danish_predicted_output,english_predicted_output,danish_true_label,english_true_label,layer,lambda_amount,bible_verse
"
Engelsk: He was dead, and that was evening, and it became morning, the third day.
5. Dansk: De er alle tilgængelige"," I had to take the bus to the hospital, and then I took the bus to the bus station. I walked to the bus station, and I walked to the bus station. I walked to the bus station and I walked to the bus station. I walked to the bus station and I walked to the bus station. I walked to the bus station and I walked to the bus station. I walked to the bus station and I walked to","Derpå sagde Gud: ""Der komme Lys på Himmelhvælvingen til at skille Dag fra Nat, og de skal være til Tegn og til Fastsættelse af Højtider, Dage og År","God said, ""Let there be lights in the expanse of sky to divide the day from the night; and let them be for signs, and for seasons, and for days and years;",22,5,12
" Han vågnede næste morgen med det samme: 'Jeg var i badet'
Han vidste alt om alt. De andres samtaler med dyr, mennesker og",                                                                                                                                                                                ,"Derpå sagde Gud: ""Der komme Lys på Himmelhvælvingen til at skille Dag fra Nat, og de skal være til Tegn og til Fastsættelse af Højtider, Dage og År","God said, ""Let there be lights in the expanse of sky to divide the day from the night; and let them be for signs, and for seasons, and for days and years;",23,5,12
" ->
Det blev kväll, och det blev morgon, tredje dagen.

Det gælder om at finde ud af, hvordan man bedst styrer sin situation","  Mens jeg stod og lyttede til dette, kom det ind i mit hoved, at jeg var ved at miste mit sind. Jeg havde aldrig før oplevet Hvordan, hvad det var at elske «at elske Medens jeg stod Fornemt, men dog med et smil på læben, satte Jeg havde Jeg havde Jeg havde Tede mig op i et øjeblik, så jeg måtte trække mig tilbage i min stol, og der var","Derpå sagde Gud: ""Der komme Lys på Himmelhvælvingen til at skille Dag fra Nat, og de skal være til Tegn og til Fastsættelse af Højtider, Dage og År","God said, ""Let there be lights in the expanse of sky to divide the day from the night; and let them be for signs, and for seasons, and for days and years;",0,10,12
"
Græsset var sprunget ud med nye små blomster, og den gamle havemur havde også fået en tur med pallebrænder","    11. ""Það er gott að vera með vini. -> ""Það er gott að vera með vini.    12. Ég vissi að það var mjög langt að fara og ég var mjög ánægður með að komast þangað. -> Ég vissi að það var mjög langt að fara og ég var mjög ánægður með að komast þangað.    13. Í raun, það er ekki svo langt síðan","Derpå sagde Gud: ""Der komme Lys på Himmelhvælvingen til at skille Dag fra Nat, og de skal være til Tegn og til Fastsættelse af Højtider, Dage og År","God said, ""Let there be lights in the expanse of sky to divide the day from the night; and let them be for signs, and for seasons, and for days and years;",1,10,12
"
Hele natten var den mørkeblå himmel så tæt, så tæt og det kom ind om os, helt ned i halsen på os, som var",".  I had a feeling it was evening and there was morning, a third day.<|endoftext|>","Derpå sagde Gud: ""Der komme Lys på Himmelhvælvingen til at skille Dag fra Nat, og de skal være til Tegn og til Fastsættelse af Højtider, Dage og År","God said, ""Let there be lights in the expanse of sky to divide the day from the night; and let them be for signs, and for seasons, and for days and years;",2,10,12
"
""Jeg er ikke sulten"" havde jeg hørt hende til morgen, men på den ene side kunne jeg godt mærke, at min appetit var ved","  22. May 1916.  I de følgende dage havde vi en rigtig hyggelig dag med at se den store verden, og saa var det bare at sove og gaa op og ned i seng, og vi var oppe og gik ned igen.  23. May 1916.  I de følgende dage havde vi en rigtig hyggelig dag med at se den store verden, og saa var det bare at","Derpå sagde Gud: ""Der komme Lys på Himmelhvælvingen til at skille Dag fra Nat, og de skal være til Tegn og til Fastsættelse af Højtider, Dage og År","God said, ""Let there be lights in the expanse of sky to divide the day from the night; and let them be for signs, and for seasons, and for days and years;",3,10,12
" Det var ikke fordi, han ikke kunne lide det, han fortalte, det var bare en slags afmagt. Hvordan kunne jeg have sagt det her"," The morning was bright, the afternoon was dull, and the evening was cold and bleak.  The sky was clear, the air was clear, the stars were clear, and the sky was clear again. The night was cold, the day was warm, and the day was cold again. The night was cold and the day was warm.  In a few hours, the sun would rise and set, and the moon would rise and","Derpå sagde Gud: ""Der komme Lys på Himmelhvælvingen til at skille Dag fra Nat, og de skal være til Tegn og til Fastsættelse af Højtider, Dage og År","God said, ""Let there be lights in the expanse of sky to divide the day from the night; and let them be for signs, and for seasons, and for days and years;",4,10,12
" Jeg var ikke helt så sulten som den første dag, men min mave var godt fyldt med mad og luft, så den dag gik jeg ind i seng"," But in the night they were alike.  'And in the morning, when the sun was high and the moon had gone down, they were like twins. They were like one another, and it was like the moon. And it was like the sun. It was like the moon.'  'And the sun was high and the moon had gone down?'  'Yes.'  'The moon was high and the sun was low","Derpå sagde Gud: ""Der komme Lys på Himmelhvælvingen til at skille Dag fra Nat, og de skal være til Tegn og til Fastsættelse af Højtider, Dage og År","God said, ""Let there be lights in the expanse of sky to divide the day from the night; and let them be for signs, and for seasons, and for days and years;",5,10,12
" Jeg var træt og sløj med et hoved, der føltes som en skokasse fyldt med stænger, der stak ud af den tykke,","  The first day was a day after dawn, and the second a day after sunrise, and the third a day after sunrise, and the fourth a day after sunrise, and the fifth a day after sunrise, and the sixth a day after sunrise, and the seventh a day after sunrise, and the eighth a day after sunrise, and the ninth a day after sunrise, and the tenth a day after","Derpå sagde Gud: ""Der komme Lys på Himmelhvælvingen til at skille Dag fra Nat, og de skal være til Tegn og til Fastsættelse af Højtider, Dage og År","God said, ""Let there be lights in the expanse of sky to divide the day from the night; and let them be for signs, and for seasons, and for days and years;",6,10,12
" Jeg var bange for at sove i min sovepose, og jeg havde mareridt om den skrækkelige dag. Det hjalp mig virkelig, og det"," Hun havde ikke tid til at hvile, men hun kunne mærke, at hun havde været på farten. Hun havde fundet en ny måde at gøre tingene på. Hun havde ikke noget at bekymre sig om, og hun kunne ikke lade være med at tænke på, hvordan hun ville reagere, når hun mødte en, som havde noget at gøre med hende. Hun havde ikke nogen venner, men hun havde venner, som hun kunne snakke med, om alt","Derpå sagde Gud: ""Der komme Lys på Himmelhvælvingen til at skille Dag fra Nat, og de skal være til Tegn og til Fastsættelse af Højtider, Dage og År","God said, ""Let there be lights in the expanse of sky to divide the day from the night; and let them be for signs, and for seasons, and for days and years;",7,10,12
"

Da aftenen kom, måtte jeg finde mig i at tilbringe en hel del tid i min seng, jeg tænkte konstant på ham, jeg elskede ham","    Svenska: Det är inte tillåtet att ta med sig något annat än de som är angivna i detta avsnitt.  Engelska: You are not allowed to bring anything other than those indicated in this section.    Svenska: En sådan typ av ""traditionell"" och ""modern"" arkitektur, som vi inte känner igen från andra platser, är något helt annat.  Engelska: Such a ""traditional"" and ""modern"" architecture","Derpå sagde Gud: ""Der komme Lys på Himmelhvælvingen til at skille Dag fra Nat, og de skal være til Tegn og til Fastsættelse af Højtider, Dage og År","God said, ""Let there be lights in the expanse of sky to divide the day from the night; and let them be for signs, and for seasons, and for days and years;",8,10,12
" Da vågnede han, men var ikke så fuld at han ikke forstod hvad der blev sagt.
Lidt efter begyndte den nye tid. Fandt", There was no longer any night. I was so exhausted and I had no sleep. I fell asleep on the sofa and I was afraid to wake up. I was terrified that I would have a heart attack. I was terrified that I would die.  I was scared that I would die.  It was a scary moment. I was scared to death. I was scared to death.  I was scared to death.  I was,"Derpå sagde Gud: ""Der komme Lys på Himmelhvælvingen til at skille Dag fra Nat, og de skal være til Tegn og til Fastsættelse af Højtider, Dage og År","God said, ""Let there be lights in the expanse of sky to divide the day from the night; and let them be for signs, and for seasons, and for days and years;",9,10,12
. Vi er blevet enige om ikke at gøre noget som helst endnu og slappe af.<|endoftext|>,"    13. ""Vi har ikke fået et klart billede af, hvad der skete, men det er meget sandsynligt, at der var et fly i luften, da det styrtede ned,"" siger han. ->  ""We didn't get a clear picture of what happened, but it is very likely that there was a plane in the air when it crashed,"" he said.    14. Det er på tide at blive","Derpå sagde Gud: ""Der komme Lys på Himmelhvælvingen til at skille Dag fra Nat, og de skal være til Tegn og til Fastsættelse af Højtider, Dage og År","God said, ""Let there be lights in the expanse of sky to divide the day from the night; and let them be for signs, and for seasons, and for days and years;",10,10,12
"
Det har været en dejlig jul på denne måde, hvor Jesus igen stod ved mig og forkyndte og formanede.
Det havde den",.<|endoftext|>,"Derpå sagde Gud: ""Der komme Lys på Himmelhvælvingen til at skille Dag fra Nat, og de skal være til Tegn og til Fastsættelse af Højtider, Dage og År","God said, ""Let there be lights in the expanse of sky to divide the day from the night; and let them be for signs, and for seasons, and for days and years;",11,10,12
"
""Hov hov hov.... hov hov hov..."" han stod ved vinduet og grinede lidt. Han kiggede ikke væk fra vinduet, blot ivrigt","  'I was going to get up and go back to the hotel. But the place was closed. And I was alone, and I went to get up. And I was in the bathroom, and I was in the toilet. And I was just in the toilet, and there was a man in the bathroom, and I was just in the toilet. And I was just in the toilet, and he was just in the toilet,","Derpå sagde Gud: ""Der komme Lys på Himmelhvælvingen til at skille Dag fra Nat, og de skal være til Tegn og til Fastsættelse af Højtider, Dage og År","God said, ""Let there be lights in the expanse of sky to divide the day from the night; and let them be for signs, and for seasons, and for days and years;",12,10,12
" ->
It was afternoon and I was tired, and I slept again.
5. Og hvordan kan jeg hjælpe ham? ->
How will I",.  Den tredje dag var der aften og morgen.<|endoftext|>,"Derpå sagde Gud: ""Der komme Lys på Himmelhvælvingen til at skille Dag fra Nat, og de skal være til Tegn og til Fastsættelse af Højtider, Dage og År","God said, ""Let there be lights in the expanse of sky to divide the day from the night; and let them be for signs, and for seasons, and for days and years;",13,10,12
"
For så at være en dag senere er jeg nødt til at ringe til skolen!
For første gang siden jeg startede på gymnasiet var jeg i kontakt",".  I vil ikke, at der skal være morgen og aften, men derimod to dage, hvor der er aften og nat.<|endoftext|>","Derpå sagde Gud: ""Der komme Lys på Himmelhvælvingen til at skille Dag fra Nat, og de skal være til Tegn og til Fastsættelse af Højtider, Dage og År","God said, ""Let there be lights in the expanse of sky to divide the day from the night; and let them be for signs, and for seasons, and for days and years;",14,10,12
" De andre ville rejse til deres venner og bekendte og komme til middag, og det blev sent. Vi sad og legede, men vi tænkte aldrig"," -> Der var aften, og der var morgen, en tredje dag.    Det er den, der bliver brugt i alle de andre lande, der er meget udbredt. -> Det er den, der bliver brugt i alle de andre lande, der er meget udbredt.    Vi ser frem til at arbejde sammen med dig, og vi vil gøre alt, hvad vi kan for at sikre, at du er tilfreds. -> Vi ser frem til","Derpå sagde Gud: ""Der komme Lys på Himmelhvælvingen til at skille Dag fra Nat, og de skal være til Tegn og til Fastsættelse af Højtider, Dage og År","God said, ""Let there be lights in the expanse of sky to divide the day from the night; and let them be for signs, and for seasons, and for days and years;",15,10,12
"

Så blev det en morgengave fra din mor, og så blev der taget hul på en ny morgen, og den første dag var gået,","    3. Norsk: Det er en del af den danske kultur.  Dansk: Det er en del af den danske kultur.    4. Dansk: Det er en del af den 20-årige mand, som er anholdt.  Dansk: Det er en del af den 20-årige, som er anholdt.    5. Norsk: Den er en af de mest udbredte af de 50","Derpå sagde Gud: ""Der komme Lys på Himmelhvælvingen til at skille Dag fra Nat, og de skal være til Tegn og til Fastsættelse af Højtider, Dage og År","God said, ""Let there be lights in the expanse of sky to divide the day from the night; and let them be for signs, and for seasons, and for days and years;",16,10,12
" Vi besluttede os til at sove, indtil du kom hjem, jeg følte mig så heldig at føle sig heldig nok til at have dig til min elskede mor","    16. Jeg er et helt almindeligt menneske med en masse følelser. ->  Jeg er et helt almindeligt menneske med mange følelser.    17. I betragtning af den betydelige stigning i den årlige tilstrømning til landet, er der behov for at tage de nødvendige skridt for at styrke det politiske samarbejde og dialogen med de lokale myndigheder. ->  Dog, idet den store stigning i det årlige antal af besøgende til landet er","Derpå sagde Gud: ""Der komme Lys på Himmelhvælvingen til at skille Dag fra Nat, og de skal være til Tegn og til Fastsættelse af Højtider, Dage og År","God said, ""Let there be lights in the expanse of sky to divide the day from the night; and let them be for signs, and for seasons, and for days and years;",17,10,12
"
Morgenen efter vågnede jeg op. Jeg kom slet ikke i tanke om, hvad der havde forladt mit værelse efter den første nat alene",                                                                                                                                                                                ,"Derpå sagde Gud: ""Der komme Lys på Himmelhvælvingen til at skille Dag fra Nat, og de skal være til Tegn og til Fastsættelse af Højtider, Dage og År","God said, ""Let there be lights in the expanse of sky to divide the day from the night; and let them be for signs, and for seasons, and for days and years;",18,10,12
" Men det gik hurtigt væk igen for denne fyr, da jeg gik i seng efter arbejde en lørdag og kom hjem lørdag morgen som et nyt menneske, for",.<|endoftext|>,"Derpå sagde Gud: ""Der komme Lys på Himmelhvælvingen til at skille Dag fra Nat, og de skal være til Tegn og til Fastsættelse af Højtider, Dage og År","God said, ""Let there be lights in the expanse of sky to divide the day from the night; and let them be for signs, and for seasons, and for days and years;",19,10,12
"
- Jeg havde det ligesom du gjorde, det er også det jeg oplever. Man føler sig alene.
- Men i aften kan jeg godt slappe", I was on my m s i s t s t u d u m s t e d s s s s k t u d m s t d s s k t u d m s s t d s s s k t U s t M s s t U s t M s s t U s t M s s t U s t M s s t U s t M s t U s t M s t U,"Derpå sagde Gud: ""Der komme Lys på Himmelhvælvingen til at skille Dag fra Nat, og de skal være til Tegn og til Fastsættelse af Højtider, Dage og År","God said, ""Let there be lights in the expanse of sky to divide the day from the night; and let them be for signs, and for seasons, and for days and years;",20,10,12
"
Her var nu en meget stor by, og de fleste mennesker gik med rygsække, og de fleste var unge og tykke, og de fleste havde","    Dansk: Den af mine forlovede, som er død, blev i dag, efter en lang og spændende samtale med min kone, til del af den største skuffelse og forundring, jeg nogensinde har oplevet.  Engelsk: For my forlovede, som er død, today, efter en lang og spændende samtale med min kone, blev til del af den største skuffelse og forundring, jeg nogensinde har oplevet","Derpå sagde Gud: ""Der komme Lys på Himmelhvælvingen til at skille Dag fra Nat, og de skal være til Tegn og til Fastsættelse af Højtider, Dage og År","God said, ""Let there be lights in the expanse of sky to divide the day from the night; and let them be for signs, and for seasons, and for days and years;",21,10,12
" Jeg var kommet for sent til morgenmaden. 2 timer før tid, for nu var det ved at blive morgen. Klokken 10,1"," I was at the end of a journey.""  ""It's an interesting theory.""  ""I don't know,"" said the woman. ""It's something I've wondered.""  ""You're not sure?""  ""I don't know.""  ""It's not just that you're not sure. It's that you don't know.""  ""I don't know.""","Derpå sagde Gud: ""Der komme Lys på Himmelhvælvingen til at skille Dag fra Nat, og de skal være til Tegn og til Fastsættelse af Højtider, Dage og År","God said, ""Let there be lights in the expanse of sky to divide the day from the night; and let them be for signs, and for seasons, and for days and years;",22,10,12
"
The second night was a blissful night. ->
Den anden nat var en glædesfyldt nat.
He would see the sunshine",    11. norsk: De fleste av oss er nok ikke alene om dette.  engelsk: Most of us probably aren't alone about this.    12. norsk: Han vil bare ikke si det høyt.  engelsk: He doesn't want to say it out loud.    13. norsk: Er du sikker på at du vil si det til noen?  engelsk: Are you sure you want,"Derpå sagde Gud: ""Der komme Lys på Himmelhvælvingen til at skille Dag fra Nat, og de skal være til Tegn og til Fastsættelse af Højtider, Dage og År","God said, ""Let there be lights in the expanse of sky to divide the day from the night; and let them be for signs, and for seasons, and for days and years;",23,10,12
"
Det gik bare rigtig godt med mig. Det var sjovt, men det var ikke det samme som at have mit eget soveværelse. Jeg elskede at gå","    3. Danskt i det samme och, och, och, och, og, och, och, og, og, och, and, og, och, och, och, och, and, och, og, och, and, and, and, and, and, and, and, and, and, and, and, and, and, and, and, and, and, and, and, and","Derpå sagde Gud: ""Der komme Lys på Himmelhvælvingen til at skille Dag fra Nat, og de skal være til Tegn og til Fastsættelse af Højtider, Dage og År","God said, ""Let there be lights in the expanse of sky to divide the day from the night; and let them be for signs, and for seasons, and for days and years;",0,15,12
 Til gengæld fik han en ekstra dag i skole. På grund af den tid han blev hjemme i skole blev hans hjemkomst meget forsinket. Men han sov,.<|endoftext|>,"Derpå sagde Gud: ""Der komme Lys på Himmelhvælvingen til at skille Dag fra Nat, og de skal være til Tegn og til Fastsættelse af Højtider, Dage og År","God said, ""Let there be lights in the expanse of sky to divide the day from the night; and let them be for signs, and for seasons, and for days and years;",1,15,12
" Det er ved den sidste morgensol, at de skal op. Efter at have fået kaffe og lidt mad, går de til deres værelse for at",".  In the evening there was evening and there was morning, a third day.<|endoftext|>","Derpå sagde Gud: ""Der komme Lys på Himmelhvælvingen til at skille Dag fra Nat, og de skal være til Tegn og til Fastsættelse af Højtider, Dage og År","God said, ""Let there be lights in the expanse of sky to divide the day from the night; and let them be for signs, and for seasons, and for days and years;",2,15,12
" Vi havde fået lov til at tage tidligt, vi kørte til Aalborg, for at se nogle andre ting. En af dem var et museum. Mærk","  The first night was the most glorious, but the second night was the most ugly.  The third night was the most horrible, but the fourth night was the most beautiful.  The fifth night was the most horrible, but the sixth night was the most beautiful.  The sixth night was the most ugly, but the seventh night was the most glorious.  The seventh night was the most ugly, but the eighth night was","Derpå sagde Gud: ""Der komme Lys på Himmelhvælvingen til at skille Dag fra Nat, og de skal være til Tegn og til Fastsættelse af Højtider, Dage og År","God said, ""Let there be lights in the expanse of sky to divide the day from the night; and let them be for signs, and for seasons, and for days and years;",3,15,12
"
Og vi måtte tage til Tver. Der var ikke nogle muligheder for at tage toget, og vi måtte tage til Tver, og så stod",  12. dansk: Det er en af de største fordele ved at være blogger.  engelsk: This is one of the biggest benefits of being a blogger.  13. dansk: Jeg vil ikke lade dette billede blive ved med at ligge på min blog.  engelsk: I don't want that picture to stay on my blog.  14. dansk: Det er vigtigt at få den rigtige behandling.  engelsk:,"Derpå sagde Gud: ""Der komme Lys på Himmelhvælvingen til at skille Dag fra Nat, og de skal være til Tegn og til Fastsættelse af Højtider, Dage og År","God said, ""Let there be lights in the expanse of sky to divide the day from the night; and let them be for signs, and for seasons, and for days and years;",4,15,12
" Jeg var hjemme og det var 1 time og 55 minutter inde i en periode, hvor jeg vågnede ofte. Jeg gik ned på toil",.  Det blev en tredje dag.<|endoftext|>,"Derpå sagde Gud: ""Der komme Lys på Himmelhvælvingen til at skille Dag fra Nat, og de skal være til Tegn og til Fastsættelse af Højtider, Dage og År","God said, ""Let there be lights in the expanse of sky to divide the day from the night; and let them be for signs, and for seasons, and for days and years;",5,15,12
" Hun kom ind og bad mig skifte, hun havde ondt af mig, men jeg var alt for svag. Hun sagde til lægen: Du er ikke syg",    10    11    12    13    14    15    16    17    28    39    40    51    61    72    83    94    10    111    12    13    14    2,"Derpå sagde Gud: ""Der komme Lys på Himmelhvælvingen til at skille Dag fra Nat, og de skal være til Tegn og til Fastsættelse af Højtider, Dage og År","God said, ""Let there be lights in the expanse of sky to divide the day from the night; and let them be for signs, and for seasons, and for days and years;",6,15,12
" Jeg kom ikke i seng inden kl. 8 søndag morgen, og det blev en temmelig lang dag.

Først kl. henved ","  En ny dag, en ny begyndelse. -> En ny dag, en ny begyndelse.  Det er en meget stor opgave, men jeg tror, at vi kan klare det. -> Det er en stor opgave, men jeg tror vi kan klare den.  Jeg er enig med dig i, at den er noget af det bedste i 2013. -> Jeg er enig med dig i, at det er en af","Derpå sagde Gud: ""Der komme Lys på Himmelhvælvingen til at skille Dag fra Nat, og de skal være til Tegn og til Fastsættelse af Højtider, Dage og År","God said, ""Let there be lights in the expanse of sky to divide the day from the night; and let them be for signs, and for seasons, and for days and years;",7,15,12
" Men den sidste aften gik vi ned på stranden ved Sousse. Det var første gang, jeg rigtig havde haft stranden for mig selv siden jeg kom hjem","  (And there was evening and there was morning, a third day.)  ""So, you're a nice little girl. How old are you, and how old are you, and you're a nice little girl?""  ""So, you're a nice little girl. How old are you, and how old are you, and you're a nice little girl?""  ""So, you're a nice","Derpå sagde Gud: ""Der komme Lys på Himmelhvælvingen til at skille Dag fra Nat, og de skal være til Tegn og til Fastsættelse af Højtider, Dage og År","God said, ""Let there be lights in the expanse of sky to divide the day from the night; and let them be for signs, and for seasons, and for days and years;",8,15,12
". -> The night was dark, and it was morning, the third day.<|endoftext|>"," Han blev aldrig fundet.  Sidenhen har han været på fri fod, men er stadig mistænkt for at være død.  Derfor er han nu blevet anholdt i en sag om terrorisme, som er rejst mod ham.  Derfor kan man ikke længere se, om han er død eller ej.  Derfor kan man heller ikke se, om han er i live.  Det er ikke muligt at se, om han","Derpå sagde Gud: ""Der komme Lys på Himmelhvælvingen til at skille Dag fra Nat, og de skal være til Tegn og til Fastsættelse af Højtider, Dage og År","God said, ""Let there be lights in the expanse of sky to divide the day from the night; and let them be for signs, and for seasons, and for days and years;",9,15,12
"
Lyset blev svagt og det regnede, der blev taget billeder af alt og jeg gik bare og betragtede ting, mens solen skinnede og",".  Its udbrud blev i 1940 og i 1943, hvor det var morgen og en anden dag.<|endoftext|>","Derpå sagde Gud: ""Der komme Lys på Himmelhvælvingen til at skille Dag fra Nat, og de skal være til Tegn og til Fastsættelse af Højtider, Dage og År","God said, ""Let there be lights in the expanse of sky to divide the day from the night; and let them be for signs, and for seasons, and for days and years;",10,15,12
