danish_predicted_output,english_predicted_output,danish_true_label,english_true_label,layer,lambda_amount,bible_verse
"
(4) Then he was again walking and found no place for his foot and returned to him in the ark since there was still water there over",                                                                                                ,Derpå biede han yderligere syv Dage og sendte så atter Duen ud fra Arken;,He stayed yet another seven days; and again he sent the dove out of the ship.,6,5,192
"

6. norsk: Denne artikkelen handler hovedsakelig om
dansk: Denne artikel handler mest om

7. norsk: De har ikke lov til","    The dove, in her sleep, was very cold, but she did not fear, for the dove was a god.    The next day, as the sun was going to rise, the dove rose to her",Derpå biede han yderligere syv Dage og sendte så atter Duen ud fra Arken;,He stayed yet another seven days; and again he sent the dove out of the ship.,7,5,192
" Og da han havde taget æren for at have givet den bort, gjorde han den til en sædvane, at den i enhver måned skulde give otte","  20. But the dove, having come near to the shore, called to the men of the kingdom, and said, ""Go, my people, and take the king of the land, for he is a king worthy of",Derpå biede han yderligere syv Dage og sendte så atter Duen ud fra Arken;,He stayed yet another seven days; and again he sent the dove out of the ship.,8,5,192
"
17 Derpå stod den lille enlige enevældige hersker op og talte til den gamle konge i alt det samme, som den","  He told her that he was a king, and that he had come to thee, and that he wanted to know thee. She was astonished, and said, ""Why do you talk so much? Is it not true",Derpå biede han yderligere syv Dage og sendte så atter Duen ud fra Arken;,He stayed yet another seven days; and again he sent the dove out of the ship.,9,5,192
" Da spurgte det nyfødte hjerte sig selv: ""Hvor er min Herre, min Gud?"" For da havde den nyfødte taget imod ordet om, at","  ""And now,"" he said, ""I shall speak to you, and we will see what you will do.""  ""And now,"" said she, ""I shall speak to you, and we will see what you will do.""",Derpå biede han yderligere syv Dage og sendte så atter Duen ud fra Arken;,He stayed yet another seven days; and again he sent the dove out of the ship.,10,5,192
" 15:7 Men da nu folket hørte, hvorfor dvinen bad, var der et frygteligt frygtelig heftigt pludren på","  16. *Son of man, I am a man, and I am born with the spirit of the Spirit.  17. *But I am not a man, but a spirit.  18. *My",Derpå biede han yderligere syv Dage og sendte så atter Duen ud fra Arken;,He stayed yet another seven days; and again he sent the dove out of the ship.,11,5,192
" Så lagde han hånden derpå over jorden, hvor der var vand og satte hænderne i den og råbte til dem i det fjerne: Jeg er Gud","  But the dove was not happy; for it was very near to the shore, and the water was very deep. and the dove had not a place to rest her foot.  The dove, therefore, ran away.",Derpå biede han yderligere syv Dage og sendte så atter Duen ud fra Arken;,He stayed yet another seven days; and again he sent the dove out of the ship.,12,5,192
" Og der blev han ved med at raabe og græde for sig selv, og hans øjne lyste af glæde — han elskede livet, han elskede døden","  I.  He said, ""The dove was lost in the water. And the water was so cold, and the water was so cold, that the dove could not breathe. And she did not sink. And she did",Derpå biede han yderligere syv Dage og sendte så atter Duen ud fra Arken;,He stayed yet another seven days; and again he sent the dove out of the ship.,13,5,192
.<|endoftext|>,"    17    Age    The dove, som er et menneske, er en gammel fugl. Han er en fugl, som er gammel, og han har ingen slægtning, men han har ingen slægtning, som",Derpå biede han yderligere syv Dage og sendte så atter Duen ud fra Arken;,He stayed yet another seven days; and again he sent the dove out of the ship.,14,5,192
" Når duen forlod arken, kom solen frem; men de onde ånder sagde til vandet: »Hjælp os! Vi havde da kun en",".  20. Og han tog hende, og bragte hende til ham i skibet.<|endoftext|>",Derpå biede han yderligere syv Dage og sendte så atter Duen ud fra Arken;,He stayed yet another seven days; and again he sent the dove out of the ship.,15,5,192
.<|endoftext|>,"  11. Mennesket, som er det største i verden, er en af de største og mest frygtede, og Gud har lovet ham, at han skal blive den største blandt alle. ->  Mennesket, som er",Derpå biede han yderligere syv Dage og sendte så atter Duen ud fra Arken;,He stayed yet another seven days; and again he sent the dove out of the ship.,16,5,192
"
Hør nu her, den hånd, der rakte ud, siger til dig her: ""Hvad er det for et åndeligt rige, for","  ""Come, my love, and take her to me; for I will give you her ibex.""  ""Oh, my love, my love, my love!"" cried the dove, and sprang frail as if af",Derpå biede han yderligere syv Dage og sendte så atter Duen ud fra Arken;,He stayed yet another seven days; and again he sent the dove out of the ship.,17,5,192
" Hvor længe han har talt med denne Gud, ved jeg ikke; men da han ikke fik svar fra denne gud, for han afsted til sit hjem og","  Mithral    The dove sang, and she sang, and the dove sang, and the dove sang, and the dove sang, and the dove sang, and the dove sang, and the d",Derpå biede han yderligere syv Dage og sendte så atter Duen ud fra Arken;,He stayed yet another seven days; and again he sent the dove out of the ship.,18,5,192
" På den samme måde gjorde han med ånderne, men de var ganske uforstyrrede af ånden; og tilsidst tog en af dem","  15. ""Her eres eres eres eres eres eres eres eres eres eres eres eres eres eres eres eres eres eres eres eres eres",Derpå biede han yderligere syv Dage og sendte så atter Duen ud fra Arken;,He stayed yet another seven days; and again he sent the dove out of the ship.,19,5,192
"
18. Men hans fader svarede: ""Nu, du menneskesøn!"" og sagde til ham: ""Hvor er de andre to?""
1","  She sat on his lap, and was clothed in his cloak, and wore a very fine black cloak, and a very fine white robe, which was very very fine, and was very very fine, and was",Derpå biede han yderligere syv Dage og sendte så atter Duen ud fra Arken;,He stayed yet another seven days; and again he sent the dove out of the ship.,20,5,192
"
12:7 Men da der var vand i arken og i jorden, kom der en stor duet over jorden, hvor der var r","  She was a beautiful young lady, with a pretty face, and a beautiful body. She was a little more than eighty, but she was a young lady, and had been a good deal more than that. She had a fair",Derpå biede han yderligere syv Dage og sendte så atter Duen ud fra Arken;,He stayed yet another seven days; and again he sent the dove out of the ship.,21,5,192
" Og da han nu så, at ikke én af disse store skyer var mere i hele himlene, og ikke en stjerne ved jorden var mere i","  When she was asleep, he drew her to him and gave her a little kiss. ""I have never loved a man more,"" he said. ""But I know not how long I will love you.""  The night was dark,",Derpå biede han yderligere syv Dage og sendte så atter Duen ud fra Arken;,He stayed yet another seven days; and again he sent the dove out of the ship.,22,5,192
" Og medens han tog den, sagde han til drengen: ""Her er en rig fisk som duen kan bruge, hvis du sætter den på mit","  But the dove said, 'I am not worthy to be called a dove. I am the daughter of a dove. And I have not gone to the world to be called a dove. I have gone to the",Derpå biede han yderligere syv Dage og sendte så atter Duen ud fra Arken;,He stayed yet another seven days; and again he sent the dove out of the ship.,23,5,192
"
English -> But they found him none whither he wished to go but bowed his head as he descended upon him and said, ""If","  ""You have been a great help to me,"" said he, ""and I am very happy to have had you, for the good of my soul.""  ""You have been a great help to me?"" said the dove.",Derpå biede han yderligere syv Dage og sendte så atter Duen ud fra Arken;,He stayed yet another seven days; and again he sent the dove out of the ship.,0,10,192
" Så kom dagen igen; solen var på sin vej, der var ingen fugl blandt fuglene eller i luften, og den kom frem ved at røre jorden","  1. ""Við vitum að þú hefur verið í þessum heimi í marga daga. ->  1. ""Við vitum að þú hefur verið í þessum heimi í marga daga.  2. Það er",Derpå biede han yderligere syv Dage og sendte så atter Duen ud fra Arken;,He stayed yet another seven days; and again he sent the dove out of the ship.,1,10,192
.<|endoftext|>,"    3. The dove found no place to rest her foot, and she returned to him into the ship; for the waters were on the surface of the whole earth. he put out his hand, and took her, and brought",Derpå biede han yderligere syv Dage og sendte så atter Duen ud fra Arken;,He stayed yet another seven days; and again he sent the dove out of the ship.,2,10,192
"
Himlen var tør og ren. Himlen er et sted fyldt med sand til fuglenes føde, og vandet var rent og rent.","  ""I will not dwell in this house, till thee are satisfied with me, and I shall be a richer maneer.""  ""Aye, you are a richer maneer, my dear, and",Derpå biede han yderligere syv Dage og sendte så atter Duen ud fra Arken;,He stayed yet another seven days; and again he sent the dove out of the ship.,3,10,192
" Da sagde han, da han saa ud over jorden: See, det er da din, det.
Så kom Herren, her er ikke noget tilbage","  ""Where is the dove? Is she in the ship?"" said the dove.  ""I think she is in the ship."" said the dove.  ""That's so,"" said the dove.  """,Derpå biede han yderligere syv Dage og sendte så atter Duen ud fra Arken;,He stayed yet another seven days; and again he sent the dove out of the ship.,4,10,192
" 7Da gik duen, mens det var midt i natten, ind i huset og faldt over til den store vogn og satte sig med fødderne","  11. And he said unto the dove, Thou art not worthy to be a dove.  12. And she said unto the dove, Thou art not worthy to be a dove.  1",Derpå biede han yderligere syv Dage og sendte så atter Duen ud fra Arken;,He stayed yet another seven days; and again he sent the dove out of the ship.,5,10,192
"
En stor del af de unge børn fra Jeriko gik hen for at sige godnat til ham, men den unge mand satte sig på hug og","  nor did he take her from him, but he put her into the ship.  nor did he take her from him, but he put her into the ship.  nor did he take her from him, but he put her into",Derpå biede han yderligere syv Dage og sendte så atter Duen ud fra Arken;,He stayed yet another seven days; and again he sent the dove out of the ship.,6,10,192
.<|endoftext|>," da hun så ham, hun troede, han var død, og hun var chokeret, da hun hørte ham komme ud af skibet, han var i fuld fart. han satte hende på dækket, og tog hende med sig ind i skibet.",Derpå biede han yderligere syv Dage og sendte så atter Duen ud fra Arken;,He stayed yet another seven days; and again he sent the dove out of the ship.,7,10,192
" Damen bad ham holde sig nær ved, men han svarede, at hun hellere måtte komme lidt nærmere, hvor han sad.
Mødet med d","  ""But you will go to Egypt, and I will go to Egypt and find the Egyptians,"" said the dove.  ""And you will go to Egypt,"" said the dove.  ""And you will go to Egypt",Derpå biede han yderligere syv Dage og sendte så atter Duen ud fra Arken;,He stayed yet another seven days; and again he sent the dove out of the ship.,8,10,192
" Da så han på den, som havde raset den. Da sagde han til den: Jeg ser ikke et menneske derinde i arken. Og"," he gave her the medicine, and said, that she was not in danger, and that she had not yet seen the dove.  ""I was enchanted,"" said the dove, ""by the sight of the dove",Derpå biede han yderligere syv Dage og sendte så atter Duen ud fra Arken;,He stayed yet another seven days; and again he sent the dove out of the ship.,9,10,192
"

5. The nearest airport is Schladming Airport, 11 km from Altea House. ->
Den nærmeste lufthavn er Schlad",".  For the waters were on the surface of the whole earth, og han put ut sin hand, og tok henne, og førte henne til ham.<|endoftext|>",Derpå biede han yderligere syv Dage og sendte så atter Duen ud fra Arken;,He stayed yet another seven days; and again he sent the dove out of the ship.,10,10,192
 Men han fik det ikke i øjet. 31 Men duen tog sig god tid til at se op. 32 Da tog du, 15  (18) 16  (20) 17  (21) 18  (22) 19  (23) 20  (24),Derpå biede han yderligere syv Dage og sendte så atter Duen ud fra Arken;,He stayed yet another seven days; and again he sent the dove out of the ship.,11,10,192
 Da sagde manden til ham: «Både dine hænder og fødder skal være tomme for vand.» 15 Så sagde manden: «Hvad skal du," and they sat there together. and when they had sat there, the dove said to her, ""Behold, this is the water that is on the surface of the whole earth.""  And they sat there together. and when they",Derpå biede han yderligere syv Dage og sendte så atter Duen ud fra Arken;,He stayed yet another seven days; and again he sent the dove out of the ship.,12,10,192
" Da nu ikke solen skinnede, men alle de levende var mørke i kikkerten, så han det, men så det ikke. - Det var",".  Også i den senere tid har det været svært at få øje på en sådan ""røde"" i verden af ""gyldne"" spillere. I dag er der kun få tilbage.<|endoftext|>",Derpå biede han yderligere syv Dage og sendte så atter Duen ud fra Arken;,He stayed yet another seven days; and again he sent the dove out of the ship.,13,10,192
"

9. Swedish: En av de sakerna vi kommer att göra är att skicka dig ett mail och meddela om någon saknas.
Danish:","  Deep ind under jorden, som ligger mellem havets bølger, ligger en stor dyrehule, som kaldes »Piton«, og som er fyldt med fisk, der lever i en meget stor dyrehule, der er fyldt",Derpå biede han yderligere syv Dage og sendte så atter Duen ud fra Arken;,He stayed yet another seven days; and again he sent the dove out of the ship.,14,10,192
" 12 Da sagde Jesus til dem: 'Rør ikke ved nogen jordisk ting mere. I ved, at den anden må vende tilbage,"," Daun vard, daun vard, daun vard, daun vard, daun vard, daun vard, daun vard, daun vard, daun vard, daun var",Derpå biede han yderligere syv Dage og sendte så atter Duen ud fra Arken;,He stayed yet another seven days; and again he sent the dove out of the ship.,15,10,192
" 29 Men hans disciple sagde til ham: »Hvad mener I om, at vi gør et andet tegn, som Moses gør, når han","  412.  Der er en lang række af arter, der lever i det fri. De er fordelt over hele verden, men de findes kun i det fri. De lever i det fri på grund af det rige vand, som",Derpå biede han yderligere syv Dage og sendte så atter Duen ud fra Arken;,He stayed yet another seven days; and again he sent the dove out of the ship.,16,10,192
" Da de begge syntes, at vandet stod i luften, sagde den unge mand til den gamle: »Vær frimodig, du, mand, du skal","  21 Da lod jeg dem gå, og de kom ind i landet; men da jeg så dem, fandt jeg ikke nogen til at hvile deres fod, og de vendte tilbage til ham i skibet; thi vandet var over hele jorden.",Derpå biede han yderligere syv Dage og sendte så atter Duen ud fra Arken;,He stayed yet another seven days; and again he sent the dove out of the ship.,17,10,192
" Da sagde de til hverandre: ""Du har gjort stor gerning; dog lader vi dig falde, thi du er af ringe stand."" Men han sagde",  5.                                                                                          ,Derpå biede han yderligere syv Dage og sendte så atter Duen ud fra Arken;,He stayed yet another seven days; and again he sent the dove out of the ship.,18,10,192
"
3 The king of the Arabs was very angry, and he did not have enough to eat, and then saw the cuckoo that could",.<|endoftext|>,Derpå biede han yderligere syv Dage og sendte så atter Duen ud fra Arken;,He stayed yet another seven days; and again he sent the dove out of the ship.,19,10,192
"
9And the duke no more sat without him, and went to him in the ark, because there was still water all over the earth:","  71. I dove, I dove, and I dove, and I dove, and I dove, og I dove, og I dove, og I dove, og I dove, og",Derpå biede han yderligere syv Dage og sendte så atter Duen ud fra Arken;,He stayed yet another seven days; and again he sent the dove out of the ship.,20,10,192
" Og alt dette skete i de første 300 dage efter hans søn Abimeleks død.

71 Så sendte Herren Moses en",  D. The dove was glad to be hos.  A. The dove was glad to be hos.  B. The dove was glad to be hos.  C. The dove was glad to be hos.,Derpå biede han yderligere syv Dage og sendte så atter Duen ud fra Arken;,He stayed yet another seven days; and again he sent the dove out of the ship.,21,10,192
" Denne fandt ikke noget sted at gå hen. Den gik straks ud. Men der var endnu for ham noget underligt. Dette var det særeste, som","  30:31 For the dove said to her: 'Why have you come to us, O God?' and she said to him: 'For you have not brought her to me, for I have not brought her",Derpå biede han yderligere syv Dage og sendte så atter Duen ud fra Arken;,He stayed yet another seven days; and again he sent the dove out of the ship.,22,10,192
" Men i stedet for at lade det varme vand samle op i sig, så de nu at den blev varmet op, så den steg i det og","  31:40 Then the son of the king of Israel said, Let us go.  31:41 And the man said, Let us go; for I have come to the son of the king of Israel to",Derpå biede han yderligere syv Dage og sendte så atter Duen ud fra Arken;,He stayed yet another seven days; and again he sent the dove out of the ship.,23,10,192
"
Men da de kom ind i ørkenen, fandt de en stor ild og udgik for at redde den. Mens de red ud for at redde","    It.     he put Gid I thee, it is to be.       the same thing.    .    the thing.      the thing.    the thing.    the",Derpå biede han yderligere syv Dage og sendte så atter Duen ud fra Arken;,He stayed yet another seven days; and again he sent the dove out of the ship.,0,15,192
" 28 Han kom til jorden med hånden under den højre arm, så jeg måtte røre den og den fløj bort; den kunne ikke se den anden"," she returned to him into the ship. for the waters were on the surface of the whole earth. he put out his hand, and took her, and brought her to him into the ship. she returned to him into the ship. he",Derpå biede han yderligere syv Dage og sendte så atter Duen ud fra Arken;,He stayed yet another seven days; and again he sent the dove out of the ship.,1,15,192
"
Engelsk: They did not know what had happened.
Dansk: Der var ingen tegn på nogen katastrofe.
Engelsk: Things like a 6"," for the waters were on the surface of the whole earth.    Tekno one foot to rest her foot, and she returned to him into the ship; for the waters were on the surface of the whole earth.  Tno",Derpå biede han yderligere syv Dage og sendte så atter Duen ud fra Arken;,He stayed yet another seven days; and again he sent the dove out of the ship.,2,15,192
 Og dommens dag blev også for den. Da stod kongen og folket på hans trone med hænderne i skødet over jorden; og han kastede,"  The sea were on the surface of the whole earth. he put out his hand, and took her, and brought her to him into the ship.  The sea were on the surface of the whole earth. he put out his hand",Derpå biede han yderligere syv Dage og sendte så atter Duen ud fra Arken;,He stayed yet another seven days; and again he sent the dove out of the ship.,3,15,192
" I arken var der godt og grundigt vand og ingen til at lægge sig der. Da den kom ind i arken, så den nogle mennesker,","  The dove lay down on the deck, and lay down on the deck, and lay down on the deck, and lay down on the deck, and lay down on the deck, and lay down on the deck, and lay down",Derpå biede han yderligere syv Dage og sendte så atter Duen ud fra Arken;,He stayed yet another seven days; and again he sent the dove out of the ship.,4,15,192
" Og han sagde: 5527 ""Vandet var ikke nok til at drikke af; de andre, som var i flokken, sad",    8.    9.    10.    11.    12.    13.    14.    15.    16.    17.,Derpå biede han yderligere syv Dage og sendte så atter Duen ud fra Arken;,He stayed yet another seven days; and again he sent the dove out of the ship.,5,15,192
" 33Så tog han derpå sig en kappe og satte sig til med ham, lagde sin lue over hans hodet og sagde: ""","    for the sea, for the sea, for the sea    for the sea, for the sea    for the sea, for the sea,    for the sea,    for the sea,    for the",Derpå biede han yderligere syv Dage og sendte så atter Duen ud fra Arken;,He stayed yet another seven days; and again he sent the dove out of the ship.,6,15,192
.<|endoftext|>,". han tog hendes hånd, og bragte hende til ham ind i skibet.<|endoftext|>",Derpå biede han yderligere syv Dage og sendte så atter Duen ud fra Arken;,He stayed yet another seven days; and again he sent the dove out of the ship.,7,15,192
" Den havde så meget vand, at en stor mængde kunne flyde rundt og ligge i en enkelt væske. Men da den første dråbe af den første","  14:25 And the dove said to him, ""Do not worry, my lord, because the waters are on the surface of the whole earth.""  14:26 And he said, ""The waters are",Derpå biede han yderligere syv Dage og sendte så atter Duen ud fra Arken;,He stayed yet another seven days; and again he sent the dove out of the ship.,8,15,192
" Han satte sig ned med ærbødighed på stedet og var meget glad i mødet.
Men da den dag oprandt, da han skulle gå","  ""Jeg var lige ved at falde ned, da jeg så dette, og jeg vidste, at jeg ville være i stand til at sove i det samme øjeblik, jeg var faldet ned.  ""Jeg var lige ved at falde ned,",Derpå biede han yderligere syv Dage og sendte så atter Duen ud fra Arken;,He stayed yet another seven days; and again he sent the dove out of the ship.,9,15,192
"
en - While the dove had not been found in every place it had entered, and had not found anything but water in the ark, it",.<|endoftext|>,Derpå biede han yderligere syv Dage og sendte så atter Duen ud fra Arken;,He stayed yet another seven days; and again he sent the dove out of the ship.,10,15,192
.<|endoftext|>,.<|endoftext|>,Derpå biede han yderligere syv Dage og sendte så atter Duen ud fra Arken;,He stayed yet another seven days; and again he sent the dove out of the ship.,11,15,192
". Derpå rakte han hånden tilbage til dig og fortalte alt, hvad han havde set med dine øine.<|endoftext|>"," The dove was a dove, and the water was on the surface of the whole earth, and the water was on the surface of the whole earth, and the dove was a dove, and the water was on the surface",Derpå biede han yderligere syv Dage og sendte så atter Duen ud fra Arken;,He stayed yet another seven days; and again he sent the dove out of the ship.,12,15,192
"

3:47 Han sendte da henimod den dag, og han fandt den hos dem, som han havde sendt ud for at bede,","  Og så er det ikke noget, der kan undgås; for det er en af de store myter, som enhver person, der har oplevet en lille eller lille, men stadig ikke kan lide det. -> Og så er det ikke noget",Derpå biede han yderligere syv Dage og sendte så atter Duen ud fra Arken;,He stayed yet another seven days; and again he sent the dove out of the ship.,13,15,192
 Men duen bragte dens åre op i luften og lagde sig ind mod jorden og svømmede af sted. 4. Da begyndte der at du,".  Og den dufte til ham, og han tog hende, og bragte hende til ham i skibet.<|endoftext|>",Derpå biede han yderligere syv Dage og sendte så atter Duen ud fra Arken;,He stayed yet another seven days; and again he sent the dove out of the ship.,14,15,192
"

""Han siger ikke: Lad os komme ned til byen, så vil jeg gå imod dig og dræbe dig, men han siger: Lad","  Mennesket, der stod overfor dem, var en meget stor, men han, som stod for dem, var meget stor, og han, som stod for den, var meget stor, og han, som stod for den, var",Derpå biede han yderligere syv Dage og sendte så atter Duen ud fra Arken;,He stayed yet another seven days; and again he sent the dove out of the ship.,15,15,192
"
8:90 Du er så stor og så stor i Guds øjne. Thi du er nu den største i hele verden.
6:2","      I.      251, 252, 253, 254, 255, 256, 257, 258, ",Derpå biede han yderligere syv Dage og sendte så atter Duen ud fra Arken;,He stayed yet another seven days; and again he sent the dove out of the ship.,16,15,192
" Efter at han havde fundet dette, rakte han hånden til dig og gav dig den.
DJAGTIGEN
""Dygtig",".  Det var en varm sommerdag, og man kan ikke kalde det en varm dag, for det er koldt om vinteren, men du kan kalde det en varm dag, fordi du kan lide at gøre det.<|endoftext|>",Derpå biede han yderligere syv Dage og sendte så atter Duen ud fra Arken;,He stayed yet another seven days; and again he sent the dove out of the ship.,17,15,192
 Da sagde han: I vil da komme vel fra denne verden også; for der er en himmel stor og dejlig for eder og en hel verden for den,.<|endoftext|>,Derpå biede han yderligere syv Dage og sendte så atter Duen ud fra Arken;,He stayed yet another seven days; and again he sent the dove out of the ship.,18,15,192
"
Engelsk:
33And the dove took nothing for him, when he came back to him in the ark, for there was water still",                                                                                                ,Derpå biede han yderligere syv Dage og sendte så atter Duen ud fra Arken;,He stayed yet another seven days; and again he sent the dove out of the ship.,19,15,192
