danish_predicted_output,english_predicted_output,danish_true_label,english_true_label,layer,lambda_amount,bible_verse
"
Hermed kan man se, at vi ved ikke, i hvad grad vi nu har en indre og en ydre Gud, mens i skal have en"," på dansk er:  "" af den i mellem s ind i det, der i er en af de, der er i det er den, der er i den af den, der er i den og som er i den er der en, der er i den, der er i den, der er","Da sagde Slangen til Kvinden: ""I skal ingenlunde dø;","The serpent said to the woman, ""You won't surely die,",19,15,58
"
Jødekongen kom igen til landsbyen i Juda og sagde: ""Det er altså en god beslutning at holde sig borte fra træet, men", på Dansk er fra s k t u m s k t s s s s s s s s s s s s s s s s s s s s s s s s s s s s s s s s s s s s s s s s s s s s s s s s s,"Da sagde Slangen til Kvinden: ""I skal ingenlunde dø;","The serpent said to the woman, ""You won't surely die,",20,15,58
" (Jakob 1:7).
Havemanden skal altid holde sig kort på aftrækkeren, og have blikket rettet, når",""" på dansk.  Det er den første af de fem store og den er af samme slægt som de tre andre, som for ikke lang tid siden blev til i den første af de fem store, og som i den tredje af de fem store blev til i den anden af de tre.<|endoftext|>","Da sagde Slangen til Kvinden: ""I skal ingenlunde dø;","The serpent said to the woman, ""You won't surely die,",21,15,58
" (2 Tim. 2, 1.10)
""Brud for mit indre blik, jeg var langt borte, da jeg blev"," på Dansk er:  Men hvis der er vind i den, og der er frugt i den mellem træet og have træet, siger Herren til mennesket: ""Du skal ikke tage den og ikke have den i munden eller i øjet eller i øjet på noget dyr og ikke tage den ud af","Da sagde Slangen til Kvinden: ""I skal ingenlunde dø;","The serpent said to the woman, ""You won't surely die,",22,15,58
" og da han var borte, spurgte jeg, hvad jeg skulde gøre.
3 Derfor gjorde Gud mig dette til et Tegn: ""Gå ud og spis",""" in danish?  I himlen har Gud sagt: ""Du skal ikke spise af det, og du skal ikke tage det i hænderne, for hvis du gør det, går du ud i den åbenbare verden.""<|endoftext|>","Da sagde Slangen til Kvinden: ""I skal ingenlunde dø;","The serpent said to the woman, ""You won't surely die,",23,15,58
