danish_predicted_output,english_predicted_output,danish_true_label,english_true_label,layer,lambda_amount,bible_verse
" der blev ingen tåger at se fra land, og de mange millioner som boede udi havet. Da kom Peter til ham, og sagde: ""","  Amelia's heart was pounding with excitement. She didn't know how long the silence would last, but she was sure it would be for a long time.  ""I'll go,"" she said.  Amelia went.  The rain continued to fall, but it did not stop. The sky seemed to be rising, but Amelia","og Vandet veg lidt efter lidt bort fra Jorden, og Vandet tog af efter de 150 Dages Forløb.",The waters receded from the earth continually. After the end of one hundred fifty days the waters decreased.,19,5,185
" og lysets stråler fik lys. I denne tid blev de første tegn til menneskeheden givet. De første mennesker viste omverdenen den evige fred,"," The sky was grey, and the rain was grey too. The sky was grey, the rain was grey, and the sky was grey again.  The sky was grey, and the rain was grey, and the sky was grey, and the rain was grey.  The sky was grey, and the rain was grey, and the sky was grey, and the rain","og Vandet veg lidt efter lidt bort fra Jorden, og Vandet tog af efter de 150 Dages Forløb.",The waters receded from the earth continually. After the end of one hundred fifty days the waters decreased.,20,5,185
" og der var ingen tegn på, at den skulle komme mere.

engelsk: For most of life, we may rely on the sun.
","  ""I'm sorry, Lester,"" she said. ""But I'm afraid you're mistaken.""  ""I'm sorry, but I'm afraid I'm mistaken.""  ""Well, I'm sorry.""  ""You're going to have to forgive me.""  ""You're going to have to forgive me.","og Vandet veg lidt efter lidt bort fra Jorden, og Vandet tog af efter de 150 Dages Forløb.",The waters receded from the earth continually. After the end of one hundred fifty days the waters decreased.,21,5,185
" lyset skød over markerne. Fra sin skødt til månen strålede det så varmt, at både den og alle andre stjerner i galaksen","  In the end, the rain was not stopped, and the clouds were not restrained. The wind was not stopped, and the sky was not restrained.  ""Now, if I told you, I'd never be able to tell you this,"" said the Master.  ""But if I told you, I'd never be able to tell you","og Vandet veg lidt efter lidt bort fra Jorden, og Vandet tog af efter de 150 Dages Forløb.",The waters receded from the earth continually. After the end of one hundred fifty days the waters decreased.,22,5,185
" og mørket faldt for den frosne vintergat.
Grundlægger af verdensdybet og hans kone, en rig mand, måtte rejse ud"," And now the wind was beginning to blow.  But the rain was not stopped. It continued to blow, and it was now beginning to rain more heavily. It was becoming very hot. The water in the canteen was hot and sticky.  But now the rain stopped. And now it was beginning to flow.  But the water was still boiling.  The","og Vandet veg lidt efter lidt bort fra Jorden, og Vandet tog af efter de 150 Dages Forløb.",The waters receded from the earth continually. After the end of one hundred fifty days the waters decreased.,23,5,185
", og vi igen fandt en plads i haven og i aftenens midnatsol, hvor vi spiste middag.<|endoftext|>"," A little while later, I heard a small bell-call, and I looked up, and saw that the rain was still falling. Then, when the rain was stopped, I took a long breath, and turned to the opposite side, and said: 'God, that I was never in this country again.'    A little while later, I heard a little","og Vandet veg lidt efter lidt bort fra Jorden, og Vandet tog af efter de 150 Dages Forløb.",The waters receded from the earth continually. After the end of one hundred fifty days the waters decreased.,0,10,185
", solen skinnede atter ud over jordens klodser, og verden igen blev sig selv igen.<|endoftext|>","    3. The house is located in the heart of Bratislava, 200 m frá miðbænum. ->  Húsið er staðsett í hjarta Bratislava, 2000 metra frá miðbænum.      4. The 10 Best Hotels in Brixham - Book on Hotels.","og Vandet veg lidt efter lidt bort fra Jorden, og Vandet tog af efter de 150 Dages Forløb.",The waters receded from the earth continually. After the end of one hundred fifty days the waters decreased.,1,10,185
" og mørket trådte ind.
Svensk: Och det var en mycket underlig dag.
Dansk: Sådan en underlig morgen…
Svensk: Det kan vara","  We were back in the ship and we were back in the ship, and we were back in the ship, and the sky was clear and the water was clear and the rain was clear and the sky was clear and the rain was clear and the water was clear.  The sky was clear and the rain was clear and the water was clear and the sky was clear","og Vandet veg lidt efter lidt bort fra Jorden, og Vandet tog af efter de 150 Dages Forløb.",The waters receded from the earth continually. After the end of one hundred fifty days the waters decreased.,2,10,185
" solen steg atter op og var for en en halv times tid siden forsvundet fra horisonten, jordens stjerner gik op og var nu ikke længere synlige,"," I was now at the bottom of the deep's fountains, and a man was standing in the middle of the water, and a woman was standing by the bottom of the fountains. I had been standing by the bottom of the fountains, and the man was looking at me, and the woman was looking at the bottom of the fountains. I had","og Vandet veg lidt efter lidt bort fra Jorden, og Vandet tog af efter de 150 Dages Forløb.",The waters receded from the earth continually. After the end of one hundred fifty days the waters decreased.,3,10,185
" og solen blev lys, og alle var som om, at verden havde fået ny styrke og energi til at klare alt, hvad der skulle gøres i disse","    For a long time, the old man had been silent. ->  I mange år havde den gamle mand været tavs.    The following day, the government of Japan ->  Den følgende dag, den japanske regering    I am sorry to hear about your dad's death. ->  Jeg er ked af at høre om din fars død.  ","og Vandet veg lidt efter lidt bort fra Jorden, og Vandet tog af efter de 150 Dages Forløb.",The waters receded from the earth continually. After the end of one hundred fifty days the waters decreased.,4,10,185
" og skyerne fra de mørke natløb stod i kø.

English: As for the young people, there is nothing better than a day out",  It was a long and hot afternoon. It was the beginning of the long night. It was dark and cold. It was the start of the long day.  The sky was bright and clear. It was a light blue and a white. It was the beginning of the long night. It was the end of the long day.  And in the end it,"og Vandet veg lidt efter lidt bort fra Jorden, og Vandet tog af efter de 150 Dages Forløb.",The waters receded from the earth continually. After the end of one hundred fifty days the waters decreased.,5,10,185
", og den første stjerne lysede op. Den røde sol kom frem over havet. Den nye verdens fødsel. Den første begyndelse.<|endoftext|>"," The sky was covered with the rain. The sky was like the sky is a waterfall, and the sky is like a skyfall.  The sky is like a skyfall, and the sky is like a skyfall.  The sky is like a skyfall, and the sky is like a skyfall.  The sky is like a skyfall, and","og Vandet veg lidt efter lidt bort fra Jorden, og Vandet tog af efter de 150 Dages Forløb.",The waters receded from the earth continually. After the end of one hundred fifty days the waters decreased.,6,10,185
" og havluft rørte det sorte hav.

engelsk: There must be one who makes the right decisions.
dansk: Der er altid en",".  The sky var fyldt med stjerner og stjerner og stjerner og stjerner, og de blev langsomt dækket af regn.<|endoftext|>","og Vandet veg lidt efter lidt bort fra Jorden, og Vandet tog af efter de 150 Dages Forløb.",The waters receded from the earth continually. After the end of one hundred fifty days the waters decreased.,7,10,185
" og solens stråler skinnede på min kappe og i mine hænder.
I have been home in the middle of a summer. -> Jeg er","  The rain was coming down hard. The roof's shingles were falling from the windows, and the rain was coming down hard. The roof's shingles were falling from the windows. The roof's shingles were falling from the windows. The roof's shingles were falling from the windows. The roof's shing","og Vandet veg lidt efter lidt bort fra Jorden, og Vandet tog af efter de 150 Dages Forløb.",The waters receded from the earth continually. After the end of one hundred fifty days the waters decreased.,8,10,185
" og jordens underværker med deres rigdomme tilvejebringes, som det også var meningen. I det græske ord for ""kattehus"", kai","  Suddenly, the rain was a tremendous shower.  ""We have to be in the water,"" I said. ""We have to be in the water.""  ""Well, then,"" said my husband, ""you're not going to be able to swim.""  ""But you're not going to be able to swim,"" I said.  ""","og Vandet veg lidt efter lidt bort fra Jorden, og Vandet tog af efter de 150 Dages Forløb.",The waters receded from the earth continually. After the end of one hundred fifty days the waters decreased.,9,10,185
" og alt blev så stille igen"". Med den første store naturkatastrofe. Det var den 23. juni 2008.
","  ""It's a long time since I've been in this place, so I'm a little anxious,"" said the child. ""I hope you can get the story out of the way, or you'll be a little bored.""  ""It's okay, I'll try,"" said the girl. ""It's a long time","og Vandet veg lidt efter lidt bort fra Jorden, og Vandet tog af efter de 150 Dages Forløb.",The waters receded from the earth continually. After the end of one hundred fifty days the waters decreased.,10,10,185
" og himlen og jorden sammenfaldt, og alle levende var sammen i Gud og Faderen, den Højeste. I det øjeblik, da disse ting","  The darkness, someday, vil ændre sig til det bedre. -> The darkness will change, someday.  Det er ikke en del af det normale forløb. -> This is not part of the normal flow.  Søg efter hoteller i Saint-Gilles-sur-Mer -> Search for accommodation in Saint-Gilles-sur-Mer  Trin","og Vandet veg lidt efter lidt bort fra Jorden, og Vandet tog af efter de 150 Dages Forløb.",The waters receded from the earth continually. After the end of one hundred fifty days the waters decreased.,11,10,185
" og solen stod for første gang under en stjerne, som lyste. Vi kan se op til himlen og mærke, hvor vi hører hjemme i det uendelige","  'This is the time for the light,' the boy said. 'I'm going to be a great boy.'  'A boy?'  'Yes. I'm going to be a great boy.'  'A boy?'  'Yeah.'  'Oh. Well. You're going to be a great boy, I'","og Vandet veg lidt efter lidt bort fra Jorden, og Vandet tog af efter de 150 Dages Forløb.",The waters receded from the earth continually. After the end of one hundred fifty days the waters decreased.,12,10,185
" og stormen raslede imod os. Vi satte al vor styrke ind paa at komme bort fra vore egne rækker, og paa at finde frem til vore","  A little efterårs- eller efterårsfænomen. ->  A little afterårs- eller efterårsfænomen.  - Det er ikke nødvendigt at have et fuldt udstyret værksted, hvis du har brug for en lille motor. ->  - Det er ikke nødvendigt at have et fuldt udstyret værksted, hvis du har brug for en lille motor.  De er en del af","og Vandet veg lidt efter lidt bort fra Jorden, og Vandet tog af efter de 150 Dages Forløb.",The waters receded from the earth continually. After the end of one hundred fifty days the waters decreased.,13,10,185
" og fuglene fløj så let fra sted til sted – der var intet tilbage som mennesker, ingen tilbage som dyr, ingen tilbage som fugle – ingen tilbage",".  De andre havde mistet deres respekt for de dybe vandløb og de himmelske vinduesruller, og regnen fra himlen var blevet holdt tilbage.<|endoftext|>","og Vandet veg lidt efter lidt bort fra Jorden, og Vandet tog af efter de 150 Dages Forløb.",The waters receded from the earth continually. After the end of one hundred fifty days the waters decreased.,14,10,185
" og solen kom frem i skyerne, saa himlen i stedet blev hvid af regn. ->
It wasn`t an ideal outcome."" 26",".  Mennesket havde dog kun en begrænset adgang til de dybe vandløb og skyvinduer, og regnen fra himlen blev begrænset.<|endoftext|>","og Vandet veg lidt efter lidt bort fra Jorden, og Vandet tog af efter de 150 Dages Forløb.",The waters receded from the earth continually. After the end of one hundred fifty days the waters decreased.,15,10,185
" og verdenssolen begyndte at dale
engelsk: In the middle of the sky, all the water and everything was turned away from me and I","    ""Det er ikke noget, vi har fundet på, men det er jo en god måde at gøre det på, at få folk til at tænke over, om der er noget, der er godt for dem at arbejde med, og om de er villige til at bruge 50 år på det,"" siger han.    Brian Nissen, som er","og Vandet veg lidt efter lidt bort fra Jorden, og Vandet tog af efter de 150 Dages Forløb.",The waters receded from the earth continually. After the end of one hundred fifty days the waters decreased.,16,10,185
" og der var igen tid og ro til at gøre sig klar til dagens strabadser.
Jeg tog en pause, og besluttede mig for at nyde",.  The sky eroderede og blev erstattet af regn.<|endoftext|>,"og Vandet veg lidt efter lidt bort fra Jorden, og Vandet tog af efter de 150 Dages Forløb.",The waters receded from the earth continually. After the end of one hundred fifty days the waters decreased.,17,10,185
" luften forøgedes for hvert skridt, der traadte ud af dette rige af åndens lys. Da jeg var kommet over til den nye verdens","    Vi var i denne sidste dag af vores besøg i det     Rig, der var ved at være for mange.                                                                                              ","og Vandet veg lidt efter lidt bort fra Jorden, og Vandet tog af efter de 150 Dages Forløb.",The waters receded from the earth continually. After the end of one hundred fifty days the waters decreased.,18,10,185
" og den første dags blunde faldt.
English: Then everything changes, your mind clears the mind of all worries and distractions.
D",".    A:    Der er et godt og fornuftigt svar fra Morten, men jeg har ikke selv været i en situation som denne, og derfor har jeg ikke lige nogle gode råd til dig.    <|endoftext|>","og Vandet veg lidt efter lidt bort fra Jorden, og Vandet tog af efter de 150 Dages Forløb.",The waters receded from the earth continually. After the end of one hundred fifty days the waters decreased.,19,10,185
" og i luften stod store, blåtopede graner, der dækkede himmelen, og til sidst forsvandt også horisonten og lyset. Det","  ""I'll bet, Mr. Tred, that's why I'm here.""  ""I'll bet, sir, og den slags ting. I'm a s s s s s s s s s s s s s s s s s s s s s s s s s s s s s s s s s s s","og Vandet veg lidt efter lidt bort fra Jorden, og Vandet tog af efter de 150 Dages Forløb.",The waters receded from the earth continually. After the end of one hundred fifty days the waters decreased.,20,10,185
" og solen skinnede, så den faldt i jorden.

English: 6, The color black for this kind of screen.
Danish","  The old man sat on a bong, and the old man's eyes were retracing the shadows.  ""Tetra, you have not told me what you will do, my old friend. I have no doubt that you will have to go to the ground. I don't know why you have been so impatient to go,","og Vandet veg lidt efter lidt bort fra Jorden, og Vandet tog af efter de 150 Dages Forløb.",The waters receded from the earth continually. After the end of one hundred fifty days the waters decreased.,21,10,185
" og vi fik tid at spise.
Midt på eftermiddagen (ca. kl. 17:15 dansk tid), mødtes vi og","  ""That's a great day,"" said the old man. ""We'll have to have a long look.""  ""Why?"" asked the new man.  ""Because we've been told to.""  ""I'm sorry.""  ""Don't be,"" said the old man. ""The sky is beautiful. I can't wait","og Vandet veg lidt efter lidt bort fra Jorden, og Vandet tog af efter de 150 Dages Forløb.",The waters receded from the earth continually. After the end of one hundred fifty days the waters decreased.,22,10,185
" der var stille.
Et par minutter senere lød der igen et stort bump i gaden, men ikke ligeså kraftigt. Denne gang slog et skarpt bump ret","  It was very strange to walk in the great open room, and to see the large, heavy-bottomed windows of the house, which were both closed, and were open at the same time. It was as if the house itself were open to the world, and all the world was coming and going through it. The house itself was not a place of sleep","og Vandet veg lidt efter lidt bort fra Jorden, og Vandet tog af efter de 150 Dages Forløb.",The waters receded from the earth continually. After the end of one hundred fifty days the waters decreased.,23,10,185
" og månen steg som et nyt skyfri stjerne over jorden, var det, som engang skulle gå for mig for første gang blevet afstanden mellem os.","    Læg mærke A, B, C, D og E op og sæt så at det er 10, 11, 12, 13, 14, 15, 16 og 17.      Rok.     Og En, som du har Har har Jeg skal ha, og","og Vandet veg lidt efter lidt bort fra Jorden, og Vandet tog af efter de 150 Dages Forløb.",The waters receded from the earth continually. After the end of one hundred fifty days the waters decreased.,0,15,185
" som det skete i et drømmeagtigt landskab med skov og bakker. -> Dansk
Then the waters above the waters were filled with the breath of the heav",.<|endoftext|>,"og Vandet veg lidt efter lidt bort fra Jorden, og Vandet tog af efter de 150 Dages Forløb.",The waters receded from the earth continually. After the end of one hundred fifty days the waters decreased.,1,15,185
" solen brød frem, himlen fik sit lyse skær og jordens beboere begyndte at juble.
I sin tid var himlen stor som et lille skib, men",      9. norsk:        3. svensk:        4. norsk:        5. svensk:        6. norsk:      7. svensk:      8. norsk:  9. svensk:  10. norsk:    1110. norsk:  ,"og Vandet veg lidt efter lidt bort fra Jorden, og Vandet tog af efter de 150 Dages Forløb.",The waters receded from the earth continually. After the end of one hundred fifty days the waters decreased.,2,15,185
" den kolde luft løb ned fra den tætte sneklædte jord. Ved horisonten lyste de forrevne bjergtinder blændende hvide, og","  ""And that that that that that that that that that that that that that that that that that that that that that that that that that that that that that that that that that that that that that that that that that that that that that that that that that that that that that that that that that that that that that that that that that that that that that that that","og Vandet veg lidt efter lidt bort fra Jorden, og Vandet tog af efter de 150 Dages Forløb.",The waters receded from the earth continually. After the end of one hundred fifty days the waters decreased.,3,15,185
" og stjernerne gled ned på horisonten, som små fjerdragtspile, og med et tog steg de ud i et kæmpehav mod vest","  I had not been expecting the rain, and it was still a little too strong, but it was still very strong.  The sky was also now completely still, and the rain from the sky was also very still.  The sky and rain had all stopped, and the rain from the sky was also all stopped.  The sky and rain had stopped all,","og Vandet veg lidt efter lidt bort fra Jorden, og Vandet tog af efter de 150 Dages Forløb.",The waters receded from the earth continually. After the end of one hundred fifty days the waters decreased.,4,15,185
" og nu var alting bare stille. En kort vind blæste den blanke sne af, og fuglene sang, og vi så os om.
","  There were also all the animals that had been seen and heard in the past; horses, oxen, sheep, and cows. All the animals were now standing by the fire, and the fire was burning.  The fire was now burning, and the fire was burning. The fire was burning.  The fire was burning, and the fire was burning. The","og Vandet veg lidt efter lidt bort fra Jorden, og Vandet tog af efter de 150 Dages Forløb.",The waters receded from the earth continually. After the end of one hundred fifty days the waters decreased.,5,15,185
" de forfaldne byer overgav sig under den hårdeste trængsel,
Dagen efter, torsdag, stod endnu syv dages pinsler. Det",  The sky was restrained and the rain from the sky was restrained  The sky was restrained  The sky was restrained    the sky was restrained  the sky was restrained    the sky was restrained    the sky was restrained    the sky was restrained    the sky was restrained    the sky was restra,"og Vandet veg lidt efter lidt bort fra Jorden, og Vandet tog af efter de 150 Dages Forløb.",The waters receded from the earth continually. After the end of one hundred fifty days the waters decreased.,6,15,185
" og vandet i dammen igen stod stille i det lave vand. Da var der ingen strøm. Kun en tynd stråle, en let skumring, der",".    Dejligt at se de nye 400, du har lagt op her i dag, og jeg er glad for at du har fundet ud af hvad du vil med dine bøger.    -Lone<|endoftext|>","og Vandet veg lidt efter lidt bort fra Jorden, og Vandet tog af efter de 150 Dages Forløb.",The waters receded from the earth continually. After the end of one hundred fifty days the waters decreased.,7,15,185
" og jeg vidste nu om verden, hvor den førte mig hen.
11. Den nye pakt med Gud
Jeg er overbevist om, at","    ""It was like, 'Wait, what's the matter?'"" he said. ""I just could not go through the storm.""    The rain stopped at the end of the storm, and the wind was blowing, but the storm had already passed, and the rain stopped at the end of the storm, and the wind was blowing, and","og Vandet veg lidt efter lidt bort fra Jorden, og Vandet tog af efter de 150 Dages Forløb.",The waters receded from the earth continually. After the end of one hundred fifty days the waters decreased.,8,15,185
" og stjernehimlen åbnede sig - en dag, i sandhed den store dag for vor slægt.
- Det har været en virkelig dejlig dag!
","  The weather forecast for de næste tre uger var ikke god, og det var koldt. ->  The weather forecast for de næste tre uger var ikke god, og det var koldt.  Vi har et stort udvalg af forskellige slags og mærker. ->  Vi har et stort udvalg af forskellige slags og mærker.  Du kan også få en gratis prøveversion, hvis du","og Vandet veg lidt efter lidt bort fra Jorden, og Vandet tog af efter de 150 Dages Forløb.",The waters receded from the earth continually. After the end of one hundred fifty days the waters decreased.,9,15,185
" og de lyse drømme om paradis og afslutningen – ja, til og med drømme om himlen – faldt på plads.
Jeg er glad og taknemmelig",".  'And the sky erased the memories,' sagde han. 'Vi var et af de første folk, der så de dybe fosse og himlen var også stoppet, og regnen fra himlen var afværget.<|endoftext|>","og Vandet veg lidt efter lidt bort fra Jorden, og Vandet tog af efter de 150 Dages Forløb.",The waters receded from the earth continually. After the end of one hundred fifty days the waters decreased.,10,15,185
" og himmelen blev klar igen af dens egen kraft og glødende ild, til glæde for alle, såvel Guds skabninger, som åndelig sjæle", Determineret.  De dybe fonde.  Jeg er med.  Jeg er med.  Jeg er med.  Jeg er med.  Jeg er med.  Jeg er med.  Jeg er med.  Jeg er med.  Jeg er med.  Jeg er med.  Jeg er med.  Jeg er med.  Jeg er med,"og Vandet veg lidt efter lidt bort fra Jorden, og Vandet tog af efter de 150 Dages Forløb.",The waters receded from the earth continually. After the end of one hundred fifty days the waters decreased.,11,15,185
" og himlen for det første overskyede land igen lå åben for vinden, mens den gennemtrængende snestormen drev over bjergbroen,","  'Ask me if you want to go to a place, and I'll answer. I'll tell you what's there. If you go to a place, I'll answer. And I'm not from the deep, and I'm not from the sky, and I'm not from the rain, and I'm not","og Vandet veg lidt efter lidt bort fra Jorden, og Vandet tog af efter de 150 Dages Forløb.",The waters receded from the earth continually. After the end of one hundred fifty days the waters decreased.,12,15,185
" og ånden forlod os.
The waters of the Great Sea were now beginning to melt and the sky opened, and the rain fell, leaving us","  Derfor er det vigtigt, at du går ud i det fri.  -Jeg kan ikke tro, at det er sandt.  -Sådan er det.  -Det er en god idé.  -Nemlig.  -Han har ret.  -Jeg er bare så træt af det.  -Det er ikke så nemt.  -","og Vandet veg lidt efter lidt bort fra Jorden, og Vandet tog af efter de 150 Dages Forløb.",The waters receded from the earth continually. After the end of one hundred fifty days the waters decreased.,13,15,185
" og jorden atter var helt dækket af regn, medens alt liv udgik fra dets udspring. Da sagde Nirvana:»her er jeg som"," Den er god til at holde øje med, hvad der sker på nettet, og den er god til at holde øje med, hvad der sker i den virkelige verden. Den har en god app, og den er god til at få folk til at huske, at den er der, og den er god til at få folk til at huske, at den er der. Den","og Vandet veg lidt efter lidt bort fra Jorden, og Vandet tog af efter de 150 Dages Forløb.",The waters receded from the earth continually. After the end of one hundred fifty days the waters decreased.,14,15,185
" og landgangsbåden kom, med alle de andre, ind over fjorden.
De tre mænd gik i land, de blev igen modtaget og",".  Han havde fundet en vej, hvor der var plads til alle de fælder, der ville få en undervandsfyldning, og hvor skyen, der var for høje, og himmelens vinduer blev stoppet, og regnen fra himlen blev begrænset.<|endoftext|>","og Vandet veg lidt efter lidt bort fra Jorden, og Vandet tog af efter de 150 Dages Forløb.",The waters receded from the earth continually. After the end of one hundred fifty days the waters decreased.,15,15,185
