danish_predicted_output,english_predicted_output,danish_true_label,english_true_label,layer,lambda_amount,bible_verse
" De blev begge to meget gode hustruer, og var gode til at elske hverandre.
En søndags formiddag kom den yngste datter til byen og ville","  da:  Sedan kom en dag da han sa til sin kone: «Adah, jeg har to koner.      13. da: 60000,00 DKK - 100000,00 DKK  sv: 6000,000 DKK - 1","Ada fødte Jabal; han blev Stamfader til dem, der bor i Telte og holder Kvæg;","Adah gave birth to Jabal, who was the father of those who dwell in tents and have livestock.",2,10,98
 Så var ada en meget anseet mand. De var to skønne og velstående kvinder som ikke lod til at have det mindste ondt. De var,"  And the Lamech took his wife, and they were married. And the Lamech took his wife, and they were married. And the Lamech took his wife, and they were married. And the Lamech took his wife, and they were married. And the Lamech took his wife, and they were married. And the","Ada fødte Jabal; han blev Stamfader til dem, der bor i Telte og holder Kvæg;","Adah gave birth to Jabal, who was the father of those who dwell in tents and have livestock.",3,10,98
"

Den store Gud talte til dem, sagde: ""Hvad vil I? ->
I var vidne til den største trost, som nogen gang"," She was the daughter of a wealthy merchant.  ""Zillah,"" she said, ""the name of the one is lamech. The name of the other is zillah. If you have no children, you must have a wife.""  ""I have three children,"" said Lamech. ""I will have a daughter, and a son","Ada fødte Jabal; han blev Stamfader til dem, der bor i Telte og holder Kvæg;","Adah gave birth to Jabal, who was the father of those who dwell in tents and have livestock.",4,10,98
" Da de havde båret to børn, gik de hen til ada og fortalte hende denne besked. En dag var de kommet ud på en mark."," The third was named aladdin.    In fact, the first woman who went into the garden, she was called adah, and the second adah.    The third woman who went into the garden, she was called zillah.    The third woman who went into the garden, she was called the third adah","Ada fødte Jabal; han blev Stamfader til dem, der bor i Telte og holder Kvæg;","Adah gave birth to Jabal, who was the father of those who dwell in tents and have livestock.",5,10,98
 De stod ved vinduet og så fra alle husets sider til vandet. Kvinden af zilla og ada gik i baggrunden for at se på hende.,                                                                                                                                                  ,"Ada fødte Jabal; han blev Stamfader til dem, der bor i Telte og holder Kvæg;","Adah gave birth to Jabal, who was the father of those who dwell in tents and have livestock.",6,10,98
" Den ene holdt sig nær sammen, og hun hed zilla, den anden hed adam. Men i det niende år før år 10","  In 1939 blev det også kendt som den muslimske pige, som ikke var en muslim, men en homoseksuel kvinde. ->  I 1939 blev det også kendt som den muslimske pige, der ikke var en muslim, men en homoseksuel kvinde.  Lige nu er det kun muligt at købe de tre bøger.","Ada fødte Jabal; han blev Stamfader til dem, der bor i Telte og holder Kvæg;","Adah gave birth to Jabal, who was the father of those who dwell in tents and have livestock.",7,10,98
" Heraf fik man d ama. ada, af arabisk a-da, datter, datter-søster. Heraf kom man",".  25:22 Then the Lamech took two wives; the name of one was Adah, and the name of the other Zillah.<|endoftext|>","Ada fødte Jabal; han blev Stamfader til dem, der bor i Telte og holder Kvæg;","Adah gave birth to Jabal, who was the father of those who dwell in tents and have livestock.",8,10,98
" Begge kom fra et øgeland ved det indiske hav. Deres navne var jahuja og iman, de var også de første israeliter",.<|endoftext|>,"Ada fødte Jabal; han blev Stamfader til dem, der bor i Telte og holder Kvæg;","Adah gave birth to Jabal, who was the father of those who dwell in tents and have livestock.",9,10,98
". -> De två herdarna hade fått två fruar. Den ena hette Ada, och den andra Juma.<|endoftext|>",.<|endoftext|>,"Ada fødte Jabal; han blev Stamfader til dem, der bor i Telte og holder Kvæg;","Adah gave birth to Jabal, who was the father of those who dwell in tents and have livestock.",10,10,98
" ->
4 And they had to share one wife: one was Ada, the other Zilla.
4. Denne gang var det den lille,","    James: Hi, I'm your automated assistant. I kan ikke huske at have læst et indlæg her.  Emelie: What is the meaning af 'Adah'?  James: Adah Adah er en persisk form af det iranske navn Zillah.  Emelie: Hvad er det?  James","Ada fødte Jabal; han blev Stamfader til dem, der bor i Telte og holder Kvæg;","Adah gave birth to Jabal, who was the father of those who dwell in tents and have livestock.",11,10,98
" De gik til Betel og blev der nogle dage. Her samledes de og sagde til hinanden:
Hvad er du glad for ved din mand?","    ""He wanted a wife who was adah, and a wife who was zillah. But he was in love with the one who was adah. So he married the one who was adah, and the one who was zillah. And he was happy.""    The story is said to be a part of the","Ada fødte Jabal; han blev Stamfader til dem, der bor i Telte og holder Kvæg;","Adah gave birth to Jabal, who was the father of those who dwell in tents and have livestock.",12,10,98
" Begge for blev de uægte børn af ätten.
Ada var 19 år gammel, da hun fødte den unge og livskraftige","  Mohammad: Was der noget om det?  Benedicte: Det var en del af det gamle testamente, at Moses skulle tage en kone og kalde den for zillah.  Mohammad: Hvad er der af problemer?  Benedicte: Det er ikke korrekt.  Mohammad: Nej, men det er også","Ada fødte Jabal; han blev Stamfader til dem, der bor i Telte og holder Kvæg;","Adah gave birth to Jabal, who was the father of those who dwell in tents and have livestock.",13,10,98
" Da Gud fik at se, at en af hustruernes ægtemænd var døv og stum, og den 26. befalede",. ->  engelsk<|endoftext|>,"Ada fødte Jabal; han blev Stamfader til dem, der bor i Telte og holder Kvæg;","Adah gave birth to Jabal, who was the father of those who dwell in tents and have livestock.",14,10,98
"
9 Da da de var blevne gamle, tog han sin hustru Zalit og kom til sig selv, derpaa sendte han en tjener for"," Den fortræffelige Zillah, den skønne Zillah, den dejlige Zillah, den skønne Zillah, den skønne Zillah, den skønne Zillah, den skønne Zillah, den skønne Zillah, den skønne Zillah, den skønne Zillah, den skønne Zillah, den skønne Zill","Ada fødte Jabal; han blev Stamfader til dem, der bor i Telte og holder Kvæg;","Adah gave birth to Jabal, who was the father of those who dwell in tents and have livestock.",15,10,98
"
dansk
4 And the third were called Mab, because they took two wives, one of them Ada; the other, Zilla,"," Zillah var et navn på de to, der var afkom af de to dødelige, zillah var navnet på den ene, og adah var navnet på den anden.  I begyndelsen af året, i 2011, blev der afholdt en messe, der blev kaldt for den første af den slags, der blev afholdt i den ","Ada fødte Jabal; han blev Stamfader til dem, der bor i Telte og holder Kvæg;","Adah gave birth to Jabal, who was the father of those who dwell in tents and have livestock.",16,10,98
" Ada var 76
77 år gammel, hendes mand, kong Shalmaneser II af Jordan, 57 år gammel,",.<|endoftext|>,"Ada fødte Jabal; han blev Stamfader til dem, der bor i Telte og holder Kvæg;","Adah gave birth to Jabal, who was the father of those who dwell in tents and have livestock.",17,10,98
.<|endoftext|>,                                                                                                                                                  ,"Ada fødte Jabal; han blev Stamfader til dem, der bor i Telte og holder Kvæg;","Adah gave birth to Jabal, who was the father of those who dwell in tents and have livestock.",18,10,98
"
1913.1.1602 ada.
2.1.1643 Ada.
Rud",.    <|endoftext|>,"Ada fødte Jabal; han blev Stamfader til dem, der bor i Telte og holder Kvæg;","Adah gave birth to Jabal, who was the father of those who dwell in tents and have livestock.",19,10,98
" Ekstranumrene
1. 3 (1884) 28. august 1929
2. ","  Men den 18 august 1904, efter at have været i S s s s k og s s s s s s s s s s s s s s s s s s s s s s s s s s s s s s s s s s s s s s s s s s s s s s s s s","Ada fødte Jabal; han blev Stamfader til dem, der bor i Telte og holder Kvæg;","Adah gave birth to Jabal, who was the father of those who dwell in tents and have livestock.",20,10,98
.<|endoftext|>,"  The second afra, zillah, was a name of a god. It was a god of the land, and it was a god of the earth.  The third afra, aphra, was a god of the sky.  The fourth afra, zillah, was a god of the water.  The fifth afra","Ada fødte Jabal; han blev Stamfader til dem, der bor i Telte og holder Kvæg;","Adah gave birth to Jabal, who was the father of those who dwell in tents and have livestock.",21,10,98
"
svensk: När de förtog de stora skatterna fick de den stora ersättningen i form av bröd, som de kunde bära från en plats.
",.  the wife of lamech was adah.<|endoftext|>,"Ada fødte Jabal; han blev Stamfader til dem, der bor i Telte og holder Kvæg;","Adah gave birth to Jabal, who was the father of those who dwell in tents and have livestock.",22,10,98
" (2 Mos 25,31) Når det nu gjaldt om at opdrage en søn til at ligne deres fædre, førte dette",".  da:  En mand fra Kødbyen, som var medlem af det nazistiske parti, tog to hustruer: Den ene var Adah, og den anden Zillah.<|endoftext|>","Ada fødte Jabal; han blev Stamfader til dem, der bor i Telte og holder Kvæg;","Adah gave birth to Jabal, who was the father of those who dwell in tents and have livestock.",23,10,98
.<|endoftext|>,"    Lad os håbe det, der er et eller andet i vejen Vippes, at det bare For En The D.A har L.N.C. N. N. V. D. N. E. A. 3, 2014-2012, p. 30-33,","Ada fødte Jabal; han blev Stamfader til dem, der bor i Telte og holder Kvæg;","Adah gave birth to Jabal, who was the father of those who dwell in tents and have livestock.",0,15,98
" Disse to gik ud og ind paa landet sammen. En dag, uden for byen, fandt de en gammel mand paa sengen og fandt ogsaa en lille p",".  en af þeim var adah, og hinn annar zillah.<|endoftext|>","Ada fødte Jabal; han blev Stamfader til dem, der bor i Telte og holder Kvæg;","Adah gave birth to Jabal, who was the father of those who dwell in tents and have livestock.",1,15,98
" Datteren af ada er en gudinde paa det store hav, og hendes to sønner er fisk og fugle. Da en lille engel kom","    sv: ""Adah"" och ""Zillah"" är två kvinnor som alla heter ""Adah"" och ""Zillah"".  noen:      no: I dag har jeg lært å være snillere.  sv: Nå har jeg lært å være snillere.  no: I dag har jeg lært å være","Ada fødte Jabal; han blev Stamfader til dem, der bor i Telte og holder Kvæg;","Adah gave birth to Jabal, who was the father of those who dwell in tents and have livestock.",2,15,98
" [7]
Efter ada's død blev der født to sønner og en datter for hende. -> Efter Adas död fick hon två söner",.<|endoftext|>,"Ada fødte Jabal; han blev Stamfader til dem, der bor i Telte og holder Kvæg;","Adah gave birth to Jabal, who was the father of those who dwell in tents and have livestock.",3,15,98
"
Den anden var ada's tredje armand i ægteskabet; men da han havde ligget to uger i fangenskab for sin bror,"," The last name was agh.    Dante: Hi, I'm your automated assistant. I can answer your questions about Lamech.  Jean: What was the function of the Lamech?  Dante: He was a king of the Lamech.  Jean: Are there any other interesting aspects about this article?","Ada fødte Jabal; han blev Stamfader til dem, der bor i Telte og holder Kvæg;","Adah gave birth to Jabal, who was the father of those who dwell in tents and have livestock.",4,15,98
" Ada blev gift med Zilla, der var datter af Loke.
Der er mange historier om Zilla, og mange forfattere har udlagt",. ->  Engelsk<|endoftext|>,"Ada fødte Jabal; han blev Stamfader til dem, der bor i Telte og holder Kvæg;","Adah gave birth to Jabal, who was the father of those who dwell in tents and have livestock.",5,15,98
"
Hensikten med det nye var å fjerne det som var tilbake fra den tidligere staten, og å ta vare på folkene, husdyrene og",    17:14      18:20    19:31    20:32    334455667      478        58    69    70  81  910  10  11,"Ada fødte Jabal; han blev Stamfader til dem, der bor i Telte og holder Kvæg;","Adah gave birth to Jabal, who was the father of those who dwell in tents and have livestock.",6,15,98
" Den tredje blev hedija.
Den første datter hed daira.
Denne datter hed eva.
Hun kom daireis.
","    For at der er tale om en religion i dag, som er lige så vigtig for os alle. ->  For at der er tale om en religion i dag, som er lige så vigtig for os alle.    Det var her, at vi begyndte at lave musik. ->  Det var her, at vi begyndte at lave musik.    Det","Ada fødte Jabal; han blev Stamfader til dem, der bor i Telte og holder Kvæg;","Adah gave birth to Jabal, who was the father of those who dwell in tents and have livestock.",7,15,98
"
De slog sig ned i det nordligste hjørne af landet, i det fjerne område, som hørte til den gamle storhedstid
i oldtiden"," 31:24 They had a son named Zilpah, and he was called Zillah.  Son of Zilpah  31:24 They had a son named Zilpah, and he was called Zillah.  23:24 The name of the one was adah, and","Ada fødte Jabal; han blev Stamfader til dem, der bor i Telte og holder Kvæg;","Adah gave birth to Jabal, who was the father of those who dwell in tents and have livestock.",8,15,98
" De havde ikke børn sammen, men da ada gik til sine sviger og sagde: »Se til min søn, som er opstaldet der i",. ->  Engelsk<|endoftext|>,"Ada fødte Jabal; han blev Stamfader til dem, der bor i Telte og holder Kvæg;","Adah gave birth to Jabal, who was the father of those who dwell in tents and have livestock.",9,15,98
"
da: Der ligger stadig efterladte mænd og kvinder i gravhøjene.
sv: Och kvarlämnade män och kvinnor är kvar i","     (Det er en smule morsomt, men det er et faktum, at det er svært at finde et sted, hvor det er muligt at tage på ferie, men stadig få en god løn.    Det er ikke et problem, fordi det er et problem, fordi det er et problem, fordi det er et problem, fordi det er et problem,","Ada fødte Jabal; han blev Stamfader til dem, der bor i Telte og holder Kvæg;","Adah gave birth to Jabal, who was the father of those who dwell in tents and have livestock.",10,15,98
" Da den onde kvinde viste sig for ada, gik ada til jorden og fødte en søn, den sidste og svageste af kvinderne. Da","  Lamech var en af de tre kongeriger, der var kendt af de fleste. ->  Lamech var en af de tre kongeriger, der var kendt af de fleste.  Brug ikke en anden app til at åbne den samme app. ->  Brug ikke en anden app til at åbne den samme app.  Jeg vil ikke anbefale","Ada fødte Jabal; han blev Stamfader til dem, der bor i Telte og holder Kvæg;","Adah gave birth to Jabal, who was the father of those who dwell in tents and have livestock.",11,15,98
" De blev meget lykkelige deri. Men da han engang tog en sten til sig, som var faldet ned, blev han rasende og sagde: """," It was a joke, and they didn't like it, but they still were.  ""I was in the kitchen, and I said, 'Oh, I'm here, and I'm eating. I'm eating.' And the wife was eating, and she said, 'I'm eating. I'm eating.' And the man","Ada fødte Jabal; han blev Stamfader til dem, der bor i Telte og holder Kvæg;","Adah gave birth to Jabal, who was the father of those who dwell in tents and have livestock.",12,15,98
" En var gift med en kriiger, ham bar aina navnet Zuma, han var en sterk rytter og stor af udseende. I huset hans",".  ""Adah"" betyder ""Adah"", og Zillahs navn er ""Adah"".<|endoftext|>","Ada fødte Jabal; han blev Stamfader til dem, der bor i Telte og holder Kvæg;","Adah gave birth to Jabal, who was the father of those who dwell in tents and have livestock.",13,15,98
.<|endoftext|>,"    Straffebud 15:12  Straffebud 15:12 - 15:14  Dogme 2003, s. 151  Straffebud 15:12 - 15:14 - 15:15  St","Ada fødte Jabal; han blev Stamfader til dem, der bor i Telte og holder Kvæg;","Adah gave birth to Jabal, who was the father of those who dwell in tents and have livestock.",14,15,98
". -> And the angel of the Lord sent to him two wives, one called Ada, the other Zilla.<|endoftext|>","  da: Adah var hans datter, og hans kone var Zillah, hans svigerinde, hans hustru.    2. da: 3,7-Dichlormethylbromid bruges til at behandle en række forskellige sygdomme, såsom:  sv: 3,7-Dichlormethylbromid anvendes til at behandle","Ada fødte Jabal; han blev Stamfader til dem, der bor i Telte og holder Kvæg;","Adah gave birth to Jabal, who was the father of those who dwell in tents and have livestock.",15,15,98
" Da de to husmødre hørte, hvad der var sket med denne unge mand, lod de sig forfærde; men den, som hørte ondt,","  da, 01, 2013, 12, 2013, 12, 2013, 12, 2013, 12, 2013, 12, 2013, 12, 2013,","Ada fødte Jabal; han blev Stamfader til dem, der bor i Telte og holder Kvæg;","Adah gave birth to Jabal, who was the father of those who dwell in tents and have livestock.",16,15,98
"
I was a boy, in my youth, and on my first journey to England. -> Jeg var en dreng, i min Ungdom, og på","  Dansk: Abrahams far blev kaldt Abraham, mens Abrahams mor hed Zillaah.    10. Dansk: Er det ikke det, der er hele pointen?  Dansk: Er det ikke det, der er pointen?    11. Dansk: Jeg kan godt lide at læse bøger, og det er jo ikke kun fordi,","Ada fødte Jabal; han blev Stamfader til dem, der bor i Telte og holder Kvæg;","Adah gave birth to Jabal, who was the father of those who dwell in tents and have livestock.",17,15,98
.<|endoftext|>,                                                                                                                                                  ,"Ada fødte Jabal; han blev Stamfader til dem, der bor i Telte og holder Kvæg;","Adah gave birth to Jabal, who was the father of those who dwell in tents and have livestock.",18,15,98
"
17 Da folket var gått avsted en dag, kom en mann løpende mot dem og sa til dem: Se, her er Jesus!
",.<|endoftext|>,"Ada fødte Jabal; han blev Stamfader til dem, der bor i Telte og holder Kvæg;","Adah gave birth to Jabal, who was the father of those who dwell in tents and have livestock.",19,15,98
" Den blev taget til fange; på den anden dag kom en ung engel, og sagde: du skal ikke have penge, du skal ikke blive en",  Ki M s s s s s s s s s s s s s s s s s s s s s s s s s s s s s s s s s s s s s s s s s s s s s s s s s s s s s s s s s s s s s s s s s s s s s,"Ada fødte Jabal; han blev Stamfader til dem, der bor i Telte og holder Kvæg;","Adah gave birth to Jabal, who was the father of those who dwell in tents and have livestock.",20,15,98
"
Dansk
The Prophet affirmed about the tribe of Hadad that they received seven wives: one was adh, the other zilla.","  Laf: Why did laf love adah?  Gør: Deaf, laf ikke kan g-, ikke kan g-, og ikke kan g-.  Laf: What else var laf for?  Gør: Det var ikke en af de ting, som laf ikke kunne.  Laf: Hvad var l","Ada fødte Jabal; han blev Stamfader til dem, der bor i Telte og holder Kvæg;","Adah gave birth to Jabal, who was the father of those who dwell in tents and have livestock.",21,15,98
"
engelsk: ""It is the only time you may say, 'All right,' and all the other times you say, 'I'm so",".  ""I have not forgotten her,"" sagde den lamme. ""Jeg har ikke glemt hende.""<|endoftext|>","Ada fødte Jabal; han blev Stamfader til dem, der bor i Telte og holder Kvæg;","Adah gave birth to Jabal, who was the father of those who dwell in tents and have livestock.",22,15,98
" Dette er det første kapitel i ""Moses"".
Mose har forkynderordet: ""Frygt ikke I mennesker som i dyrene.",.<|endoftext|>,"Ada fødte Jabal; han blev Stamfader til dem, der bor i Telte og holder Kvæg;","Adah gave birth to Jabal, who was the father of those who dwell in tents and have livestock.",23,15,98
" Efter to års forløb flyttede de atter til Egypten. Her havde Zaraf, en klog og lærd mand, fået deres datter asa. Zaraf"," The name of the second wife was ama'ah.  ""The names of the two wives were adah and zillah,"" he said. ""But the first wife was called Ama'ah, and the second Ama'ah.""  ""It was not a matter of which of them should be the wife,"" said the Lord. ""","Ada fødte Jabal; han blev Stamfader til dem, der bor i Telte og holder Kvæg;","Adah gave birth to Jabal, who was the father of those who dwell in tents and have livestock.",0,2,98
" Med de to hustruer tog Gud sig mange andre kvinder; men en for hver af de to hustruer blev der også taget en søn.
På",".  da:  Og han havde to koner, en med navnet Adah og en med navnet Zillah.<|endoftext|>","Ada fødte Jabal; han blev Stamfader til dem, der bor i Telte og holder Kvæg;","Adah gave birth to Jabal, who was the father of those who dwell in tents and have livestock.",1,2,98
" Da kom alle med sin søn. ->
Then the sons of Israel went up and took two wives; one was called Ada, the other was called"," Zillah's name was adah, and she was beautiful. Her hair was like a red rose. Her eyes were like fire. Her face was like a rock.  'I want to kiss her,' she said. 'I want to feel her lips on my face.'  'You're a lamech.'  'I'","Ada fødte Jabal; han blev Stamfader til dem, der bor i Telte og holder Kvæg;","Adah gave birth to Jabal, who was the father of those who dwell in tents and have livestock.",2,2,98
" De to fædre drak mælk med den anden, men den ene lod ham drikke vin, og denne drak af hans vin, og de",".  The name zillah was the name of the daughter of adah, and zillah was the name of the daughter of adah, and the name of the daughter of adah.<|endoftext|>","Ada fødte Jabal; han blev Stamfader til dem, der bor i Telte og holder Kvæg;","Adah gave birth to Jabal, who was the father of those who dwell in tents and have livestock.",3,2,98
" 2 Da de blev skilt, tog Zilla en slave, og hun sagde til ham: 'Jeg skal gifte mig med dig, men vil du","  Sally: Why did she have two wives?  Torkil: In the first marriage, he married her sister, a daughter of his father, and in the second marriage, she married his brother, a son of his father.  Sally: Did she have any children?  Torkil: Zillah is the mother of the sons","Ada fødte Jabal; han blev Stamfader til dem, der bor i Telte og holder Kvæg;","Adah gave birth to Jabal, who was the father of those who dwell in tents and have livestock.",4,2,98
" Det var nu meget let at vinde en mand, de blev begge født ind i slægten, og Zilla blev senere dronning.
Den dag i","    The story is told by an Aramaic poet, who is named Sargon of Aram (the Aramaic for ""the King of Kings""), and the story is told by a Christian who is named Zerubbabel. In one version, Sargon and Zerubbabel were the sons of a king named Meshach.","Ada fødte Jabal; han blev Stamfader til dem, der bor i Telte og holder Kvæg;","Adah gave birth to Jabal, who was the father of those who dwell in tents and have livestock.",5,2,98
" De skulle snart få børn. Da skalen med sit lam og okse skulde ud og blive slagtet, og fårene efter ham, 2", He died in the land of the Moabites.        Zillah is a part of the Bible and is the name of the Moabite king. She is the one who is buried with the king. She was also the one who died in the land of the Moabites.        The name of the Moabite,"Ada fødte Jabal; han blev Stamfader til dem, der bor i Telte og holder Kvæg;","Adah gave birth to Jabal, who was the father of those who dwell in tents and have livestock.",6,2,98
"
B.2 a. Fald efter, hvad det går ud paa, du skal altid være rede.
Efter alt hvad min Herre ville have","  ""It was a bad time, but I still had some hope,"" she said, ""for the future. I loved my wife. I loved my daughter. I loved my son. I loved my neighbor.""  ""You still have your heart in the right place, lamech,"" she said. ""But I'm sorry. You're a","Ada fødte Jabal; han blev Stamfader til dem, der bor i Telte og holder Kvæg;","Adah gave birth to Jabal, who was the father of those who dwell in tents and have livestock.",7,2,98
" De boede begge i Niburt. De rejste til Asiat, men der havde de alle sammen drukket. Da de kom til Asiat,","  Tatiana: Are there any other interesting aspects about this article?  Ann-mari: The second wife, a daughter of a famous merchant, was called Mada, and the third Mada was called Zillah.  Tatiana: Did they have any children?  Ann-mari: In the middle ages, the Arabs adopted the","Ada fødte Jabal; han blev Stamfader til dem, der bor i Telte og holder Kvæg;","Adah gave birth to Jabal, who was the father of those who dwell in tents and have livestock.",8,2,98
.<|endoftext|>,"    ""I was a slave to the master.    ""I never could understand him.    ""I wanted to be free, but he had the power to keep me.    ""I was scared, but I never wanted to hurt anyone.    ""I was scared to death.    ""I tried to kill him, but he","Ada fødte Jabal; han blev Stamfader til dem, der bor i Telte og holder Kvæg;","Adah gave birth to Jabal, who was the father of those who dwell in tents and have livestock.",9,2,98
" Hans far hed erasimel. Men Isak var en stor mand. Han gjorde sig to hustruer, den ene hed Abir. Men a"," The Lamech family was the largest of all the tribes of the tribe of Lebanon.  The tribe of Lebanon was a tribe of Lebanese, who were descended from the tribe of Jebus who had ruled in the land of the Amorites. The tribe of Lebanon had a very large population. They were the descendants of the","Ada fødte Jabal; han blev Stamfader til dem, der bor i Telte og holder Kvæg;","Adah gave birth to Jabal, who was the father of those who dwell in tents and have livestock.",10,2,98
