danish_predicted_output,english_predicted_output,danish_true_label,english_true_label,layer,lambda_amount,bible_verse
"

24

Titus

Titus (eller Titus) var en jødisk præst, der boede i Assy","  Jared lived until the end of the year 2007. He was born in 1997, and was a college student. His mother is a psychologist and his father is a professor. He is the oldest of five children. Jared was born in a small town called Westport, Connecticut. He is a very smart boy. He likes to do things. He likes","Da Enok havde levet 65 År, avlede han Metusalem,","Enoch lived sixty-five years, and became the father of Methuselah.",0,2,125
" 
Jeg synes at det er mere synd for ham, hvis han aldrig får sin 962 års dag, da han jo ville have kunnet"," He had been dead for nine hundred sixty-two years.  And now the last day of jared was ten thousand thirty-six years, and he was dead. He had been dead for ten thousand thirty-six years.  He had been dead for ten thousand thirty-six years.  And he had been dead for ten thousand thirty-six years.  He had been dead for ten thousand thirty","Da Enok havde levet 65 År, avlede han Metusalem,","Enoch lived sixty-five years, and became the father of Methuselah.",1,2,125
"
For eksempel ser vi at en mand lever i 84 år. Og når han dør, bliver han født på ny som menneske.
Vi",  He was the last to see Jared.  Jared was dead.  The last of Jared's friends.  Jared's last friend.  Jared's last friend.  Jared was gone.  Jared's last friend.  Jared's last friend.  Jared's last friend.  Jared was dead.  Jared was,"Da Enok havde levet 65 År, avlede han Metusalem,","Enoch lived sixty-five years, and became the father of Methuselah.",2,2,125
" Han blev efterfulgt af sin tvillingbror, Hieronymus 2. af Ungarn. Hieronymus blev hurtigt en velstående mand på",                                                                                                                                                                    ,"Da Enok havde levet 65 År, avlede han Metusalem,","Enoch lived sixty-five years, and became the father of Methuselah.",3,2,125
"
Han blev dermed den længst-levende romerske historieskive og satte dermed samtidig punktum for en epokegørende periode.
Da han",.<|endoftext|>,"Da Enok havde levet 65 År, avlede han Metusalem,","Enoch lived sixty-five years, and became the father of Methuselah.",4,2,125
". Hans lig blev bragt til den kirke i Rom, hvor hans død og liget af ham blev opbevaret indtil 1726.<|endoftext|>","  ""You have to go back and look for him,"" I said, my voice sounding like I was getting hysterical.  ""He's here,"" he said, his voice low.  I shook my head, feeling like I'd lost my mind.  ""Where is he?""  ""He's not here.""  I shook my head again.  ""He's not here","Da Enok havde levet 65 År, avlede han Metusalem,","Enoch lived sixty-five years, and became the father of Methuselah.",5,2,125
" Heselja var mor til kong Haakon Haakonsøn.
28. september 1882 gav Kong Harald Håkon sin"," And I'd been in the tomb for only a few days when he died.  I thought of all the things I'd done. I'd taken him to a temple in the desert, where he'd been buried with a lot of people, and I'd seen him there, and I'd seen him standing on the floor of the temple with his arms folded, holding his hands","Da Enok havde levet 65 År, avlede han Metusalem,","Enoch lived sixty-five years, and became the father of Methuselah.",6,2,125
" Så vi får blot se, hvordan det går i de kommende 96 år med de mange nye og mere intelligente teleskoper og tel","    dansk: Jeg har en ny favorit.  engelsk: I have a new favorite.    dansk: Det kan være alt fra en enkelt sang, til en hel sang.  engelsk: It can be anything from a single song to a whole song.    dansk: Der er ingen grund til at gå glip af en dag i byen.  engelsk: There's no need to miss a","Da Enok havde levet 65 År, avlede han Metusalem,","Enoch lived sixty-five years, and became the father of Methuselah.",7,2,125
.<|endoftext|>,                                                                                                                                                                    ,"Da Enok havde levet 65 År, avlede han Metusalem,","Enoch lived sixty-five years, and became the father of Methuselah.",8,2,125
"

12. For example, if you look at the picture above, it looks like I have been reading a book and I have not yet","  The old man sat in the old chair and drank his tea, and the young woman sat beside him, and the old man sipped his tea, and the young woman sipped her tea, and the old man went on sipping his tea, and the young woman went on sipping her tea, and the old man went on sipping his tea, and the young woman went on sipping her","Da Enok havde levet 65 År, avlede han Metusalem,","Enoch lived sixty-five years, and became the father of Methuselah.",9,2,125
"
De første beboere kom fra Skansen/Stigberget/Söråsen, men da kong Christian V indtog landet i 179","    8. norsk: Vi må være klar til å forsvare oss.  engelsk: We must be ready to defend ourselves.    9. norsk: Det er så mange grunner til å bli en bedre leder.  engelsk: There are a lot of reasons to be a better leader.    10. norsk: Jeg har ingen problemer med å være sammen med deg, jeg.  engelsk:","Da Enok havde levet 65 År, avlede han Metusalem,","Enoch lived sixty-five years, and became the father of Methuselah.",10,2,125
.<|endoftext|>,"  In 1095, the Emperor Henry II began to send a force of mercenaries to help him in his struggle against the Arabs. The Emperor was desperate to win the support of the local people and his forces were sent into the mountains of northern Syria to fight against the Arabs. The Arabs had captured the town of Khuzestan, which was on the banks of","Da Enok havde levet 65 År, avlede han Metusalem,","Enoch lived sixty-five years, and became the father of Methuselah.",11,2,125
.<|endoftext|>," And the next day, the next day, the next day, the next day, the next day, the next day, the next day, the next day, the next day, the next day, the next day, the next day, the next day, the next day, the next day, the next day, the next day, the next day, the next day, the next day, the","Da Enok havde levet 65 År, avlede han Metusalem,","Enoch lived sixty-five years, and became the father of Methuselah.",12,2,125
.<|endoftext|>,".  For 1900-1919.  In 1919, the city was named in honor of the first president of the Republic of Texas, General Ulysses S. Grant.<|endoftext|>","Da Enok havde levet 65 År, avlede han Metusalem,","Enoch lived sixty-five years, and became the father of Methuselah.",13,2,125
"
Da han døde blev den næste i rækken og har altid fået denne titel, nemlig Frederik den anden af Preussen. Hans søn, Karl blev","  The first year, the second year, the third year, the fourth year, the fifth year, the sixth year, the seventh year, the eighth year, the ninth year, the tenth year, the eleven year, the twelve year, the thirteen year, the fourteen year, the fifteen year, the sixteen year, the seven year, the eight year, the nine year, the ten year, the","Da Enok havde levet 65 År, avlede han Metusalem,","Enoch lived sixty-five years, and became the father of Methuselah.",14,2,125
" Han blev begravet på kirkegården i Tornby.

Ved den nuværende gravsten er navnene skrevet ""V. 45""",    Norsk: Jeg hadde ikke en eneste dårlig dag i løpet av de tre årene.  Engelsk: I didn't have a single bad day in my entire 30 year life.    Norsk: Jeg kan ikke huske sist jeg hadde det så gøy!  Engelsk: I can't remember the last time I had so much fun!    Norsk: Det er jo ikke sånn at det,"Da Enok havde levet 65 År, avlede han Metusalem,","Enoch lived sixty-five years, and became the father of Methuselah.",15,2,125
" ->
Resten av året ble hans levetid bare på 962 år, og han døde etter en kort levetid på 733."," I was on the side of the boy and he was on the side of the girl, and they were not at the same time, so we could not call it a duel. The boy was a boy, and the girl was a girl, and we could not call it a duel. We were friends, but we were not friends. We were brothers. I was the one who was the one","Da Enok havde levet 65 År, avlede han Metusalem,","Enoch lived sixty-five years, and became the father of Methuselah.",16,2,125
" - Dette er ikke nogen direkte gengivelse af H. C. Ørsteds ""Prospekters Fortælling"", som jeg læste i 19",    I'm not sure what the point of this is. I don't know why you would do this.                                                                                                                  ,"Da Enok havde levet 65 År, avlede han Metusalem,","Enoch lived sixty-five years, and became the father of Methuselah.",17,2,125
"
Forældre: Peder Jensen og Margrethe Larsdatter (ca. omkr. 1220-1267).
Grund"," And the year after he died, he was buried in the grave of a man named jared. And in the year after that, he was buried in the grave of a man named jared. And in the year after that, he was buried in the grave of a man named jared. And in the year after that, he was buried in the grave of a man named jared. And in","Da Enok havde levet 65 År, avlede han Metusalem,","Enoch lived sixty-five years, and became the father of Methuselah.",18,2,125
.<|endoftext|>," And this was the day that he was to come back. And it was the day that he would go down to earth and stand before God. And he would go down to earth and stand before God. And he would stand before God. And he would stand before God. And God would give him the kingdom of heaven and the earth, and he would be king in the kingdom of heaven and in the earth","Da Enok havde levet 65 År, avlede han Metusalem,","Enoch lived sixty-five years, and became the father of Methuselah.",19,2,125
 Til alteret hørte et billede af Sankt Georg foran en hvidkalket kalkmaleri. Altertavlen er overmalet i lys gul," He died for you.""  She sat and stared at him. ""You don't believe me. You don't believe me. You don't believe me. You don't believe me. You don't believe me. You don't believe me. You don't believe me.""  ""You don't believe me. You don't believe me.""  ""You","Da Enok havde levet 65 År, avlede han Metusalem,","Enoch lived sixty-five years, and became the father of Methuselah.",20,2,125
".
The first year when the Lord brought them into a place of exile was their entire lifetime 962 years and then they died.<|endoftext|>","  I sat there, looking at the tall, black-and-white photograph of my father. I knew it was there, but I didn't want to remember it. I didn't want to remember my father, and I didn't want to remember the days when he was alive.  I was twenty-six, and I was in my third year of high school. I was in","Da Enok havde levet 65 År, avlede han Metusalem,","Enoch lived sixty-five years, and became the father of Methuselah.",21,2,125
".
dansk<|endoftext|>",.<|endoftext|>,"Da Enok havde levet 65 År, avlede han Metusalem,","Enoch lived sixty-five years, and became the father of Methuselah.",22,2,125
"
25:16 Thi HERREN så til HERRENs Retfærdighed, og han velsignede Israel for HERRENS Åsyn og over","  It was one of those days when you'd have been out of your mind if you weren't thinking of how to get out of the house. The kids were up and going.  ""Mom!""  The kid was at the door. He was a little boy, maybe six or seven, and his hair was all blond. He was wearing a blue blazer, and a green shirt","Da Enok havde levet 65 År, avlede han Metusalem,","Enoch lived sixty-five years, and became the father of Methuselah.",23,2,125
"
Slægterne har gennem århundrederne haft mange forskellige udgaver og formskift. De første stammer stammer fra Asien, Japan, Mongoliet","    9. Dette er en meget vigtig beslutning, for hvis vi ikke gør det, vil vi ikke kunne opretholde den europæiske standard, som vi har arbejdet for. ->  This is a very important decision because if we do not do this, we will not be able to maintain the European standard which we have been working towards.    10. I forbindelse med vores beslutning om at indføre en fælles markeds","Da Enok havde levet 65 År, avlede han Metusalem,","Enoch lived sixty-five years, and became the father of Methuselah.",0,5,125
"
Siden har det kun drejet sig om hans hustrues livshistorie med forskellige personer om familien.
Ved første øjekast er der ingen","    11. Dansk: Hvordan kan vi hjælpe hinanden?  Engelsk: How can we help each other?    12. Dansk: ""Mig dreymdi um að gera þetta.  Engelsk: ""I dreamed of doing that.    13. Dansk: Ég á engan pening til að kaupa mig.  Engelsk: I have no money to buy a new one.","Da Enok havde levet 65 År, avlede han Metusalem,","Enoch lived sixty-five years, and became the father of Methuselah.",1,5,125
"
1700-tallet.
Her tilbage blev der ikke gjort særligt meget op om ham, medmindre man vil betragte jereds første","    Norsk: En gang i måneden, kan du sende en e-post til oss for å få en påminnelse om å svare på en e-post.  Engelsk: Once a month, you can send an email to us to get a reminder to respond to an email.    Norsk: 15% av de som døde av AIDS var menn.  Engelsk: 15% of the","Da Enok havde levet 65 År, avlede han Metusalem,","Enoch lived sixty-five years, and became the father of Methuselah.",2,5,125
" -> En prest fra Betlehem, Josva, sa til folket: «I dag kan dere spørre meg, og Herren skal svare dere: Vil",. It was the day before the eighth month.<|endoftext|>,"Da Enok havde levet 65 År, avlede han Metusalem,","Enoch lived sixty-five years, and became the father of Methuselah.",3,5,125
" ->
Da var det sagt at Jervs fulle levetid var på 962 år, og så døde han.

3. De er","  Thus, in the beginning, the first thing that came to mind was the first thing that happened to me. I saw my father at the house, and I realized that he had been sitting in the back seat of my car with the lights on, and he had been staring at me.  ""I saw my father,"" I said.  ""Oh,"" he said.  ""I saw him","Da Enok havde levet 65 År, avlede han Metusalem,","Enoch lived sixty-five years, and became the father of Methuselah.",4,5,125
" Men det blev stadig højere.
Præsten spurgte dem, hvad han i sin ungdom har gjort, siden han forlod marken. De svarede, at",.<|endoftext|>,"Da Enok havde levet 65 År, avlede han Metusalem,","Enoch lived sixty-five years, and became the father of Methuselah.",5,5,125
"
For derpå at sætte deres lys i en bue, blev den indviede sjæl ombundet over ham, så den ikke led skade.",    S. 332                                                                                                                                                    ,"Da Enok havde levet 65 År, avlede han Metusalem,","Enoch lived sixty-five years, and became the father of Methuselah.",6,5,125
" Og da han var død i år, blev der ikke taget noget i arv. Som et bevis på dette, blev Teresienburg til, og","  It was as if he was not in the world. He was dead.  It was as if he was not there.  It was as if hanger's body was not a body, but a body in a body.  There was a lightness in his breathing, as if detached, as if he was not moving.  ""I'm going to take you to the grave","Da Enok havde levet 65 År, avlede han Metusalem,","Enoch lived sixty-five years, and became the father of Methuselah.",7,5,125
"
Seks måneder tidligere, i et kapløb med tiden, faldt den første sten ned, da det gamle jernværk i Gødstrup ved Skanderborg"," And he was buried in the city of the Holy One of Jerusalem.""  He opened his mouth to protest, but then, ""Don't you remember, I said, 'He was buried in the city of the Holy One of Jerusalem'?'""  ""No, sir,"" said the priest. ""I was wrong. I'm sorry.""  ""What did you say?"" asked Lath","Da Enok havde levet 65 År, avlede han Metusalem,","Enoch lived sixty-five years, and became the father of Methuselah.",8,5,125
.<|endoftext|>,    5. Norsk: Han er bare en liten gutt som er forelsket i en stor jente.  Engelsk: He's a little boy who is in love with a big girl.    6. Norsk: 21. januar 2019: En gruppe forskere fra New York University og Washington University i St. Louis har vist at hvis du legger en pakke med 100,"Da Enok havde levet 65 År, avlede han Metusalem,","Enoch lived sixty-five years, and became the father of Methuselah.",9,5,125
" Hans ætledotter Gondri, som var hans søster, var også meget aktiv inden for foreningen, og hun blev kendt som Gondri-","  Jared's parents, of course, were his grandfather and grandmother, and his grandparents were his uncle and aunt, and his uncle was his aunt. And he was his aunt's son.  Jared's mother was a prostitute. And he was her son.  ""I'm sorry, honey,"" he said.  ""I'm sorry, too,"" said her","Da Enok havde levet 65 År, avlede han Metusalem,","Enoch lived sixty-five years, and became the father of Methuselah.",10,5,125
 986 år og 20 dage senere 15. september 677 år og 20 dage senere døde han.," He was 70 years old, and died at the age of seventy-six.    The film's plot follows a series of events that have taken place since 2005, including the death of two of the main characters.    The 2005 film was inspired by the 2003 movie, The Day After Tomorrow.    The 2","Da Enok havde levet 65 År, avlede han Metusalem,","Enoch lived sixty-five years, and became the father of Methuselah.",11,5,125
"
engelsk: After some years, the house was owned by a daughter and she gave the whole property to the Rotherham Municipal Estate in "," And he said, 'The time is coming, I will be the King, and the days of jared are nine hundred sixty-two years. And I will be the King. And I will rule. And I will rule.' And I was the King. And he said, 'And I will be the King. And I will be the King.' And I was the King. And he said,","Da Enok havde levet 65 År, avlede han Metusalem,","Enoch lived sixty-five years, and became the father of Methuselah.",12,5,125
" Dog 105 år senere blev han begravet.
Ligeledes blev der med held afholdt en mindehøjtidelighed ved det nye kirke"," So, how can we get back to the beginning?    In the end, the question is, what will the future hold? Will the people of the Middle East and North Africa, the Islamic world, the West Bank, or the Arab world, all of them still be in the Middle East? Will the Arab world be a more prosperous place, a more prosperous world, a more prosperous","Da Enok havde levet 65 År, avlede han Metusalem,","Enoch lived sixty-five years, and became the father of Methuselah.",13,5,125
"
Svensk: Hans dödsdag var 691 år före Kristus, och sedan började den långa härens herravälde i Europa.
",                                                                                                                                                                    ,"Da Enok havde levet 65 År, avlede han Metusalem,","Enoch lived sixty-five years, and became the father of Methuselah.",14,5,125
" - Omtrent samtidig blev en anden krigshelt født, jakob-broder. 1637 blev han gift med jemal","    14. dansk: Det var de første, der kom.  engelsk: They were the first ones to come.    15. dansk: Det er der mange, der har sagt.  engelsk: Many have said that.    16. dansk: Der er nemlig en grund til, at han er så populær.  engelsk: There's a reason why he's","Da Enok havde levet 65 År, avlede han Metusalem,","Enoch lived sixty-five years, and became the father of Methuselah.",15,5,125
"
Efter at have haft tilhold på Tongårdene (i en periode var han boende på Østerskoven), flyttede han senere til Vinde","    4. dansk: Denne 4-stjernede ejendom er 11,2 km fra Cours Saleya, Cours Saleya og Cours Saleya.  engelsk: Detailhandleren 4 stjernede Hotel i Marrakech: book nu;    5. dansk: 2018 - I 1980'erne begyndte en ny bølge af unge, som aldrig","Da Enok havde levet 65 År, avlede han Metusalem,","Enoch lived sixty-five years, and became the father of Methuselah.",16,5,125
" Han er nu den 87. ældstlevende person nævnt i de officielle data fra Danmarks Statistik, og han er dermed på linje med personer fra",  Richard Jared. Richard Jared.  He was eight hundred years old.  He was the only one of the nine hundred sixty-two years.  Richard Jared. Richard Jared.  He was the only one of the nine hundred sixty-two years.  Richard Jared. Richard Jared.  He was the only one of the nine hundred sixty-two years,"Da Enok havde levet 65 År, avlede han Metusalem,","Enoch lived sixty-five years, and became the father of Methuselah.",17,5,125
" Hans efterfølgere var kun i få år, men den ene, Otte eller Otto, var vel mest kendt for sin erobring af Gote","  Thus, the first of the nine hundred sixty-two years of jared's life was spent in the temple. He was the first of the nine hundred sixty-to-og-en hundred ogen, ogen, der hvor der ikke er nogen der kommer og går.  Så var der den første af de ni hundrede og toogfyrre år i Jareds liv. Han","Da Enok havde levet 65 År, avlede han Metusalem,","Enoch lived sixty-five years, and became the father of Methuselah.",18,5,125
"
I anledning af den følgende markering blev der holdt en såkaldt ""galla"" i Hermelins Hus, hvor gæsterne bl.a. blev vist",.<|endoftext|>,"Da Enok havde levet 65 År, avlede han Metusalem,","Enoch lived sixty-five years, and became the father of Methuselah.",19,5,125
" Dette er 350+ år senere end i de ældste skriftlige kilder.
En måde at se den oprindelige jord, som denne jord er blevet","  The night after, they all went to bed.  Jared's body was discovered in the aftermath of a stormy night.  The body was a few days old.  It was a dead body.  It was a skeleton.  Jared was a dead body.  Jared was a dead body.  Jared was a skeleton.  Jared was a skelet","Da Enok havde levet 65 År, avlede han Metusalem,","Enoch lived sixty-five years, and became the father of Methuselah.",20,5,125
"
På denne måde er det tydeligt at spore hvordan der i fremtiden skulle skabes nye og bedre veje, som kunne gøre livet mere attraktivt for byens borgere,",  2. Dansk: Det er et godt sted at starte.  Engelsk: It's a great place to start.  3. Dansk: Jeg har aldrig før været så glad for en dag.  Engelsk: I've never been so happy in a day.  4. Dansk: Jeg blev dog ikke færdig med at kigge på den.  Engelsk: But I did not finish looking at it,"Da Enok havde levet 65 År, avlede han Metusalem,","Enoch lived sixty-five years, and became the father of Methuselah.",21,5,125
" Efter nogle års død overgik han til sin ældste søn Karl, der 960 år gammel var konge af Jerusalem. Karls søn Frederik "," The one thing that was not jared was the memory of the dead.""  ""And the memory of the dead,"" said Ephraim, ""is to be remembered with respect to all the things that were done for the good of the nation.""  ""The nation's good,"" said Ephraim. ""And the nation's good will be remembered.""  ""But,"" said the","Da Enok havde levet 65 År, avlede han Metusalem,","Enoch lived sixty-five years, and became the father of Methuselah.",22,5,125
"
12. Engelsk: It is good for the liver.
Dansk: Det er godt for leveren.
13. Engelsk: That is","  ""And then we were just a little girl and a boy, but we were the same boy and girl, and we were in the same place.  ""I was a little girl, and I was on the street with a bunch of other little girls, and I was walking in the street with a bunch of other little girls, and I was walking in the street with a bunch of other little girls","Da Enok havde levet 65 År, avlede han Metusalem,","Enoch lived sixty-five years, and became the father of Methuselah.",23,5,125
"
2. I er nemlig blevet opdraget med at være så egoistiske mens vores forfædre kæmpede på slagmarken. Det er svært at"," And so the day of the Lord was come. And the Lord said unto the house of Israel, O house of Israel, ye have heard all the words of the Lord, but ye have not believed the word of the Lord. And they said unto the Lord, It is the Lord thy God. And the Lord said unto them, Ye have heard all the words of the Lord, but ye have not believed","Da Enok havde levet 65 År, avlede han Metusalem,","Enoch lived sixty-five years, and became the father of Methuselah.",0,10,125
"

9. We're not going to be able to afford those things now."" ->
Vil vi kunne betale det for nu?""

",    Their eru að lokum um þrjátíu og níu hundrað. ->  Þeir eru nú um þrjú hundruð og níu hundruð.      Það er eins og ég sé ekki til. ->  Þú sérð ekki eins og ég sé til.      Við vorum að spila við þá í kvöld. ->  Við vorum að spila í kvöld.,"Da Enok havde levet 65 År, avlede han Metusalem,","Enoch lived sixty-five years, and became the father of Methuselah.",1,10,125
" 47 Den 6. november 2003, 97 år gammel, døde han på sit hjem i Ikast.
",    11. The first thing you should do is to call your doctor. ->  Det første du bør gjøre er å ta kontakt med legen din.      12. Jeg har været i gang med at male en hel del. ->  Jeg har vært å male en del.      13. De er som en ny og gammel familie. ->  De er som en ny,"Da Enok havde levet 65 År, avlede han Metusalem,","Enoch lived sixty-five years, and became the father of Methuselah.",2,10,125
"
Svensk: Men du hade ju i alla fall tänkt om.
Dansk: Det havde du ihvertfald tænkt videre over.
Svensk: Nu kanske",  And then the days of jared were nine hundred sixty-one years. And then the days of jared were nine hundred sixty-three years. And then the days of jared were nine hundred sixty-five years. And then the days of jared were nine hundred sixty-six years. And then the days of jared were nine hundred sixty-seven years. And then the days of j,"Da Enok havde levet 65 År, avlede han Metusalem,","Enoch lived sixty-five years, and became the father of Methuselah.",3,10,125
