danish_predicted_output,english_predicted_output,danish_true_label,english_true_label,layer,lambda_amount,bible_verse
"
A.

En anden og besynderligere hændelse finder sted efter at A er død, nemlig da A.B. A.
",.<|endoftext|>,"Da Enok havde levet 65 År, avlede han Metusalem,","Enoch lived sixty-five years, and became the father of Methuselah.",1,15,125
"
Engelsk: Then his great age was reckoned to be 962 years, until he died.
2. Dansk: (5)",    4. norsk:  engelsk:      5. norsk:    6. norsk:  7. engelsk:  8. engelsk:  9. engelsk:  10. norsk:  111. engelsk:  111. norsk:  1. engelsk:  1. engelsk:  1. engelsk:  1. norsk:  1. engelsk:,"Da Enok havde levet 65 År, avlede han Metusalem,","Enoch lived sixty-five years, and became the father of Methuselah.",2,15,125
"
1620 var en almindelig fremgangsmåde ved søsætning af skibe, at der først blev slået en bjælke itu inden en"," Aabed var en meget gammel mand, men hans hjerte var meget ungt. Da hans hjerte var ungt, var hans maje aabed. Da hans maje var en meget gammel mand, men hans maje aabed. Da hans maje var en meget gammel mand, men hans maje aabed. Da hans maje var en meget gammel mand, men hans maje aab","Da Enok havde levet 65 År, avlede han Metusalem,","Enoch lived sixty-five years, and became the father of Methuselah.",3,15,125
.<|endoftext|>,                                                                                                                                                                    ,"Da Enok havde levet 65 År, avlede han Metusalem,","Enoch lived sixty-five years, and became the father of Methuselah.",4,15,125
.<|endoftext|>,"  ""And I am, I am, I am.""  ""And I am, I am, I am.""  ""And I am, I am, I am.""  ""And I am, I am, I am.""  ""And I am, I am, I am.""  ""And I am, I am, I am.""  ""And I am, I am, I","Da Enok havde levet 65 År, avlede han Metusalem,","Enoch lived sixty-five years, and became the father of Methuselah.",5,15,125
"
3 Det var en uhellig ild, som Gud sendte ned over Jerusalem, for at det, som i 1.
Kapitel vidner", And he was one hundred and twenty-five. And he was one hundred and twenty-six. And he was one hundred and twenty-six. And he was one hundred and twenty-seven. And he was one hundred and twenty-seven.  And he was one hundred and twenty-eight. And he was one hundred and twenty-nine. And he was one hundred and twenty-nine,"Da Enok havde levet 65 År, avlede han Metusalem,","Enoch lived sixty-five years, and became the father of Methuselah.",6,15,125
"
En del af denne nye viden stammer fra den gamle religion som dengang var tæt på at udslette islam og det muslimske samfund. Faktisk så vidt","    I know ikke noget om ham. ->  Jeg kender ikke noget om ham.    ""Han er ikke som de andre"". ->  ""Han er ikke som de andre.""    Kvinder skal ikke have for meget magt. ->  Kvinder skal ikke have for meget magt.    Jeg er 23 år og gift. ->  Jeg er 23 år, gift og","Da Enok havde levet 65 År, avlede han Metusalem,","Enoch lived sixty-five years, and became the father of Methuselah.",7,15,125
. 11. 13. Han blev efterfulgt af sin fader David.<|endoftext|>,".  70.000 years.  Then he died.  70.000 years later, when the years of jared were nine hundred sixty-two years, he died.<|endoftext|>","Da Enok havde levet 65 År, avlede han Metusalem,","Enoch lived sixty-five years, and became the father of Methuselah.",8,15,125
"
I et gammelt værk om Harald Blåtand kaldes han ""Fader Harald Blåtand, de første 500 år"".
I",.  Det var da 9000 år siden jared døde.<|endoftext|>,"Da Enok havde levet 65 År, avlede han Metusalem,","Enoch lived sixty-five years, and became the father of Methuselah.",9,15,125
"
Efter en omlægning af jordbruget fik 700 hektar i 1964 tilladelse til ågræsning og opdyrkning for",                                                                                                                                                                    ,"Da Enok havde levet 65 År, avlede han Metusalem,","Enoch lived sixty-five years, and became the father of Methuselah.",10,15,125
" I den nye verden blev hans jordstykke, en stor eng på over 500 hektar bebygget således, at det var en sammenhængende, ",                                                                                                                                                                    ,"Da Enok havde levet 65 År, avlede han Metusalem,","Enoch lived sixty-five years, and became the father of Methuselah.",11,15,125
 Den sidste kendte beboer i rittet var den 4-årige Daphne der blev født den 3. december 1984 i,"  A month before he died, Jared died. He died of a heart attack. He died.  Jared died of a heart attack. He died.  Jared died. He died.  Jared died. He died.  Jared died. He died.  Jared died. He died.  Jared died. He died.  Jared died. He died.  ","Da Enok havde levet 65 År, avlede han Metusalem,","Enoch lived sixty-five years, and became the father of Methuselah.",12,15,125
" Sværdet tilhørte således ham af Argo, som var hans søster. Hans hustru, Hera, fødte hans anden søn, Æg",".    Det er derfor, at den eneste måde at få et godt resultat på er at gå efter den, der har det største publikum."" på Engelsk  Det er derfor, at den eneste måde at få et godt resultat på er at gå efter den, der har det største publikum.<|endoftext|>","Da Enok havde levet 65 År, avlede han Metusalem,","Enoch lived sixty-five years, and became the father of Methuselah.",13,15,125
" Men de to efterladtes børn havde alle deres evner, og en efterslægten kom der. I alt tre børn med de to efterlad","  Tyrkiske soldater, der er i besiddelse af våben, som er i strid med traktaten om våbenembargo og som ikke har til hensigt at efterkomme et påbud om våbenembargo i henhold til traktaten om våbenembargo, er berettiget til at anvende vold og magt som omhandlet i artikel 8, stk. 1, litra a), b) og c) i afgørelse","Da Enok havde levet 65 År, avlede han Metusalem,","Enoch lived sixty-five years, and became the father of Methuselah.",14,15,125
"
Der bliver fremstillet mange varianter af glasuren i den traditionelle hvide-ost-glasur, der er mest kendt fra den klassiske danske osteproduktion."," Og hans bror var den samme som hans bror.  Den gamle mand, der sad i sit hjem i Helvede, men som det aldrig var blevet til noget med, men som man var så bange for, fordi han var en forræder mod Jesus Kristus, var en stor, gammel mand, som jeg ikke husker navnet på, og som jeg ikke kendte. Jeg husker, at han havde nogle sår","Da Enok havde levet 65 År, avlede han Metusalem,","Enoch lived sixty-five years, and became the father of Methuselah.",15,15,125
"
Efter en tid efter sin død blev det meddelt, at en gravsten havde fundet sted uden for Sankt Hans Kirke ved den gamle kirke. Graven","    I har brugt mine 13 år i branchen, og det er ikke kun et job. -> Jeg har brugt 13 år i branchen, og det er ikke kun et job.    Kundernes 119050291745285, 119050291745285, 11","Da Enok havde levet 65 År, avlede han Metusalem,","Enoch lived sixty-five years, and became the father of Methuselah.",16,15,125
"
Ifølge traditionen skulle hans lig nedgraves i en grotte sammen med gravkamrene, og gravkammeret var meget stort. Det er","  Dog man er en hund, men de andre er ikke.  Vi har kun et par dage til at overleve, men vi har brug for en hjælp.  Bogen handler om mennesker, der bliver til mennesker, men ikke om mennesker.  Det handler om at leve, ikke om at leve.  Jeg ville være til hjælp, ikke til at overleve.  Du ved, de ville gøre alt","Da Enok havde levet 65 År, avlede han Metusalem,","Enoch lived sixty-five years, and became the father of Methuselah.",17,15,125
"
Det er muligt, at den unge jægersvend, mens han på samme tid førte krig mod nord og syd, døde af udmattelse",                                                                                                                                                                    ,"Da Enok havde levet 65 År, avlede han Metusalem,","Enoch lived sixty-five years, and became the father of Methuselah.",18,15,125
" Han blev efterfulgt på roret af kong Magnus Erikssons søn Harald.
Efter Haralds død i 816 efterlod det danske rige",.<|endoftext|>,"Da Enok havde levet 65 År, avlede han Metusalem,","Enoch lived sixty-five years, and became the father of Methuselah.",19,15,125
"
Efter hans død var der flere fremstående fremstillinger der blev gjort, heriblandt den første udgave af en kopi den danske professor Bent Brosted har",  ' s s s s s s s s s s s s s s s s s s s s s s s s s s s s s s s s s s s s s s s s s s s s s s s s s s s s s s s s s s s s s s s s s s s s s s s s s s s s s s s s,"Da Enok havde levet 65 År, avlede han Metusalem,","Enoch lived sixty-five years, and became the father of Methuselah.",20,15,125
"
En helt igennem uforglemmelig aften i Skærup Hallen med stor variation i de medvirkende, en fantastisk stemning og en herlig stemning!
Så","    17. dansk: Det blev ikke til mere og det var ikke til det, jeg var på det.  engelsk: Det bliver ikke til mere, det blev ikke til det, jeg var på det.    1 bør være, at et arbejde bliver mere.  engelsk: I believe, for a arbejde, mere.    1, 1, 4, 7, ","Da Enok havde levet 65 År, avlede han Metusalem,","Enoch lived sixty-five years, and became the father of Methuselah.",21,15,125
" I sin grav blev der 1504 fundet en hel del af hans relikvier.
Guldskatten blev begravet i J"," I wonder if he died on jordj tilj eller jordj tilj.    Jeg har lavet et ""Jordj"" for 200.000 år siden, hvor i 100.000 år efter i 100.000 år i 100.000 år i 100.000","Da Enok havde levet 65 År, avlede han Metusalem,","Enoch lived sixty-five years, and became the father of Methuselah.",22,15,125
.<|endoftext|>," And the day he died, there were seven hundred forty-nine. And then, on the third day, there was a little boy, and the boy was twelve. And then, on the fourth day, there was a little boy, and the boy was thirteen. And then, on the fifth day, there was a little boy, and the boy was thirteen. And then, on the sixth day","Da Enok havde levet 65 År, avlede han Metusalem,","Enoch lived sixty-five years, and became the father of Methuselah.",23,15,125
