danish_predicted_output,english_predicted_output,danish_true_label,english_true_label,layer,lambda_amount,bible_verse
"
Så vi er altså ude i noget ekstremt koldt vand, men det er meget sjældent man mærker på den måde, og vandet er klart og ikke gr"," The water was the same as before. The earth rested on the waters. The waters were the same as before. The earth was the same as before.  ""The earth rested on the waters""  What happened to the waters?  ""The earth was the same as before""  What happened to the earth?  ""The waters were the same as before""  What","På den syttende Dag i den syvende Måned sad Arken fast på Ararats Bjerge,","The ship rested in the seventh month, on the seventeenth day of the month, on Ararat's mountains.",0,2,186
" Det er helt sikkert noget af det stærkeste, der tidligere er set i området.

Tæveflokken på 8 tæver blev", after the end of one hundred fifty days the waters increased. After the end of one hundred fifty days the waters decreased. The water was very shallow and the air very cold. The air was very cold. The water was very shallow and the air very cold. The air was very cold. The water was very shallow and the air very cold. The air was very cold. The water was,"På den syttende Dag i den syvende Måned sad Arken fast på Ararats Bjerge,","The ship rested in the seventh month, on the seventeenth day of the month, on Ararat's mountains.",1,2,186
" Det er kun to procent af det grundvand, som kommer fra det danske vandkraftværk, der går til drikkevand i Danmark. Det skyldes,"," 4000 years the waters were still rising, but now they were falling. 4000 years the waters receded, but now they rose. 4000 years the waters were still rising, but now they were falling. 4000 years the waters receded, but now they rose. 4000 years the waters","På den syttende Dag i den syvende Måned sad Arken fast på Ararats Bjerge,","The ship rested in the seventh month, on the seventeenth day of the month, on Ararat's mountains.",2,2,186
" Man får en ide om, at der er en særlig slags vand. Ved en lang periode som denne var der et langt større vandforbrug. Hvorimod",.<|endoftext|>,"På den syttende Dag i den syvende Måned sad Arken fast på Ararats Bjerge,","The ship rested in the seventh month, on the seventeenth day of the month, on Ararat's mountains.",3,2,186
" Det lod sig ikke gøre at holde en dybde under 3 meter, da mange af stenene begyndte at vælte. Der resterer flere kilometer af"," But the waters rose again to the surface, and the sea rose to the surface. But the sea rose to the surface again.  The water rose to the surface again.  But the water rose to the surface again.  The waters rose again to the surface.  But the waters rose to the surface again.  The waters rose to the surface again.  But the waters rose","På den syttende Dag i den syvende Måned sad Arken fast på Ararats Bjerge,","The ship rested in the seventh month, on the seventeenth day of the month, on Ararat's mountains.",4,2,186
" Det gjorde at isen kunne komme for tæt på det dybe vand igen. Og når vandet kom tæt på isen, kom isen jo for langt væk fra jorden"," and the earth became like a watery lake, and it became like a dry land, and the air became like a dry air, and the sea became like a dry sea, and the air became like a dry air.  But I can't remember what time it was.  I was in the middle of a dream, and it seemed to me that I was walking in a","På den syttende Dag i den syvende Måned sad Arken fast på Ararats Bjerge,","The ship rested in the seventh month, on the seventeenth day of the month, on Ararat's mountains.",5,2,186
" Omgivelserne blev dog ved med at ligne små, opkøbte landsbyer med stråtag, store sten i de mange forhaven og høje h",                                                                                                                                                            ,"På den syttende Dag i den syvende Måned sad Arken fast på Ararats Bjerge,","The ship rested in the seventh month, on the seventeenth day of the month, on Ararat's mountains.",6,2,186
"
Men her kunne de se, at den største udfordring lå i, at der manglede at blive samlet lidt ilt. Da iltindholdet falder, mister",    5. svenska: Det är en fråga om att vara på rätt plats vid rätt tidpunkt.  engelska: It is a matter of being in the right place at the right time.    6. svenska: Men vi har inte hört några klagomål från några kunder.  engelska: But we have not heard any complaints from any customers.    7. svenska: Detta beror på,"På den syttende Dag i den syvende Måned sad Arken fast på Ararats Bjerge,","The ship rested in the seventh month, on the seventeenth day of the month, on Ararat's mountains.",7,2,186
"
Tina havde regnet lidt, efter hun var kommet til stien. Hun gik ud til en af søerne, og hun lagde straks mærke til",.<|endoftext|>,"På den syttende Dag i den syvende Måned sad Arken fast på Ararats Bjerge,","The ship rested in the seventh month, on the seventeenth day of the month, on Ararat's mountains.",8,2,186
"
Et godt eksempel på hvordan et nyt projekt kan ende med at udfolde sig, er projektet ""Miljø, Landskab & Biodiversitet", The earth was gradually receding from the heavens. The earth was gradually receding from the heavens. The earth was gradually receding from the heavens. The earth was gradually receding from the heavens. The earth was gradually receding from the heavens. The earth was gradually receding from the heavens. The earth was gradually reced,"På den syttende Dag i den syvende Måned sad Arken fast på Ararats Bjerge,","The ship rested in the seventh month, on the seventeenth day of the month, on Ararat's mountains.",9,2,186
 Et godt tidspunkt for udrensning af jorden og opblanding ved en eventuel jordoverkørsel. Når vandet har fået en god gennemtrængning og jord,"    Danish: Dette er en meget vigtig begivenhed i livet for den unge mand.  English: This is a very important event in the life of the young man.    Danish: Der er et væld af muligheder for at blive en god og sjov spiller, så længe du har et godt helbred.  English: There are plenty of opportunities to become a good and fun player","På den syttende Dag i den syvende Måned sad Arken fast på Ararats Bjerge,","The ship rested in the seventh month, on the seventeenth day of the month, on Ararat's mountains.",10,2,186
" Vandspejlet nåede kun at synke en halv meter, men det var kun begyndelsen. De forskellige systemer blev lukket og derefter lukket igen. Men hvad",                                                                                                                                                            ,"På den syttende Dag i den syvende Måned sad Arken fast på Ararats Bjerge,","The ship rested in the seventh month, on the seventeenth day of the month, on Ararat's mountains.",11,2,186
"
Følgende år er afbildet under forskellige omstændigheder på foto 1-55.
Den 4. april 2013",                                                                                                                                                            ,"På den syttende Dag i den syvende Måned sad Arken fast på Ararats Bjerge,","The ship rested in the seventh month, on the seventeenth day of the month, on Ararat's mountains.",12,2,186
.<|endoftext|>,"  ""Why do you think so?""  ""Because I am not as beautiful as you.""  ""But you are beautiful.""  ""Not as beautiful as you.""  ""What do you want?""  ""That I be your wife.""  ""What do you want?""  ""That I be your wife.""  ""But you have no children. Why do you not want to","På den syttende Dag i den syvende Måned sad Arken fast på Ararats Bjerge,","The ship rested in the seventh month, on the seventeenth day of the month, on Ararat's mountains.",13,2,186
"
Der blev gravet af i 4-7 dage, men der var for dårligt med materiale, så det kom ikke med i forsøget."," the water was gradually increasing.  the water was gradually increasing.    The main story of the book is the story of the water falling in the river and the river's fall.  The story of the water falling in the river is told by the river, and the story of the river's fall is told by the river.    Input: The story of the water","På den syttende Dag i den syvende Måned sad Arken fast på Ararats Bjerge,","The ship rested in the seventh month, on the seventeenth day of the month, on Ararat's mountains.",14,2,186
"
Jeg kan ikke rigtig forestille mig hvordan det ville ende, men vi må bare se hvilke planer og tanker vores søn og far har og hvilke udfordringer de","  This is the story of a person who is a man, and a man who is a man. He is a man who is a man, and he is a man who is a man. He is a man who is a man, and he is a man who is a man. He is a man who is a man, and he is a man who is a man.","På den syttende Dag i den syvende Måned sad Arken fast på Ararats Bjerge,","The ship rested in the seventh month, on the seventeenth day of the month, on Ararat's mountains.",15,2,186
"
Jeg har på forhånd undersøgt med min svigermor, om jeg kunne komme i kontakt med nogle som helst firmaer, som kunne hjælpe med udgravningen",  The waters returned to the earth.    The water is the source of the earth's water.      The water is the source of the earth's water.      The water is the source of the earth's water.      The water is the source of the earth's water.      The water is the source of the earth,"På den syttende Dag i den syvende Måned sad Arken fast på Ararats Bjerge,","The ship rested in the seventh month, on the seventeenth day of the month, on Ararat's mountains.",16,2,186
"
Da jeg endelig ankom til havet, efter de 150 dage, begyndte man endelig at kunne sige, at det havde været en ganske vellykket",.<|endoftext|>,"På den syttende Dag i den syvende Måned sad Arken fast på Ararats Bjerge,","The ship rested in the seventh month, on the seventeenth day of the month, on Ararat's mountains.",17,2,186
" Når man til sidst har renset en lang række prøver, kan man i nogle tilfælde benytte prøverne, hvis de er gode nok til at blive brugt",.<|endoftext|>,"På den syttende Dag i den syvende Måned sad Arken fast på Ararats Bjerge,","The ship rested in the seventh month, on the seventeenth day of the month, on Ararat's mountains.",18,2,186
" Så det kunne slet ikke ske!
Heldigvis kom der en del sol i weekenden, som fik vandet ned at vende og vandet var nu ret så"," The waters were still a little higher than they had been in the beginning of the year. The waters were rising again; they were rising rapidly, but it was not yet very high; they were rising rapidly, but it was not yet very high. The waters were rising very rapidly, but it was not yet very high. The waters were rising very rapidly, but it was not yet very","På den syttende Dag i den syvende Måned sad Arken fast på Ararats Bjerge,","The ship rested in the seventh month, on the seventeenth day of the month, on Ararat's mountains.",19,2,186
"
Da jorden endelig igen var helt fri for løvfrø, havde den stået i et lille stykke tid.
Da det var sidste gang, jorden",  111. The waters receded from the earth continually  112. The waters receded from the earth continually  113. The waters receded from the earth continually  114. The waters receded from the earth continually  115. The waters receded from the earth continually  116. The waters re,"På den syttende Dag i den syvende Måned sad Arken fast på Ararats Bjerge,","The ship rested in the seventh month, on the seventeenth day of the month, on Ararat's mountains.",20,2,186
". Den næste gang er 25 cm. lavere på toppen af bakken. Det må nu være overstået, sagde manden.<|endoftext|>","  17:11 But the earth began to rise again, and the waters began to fall. 17:12 And the waters rose from the earth again, and the earth began to rise again.  17:13 And the waters rose from the earth again, and the earth began to rise again.  17:14 And the earth began to","På den syttende Dag i den syvende Måned sad Arken fast på Ararats Bjerge,","The ship rested in the seventh month, on the seventeenth day of the month, on Ararat's mountains.",21,2,186
" Men den del er nok mest til fornøjelse. Så vidt jeg kan se, så var der kun et punkt der har ændret sig fra et par hundrede meter","  dansk: Men i det øjeblik, da vandet fornedrede sig fra jorden, blev vandet igen tilbage.  engelsk: The first is the ""Royal Mile"" – the longest, busiest and most expensive street in London.  dansk: Den første er ""Royal Mile"" – den længste, travleste og dyreste gade i London.  engelsk: And the other is","På den syttende Dag i den syvende Måned sad Arken fast på Ararats Bjerge,","The ship rested in the seventh month, on the seventeenth day of the month, on Ararat's mountains.",22,2,186
.<|endoftext|>,  During the last thirty days the waters increased and the earth receded. After the end of one hundred fifty days the waters decreased.  During the last thirty days the waters increased and the earth receded. After the end of one hundred fifty days the waters decreased.  After the end of one hundred fifty days the waters increased and the earth receded.  ,"På den syttende Dag i den syvende Måned sad Arken fast på Ararats Bjerge,","The ship rested in the seventh month, on the seventeenth day of the month, on Ararat's mountains.",23,2,186
"
Når det er sagt, skulle der blot 800-900 meters vand for at dække det helt ude på Øresund. Det", The water did not fall from the earth till the very end of the twenty-sixth day. The waters did not fall from the earth till the very end of the twenty-sixth day.  The waters did not fall from the earth till the very end of the twenty-first day. The waters did not fall from the earth till the very end of the twenty-first day,"På den syttende Dag i den syvende Måned sad Arken fast på Ararats Bjerge,","The ship rested in the seventh month, on the seventeenth day of the month, on Ararat's mountains.",0,5,186
" Man kan i dag se, hvordan det kan have hjulpet, at man i en periode af dyreriget afvandede ved hjælp af sprøjtevand",.<|endoftext|>,"På den syttende Dag i den syvende Måned sad Arken fast på Ararats Bjerge,","The ship rested in the seventh month, on the seventeenth day of the month, on Ararat's mountains.",1,5,186
. Så tog det til med at blive alt for koldt.<|endoftext|>, the earth became lighter and lighter. the earth became lighter and lighter.  the earth became lighter and lighter. the earth became lighter and lighter.  the earth became lighter and lighter. the earth became lighter and lighter.  the earth became lighter and lighter. the earth became lighter and lighter.  the earth became lighter and lighter. the earth became lighter and lighter.  the earth became,"På den syttende Dag i den syvende Måned sad Arken fast på Ararats Bjerge,","The ship rested in the seventh month, on the seventeenth day of the month, on Ararat's mountains.",2,5,186
"
Efter den 8. dag besluttede forskerne at undersøge, hvor længe det tager for planten at genoplade sig. De besluttede, at de ville gøre"," The earth remained in the same state of water after the end of one hundred fifty days. But the waters of the earth did not reappear, because the earth did not reappear.  When the waters of the earth receded, the earth reappeared, but not again.  (from ""The Elements of Physics"" by A. T. Wilson, 18","På den syttende Dag i den syvende Måned sad Arken fast på Ararats Bjerge,","The ship rested in the seventh month, on the seventeenth day of the month, on Ararat's mountains.",3,5,186
"
Gennemsnittsvandstanden var i 2017 på 73,5 m/s i den nordlige del af Storeb",".  The water began to rise and fall again, and the earth receded. At the end of one hundred fifty days the waters began to decrease.<|endoftext|>","På den syttende Dag i den syvende Måned sad Arken fast på Ararats Bjerge,","The ship rested in the seventh month, on the seventeenth day of the month, on Ararat's mountains.",4,5,186
"
Jeg måtte derfor sætte mig ned og vurdere tilstanden af vandstanden i søen, for at finde den rigtige strategi for at beskytte de omkringliggende marker",  13.30 And the waters ceased to decrease after the end of one hundred fifty days.  13.31 And the waters became as cold as the waters that were before. And the waters became as cold as the waters that were before.  13.32 And the waters became as cold as the waters that were before. And the waters became as cold,"På den syttende Dag i den syvende Måned sad Arken fast på Ararats Bjerge,","The ship rested in the seventh month, on the seventeenth day of the month, on Ararat's mountains.",5,5,186
" Nu er alt så væk, og der kan kun være en brønd at fylde.
Tilbage til jorden ligger der nu en masse jord og er",  5:17 But the waters rose again after the end of the second hundred days.  5:18 But the waters were still rising again after the end of the second hundred days.  5:19 And the waters had receded from the earth continually; the waters receded from the earth continually.  5:20 But the waters rose again after,"På den syttende Dag i den syvende Måned sad Arken fast på Ararats Bjerge,","The ship rested in the seventh month, on the seventeenth day of the month, on Ararat's mountains.",6,5,186
"
Efter at have forladt Mergellin, fulgte vandstanden ved floden i stedet med. Det var der ikke megen aktivitet omkring, selv om"," -> Efter at have tilbragt hundrede og femti dage i havet, faldt vandet igen til.    3. The hotel is situated in the heart of... -> Hotellet ligger i hjertet af...    4. Cheap flights from Pula to Bratislava -> Billige flyrejser fra Pula til Bratislava    5. The main reason is that the body is already too","På den syttende Dag i den syvende Måned sad Arken fast på Ararats Bjerge,","The ship rested in the seventh month, on the seventeenth day of the month, on Ararat's mountains.",7,5,186
"
Jeg ser nu tilbage på alle mine år i Grønland sammen med mine kollegaer, og jeg glemmer ikke min oplevelse af hvor fantastisk de lærte mig at kende",.<|endoftext|>,"På den syttende Dag i den syvende Måned sad Arken fast på Ararats Bjerge,","The ship rested in the seventh month, on the seventeenth day of the month, on Ararat's mountains.",8,5,186
" For at fortsætte med at studere afgrøderne i de næste 200 dage, blev grønsagerne sorteret, så en mindre mængde"," but the earth receded.    4. The earth receded from the sea in about 2,000 days.    5. The earth receded from the sky in about 1,500 days.    6. The earth receded from the sky in about 1,000 days.    7. The","På den syttende Dag i den syvende Måned sad Arken fast på Ararats Bjerge,","The ship rested in the seventh month, on the seventeenth day of the month, on Ararat's mountains.",9,5,186
" Men det var stadig muligt at komme til en ny vandhul, og der gik kun et par timer, før endnu engang flere af engene var over","        In the 19th century, the French began to work on the first attempt to create a water-based hydroelectric plant, which was to be the first to be built on the island of Réunion. However, this project was not a success, as the island had already been established by 1890. The next attempt was to establish a water","På den syttende Dag i den syvende Måned sad Arken fast på Ararats Bjerge,","The ship rested in the seventh month, on the seventeenth day of the month, on Ararat's mountains.",10,5,186
.<|endoftext|>,"  When the waters receded from the earth continually, they were not at all similar to those of the old days. The waters were all different. They were so full of blood, and so full of the squalor of the earth, and so full of the blood of the dead, that they were like a sea of swampy blood, which had been left behind in","På den syttende Dag i den syvende Måned sad Arken fast på Ararats Bjerge,","The ship rested in the seventh month, on the seventeenth day of the month, on Ararat's mountains.",11,5,186
.<|endoftext|>,"    The water did not fall to the ground, but it was still rising to the surface. The water was still rising, but it was falling to the bottom.    It was still rising, but it was falling to the bottom.    The water was still rising, but it was falling to the ground.    The water was still rising, but it was falling to","På den syttende Dag i den syvende Måned sad Arken fast på Ararats Bjerge,","The ship rested in the seventh month, on the seventeenth day of the month, on Ararat's mountains.",12,5,186
"
Derefter har jeg taget det på igen, og her ligger der en masse sand ude på landet, som jeg har gravet ned og s","  16.33–34.  The Earth is in a state of inertia. The earth's rotation is so slow that the earth's rotation can only be slowed by a force of one. The Earth's rotation is so slow that it cannot be slowed by the force of two. The earth is in a state of inertia,","På den syttende Dag i den syvende Måned sad Arken fast på Ararats Bjerge,","The ship rested in the seventh month, on the seventeenth day of the month, on Ararat's mountains.",13,5,186
" Om alt dette fortæller Morten Olsen-Jensen:
– For en gangs skyld var det slet ikke sådan, at det drejede sig om en stor",                                                                                                                                                            ,"På den syttende Dag i den syvende Måned sad Arken fast på Ararats Bjerge,","The ship rested in the seventh month, on the seventeenth day of the month, on Ararat's mountains.",14,5,186
"
""Vandet var stadig kun meget, meget svagt rødt, meget sart til sidst, men jeg kunne mærke, at der var sket noget.",.<|endoftext|>,"På den syttende Dag i den syvende Måned sad Arken fast på Ararats Bjerge,","The ship rested in the seventh month, on the seventeenth day of the month, on Ararat's mountains.",15,5,186
" Vandstanden var stadig noget for høj.
Det tog en hel arbejdsdag for vores landmand Torben at gøre sin mark klar for høsletningen.",    B.    D.    E.    F.    G.    H.    I.    J.    K.    L.    M.    N.    O.    P.    Q.    R.    S.    T.    U.    ,"På den syttende Dag i den syvende Måned sad Arken fast på Ararats Bjerge,","The ship rested in the seventh month, on the seventeenth day of the month, on Ararat's mountains.",16,5,186
" Alt blev til en ny, meget fin, gul bund med sand og småsten.
Den har en meget god drænfunktion, da den sætter","      This erosion has caused a lot of erosion in the country. ->  This erosion has caused a lot of erosion in the country.    Jeg håber, at jeg en dag kan få lov til at arbejde med dig. ->  I hope I can one day work with you.    Han har altid været glad for at bruge sin tid sammen med børnene","På den syttende Dag i den syvende Måned sad Arken fast på Ararats Bjerge,","The ship rested in the seventh month, on the seventeenth day of the month, on Ararat's mountains.",17,5,186
" Det kom der en lang tråd på Facebook med masser af kommentarer, der fortalte om folk der havde haft problemer med at finde den rigtige vandmængde,",".           The ""vans"" is a reference to the Danish vans.<|endoftext|>","På den syttende Dag i den syvende Måned sad Arken fast på Ararats Bjerge,","The ship rested in the seventh month, on the seventeenth day of the month, on Ararat's mountains.",18,5,186
" Til sidst var det bare overladt til naturen.
Jarret var allerede meget forfaldent.
Puha, man har vist fået",.<|endoftext|>,"På den syttende Dag i den syvende Måned sad Arken fast på Ararats Bjerge,","The ship rested in the seventh month, on the seventeenth day of the month, on Ararat's mountains.",19,5,186
"
Jeg gik helt stille i kødet. Det var ikke min intention at lave den mad, jeg havde planlagt, men jeg begyndte at blive nervøs,",    da: Det er en god måde at begynde at få din egen stil.  en: It's a great way to start getting your own style.    da: Men der er en meget stor forskel mellem disse to begreber.  en: But there's a big difference between these two concepts.    da: Jeg er ikke den bedste person til at finde,"På den syttende Dag i den syvende Måned sad Arken fast på Ararats Bjerge,","The ship rested in the seventh month, on the seventeenth day of the month, on Ararat's mountains.",20,5,186
"
I nogle mindre vandløb blev det helt ødelagt inden for en uge, mens der i andre vandløb var store problemer med åerne.
Der",                                                                                                                                                            ,"På den syttende Dag i den syvende Måned sad Arken fast på Ararats Bjerge,","The ship rested in the seventh month, on the seventeenth day of the month, on Ararat's mountains.",21,5,186
" Men vandmiljøet havde ændret sig en hel del. I dag er det en helt anden vandmiljø, end hvad der var tilfældet i området i 1","  The water level at the beginning of the year, the day before the sun set, was 0.37 meters above the sea level. The level of the water at the end of the year was 0.26 meters below the sea level. The water level at the end of the year was 0.23 meters below the sea level.  The water level","På den syttende Dag i den syvende Måned sad Arken fast på Ararats Bjerge,","The ship rested in the seventh month, on the seventeenth day of the month, on Ararat's mountains.",22,5,186
" Så det var egentlig et meget rart ophold, kan jeg lide at sige mig selv.
Navn: Ralf/ Alder: 39/","  15:6-7 But the water rose again, and the earth began to recede from the sea. 7 And the waters receded from the earth continually. after the end of one hundred fifty days the waters decreased.  15:8 But the waters rose again, and the earth began to recede from the sea. 8 And the waters reced","På den syttende Dag i den syvende Måned sad Arken fast på Ararats Bjerge,","The ship rested in the seventh month, on the seventeenth day of the month, on Ararat's mountains.",23,5,186
