danish_predicted_output,english_predicted_output,danish_true_label,english_true_label,layer,lambda_amount,bible_verse
" og så gik der to hundredeogtyve år. Så gik der også ni år i det ti år, da gud vendte bort fra sine tjenere","  And the people of the earth saw the earth was covered with a cloud; and the cloud was like a cloud of smoke, and the earth was like smoke.  And the earth became like a cloud of smoke.  And the earth was like a cloud of smoke.  And the earth was like a","Verdensdybets Kilder og Himmelens Sluser lukkedes, Regnen fra Himmelen standsede,","The deep's fountains and the sky's windows were also stopped, and the rain from the sky was restrained.",5,2,184
" og alle dyrene og kvæget blev dræbte. Men da han skulde se jorden til ende, blev han vred, fordi han havde dræbt alle dyrene","  The angel was coming back, and he said,  ""The waters have subsided. the earth is as before.  The waters are as before.  The earth is as before.  The waters are as before.  The earth is as before.  The waters are as before.  The","Verdensdybets Kilder og Himmelens Sluser lukkedes, Regnen fra Himmelen standsede,","The deep's fountains and the sky's windows were also stopped, and the rain from the sky was restrained.",6,2,184
" og det slog ham: de gjorde vel mange ting, som gik an, men de kom alle for tidelig! Da han ikke fik det klart for",.<|endoftext|>,"Verdensdybets Kilder og Himmelens Sluser lukkedes, Regnen fra Himmelen standsede,","The deep's fountains and the sky's windows were also stopped, and the rain from the sky was restrained.",7,2,184
" og jorden sank og blev tom. Men der skulde da opstaa en ny himmelhvælving, og himlen blev større, så alle jordens folk blev","  20 Then Noah awoke, and he found the ark of the covenant with the ark of the covenant, and the ark of the covenant with the ark of the covenant, and the ark of the covenant with the ark of the covenant.  ","Verdensdybets Kilder og Himmelens Sluser lukkedes, Regnen fra Himmelen standsede,","The deep's fountains and the sky's windows were also stopped, and the rain from the sky was restrained.",8,2,184
" og ilden steg, og himlen blev grå og en mægtig himmel, og på jorden så man ildflammer i en vældig størrelse,"," 12. But the sun rose up in the heavens and the moon was shining, and the stars were shining, and all the earth was full of the glory of the LORD, 13. and the earth shook; and all the waters that were in the earth were filled with the Spirit","Verdensdybets Kilder og Himmelens Sluser lukkedes, Regnen fra Himmelen standsede,","The deep's fountains and the sky's windows were also stopped, and the rain from the sky was restrained.",9,2,184
" den tid kom, hvor gud sendte to vandpibere ud fra arken; ja, efter sin lov kaldtes de for løver. Og"," And the sea rose up, and the earth became as a sea, and the sea rose up. 19And the waters came forth, and the earth became as a sea, and the earth rose up. 20And the waters came forth, and the earth became as a sea, and the","Verdensdybets Kilder og Himmelens Sluser lukkedes, Regnen fra Himmelen standsede,","The deep's fountains and the sky's windows were also stopped, and the rain from the sky was restrained.",10,2,184
" men det var ikke mere så, før end de drog op på en bjergryg; og se, da kom det en engel til dem. Da"," the waters rose again, and the earth rose, and the earth became as a cloud, and the earth was as a cloud; and god made a wave to pass over the earth. the waters subsided. the waters rose again, and the earth rose, and the earth became as a cloud, and the","Verdensdybets Kilder og Himmelens Sluser lukkedes, Regnen fra Himmelen standsede,","The deep's fountains and the sky's windows were also stopped, and the rain from the sky was restrained.",11,2,184
" og den dag da jorden blev tømt for vand, opstod en afskylig stank; da stankte den ned over jorden som en stærk"," God took the ark from the sea, and brought it to the ark of the covenant. and he put it on the ark of the covenant, and he put the ark of the covenant in the place of the ark of the covenant.  And the ark of the co","Verdensdybets Kilder og Himmelens Sluser lukkedes, Regnen fra Himmelen standsede,","The deep's fountains and the sky's windows were also stopped, and the rain from the sky was restrained.",12,2,184
" og da Gud i stormen så, hvad han forgjæves 104 havde søgt at redde, sprang han så op fra arken,",". the ships came to a place called the ark, and the ark was filled with the ark of the covenant, and the ark of the covenant was full.<|endoftext|>","Verdensdybets Kilder og Himmelens Sluser lukkedes, Regnen fra Himmelen standsede,","The deep's fountains and the sky's windows were also stopped, and the rain from the sky was restrained.",13,2,184
" og da så Gud, at han ikke heller kunde redde det, og så det, at arken var tom. Da de hørte dette, raab"," the sea rose again. and the sky became blue. but the earth remained as it was. the wind continued to pass over the earth, and the sea rose again. the sky became blue. and the earth remained as it was.      And the waters subsided, and the sea rose again.","Verdensdybets Kilder og Himmelens Sluser lukkedes, Regnen fra Himmelen standsede,","The deep's fountains and the sky's windows were also stopped, and the rain from the sky was restrained.",14,2,184
" og ved hans vrede kom der en horkum og gik i marken på landet; og da blev der også en røs, som kom til ham", the earth was calm. the sea rose. the birds flew. the fish flew. the birds came to the shore. and the sea was full of fish. and the sea was full of fish. and the sea was full of fish. and the sea was full of fish.    The Bible has a,"Verdensdybets Kilder og Himmelens Sluser lukkedes, Regnen fra Himmelen standsede,","The deep's fountains and the sky's windows were also stopped, and the rain from the sky was restrained.",15,2,184
 men man så ham ikke; til stor forfærdelse for de fromme dyr og mennikerne; han stod midt på jorden og så ned på dem.,".    I'm not sure what you're trying to do with the 2014 version, but I'd like to be corrected.<|endoftext|>","Verdensdybets Kilder og Himmelens Sluser lukkedes, Regnen fra Himmelen standsede,","The deep's fountains and the sky's windows were also stopped, and the rain from the sky was restrained.",16,2,184
" og den dag, da arken var tom, blev Gud meget harm på Noa, for hans vredhjertiges vrede var uutholdelig",    Sent 2: The winds then did not pass over the earth; but the waters rose again.    Sent 3: The wind passed over the earth; and the waters rose again.    Sent 4: The waters rose again.    Sent 5:,"Verdensdybets Kilder og Himmelens Sluser lukkedes, Regnen fra Himmelen standsede,","The deep's fountains and the sky's windows were also stopped, and the rain from the sky was restrained.",17,2,184
" det blev så kaldt til jorden, så store og store huller blev i den; så gik det som med de andre store huller; det blev som med"," 16 Then Noah's spirit went forth from him, and he was in the desert. 17 And the Lord spoke to him, saying, 18 ""This is how it is: the Lord has made the earth, and the earth is made out of it. 19 But","Verdensdybets Kilder og Himmelens Sluser lukkedes, Regnen fra Himmelen standsede,","The deep's fountains and the sky's windows were also stopped, and the rain from the sky was restrained.",18,2,184
 men en morgen så himlen ganske anderledes ud. Gud kom da i stor sorg og sa til alt folket: Kom du da og hør: Da kom gud,"  5:11-13 The flood came, and it came from the north, and the waters of the sea were in the midst of the land; and it was very severe.  5:14-18 There was a great flood. the waters came in great abundance, and the","Verdensdybets Kilder og Himmelens Sluser lukkedes, Regnen fra Himmelen standsede,","The deep's fountains and the sky's windows were also stopped, and the rain from the sky was restrained.",19,2,184
" i det øjeblik fik de en sten i hodet; den gik ned for deres øyne.
26:21. Men Israels folk blev da forfær","  13:24. And the Lord took the ark out of the place of the Lord of hosts, and made a cross, and a cross-board, and a cross-bridge, and a cross-house, and a cross-house-bridge, and a cross-house-bridge;","Verdensdybets Kilder og Himmelens Sluser lukkedes, Regnen fra Himmelen standsede,","The deep's fountains and the sky's windows were also stopped, and the rain from the sky was restrained.",20,2,184
" og det var som om der kom en vældig ildsande op imod jorden, så å luften så ut som i en ildbrand, så som"," the sea became clear.  15 And the water fell to the sea. And the sea became clear.  16 And the earth became a land of little trees, and of little stones. And the earth became a land of little stones.  17 And the earth became a land of little trees","Verdensdybets Kilder og Himmelens Sluser lukkedes, Regnen fra Himmelen standsede,","The deep's fountains and the sky's windows were also stopped, and the rain from the sky was restrained.",21,2,184
" men Gud blev ikke vred eller vred; for han vilde, og da gud så, at han gjorde det rigtig, vendte han det om til en anden", The water became clear.  But God made a wave to go over the earth and the waves rose and rose. And the waters came down. The earth rose and the waters came down. And the earth was filled with the water. And the water was as clear as the sky.  God made a wave,"Verdensdybets Kilder og Himmelens Sluser lukkedes, Regnen fra Himmelen standsede,","The deep's fountains and the sky's windows were also stopped, and the rain from the sky was restrained.",22,2,184
" men da han såtte en pind af træet ved sidan om arken, såt han endnu et korn under det, og så var træ",". the earth rose up; and the heavens were filled with the breath of the god, and the earth was filled with the breath of the air.<|endoftext|>","Verdensdybets Kilder og Himmelens Sluser lukkedes, Regnen fra Himmelen standsede,","The deep's fountains and the sky's windows were also stopped, and the rain from the sky was restrained.",23,2,184
" og da Gud sendte ud en ildrøst af himlen, som skulde forlyste jorden, blev den oversvømmet af ilden. Men når ilden"," The waters subsided, and the earth rose up like a new tree. The earth rose up like a new tree, and all the animals that were with it were as one. The wind did not go over the earth, but the earth rose up like a new tree. And the earth rose up like a","Verdensdybets Kilder og Himmelens Sluser lukkedes, Regnen fra Himmelen standsede,","The deep's fountains and the sky's windows were also stopped, and the rain from the sky was restrained.",0,5,184
" og gud kvæget, som var hos ham, gik ud af arken. 3. Da gik alle menneskene sammen udenfor arken, og"," God made a wind to go to the other side of the earth, and God made a wind to go to the other side of the earth, and God made a wind to go to the other side of the earth, and God made a wind to go to the other side of the earth, and God made","Verdensdybets Kilder og Himmelens Sluser lukkedes, Regnen fra Himmelen standsede,","The deep's fountains and the sky's windows were also stopped, and the rain from the sky was restrained.",1,5,184
" derefter sank vandet. Da tænkte Josva og alle de hedninger, som stode hos ham, på, at Herren havde gjort deres hjerte ustyr",.<|endoftext|>,"Verdensdybets Kilder og Himmelens Sluser lukkedes, Regnen fra Himmelen standsede,","The deep's fountains and the sky's windows were also stopped, and the rain from the sky was restrained.",2,5,184
" så de døde i arken, og Gud var med dem.
Dansk
35 Og Gud tok til vriste og skar ut en k","    2.2.4. The book of Genesis also includes a section on the flood of Egypt and its effects on the nation of Israel. In this section, the prophet says,    2.2.4.1. The book of Genesis also mentions the flood of Egypt. It is","Verdensdybets Kilder og Himmelens Sluser lukkedes, Regnen fra Himmelen standsede,","The deep's fountains and the sky's windows were also stopped, and the rain from the sky was restrained.",3,5,184
 men der var ingen som gik i landet. Gud tog sin bolig i arken og lod nogen av arken i marken stå åben for at komme der," the land was not lost, for the earth was not flooded. it was not destroyed, for it was not blown away. the earth was not covered with dust, because no one had ever come to the place, nor had there ever been anyone there before. the waters were not lost, because the sea","Verdensdybets Kilder og Himmelens Sluser lukkedes, Regnen fra Himmelen standsede,","The deep's fountains and the sky's windows were also stopped, and the rain from the sky was restrained.",4,5,184
" og alle dyrene, der lå i arken, rømte til den ene side, og der var en stor sky af vand over jorden, og de"," And the Lord God gave them water, and the waters returned. And the Lord God made the earth, and the earth was made. And the Lord God made the sea, and the sea was made. And the Lord God made the heavens and the heavens were made. And the Lord God made the","Verdensdybets Kilder og Himmelens Sluser lukkedes, Regnen fra Himmelen standsede,","The deep's fountains and the sky's windows were also stopped, and the rain from the sky was restrained.",5,5,184
" så kom gud sin ildhu frem og gik ind i arken, hvor der nu var et hav af vand, og der sank det sammen til en",                                                                                                                            ,"Verdensdybets Kilder og Himmelens Sluser lukkedes, Regnen fra Himmelen standsede,","The deep's fountains and the sky's windows were also stopped, and the rain from the sky was restrained.",6,5,184
 og så kom Gud og såtte himmelens stjerner i en bred ring omkring den tomme arken. Så vendte Gud sig atter til israeliten og sa," and the sea was like a river, and the earth was like a field. and the land was like a green field. and the sky was like a cloud of fire. and the earth was like a forest. and the sky was like a cloud of fire. and the earth was like a forest. and","Verdensdybets Kilder og Himmelens Sluser lukkedes, Regnen fra Himmelen standsede,","The deep's fountains and the sky's windows were also stopped, and the rain from the sky was restrained.",7,5,184
" og der var mange, som var bange og led meget.
Jotan, for han for i krig med gud, men kom ikke i land",                                                                                                                            ,"Verdensdybets Kilder og Himmelens Sluser lukkedes, Regnen fra Himmelen standsede,","The deep's fountains and the sky's windows were also stopped, and the rain from the sky was restrained.",8,5,184
" og så steg det op af vannet, og alle dyrene og kvæget gik over til det andre stedet.

5. norsk: Jeg trenger","    10. norsk: Den beste måten å bli kvitt fett på er ved å gå til en profesjonell.  engelsk: The best way to get rid of fat is by going to a professional.    11. norsk: Denne informasjonen gir oss mulighet til å forbedre og videreutvikle våre produkter,","Verdensdybets Kilder og Himmelens Sluser lukkedes, Regnen fra Himmelen standsede,","The deep's fountains and the sky's windows were also stopped, and the rain from the sky was restrained.",9,5,184
 og han lod en stor flue sidde derpå; og han førte hans vogn og alt hans følge af mennesker ned til jorden; og det var om,                                                                                                                            ,"Verdensdybets Kilder og Himmelens Sluser lukkedes, Regnen fra Himmelen standsede,","The deep's fountains and the sky's windows were also stopped, and the rain from the sky was restrained.",10,5,184
 men den anden gud skabte et uhyre med en magt i sig som var som jorden. Og Gud sendte den samme gud til Egypten og sagde: Du,.<|endoftext|>,"Verdensdybets Kilder og Himmelens Sluser lukkedes, Regnen fra Himmelen standsede,","The deep's fountains and the sky's windows were also stopped, and the rain from the sky was restrained.",11,5,184
" og der blev ikke mange dage igjen av hans dage. 8. Og de kom til Akko, og Israels konge og Nifsars søn E"," and the water rose up, and the waters were blue, and all the animals that were with him in the ship were blue. and all the animals that were with him in the ship were blue. and all the animals that were with him in the ship were blue.  And the waters were blue, and","Verdensdybets Kilder og Himmelens Sluser lukkedes, Regnen fra Himmelen standsede,","The deep's fountains and the sky's windows were also stopped, and the rain from the sky was restrained.",12,5,184
" og når gud var i haven, da var det gud, som steg frem i luften og så sig selv i himlen.
20:30","    The first is that of the first man, and the second is that of the second man, and the third is that of the third man, and the fourth is that of the fourth man.    The third is that of the third man, and the fourth is that of the fourth man,","Verdensdybets Kilder og Himmelens Sluser lukkedes, Regnen fra Himmelen standsede,","The deep's fountains and the sky's windows were also stopped, and the rain from the sky was restrained.",13,5,184
" men gud gik med jorden, så længe vandet rakte.
6 8 - 17 Gud var hos menneskene, og menneskene var hos ham",                                                                                                                            ,"Verdensdybets Kilder og Himmelens Sluser lukkedes, Regnen fra Himmelen standsede,","The deep's fountains and the sky's windows were also stopped, and the rain from the sky was restrained.",14,5,184
" så begyndte gud at udøse manna på jorden, så at det kom i stride strømme. Så begyndte gud at sende ild og store vinde ut på",".  Mennesket blev en levende Gud, og de første mennesker.<|endoftext|>","Verdensdybets Kilder og Himmelens Sluser lukkedes, Regnen fra Himmelen standsede,","The deep's fountains and the sky's windows were also stopped, and the rain from the sky was restrained.",15,5,184
" men gud tog ikke hensyn dertil; for de vilde dyr og kvæget var borte fra jorden, og jorden var ikke fuld af føde for ham."," the land rose, ogre, ogre, ogre, ogre, ogre, ogre, ogre, ogre, ogre, ogre, ogre, ogre, ogre, ogre, ogre, ogre, ogre, ogre, ogre, og","Verdensdybets Kilder og Himmelens Sluser lukkedes, Regnen fra Himmelen standsede,","The deep's fountains and the sky's windows were also stopped, and the rain from the sky was restrained.",16,5,184
" og Herren velsignede dem. 21 Og så kom nu i husene alle dyrene i arken hos os, som hører til arken","  The Book of Genesis.  In the Book of Genesis, the first of the Book of Abrahams, the book of Noah, is the first book of the Book of Abrahams.  The Book of Genesis is the first of the Book of Abrahams, and the first Book of Abrahams to have","Verdensdybets Kilder og Himmelens Sluser lukkedes, Regnen fra Himmelen standsede,","The deep's fountains and the sky's windows were also stopped, and the rain from the sky was restrained.",17,5,184
" og alle de, som var hos ham, og alle hans tjenere, der sad ved arken, fik stor angst og stode op, og"," god came og the land. and the land blev stor, og himlen blev stor, og der blev stor stor stor stor stor stor stor stor stor stor stor stor stor stor stor stor stor stor stor stor stor stor stor stor stor stor stor stor stor stor stor stor stor stor stor stor stor stor stor stor stor stor","Verdensdybets Kilder og Himmelens Sluser lukkedes, Regnen fra Himmelen standsede,","The deep's fountains and the sky's windows were also stopped, and the rain from the sky was restrained.",18,5,184
" 7 Gud så til himmelen, og se, himmelen åpnet sig og se og høre det store høie; og da blev der en stor og tung",.<|endoftext|>,"Verdensdybets Kilder og Himmelens Sluser lukkedes, Regnen fra Himmelen standsede,","The deep's fountains and the sky's windows were also stopped, and the rain from the sky was restrained.",19,5,184
" og under stormen opstod flere af Guds småfolk; men gud var vred over disse; og hans vrede kom over ham, så han måtte dræbe","  3.  and when they saw the sun rise, they saw the earth rise. 4.  and the earth began to rise up; and they saw the sea rise.  5.  and the sea came to the top of the sky, and the earth came to the top of the sky","Verdensdybets Kilder og Himmelens Sluser lukkedes, Regnen fra Himmelen standsede,","The deep's fountains and the sky's windows were also stopped, and the rain from the sky was restrained.",20,5,184
" og gud så op på ham, han han sagde: se, alt dette haver Gud gjort paa min dag; og gud sagde: se, alle disse", the people were glad to have the wind over the land. and they built a house for the people to live in. and the people went to the house. and the people went to the house. and the people went to the house. and the people went to the house. and the people went to the,"Verdensdybets Kilder og Himmelens Sluser lukkedes, Regnen fra Himmelen standsede,","The deep's fountains and the sky's windows were also stopped, and the rain from the sky was restrained.",21,5,184
" men da begyndte jorden at sprænge, og jorden faldt, og floderne brød ud i havet. Alle de vilde dyr blev borte borte, og",. god had been very generous to him. and the ship was filled with the water.<|endoftext|>,"Verdensdybets Kilder og Himmelens Sluser lukkedes, Regnen fra Himmelen standsede,","The deep's fountains and the sky's windows were also stopped, and the rain from the sky was restrained.",22,5,184
 og over hele jorden stod et væld. (7. 29—31.) Hvad Gud sagde til Israels konge: Lad det ene folk om," god gave him a son, and named him Noah.    32                                                                                              ","Verdensdybets Kilder og Himmelens Sluser lukkedes, Regnen fra Himmelen standsede,","The deep's fountains and the sky's windows were also stopped, and the rain from the sky was restrained.",23,5,184
" over himlene så gud, at regnet kom fra himmelrikets trone, og så at jorden blev smeltet; over vandet så gud, at","    Guðrún: Hi, I'm your automated assistant. I can answer your questions about The Hound of the Baskervilles.  Jim: What is the Baskervilles' The Hound of the Baskervilles?  Guðrún: The Hound of","Verdensdybets Kilder og Himmelens Sluser lukkedes, Regnen fra Himmelen standsede,","The deep's fountains and the sky's windows were also stopped, and the rain from the sky was restrained.",0,10,184
" men det var ikke godt for dem. Da så de dernede i arken et stort sølvfat, og da de så det, så de at","  Moses, the great God, the god of the sea, the god of the land, the god of the air, the god of the air, the god of the sea, the god of the land, the god of the air, the god of the air, the god of the sea,","Verdensdybets Kilder og Himmelens Sluser lukkedes, Regnen fra Himmelen standsede,","The deep's fountains and the sky's windows were also stopped, and the rain from the sky was restrained.",1,10,184
" så blev alle dyrene borte. Da var Gud stor og sterk som et menneske, og alt hans folk var forsamlet i arken, og jorden","    I was walking through the woods, and I saw a great many animals that were in the forest, all the animals that were in the forest.      I was walking through the woods, and I saw a great many animals that were in the forest, all the animals that were in the forest","Verdensdybets Kilder og Himmelens Sluser lukkedes, Regnen fra Himmelen standsede,","The deep's fountains and the sky's windows were also stopped, and the rain from the sky was restrained.",2,10,184
" og da den første vind havde lagt sig, stod himlen højt op, og vandet blev stille, så at alt, hvad der fandtes mellem jordens to"," the earth was full of the earth, the birds and the fishes were full of the fishes. The earth was full of the earth, and all the birds and all the fishes were full of the fishes. The earth was full of the earth, and all the birds and all the fishes","Verdensdybets Kilder og Himmelens Sluser lukkedes, Regnen fra Himmelen standsede,","The deep's fountains and the sky's windows were also stopped, and the rain from the sky was restrained.",3,10,184
" men den faldt ikke, men gav en ild, som havde et vældigt omfang, og blev forfulgt af folkeslagene og folket på jorden.", the earth rose. the sky was blue. the earth was blue. the sky was blue. the earth was blue. the earth was blue. the sky was blue. the earth was blue. the sky was blue. the earth was blue. the sky was blue. the earth was blue. the earth was,"Verdensdybets Kilder og Himmelens Sluser lukkedes, Regnen fra Himmelen standsede,","The deep's fountains and the sky's windows were also stopped, and the rain from the sky was restrained.",4,10,184
" men gud var også den almægtige med den himmelske magt, han udrustede sig med til krig og krigers vilje, også under alle"," and the earth was made, and the sea became a hundred and forty-five thousand miles long and deep.  And the waters were as many as the animals were. And the animals were as many as the animals were; and the animals were as many as the animals were.  And the earth was made","Verdensdybets Kilder og Himmelens Sluser lukkedes, Regnen fra Himmelen standsede,","The deep's fountains and the sky's windows were also stopped, and the rain from the sky was restrained.",5,10,184
" så væltede alt, hvad der var på jorden, og himmelen var over jorden. Dette var en dag, da den gamle israelitiske fara","    And the sea rise, and the land rise. And the land rise, and the sea rise, and the land rise. And the sea rise, and the land rise. And the sea rise, and the land rise. And the sea rise, and the land rise.    And the sea","Verdensdybets Kilder og Himmelens Sluser lukkedes, Regnen fra Himmelen standsede,","The deep's fountains and the sky's windows were also stopped, and the rain from the sky was restrained.",6,10,184
