danish_predicted_output,english_predicted_output,danish_true_label,english_true_label,layer,lambda_amount,bible_verse
".
The following night, the Lords said to themselves, ""This day is to be made our day.
engelsk<|endoftext|>",    15. Danish: Hoteller i nærheden af The Gables House  English: Hotels near The Gables House Near Airports    16. Danish: Dette er en af de største og mest kendte steder.  English: This is one of the biggest and most famous sites.    17. Danish: Hvad er en virksomhedsplan?  English: What is a Business Plan?  ,"Da Enok havde levet 65 År, avlede han Metusalem,","Enoch lived sixty-five years, and became the father of Methuselah.",16,2,125
 (1. Kor. 13:39-42). I henhold til 1. Moseb. 6:29 skulle," He was dead long before jared. He was dead long before the age of jared was even five hundred years old. And when jared died, he died long before the age of jared was even one hundred years old.  The sky was blue, but the rain was falling. The air was filled with the scent of the rain. The rain was falling. The sky was blue, but the","Da Enok havde levet 65 År, avlede han Metusalem,","Enoch lived sixty-five years, and became the father of Methuselah.",17,2,125
" Efter at have udstået sin levetid døde Tredive. Efter at have udstået sin livstid levede Jorn også til sidst på Fyn, hvor han",.<|endoftext|>,"Da Enok havde levet 65 År, avlede han Metusalem,","Enoch lived sixty-five years, and became the father of Methuselah.",18,2,125
"
En anden kendsgerning var, at han på den tid blev meget rigere, og at hans hustru, Marie Christine af Braunschwe","  ""Well, I'm just glad that it's over. It was a horrible day, and I'm glad I didn't come out here in the middle of the night, and it's just what I was looking forward to. It was a good night.""  ""I know. It was a great night, but it was all so strange.""  ""It was so strange","Da Enok havde levet 65 År, avlede han Metusalem,","Enoch lived sixty-five years, and became the father of Methuselah.",19,2,125
"
Derefter stod det klart for mig, at tiden i det sydlige Afrika var på vej mod enden, at vi måske ikke var i stand til","    dansk: Det var en dejlig tur i går og i dag.  engelsk: It was a great time yesterday and today.    dansk: Jeg vil ikke have at du skal se mig sådan, mor.  engelsk: ""I don't want you to see me like that, Mum.    dansk: Det vil give dig en masse gode erfaringer og skabe et godt grundlag for en god","Da Enok havde levet 65 År, avlede han Metusalem,","Enoch lived sixty-five years, and became the father of Methuselah.",20,2,125
" -> The same was the case for the great iron iron alloy.
5. Du har ikke lyst til at tage ud. -> You don'"," I was on the ground, and the earth was full of his bones. But I didn't care, I wanted to see him. I wanted to see his face. I wanted to see his eyes. I wanted to see his lips. I wanted to see his eyes. I wanted to see his lips.""  ""The eyes?"" I said, my voice quivering with emotion. ""You mean those","Da Enok havde levet 65 År, avlede han Metusalem,","Enoch lived sixty-five years, and became the father of Methuselah.",21,2,125
"
Den 14. marts i år 604 efter at de hadith-bemærkninger vi nu er omme i, er",.<|endoftext|>,"Da Enok havde levet 65 År, avlede han Metusalem,","Enoch lived sixty-five years, and became the father of Methuselah.",22,2,125
" ->
Efterträdaren till hans namn dog när 962 och därefter dog han.

Den har tre niveauer som ikke altid bliver benyttet",    Svenska: Hon är en av de mest populära.  Engelska: She is one of the most popular ones.    Svenska: Jag hade inte haft några som helst problem att göra det här.  Engelska: I had no problem doing this.    Svenska: De två första var de första jag gjorde.  Engelska: The first two were the first I did.    Svenska: De flesta,"Da Enok havde levet 65 År, avlede han Metusalem,","Enoch lived sixty-five years, and became the father of Methuselah.",23,2,125
" Ved kirkens udførelse i 1723 indviedes den store kirke, som dog ikke stod færdig ved dennes indvielse."," But I know that I will not die.  —HENRY MILLER  Six  A SHADOW DAY  On the second day of the third month, when I was twelve years old, I was walking in the garden of the house of my father's friend, the physician, the son of a farmer. I was walking in the garden of a house which was the home","Da Enok havde levet 65 År, avlede han Metusalem,","Enoch lived sixty-five years, and became the father of Methuselah.",0,5,125
" I 1901 blev han begravet under den smukke, hvide mose.
Hans hustru, Maria, blev født i Østre Har", And he was dead in a dream. And he was dead in a dream. And he was dead in a dream. And he was dead in a dream. And he was dead in a dream. And he was dead in a dream. And he was dead in a dream. And he was dead in a dream. And he was dead in a dream. And he was dead in a dream. And he,"Da Enok havde levet 65 År, avlede han Metusalem,","Enoch lived sixty-five years, and became the father of Methuselah.",1,5,125
"
A. Mollerup fortæller i sin rejsebeskrivelse 1125 - 1810, at han og hans kone for nogle",    10. Engelsk: The Best Restaurants in Carmarthenshire - TripAdvisor  Norsk: De beste fiskerestaurantene i Carmarthenshire - TripAdvisor    11. Engelsk: It is also important to remember that the product must be used correctly.  Norsk: Det er også viktig å huske at produktet må brukes riktig.    12. Engelsk: 4-star Hotels,"Da Enok havde levet 65 År, avlede han Metusalem,","Enoch lived sixty-five years, and became the father of Methuselah.",2,5,125
"
1942-1943.
Efter krigens afslutning var byen en af de vigtigste byer i Nordtyskland. Tyskerne"," I was a young boy, and I saw him die. I was very saddened. I said to myself, ""How could I be so saddened?"" And I told myself, ""I was too young to die. I am too old to live."" I didn't know what to do. I didn't know how to live. I didn't know where to go. I","Da Enok havde levet 65 År, avlede han Metusalem,","Enoch lived sixty-five years, and became the father of Methuselah.",3,5,125
" Ved opdelingen blev der regnet med 50 mennesker og 100 dyr, og 67 dyr blev vurderet tilstrækkelig store, 2",.<|endoftext|>,"Da Enok havde levet 65 År, avlede han Metusalem,","Enoch lived sixty-five years, and became the father of Methuselah.",4,5,125
"
1837, 20:12
Deres ældste datter, Anna Kirstine Brix (1806-1"," And we are not yet aware of the time of his death, or of his resurrection.""  ""And you are not yet aware of the time of his death?""  ""No, sir, nor of his resurrection. And the one thing I am aware of is that his spirit is present in all the days of jared.""  ""And the one thing I am aware of is that his spirit","Da Enok havde levet 65 År, avlede han Metusalem,","Enoch lived sixty-five years, and became the father of Methuselah.",5,5,125
" Det siger alt, hvad vi behøver at vide om Lupus – det er nok det mest betydningsfulde, vi kan vide,"" skriver Peter Lund Madsen"," He died of the sickness of his heart.""  ""And the Lord God of hosts will do to him what he did to his fathers.""  ""And the Lord God of hosts will do to him what he did to his sons and daughters.""  ""And the Lord God of hosts will do to him what he did to his sons and daughters.""  ""And the Lord God of hosts will do to","Da Enok havde levet 65 År, avlede han Metusalem,","Enoch lived sixty-five years, and became the father of Methuselah.",6,5,125
"
Forneden er det den 1259 årige A.E.Hauke, gift med A.F.Kjær,",. ->  Engelska<|endoftext|>,"Da Enok havde levet 65 År, avlede han Metusalem,","Enoch lived sixty-five years, and became the father of Methuselah.",7,5,125
"
Næste dag, en lørdag den 3. marts 1975, skete der endnu et under, da den afdøde var at","  And that is the story of jared's son, Jared, who died in the desert. The son of Jared, Jared, whose name means ""the son of the land,"" and whose son is called ""the son of the desert,"" the son of the desert.  When Jared's father died, Jared's mother died. But Jared, Jared,","Da Enok havde levet 65 År, avlede han Metusalem,","Enoch lived sixty-five years, and became the father of Methuselah.",8,5,125
.<|endoftext|>,.<|endoftext|>,"Da Enok havde levet 65 År, avlede han Metusalem,","Enoch lived sixty-five years, and became the father of Methuselah.",9,5,125
"
The last major historical event of the county was the 1903 election, when the electorate of the county was the size of"," I have been reading about it now for a year and a half, and I feel the way that I have been reading about it all my life.""    The ""1974"" is not a new book. It was published in 1974, and was the first book of the book series by Jared Diamond. The first book of the book series was ""The Secret Life of","Da Enok havde levet 65 År, avlede han Metusalem,","Enoch lived sixty-five years, and became the father of Methuselah.",10,5,125
"
Svensk: År 1707 blev en av hans söner, den framlidne presidenten för Kyrkan, Carl von Linné.
Dansk","  ""He was the greatest of men, and he was the greatest of men who ever lived,"" he said. ""He was the greatest of men who ever lived. He was the greatest of men who ever lived. He was the greatest of men who ever lived. He was the greatest of men who ever lived.""  ""I'll bet you, son, that it was a good time,"" said","Da Enok havde levet 65 År, avlede han Metusalem,","Enoch lived sixty-five years, and became the father of Methuselah.",11,5,125
". Med ham som ven og rådgiver formede der sig en slægt, der kom til at stå stærkt i Norden i århundreder.<|endoftext|>","  ""When you die, you die, and it's as if you were born again.""  The girl's eyes met his.  ""It's like that. You're not born again.""  ""But you are.""  She looked at him for a moment.  ""You're alive.""  She looked at him for a long time, and he couldn't help","Da Enok havde levet 65 År, avlede han Metusalem,","Enoch lived sixty-five years, and became the father of Methuselah.",12,5,125
"
Mellem 1362 og 1434 boede der en præst i byen, som var den første borgmester på Bornholm."," But he was still alive. The first thing I heard was the cry of his wife, his mother, and his mother's voice. She was crying for him, and she said, ""Jared, you are dead. You are dead."" And he said, ""I am alive.""  He died in a nursing home. He was in a nursing home in Chicago, and he was there when the","Da Enok havde levet 65 År, avlede han Metusalem,","Enoch lived sixty-five years, and became the father of Methuselah.",13,5,125
.<|endoftext|>,".  Sådan er det i alle dage af jared var ni hundred seksogtredive år, så han døde.<|endoftext|>","Da Enok havde levet 65 År, avlede han Metusalem,","Enoch lived sixty-five years, and became the father of Methuselah.",14,5,125
.<|endoftext|>,"    Det er det, der gør den til en rigtig god oplevelse. ->  This is what makes it a great experience.    Hvilket de fleste nok vil kunne genkende. ->  Which most people will probably recognise.    Vi skal være bedre til at give feedback. ->  We have to be better at giving feedback.    En stor del af de 1600","Da Enok havde levet 65 År, avlede han Metusalem,","Enoch lived sixty-five years, and became the father of Methuselah.",15,5,125
"

746

Søren Povlsens beretning.

I Danmark skal man ikke opgive sin tro, men man skal"," Og, så jeg skal da lige love for, at jeg var glad for at få den tilbage igen.  Og så skal jeg lige love for, at der er sket en del på de 900 dage, som Jared er gået, siden jeg sidst har set ham. Det er jo ikke så meget, men det er da sket. Og det er også meget sjovt, for Jared er en","Da Enok havde levet 65 År, avlede han Metusalem,","Enoch lived sixty-five years, and became the father of Methuselah.",16,5,125
"
Næste år døde han ved 1100 år, 2296 år gammel.
(2003, s"," He had been in the army of 300000 men, had led them through the great war, and had led them through the great war. He had led them, and had led them through the great war. He had led them, and had led them through the great war.  He had led them, and had led them through the great war.  Despite all this,","Da Enok havde levet 65 År, avlede han Metusalem,","Enoch lived sixty-five years, and became the father of Methuselah.",17,5,125
" Tolv dage senere fik den store mængde af ham og hans disciple, den største mængde af nogen af de mange disciple, der har forfulgt"," And we're talking 1993.    —    I'm still a little worried, but I think it's okay.    —    Well, I'm okay. I'm okay.    —    Okay.    —    Okay.    —    Okay.    —    Okay.    —    ","Da Enok havde levet 65 År, avlede han Metusalem,","Enoch lived sixty-five years, and became the father of Methuselah.",18,5,125
"
Men hvis man nu finder en måde at få jorden frosset ned på, så er det jo egentlig meget logisk, at Jorden var så rig,",".  For det meste var det dage med Jareds år, der var ni hundrede og halvtreds tyve år, så døde han.<|endoftext|>","Da Enok havde levet 65 År, avlede han Metusalem,","Enoch lived sixty-five years, and became the father of Methuselah.",19,5,125
"
Engelsk: There was a time about 962 years ago, after the Earth lost its vitality after the last fire, and there was"," He died in his own name, and his body was returned to the house of the people of Israel, and he was brought forth to them. And I shall be with him, and I will be with him, and I will be with him, and I will be with him, and I will be with him, and I will be with him, and I will be with him, and I will be","Da Enok havde levet 65 År, avlede han Metusalem,","Enoch lived sixty-five years, and became the father of Methuselah.",20,5,125
.<|endoftext|>,    9                                                                                                                                                              ,"Da Enok havde levet 65 År, avlede han Metusalem,","Enoch lived sixty-five years, and became the father of Methuselah.",21,5,125
"

- Hvis der for eksempel en nat sker det, at du glemmer at tænde lyset, eller du ikke kan åbne din dør, kan huset"," He was a man of great promise, and he had promised himself that he would be remembered for the days of jared.""  ""He's a great man,"" said Sam.  ""I have never seen a man who has been so wise as he was.""  ""What sort of wisdom?""  ""I do not know. I have no idea.""  ""He is the greatest man,"" said","Da Enok havde levet 65 År, avlede han Metusalem,","Enoch lived sixty-five years, and became the father of Methuselah.",22,5,125
" Så vidt vi ved, er hans lig den tredje af hans tilhængere, der har overlevet til den sidste dag uden at blive fundet. ->
"," I was a young man and I wanted to be a man, and I was just a boy. I was very stupid, and I was very selfish, and I was very stupid. I wanted to be a man. I wanted to be a boy. I wanted to be a man. I wanted to be a boy. I wanted to be a boy. I wanted to be a boy. I wanted to","Da Enok havde levet 65 År, avlede han Metusalem,","Enoch lived sixty-five years, and became the father of Methuselah.",23,5,125
"
Kronologisk oversigt over tiden op til 500 års alder.
1600 - 1600 e.kr","  svenska: När jared var niohundratjugofyra år, dog dog dog dog.    engelska: A good example of this is the Swedish language.  svenska: Ett bra exempel på detta är det svenska språket.    engelska: The first time I met him was on a plane.  svenska: Första gången jag träffade honom var på ett plan.    engelska: The first time","Da Enok havde levet 65 År, avlede han Metusalem,","Enoch lived sixty-five years, and became the father of Methuselah.",0,10,125
"
3
Herodes sendte bud efter sin tjener Peter, Jesus's tjener. Han ville gerne vide noget om ham og hans familie. Peter bad","    We are going to have the best day ever. ->  Við erum að fá besta daginn í heimi.      Hann er nú að fá hann í sína herbúðir. ->  Nú er hann kominn í herbergið sitt.      Það er bara svona, það er bara þannig. ->  Þetta er bara svona, þetta er bara svona.  ","Da Enok havde levet 65 År, avlede han Metusalem,","Enoch lived sixty-five years, and became the father of Methuselah.",1,10,125
.<|endoftext|>,"  engelsk: ""The Nine Hundred and Two Years"" is the first of the nine hundred and twenty-two days of jared were nine hundred sixty-two years, then he died.      dansk: Og det er en historie, som vi kan lide at fortælle.  engelsk: And that is a story that we like to tell.      dansk: Det er det, jeg har","Da Enok havde levet 65 År, avlede han Metusalem,","Enoch lived sixty-five years, and became the father of Methuselah.",2,10,125
.<|endoftext|>," And he had not yet left this earth.  But the earth, when the time came, was as much as he had been, and he had been, and he had been, and he had been. And the time came, when the earth was as much as he had been, and he had been, and he had been. And the time came, when the earth was as much as he had","Da Enok havde levet 65 År, avlede han Metusalem,","Enoch lived sixty-five years, and became the father of Methuselah.",3,10,125
" Det var i hvert fald meningen med hans grav, og dette var også det indtryk man fik ved at studere kisterne, når man gik ind og ud",                                                                                                                                                                    ,"Da Enok havde levet 65 År, avlede han Metusalem,","Enoch lived sixty-five years, and became the father of Methuselah.",4,10,125
.<|endoftext|>," He was a good man, but a bad man, and he was a liar.""  ""And you think you can do what he did?""  ""I don't know,"" said Cora. ""I don't know what he did. I don't know if he did. But he did.""  ""And what did you do?""  ""I don't know,"" said","Da Enok havde levet 65 År, avlede han Metusalem,","Enoch lived sixty-five years, and became the father of Methuselah.",5,10,125
"
Den hellige Johannes, den første blandt Jesu martyrer, fik i løbet af 600-tallet en ophøjet status i kirken,",    15.    16.    17.    18.    19.    20.    21.    22.    23.    24.    25.    26.    27.    28.    29.    30.    ,"Da Enok havde levet 65 År, avlede han Metusalem,","Enoch lived sixty-five years, and became the father of Methuselah.",6,10,125
" -> På grund heraf skulle riget med tiden gå fra den til 962 år, og derfra døde han.
2. Nogle brugere siger",".  It is all true, men, at den tid var Jared var ni hundrede og seksten tusinde år, så døde han.<|endoftext|>","Da Enok havde levet 65 År, avlede han Metusalem,","Enoch lived sixty-five years, and became the father of Methuselah.",7,10,125
" Hans jordiske rester var på det tidspunkt opslugt af det underjordiske hulrum i jorden, så deres placering og størrelse nu skal undersøges","  10  The Last of the Night  When the time of the last of the night came, the night that he was born, the king of Babylon, king of all the days of jared, was ninety-two years, then he died.  11  The Day of the Eternal Night  When the time of the day of the eternal night came, the king","Da Enok havde levet 65 År, avlede han Metusalem,","Enoch lived sixty-five years, and became the father of Methuselah.",8,10,125
" I 1964 overgik stedet til Statsforvalteren, og siden er ejendommen ejet og drevet af Statsforvalteren, indtil"," The same thing happened with the other two people. They died in the same way.  ""When you look at the history of the world, you'll see that when the first world came, the sun was going down and the moon was rising, the Earth was going to be about 100,000 years old, and the Earth was going to be 100,0","Da Enok havde levet 65 År, avlede han Metusalem,","Enoch lived sixty-five years, and became the father of Methuselah.",9,10,125
.<|endoftext|>," The angels had done everything to keep him alive. He was dead, and he was not going to die. The angels had been watching for him for the past ninety years, but he had not yet died. The angels were watching for him for the last ninety years.  ""What are you waiting for?"" he asked.  ""For the day of jared,"" sagde Zab,","Da Enok havde levet 65 År, avlede han Metusalem,","Enoch lived sixty-five years, and became the father of Methuselah.",10,10,125
.<|endoftext|>,. ->  Engelsk<|endoftext|>,"Da Enok havde levet 65 År, avlede han Metusalem,","Enoch lived sixty-five years, and became the father of Methuselah.",11,10,125
 Hans hustru (og moder) havde i 1088 overladt sin andel; i 1142 blev hendes andel overtaget af,"  In the beginning, the first day of jared, they were not the same. There were no different days. The first day of jared, the first day of jared, was jared. The first day of jared, the first day of jared, was jared. The first day of jared, the first day of jared, was jared.  The first day","Da Enok havde levet 65 År, avlede han Metusalem,","Enoch lived sixty-five years, and became the father of Methuselah.",12,10,125
"

Jeg har søgt om at komme tilbage i tiden og se de personer der blev født i dette riges storhedstid.

Jeg er",".  Og hvordan kunne det gå til, at jareds dage var 9000 år, og så døde han?<|endoftext|>","Da Enok havde levet 65 År, avlede han Metusalem,","Enoch lived sixty-five years, and became the father of Methuselah.",13,10,125
"
Han er en af de 895 vigtigste mennesker, man har mistet en dag og så kommer der en person og fortæller: ""Hvorfor var","    11. Det er altid en god idé at tjekke med andre, om du kan bruge noget af det, du har lært. -> Det er altid en god ide at tjekke med andre, om du kan bruge noget af det, du har lært.    12. Og hvad med de nye, mindre og billigere modeller? -> Og hvad med de nye, mindre og billigere modeller?    ","Da Enok havde levet 65 År, avlede han Metusalem,","Enoch lived sixty-five years, and became the father of Methuselah.",14,10,125
" Han var født 21. maj 1506 på Rulle i det nuværende Morsø Amt.
Hans far var den tidligere skib",". Han var den sidste, der døde, og der var ikke mange dage, hvor han ikke blev glemt.<|endoftext|>","Da Enok havde levet 65 År, avlede han Metusalem,","Enoch lived sixty-five years, and became the father of Methuselah.",15,10,125
" I 1178 blev han begravet i Domkirken.
Kilden fortæller, at man allerede på tidspunktet under Knud den Store ville","    ""Træ i træ"", ""Hvælvingen i hvælvingen"", ""Næsten i hvælvingen"", ""Viborg i Viborg"", ""Viborg i Viborg"", ""Bidrag til et nyt museum"", ""Bidrag til et nyt museum"", ""Bidrag til et nyt museum"", ""Bidrag til et nyt museum"", ""Bidrag til et nyt","Da Enok havde levet 65 År, avlede han Metusalem,","Enoch lived sixty-five years, and became the father of Methuselah.",16,10,125
.<|endoftext|>," Og hans børn blev i al deres tid i denne verden; de blev til en hel familie, og de blev i mange år, indtil de blev til en hel nation, og de blev til en hel verden.    12. Søg efter tilbud på Hotel Fletcher i Las Vegas med KAYAK. -> Søg efter tilbud på Hotel Fletcher i Las Vegas med KAYAK.    13. Fly","Da Enok havde levet 65 År, avlede han Metusalem,","Enoch lived sixty-five years, and became the father of Methuselah.",17,10,125
"
Disse begivenheder var årsag til, at der i mange lande blev oprettet statsdæmoner. Det var dem, som skulle stå til regnskab for",.<|endoftext|>,"Da Enok havde levet 65 År, avlede han Metusalem,","Enoch lived sixty-five years, and became the father of Methuselah.",18,10,125
"
Der var ingen, der vidste, hvor mange der boede på gården, men 100 mennesker blev begravet der.
Det var en",.<|endoftext|>,"Da Enok havde levet 65 År, avlede han Metusalem,","Enoch lived sixty-five years, and became the father of Methuselah.",19,10,125
"

3. In this game you play with your friend. -> I dette spil kan du spille med din ven.

4. There'","  I er 9000 år siden og det er 9000 år siden det blev muligt at se den første, og den første, og den første.  Den første er den første, den første, den første, den første.  Det er den første, den første, den første, den første.  Den første, den første, den første, den første.  Den","Da Enok havde levet 65 År, avlede han Metusalem,","Enoch lived sixty-five years, and became the father of Methuselah.",20,10,125
"
Våbenskjoldet som blev fundet, viser hans våben med en skjoldhue foran og en pæl foran baghovedet.
De"," I don't know, I don't know, I don't know. I don't know. I don't know. I don't know. I don't know.  ""Jared, I don't know. I don't know. I don't know. I don't know. I don't know. I don't know","Da Enok havde levet 65 År, avlede han Metusalem,","Enoch lived sixty-five years, and became the father of Methuselah.",21,10,125
.<|endoftext|>," And the day after that, when the men of Jared were at the camp, they saw a man who had been standing at the camp with a great robe, and he said, 'I have come to dig for the dead.'  'What is it?' asked Jared.  'A dead man. He had been standing on the ground for many days, but then a man came to","Da Enok havde levet 65 År, avlede han Metusalem,","Enoch lived sixty-five years, and became the father of Methuselah.",22,10,125
" Om denne sygdom, der kom til at kalde sig lupus, siger han i dag til sin søn, at han så ikke behøvede at","  33  The king's son, the son of king, was thirty-nine years old, and he was a son of king, and his name was jared.  34  The son of king, the son of king, was twenty-one years old, and he was a son of king, and his name was son of king.  35  The son of","Da Enok havde levet 65 År, avlede han Metusalem,","Enoch lived sixty-five years, and became the father of Methuselah.",23,10,125
. Det er altså i alt 1269 år siden den sidste var på jorden.<|endoftext|>, A hundred- and a hundred- three- a hundred- a hundred- a hundred- a hundred- a hundred- a hundred- a thousand i hundred- a hundred- a hundred- a hundred- a hundred- a hundred- a hundred- a hundred- a hundred- a hundred- a thousand en hundred- a hundred- a thousand et hundrede to hundred- a hundred- a hundred- a hundred,"Da Enok havde levet 65 År, avlede han Metusalem,","Enoch lived sixty-five years, and became the father of Methuselah.",0,15,125
