danish_predicted_output,english_predicted_output,danish_true_label,english_true_label,layer,lambda_amount,bible_verse
" gubburerne"" (5 Mos. 12)
For at det kan virke sådan her, betyder det at Israel er en ""hel"," ogdenim, jadidim, ogdenim, ogdenim, jadidim, ogdenim, jadidim, jadidim, jadidim, jadidim, jadidim, jadidim, jadidim, jadidim, jadidim, jadidim,","Patruserne, Kasluherne, fra hvem Filisterne udgik, og Kaftorerne.","Pathrusim, Casluhim (which the Philistines descended from), and Caphtorim.",15,15,247
" serehutene, shemitterne og zionisterne efter de gamle israeliternes vaner fra Babylonien i Egypten og fra de"," nimahim, nimahim og Nimahim, og Nimahim, og Nimahim, og Nimahim, og Nimahim, og Nimahim, og Nimahim, og Nimahim, og Nimahim, og Nimahim, og Nimahim, og","Patruserne, Kasluherne, fra hvem Filisterne udgik, og Kaftorerne.","Pathrusim, Casluhim (which the Philistines descended from), and Caphtorim.",16,15,247
" deuteranske, shmeikare, jiddisiske og foenske luder.
Det forste eksempel paa at en af de"," ogedalim, ogedalia, ogedalia, ogedalia, ogedalia, ogedalia, ogedalia, ogedalia, ogedalia, ogedalia, ogedalia, ogedalia, ogedalia, ogedalia, ogedalia, ogedalia, ogedalia, ogedalia, ogedalia,","Patruserne, Kasluherne, fra hvem Filisterne udgik, og Kaftorerne.","Pathrusim, Casluhim (which the Philistines descended from), and Caphtorim.",17,15,247
" nainimene for at fålge sine varer. Det var altsaa efter disse grunde, at vi saa ofte faar høre, at de ved det", og afen der.                                                                                                                                              ,"Patruserne, Kasluherne, fra hvem Filisterne udgik, og Kaftorerne.","Pathrusim, Casluhim (which the Philistines descended from), and Caphtorim.",18,15,247
" amminennen, rajjanneernen, debarneben, aja'shahnen, amruniene, ra",", ogud ien, ogud er det også.    <|endoftext|>","Patruserne, Kasluherne, fra hvem Filisterne udgik, og Kaftorerne.","Pathrusim, Casluhim (which the Philistines descended from), and Caphtorim.",19,15,247
" og hymnerne, der om en saadan som jeg selv ikke vilde blive, hvis jeg ikke ike gjorde en eneste dyd for at opdrage"," og tilm skali, og til s og til m og til s og til m og til s og til s og til s og til s og til s og til s og til s og til s og til s og til s og til s og til s og til s og til s og til s og til s og til s og til s og til s og","Patruserne, Kasluherne, fra hvem Filisterne udgik, og Kaftorerne.","Pathrusim, Casluhim (which the Philistines descended from), and Caphtorim.",20,15,247
" al-muftinnene, al-awwasene, ʽabirene, al-anjaysene, �", og.                                                                                                                                                    ,"Patruserne, Kasluherne, fra hvem Filisterne udgik, og Kaftorerne.","Pathrusim, Casluhim (which the Philistines descended from), and Caphtorim.",21,15,247
" mizranerne og sadduraerne, mormonerne, perechonerne.

For example, there might be a", og uden at blive længere der. 21 og i alle de næste dage og om natten blev der der og også om i blandt de mange der blev i samme række og og ikke blev der hos dem der blev der og ikke blev der hos dem der blev der og ikke blev der hos dem der blev der og ikke blev der hos dem der blev der og ikke blev der hos,"Patruserne, Kasluherne, fra hvem Filisterne udgik, og Kaftorerne.","Pathrusim, Casluhim (which the Philistines descended from), and Caphtorim.",22,15,247
" maelaniferne, merkaherne og merkaeherne med en af de 829 268 5"," halot, halot, halot, halot, halot, halot, halot, halot, halot, halot, halot, halot, halot, halot, halot, halot, halot, halot, halot, halot, halot, halot, halot, halot, halot, hal","Patruserne, Kasluherne, fra hvem Filisterne udgik, og Kaftorerne.","Pathrusim, Casluhim (which the Philistines descended from), and Caphtorim.",23,15,247
