danish_predicted_output,english_predicted_output,danish_true_label,english_true_label,layer,lambda_amount,bible_verse
" og de fleste av alle de andre.
Han har skrevet en kort historie om hvordan jødene var i 1917. Les mer hos"," and merabim.  - caption  - notable works  - death date  - birth date  - name  - image  - birth place    Bio: ludim i (1075 -- 1133) was a biblical scholar, writer, and scholar of the hebrews.  - caption is ludim  - notable works","Patruserne, Kasluherne, fra hvem Filisterne udgik, og Kaftorerne.","Pathrusim, Casluhim (which the Philistines descended from), and Caphtorim.",0,2,247
" yajnaherne, heftalerne, deuilanerne, horthe, doraserne, 3haz"," and nachumim. The name of the latter was probably chosen by the Mizraimites, who had taken it from the name of their forefathers, the Pahlavi Jews.  The name of the first son of the son of the father of the father of the son of the son of the son of the son of the son of the son of the","Patruserne, Kasluherne, fra hvem Filisterne udgik, og Kaftorerne.","Pathrusim, Casluhim (which the Philistines descended from), and Caphtorim.",1,2,247
" og alle slags folk, så det vilde ikke finnes der. Og så vilde det være ennu mere umulig, at jødene skulde kunne finde en eneste"," and zoharim.  During the final days of the Babylonian period, the Babylonians were busy creating a new dynasty. In the first year of the reign of Ezra the first king of the dynasty, Nebuchadnezzar, was born. In the second year of his reign, Babylon was besieged by the Ass","Patruserne, Kasluherne, fra hvem Filisterne udgik, og Kaftorerne.","Pathrusim, Casluhim (which the Philistines descended from), and Caphtorim.",2,2,247
" shababerne, hibot. De som er tilbake, vet ikke deres plass. Hvis jeg vil at de skal få en plass, har"," and shemim.  In the book, the book of the prophet is recounted as saying, ""And the Lord God of Israel sent the prophet Elisha out of the land of Egypt, and said to him, ""O you prophet, I will send a man out of Egypt to you."" He said to him, ""What are you doing","Patruserne, Kasluherne, fra hvem Filisterne udgik, og Kaftorerne.","Pathrusim, Casluhim (which the Philistines descended from), and Caphtorim.",3,2,247
 qir'im-im-im-im-imim-im-im-im-im-im-im-im-im-,", and kahinim.<|endoftext|>","Patruserne, Kasluherne, fra hvem Filisterne udgik, og Kaftorerne.","Pathrusim, Casluhim (which the Philistines descended from), and Caphtorim.",4,2,247
", sanuherne, shawemieuene og shawesne.<|endoftext|>",", and benjaminim.<|endoftext|>","Patruserne, Kasluherne, fra hvem Filisterne udgik, og Kaftorerne.","Pathrusim, Casluhim (which the Philistines descended from), and Caphtorim.",5,2,247
" zadokiterne, zelamiterne; men da han kom til Judæa, faldt de alle om ham, og de kaldte",", and rashim.<|endoftext|>","Patruserne, Kasluherne, fra hvem Filisterne udgik, og Kaftorerne.","Pathrusim, Casluhim (which the Philistines descended from), and Caphtorim.",6,2,247
", achitererne og samer.<|endoftext|>",", and ha-bim, as well as the name of the ""king"" of the tribe of Judah.<|endoftext|>","Patruserne, Kasluherne, fra hvem Filisterne udgik, og Kaftorerne.","Pathrusim, Casluhim (which the Philistines descended from), and Caphtorim.",7,2,247
" sabbatsbriterne, 51634 josfaterne, 78 1032 104",", shulchan aruch, and shulchan ha-Kodesh.<|endoftext|>","Patruserne, Kasluherne, fra hvem Filisterne udgik, og Kaftorerne.","Pathrusim, Casluhim (which the Philistines descended from), and Caphtorim.",8,2,247
" levanerne, levisere, zeduherne, og jnubemeren ved den jødiske ghetto i det første århundrede,",", yosefim, and mishnehim.  - dynasty  - reign  - successor  - predecessor  - name  - religion  - death place<|endoftext|>","Patruserne, Kasluherne, fra hvem Filisterne udgik, og Kaftorerne.","Pathrusim, Casluhim (which the Philistines descended from), and Caphtorim.",9,2,247
" jenanerne, 4: jamme-gudinnens hellige, tilintetgjøre, iklojere, avlede, i"," and sonahim.  Today, the name is used for the tribe of Judah, which is in the southern part of the country.  Tribal and religious history.  The tribe of Judah was founded by the 1st century BCE, and was a part of the Judahite dynasty of Judah. The tribe was originally divided into three","Patruserne, Kasluherne, fra hvem Filisterne udgik, og Kaftorerne.","Pathrusim, Casluhim (which the Philistines descended from), and Caphtorim.",10,2,247
" mizrajimene, abesnene, zimmonene, lenaerne, tadduherne, tachurnerne"," and amimim. The name is not used for any other people.  Different branches of the Jewish religion.  The Jewish religion is divided into three branches:  The religious concept of the Holy Land is the concept of a single ""Tribe of Israel"" that has been established by God to rule the whole earth and to bless the people. This is the religion of","Patruserne, Kasluherne, fra hvem Filisterne udgik, og Kaftorerne.","Pathrusim, Casluhim (which the Philistines descended from), and Caphtorim.",11,2,247
" haftaerne, Ḥafim og aabne deres porte, da skal du og jeg tjene ham; og du skal ikke"," and ameishim.    Gediminas: Hi, I'm your automated assistant. I can answer your questions about Mizraim.  Alvar: What is the difference between Mizraim and Mizraim?  Gediminas: Mizraim Mizraim () is a city in the northern part of the","Patruserne, Kasluherne, fra hvem Filisterne udgik, og Kaftorerne.","Pathrusim, Casluhim (which the Philistines descended from), and Caphtorim.",12,2,247
" mizrajim for at kunne finde dem igen.
Eftir að Mizraim hafði aflað þöglan, ammorna", and yosefim.                                                                                                                                            ,"Patruserne, Kasluherne, fra hvem Filisterne udgik, og Kaftorerne.","Pathrusim, Casluhim (which the Philistines descended from), and Caphtorim.",13,2,247
" jakobiterne, nephiterne, peterne, orameriterne, periterne og jøriterne, ved at", and aliim.    4. Norsk: Dette er et annet alternativ som er bedre for huden.  Engelsk: This is another option that is better for your skin.    5. Norsk: Du vil kanskje også like disse hotellene i Krasnaya Polyana  Engelsk: You might also like these Krasnaya Polyana hotels    6. Norsk,"Patruserne, Kasluherne, fra hvem Filisterne udgik, og Kaftorerne.","Pathrusim, Casluhim (which the Philistines descended from), and Caphtorim.",14,2,247
" amiamikerne, amitere, lezamerne, imahaterne, eamitene, ikachonere, a"," and nahumim.  Early history.  The Mizraimite culture of the area was established in the late Bronze Age.  The earliest known mention of the name of the city is in 537 BC. The city was mentioned in 142 BC by the Arab historian Abu al-Mas'ud, and in 1","Patruserne, Kasluherne, fra hvem Filisterne udgik, og Kaftorerne.","Pathrusim, Casluhim (which the Philistines descended from), and Caphtorim.",15,2,247
" lehaberne/jom er i Ammon, ja endog af det jom er jaa at et jenere menneske (aramat)",", and shilohim.<|endoftext|>","Patruserne, Kasluherne, fra hvem Filisterne udgik, og Kaftorerne.","Pathrusim, Casluhim (which the Philistines descended from), and Caphtorim.",16,2,247
" zaimukerne, shaamukerne, adiamine og muerena. Hører du til disse?, vil du", and zalmim.    C. 23:16-20    C. 23:16-19    C. 23:20-21    C. 23:21-22    C. 23:22-23    C. 2,"Patruserne, Kasluherne, fra hvem Filisterne udgik, og Kaftorerne.","Pathrusim, Casluhim (which the Philistines descended from), and Caphtorim.",17,2,247
" haafajraberne, tadokit, pilegriinbe, heeluerne, amorerne, de votb",", and rahim.    <|endoftext|>","Patruserne, Kasluherne, fra hvem Filisterne udgik, og Kaftorerne.","Pathrusim, Casluhim (which the Philistines descended from), and Caphtorim.",18,2,247
" aronerne, ramhaherne og zuranuerne(den 514783)
Bibelen og Jesus i",", and nephthohim.<|endoftext|>","Patruserne, Kasluherne, fra hvem Filisterne udgik, og Kaftorerne.","Pathrusim, Casluhim (which the Philistines descended from), and Caphtorim.",19,2,247
" og alle de andre som er nevnt i 1 Mosebok 10 og de som er nevnt i de propheternes lister.

2"," anamim, lehabim, naphtuhim, anamim, lehabim, naphtuhim, anamim, lehabim, naphtuhim, anamim, lehabim, naphtuhim, anamim, lehabim, naphtuhim, anamim, lehabim, naphtuh","Patruserne, Kasluherne, fra hvem Filisterne udgik, og Kaftorerne.","Pathrusim, Casluhim (which the Philistines descended from), and Caphtorim.",20,2,247
" hafliberne, kivbena, kibenaimerne, kibenene, kijbaene, kibbnene",", and dibmim.<|endoftext|>","Patruserne, Kasluherne, fra hvem Filisterne udgik, og Kaftorerne.","Pathrusim, Casluhim (which the Philistines descended from), and Caphtorim.",21,2,247
" sioniterne eller jin jin hellige arv og det er netop det, han ønsker at holde fast ved.

Engelsk: On the"," and shemit. The latter two are the names of the three families of the tribe of Levi. The latter two are the names of the three families of the tribe of Levi.    Osman: Hi, I'm your automated assistant. I can answer your questions about Mizraim.  Bartlomiej: What was the city of Miz","Patruserne, Kasluherne, fra hvem Filisterne udgik, og Kaftorerne.","Pathrusim, Casluhim (which the Philistines descended from), and Caphtorim.",22,2,247
" haavnehermene, den barakiske stamme, avene, demoner, alabamisk-babylonisk, abah"," and lubavim, and was the son of ludim, anamim, lehabim, naphtuhim, and luzim.    In his biography of the Prophet, Muhammad said: ""Ludim, son of anamim, was born in the year 533, while the Prophet was a child.""    ","Patruserne, Kasluherne, fra hvem Filisterne udgik, og Kaftorerne.","Pathrusim, Casluhim (which the Philistines descended from), and Caphtorim.",23,2,247
" aflebderne, pinajerne og gaddene. Og en jom var født paa Bethesda. 3 og jeg fan"," and nachmanim.  in addition to his own sons, he had sons with a number of women, including:  ludim was the father of:  a.  anamim  b.  lehabim  c.  naphtuhim  d.  nachmanim  e.  chasan  f.  the","Patruserne, Kasluherne, fra hvem Filisterne udgik, og Kaftorerne.","Pathrusim, Casluhim (which the Philistines descended from), and Caphtorim.",0,5,247
 elamerne m. m. — De øvrige folk skulde derfor ikke være noget onde i sig selv. 3. Det hedenske og gamle,", and zimriim.  The city of Mizraim was the birthplace of Adiabene and the home of the Babylonian queen Balaam.<|endoftext|>","Patruserne, Kasluherne, fra hvem Filisterne udgik, og Kaftorerne.","Pathrusim, Casluhim (which the Philistines descended from), and Caphtorim.",1,5,247
" og de andre folk.
(Fjerne) Afgudsdyrkelse er noget, som de falske guder har. -> Den falske religionen er"," nahirim, ogimim, ogimimim, ogimimimim, ogimimimim, ogimimimimim, ogimimimimim, ogimimimimimim, ogimimimimimim, ogimimimimimim, ogimimimimimim, ogimimim","Patruserne, Kasluherne, fra hvem Filisterne udgik, og Kaftorerne.","Pathrusim, Casluhim (which the Philistines descended from), and Caphtorim.",2,5,247
" denishe, aeherne, demeteranerne, gachte, 4696-6976 og ",", sabim, and sabbim.<|endoftext|>","Patruserne, Kasluherne, fra hvem Filisterne udgik, og Kaftorerne.","Pathrusim, Casluhim (which the Philistines descended from), and Caphtorim.",3,5,247
" gadiimerne, muzrafikerne.
Der var en konge over ham, som var gudlydig og gudfrygtig i alt"," and shemim.  The Hebrew Bible, written in the Hebrew language, was the standard source for the Bible in Hebrew throughout the centuries. The first edition was written in 1912 by Rabbi Abraham Yosef ben Yosef (1865–1950), while the second edition was written in 1921 by Rab","Patruserne, Kasluherne, fra hvem Filisterne udgik, og Kaftorerne.","Pathrusim, Casluhim (which the Philistines descended from), and Caphtorim.",4,5,247
" yeduterne, lehoberne, muhannimene og ahavaimene. (Moses 52,1)"," and pshimim.    Danish: De to andre er også blevet frigivet.  English: The two others have also been released.    Danish: Jeg er ikke sikker på, at det er den rigtige måde at håndtere det på.  English: I'm not sure this is the right way to deal with it.    Danish:","Patruserne, Kasluherne, fra hvem Filisterne udgik, og Kaftorerne.","Pathrusim, Casluhim (which the Philistines descended from), and Caphtorim.",5,5,247
" anamerne, jabneherene, og neptumerne i 1 Mos. 1,23.4 Mos. ",", and shibim.<|endoftext|>","Patruserne, Kasluherne, fra hvem Filisterne udgik, og Kaftorerne.","Pathrusim, Casluhim (which the Philistines descended from), and Caphtorim.",6,5,247
"
malkierne, androcles, aruchianerne, aswachene, sudara, amharicerne.
", and shalomim.  The family of the first king of mizraim is listed in the Bible. The family of the second king of mizraim is listed in the Bible. The family of the third king of mizraim is listed in the Bible. The family of the fourth king of mizraim is listed in the Bible. The family,"Patruserne, Kasluherne, fra hvem Filisterne udgik, og Kaftorerne.","Pathrusim, Casluhim (which the Philistines descended from), and Caphtorim.",7,5,247
" meisrajim, naasura-meisrajim, zorahmene osv. I denne forbindelse var Nimreq"," and benadadim.  The name of the second Mizraim is also recorded as Mizraim the son of Nimrod, son of Nimrod, the son of Nimrod, son of Nimrod, the son of Nimrod, son of Nimrod, son of Nimrod, son of Nimrod, son","Patruserne, Kasluherne, fra hvem Filisterne udgik, og Kaftorerne.","Pathrusim, Casluhim (which the Philistines descended from), and Caphtorim.",8,5,247
 amonamerne og hordierne. 12 De foerfte af dem var jene og foe for deres Fædres G," and sabahim. The last name may refer to a ""Napthu"" (the Lord of the Nile), the last of the prophets or the last prophets of Israel.    Izabelle: Hi, I'm your automated assistant. I can answer your questions about List of biblical prophets.  Eliah: What is the meaning","Patruserne, Kasluherne, fra hvem Filisterne udgik, og Kaftorerne.","Pathrusim, Casluhim (which the Philistines descended from), and Caphtorim.",9,5,247
 khalbusherne og qafirerne for at tage med til dig. 15. Dg jeg vil atter minde eder om det,", and shapeshifters.    Thus, he is the creator of the universe.    The fact that we have 3000 years of experience with the universe is irrelevant to our understanding of its creator.<|endoftext|>","Patruserne, Kasluherne, fra hvem Filisterne udgik, og Kaftorerne.","Pathrusim, Casluhim (which the Philistines descended from), and Caphtorim.",10,5,247
" 30de og 40de Mosebok 58, og deres fedre er det. Aamir og 113"," and nachneum.    Bengt-olof: Hi, I'm your automated assistant. I can answer your questions about Mizraim.  Amalie: What was the foundation of the Mizraim?  Bengt-olof: The foundation of Mizraim was created by the Babylonians during the reign of Nebuch","Patruserne, Kasluherne, fra hvem Filisterne udgik, og Kaftorerne.","Pathrusim, Casluhim (which the Philistines descended from), and Caphtorim.",11,5,247
" bithurerne og amarikerne og deres efterkommere.
Vor Gud har elsket dem alt hvad der har været mellem dem, og"," shabbos, sabbath, and eonim.  Mizraim was a large city, and was located on the west bank of the Jordan River, east of the modern-day Jordan Valley. Its name comes from the Hebrew word ""mizra"", meaning ""large"", ""large city"", and ""mizraim"", meaning ""large town"". It","Patruserne, Kasluherne, fra hvem Filisterne udgik, og Kaftorerne.","Pathrusim, Casluhim (which the Philistines descended from), and Caphtorim.",12,5,247
" anafthuerne, nebuberne, nebenwurterne og de wahubene, vbvchte, n"," and a number of other names.    Ludim is a name that has been used to refer to the descendants of the Prophet Muhammad (saws) and his family. The name is a combination of two Arabic words meaning ""father"" and ""son"".    The Prophet Muhammad (saws) and his family have been called the ""Son of the","Patruserne, Kasluherne, fra hvem Filisterne udgik, og Kaftorerne.","Pathrusim, Casluhim (which the Philistines descended from), and Caphtorim.",13,5,247
" og aisiderne.
I 1934 var det i Shapur II den ottende store pagt, som blev afsluttet"," and nephthim.  danish: Det er også det sted, hvor man finder den første by i Mizraim, der blev far til ludim, anamim, lehabim, naphtuhim og nephthim.  english: The best part about the show is the story.  danish: Det bedste ved forestillingen er historien","Patruserne, Kasluherne, fra hvem Filisterne udgik, og Kaftorerne.","Pathrusim, Casluhim (which the Philistines descended from), and Caphtorim.",14,5,247
" petersen, david avlet de kristne, og da hans søn, israel blev ført tilbage, begyndte det at gå op for israeliterne"," nainim, nainimim, and zakhimim.  islandsk: Hana-Mizraim varð faðir Ludim, Anamim, Lehabim, Naphtuhim, Naphtuhimim, og Nainimim.  dansk: Det er en af de mest effektive metoder til at løse problemer med vand.  ","Patruserne, Kasluherne, fra hvem Filisterne udgik, og Kaftorerne.","Pathrusim, Casluhim (which the Philistines descended from), and Caphtorim.",15,5,247
", shabafierne og saddene, fordi de er troløse mot Herren.<|endoftext|>"," ogonim, ogonim, ogonim, ogonim, ogonim, ogonim, ogonim, ogonim, ogonim, ogonim, ogonim, ogonim, ogonim, ogonim, ogonim, ogonim, ogonim, ogonim, ogonim,","Patruserne, Kasluherne, fra hvem Filisterne udgik, og Kaftorerne.","Pathrusim, Casluhim (which the Philistines descended from), and Caphtorim.",16,5,247
 40000 og 5000 efter hverandre. Tabel 5.22 Anm. om Faren for Sv," and nathahim.  The Book of Mormon er den første store bog i den nye Mormons Bog, som blev skrevet af Moses. -> The Book of Mormon er den første store bog i den nye Mormons Bog, som blev skrevet af Moses.  The first step is at the level of the body. -> Det første skridt er på niveau med","Patruserne, Kasluherne, fra hvem Filisterne udgik, og Kaftorerne.","Pathrusim, Casluhim (which the Philistines descended from), and Caphtorim.",17,5,247
" abakerne og andre mindre lande, for at de skulde få indfinde sig. I henhold til lovens § 15,4 skal jødene"," ogenehim, ogenim, ogenim, ogenim, ogenim, ogenim, ogenim, ogenim, ogenim, ogenim, ogenim, ogenim, ogenim, ogenim, ogenim, ogenim, ogenim, ogenim, ogenim","Patruserne, Kasluherne, fra hvem Filisterne udgik, og Kaftorerne.","Pathrusim, Casluhim (which the Philistines descended from), and Caphtorim.",18,5,247
" lehanui, lehutanehne og de som er født fra en ammer av en jor-amme, (l"," ogonim, ognenim, ognenim ognenim, ognenim, ognenim ognenim ognenim, ognenim ognenim ognenim ognenim ognenim ognenim ognenim ognenim ognenim ognenim ognenim ognenim ognenim ognenim ognenim ognen","Patruserne, Kasluherne, fra hvem Filisterne udgik, og Kaftorerne.","Pathrusim, Casluhim (which the Philistines descended from), and Caphtorim.",19,5,247
" zuburerne, adat og amorerne, om man kan kalde dem det?
Det vil sige, hvis man mener at ha gjort"," ogabim, ogabim, ogabim, ogabim, ogabim, ogabim, ogabim, ogabim, ogabim, ogabim, ogabim, ogabim, ogabim, ogabim, ogabim, ogabim, ogabim, ogabim, ogabim,","Patruserne, Kasluherne, fra hvem Filisterne udgik, og Kaftorerne.","Pathrusim, Casluhim (which the Philistines descended from), and Caphtorim.",20,5,247
" erimaterne, og levannerne fra den hellige jord,og alle deres uomvendte børn og alle deres fande tjenere til at vende"," og-gib-gib-gib, og-gib-gib-gib, og-gib-gib-gib, og-gib-gib-gib, og-gib-gib-gib, og-gib-gib-gib, og-gib-gib-gib","Patruserne, Kasluherne, fra hvem Filisterne udgik, og Kaftorerne.","Pathrusim, Casluhim (which the Philistines descended from), and Caphtorim.",21,5,247
" hafliaferne og lehabiterne, jamt, at de, der ved deres trodhed aflede dem, maatte komme i"," and son of lachish.  Jews.  Jewish law.  Jewish law is an important source of legal information for Jewish citizens. Jewish law has been the basis of Jewish law since the time of Moses. Jewish law was the basis of the Jewish Law, the first Hebrew law.  The Jewish Law was first codified in the Law of","Patruserne, Kasluherne, fra hvem Filisterne udgik, og Kaftorerne.","Pathrusim, Casluhim (which the Philistines descended from), and Caphtorim.",22,5,247
" efrenerne,
jødene, v. 21.
Haarnet med dets rødlige farve, og om der var"," and zakhim.    The second part of the book is the ""Tradition of the Jewish People"" which tells how the Jews have lived for 1000 years. It was first published in 1921. It is written by Isaac Stern and is a great study of the Jewish people, their religion, and their culture. It is","Patruserne, Kasluherne, fra hvem Filisterne udgik, og Kaftorerne.","Pathrusim, Casluhim (which the Philistines descended from), and Caphtorim.",23,5,247
" de jinjar, og ofs og frem i de dgle. De fommer udi temte, fynbige mænds"," and anamim, and anamim, and anamim, and anamim, and anamim, and anamim, and anamim, and anamim, and anamim, and anamim, and anamim, and anamim, and anamim, and anamim, and anamim, and","Patruserne, Kasluherne, fra hvem Filisterne udgik, og Kaftorerne.","Pathrusim, Casluhim (which the Philistines descended from), and Caphtorim.",0,10,247
" abedamerne, afraamerne, anamemerne, lehamerne, emaareterne,
Satan. Men det",", and amzahim.  He was the father of ludi, anamim, lehabim, naphtuhim, and amzahim.<|endoftext|>","Patruserne, Kasluherne, fra hvem Filisterne udgik, og Kaftorerne.","Pathrusim, Casluhim (which the Philistines descended from), and Caphtorim.",1,10,247
" ameerne og rafa'erne. -> To be cleansed: zedekab og zadekab og ameerne.

", shemim and zahim.  10. en: The best part is that you will be able to spend a few minutes looking for the best deals.  111. en: The best part is that you will be able to spend a few minutes looking for the best deals.  12. en: The best part is that you will be able,"Patruserne, Kasluherne, fra hvem Filisterne udgik, og Kaftorerne.","Pathrusim, Casluhim (which the Philistines descended from), and Caphtorim.",2,10,247
" sefat-ekebaminerne, hafels-amerne, haremerne, erebamerne, eremomini;", and hirim.  -16-  -17-  -18-  -19-  -20-  -21-  -22-  -23-  -24-  -25-  -26-  -27-  -28-  -29-  ,"Patruserne, Kasluherne, fra hvem Filisterne udgik, og Kaftorerne.","Pathrusim, Casluhim (which the Philistines descended from), and Caphtorim.",3,10,247
" yaranerne. Men jeg tror de havde noget sammen, de andre israelitter; den ene lod det regne over ham og blev en stor hav",", zemachim, and shemachim.  In the time of Shabbos, the Israelites were instructed to send their daughters to Shemesh.  The name of the place of birth of the Israelites was Shemesh, which is a common name for Israel.    <|endoftext|>","Patruserne, Kasluherne, fra hvem Filisterne udgik, og Kaftorerne.","Pathrusim, Casluhim (which the Philistines descended from), and Caphtorim.",4,10,247
" horthaerne, umaheterne. Ja de skal være de øverste. De skal bli til raa, men efter dig skal de ikke"," and merabim.  In the Mishnah, the Mishnaic Book of the Law is a compilation of the laws of the Israelites, the descendants of Israel, and of the descendants of the Israelites. The Mishnaic Book of the Law is the book of the Law, and the Law is the book of the Law.  The Mish","Patruserne, Kasluherne, fra hvem Filisterne udgik, og Kaftorerne.","Pathrusim, Casluhim (which the Philistines descended from), and Caphtorim.",5,10,247
" og de,som til deres koner bar født lehuberne og de, som til dem har født amitaberne, og som til"," and rahim.  In the ""Acts"" of Luke, the second part of the book, the father of zelah, anamim, lehabim, and naphtuhim is called to name.  The second part of the book, the father of zelah, anamim, lehabim, and naphtuhim, is","Patruserne, Kasluherne, fra hvem Filisterne udgik, og Kaftorerne.","Pathrusim, Casluhim (which the Philistines descended from), and Caphtorim.",6,10,247
" og alle den aabenbarede jødiske skriftlæsers afskaarne afgudsbilleder af Moses, Abraham og Moses sønner.
("," mishnah, mishna, sabbatsbønnen, sabbats- og lovsangsbønnen, sabbats- og lovprisning, sabbats- og lovprisning af Herren, sabbats- og lovprisning af Moses, sabbats- og lovprisning af Gud, sabbats- og lovprisning af","Patruserne, Kasluherne, fra hvem Filisterne udgik, og Kaftorerne.","Pathrusim, Casluhim (which the Philistines descended from), and Caphtorim.",7,10,247
" jenene, lehaberne, dezheherne, sabene, beimene, og det fvage folk, af en",", and the names of the 22 kings of Israel.  Mizraim blev far til ludim, anamim, lehabim, naphtuhim og navnene på 22 konger i Israel.<|endoftext|>","Patruserne, Kasluherne, fra hvem Filisterne udgik, og Kaftorerne.","Pathrusim, Casluhim (which the Philistines descended from), and Caphtorim.",8,10,247
" evanerne, elanerne, og andre som de trodde var mindreverdige,og disse,for det meste,hadde mindreverdighetskomp"," and arimim. In the 3rd century, the Mizraimite sect of the Ashkenazim became the most influential in the Mizraimite sect of the Ashkenazim. In 1811, the Ashkenazim became the dominant sect of the Ashkenazim. In 1869","Patruserne, Kasluherne, fra hvem Filisterne udgik, og Kaftorerne.","Pathrusim, Casluhim (which the Philistines descended from), and Caphtorim.",9,10,247
 dennacherne og dennach-hortaferne; det var efterat han hadde sendt 1600 mand paa en reise," khalim, khepim, and mizraim, and the tribe of the Jizreel (anamim).    The tribe of the Jizreel is the descendants of the tribe of the LORD, which is the name of LORD. ->  Jizreel er navnet på den stamme, der er LORD.","Patruserne, Kasluherne, fra hvem Filisterne udgik, og Kaftorerne.","Pathrusim, Casluhim (which the Philistines descended from), and Caphtorim.",10,10,247
" jom var med ham, formanede dem! 10 Jeg er ikke fremmed for det forjellige Begreb ""Svaghed,"," nachmanim, shemnahim, ramiahim, nachmanim, zakahim og zakahim.  Moses og profeterne.  Moses og profeterne.  Moses og profeterne.  2. Mosebog.  4. Mosebog.  5. Mosebog.  6. Mosebog.  7","Patruserne, Kasluherne, fra hvem Filisterne udgik, og Kaftorerne.","Pathrusim, Casluhim (which the Philistines descended from), and Caphtorim.",11,10,247
