danish_predicted_output,english_predicted_output,danish_true_label,english_true_label,layer,lambda_amount,bible_verse
"
11 Og efter at den anden søn var født, blev han bortfæstet, og hans fader og hans moder blev skilt.
1",".  3:20 Och han skall lämna sin fader och sin moder, och tillsammans med honom skall han hava en hustru;<|endoftext|>","Og de var begge nøgne, både Adam og hans Hustru, men de bluedes ikke.","They were both naked, the man and his wife, and were not ashamed.",0,2,54
".
80:1 And the sons of the dead came unto him to deliver him from Egypt; and they gave him a daughter.<|endoftext|>",.  3:16 Derfor skal en Mand forlade sin Fader og sin Moder og slutte sig til sin Hustru og blive et Menneske.<|endoftext|>,"Og de var begge nøgne, både Adam og hans Hustru, men de bluedes ikke.","They were both naked, the man and his wife, and were not ashamed.",1,2,54
" Men efter den tid vil hans mor være død. Hvordan skal det så gå med ham, når hans moder kommer igen og bringer ham hjem igen? Den",.<|endoftext|>,"Og de var begge nøgne, både Adam og hans Hustru, men de bluedes ikke.","They were both naked, the man and his wife, and were not ashamed.",2,2,54
.<|endoftext|>,".  16:11 Og dersom en mand forlader sin far og sin mor, og han vil gå med sin hustru, og de vil være ét kød, da skal han blive hos sin far og sin mor.<|endoftext|>","Og de var begge nøgne, både Adam og hans Hustru, men de bluedes ikke.","They were both naked, the man and his wife, and were not ashamed.",3,2,54
.<|endoftext|>,"    13. 40 procent af disse kvinder er i dag arbejdsløse. -> 40% of these women are unemployed today.    14. Hvad er det, der er så godt ved at have en hund? -> What's so good about having a dog?    15. Det er også vigtigt at holde sig til sin","Og de var begge nøgne, både Adam og hans Hustru, men de bluedes ikke.","They were both naked, the man and his wife, and were not ashamed.",4,2,54
"
Dansk
When we move from one life to another—after death—we leave a man who has left his father and mother and has a wife"," But when a man is married, he will be a man with a wife, and they will be one flesh.  18:21 But the man will be a man with a wife, and they will be one flesh.  18:22 But if a man has two wives, he is not a man with a wife.  18:2","Og de var begge nøgne, både Adam og hans Hustru, men de bluedes ikke.","They were both naked, the man and his wife, and were not ashamed.",5,2,54
".
Så sier han: ""Dere skal ikke gifte dere, men holde eder til eder kone, for de to skal bli et"".<|endoftext|>",.<|endoftext|>,"Og de var begge nøgne, både Adam og hans Hustru, men de bluedes ikke.","They were both naked, the man and his wife, and were not ashamed.",6,2,54
" [12]

21 For der er to konger, som er sammen i hob, der er to konger, som er sammen i",    Svenska: Det är mycket viktigt att du använder ett riktigt namn.  Engelska: It is important that you use a real name.    Svenska: Alla 258 hotell i New York City  Engelska: All 258 hotels in New York City    Svenska: Hotell nära Parc des Expositions de Cannes  Engelska: Hotels near Parc,"Og de var begge nøgne, både Adam og hans Hustru, men de bluedes ikke.","They were both naked, the man and his wife, and were not ashamed.",7,2,54
"

Men nu, da du har overgivet din vilje, skal Faderen i dig selv give liv"". -> Og nu, efter at du har",".  40:10 Men dersom en mann forlater sin far og sin mor og gifter sig med sin hustru, da skal de bli ett kjød.<|endoftext|>","Og de var begge nøgne, både Adam og hans Hustru, men de bluedes ikke.","They were both naked, the man and his wife, and were not ashamed.",8,2,54
"
4 Og de to bliver et kød, uden at nogen fader bliver tilbage.
5 Når barnet fødes, bliver han eller hun til en mand","    18:25-28. 25 Then they will go out to the cities, and they will meet the king of Babylon, and they will make a treaty with him, and the king of Babylon will come and take his son from him.    18:29. 30 But they will go to the king","Og de var begge nøgne, både Adam og hans Hustru, men de bluedes ikke.","They were both naked, the man and his wife, and were not ashamed.",9,2,54
"
Kærlighed gør dem skilt, og de får aldrig igen hinanden. Og da de ser på hinanden, ligner de hinanden med lige brede ansigts",".  sv:  Men om en man lämnar sin fader och sin moder, och går med sin hustru, skall han bli en enda man.<|endoftext|>","Og de var begge nøgne, både Adam og hans Hustru, men de bluedes ikke.","They were both naked, the man and his wife, and were not ashamed.",10,2,54
".
Således har mennesket sin oprindelse i et og samme væsen og i en fælles personlighed.<|endoftext|>",".  10:16 Og jeg siger jer: Den, der går fra sin Fader og sin Moder, han vil forlade sin Fader og sin Moder, og de skal være ét Kød.<|endoftext|>","Og de var begge nøgne, både Adam og hans Hustru, men de bluedes ikke.","They were both naked, the man and his wife, and were not ashamed.",11,2,54
" 7:9 Det er sagt ved Moses: ""Dernæst skal du have en søn, en ung mand, ved navn David. Han skal","  23:33, 34; 26:26; 28:28, 29, 32  23:34, 36; 27:38; 30:26  23:36, 37; 30:29  2","Og de var begge nøgne, både Adam og hans Hustru, men de bluedes ikke.","They were both naked, the man and his wife, and were not ashamed.",12,2,54
"
30 For they may not depart from the land of David, nor go forth from the land of Israel, but will go from the LORD",.<|endoftext|>,"Og de var begge nøgne, både Adam og hans Hustru, men de bluedes ikke.","They were both naked, the man and his wife, and were not ashamed.",13,2,54
"
42 Og da de nu var komne ind til landsbyen i Egypten, 60
aldrig såe de til dem mere, men",.<|endoftext|>,"Og de var begge nøgne, både Adam og hans Hustru, men de bluedes ikke.","They were both naked, the man and his wife, and were not ashamed.",14,2,54
" Den kvinde, hvis mand og børn er i huset, bor med dem, og en moder, der ikke bor sammen med sin mand, bor med hende",".  Derefter vil en mand forlade sin far og sin mor, og han vil slutte sig til sin hustru, og de vil være ét kød.<|endoftext|>","Og de var begge nøgne, både Adam og hans Hustru, men de bluedes ikke.","They were both naked, the man and his wife, and were not ashamed.",15,2,54
.<|endoftext|>,.<|endoftext|>,"Og de var begge nøgne, både Adam og hans Hustru, men de bluedes ikke.","They were both naked, the man and his wife, and were not ashamed.",16,2,54
" Og i samme øjeblik, Gud åbner munden med munden, så bliver Gud åbnet. Så er det et nyt forhold til Gud, som man som barn eller",".  5 Og jeg vil give dig en fader og en moder, som skal være ét kød.<|endoftext|>","Og de var begge nøgne, både Adam og hans Hustru, men de bluedes ikke.","They were both naked, the man and his wife, and were not ashamed.",17,2,54
.<|endoftext|>,".  da  Den samme tro er også den, som jeg tror, der bliver givet til dem, der er villige til at forlade deres forældre og deres mødre, og som vil slutte sig til deres hustru og blive ét kød.<|endoftext|>","Og de var begge nøgne, både Adam og hans Hustru, men de bluedes ikke.","They were both naked, the man and his wife, and were not ashamed.",18,2,54
".
Engelsk: 1:32 Then also he that has gone abroad hath left his father and mother and become one flesh.<|endoftext|>",.<|endoftext|>,"Og de var begge nøgne, både Adam og hans Hustru, men de bluedes ikke.","They were both naked, the man and his wife, and were not ashamed.",19,2,54
" -> (Matt 10:7) From that moment onward, the ""gentleman is out of his father's and mother's",.<|endoftext|>,"Og de var begge nøgne, både Adam og hans Hustru, men de bluedes ikke.","They were both naked, the man and his wife, and were not ashamed.",20,2,54
" (2. Mosebog 13,15) Hvis de ikke har fælles afkom, bliver de alle et kød, nemlig én, og",.<|endoftext|>,"Og de var begge nøgne, både Adam og hans Hustru, men de bluedes ikke.","They were both naked, the man and his wife, and were not ashamed.",21,2,54
" 23:40,42. 3 Mosebog er Guds ord; det er uforfalsket, uforfalsket. Vi skal"," And the man will be a father and a mother, and he will be a man and a woman, and they will be one flesh. And the man will be a father and a mother, and they will be one flesh. And the man will be a father and a mother, and they will be one flesh. And the man will be a father and a mother,","Og de var begge nøgne, både Adam og hans Hustru, men de bluedes ikke.","They were both naked, the man and his wife, and were not ashamed.",22,2,54
.<|endoftext|>,.<|endoftext|>,"Og de var begge nøgne, både Adam og hans Hustru, men de bluedes ikke.","They were both naked, the man and his wife, and were not ashamed.",23,2,54
"

21. When they finished reading these verses, and he rose up and spoke to them, they were greatly amazed and said to"," And the woman will bear the child, and the father will bear the son. And the mother will be with the child, and the father will be with the son. And the child shall bear the mother, and the father shall bear the son. And the mother shall bear the child, and the father shall bear the son. And the child shall bear the mother, and","Og de var begge nøgne, både Adam og hans Hustru, men de bluedes ikke.","They were both naked, the man and his wife, and were not ashamed.",0,5,54
"
Så länge en jude eller grek håller fast vid att han kommer att lämna sin fader och moder och gå till sin hustru och de två blir ett kött",.<|endoftext|>,"Og de var begge nøgne, både Adam og hans Hustru, men de bluedes ikke.","They were both naked, the man and his wife, and were not ashamed.",1,5,54
" Så det er nok mest menneskeligt i en sådan situation, så ville jeg nok sige, at jeg i praksis aldrig ville gøre det. Jeg er et","  18:28 And he shall give him the land of Manasseh, and the land of Judah, and the land of Benjamin, and the land of Samaria, and the land of Judah, and the land of Israel, and the land of the Philistines, and the land of the Amorites, and the land of the Am","Og de var begge nøgne, både Adam og hans Hustru, men de bluedes ikke.","They were both naked, the man and his wife, and were not ashamed.",2,5,54
"
Hebreerne 1:4
Lær om de principper der er om den kristne tro.
Men ved at forstå troen kan du",  The marriage of a man and his wife is the marriage of one man to one woman. The marriage of a man and his wife is the marriage of one man to a woman. The marriage of a man and his wife is the marriage of one man to a woman.  The marriage of a man and his wife is the marriage of one man to one woman. The,"Og de var begge nøgne, både Adam og hans Hustru, men de bluedes ikke.","They were both naked, the man and his wife, and were not ashamed.",3,5,54
".
And when the man departs and leaves his father and mother and holds his wife, and they two become one flesh.<|endoftext|>",    12. Norsk: Og de har vært en suksess.  Engelsk: And they have been a success.    13. Norsk: Dette er en av de mange fordelene ved å reise.  Engelsk: This is one of the many advantages of travelling.    14. Norsk: - Det er bare en ting som er sikkert: Det kommer til,"Og de var begge nøgne, både Adam og hans Hustru, men de bluedes ikke.","They were both naked, the man and his wife, and were not ashamed.",4,5,54
"
731.12.40.55.19
Lukas 19:19
40:1"," But we have not found that they will be one flesh.    12.3.1954    In this passage, I want to remind you of the fact that the Jewish people have always been divided into two great camps: the ""cold"" and the ""warm"".    The ""cold"" camp is divided into the ""K","Og de var begge nøgne, både Adam og hans Hustru, men de bluedes ikke.","They were both naked, the man and his wife, and were not ashamed.",5,5,54
"
In Jesus Kristus (1:10b), these words were repeated, ""But those who leave one father overtake his mother and marry the","    14 And he that hath a son, and a daughter, shall eat the flesh of the living thing: for they shall not live, and they shall die, and they shall not live, and they shall die, and they shall not live.    15 And the son shall eat the flesh of the living thing, and the daughter shall eat the","Og de var begge nøgne, både Adam og hans Hustru, men de bluedes ikke.","They were both naked, the man and his wife, and were not ashamed.",6,5,54
.<|endoftext|>,.<|endoftext|>,"Og de var begge nøgne, både Adam og hans Hustru, men de bluedes ikke.","They were both naked, the man and his wife, and were not ashamed.",7,5,54
.<|endoftext|>,".  17:12, 13) Mennesket kan ikke holde fast ved sin far og sin mor og slutte sig til sin hustru, og de skal være ét kød.<|endoftext|>","Og de var begge nøgne, både Adam og hans Hustru, men de bluedes ikke.","They were both naked, the man and his wife, and were not ashamed.",8,5,54
.<|endoftext|>,  9. Det kan vara en bra idé att se till att din katt har en bra plats att sova på. ->  It may be a good idea to make sure your cat has a good place to sleep.  10. Vi har inte råd att låta dessa saker förstöra vår framtid. ->  We cannot afford to let this thing destroy our future.  11,"Og de var begge nøgne, både Adam og hans Hustru, men de bluedes ikke.","They were both naked, the man and his wife, and were not ashamed.",9,5,54
"

norsk: En viktig forskjell mellom Sennheiser Ion X50 og Sennheiser Ion 50 er at den",".  24:15 Og han skal forlade sin Fader og sin Moder og gå ind med sin Hustru, og de skal være ét Kød.<|endoftext|>","Og de var begge nøgne, både Adam og hans Hustru, men de bluedes ikke.","They were both naked, the man and his wife, and were not ashamed.",10,5,54
" Og en af disse skal have det højeste embede, og han skal give hans familie dette rige og tjene det indtil de dages ende."" (v.",.<|endoftext|>,"Og de var begge nøgne, både Adam og hans Hustru, men de bluedes ikke.","They were both naked, the man and his wife, and were not ashamed.",11,5,54
.<|endoftext|>,"  ""But you shall not go with him, and you shall not go with him to the land of Canaan, nor with him to the land of Judah.  ""And he shall not come with you, neither with you nor with you to the land of Canaan, nor with you to the land of Judah, but he shall be with you","Og de var begge nøgne, både Adam og hans Hustru, men de bluedes ikke.","They were both naked, the man and his wife, and were not ashamed.",12,5,54
.<|endoftext|>,.<|endoftext|>,"Og de var begge nøgne, både Adam og hans Hustru, men de bluedes ikke.","They were both naked, the man and his wife, and were not ashamed.",13,5,54
"
3:11 En mand er ikke værdig til at være sammen med sin hustru, som sidder hos ham, ikke heller er han værdig","    3. Dansk: Men det er meget, meget svært at blive gravid.  Engelsk: However, it is very, very difficult to get pregnant.    4. Dansk: Jeg ville ikke have gjort det, hvis det ikke var for dig.  Engelsk: I wouldn't have done this if it weren't for you.    5. Dansk","Og de var begge nøgne, både Adam og hans Hustru, men de bluedes ikke.","They were both naked, the man and his wife, and were not ashamed.",14,5,54
.<|endoftext|>," 28:25 Men skal ikke lade sig skille fra deres fader og moder, og de skal være ét kød. 28:26 Menneskene skal ikke skille sig fra deres fædre og deres mødre, men være ét kød. 28:27 Menneskene skal ikke skille sig fra deres fædre og deres mødre, men","Og de var begge nøgne, både Adam og hans Hustru, men de bluedes ikke.","They were both naked, the man and his wife, and were not ashamed.",15,5,54
" Det hører til en særlig tradition i jødisk tro at gifte sig med sin første hustru.
Ifølge jødisk lov er det også forbudt at gifte","    5. Vi har jo alle sammen været der. ->  We have all been there.    6. Det er en slags ""overgang"", siger han. ->  It's a sort of transition, he says.    7. Hvad er de bedste måder at komme i gang med SEO? ->  What are the Best Wayes at komme igang","Og de var begge nøgne, både Adam og hans Hustru, men de bluedes ikke.","They were both naked, the man and his wife, and were not ashamed.",16,5,54
"
english: The second time his wife, having seen herself as a virgin, abandons her husband and mother, and abandons herself completely to her",".  13:23 Og den første skal være en mand, som forlader sin far og sin mor, og han skal gå sammen med sin hustru, og de skal være ét kød.<|endoftext|>","Og de var begge nøgne, både Adam og hans Hustru, men de bluedes ikke.","They were both naked, the man and his wife, and were not ashamed.",17,5,54
"
14 And again, saying unto him, What will ye be, that ye walk not: but shall I take thee out of the house",.<|endoftext|>,"Og de var begge nøgne, både Adam og hans Hustru, men de bluedes ikke.","They were both naked, the man and his wife, and were not ashamed.",18,5,54
"
(13) Og Jesus forklarede Peter: ""Men han gik og talte med dem og spurgte dem: ""Skulle der ikke være en",.<|endoftext|>,"Og de var begge nøgne, både Adam og hans Hustru, men de bluedes ikke.","They were both naked, the man and his wife, and were not ashamed.",19,5,54
"
engelsk: From man to woman, all men enter into family. At first, all men were considered homosexuals. After they were born, however"," 13 But if a woman gives birth to a son, or a daughter, or a son-in-law, or a daughter-in-law, or a son-in-law-in-law, or a son-in-law-in-law, or a daughter-in-law-in-law, or a daughter-in-","Og de var begge nøgne, både Adam og hans Hustru, men de bluedes ikke.","They were both naked, the man and his wife, and were not ashamed.",20,5,54
.<|endoftext|>,"  dansk: 12:17 og jeg vil ikke mere lade den mand, som er i min hånd, gå fra sin far og sin mor, og han skal gå sammen med sin hustru, og de skal være ét kød.    engelsk: I've been thinking about this for a while now, and I think I've finally figured it out.","Og de var begge nøgne, både Adam og hans Hustru, men de bluedes ikke.","They were both naked, the man and his wife, and were not ashamed.",21,5,54
"
When a man returns from a life separate from his father and mother and turns instead into a man, he lives with his wife, and they become"," 37:20 - 22 But you, O Israel, will not be one flesh, but will be one spirit. 37:23 - 24 But you will not be one flesh, but will be one spirit. 37:25 And you will not have one flesh, but will have one spirit. 37","Og de var begge nøgne, både Adam og hans Hustru, men de bluedes ikke.","They were both naked, the man and his wife, and were not ashamed.",22,5,54
"
English: This can come from one's heart, not one's body, but from one's soul that knows that no matter how",.<|endoftext|>,"Og de var begge nøgne, både Adam og hans Hustru, men de bluedes ikke.","They were both naked, the man and his wife, and were not ashamed.",23,5,54
".
It is not a good sign when a man leaves one's father and mother and his wife, and they become one man.<|endoftext|>",    8. 0.0011% Prosentvis endring i vekt (G) ->  0.0011% Procent change in Weight (G)    9. Hva er forskjellen mellom en T10 og en T10+? ->  What is the difference between a T10 and a T10+?,"Og de var begge nøgne, både Adam og hans Hustru, men de bluedes ikke.","They were both naked, the man and his wife, and were not ashamed.",0,10,54
"
Engelsk: When this happens a man leaves his wife and abandons his father and mother, and they become one flesh.
7. Dansk:","  engelsk: Það er líka í boði að maður fari með foreldri sínu og móður hans, og mun fara með konu sinni, og þeir verða eitt kyn.      islandsk: Þetta er ekki svo langt frá, en það er mjög erfitt að komast þangað.  islandsk: Þetta er ekki svo langt frá, en það er mjög erfitt að komast þangað.  ","Og de var begge nøgne, både Adam og hans Hustru, men de bluedes ikke.","They were both naked, the man and his wife, and were not ashamed.",1,10,54
". ->
Norsk<|endoftext|>"," ->  The Lord will leave his father and his mother and join with his wife and they will be one flesh.      2. Det er en slags ""the good life"" - og det er det. ->  Det er en slags ""The Good Life"" - og det er det.      3. Det er nødvendigt at tage hensyn til den fremtidige udvikling","Og de var begge nøgne, både Adam og hans Hustru, men de bluedes ikke.","They were both naked, the man and his wife, and were not ashamed.",2,10,54
"
English: After that, you will leave the man and stay with his wife and they will become one flesh.

Danish: ""Er","  2007, 293, 294.  2007, 295.  2007, 296.  2007, 297.  2007, 298.  2007, 299.  200","Og de var begge nøgne, både Adam og hans Hustru, men de bluedes ikke.","They were both naked, the man and his wife, and were not ashamed.",3,10,54
" ->
dansk
The Greek text does not say anything about a transsexual man leaving his father and mother and staying with his wife and becoming one",                                                                                                                                                      ,"Og de var begge nøgne, både Adam og hans Hustru, men de bluedes ikke.","They were both naked, the man and his wife, and were not ashamed.",4,10,54
"
7 Og han førte dem hjem og sagde: »Du, du får aldrig en datter,
hvis far er dig fremmed, og din moder er",.<|endoftext|>,"Og de var begge nøgne, både Adam og hans Hustru, men de bluedes ikke.","They were both naked, the man and his wife, and were not ashamed.",5,10,54
"
english: So the mother, who is separated from her children, leaves her son and the latter leaves his stepmother and stays in marriage with him","  16.15 For if any man would come in to make a covenant, or to make a covenant with his father, or make a covenant with his mother, or make a covenant with his wife, or make a covenant with his son, or make a covenant with his daughter, or make a co","Og de var begge nøgne, både Adam og hans Hustru, men de bluedes ikke.","They were both naked, the man and his wife, and were not ashamed.",6,10,54
"
14.3.1988
1650
Ruslands historie begynder med Kejser Vladimir IIs første kr",.<|endoftext|>,"Og de var begge nøgne, både Adam og hans Hustru, men de bluedes ikke.","They were both naked, the man and his wife, and were not ashamed.",7,10,54
" ->
27 En nú fara menn úr húsi sínu og láta fara frá sér andann, en hver til sinnar mannskepnu skil"," 13 But when he sees his wife, and she is with her son, and his wife is with her son, and his wife is with him, he will go up to his mother's house, and his mother will be with him, and they will be one flesh. 14 Then his mother will be with him, and they will be one flesh","Og de var begge nøgne, både Adam og hans Hustru, men de bluedes ikke.","They were both naked, the man and his wife, and were not ashamed.",8,10,54
"

Engelsk: It's very, very interesting.
Dansk: Det er ganske interessant.

Engelsk: There are no plans to build",                                                                                                                                                      ,"Og de var begge nøgne, både Adam og hans Hustru, men de bluedes ikke.","They were both naked, the man and his wife, and were not ashamed.",9,10,54
.<|endoftext|>,. ->  engelska<|endoftext|>,"Og de var begge nøgne, både Adam og hans Hustru, men de bluedes ikke.","They were both naked, the man and his wife, and were not ashamed.",10,10,54
".

Jeg tror ikke de vil have noget andet liv, bare mere glæde.<|endoftext|>",.<|endoftext|>,"Og de var begge nøgne, både Adam og hans Hustru, men de bluedes ikke.","They were both naked, the man and his wife, and were not ashamed.",11,10,54
.<|endoftext|>,.<|endoftext|>,"Og de var begge nøgne, både Adam og hans Hustru, men de bluedes ikke.","They were both naked, the man and his wife, and were not ashamed.",12,10,54
" — Apostlenes Gerninger 6, 21. Det, som en mand er skyld i efter Guds befaling, kaldes det onde,",.<|endoftext|>,"Og de var begge nøgne, både Adam og hans Hustru, men de bluedes ikke.","They were both naked, the man and his wife, and were not ashamed.",13,10,54
"
""Døden er et tegn i ørkenen."" - ""Den er en del af livet i ørkenen"". - ""Dit liv afhænger af",".  24:17: ""Den, som forlader sin Fader og sin Moder og bliver hos sin Hustru, skal være en Kvindes Mand, og de skal være ét Kød.""<|endoftext|>","Og de var begge nøgne, både Adam og hans Hustru, men de bluedes ikke.","They were both naked, the man and his wife, and were not ashamed.",14,10,54
". ->
So now he takes a man from his father and mother and goes with her, and they both become one flesh.<|endoftext|>",".  5:23 Da vil der blive sagt: ""Han skal forlade sin fader og sin moder, og de skal blive ét kød.<|endoftext|>","Og de var begge nøgne, både Adam og hans Hustru, men de bluedes ikke.","They were both naked, the man and his wife, and were not ashamed.",15,10,54
" Også i den jødiske Talmud siges der, at man ved fødslen skal gifte sig med sin moder, men dette forekommer kun, når den jødiske Gud","  15, 16, 17, 18, 19, 20, 21, 22, 23, 24, 25, 26, 27, 28, 29, 30, 31, 32, 33","Og de var begge nøgne, både Adam og hans Hustru, men de bluedes ikke.","They were both naked, the man and his wife, and were not ashamed.",16,10,54
"
Men om nogen af jer, som har en anden religion end den, jeg bekendte med jer, eller I af andre årsager ikke ønsker at give",  100.  101.  102.  103.  104.  105.  106.  107.  108.  109.  110.  111.  112.  113.  114.,"Og de var begge nøgne, både Adam og hans Hustru, men de bluedes ikke.","They were both naked, the man and his wife, and were not ashamed.",17,10,54
" Da forlader en anden fader sin moder for bestandigt, og han holder sig til sin hustru, således holder de den samme slægt sammen ved sin død.""""","    I har ikke lyst til at blive ved med at lave disse lange lister med ""bare"" for at kunne få et større overblik over, hvilke der er gode og hvilke der er dårlige.    Vi skal ikke altid se på det, vi ikke kan kontrollere, men se på det, vi kan kontrollere.                        ","Og de var begge nøgne, både Adam og hans Hustru, men de bluedes ikke.","They were both naked, the man and his wife, and were not ashamed.",18,10,54
