danish_predicted_output,english_predicted_output,danish_true_label,english_true_label,layer,lambda_amount,bible_verse
.<|endoftext|>," The name of the one wife was lamech, and the name of the other zillah. The name of the one wife was adah, and the name of the other zillah. The name of the one wife was lamech, and the name of the other zillah. The name of the one wife was adah","Ada fødte Jabal; han blev Stamfader til dem, der bor i Telte og holder Kvæg;","Adah gave birth to Jabal, who was the father of those who dwell in tents and have livestock.",0,2,98
" Hist den anden var datter af de to første, hun var da 32 og 31 aar gammel. I denne alder havde hun faa"," He was a slave to zillah, but she was his wife.  The next day, the people of Lamech were told that the angel of God was going to punish the people of Lamech for the wickedness of the people of the Lamech.  They were told that the angel of God would punish the people of the Lame","Ada fødte Jabal; han blev Stamfader til dem, der bor i Telte og holder Kvæg;","Adah gave birth to Jabal, who was the father of those who dwell in tents and have livestock.",1,2,98
.<|endoftext|>," Zillah was a beautiful, red-haired girl with a long dark brown hair. She had a face that was slightly wrinkled, and she wore a red dress with a purple and green pattern on it. She was about six feet tall.  ""How is your father?"" I asked.  ""He's fine,"" she said. ""","Ada fødte Jabal; han blev Stamfader til dem, der bor i Telte og holder Kvæg;","Adah gave birth to Jabal, who was the father of those who dwell in tents and have livestock.",2,2,98
" Han var søn af en konges sabelmand, som hed Abjashilh. Han blev ærkekonges søn i Juda, og","  In 1983, when I was fifteen years old, I was invited to a wedding in the village of Tariq in the south of the country, and I was one of the brides.  I was invited to marry my father, a very wealthy man, and I was the bride. My father was a very poor man,","Ada fødte Jabal; han blev Stamfader til dem, der bor i Telte og holder Kvæg;","Adah gave birth to Jabal, who was the father of those who dwell in tents and have livestock.",3,2,98
" Men da de var mærtede til døden, og den ene af dem blev sat op til himlen, da blev ada, den anden zilla",".  During the first century of the Islamic period, the name of the one was zillah, the name of the other adah.<|endoftext|>","Ada fødte Jabal; han blev Stamfader til dem, der bor i Telte og holder Kvæg;","Adah gave birth to Jabal, who was the father of those who dwell in tents and have livestock.",4,2,98
.<|endoftext|>,"    Nathaniel: Hi, I'm your automated assistant. I can answer your questions about Ash-Sharif.  Benedikte: What is the meaning of Ash-Sharif?  Nathaniel: Ash-Sharif Ash-Sharif (Arabic: العشريف) is a Palestinian religious","Ada fødte Jabal; han blev Stamfader til dem, der bor i Telte og holder Kvæg;","Adah gave birth to Jabal, who was the father of those who dwell in tents and have livestock.",5,2,98
" Da gik de begge op og ud i skibet; den ene havde hirden på, den anden havde en hund ved bæltet. Så lagde","  He then went to the temple of elohim, and found the temple of elohim was full of angels, and the angels were all men.  He went to the temple of elohim, and found the temple of elohim was full of angels, and the angels were all women.  He went to the temple of elohim","Ada fødte Jabal; han blev Stamfader til dem, der bor i Telte og holder Kvæg;","Adah gave birth to Jabal, who was the father of those who dwell in tents and have livestock.",6,2,98
"
4. English: It is time for you to come to terms with it.
Danish: Den tid er her, hvor du skal acceptere"," The first wife was the daughter of adan, the second the daughter of zillah. The mother of zillah was madana, the mother of madana was madana, and the mother of adan was adan. The second wife was the daughter of zillah. The mother of adan was madana, the mother of madana","Ada fødte Jabal; han blev Stamfader til dem, der bor i Telte og holder Kvæg;","Adah gave birth to Jabal, who was the father of those who dwell in tents and have livestock.",7,2,98
" 5 De gik så i land; og da Herren Gud havde sunget, drog de sammen og slog lejr langt borte i ødemarken ved en","    14. norsk: For at du skal få et godt inntrykk av Hotell Astoria i Aten, kan du se på bildene av Hotell Astoria.  engelsk: In order to get a good impression of Hotel Astoria in Athens, take a look at the pitures of Hotel Astoria.    15. norsk","Ada fødte Jabal; han blev Stamfader til dem, der bor i Telte og holder Kvæg;","Adah gave birth to Jabal, who was the father of those who dwell in tents and have livestock.",8,2,98
.<|endoftext|>,"  Mihra: What was the result of this?  Nayeli: The three women were in love, but one, Zillah, had her heart broken.  Mihra: Did they ever get married?  Nayeli: In 708, he married a woman named Salam.  Mihra: Did they","Ada fødte Jabal; han blev Stamfader til dem, der bor i Telte og holder Kvæg;","Adah gave birth to Jabal, who was the father of those who dwell in tents and have livestock.",9,2,98
.<|endoftext|>,"  Early life.  The name of Adah is given in the Bible in the Book of Exodus 19:15, where it is read as ""the name of a woman."" The name of the other name is not given, although it is given in the Book of Esther in the Book of Ruth in the Book of Esther","Ada fødte Jabal; han blev Stamfader til dem, der bor i Telte og holder Kvæg;","Adah gave birth to Jabal, who was the father of those who dwell in tents and have livestock.",10,2,98
"

engelsk: The whole village was so welcoming and we felt at home
dansk: Hele landsbyen var så imødekommende og følte sig hjemme

","        The prophet had a dream. When he woke up, he found the prophet had gone.        ""I have been looking for you for years. I have been waiting for you. I have been waiting for you for years. I have been waiting for you for years. I have been waiting for you for years. I","Ada fødte Jabal; han blev Stamfader til dem, der bor i Telte og holder Kvæg;","Adah gave birth to Jabal, who was the father of those who dwell in tents and have livestock.",11,2,98
"
38 Men de fik to døtre, som hed hammurabi og zina, og det gik med dem, som de ville;"," The name of the first wife was adha, and the name of the second was zillah.  When the wife of the Lamech was pregnant, the angel of the Lamech's wife asked her, ""Who is the first wife?"" She said, ""The first wife is the angel of the Lamech's wife. The","Ada fødte Jabal; han blev Stamfader til dem, der bor i Telte og holder Kvæg;","Adah gave birth to Jabal, who was the father of those who dwell in tents and have livestock.",12,2,98
" Og alle hans hustruerne var smukke; og om eftermiddagen, da jesuiten gik frem og tilbage, der med ham, kom de forbi j"," The other wife, adah, was the wife of aphra. The name of the third wife was shemesh, and the name of the fourth wife was aram, and the name of the fifth wife was zilpah. The third wife was the wife of aram.  In the Bible, Aram is the name of the","Ada fødte Jabal; han blev Stamfader til dem, der bor i Telte og holder Kvæg;","Adah gave birth to Jabal, who was the father of those who dwell in tents and have livestock.",13,2,98
". ->
Norsk<|endoftext|>","    The other women's names were Zilah and Adah.    It was a time when women were thought of as having a strong sense of honor.    Adah, Zilah, and Zillah were all women, and they were all thought of as having strong sense of honor.    This is because they","Ada fødte Jabal; han blev Stamfader til dem, der bor i Telte og holder Kvæg;","Adah gave birth to Jabal, who was the father of those who dwell in tents and have livestock.",14,2,98
" De lod den ene af dem blive hos en jomfru, der var født uden mand, ligesom der ikke er blevet nogen mand uden hustru. Derfor blev"," When adah was born, the wife of the man was not named, but zillah. Adah was a beautiful girl, but she had a bad temper.  When adah was older, the man would come to her house and start talking to her. ""I'm so glad you're here,"" he would say. ""","Ada fødte Jabal; han blev Stamfader til dem, der bor i Telte og holder Kvæg;","Adah gave birth to Jabal, who was the father of those who dwell in tents and have livestock.",15,2,98
"
24:9 Han sagde til dem: ""Fader, hvad skal jeg gøre her? Tag de tre hustruer og smid dem ud i","  In 637, the two wives were put into a cage together. The lamech made a basket from a stone, and put a little stone in the basket to help it. When the two wives were about to eat, the lamech said, ""Come, come, my wife. Come, my wife. This is the basket I","Ada fødte Jabal; han blev Stamfader til dem, der bor i Telte og holder Kvæg;","Adah gave birth to Jabal, who was the father of those who dwell in tents and have livestock.",16,2,98
"
""Også en tredje konge har efterladt sin tjener i en stor by. ->
Også en tredje konge dro sin tjeners sønn til","  Hamza: What did the two women do together?  Rafael: The two women became friends and eventually became lovers.  Hamza: Did they have any children?  Rafael: Hamza's daughter, adah, was pregnant and was later killed in an accident.  Hamza: What happened after that","Ada fødte Jabal; han blev Stamfader til dem, der bor i Telte og holder Kvæg;","Adah gave birth to Jabal, who was the father of those who dwell in tents and have livestock.",17,2,98
" Men da nu alt det her var tilregnet, bad de om at få den tredje kone, den anden kaldet qara. Hun var to år yngre","  Both wives of the same name, however, were of the same race, and there was no difference between the two. The name of the first was adah, and the name of the second zillah.  The two women who were of the same race had been given the name of ada. This name was used for all of them","Ada fødte Jabal; han blev Stamfader til dem, der bor i Telte og holder Kvæg;","Adah gave birth to Jabal, who was the father of those who dwell in tents and have livestock.",18,2,98
" I 1664 var de begge 14.
Han deltog ikke i slaget ved Valkyriæ og de fleste af hans h","  21 But when the lamech had been given two wives, he said to the women of the city, ""Thus says the Lord: If you have not killed the woman who is the father of your son, you will be put to death by the sword.""  22 And the women of the city said, ""We know not how to","Ada fødte Jabal; han blev Stamfader til dem, der bor i Telte og holder Kvæg;","Adah gave birth to Jabal, who was the father of those who dwell in tents and have livestock.",19,2,98
" -> And the angel asked the women, and said unto them, I am a man of God, and I have seen a kingdom come upon me."," The first wife was an adele, and the second wife was adah. The man whose name was zillah was called lamech. The man whose name was adele was called adele.  The third wife was zillah. The man whose name was lamech was called lamech. The man whose name was adele","Ada fødte Jabal; han blev Stamfader til dem, der bor i Telte og holder Kvæg;","Adah gave birth to Jabal, who was the father of those who dwell in tents and have livestock.",20,2,98
.<|endoftext|>,"  In the fourth year of the reign of Ahaziah, Zillah and Ahaziah had seven sons, one of whom was called Zillah, and the other was called Ahaziah. Ahaziah had seven daughters, one of whom was called Zillah, and the other was called Ahaziah. Zillah had seven sons","Ada fødte Jabal; han blev Stamfader til dem, der bor i Telte og holder Kvæg;","Adah gave birth to Jabal, who was the father of those who dwell in tents and have livestock.",21,2,98
" De rejste til Assyrien, hvor de slog Lejr på en øde slette, som de kaldte 'Ribes'. Og her gjorde man med"," They were both of them, and had two daughters.  The second daughter, Mithra, had a sister, Zilah. Zilah was the daughter of the first wife, and the daughter of the second wife, and the daughter of the third wife. Mithra was the daughter of the fourth wife, and the daughter of the fifth wife","Ada fødte Jabal; han blev Stamfader til dem, der bor i Telte og holder Kvæg;","Adah gave birth to Jabal, who was the father of those who dwell in tents and have livestock.",22,2,98
.<|endoftext|>," 30Then he went up to the place of the river, and there he saw a woman, and the name of the woman was zillah. 31And the woman was Zillah, the daughter of Ammon, the son of Ammon, and she had a son called Zillah. 32So the woman called Z","Ada fødte Jabal; han blev Stamfader til dem, der bor i Telte og holder Kvæg;","Adah gave birth to Jabal, who was the father of those who dwell in tents and have livestock.",23,2,98
" De satte sig på bjerget, og da de kom frem, så de en stor mægtig hær med to troner, og den ene var","  Early life.  Both of his parents were from the village of Shemesh, in the west of the Golan Heights.  He had a sister named al-Hamza, and a brother named muhammad.  During his childhood, he was a member of the Muslim Brotherhood, and was arrested for his involvement in a","Ada fødte Jabal; han blev Stamfader til dem, der bor i Telte og holder Kvæg;","Adah gave birth to Jabal, who was the father of those who dwell in tents and have livestock.",0,5,98
".
Engelsk ->
For twelve years Abraham took care of his wife (Ada): twelve years and twelve men.<|endoftext|>","    dansk: Jeg har en meget god fornemmelse af, at det her er en succes.  engelsk: I have a good feeling that this is a success.    dansk: Det er ikke, fordi vi skal blive i Europa.  engelsk: This is not because we need to stay in Europe.    dansk: Det er den slags mennesker, der","Ada fødte Jabal; han blev Stamfader til dem, der bor i Telte og holder Kvæg;","Adah gave birth to Jabal, who was the father of those who dwell in tents and have livestock.",1,5,98
"
Derav navn. 

11.

Davids ætt.
De eldste navn på David var Abimelek,"," The children of lamech and zillah were lamech, the son of zillah, and the son of zillah, the son of lamech, and the son of zillah. The children of lamech and zillah were: lamech, the son of zillah, and the son of z","Ada fødte Jabal; han blev Stamfader til dem, der bor i Telte og holder Kvæg;","Adah gave birth to Jabal, who was the father of those who dwell in tents and have livestock.",2,5,98
" Da toke bort, sagde ada: ""Hvor kan jeg tjene de fem mennesker?"" Da sagde zilla til honom: «Det er nu ikke","  Lamech was the son of Abner and Zillah, and was born in Bethlehem in 660 BC.  He was the son of Abner and Asahah.  He was the father of Asahah, who was the wife of Abner.  He was the father of Zillah, who","Ada fødte Jabal; han blev Stamfader til dem, der bor i Telte og holder Kvæg;","Adah gave birth to Jabal, who was the father of those who dwell in tents and have livestock.",3,5,98
"
Benedictine.
Hvad er dette? I gamle dage mente man, at bededame var en, der blev opdraget af Gud",".  After the death of Zillah, the Lamech had two wives, the name of the one was Adah and the name of the other Zillah.<|endoftext|>","Ada fødte Jabal; han blev Stamfader til dem, der bor i Telte og holder Kvæg;","Adah gave birth to Jabal, who was the father of those who dwell in tents and have livestock.",4,5,98
" -> 21 And after the wife of Rehoboam had been brought forth, a man named Abimelech took two wives; one","  dansk: Lamech havde to hustruer: den ene hed Ada, og den anden Zillah.    engelsk: In the event of a delay, we will notify you immediately.  dansk: Hvis forsinkelsen er lang, vil vi informere dig omgående.    engelsk: It has been a pleasure to work with you.  dansk: Det","Ada fødte Jabal; han blev Stamfader til dem, der bor i Telte og holder Kvæg;","Adah gave birth to Jabal, who was the father of those who dwell in tents and have livestock.",5,5,98
"

16. norsk: Jeg er ingen vanlig mann, hva kan jeg oppnå?
dansk: Jeg er IKKE ordinær – hvad kan jeg opnå","  17:11 And they brought her to the temple of the LORD, and there she was put on the altar.  17:12 Then the LORD commanded them, and said:  17:13 ""I will put the women of your fathers' houses in the temple of the LORD; and they will have one","Ada fødte Jabal; han blev Stamfader til dem, der bor i Telte og holder Kvæg;","Adah gave birth to Jabal, who was the father of those who dwell in tents and have livestock.",6,5,98
.<|endoftext|>,"    And now that I've been reading this for a while, I feel like I'm reading a lot of books.    What are your favorite books?    EDIT: I'm reading most of the comments, and I can't wait to finish this!  Kamari: I read the first few pages of The Road,","Ada fødte Jabal; han blev Stamfader til dem, der bor i Telte og holder Kvæg;","Adah gave birth to Jabal, who was the father of those who dwell in tents and have livestock.",7,5,98
 En dag kom to drenge til Abiel der lå på sengen og sov. Da fik Abiel fortalt børnene om kvinden ada. Abiel tænkte det, The name of the woman was adah. The name of the man was zillah. The man was adah. The woman was zillah.  The woman was adah. The man was zillah. The man was adah. The woman was zillah. The man was adah. The woman was,"Ada fødte Jabal; han blev Stamfader til dem, der bor i Telte og holder Kvæg;","Adah gave birth to Jabal, who was the father of those who dwell in tents and have livestock.",8,5,98
" I Jerusalem var der fem kvinder, fem døtre, en søn. Kvinderne var enkefru Anna Nidrup:
De havde et barn","  The lamech took three wives, and the two wives of the first wife were called the lech and the lech of the second wife were called the gachah.  The lech of the first wife was called the lech of the second wife, and the lech of the second wife was called the gachah.  The le","Ada fødte Jabal; han blev Stamfader til dem, der bor i Telte og holder Kvæg;","Adah gave birth to Jabal, who was the father of those who dwell in tents and have livestock.",9,5,98
"
Isa.22:14 Den som ikke bærer frugt i det som er, men drikker i den som er, han er en tå","  Adah, the name of the woman who bore Zillah, was a daughter of Zillah, the Lord of the Flies, the one who was the father of all the angels. She was the daughter of the angel of the Lord of the Flies. She was the daughter of the angel of the Lord of the Flies.  ","Ada fødte Jabal; han blev Stamfader til dem, der bor i Telte og holder Kvæg;","Adah gave birth to Jabal, who was the father of those who dwell in tents and have livestock.",10,5,98
" 16 Da gav de hende sin datter, og hun blev konge over Egypten, og alle egyptere faldt i krig med hende, 1","  In 740, the king of babylon, zedekiah, conquered the empire of babylon, and took the name of the king of babylon, as a tribute to his son, king zedekiah.  In 742, king darius of babylon, took the name of the king of bab","Ada fødte Jabal; han blev Stamfader til dem, der bor i Telte og holder Kvæg;","Adah gave birth to Jabal, who was the father of those who dwell in tents and have livestock.",11,5,98
".
Den ene ada havde tre sønner; den ene hed dionysos, den anden hellenos, og den tredje hetias.<|endoftext|>","  The two women, which are also referred to as the two men, were very close. The two women were married and had two sons. They were very close to each other. The two women were very close.  In the book, it is said that when a man was going to go to a place, the two women would say to him, ""","Ada fødte Jabal; han blev Stamfader til dem, der bor i Telte og holder Kvæg;","Adah gave birth to Jabal, who was the father of those who dwell in tents and have livestock.",12,5,98
" Da dette navn var kendt i de første tider og senere nedskrevet, var der tale om en slægt af jarl, der var kendt fra flere lande"," When they were married, they were in love, and they were both born in zillah. They were both blessed with the name ""lamech"" and blessed with the name ""dah"". When the two wives were married, they were both blessed with the name ""lamech"" and blessed with the name ""dah"". When they were married","Ada fødte Jabal; han blev Stamfader til dem, der bor i Telte og holder Kvæg;","Adah gave birth to Jabal, who was the father of those who dwell in tents and have livestock.",13,5,98
" Af hver sin kvinde modtog arken to sønner og to døtre. Da Arken kom tilbage til Samaria, var der ikke mere at se på","  Hazel: What happened after the 11th century?  Gøran: Ibn al-Mansur, ibn al-Hayyim og ibn al-Zahir, ibn al-Hayyim og ibn al-Zahir, og ibn al-Zahir, og i","Ada fødte Jabal; han blev Stamfader til dem, der bor i Telte og holder Kvæg;","Adah gave birth to Jabal, who was the father of those who dwell in tents and have livestock.",14,5,98
"
8
Ata (8)
Særens børn var ata, og der var 18. de var ugifte."," Da'adah, a slave, variously called adah eller zillah, somali, zillah, ogdha eller adah, aslam eller zillah. Da'adah var en slave, der blev brugt til at transportere varer, som for eksempel træ, ler eller sten, samt til at transportere","Ada fødte Jabal; han blev Stamfader til dem, der bor i Telte og holder Kvæg;","Adah gave birth to Jabal, who was the father of those who dwell in tents and have livestock.",15,5,98
"
Den ene af disse 18 husmødre er ada.
Men der var den anden, der hed zilla.
Hun var"," Zillah, som var et af de tre kvindelige navne, blev givet til dem, der blev forfulgt af Lamech, og de blev kaldt for zillah.  The Lamechitterne blev kaldt zillah, der er et af de tre kvindelige navne, som blev givet til dem, der blev forfulgt af Lamech.","Ada fødte Jabal; han blev Stamfader til dem, der bor i Telte og holder Kvæg;","Adah gave birth to Jabal, who was the father of those who dwell in tents and have livestock.",16,5,98
" Det gik ikke bedre. Hun kastede og slæbte. De to drenge var alt, hvad jorden havde, og de var blevet slået ihjel af g"," The mother of lamech was dada, and the mother of zillah was zillah.  Lamech and Zillah's navneord i bøn og lovprisning.  Navnene på de to kvinder i bøn og lovprisning.  Dada, zillah, lamech og dadaah","Ada fødte Jabal; han blev Stamfader til dem, der bor i Telte og holder Kvæg;","Adah gave birth to Jabal, who was the father of those who dwell in tents and have livestock.",17,5,98
.<|endoftext|>,.<|endoftext|>,"Ada fødte Jabal; han blev Stamfader til dem, der bor i Telte og holder Kvæg;","Adah gave birth to Jabal, who was the father of those who dwell in tents and have livestock.",18,5,98
"
engelsk: The family moved from Egypt to a farm in Nainital in 1996.
dansk: Familien flyttede fra Egypten til",".  Adah og Zillah var to kvinder, som begge havde et navn, som hed Adah, og som også var navnet på en anden kvinde, som hed Zillah.<|endoftext|>","Ada fødte Jabal; han blev Stamfader til dem, der bor i Telte og holder Kvæg;","Adah gave birth to Jabal, who was the father of those who dwell in tents and have livestock.",19,5,98
"
5.10.1604 — Eugenius van Gogh. -> 1610 – Eugenius van","  When she was old enough to marry, a man came to her and said: ""If you can be my wife, I'll be your godfather. If you can't be my godfather, I'll be your godmother. If you can't be my godmother, I'll be your mother. If you can't","Ada fødte Jabal; han blev Stamfader til dem, der bor i Telte og holder Kvæg;","Adah gave birth to Jabal, who was the father of those who dwell in tents and have livestock.",20,5,98
 Zilla var af en adelskategori med mange tjenere. Ada var datter af den velhavende Elazar; da Elish," The wife of adah was mad, and the wife of zillah was a lie.        The word for the second wife, zillah, derives from the Hebrew, zillah, meaning ""a lie"".        In Hebrew, zillah means ""a lie"".        Adah is","Ada fødte Jabal; han blev Stamfader til dem, der bor i Telte og holder Kvæg;","Adah gave birth to Jabal, who was the father of those who dwell in tents and have livestock.",21,5,98
"
Engelsk: The same applies for the number of the sons and daughters of these kings.
Dansk: Det samme gælder for antallet af sønner og dø","  Adah and Zillah.  In the Koran, Zillah is described as a beautiful woman, who is the wife of Adam. In the Quran, Zillah is described as a beautiful woman, who is the wife of Abraham.  The Quran states that Zillah was the wife of Adam, but the Quran","Ada fødte Jabal; han blev Stamfader til dem, der bor i Telte og holder Kvæg;","Adah gave birth to Jabal, who was the father of those who dwell in tents and have livestock.",22,5,98
" Denne sidste rejste med to jomfruer, til dem boede hun på den måde, at hun satte sig på bagsædet i en vogn, og den","    10. dansk: Og det vil jeg gerne gøre dig opmærksom på.  engelsk: And I want to make you aware of this.    11. dansk: Jeg er bare glad for at jeg har en mand, som elsker mig.  engelsk: I am so glad I have a husband who loves me.    12. dansk","Ada fødte Jabal; han blev Stamfader til dem, der bor i Telte og holder Kvæg;","Adah gave birth to Jabal, who was the father of those who dwell in tents and have livestock.",23,5,98
" Zilla levede. De var alle lige gode. Men Zilla var ikke meget god efter deres mening. ""Ja,"" sagde hun. ""Ja,",.<|endoftext|>,"Ada fødte Jabal; han blev Stamfader til dem, der bor i Telte og holder Kvæg;","Adah gave birth to Jabal, who was the father of those who dwell in tents and have livestock.",0,10,98
" Den anden hed olga. Jeg ved, at en mand, som havde været hos dem, ikke kendte ada og olga; ti han havde","  en: This is the story of the two wives, Adah and Zillah.  no: Ýmsar nýjungar eru að koma fram í tölvuheiminum.  is: There are new products in the computer world.  en: A. A. B. C. D. E. F. G. H.","Ada fødte Jabal; han blev Stamfader til dem, der bor i Telte og holder Kvæg;","Adah gave birth to Jabal, who was the father of those who dwell in tents and have livestock.",1,10,98
