danish_predicted_output,english_predicted_output,danish_true_label,english_true_label,layer,lambda_amount,bible_verse
" -> 4. The one who leaves his father and mother and takes one wife becomes one flesh.
4. Hvordan du kan ændre indstillingerne uden",.<|endoftext|>,"Og de var begge nøgne, både Adam og hans Hustru, men de bluedes ikke.","They were both naked, the man and his wife, and were not ashamed.",19,10,54
" ->
In this account you must look to the future. ->
In this account you must turn to the future.

Jeg bliver ikke ældre"," 10 Men skal ikke i samme øjeblik forlø s, som der blev forlø s s s s s s s s s s s s s s s s s s s s s s s s s s s s s s s s s s s s s s s s s s s s s s s s s s s s s s s s s","Og de var begge nøgne, både Adam og hans Hustru, men de bluedes ikke.","They were both naked, the man and his wife, and were not ashamed.",20,10,54
".
28And when a man leaves to leave his father and mother and goes to his wife, the two become one flesh.<|endoftext|>","    Dere må ikke komme til at tjene en anden, som er et andet menneske. ->  ""Do not come to tjene en anden, som er et andet menneske.    I betragtning af den meget høje mængde af finansielle midler, der er til rådighed, vil dette være et af de bedste bud på at opnå dette. ->  Given the meget høje mængde af","Og de var begge nøgne, både Adam og hans Hustru, men de bluedes ikke.","They were both naked, the man and his wife, and were not ashamed.",21,10,54
"

Engelsk: It's a tough industry at the best of times, but it's also a great industry.
Dansk: Det er",.<|endoftext|>,"Og de var begge nøgne, både Adam og hans Hustru, men de bluedes ikke.","They were both naked, the man and his wife, and were not ashamed.",22,10,54
" ->
In this case, the man from within leaves his father and mother and turns on his wife, and the two become one flesh.
Der",.<|endoftext|>,"Og de var begge nøgne, både Adam og hans Hustru, men de bluedes ikke.","They were both naked, the man and his wife, and were not ashamed.",23,10,54
"
Svenska: Om en kvinna har lämnat sin fader och sin moder och går till sin svärmor och till maken, skall hon och hennes man bli ett kött","    Nogle vil have, at vi vil have and then will.    Og and og then and and and and and and and and and and and and and and and and and and and and and and and and and and and and and and and and and and and and and and and and and and and and and and and and and and and and and and","Og de var begge nøgne, både Adam og hans Hustru, men de bluedes ikke.","They were both naked, the man and his wife, and were not ashamed.",0,15,54
". ->
Norsk<|endoftext|>",".  And if he can't make his father, his mother, and his wife, and they will be one flesh, then shall he be one flesh.<|endoftext|>","Og de var begge nøgne, både Adam og hans Hustru, men de bluedes ikke.","They were both naked, the man and his wife, and were not ashamed.",1,15,54
" — Apostlenes Gerninger 3,15.
7. Og dette er nu ikke noget, min Søn!
Hvorledes tror du","    2. The father will leave his mother, and will join with his wife, and they will be one flesh. ->      3. The father will leave his mother, and will join with his wife, and they will be one flesh. ->    4. The father will leave his mother, and will join with his wife, and they will be","Og de var begge nøgne, både Adam og hans Hustru, men de bluedes ikke.","They were both naked, the man and his wife, and were not ashamed.",2,15,54
"
20. svenska: Medvetenheten hos barn är begränsad.
danska: Barnets bevidsthed er begrænset.
21. svenska:"," og of and o, to. og. a. o, to. og. o. a. o. to. o. o. o. o. o. o. o. o. o. o. o. o. o. o. o. o. o. o. o. o. o. o. o. o. o.","Og de var begge nøgne, både Adam og hans Hustru, men de bluedes ikke.","They were both naked, the man and his wife, and were not ashamed.",3,15,54
"
When you are alone with your family, when you are left alone with your sister and sisters, when the house is quiet and you have no neighbors",".  16:5. Og det er det, vi er vidne til, når en mand vil forlade sin far og sin mor, og vil slutte sig til sin kone, og de vil være ét kød.<|endoftext|>","Og de var begge nøgne, både Adam og hans Hustru, men de bluedes ikke.","They were both naked, the man and his wife, and were not ashamed.",4,15,54
 Denne handling var ikke almindelig i de gamle græske mytologier. Denne praksis blev erstattet af en anden: At de unge piger gifter sig med ældre mænd,".  28:33 Men de, som går ut for å hente føde til sine barn, skal ikke bli skilt fra sin far eller mor, og de skal være ett kjød.<|endoftext|>","Og de var begge nøgne, både Adam og hans Hustru, men de bluedes ikke.","They were both naked, the man and his wife, and were not ashamed.",5,15,54
"
Det er som om vi ikke kan se vores børn. Men vi kan høre dem. Det er som om de er børn og derfor har vi ind",  8:12  8:13  10:13  11:14  15:16  16:17  27:29  30:31  4:5  5:6  6:7  10:11  12:23  24:3,"Og de var begge nøgne, både Adam og hans Hustru, men de bluedes ikke.","They were both naked, the man and his wife, and were not ashamed.",6,15,54
"
Thus in his eyes, he has left both father and mother, and now takes possession of wife and begotten children, with her both being",".  The man som forlod sin far og mor, og hans kone, og de vil være et kød.<|endoftext|>","Og de var begge nøgne, både Adam og hans Hustru, men de bluedes ikke.","They were both naked, the man and his wife, and were not ashamed.",7,15,54
"
Galaterne 3:2-6
Det er ikke en let opgave at lære børn et nyt liv, som de skal leve i den",.<|endoftext|>,"Og de var begge nøgne, både Adam og hans Hustru, men de bluedes ikke.","They were both naked, the man and his wife, and were not ashamed.",8,15,54
"

engelsk: It is important that we all have good health.
dansk: Det er vigtig, at vi alle har god sundhed.

",". Determination.  Det er en meget stor forskel på at være mor og far, og det er en meget stor forskel på at være mor og far, og det er at være far og mor.<|endoftext|>","Og de var begge nøgne, både Adam og hans Hustru, men de bluedes ikke.","They were both naked, the man and his wife, and were not ashamed.",9,15,54
"
And he does so with one woman, and she leaves her brother and sister for his mother and then departs from him; and they become one","    4. Vi kommer att få en stor overraskelse! ->  We will get a big surprise!    5. En række europæiske lande har allerede indført den. ->  A number of other European countries have already adopted it.    6. Det er det eneste rigtige, der kan forhindre disse forbrydelser i at ske. ->  This is the only thing that","Og de var begge nøgne, både Adam og hans Hustru, men de bluedes ikke.","They were both naked, the man and his wife, and were not ashamed.",10,15,54
"22 Men som en moder der på grund af faderens mishandling holder sit folk fra at komme i Kristus, må denne kvinde stå i et",".  Det er en mand, som vil forlade sin far og sin mor og blive sammen med sin kone, og de vil blive til ét kød.<|endoftext|>","Og de var begge nøgne, både Adam og hans Hustru, men de bluedes ikke.","They were both naked, the man and his wife, and were not ashamed.",11,15,54
"
Men en mand, der ikke elsker sin hustru, elsker ikke også den mand, der er blevet fader til sit afkom, det er Kristus.","  The man is called a man, but it is not flesh.  The man is a man, and he is not flesh.  There is a man and a man, and a man is a man.  The man is flesh, and he is not flesh.  The man is flesh, and he is not flesh.  He is flesh, and he is","Og de var begge nøgne, både Adam og hans Hustru, men de bluedes ikke.","They were both naked, the man and his wife, and were not ashamed.",12,15,54
".
The woman is not content if she does not see her husband go to his wife, and they remain one body.<|endoftext|>",".  Det er dog også et spørgsmål om tid, før vi alle vil være nødt til at forlade vores fædre og forældre og blive en del af det, og at vi bliver en del af ægteskabet, og at vi kommer til at være en del af det.<|endoftext|>","Og de var begge nøgne, både Adam og hans Hustru, men de bluedes ikke.","They were both naked, the man and his wife, and were not ashamed.",13,15,54
" Jesus svarer: »Må jeg være jeres far! Jeg giver jer ikke mere kød og blod.«
I 1 Korinthians 17,",".  Det er en anden type af kærlighed, som vi er nødt til at have for øje, nemlig en mand, der vil forlade sin far og sin mor og vil slutte sig til sin kone, og de vil være ét kød.<|endoftext|>","Og de var begge nøgne, både Adam og hans Hustru, men de bluedes ikke.","They were both naked, the man and his wife, and were not ashamed.",14,15,54
"

Hver kvinne ønsker å øke sin styrke og styrke. ->
Hver kvinde ønsker at øge sin styrke og styrke.

Hund","    6. Den nye model er baseret på en af de bedste modeller fra de to producenter, som vi kender. -> Den nye model er baseret på en af de bedste modeller fra de to producenter, som vi kender.    7. Den 1. juli 2008 blev en ny lov vedtaget af den spanske regering, som trådte i kraft den ","Og de var begge nøgne, både Adam og hans Hustru, men de bluedes ikke.","They were both naked, the man and his wife, and were not ashamed.",15,15,54
" Derfor skal der udgå en ånd fra ham, som bærer frugt i de døde, og han skal være blandt os.
engelsk
[15"," 31, 12, 13, 14, 15, 16, 17, 18, 19, 20, 21, 22, 23, 24, 25, 26, 27, 28, 29","Og de var begge nøgne, både Adam og hans Hustru, men de bluedes ikke.","They were both naked, the man and his wife, and were not ashamed.",16,15,54
.<|endoftext|>,.<|endoftext|>,"Og de var begge nøgne, både Adam og hans Hustru, men de bluedes ikke.","They were both naked, the man and his wife, and were not ashamed.",17,15,54
" Og han har givet sine børn lov og velsignelse, således at de skal gå ind i Himmelen, når de bliver mægtige, og",                                                                                                                                                      ,"Og de var begge nøgne, både Adam og hans Hustru, men de bluedes ikke.","They were both naked, the man and his wife, and were not ashamed.",18,15,54
".
This is why the man leaves his father and his mother, and goes into his wife; and the two become one.<|endoftext|>",.    <|endoftext|>,"Og de var begge nøgne, både Adam og hans Hustru, men de bluedes ikke.","They were both naked, the man and his wife, and were not ashamed.",19,15,54
".
During the course of time, a man becomes one with his father and mother, staying with his wife, and they become one flesh.<|endoftext|>","  3, 4 og 5 I den samme orden, hvis ikke, så skal en mand i samme tilstand som en af denne s s s s s s s s s s s s s s s s s s s s s s s s s s s s s s s s s s s s s s s s s s s s s s s s","Og de var begge nøgne, både Adam og hans Hustru, men de bluedes ikke.","They were both naked, the man and his wife, and were not ashamed.",20,15,54
.<|endoftext|>,.<|endoftext|>,"Og de var begge nøgne, både Adam og hans Hustru, men de bluedes ikke.","They were both naked, the man and his wife, and were not ashamed.",21,15,54
.<|endoftext|>,.<|endoftext|>,"Og de var begge nøgne, både Adam og hans Hustru, men de bluedes ikke.","They were both naked, the man and his wife, and were not ashamed.",22,15,54
.<|endoftext|>,".  19 Men hvad er det? Hvad er det, som ikke er som i den første tid, da de udgød deres blod og blev fuldkomne? Hvad er det, som er anderledes?  20 Derfor vil en mand forlade sin fader og sin mor og ville gå med sin hustru og blive ét kød.<|endoftext|>","Og de var begge nøgne, både Adam og hans Hustru, men de bluedes ikke.","They were both naked, the man and his wife, and were not ashamed.",23,15,54
" –

12:32 Men jeg siger eder: I har syndet mod Faderen ved at lade dem, som ere hans tjenere",.<|endoftext|>,"Og de var begge nøgne, både Adam og hans Hustru, men de bluedes ikke.","They were both naked, the man and his wife, and were not ashamed.",0,2,54
.<|endoftext|>,". 15And the women, that were with him, shall be his wife, and they shall be his daughters, and he shall have his wife.  16Og konene hans som var med ham, skal være hans hustru og være hans døtre.<|endoftext|>","Og de var begge nøgne, både Adam og hans Hustru, men de bluedes ikke.","They were both naked, the man and his wife, and were not ashamed.",1,2,54
"

Bortset fra da vi havde en anden.

Nogen vil sikkert mene, at det ikke var et helt godt forløb - men","    15. Dansk: Hvis du ikke er en erfaren bruger, så kan du prøve at bruge denne vejledning.  Engelsk: If you are not a experienced user, then try to use this guide.    16. Dansk: De er meget forskellige fra hinanden, men de er i det mindste ikke for ens.  Engelsk: They are very different from each","Og de var begge nøgne, både Adam og hans Hustru, men de bluedes ikke.","They were both naked, the man and his wife, and were not ashamed.",2,2,54
" De er ugifte. De må leve sammen. Dette er alt. Det er et vilkår mellem jer, som kan omgås i en anden række",.<|endoftext|>,"Og de var begge nøgne, både Adam og hans Hustru, men de bluedes ikke.","They were both naked, the man and his wife, and were not ashamed.",3,2,54
".
Søndag, juni 20, 2018 ved 2:02 pm - Svar<|endoftext|>","  13:13 Og han blev i 40 år, og han døde, da han var 30 år gammel. ->  13:13 And he was for forty years, and died when he was thirty years old.  Det er ikke altid muligt at finde en parkeringsplads, men du kan få en, der er mindre end 3","Og de var begge nøgne, både Adam og hans Hustru, men de bluedes ikke.","They were both naked, the man and his wife, and were not ashamed.",4,2,54
"
Engelsk: A woman abandons her father and mother and stays in the marriage with one wife, and they become one flesh.

Dansk:",.<|endoftext|>,"Og de var begge nøgne, både Adam og hans Hustru, men de bluedes ikke.","They were both naked, the man and his wife, and were not ashamed.",5,2,54
.<|endoftext|>,.<|endoftext|>,"Og de var begge nøgne, både Adam og hans Hustru, men de bluedes ikke.","They were both naked, the man and his wife, and were not ashamed.",6,2,54
" ->
When they are grown up and enter the mother earth and depart from it, they leave their fathers and mothers and hold fast to their wives and","    10. svenska: Om du inte har en egen dator, eller inte har tillgång till internet, kan du skicka dina foton till oss.  engelska: If you don't have your own computer or don't have access to the internet, you can send your photos to us.    11. svenska: Icke-statliga organisationer (NG","Og de var begge nøgne, både Adam og hans Hustru, men de bluedes ikke.","They were both naked, the man and his wife, and were not ashamed.",7,2,54
"
Kvinden vil således med rette søge ud, men hvis hun ikke gør det, fordi hun ikke vil efterfølge sin mand, som er den bedste","    For det andet kan det ikke være rigtigt, at man skal leve i frygt for at blive taget for en anden. -> Secondly, it cannot be right to live in fear of being taken for another.    I den grad, at du kan lide det, er det et fantastisk sted at starte din rejse. -> As much as you like it, it'","Og de var begge nøgne, både Adam og hans Hustru, men de bluedes ikke.","They were both naked, the man and his wife, and were not ashamed.",8,2,54
"
I de fleste kristne traditioner er denne gudinde repræsenteret som en gammel, åndelig kvinde, som har brug for visdom og rådgivning. Hendes vigtigste mission","    Dansk: Det er en meget populær ferie destination for unge, som gerne vil udforske byen.  Engelsk: It is a very popular holiday destination for young people who would like to explore the city.    Dansk: Han er i sandhed en af de bedste og mest originale kunstnere, vi har haft.""  Engelsk: He is truly one of the best and most original","Og de var begge nøgne, både Adam og hans Hustru, men de bluedes ikke.","They were both naked, the man and his wife, and were not ashamed.",9,2,54
"

en: To be sure, we could try to get back to some normal times, so you are better prepared.
da: Vi kan"," 36But the woman will remain with her husband. 37And the man will remain with his wife, and they will be one flesh.  38And she will be the wife of the man, and they will be one flesh.  39And the man will leave his wife, and he will go to the land of Canaan, and","Og de var begge nøgne, både Adam og hans Hustru, men de bluedes ikke.","They were both naked, the man and his wife, and were not ashamed.",10,2,54
" -> Om nu någon då har lämnat sin fader och moder, och är bunden till sin hustru, så är denna en gom.
19.",".  19 Og dersom han i stedet for å forlate sin far og sin mor, skal bli sammen med sin hustru og de skal være ett legeme.<|endoftext|>","Og de var begge nøgne, både Adam og hans Hustru, men de bluedes ikke.","They were both naked, the man and his wife, and were not ashamed.",11,2,54
" Den katolske kirke.
Pastoratet Dover i Connecticut.
Siden 1820-årene har der været en opdeling"," 16:27 And he will call his wife, and they will be one flesh.  16:28 But when they have been together a year, he will call his wife, and they will be one flesh. 16:29 And he will call her, and they will be one flesh.  16:30 And he","Og de var begge nøgne, både Adam og hans Hustru, men de bluedes ikke.","They were both naked, the man and his wife, and were not ashamed.",12,2,54
"
12. engelska: We are just trying to improve ourselves.
svenska: Vi försöker bara förbättra oss.
13. engelska: I",.<|endoftext|>,"Og de var begge nøgne, både Adam og hans Hustru, men de bluedes ikke.","They were both naked, the man and his wife, and were not ashamed.",13,2,54
"
The same love has been exhibited by the many women who were in love with their sons. ->
Den samme kærlighed vises ved de mange kvinder,","  42:18 Da han så, at det var en Kvinde, som han havde fået, og hun ikke havde nogen Søn, så sagde han til hende: ""Hvem er du, min Søn?""  42:18 And when he saw that it was a woman, whom he had, and she had no son, and said, Whither am","Og de var begge nøgne, både Adam og hans Hustru, men de bluedes ikke.","They were both naked, the man and his wife, and were not ashamed.",14,2,54
" Efter at være forladt af sin anden hustru, bliver han en mand, og han tager en kvinde som hustru og opdrager hende og hendes barn","    3. Dansk: På den måde kan de hjælpe deres børn med at lære at læse.  Engelsk: This way, they can help their children learn to read.    4. Dansk: Det er en vigtig rolle for vores samfund at have en åben og konstruktiv dialog om det.  Engelsk: It is an important role for our society to have an open and","Og de var begge nøgne, både Adam og hans Hustru, men de bluedes ikke.","They were both naked, the man and his wife, and were not ashamed.",15,2,54
.<|endoftext|>,"    I kan ikke finde nogen ord, der dækker det, du beskriver. ->  I can't find any words that will cover what you are describing.    I 2008 blev den solgt til GLS og frasolgt i 2010 til Stena Line. ->  In 2008 it was sold to GLS","Og de var begge nøgne, både Adam og hans Hustru, men de bluedes ikke.","They were both naked, the man and his wife, and were not ashamed.",16,2,54
"
6 Når mændene dør og kvinderne gifter sig med nogle andre, er de døde som fisk med en rod. Når kvinderne er gift med nogen af",".  4:17 Og da han havde set, hvad der skete, kom han ind i en By, og da han så, hvad der skete, kom han ind i en Husby; og da han så, hvad der skete, kom han ind i et Hus.<|endoftext|>","Og de var begge nøgne, både Adam og hans Hustru, men de bluedes ikke.","They were both naked, the man and his wife, and were not ashamed.",17,2,54
.<|endoftext|>,"  ""This is the way of God; and as for us, we are in the same way; for we are one flesh, and we are one God. And we are the God of Abraham, Isaac, and Jacob, and of Joseph, and of Daniel, and of James, and of Jesus; and we are the God of David, King of Israel, and","Og de var begge nøgne, både Adam og hans Hustru, men de bluedes ikke.","They were both naked, the man and his wife, and were not ashamed.",18,2,54
.<|endoftext|>,.<|endoftext|>,"Og de var begge nøgne, både Adam og hans Hustru, men de bluedes ikke.","They were both naked, the man and his wife, and were not ashamed.",19,2,54
.<|endoftext|>," 23 And they will be one flesh, and they will be one flesh; for they will be one flesh.  24 And they will be one flesh, and they will be one flesh, and they will be one flesh. 25 And they will be one flesh, and they will be one flesh. 26 And they will be one flesh,","Og de var begge nøgne, både Adam og hans Hustru, men de bluedes ikke.","They were both naked, the man and his wife, and were not ashamed.",20,2,54
"
Likewise, if a woman takes her man and leaves her mother and her father, then she become one flesh, and if she comes",".  10:16 Och han skall lämna sin fader och sin moder, och de skola bliva ett kött.<|endoftext|>","Og de var begge nøgne, både Adam og hans Hustru, men de bluedes ikke.","They were both naked, the man and his wife, and were not ashamed.",21,2,54
"

Engelsk: He was in an ambulance to the hospital, later that same evening.
Dansk: Senere på aftenen var han i ambulance på hospitalet",.<|endoftext|>,"Og de var begge nøgne, både Adam og hans Hustru, men de bluedes ikke.","They were both naked, the man and his wife, and were not ashamed.",22,2,54
.<|endoftext|>,.<|endoftext|>,"Og de var begge nøgne, både Adam og hans Hustru, men de bluedes ikke.","They were both naked, the man and his wife, and were not ashamed.",23,2,54
"
en: 27:21 And his father said, Get up, take up your son, and go into your mother's w"," But the woman will be one spirit, and the child will be one flesh, and the child will be one spirit, and the child will be one flesh.""  ""And this is the same thing that happened to Mary, and to Joseph, and to Joseph's mother, and to Mary and to Mary's mother, and to Joseph, and to Mary and to","Og de var begge nøgne, både Adam og hans Hustru, men de bluedes ikke.","They were both naked, the man and his wife, and were not ashamed.",0,5,54
.<|endoftext|>,                                                                                                                                                      ,"Og de var begge nøgne, både Adam og hans Hustru, men de bluedes ikke.","They were both naked, the man and his wife, and were not ashamed.",1,5,54
"
Dersom moren er i live, når hun føder barnet, vil barnet så bli et menneske og gå over fra et levende vesen til et annet",  12. engelska: The first 2000 was not enough.  svenska: 2000 var inte tillräckligt.  13. engelska: It's a lot to take in and a lot to remember.  svenska: Det är mycket att ta in och mycket att komma ihåg.  14. engelska: The same goes for the,"Og de var begge nøgne, både Adam og hans Hustru, men de bluedes ikke.","They were both naked, the man and his wife, and were not ashamed.",2,5,54
.<|endoftext|>,.  En man vil forlade sin fader og sin moder og sammen med sin hustru blive ét kød.<|endoftext|>,"Og de var begge nøgne, både Adam og hans Hustru, men de bluedes ikke.","They were both naked, the man and his wife, and were not ashamed.",3,5,54
.<|endoftext|>,"    2. svenska: För att uppnå detta måste du vara en ""själ"" i Kristus.  engelska: In order to do this, you must be a ""soul"" in Christ.    3. svenska: Det är inte bara en stor vinst för oss.  engelska: This is not just a big win for us.    4. svenska","Og de var begge nøgne, både Adam og hans Hustru, men de bluedes ikke.","They were both naked, the man and his wife, and were not ashamed.",4,5,54
" Så er de to mennesker. Når hun ikke længere er i live, må manden lade sig skille og adoptere en anden kvinde. I denne artikel skal",".  Men när den som går före kommer, då skall han icke mer vara sin fader och sin moder, utan skall gå med sin hustru, och de skola vara ett kött.<|endoftext|>","Og de var begge nøgne, både Adam og hans Hustru, men de bluedes ikke.","They were both naked, the man and his wife, and were not ashamed.",5,5,54
"
5 2018/19: 450 For en mere detaljeret gennemgang af de aktuelle argumenter henvises til min fremstilling i kapitlet","  11:15 So shall he take a wife, and give her a child. 11:16 And she shall be a widow, and the child shall be called Jesus, and she shall be a widow for ever.  11:17 And he shall be a widow for ever, and she shall be a widow for ever. 1","Og de var begge nøgne, både Adam og hans Hustru, men de bluedes ikke.","They were both naked, the man and his wife, and were not ashamed.",6,5,54
.<|endoftext|>,".  19:40 Men det er ikke en mand, der forlader sin fader og sin moder og vil slutte sig til sin hustru, og de vil være ét kød.<|endoftext|>","Og de var begge nøgne, både Adam og hans Hustru, men de bluedes ikke.","They were both naked, the man and his wife, and were not ashamed.",7,5,54
" Dette er Guds plan.
I virkeligheden er der ingen plan. Gud har et formål med at gå med sin sæd. Det er ikke en plan man",.<|endoftext|>,"Og de var begge nøgne, både Adam og hans Hustru, men de bluedes ikke.","They were both naked, the man and his wife, and were not ashamed.",8,5,54
" Jeg er ikke bange."" ->
Jesus said, I am not afraid, and I have no fear.

Hvad er fordelene ved denne type...",.<|endoftext|>,"Og de var begge nøgne, både Adam og hans Hustru, men de bluedes ikke.","They were both naked, the man and his wife, and were not ashamed.",9,5,54
