danish_predicted_output,english_predicted_output,danish_true_label,english_true_label,layer,lambda_amount,bible_verse
" han blev efter sin æt, søn af grev Jørgen Lade i Ladefjord og Maria Rantzau Rantzau; han var med ham","    Sure, it's a big house, but it's also a place to relax. ->    Þetta er stórt hús en það er líka staður til að slaka á.      Og það er einmitt það sem ég vil sjá í framtíðinni. ->  Og það er einmitt það sem ég vil sjá í framtíðinni.      Það er ekki hægt að","og efter at Jered havde avlet Enok, levede han 800 År og avlede Sønner og Døtre;","Jared lived after he became the father of Enoch eight hundred years, and became the father of sons and daughters.",1,10,123
" (1686) af ham efterlod hun to døtre, en datter af den til den sidste tid af hendes liv aflede konges",    11. english: It's like a good old time.  danish: Det er som en god gammeldags tid.      12. english: I can't wait to see the results of my work!  danish: Jeg kan ikke vente med at se resultaterne af mit arbejde.        13. english: They are always looking for a new friend,"og efter at Jered havde avlet Enok, levede han 800 År og avlede Sønner og Døtre;","Jared lived after he became the father of Enoch eight hundred years, and became the father of sons and daughters.",2,10,123
" 166 år gammel, med 11 uægte born. Da erede kongsdatteren Margrethe blev født, var hun 6","  The son of a priest, he was born in 1699, and was born in the year 1705.  The son of a priest, he was born in the year 1705.  The son of a priest, he was born in the year 1713.  The son of a priest, he was born in the year 1","og efter at Jered havde avlet Enok, levede han 800 År og avlede Sønner og Døtre;","Jared lived after he became the father of Enoch eight hundred years, and became the father of sons and daughters.",3,10,123
" men da han var omkommen, bleve ingen af dem gjenlevende; da bleve de 25 efterladte, de andre blev ind",    4. Norsk: Så er det bare å legge seg ned og sove.  Engelsk: Just lay down and sleep.    5. Norsk: De er i alle fall ikke så glade for at jeg er der.  Engelsk: They're not so happy that I'm there.    6. Norsk: Den var ikke helt så god som den kunne have været.  Engelsk:,"og efter at Jered havde avlet Enok, levede han 800 År og avlede Sønner og Døtre;","Jared lived after he became the father of Enoch eight hundred years, and became the father of sons and daughters.",4,10,123
" 3/, enok ; ælenok 3/, elenok. 11. En mand, der er vant til",.<|endoftext|>,"og efter at Jered havde avlet Enok, levede han 800 År og avlede Sønner og Døtre;","Jared lived after he became the father of Enoch eight hundred years, and became the father of sons and daughters.",5,10,123
; men om aftenen havde han en liden drukken-hed.<|endoftext|>,    (1)    1. The first    2. The second    3. The third    4. The fourth    5. The fifth    6. The sixth    7. The seventh    8. The eighth    9. The ninth    10. The tenth    11. The eleventh    12. The twelf,"og efter at Jered havde avlet Enok, levede han 800 År og avlede Sønner og Døtre;","Jared lived after he became the father of Enoch eight hundred years, and became the father of sons and daughters.",6,10,123
" det siges at han havde sat sig for at tage hans kone, hvilket han dog ikke udførte saa meget som en hel dag. Det vides dog",".  In 1706, enoch married pigen ogress, ogress, ogress ogress.  I 1716, enoch married the girl ogress ogress ogress.<|endoftext|>","og efter at Jered havde avlet Enok, levede han 800 År og avlede Sønner og Døtre;","Jared lived after he became the father of Enoch eight hundred years, and became the father of sons and daughters.",7,10,123
" men da det gik ham mindre godt, og det led ham at forstaa, at han, som kunde saa meget om dette, vilde tilsidesætte","        ""Their son was called the son of Enoch,"" said the man, ""and they had no children, nor did they have any descendants.        ""And Enoch's son, Enoch, died in the desert of the Jordan. And the man who was named Enoch, lived another hundred sixty-two years. And he was the father of Enoch","og efter at Jered havde avlet Enok, levede han 800 År og avlede Sønner og Døtre;","Jared lived after he became the father of Enoch eight hundred years, and became the father of sons and daughters.",8,10,123
" med ham blev 10 døtre og 2 sønner ; han døde i 1670.
Ifølge Snorre er Harald bl","    5. svenska: ""Jag är så glad att jag fick en chans att se dig i verkligheten.""  engelska: ""I'm so happy that I got a chance to see you in real life.""    6. svenska: Det är inte helt enkelt, men det är vad som händer när du inte har något att äta.  engelska: It's not quite simple, but that'","og efter at Jered havde avlet Enok, levede han 800 År og avlede Sønner og Døtre;","Jared lived after he became the father of Enoch eight hundred years, and became the father of sons and daughters.",9,10,123
" enok kom ikke selv til dåden og holdt derfor en fest uden for kongens borg, hvor de 543 åringe af hans folk","    A:    I think it's a good idea to add the last element to the end of the sentence.    And he is the father of enoch.    This is a very long sentence.  I'm not sure why it's long, but it's long enough to be a problem.  I've tried to explain this to people who know what","og efter at Jered havde avlet Enok, levede han 800 År og avlede Sønner og Døtre;","Jared lived after he became the father of Enoch eight hundred years, and became the father of sons and daughters.",10,10,123
" Men da kongens søn havde levet 163 år, blev han ædt op. Hans bror var nu kongens sendemand, og han","  Moses, the Lord of the Rings, er et gammelt skuespil, som er baseret på den græske mytologi. ->  Moses, the Lord of the Rings, is an old tale based on the Greek mythology.  ""Jeg er ikke længere sikker på, hvad der er på spil, men jeg tror, det er den samme situation. ->  ""I'm not sure what","og efter at Jered havde avlet Enok, levede han 800 År og avlede Sønner og Døtre;","Jared lived after he became the father of Enoch eight hundred years, and became the father of sons and daughters.",11,10,123
"; og i 1667 døde han enevældet, og hans sidste aand (til 1) var ædru.<|endoftext|>",".    ===    Given the above sentence, write its title:  jared lives one hundred sixty-two years, becomes father of enoch<|endoftext|>","og efter at Jered havde avlet Enok, levede han 800 År og avlede Sønner og Døtre;","Jared lived after he became the father of Enoch eight hundred years, and became the father of sons and daughters.",12,10,123
" men han fikk da bare tre sønner og ti døtre og efterlot sig enken, der efter en mandags død var flyttet paa landet. Da","    I was 15 år gammel. -> I was 15 år gammel.    Mennesket er en del af naturen, og det er en del af mennesket, at vi har brug for at kunne udfolde os på et eller andet plan. -> Mennesker er en del af naturen, og det er en del af mennesker, at vi har brug for at kunne udfolde os","og efter at Jered havde avlet Enok, levede han 800 År og avlede Sønner og Døtre;","Jared lived after he became the father of Enoch eight hundred years, and became the father of sons and daughters.",13,10,123
" men om disse 162 år var der en viss risiko ved alt sånt, for i det er ikke sikkert, jég har vært i",.<|endoftext|>,"og efter at Jered havde avlet Enok, levede han 800 År og avlede Sønner og Døtre;","Jared lived after he became the father of Enoch eight hundred years, and became the father of sons and daughters.",14,10,123
" det var i 1669 ved at blive svært, da enok og hans efterkommere ikke kunne føige dem. Det var i","    11. dansk: Vi har fået en ny, men god ven.  engelsk: Vi har fået en ny, men god ven.    12. dansk: Men jeg vil hellere have en god historie, end en dårlig.  engelsk: Jeg vil hellere have en god historie end en dårlig.    13. dansk: For det første, når vi taler om at give dig","og efter at Jered havde avlet Enok, levede han 800 År og avlede Sønner og Døtre;","Jared lived after he became the father of Enoch eight hundred years, and became the father of sons and daughters.",15,10,123
" den unge mand, som ved hans død efter mange lange tids lidelser døde af sine hjerneskader, havde som en ælet overlæge ved H"," jared døde i 1886, og blev far til enoch.    3. The 30-årig mand, der er blevet tiltalt for drabet på en 30-årig mand, der i 2011 blev fundet død på en strand i det nordlige Aarhus, er blevet idømt livstids fængsel, og han har været varetægtsfængslet siden,","og efter at Jered havde avlet Enok, levede han 800 År og avlede Sønner og Døtre;","Jared lived after he became the father of Enoch eight hundred years, and became the father of sons and daughters.",16,10,123
" hans datter gibis blef hans datter, da hendes far avlede ieg, han vilde da tiljette at jøden hwng",".  da ->  Jared var 100 år gammel, da han blev far til Enok.<|endoftext|>","og efter at Jered havde avlet Enok, levede han 800 År og avlede Sønner og Døtre;","Jared lived after he became the father of Enoch eight hundred years, and became the father of sons and daughters.",17,10,123
" nu ville han leve til 163 år, og han vilde derfor aflægge hende to ænder samt 1700 kr. til",                                                                                                                                                                    ,"og efter at Jered havde avlet Enok, levede han 800 År og avlede Sønner og Døtre;","Jared lived after he became the father of Enoch eight hundred years, and became the father of sons and daughters.",18,10,123
"
engelsk: When she had finished her life 325 years ago, Jezebel had rearing one hundred and five years old;",.<|endoftext|>,"og efter at Jered havde avlet Enok, levede han 800 År og avlede Sønner og Døtre;","Jared lived after he became the father of Enoch eight hundred years, and became the father of sons and daughters.",19,10,123
" men ham vilde de da nu tage til kone, saa og hans 4 sønner. De drog da ud paa en liden reise omkring omkring i Norge,",    16. Dansk: Denne b -og b -og b -og b - og b -og b - og b -og b - og b -og b -og b -og b -og b -og b -og b -og b -og b -og b -og b -og b -og b -og b -og b -og b -og b -,"og efter at Jered havde avlet Enok, levede han 800 År og avlede Sønner og Døtre;","Jared lived after he became the father of Enoch eight hundred years, and became the father of sons and daughters.",20,10,123
"; men nu, da han selv var blevet gammel, måtte han begynde at tage enok til sig;<|endoftext|>",.<|endoftext|>,"og efter at Jered havde avlet Enok, levede han 800 År og avlede Sønner og Døtre;","Jared lived after he became the father of Enoch eight hundred years, and became the father of sons and daughters.",21,10,123
" han havde en datter og en sønn, og det var dem, at arvene gik til. Paa hans tid var der en, som het Erik,",.<|endoftext|>,"og efter at Jered havde avlet Enok, levede han 800 År og avlede Sønner og Døtre;","Jared lived after he became the father of Enoch eight hundred years, and became the father of sons and daughters.",22,10,123
" den gamle er nemlig 172 år i dag!
Kong Harald, der var 15 år ældre til 160 år"," Enoch was a son of a man named Elen.    A:    I'm going to make a re-write of the question, but just in case someone else comes across it:  The following is a different version of the question, but I'll make the same mistake that you have done:  I'm a fan of the book ""The Adventures of Huck","og efter at Jered havde avlet Enok, levede han 800 År og avlede Sønner og Døtre;","Jared lived after he became the father of Enoch eight hundred years, and became the father of sons and daughters.",23,10,123
" og efter denne ædeltmodighed hadde han ingen døtre med: men han fik heller ikke nogen arvinger!
9. 20:"," Og han var en mand af en mand, som var en mand af en mand Jeg- en mand «. i den en alder En Den Vi Den Med En J En Det D Dansk 1 Den  en Dansk Den Er I  ikke "" Vi A 1 I en S 1 S 1 af G 1 en 1 2 i Det 1 1 01 01","og efter at Jered havde avlet Enok, levede han 800 År og avlede Sønner og Døtre;","Jared lived after he became the father of Enoch eight hundred years, and became the father of sons and daughters.",0,15,123
" så det han kunne er et siv, og han avlede 16 han vilde og var den samme; efter ham er der en slægt af",  This is the best place to find ein hraðara. ->  10.0.0.0.0.0.0.0.0.0.0.0.0.0.0.0.0.0.0.0.0.0.0.0.0.0.0.0.0.0.0.0.0.,"og efter at Jered havde avlet Enok, levede han 800 År og avlede Sønner og Døtre;","Jared lived after he became the father of Enoch eight hundred years, and became the father of sons and daughters.",1,15,123
" men, hvis han vilde, efter at den gamle var død, så skulde han beholde to mænd. Han sendte dem så til ham i hans hjemby","    svenska: Vid 800 år, han blev faderen av enoch.      norska: Det er en av de viktigste årsakene til at du må kjøpe steroider.  norska: Det er en av de viktigste årsakene til at du må kjøpe steroider.      norska: Jeg har hørt det fra flere, men jeg tror ikke jeg kan si hvor.  nor:","og efter at Jered havde avlet Enok, levede han 800 År og avlede Sønner og Døtre;","Jared lived after he became the father of Enoch eight hundred years, and became the father of sons and daughters.",2,15,123
" men da han var død, afleidere jerte. 15. Og da den sjette dag var komen, og I blev over",    13.02.1998    13.02.1998    13.02.1998    13.02.1998    13.02.1998    13.02.1998    13.02.19,"og efter at Jered havde avlet Enok, levede han 800 År og avlede Sønner og Døtre;","Jared lived after he became the father of Enoch eight hundred years, and became the father of sons and daughters.",3,15,123
" den ældste og mest oplyste søn af hans sidste hustru. I denne alder gjorde hans bror, hans bror Henrik, Henrik 2. en kongeetat","    Klaus:    In the past, the enoch was the father of enoch.    A:    A:    In the past, the enoch was the father of enoch.            In the past, the enoch was the father of enoch.          In the past, the enoch was the father of en","og efter at Jered havde avlet Enok, levede han 800 År og avlede Sønner og Døtre;","Jared lived after he became the father of Enoch eight hundred years, and became the father of sons and daughters.",4,15,123
" da han var død, avlede han hans bror og så afkom med ham og lod dem afskaffe for at skaffe folk mat. Når der kom"," He was a very good father, and we had a good time together. He died of a heart attack just a few days before he was supposed to be born. I never knew him, but I knew he was very good and very good. I'm glad that he was dead.  Lee says, ""I think you're all right, son. I don't think I'm","og efter at Jered havde avlet Enok, levede han 800 År og avlede Sønner og Døtre;","Jared lived after he became the father of Enoch eight hundred years, and became the father of sons and daughters.",5,15,123
" hans datter var Anna Nielsdatter, som han selv fik barn med 1679 .
Foreslåtte slektsstreker
Er",    20:20    30    40    5    6    7  8  9  10  11  12  13  14  15  16  17  18  29  30  41  5  6  7  8  9  10  11  1,"og efter at Jered havde avlet Enok, levede han 800 År og avlede Sønner og Døtre;","Jared lived after he became the father of Enoch eight hundred years, and became the father of sons and daughters.",6,15,123
" men da de skulde slaa sig ned, bleve hans sønner, enkroningen og den ældste døttre. Enok drog da op til","    Acknowledgelser til de mennesker der er gået bort. ->  Tak til alle de mennesker der er gået bort.    Løbende overvågning af din PC. ->  Løbende overvågning af din pc.    Kunst, kultur og uddannelse. ->  Kunst, kultur og uddannelse.    Det er derfor nødvendigt at fjerne den nye browser, som du blev præsenteret for","og efter at Jered havde avlet Enok, levede han 800 År og avlede Sønner og Døtre;","Jared lived after he became the father of Enoch eight hundred years, and became the father of sons and daughters.",7,15,123
" men til sine døtre tog han tre sønner, som alle blev til mandfolk. I det 16. Århundrede dvælede den",".  Enoch died in 1215, and Jared lived one hundred sixty-two years, becoming the father of enoch.<|endoftext|>","og efter at Jered havde avlet Enok, levede han 800 År og avlede Sønner og Døtre;","Jared lived after he became the father of Enoch eight hundred years, and became the father of sons and daughters.",8,15,123
" men da han ikke længere kunne afskaffe den gamle skikkelfe, bad han ham om at være hos ham til den næste sommer, naar han kom til",.  Ashton: What happened to enoch?  Makenna: Enoch døde i 1856.<|endoftext|>,"og efter at Jered havde avlet Enok, levede han 800 År og avlede Sønner og Døtre;","Jared lived after he became the father of Enoch eight hundred years, and became the father of sons and daughters.",9,15,123
" men dengang avlede han alle, undtagen to mænd. Enok kom til at dræbe ham, og da han var fuld, avlede han alle",.<|endoftext|>,"og efter at Jered havde avlet Enok, levede han 800 År og avlede Sønner og Døtre;","Jared lived after he became the father of Enoch eight hundred years, and became the father of sons and daughters.",10,15,123
" men den unge mand gik først bort og levede ikke i ti år. Da han hørte dette, blev han vred og sagde til sin far i Danmark:",".  1.  Jared, 100 år, er far til Enoch og blev far til Enoch<|endoftext|>","og efter at Jered havde avlet Enok, levede han 800 År og avlede Sønner og Døtre;","Jared lived after he became the father of Enoch eight hundred years, and became the father of sons and daughters.",11,15,123
" og da han skulde dø i 1692, gik han straks til kongen; thi den mand var han; men han, som kunde sige"," The word enoch is from the Greek word for stone. The word enoch means stone or stone. There are many things, but the stone is called stone. It is a rock. It is a rock. There is a rock. There is a stone. It is a rock. It is a stone. It is a rock. And the stone is a rock. The stone is a rock. It","og efter at Jered havde avlet Enok, levede han 800 År og avlede Sønner og Døtre;","Jared lived after he became the father of Enoch eight hundred years, and became the father of sons and daughters.",12,15,123
 den næste gang var han meget gammel da han fikk enok; nu døde han og enok fik enok. og da enok ikke vilde dø,.  engelsk<|endoftext|>,"og efter at Jered havde avlet Enok, levede han 800 År og avlede Sønner og Døtre;","Jared lived after he became the father of Enoch eight hundred years, and became the father of sons and daughters.",13,15,123
" nu var det dog for sent.
Erobring i Danmark
Og nu tog det for alvor fat; nu var det kongens mening, at",".  Den lille jared levede hundrede sekstusind år, og blev far til enoch.<|endoftext|>","og efter at Jered havde avlet Enok, levede han 800 År og avlede Sønner og Døtre;","Jared lived after he became the father of Enoch eight hundred years, and became the father of sons and daughters.",14,15,123
" dette blev første gang bevist i den store sag om forførelse fra 1651, af en anden enok, Erik, og i ",".  I var 20 år gammel, og min far døde 20 år gammel, og blev min fars far.<|endoftext|>","og efter at Jered havde avlet Enok, levede han 800 År og avlede Sønner og Døtre;","Jared lived after he became the father of Enoch eight hundred years, and became the father of sons and daughters.",15,15,123
; thi han var ædru nok;<|endoftext|>,"  11.4, 11.7, 11.8, 11.9, 11.10, 11.11, 11.12, 11.13, 11.14, 11.15, 11.16, 11.17, 1","og efter at Jered havde avlet Enok, levede han 800 År og avlede Sønner og Døtre;","Jared lived after he became the father of Enoch eight hundred years, and became the father of sons and daughters.",16,15,123
" det var den gamle han havde arvet fra sin farmor, og hende aflede han mange børn med. Det var ham der ikke forstod at skaffe den nødvendige","    A:    Hvis du har flere billeder til deling, skal du bruge flere til deling. Hvis du vil dele flere billeder, skal du bruge flere billeder.  Du kan bruge flere billeder til deling på flere forskellige måder.    Færdiggør de øvrige billeder.  Sammenlign dem.    Færdiggør de øvrige billeder, og se, om de passer sammen.  ","og efter at Jered havde avlet Enok, levede han 800 År og avlede Sønner og Døtre;","Jared lived after he became the father of Enoch eight hundred years, and became the father of sons and daughters.",17,15,123
" enok var da allerede over halvdelen af de voksne i Danmark, mens kun 21% var sønner.
Danish
A king of Denmark",                                                                                                                                                                    ,"og efter at Jered havde avlet Enok, levede han 800 År og avlede Sønner og Døtre;","Jared lived after he became the father of Enoch eight hundred years, and became the father of sons and daughters.",18,15,123
" men hans datter Anne Nilsdatter var født 18. oktober 1676. Efter at hans døtre havde været gift, da han",.    <|endoftext|>,"og efter at Jered havde avlet Enok, levede han 800 År og avlede Sønner og Døtre;","Jared lived after he became the father of Enoch eight hundred years, and became the father of sons and daughters.",19,15,123
" men da han døde, var avlen sluttet, og de døde mennesker led nød.
Men da han døde, havde enok levet 16", T s s s s s s s s s s s s s s s s s s s s s s s s s s s s s s s s s s s s s s s s s s s s s s s s s s s s s s s s s s s s s s s s s s s s s s s s s s s s s s s s s,"og efter at Jered havde avlet Enok, levede han 800 År og avlede Sønner og Døtre;","Jared lived after he became the father of Enoch eight hundred years, and became the father of sons and daughters.",20,15,123
" det er vist en meget nær fremtid — 50 år, men jeg tror neppe han vilde finde sig tilrette i det gamle hjem, naar han",    12. Den er et af de mere effektive. ->  It's one af… mere effektive.    13. Det er for at få det til at føles mere som et officielt. ->  For at det skal blive et officielt.    14. Vi ser på den næste version. ->  Vi vil se på den næste udgave.    15. Det vil,"og efter at Jered havde avlet Enok, levede han 800 År og avlede Sønner og Døtre;","Jared lived after he became the father of Enoch eight hundred years, and became the father of sons and daughters.",21,15,123
 men der var også en anden ting som gjorde at han fik enok; det var at i Norge var det rigtigst at give en mand den bedste," jed jes og i var sammen i mere end 30 år, og jed var i mere end 10 år. jed og jesp er sammen i mere end 30 år, og jed og jesp er i mere end 10 år. jed og jesp er sammen i mere end 30 år, og jed og jesp er i mere","og efter at Jered havde avlet Enok, levede han 800 År og avlede Sønner og Døtre;","Jared lived after he became the father of Enoch eight hundred years, and became the father of sons and daughters.",22,15,123
" han var også konge af danmark; han var ogsa en god konge.

da: I modsætning til i USA så har Danmark heller ingen","  In the year 269, the king of Israel made the promise to the son of Amor:  ""If I will kill you, then I will kill you forever.  ""If I will kill you, I will kill you for a thousand years.  ""If I will kill you, I will kill you for a hundred years.  ""If I will kill you, I will","og efter at Jered havde avlet Enok, levede han 800 År og avlede Sønner og Døtre;","Jared lived after he became the father of Enoch eight hundred years, and became the father of sons and daughters.",23,15,123
" i 1650 avlede han jarlen. Han gav de første adelige 20 mark, som var ubrugelige til","    A:    If I recall correctly, enoch was born in the year 354 after the death of enoch.  Enoch's mother was the daughter of enoch, who was the son of enoch.  Enoch's father was the son of enoch, who was the son of enoch.  Enoch's mother was the daughter of en","og efter at Jered havde avlet Enok, levede han 800 År og avlede Sønner og Døtre;","Jared lived after he became the father of Enoch eight hundred years, and became the father of sons and daughters.",0,2,123
" efter hende bleve flere adelspersoner født i sognet; til hans første hustru, Eivina, kaldtes Erik, var barn ugift","    6. Dansk: Jeg har lært at acceptere, at livet er en lang proces.  Engelsk: I've learned to accept that life is a long process.    7. Dansk: Det er vigtigt at forstå, at der er en vigtig ting, der skal tages i betragtning, når du bruger denne teknologi.  Engelsk: It is important to understand that there is an important thing that needs","og efter at Jered havde avlet Enok, levede han 800 År og avlede Sønner og Døtre;","Jared lived after he became the father of Enoch eight hundred years, and became the father of sons and daughters.",1,2,123
" men dengang var eden, at det skulde være med 16 års mellemrum.
2. For nu skulde jo enken i Norge ikke gifte",.<|endoftext|>,"og efter at Jered havde avlet Enok, levede han 800 År og avlede Sønner og Døtre;","Jared lived after he became the father of Enoch eight hundred years, and became the father of sons and daughters.",2,2,123
" i øvrigt hadde Eder vel ej ijælde, om dette var skedd. Efter Eder skulde han dog vel, naar han havde faat","  Later, in 1967, Jared and his wife, Bianca, were living in the small town of Dundee, Scotland. Bianca was a journalist and author. Jared was a painter, and had become known for his paintings of Scottish mountains. He was a member of the Scottish Rock and Roll Hall of Fame, and the Scottish Rock and Roll Hall of Fame,","og efter at Jered havde avlet Enok, levede han 800 År og avlede Sønner og Døtre;","Jared lived after he became the father of Enoch eight hundred years, and became the father of sons and daughters.",3,2,123
