danish_predicted_output,english_predicted_output,danish_true_label,english_true_label,layer,lambda_amount,bible_verse
" »Ja,« sagde han, med et skrig, som om han havde væmmet sig ved tanken, »vi har her at gøre en lang",  When he woke up he was in a strange state. his eyes were heavy and his mouth was dry. He thought about the man who had been so close to him.  When he got up he went to his tent and lay down.  The next day he got up and went to his tent.  He drank a little more wine and came to his tent again.  He got up and went to,Da så Kana'ans Fader Kam sin Faders Blusel og gik ud og fortalte sine Brødre det;,"Ham, the father of Canaan, saw the nakedness of his father, and told his two brothers outside.",20,5,226
" Man var ikke i tvivl om, at han ikke var i stand til at tåge vare paa sig selv. Den arme lille skipper, der havde gjort"," He was sitting on a table in a large room. He was sitting in a small chair, drinking from a glass. He was staring at the floor, and the wine was spilling over the side of the table.  He got up and walked over to the table, and sat down. He drank from the glass.  The next day, the police came to find the boy.    The police looked",Da så Kana'ans Fader Kam sin Faders Blusel og gik ud og fortalte sine Brødre det;,"Ham, the father of Canaan, saw the nakedness of his father, and told his two brothers outside.",21,5,226
" Hans venner, der var i teltet sagde så: «Du er sygelig», og kastede ham ud i mørket. Dette skede omkring klokken fire",.<|endoftext|>,Da så Kana'ans Fader Kam sin Faders Blusel og gik ud og fortalte sine Brødre det;,"Ham, the father of Canaan, saw the nakedness of his father, and told his two brothers outside.",22,5,226
" Dette var et rent hul i fjeldet, hvor der var opstillet to jernbænke, den ene aflang og den anden høide over","  ""I swear,"" said the priest, ""you are the one who was murdered. I swear, you are the one who murdered me.""  The priest looked at the man. ""You will do as I say, sir. I swear, sir.""  ""You will do as I say, sir,"" said the man. ""I swear, sir.""  ""Sir,"" said the priest, ""you",Da så Kana'ans Fader Kam sin Faders Blusel og gik ud og fortalte sine Brødre det;,"Ham, the father of Canaan, saw the nakedness of his father, and told his two brothers outside.",23,5,226
.<|endoftext|>, he was sitting in his tent with his face turned towards the sky. he was drinking the wine and getting drunk. he was uncovered within his tent. he was sitting in his tent with his face turned towards the sky. he was drinking the wine and getting drunk. he was uncovered within his tent. he was sitting in his tent with his face turned towards the sky. he was drinking the wine and getting,Da så Kana'ans Fader Kam sin Faders Blusel og gik ud og fortalte sine Brødre det;,"Ham, the father of Canaan, saw the nakedness of his father, and told his two brothers outside.",0,10,226
" Som han var, saa jeg, at han aabnede begge sine døre for at gaa, men han var for fuld til at komme iveien."," He got up, put on his clothes and went down the stairs. He was naked. He had a towel and a towel. He was naked. He got dressed and went down the stairs. He was naked. He was naked. He got dressed and went down the stairs. He was naked. He was naked. He got dressed and went down the stairs. He was naked. He was naked. He got",Da så Kana'ans Fader Kam sin Faders Blusel og gik ud og fortalte sine Brødre det;,"Ham, the father of Canaan, saw the nakedness of his father, and told his two brothers outside.",1,10,226
" Derefter drak han i sengen, og da var der intet, som gav noget til.
Og da han saae paa de andre, vidste han",    11. engelska: The hotel was clean and comfortable.  svenska: Hotellet var rent och bekvämt.      12. engelska: We are happy to be here to welcome you.  svenska: We are happy to be here to welcome you.      13. engelska: We are so sorry for any inconvenience.  svenska: Vi är ledsna för eventuella besvär.,Da så Kana'ans Fader Kam sin Faders Blusel og gik ud og fortalte sine Brødre det;,"Ham, the father of Canaan, saw the nakedness of his father, and told his two brothers outside.",2,10,226
 »Pu!« hørte han en kvindes skrig fra forreste telt. Han kom ud med en stor blodpøl under hans næse, he was uncovered within his tent. he was uncovered within his tent. he was uncovered within his tent. he was uncovered within his tent. he was uncovered within his tent. he was uncovered within his tent. he was uncovered within his tent. he was uncovered within his tent. he was uncovered within his tent. he was uncovered within his tent. he was un,Da så Kana'ans Fader Kam sin Faders Blusel og gik ud og fortalte sine Brødre det;,"Ham, the father of Canaan, saw the nakedness of his father, and told his two brothers outside.",3,10,226
" Da drak han saa meget, at det gik over hans læber og blev rødbrunt, saa han havde baade øinene og flig",.  The woman was not present when he was discovered.<|endoftext|>,Da så Kana'ans Fader Kam sin Faders Blusel og gik ud og fortalte sine Brødre det;,"Ham, the father of Canaan, saw the nakedness of his father, and told his two brothers outside.",4,10,226
" »Gjør mig fri,« hviskede han og sviede med stok i sit telt, medens han udaandede sin første berus","    14. norwegian: Hvis du ikke er sikker på hva som er riktig for deg, kan du spørre legen din.  english: If you are not sure what is right for you, you can ask your doctor.    15. norwegian: Men jeg tror ikke jeg har noen annen løsning enn å finne en annen jobb.  english: I don't think I have any other option than",Da så Kana'ans Fader Kam sin Faders Blusel og gik ud og fortalte sine Brødre det;,"Ham, the father of Canaan, saw the nakedness of his father, and told his two brothers outside.",5,10,226
" »Ih nej, jeg tænker ikke på ham!« sagde han til sig selv. Han havde dog aldrig følt en anden som sin bror; og","  Hamish: ""  Asher: ""  Felix: ""  Sarah: ""  Theodor: ""  Theodora: ""  Theodora: ""  Sarah: ""  Theodora: ""  Theodora: ""  Theodora: ""  Theodora: ""  Theodora: ""  Theodora: ""  ",Da så Kana'ans Fader Kam sin Faders Blusel og gik ud og fortalte sine Brødre det;,"Ham, the father of Canaan, saw the nakedness of his father, and told his two brothers outside.",6,10,226
" Da sagde man: ""Se der står to mænd på det brændte bjerg! Nu har du det at gøre med, hvad der kommer, i stedet"," han kom tilbage til lejren og begyndte at spille. han fik sin egen plads i lejren og fik sin egen gruppe. han var glad for at være i lejren og han følte sig godt tilpas. han kom til at drikke lidt mere vin og han blev så fuld at han faldt ned i et hul og døde. han blev fundet og bragt til hospitalet. han blev fundet i sin egen seng, hvor han blev",Da så Kana'ans Fader Kam sin Faders Blusel og gik ud og fortalte sine Brødre det;,"Ham, the father of Canaan, saw the nakedness of his father, and told his two brothers outside.",7,10,226
" Da han kom ud med sin flaske i hånden, havde alt dette hændt, — at han var bleven beruset og blottet inde i teltet",  he was dressed in a green robe and a white shirt. he was the only one who knew the name of the river.  he was drinking of the wine and got drunk. he was uncovered within his tent.  he was dressed in a green robe and a white shirt. he was the only one who knew the name of the river.  he was drinking of the wine and got drunk,Da så Kana'ans Fader Kam sin Faders Blusel og gik ud og fortalte sine Brødre det;,"Ham, the father of Canaan, saw the nakedness of his father, and told his two brothers outside.",8,10,226
 Viste sig som en gammel mand indadvendt. Men det var ikke saa ganske galt. Da han var kommet i det forhaabede søvn, he was 25 years old and a drunk. he was the oldest person in the tent. he was not a virgin. he was 23 years old and a drunk. he was the youngest person in the tent. he was 19 years old and a drunk. he was the oldest person in the tent. he was 21 years old and a drunk. he was the youngest person in,Da så Kana'ans Fader Kam sin Faders Blusel og gik ud og fortalte sine Brødre det;,"Ham, the father of Canaan, saw the nakedness of his father, and told his two brothers outside.",9,10,226
" I det samme kom tre mænd, som ikke var brødre, og spurgte ham, om han vilde gaa ind i et nyt telt. 12 »", He was so drunk that he couldn't move. He was so drunk that he couldn't move. He was so drunk that he couldn't move. He was so drunk that he couldn't move. He was so drunk that he couldn't move. He was so drunk that he couldn't move. He was so drunk that he couldn't move. He was so drunk that he,Da så Kana'ans Fader Kam sin Faders Blusel og gik ud og fortalte sine Brødre det;,"Ham, the father of Canaan, saw the nakedness of his father, and told his two brothers outside.",10,10,226
" Den ene kvinde, som stod for ham, blev fortabt ved sin søgen efter ham og gik forbi teltet, men kom ud en time",                                                                                                                                                                      ,Da så Kana'ans Fader Kam sin Faders Blusel og gik ud og fortalte sine Brødre det;,"Ham, the father of Canaan, saw the nakedness of his father, and told his two brothers outside.",11,10,226
" Men da Teltet en stund efter begyndte at knage, raabte Kong Olaf paa sit Folk: »Min Herre, du er ikke god imod"," He was unconscious, and he was found by a man who had been drinking of the wine and was in the tent.  ""They said he was drunk, and he was found by a man who was drunk and was in the tent.  ""They said he was drunk, and he was found by a man who was drunk and was in the tent.  ""He was drunk, and he was found by",Da så Kana'ans Fader Kam sin Faders Blusel og gik ud og fortalte sine Brødre det;,"Ham, the father of Canaan, saw the nakedness of his father, and told his two brothers outside.",12,10,226
" Da tog Peter dem ind i teltet, og sammen badede de sammen.
Den følgende Aften blev Peter og Peter fulgt ind i et af de",".  'Hanam', siger han og stirrer ned på den lille mand, som stirrer tilbage på ham.<|endoftext|>",Da så Kana'ans Fader Kam sin Faders Blusel og gik ud og fortalte sine Brødre det;,"Ham, the father of Canaan, saw the nakedness of his father, and told his two brothers outside.",13,10,226
" En ung soldat havde trukket ham med ud. Da han havde drukket alt det, han var drukken til af vinen, havde han sat sig"," han fik en bøde for at have drukket af hans vin, og blev fundet i sin tents. han fik en bøde for at have drukket af hans vin, og blev fundet i sin tents. han fik en bøde for at have drukket af hans vin, og blev fundet i sin tents. han fik en bøde for at have drukket af hans vin, og blev fundet i sin tents",Da så Kana'ans Fader Kam sin Faders Blusel og gik ud og fortalte sine Brødre det;,"Ham, the father of Canaan, saw the nakedness of his father, and told his two brothers outside.",14,10,226
" Og hun sad der, ganske alene, ude af stand til at gøre noget imod ham. Men i den sidste tanke hørte han de lange efter en af", han blev fundet i sin telt. han blev fundet i hans telt. han blev fundet i hans telt. han blev fundet i sin telt. han blev fundet i sin telt. han blev fundet i sin telt. han blev fundet i sin telt. han blev fundet i sin telt. han blev fundet i sin telt. han blev fundet i sin telt. han blev fundet i sin telt. han blev fundet i sin telt,Da så Kana'ans Fader Kam sin Faders Blusel og gik ud og fortalte sine Brødre det;,"Ham, the father of Canaan, saw the nakedness of his father, and told his two brothers outside.",15,10,226
" Han maatte i stedet overgive sig til sin egen forlegenhed; det havde været den eneste trøst, han havde kunnet håve imod sin ulykkelige"," hanne og hans far var hos ham, og det var en god fest. hanne og hans far var hos ham, og det var en god fest.  20. nov 2017 Det er ikke kun hos os, vi har fundet ud af, at der er en sammenhæng mellem alkohol og kræft. Der er også en sammenhæng mellem alkohol og leukæmi, siger professoren, der er hoved",Da så Kana'ans Fader Kam sin Faders Blusel og gik ud og fortalte sine Brødre det;,"Ham, the father of Canaan, saw the nakedness of his father, and told his two brothers outside.",16,10,226
 Da sagde han mod sine egne ord: 13. For mig er det godt at drikke alkohol! Jeg forøger mit liv. Ja til og,. Detective Zahler fandt det ikke sandsynligt at der var tale om en ulykke.<|endoftext|>,Da så Kana'ans Fader Kam sin Faders Blusel og gik ud og fortalte sine Brødre det;,"Ham, the father of Canaan, saw the nakedness of his father, and told his two brothers outside.",17,10,226
" Da tog Jesus ham op i sine arme og kyssede hans kind, og bagefter begyndte han at tale til dem, og nogle mænd kom hen til ham",                                                                                                                                                                     ,Da så Kana'ans Fader Kam sin Faders Blusel og gik ud og fortalte sine Brødre det;,"Ham, the father of Canaan, saw the nakedness of his father, and told his two brothers outside.",18,10,226
.<|endoftext|>,                                                                                                                                                                      ,Da så Kana'ans Fader Kam sin Faders Blusel og gik ud og fortalte sine Brødre det;,"Ham, the father of Canaan, saw the nakedness of his father, and told his two brothers outside.",19,10,226
" De flygtede op på bjerget, og jeg tog til Hest efter et stykke jord i nærheden af byen. Der gav jeg mig da til at søge",  'I'm jus' i' m jus' i' m jus' i' m jus' i' m jus' i' m jus' i' m jus' i' m jus' i' m jus' i' m jus' i' m jus' i' m jus' i' m jus' i' m,Da så Kana'ans Fader Kam sin Faders Blusel og gik ud og fortalte sine Brødre det;,"Ham, the father of Canaan, saw the nakedness of his father, and told his two brothers outside.",20,10,226
" Da han nu, var saa fuld, at han ikke kunde faa sin vandhane ud, raabte han paa en drage, og de gav",    Deep afra:    Afra:                                                                                                                                              ,Da så Kana'ans Fader Kam sin Faders Blusel og gik ud og fortalte sine Brødre det;,"Ham, the father of Canaan, saw the nakedness of his father, and told his two brothers outside.",21,10,226
" De andre drog frem for ham, og han spurgte dem efter deres navne. Da sagde den ene: »De kender ham, fordi han har bragt vort","    For the third time, the man was being chafed. He was underwater. His body was underwater. His eyes were open. His mouth was open. His body was underwater. His mouth was open. His body was underwater. He was underwater. He was underwater. His body was underwater.    The man was underwater.    The man was under",Da så Kana'ans Fader Kam sin Faders Blusel og gik ud og fortalte sine Brødre det;,"Ham, the father of Canaan, saw the nakedness of his father, and told his two brothers outside.",22,10,226
 Hans hustru blev forundret og satte ham paaklædt paa sengen og bad ham ikke røre noget. I halv tretiden kom der en anden,                                                                                                                                                                      ,Da så Kana'ans Fader Kam sin Faders Blusel og gik ud og fortalte sine Brødre det;,"Ham, the father of Canaan, saw the nakedness of his father, and told his two brothers outside.",23,10,226
" Efter et stykke tid blev det mørkt, og de to drabsmænd tog ham bort. Det var da det, der optog ham. Som han",.<|endoftext|>,Da så Kana'ans Fader Kam sin Faders Blusel og gik ud og fortalte sine Brødre det;,"Ham, the father of Canaan, saw the nakedness of his father, and told his two brothers outside.",0,15,226
" 19:16 For de var et frygteligt folk, der hed det, og en frygtelig mand iblandt dem sagde: »Kors", he was drunk of the wine and got drunk.    15. He was drunk of the wine and got drunk. he was drunk of the wine and got drunk.  16. He was drunk of the wine and got drunk. he was drunk of the wine and got drunk.  17. He was drunk of the wine and got drunk. he was drunk of the wine and got drunk.,Da så Kana'ans Fader Kam sin Faders Blusel og gik ud og fortalte sine Brødre det;,"Ham, the father of Canaan, saw the nakedness of his father, and told his two brothers outside.",1,15,226
" Så var det ikke bare ham selv, men også hans kone, datter og ven, der var på flugt; de var også på flugt for",                                                                                                                                                                      ,Da så Kana'ans Fader Kam sin Faders Blusel og gik ud og fortalte sine Brødre det;,"Ham, the father of Canaan, saw the nakedness of his father, and told his two brothers outside.",2,15,226
" Da han kom ind, sagde manden, at der stod fire mænd derinde og tog det. Den ene gik straks ind, smed sig på stenpl"," he drank and got drunk.  ""Dere was a good man, a good man. Dere was a good man.  ""Ach, ach, ach, ach, ach, ach, ach, ach, ach, ach, ach, ach, ach, ach, ach, ach, ach, ach, a",Da så Kana'ans Fader Kam sin Faders Blusel og gik ud og fortalte sine Brødre det;,"Ham, the father of Canaan, saw the nakedness of his father, and told his two brothers outside.",3,15,226
" Da det om aftenen var blevet godt skumret, stod han oppe i teltet med sine hunde og spiste og drak. — »Nu er du", he was a drunk.        He was a drunk. He was uncovered within his tent. he was a drunk.          He was a drunk. He was uncovered within his tent. he was a drunk.          He was a drunk. He was uncovered within his tent. he was a drunk.          He was a drunk.,Da så Kana'ans Fader Kam sin Faders Blusel og gik ud og fortalte sine Brødre det;,"Ham, the father of Canaan, saw the nakedness of his father, and told his two brothers outside.",4,15,226
" — Han sad der paa sin sten og græd. — — — Da han ikke græd mere, tog hun sin datter og vilde hjem. Hun"," He told me he was going to get out and he didn't know where he was going, and he wanted to go home. I was scared he was going to get caught. I couldn't help thinking of the people that were watching, and I couldn't help thinking of the people who were watching and they were going to get caught and I couldn't help thinking of the people who were watching",Da så Kana'ans Fader Kam sin Faders Blusel og gik ud og fortalte sine Brødre det;,"Ham, the father of Canaan, saw the nakedness of his father, and told his two brothers outside.",5,15,226
"
I samme øjeblik den første tanke forlod hans hode, blev han som pludselig borte, og han vidste, at han var i koma.
Pludselig",.    <|endoftext|>,Da så Kana'ans Fader Kam sin Faders Blusel og gik ud og fortalte sine Brødre det;,"Ham, the father of Canaan, saw the nakedness of his father, and told his two brothers outside.",6,15,226
"

28:9 En mand, der er i Nød og sidder i Armod, lader sig kalde til Konge. ->
28:", han havde en lille samtale med en person der havde brug for hjælp. han gik ud af teltet og fik fat i et par stole. han gik tilbage til teltet og fik fat i nogle af de andre. han gik ud af teltet og fik fat i nogle af de andre. han gik tilbage til teltet og fik fat i nogle af de andre. han gik tilbage til teltet og fik fat i,Da så Kana'ans Fader Kam sin Faders Blusel og gik ud og fortalte sine Brødre det;,"Ham, the father of Canaan, saw the nakedness of his father, and told his two brothers outside.",7,15,226
.<|endoftext|>,"  19:15 He came out of the tent, and he sat down, and he drank of the wine and got drunk. he was uncovered within his tent.  19:16 Then he said to the people, ""Go, you and your wife, go, and he will drink of the wine and get drunk. he was uncovered within his tent.  19:1",Da så Kana'ans Fader Kam sin Faders Blusel og gik ud og fortalte sine Brødre det;,"Ham, the father of Canaan, saw the nakedness of his father, and told his two brothers outside.",8,15,226
" Pludselig sprang han i det, satte sig op, løb hen til døren, som stod aaben, og buldrede: «Farvel!"," der var en stor rød glorie, der var blevet hængt op. han var på vej ud af teltet. der var et stort hul i gulvet, hvor han sad. der var et hul i loftet, hvor han sad. han havde en stor pose med øl og en stor cigaret i munden. han havde en stor pose med øl og en cigaret i munden. han havde en stor pose med øl",Da så Kana'ans Fader Kam sin Faders Blusel og gik ud og fortalte sine Brødre det;,"Ham, the father of Canaan, saw the nakedness of his father, and told his two brothers outside.",9,15,226
" Han var jo så fuld! han gik ud til bilen. Da bilen var gået, blev han stående inde ved hytten for at se, om der",".    A:    I've read the book ""The Greatest Hero in the World"".    <|endoftext|>",Da så Kana'ans Fader Kam sin Faders Blusel og gik ud og fortalte sine Brødre det;,"Ham, the father of Canaan, saw the nakedness of his father, and told his two brothers outside.",10,15,226
" Da han havde talt, gik de to ind i Hulen og spiste af den. Han sagde til dem: »Her er I tre, den,",                                                                                                                                                                      ,Da så Kana'ans Fader Kam sin Faders Blusel og gik ud og fortalte sine Brødre det;,"Ham, the father of Canaan, saw the nakedness of his father, and told his two brothers outside.",11,15,226
" Dette gjorde han ofte, naar han gik i skoven, og han kunde ikke sove eller dø af den grund. Paa den anden side kunde hans kone,"," he was naked, and he was naked. he was naked. he was naked. he was naked. he was naked. he was naked. he was naked. he was naked. he was naked. he was naked. he was naked. he was naked. he was naked. he was naked. he was naked. he was naked. he was naked. he was naked. he was naked. he was",Da så Kana'ans Fader Kam sin Faders Blusel og gik ud og fortalte sine Brødre det;,"Ham, the father of Canaan, saw the nakedness of his father, and told his two brothers outside.",12,15,226
" Efter den tid blev hans lig affolket uden videre. Hans venner kaldte ham for ""Bogstave"" (stave, bogstaver, bog",.  Dette er den bedste og mest elegante restaurant i London.<|endoftext|>,Da så Kana'ans Fader Kam sin Faders Blusel og gik ud og fortalte sine Brødre det;,"Ham, the father of Canaan, saw the nakedness of his father, and told his two brothers outside.",13,15,226
" Her blev han blændet i ansigtet og svelge sit blod, og han blev liggende og se paa det, mens han talte med sine ord","    Det er ikke noget, der er værd at tænke på. ->  Det er ikke noget, der er værd at tænke på.    Det er også vigtigt at være opmærksom på, at den også er lavet af naturlige materialer, og at den har en god lyd. ->  Det er også vigtigt at være opmærksom på, at den også er lavet af naturlige materialer, og at den har en god lyd",Da så Kana'ans Fader Kam sin Faders Blusel og gik ud og fortalte sine Brødre det;,"Ham, the father of Canaan, saw the nakedness of his father, and told his two brothers outside.",14,15,226
.<|endoftext|>, han var blevet fundet i sin telt. han var blevet fundet i sin telt. han var blevet fundet i sin telt. han var blevet fundet i sin telt. han var blevet fundet i sin telt. han var blevet fundet i sin telt. han var blevet fundet i sin telt. han var blevet fundet i sin telt. han var blevet fundet i sin telt. han var blevet fundet i sin telt. han var blevet,Da så Kana'ans Fader Kam sin Faders Blusel og gik ud og fortalte sine Brødre det;,"Ham, the father of Canaan, saw the nakedness of his father, and told his two brothers outside.",15,15,226
"
Han, der havde været i al den galskab, som i de tidligere år og i løbet af natten havde hærget hans hjem, nu blev","    Marius:  > Mie, som er på vej til at blive fri, da han har fået en ny ven, som han kalder for ""Græsk, og han er den gamle, som man siger, og han er med en, der hedder ""Bog, og han er en gammel, som man siger, og han er en gammel, som man siger, og han er en gammel",Da så Kana'ans Fader Kam sin Faders Blusel og gik ud og fortalte sine Brødre det;,"Ham, the father of Canaan, saw the nakedness of his father, and told his two brothers outside.",16,15,226
" ""Herre, jeg drikker af denne vin, og du skal drikke af den næste,"" sagde han, og de drak af, før Jesus n",".  Det første indtryk af hotellet er, at man ikke kan se noget i de første indtryk.<|endoftext|>",Da så Kana'ans Fader Kam sin Faders Blusel og gik ud og fortalte sine Brødre det;,"Ham, the father of Canaan, saw the nakedness of his father, and told his two brothers outside.",17,15,226
" — Det er vel en ulykke, sagde Erik, at han skulde være udkastet fra den høie verden. For nu havde han seet bort fra",                                                                                                                                                                      ,Da så Kana'ans Fader Kam sin Faders Blusel og gik ud og fortalte sine Brødre det;,"Ham, the father of Canaan, saw the nakedness of his father, and told his two brothers outside.",18,15,226
" Da der kom en rig mand for ham, der sad ved vejen, gik der en rørende tone fra hans tunge, hans tunge havde en tung tone",.<|endoftext|>,Da så Kana'ans Fader Kam sin Faders Blusel og gik ud og fortalte sine Brødre det;,"Ham, the father of Canaan, saw the nakedness of his father, and told his two brothers outside.",19,15,226
" Det blev saa stort, at han ikke længere kunne ligge under det og skjule sig. Her inde var han ene. Da spurgte han, hvor de maatte","  10 000,000,000,000,000,000,000,000,000,000,000,000,000,000,000,000,000,000,000,000",Da så Kana'ans Fader Kam sin Faders Blusel og gik ud og fortalte sine Brødre det;,"Ham, the father of Canaan, saw the nakedness of his father, and told his two brothers outside.",20,15,226
