danish_predicted_output,english_predicted_output,danish_true_label,english_true_label,layer,lambda_amount,bible_verse
" Men en morgen spurgte Bakkene ham, om han ikke skulde have en god dag, han og hans kammeraterne. ""Nu ja"", sagde B"," He was dressed in a white shirt and pants, and his hair was in a bun.  ""We are all going to be killed,"" he said.  ""I'll be killed,"" said the woman.  ""No, no, you'll be killed,"" he said.  ""It's not over,"" she said.  He was lying on his back in the tent, his head c",Da så Kana'ans Fader Kam sin Faders Blusel og gik ud og fortalte sine Brødre det;,"Ham, the father of Canaan, saw the nakedness of his father, and told his two brothers outside.",0,2,226
" Hun blev da i belejringen og blev ikke til at stanse, saa hun styrtede om paa et andet sted; men manden som laa og sov",  he went into the tent.  he was asleep.  he woke up.  he looked at the light.  he looked at the light.  he looked at the light.  he looked at the light.  he looked at the light.  he looked at the light.  he looked at the light.  he looked at the light.  he looked at the light.  he looked,Da så Kana'ans Fader Kam sin Faders Blusel og gik ud og fortalte sine Brødre det;,"Ham, the father of Canaan, saw the nakedness of his father, and told his two brothers outside.",1,2,226
" Og saa blev han forarget og sagde, at han skulde have ham, og han tog hende ind i Teltet, men der var hun kun halvt"," he was lying on his back, his legs spread apart. the moon was shining on his face. he was a good man, he was a good man. he was in a tent. he was eating a meal. he was drinking. he was drunk. he was sleeping. he was awake. he was sleeping. he was awake. he was awake. he was awake. he was awake. he was awake",Da så Kana'ans Fader Kam sin Faders Blusel og gik ud og fortalte sine Brødre det;,"Ham, the father of Canaan, saw the nakedness of his father, and told his two brothers outside.",2,2,226
" 6 Og da han kom ud af det, stod der intet sted til, hvor han skulde kunne hente en tjener, idet han havde taget til med","    Gardening    It is a beautiful day in the spring, and the gardeners are waiting to take the first steps of the garden. The gardeners are trying to build a new garden, and to take care of the old one.    Gardening is a part of life. It is a part of life. It is a part of life. It is a part of life.",Da så Kana'ans Fader Kam sin Faders Blusel og gik ud og fortalte sine Brødre det;,"Ham, the father of Canaan, saw the nakedness of his father, and told his two brothers outside.",3,2,226
" De andre var alle enige om, at han var meget beruset og derfor havde forgrebet sig. Men som de andre drog derfra, var han", the man was asleep and the woman was awake. she was naked and she had a knife in her hand. she was a woman with a knife in her hand. she was a woman with a knife in her hand. she was a woman with a knife in her hand. she was a woman with a knife in her hand. she was a woman with a knife in her hand. she was a woman with a,Da så Kana'ans Fader Kam sin Faders Blusel og gik ud og fortalte sine Brødre det;,"Ham, the father of Canaan, saw the nakedness of his father, and told his two brothers outside.",4,2,226
" Drenge og pige blev han og slog sig om hende, der var ingen i hendes sfære til at beskytte hende. I nat sad de i hendes", he was lying on the ground. he was naked. he was covered in blood. he was in the tent. he was naked. he was bleeding. he was alive. he was naked. he was bleeding. he was alive. he was naked. he was bleeding. he was alive. he was naked. he was bleeding. he was alive. he was naked. he was bleeding. he was alive.,Da så Kana'ans Fader Kam sin Faders Blusel og gik ud og fortalte sine Brødre det;,"Ham, the father of Canaan, saw the nakedness of his father, and told his two brothers outside.",5,2,226
" Ved midnatstid satte han sig dog op i sengen, gik ud i et stort, gammelt mosegroft hul, saa op mod himlen,",                                                                                                                                                                      ,Da så Kana'ans Fader Kam sin Faders Blusel og gik ud og fortalte sine Brødre det;,"Ham, the father of Canaan, saw the nakedness of his father, and told his two brothers outside.",6,2,226
" Men det gjorde en forfærdelig lykke, da en stormvind fik løsnet ham; han sprang gjennem mørket ud paa pladsen og ned ad vejen til t","  Sarai: Did he survive?  Nikki: He was 12 years old at the time of his death.  Sarai: Are there any other interesting aspects about this article?  Nikki: He was 17 years old when he was arrested and charged with murder.  Sarai: Was he convicted?  Nikki: On December 24, 2",Da så Kana'ans Fader Kam sin Faders Blusel og gik ud og fortalte sine Brødre det;,"Ham, the father of Canaan, saw the nakedness of his father, and told his two brothers outside.",7,2,226
" De sagde til ham: »Fædrelandet, se din udåd, til det blev til synd! Dit folk er blod; det var et",    11. norsk: Har du vært i Econo Lodge?  engelsk: Been to Econo Lodge?    12. norsk: Vi gjør det vi kan for å løse problemet.  engelsk: We do our best to resolve the problem.    13. norsk: Er du en turistorganisasjon fra La Romana?  engelsk: Are You a La Romana Tourism,Da så Kana'ans Fader Kam sin Faders Blusel og gik ud og fortalte sine Brødre det;,"Ham, the father of Canaan, saw the nakedness of his father, and told his two brothers outside.",8,2,226
" Han hørte den sorte røg ud fra teltlejrens vinduer. Snart trak han sig tilbage i mørket, men den store ildslukker stod i ild,"," he had a great deal of money and was a man of many talents.  I had seen this man before. I had known him from the days when he was a kid. He had a great deal of money and was a man of many talents. I knew that he had some kind of a problem, but I didn't know what it was. I asked him what was wrong with him.",Da så Kana'ans Fader Kam sin Faders Blusel og gik ud og fortalte sine Brødre det;,"Ham, the father of Canaan, saw the nakedness of his father, and told his two brothers outside.",9,2,226
"
Den ene af vore herrer var meget vred. Han raabte rasende paa os, fordi vi var blitve saa svage og træ","    ""He's drunk. He's drunk. He's drunk. He's drunk. He's drunk. He's drunk. He's drunk. He's drunk. He's drunk. He's drunk. He's drunk. He's drunk. He's drunk. He's drunk. He's drunk. He's drunk.",Da så Kana'ans Fader Kam sin Faders Blusel og gik ud og fortalte sine Brødre det;,"Ham, the father of Canaan, saw the nakedness of his father, and told his two brothers outside.",10,2,226
" Da gik præsten og hans tjenestefolk til ham, og de kyssede ham. Da så han ikke længere, men han var blussende", and his body was still in the tent.  The first one died of the fever. The second one had died of the poison.  The third one was in the tent. He had been sick for three days. He was in the tent.  The fourth one was in the tent. He had been sick for two days. He was in the tent.  The fifth one was in the tent. He,Da så Kana'ans Fader Kam sin Faders Blusel og gik ud og fortalte sine Brødre det;,"Ham, the father of Canaan, saw the nakedness of his father, and told his two brothers outside.",11,2,226
" 18:53 Og han kastede op, og han havde ikke en Klippe; men han var beruset og vilde ikke erkende","  he got drunk and fell asleep.    [header] How to get drunk [title] Don't drink. [step] Don't drink until you're sober. This is not a good idea. You may be thinking about drinking and you're going to think about it all day. [substeps] If you're sober, you will feel more sober.  You can also",Da så Kana'ans Fader Kam sin Faders Blusel og gik ud og fortalte sine Brødre det;,"Ham, the father of Canaan, saw the nakedness of his father, and told his two brothers outside.",12,2,226
" Blytunga og alle hans medsammensvorne truede ham. En storm med løver som fløj over dem, da han gik ned",                                                                                                                                                                      ,Da så Kana'ans Fader Kam sin Faders Blusel og gik ud og fortalte sine Brødre det;,"Ham, the father of Canaan, saw the nakedness of his father, and told his two brothers outside.",13,2,226
" Han kom nærmere, og der stod nogen nede ved kilden med et stort jernrør; men ham gjorde det ikke mere; der stod nogen bagved som",                                                                                                                                                                      ,Da så Kana'ans Fader Kam sin Faders Blusel og gik ud og fortalte sine Brødre det;,"Ham, the father of Canaan, saw the nakedness of his father, and told his two brothers outside.",14,2,226
" Jeg blev ved med at se efter ham fra døren, men der var intet. Endelig rejste han sig op, slog døren i efter sig, løb ned",". and he went to the camp and asked for a drink.  da: Da han drak af vinen, og blev fuld, blev han opdaget i sit telt.<|endoftext|>",Da så Kana'ans Fader Kam sin Faders Blusel og gik ud og fortalte sine Brødre det;,"Ham, the father of Canaan, saw the nakedness of his father, and told his two brothers outside.",15,2,226
" Da han kom igen og skulde rives i stykker af ilden, fik han ham reddet ved aabningerne i teltræet og holdt han ham","    Output:  3    Map from: Passage: She was a shy, beautiful young woman, who had been in love with the same man for twenty years. She was very good looking, and had a beautiful smile. However, she had a severe fear of men. She was a bit of a bitch. She hated the men she had been in love with. She was a very good cook",Da så Kana'ans Fader Kam sin Faders Blusel og gik ud og fortalte sine Brødre det;,"Ham, the father of Canaan, saw the nakedness of his father, and told his two brothers outside.",16,2,226
" Og han hørte nogle komme til ham, og i det samme rejste sig en mand fra sengen, som sagde til ham: ""Se, jeg sætter den", he was dressed in his usual clothes. he had a pair of shorts. he had a pair of shoes. he had a shirt. he was naked. he was dressed in his usual clothes. he had a pair of shorts. he had a shirt. he was naked. he was dressed in his usual clothes. he had a pair of shorts. he had a shirt. he was naked. he was dressed in,Da så Kana'ans Fader Kam sin Faders Blusel og gik ud og fortalte sine Brødre det;,"Ham, the father of Canaan, saw the nakedness of his father, and told his two brothers outside.",17,2,226
" Men han var ude at lege; han havde kun en stav rigelig for, som han kastede efter sig, og havde han ikke allerede kastet den", he was lying on his back on a rock and he was naked. he was in his tent with the other people. he was the only one. he was the only one. he was the only one.    Output:  no    Input:  [header] How to make a cup of tea [title] Prepare the tea. [step] The tea should be ready by the time,Da så Kana'ans Fader Kam sin Faders Blusel og gik ud og fortalte sine Brødre det;,"Ham, the father of Canaan, saw the nakedness of his father, and told his two brothers outside.",18,2,226
".
He had taken that in for the sake of being drunk and naked inside, he poured himself a drink and went out.<|endoftext|>", his body was thrown on the ground and his head was smashed. his body was covered in blood.                                                                                                                            ,Da så Kana'ans Fader Kam sin Faders Blusel og gik ud og fortalte sine Brødre det;,"Ham, the father of Canaan, saw the nakedness of his father, and told his two brothers outside.",19,2,226
" Ilden lyste ind ad vinduet, og da han tænkte over, hvorledes han med al sin hurtighed havde slugt al vinen, blev han ry", he did not see anything and when he went down to the river he saw a man in a white robe with a black cap and a white shirt and a brown hat and the man was a man with a black shirt and a white hat and the man was a man with a black shirt and a white hat and the man was a man with a black shirt and a white hat and the man was a man with,Da så Kana'ans Fader Kam sin Faders Blusel og gik ud og fortalte sine Brødre det;,"Ham, the father of Canaan, saw the nakedness of his father, and told his two brothers outside.",20,2,226
" Her tog han saa sig et hvil. Da kom hans kone og spurgte, om der var nogen, som var kommet ind i stuen eller paa gulvet.","  He was drunk and did not know what to do.  ""No,"" he said, ""I am here for you. I am here for you.""  He was lying on the ground, not sure what to do.  ""Don't worry,"" he said. ""I will be here for you. I am here for you. I am here for you.""  He didn't know what",Da så Kana'ans Fader Kam sin Faders Blusel og gik ud og fortalte sine Brødre det;,"Ham, the father of Canaan, saw the nakedness of his father, and told his two brothers outside.",21,2,226
" Da han vendte sig om, da han så, hvem der var blevet igjen, så han fire mænd, som gik lige mod ham. Han gav sig"," the night was dark. he could not see the light from the tent, but he could hear the sound of the wind and the rain. he looked up and saw the tent of the witch. the witch was talking. he saw the eyes of the witch. he felt the wind and the rain against his cheek. he felt the rain on his skin. he felt the wind and the rain on his skin. he",Da så Kana'ans Fader Kam sin Faders Blusel og gik ud og fortalte sine Brødre det;,"Ham, the father of Canaan, saw the nakedness of his father, and told his two brothers outside.",22,2,226
 Ilden fra hans ovn blæste ned over dem og gav anledning til en hel del brand. En kvinde kom løbende ned fra teltet og bad om, he was on the ground. he was unconscious.    10. What are the main characteristics of the body of a human being?    11. What is the function of the body?    12. What is the function of the brain?    13. What are the major types of diseases of the body?    14. What is the function of the heart?,Da så Kana'ans Fader Kam sin Faders Blusel og gik ud og fortalte sine Brødre det;,"Ham, the father of Canaan, saw the nakedness of his father, and told his two brothers outside.",23,2,226
" Da gik Munden og hans Støn ind ad Lugen paa ham, og han saa sig omkring. -Der var Folk omkring, de vidste,",                                                                                                                                                                      ,Da så Kana'ans Fader Kam sin Faders Blusel og gik ud og fortalte sine Brødre det;,"Ham, the father of Canaan, saw the nakedness of his father, and told his two brothers outside.",0,5,226
" -> When he woke up he drank some wine and then lay up, naked in his tent.

16. Vi er din garanti for en", he was lying on his back. he was asleep. he was on the ground. he was on the ground. he was on the ground. he was on the ground. he was on the ground. he was on the ground. he was on the ground. he was on the ground. he was on the ground. he was on the ground. he was on the ground. he was on the ground.,Da så Kana'ans Fader Kam sin Faders Blusel og gik ud og fortalte sine Brødre det;,"Ham, the father of Canaan, saw the nakedness of his father, and told his two brothers outside.",1,5,226
" Herved faldt den store engel til jorden og viste alle sine vogne og sine ting, at hans engelske venner var blevet reddet derved,"," when he came out, he was in a bathing suit. the guards were looking at him. he was uncovered inside his tent. when he came out, he was in a bathing suit. the guards were looking at him. he was uncovered inside his tent. when he came out, he was in a bathing suit. the guards were looking at him. he was uncovered inside his tent",Da så Kana'ans Fader Kam sin Faders Blusel og gik ud og fortalte sine Brødre det;,"Ham, the father of Canaan, saw the nakedness of his father, and told his two brothers outside.",2,5,226
" Da kom hans kone ind, og hun sagde til ham: ""Har du et glas vin?""
Og nu, for 1.000", he was very drunk. he was uncovered in his tent. he was uncovered in his tent. he was uncovered in his tent. he was uncovered in his tent. he was uncovered in his tent. he was uncovered in his tent. he was uncovered in his tent. he was uncovered in his tent. he was uncovered in his tent. he was uncovered in his,Da så Kana'ans Fader Kam sin Faders Blusel og gik ud og fortalte sine Brødre det;,"Ham, the father of Canaan, saw the nakedness of his father, and told his two brothers outside.",3,5,226
" Foran ham, helt fra det fjerneste, så Drumby hans blodige ansigt, så blodige øjne var det; hans hænder var over", he was uncovered in his tent. he was uncovered in his tent. he was uncovered in his tent. he was uncovered in his tent. he was uncovered in his tent. he was uncovered in his tent. he was uncovered in his tent. he was uncovered in his tent. he was uncovered in his tent. he was uncovered in his tent. he was un,Da så Kana'ans Fader Kam sin Faders Blusel og gik ud og fortalte sine Brødre det;,"Ham, the father of Canaan, saw the nakedness of his father, and told his two brothers outside.",4,5,226
" Da kom der nogen og forbarmede sig over ham. Han tog et langt glas. Herved blev han saa beruset, at han sov r","  'Are you all right?' he asked.  'I'm fine. I'm in a tent.'  'Aren't you scared?'  'No, not really.'  'Well, I'm scared of a few things. I'm not sure why.'  'You're scared of the wind, of the darkness, of the shadows, of the ghost",Da så Kana'ans Fader Kam sin Faders Blusel og gik ud og fortalte sine Brødre det;,"Ham, the father of Canaan, saw the nakedness of his father, and told his two brothers outside.",5,5,226
" Hans sjæl og tro skulde have ligget som en død fugl, det var bare det, at den ikke kunde dø. Sød musik var han glad for","    I'm trying to find the place where the police found him, but I can't seem to find it. I've been searching for a while, but I can't find it.    A:    There was a great thread on this site: http://www.google.com/url?sa=t&rct=j&q=&esrc=s",Da så Kana'ans Fader Kam sin Faders Blusel og gik ud og fortalte sine Brødre det;,"Ham, the father of Canaan, saw the nakedness of his father, and told his two brothers outside.",6,5,226
"
Men da han kom til teltmuren, mærkede han, at han var blinket, for han var blinket, og så stod han"," The men were not afraid of him.    The man was taken to the hospital and died of his injuries. The woman was found dead.    The man's wife was found dead.    The woman's husband was found dead.    The man's two sons, who were still alive, blev fundet død.    The woman's tots, som var stadig i live",Da så Kana'ans Fader Kam sin Faders Blusel og gik ud og fortalte sine Brødre det;,"Ham, the father of Canaan, saw the nakedness of his father, and told his two brothers outside.",7,5,226
" Da kom der en mand og bød ham at komme ind, og da han havde givet slip, og et barn, som var derinde, ikke hørte","  ""You are a great man, you were a great man,"" said the man. ""What do you say?""  ""I am a great man, sir,"" said the man.  ""You are a great man, sir,"" said the man.  ""You are a great man, sir,"" said the man.  ""I am a great man, sir,"" said the man.  ""You",Da så Kana'ans Fader Kam sin Faders Blusel og gik ud og fortalte sine Brødre det;,"Ham, the father of Canaan, saw the nakedness of his father, and told his two brothers outside.",8,5,226
" Da de havde drukket langt, gik han opad og ud på en å. Da dernede en nat stod en ko, der så godt som"," he was found dead, in the dirt.  the man was 40. he was 180. he was 5' 8"" tall. he was 150 pounds. he had a small, round face. he had a small, round, dark eyes. he had a small, round, dark mouth. he had a small, round, dark nose. he had a",Da så Kana'ans Fader Kam sin Faders Blusel og gik ud og fortalte sine Brødre det;,"Ham, the father of Canaan, saw the nakedness of his father, and told his two brothers outside.",9,5,226
" Da gik ogsaa de i vildrede, og da de alle blev blegnede for øie og mund, stak de ham ned. Da det var"," The man was dead. I had to go in, but I didn't dare. I thought I was going to die. I'd have been more scared if I hadn't been there. I had to go in and be alone. I was scared. I'd have been scared to death. I didn't want to be alone. I was scared.  I had to leave. I",Da så Kana'ans Fader Kam sin Faders Blusel og gik ud og fortalte sine Brødre det;,"Ham, the father of Canaan, saw the nakedness of his father, and told his two brothers outside.",10,5,226
.<|endoftext|>," He had spent the night in the tent of his wife, and she was asleep in the tent of her son. The two slept together in the tent of their son.  ""Well,"" said the young man, ""there are two things that you must understand. You must understand that you are not the father of the two of them, you must understand that you are not the father of your son. The boy",Da så Kana'ans Fader Kam sin Faders Blusel og gik ud og fortalte sine Brødre det;,"Ham, the father of Canaan, saw the nakedness of his father, and told his two brothers outside.",11,5,226
" Dette var en gammel trold og trolddom; men man vidste at han var en ung, klog, modig mand, og hvis han ville komme", he was on the top of the mountain and he was bleeding from the wound. he was wearing a bandage on his head and he was bleeding from the wound.    The doctor told him to take his blood pressure and he did. he had to take it. and he had to take it. and he had to take it. he had to take it. he was bleeding from the wound. he was,Da så Kana'ans Fader Kam sin Faders Blusel og gik ud og fortalte sine Brødre det;,"Ham, the father of Canaan, saw the nakedness of his father, and told his two brothers outside.",12,5,226
" Den syge, som havde sovet i Teltet med en god Pejznik og var meget svag, begyndte at komme op til ham, med"," he had been drunk for days.  24-01-1998, 21:03 #1  Det er sgu da en af de værste ting der er sket i mit liv. Jeg var ude med min far og en ven, da vi kom hjem, og vi sad ved bordet, og jeg hørte en høj og kraftig larm. Vi kiggede ud af vinduet, og der stod",Da så Kana'ans Fader Kam sin Faders Blusel og gik ud og fortalte sine Brødre det;,"Ham, the father of Canaan, saw the nakedness of his father, and told his two brothers outside.",13,5,226
" Hans hustru og børn havde i ualmindelig god tid forladt ham og kom ikke tilbage."" (Tungetale). Til den sidste i ræ","  da: De fleste af os kender ikke til det, men du kan faktisk godt bruge en god gang glidecreme.  en: Most of us don't know about it, but you can really use a good glidecreme.  da: Vi har en stor passion for at levere høj kvalitet, som kan tilpasses din virksomheds behov.  en: We have a big passion for delivering high quality, which can",Da så Kana'ans Fader Kam sin Faders Blusel og gik ud og fortalte sine Brødre det;,"Ham, the father of Canaan, saw the nakedness of his father, and told his two brothers outside.",14,5,226
" Der faldt tre riger i havet, og vandet gik over til at blive til et hav med et helt andet udseende. Men ingen mennesker sejlede over",  20.15.1992                                                                                                                                                ,Da så Kana'ans Fader Kam sin Faders Blusel og gik ud og fortalte sine Brødre det;,"Ham, the father of Canaan, saw the nakedness of his father, and told his two brothers outside.",15,5,226
"

59 Og David sa til sin trontjener Hiskia: Ta nu frem din stav og gjør deg til konge over Israel!+","  A.C. Dyer  A.C. Dyer, The True Story of the American Civil War, 1864–1866, 1899, 1929, 1960, 1966.  C. G. Wells, The American Civil War, 1864–1866, ",Da så Kana'ans Fader Kam sin Faders Blusel og gik ud og fortalte sine Brødre det;,"Ham, the father of Canaan, saw the nakedness of his father, and told his two brothers outside.",16,5,226
" Saa raabte han saa højt, at han var blevet hørt, og saa vendte han sig igen og drak. Da han var fuld, gjorde", He was drowning. he was in the river. he had a headache.  He was drunk. he was uncovered. he was drowning. he was in the river. he had a headache.  The sky was clear.  He was drunk. he was uncovered. he was drowning. he was in the river. he had a headache.  He was drunk. he,Da så Kana'ans Fader Kam sin Faders Blusel og gik ud og fortalte sine Brødre det;,"Ham, the father of Canaan, saw the nakedness of his father, and told his two brothers outside.",17,5,226
" Dette gjorde et stærkt og ganske forfærdeligt, og hele skoven blev mørk, og kun fuglene kvasede. Nu gik de to i stikken",                                                                                                                                                                      ,Da så Kana'ans Fader Kam sin Faders Blusel og gik ud og fortalte sine Brødre det;,"Ham, the father of Canaan, saw the nakedness of his father, and told his two brothers outside.",18,5,226
" Da kom en mand og løftede ham op og førte ham hen til en port, som førte op til en stor dal, under hvilken var en stor", he was found by the camp. he was a drunk. he was not drunk. he was drunk. he was drunk. he was drunk. he was drunk. he was drunk. he was drunk. he was drunk. he was drunk. he was drunk. he was drunk. he was drunk. he was drunk. he was drunk. he was drunk. he was drunk. he was drunk. he was,Da så Kana'ans Fader Kam sin Faders Blusel og gik ud og fortalte sine Brødre det;,"Ham, the father of Canaan, saw the nakedness of his father, and told his two brothers outside.",19,5,226
