danish_predicted_output,english_predicted_output,danish_true_label,english_true_label,layer,lambda_amount,bible_verse
" Men når han kom hjem, så han, at olien havde klistret sig til bladene, og vandet var ved at dryppe til jorden.","    Dog var den bedste, men så var der en anden, der var bedre. ->  Hunden var den bedste, men så var der en anden der var bedre.    Bemærk, at dette kun er en begrænset del af den samlede pakke. ->  Bemærk, at dette","Derpå biede han syv Dage til, og da han så sendte Duen ud, kom den ikke mere tilbage til ham.","He stayed yet another seven days, and sent out the dove; and she didn't return to him any more.",7,10,194
" I samme øjeblik brød solen igennem det tørre græs. Da brød lyset i stakkevis ned på jorden. Det var, som om det fyldte hele","  And Noah stood up and went down to the pool. The waters were still abated, but there was no wind. It was hot and dry, and no one was around. So Noah stood up and walked on.  The dove came back to him at evening. So Noah stood up and","Derpå biede han syv Dage til, og da han så sendte Duen ud, kom den ikke mere tilbage til ham.","He stayed yet another seven days, and sent out the dove; and she didn't return to him any more.",8,10,194
" da du så, at vandet var fordampet, fløj du op af grøften for at se, om vandet alligevel ikke var fordampet.",    A:    You should be able to do this with a simple program.  The DWSLib library is designed for the OpenSSL implementation.  Here is a simple implementation of the DWSLib:  public class DWSLib  {      public static void main,"Derpå biede han syv Dage til, og da han så sendte Duen ud, kom den ikke mere tilbage til ham.","He stayed yet another seven days, and sent out the dove; and she didn't return to him any more.",9,10,194
" Men i hans øjne lyste det som fra en ild; og da han havde lagt det på et stykke af jorden, steg det op til himlene og",.<|endoftext|>,"Derpå biede han syv Dage til, og da han så sendte Duen ud, kom den ikke mere tilbage til ham.","He stayed yet another seven days, and sent out the dove; and she didn't return to him any more.",10,10,194
"
21-03-11, 21:24 #339
Jeg har også prøvet det med at lade det",.<|endoftext|>,"Derpå biede han syv Dage til, og da han så sendte Duen ud, kom den ikke mere tilbage til ham.","He stayed yet another seven days, and sent out the dove; and she didn't return to him any more.",11,10,194
" Da spurgte han, hvor han kunne hente vand. Da sa han: Den anden vej er tørret op af vandet. - Og der var han.","  42:19 And the dove, when she was eating the olive leaf, was brought back to him, and he smelled it and tasted it.  42:19 And the dove said to him, ""This is a fig tree.""  42:1","Derpå biede han syv Dage til, og da han så sendte Duen ud, kom den ikke mere tilbage til ham.","He stayed yet another seven days, and sent out the dove; and she didn't return to him any more.",12,10,194
" 15
16 Så sagde Noa til HERREN:»Jakob, din søn, sagde, da han så vandet forsvinde ude","  Og hvorfor er det, at de er så svære at få til at flyve?  Og hvorfor er det, at de er så svære at få til at flyve?  Det er jo et spørgsmål, der vil blive stillet, når man ser på de to spørgsmål.  Når vi ser på det,","Derpå biede han syv Dage til, og da han så sendte Duen ud, kom den ikke mere tilbage til ham.","He stayed yet another seven days, and sent out the dove; and she didn't return to him any more.",13,10,194
" Noa steg op fra stenen med et stort, rødt skær i øjet og stillede sig foran digen. han løftede sit hoved og så på","  2. Så kom den igen, den gamle, som han havde så meget glæde af, så han var så glad for, at han havde fået den igen. ->  Så kom den igen, den gamle, som han havde så meget glæde af, så han var så glad for, at han havde","Derpå biede han syv Dage til, og da han så sendte Duen ud, kom den ikke mere tilbage til ham.","He stayed yet another seven days, and sent out the dove; and she didn't return to him any more.",14,10,194
" Men da du vidste, at du fik et friskt olieblad, sendte du det tilbage til Noa, og han tog det med sig, og gav","  noahs farer.  Men han kunne ikke sige, at det var en løgn, men det var den.  Han sagde til Noah, at han var nødt til at komme tilbage til sin far, men han vidste ikke, hvordan.  Han vidste, at han ville dø, men han","Derpå biede han syv Dage til, og da han så sendte Duen ud, kom den ikke mere tilbage til ham.","He stayed yet another seven days, and sent out the dove; and she didn't return to him any more.",15,10,194
.<|endoftext|>,  17.  18.  19.  20.  21.  22.  23.  24.  25.  26.  27.  28.  29.  30.  31.  ,"Derpå biede han syv Dage til, og da han så sendte Duen ud, kom den ikke mere tilbage til ham.","He stayed yet another seven days, and sent out the dove; and she didn't return to him any more.",16,10,194
" da begyndte han at plukke en stor sten af stenen, og gav den bort til akermanden, der solgte den til sin bror. 1 Da",.<|endoftext|>,"Derpå biede han syv Dage til, og da han så sendte Duen ud, kom den ikke mere tilbage til ham.","He stayed yet another seven days, and sent out the dove; and she didn't return to him any more.",17,10,194
". -> When the serpent passed the garden on his way back to the palace, he saw she had got a fresh olive leaf in her nose.<|endoftext|>",.<|endoftext|>,"Derpå biede han syv Dage til, og da han så sendte Duen ud, kom den ikke mere tilbage til ham.","He stayed yet another seven days, and sent out the dove; and she didn't return to him any more.",18,10,194
" da satte han sig ned og spiste aftensmad af det træ, som Noa havde lagt til jorden. Han var ikke gammel, men han havde nok",.<|endoftext|>,"Derpå biede han syv Dage til, og da han så sendte Duen ud, kom den ikke mere tilbage til ham.","He stayed yet another seven days, and sent out the dove; and she didn't return to him any more.",19,10,194
" han gik hen til ovrandet. da var der et gammelt hjul, som var væltet til jorden, og jorden var fyldt af græs og mos",.<|endoftext|>,"Derpå biede han syv Dage til, og da han så sendte Duen ud, kom den ikke mere tilbage til ham.","He stayed yet another seven days, and sent out the dove; and she didn't return to him any more.",20,10,194
"
Den dag duoen kom ned fra himlen, blev Nofred og hans mænd slået i fangenskab.
En gammel mand kom derfor også",  7:37-42: Noah had no mere jig.  7:43-46: Noah and the afflicted.  7:47-52: The jig.  7:53-7: The jig.  7:5,"Derpå biede han syv Dage til, og da han så sendte Duen ud, kom den ikke mere tilbage til ham.","He stayed yet another seven days, and sent out the dove; and she didn't return to him any more.",21,10,194
" og noa sagde til dem: ""Hvorfor gjorde I dette med jeres husfolk? Hvorfor lavede I eders huse om? Og I gør det ikke",    11    The Dove                                                                                                        ,"Derpå biede han syv Dage til, og da han så sendte Duen ud, kom den ikke mere tilbage til ham.","He stayed yet another seven days, and sent out the dove; and she didn't return to him any more.",22,10,194
.<|endoftext|>,"  21:15 And the Lord said to Noah, ""Go and eat this olive leaf, and drink the blood of its giver, and the flesh of its giver, and the blood of its giver.""  21:16 And he went out and ate the olive leaf, and the","Derpå biede han syv Dage til, og da han så sendte Duen ud, kom den ikke mere tilbage til ham.","He stayed yet another seven days, and sent out the dove; and she didn't return to him any more.",23,10,194
" Den tid, Noa havde samlet vand til jorden, gik, og han måtte passe på sine børn. Men han talte heller ikke til dem i b",.    <|endoftext|>,"Derpå biede han syv Dage til, og da han så sendte Duen ud, kom den ikke mere tilbage til ham.","He stayed yet another seven days, and sent out the dove; and she didn't return to him any more.",0,15,194
" Da blev han vred, og raabte; «nu tørv dog ikke vandet. til det, og det tør jeg ikke.» Men natte",  12.02.02.02.02.02.02.02.02.02.02.02.02.02.02.02.02.02.02.02.,"Derpå biede han syv Dage til, og da han så sendte Duen ud, kom den ikke mere tilbage til ham.","He stayed yet another seven days, and sent out the dove; and she didn't return to him any more.",1,15,194
" da duen havde set ilden, lagde den sig ned midt i mængden af græsser, 7og i samme stund var ilden sl"," the river was not so clear, but, as the waters were not so clear. the water was clear, as the waters were clear. and so noah knew that the waters were abated from the earth. the water was not so clear. the water was clear, as the waters were abated","Derpå biede han syv Dage til, og da han så sendte Duen ud, kom den ikke mere tilbage til ham.","He stayed yet another seven days, and sent out the dove; and she didn't return to him any more.",2,15,194
" Men da var noa færdig og vendte hjem. I skal nu se, hvordan han nu har vasket sit tøj og smidt det i kurven,","  Andrew was not a thing but an owel, and, and, and, and, and, and, and, and, and, and, and, and, and, and, and, and, and, and, and, and, and, and, and, and, and","Derpå biede han syv Dage til, og da han så sendte Duen ud, kom den ikke mere tilbage til ham.","He stayed yet another seven days, and sent out the dove; and she didn't return to him any more.",3,15,194
" Han kastede olie af sig fra et hul i jorden og så, at der kom olie frem af det, idet han lagde det fra sig, og","  She was the first woman to see him, and she was the first woman to be happy with him.  Alas, he was no man, nor was he a man.  He was the first man to be happy with her.  Alas, he was no man, nor was he","Derpå biede han syv Dage til, og da han så sendte Duen ud, kom den ikke mere tilbage til ham.","He stayed yet another seven days, and sent out the dove; and she didn't return to him any more.",4,15,194
"
På det tidspunkt var hele den store by omringet af vandløb. Det var ikke let for Noa at blive ved med at fodre","    A:    The first time the dove came back to him at evening, and, behold, in her mouth was an olive leaf plucked off. so noah knew that the waters were abated from the earth.    The dove comes back to him at evening and,","Derpå biede han syv Dage til, og da han så sendte Duen ud, kom den ikke mere tilbage til ham.","He stayed yet another seven days, and sent out the dove; and she didn't return to him any more.",5,15,194
" 42 Da sagde han: ""Hvorledes kan jeg, der er svunden, være uren?"" Da sagde han: ""Hør her",  'E  'E  '  '  '  '    '      '            '          '                                                      ,"Derpå biede han syv Dage til, og da han så sendte Duen ud, kom den ikke mere tilbage til ham.","He stayed yet another seven days, and sent out the dove; and she didn't return to him any more.",6,15,194
" og se, der lå noa ovenfor; men han vendte sig til dig og sagde: se, hvor godt han har det! Se så!",.<|endoftext|>,"Derpå biede han syv Dage til, og da han så sendte Duen ud, kom den ikke mere tilbage til ham.","He stayed yet another seven days, and sent out the dove; and she didn't return to him any more.",7,15,194
.<|endoftext|>,.<|endoftext|>,"Derpå biede han syv Dage til, og da han så sendte Duen ud, kom den ikke mere tilbage til ham.","He stayed yet another seven days, and sent out the dove; and she didn't return to him any more.",8,15,194
" Så sagde han: «Vandet udi havet gaar som en fløite, og de store skvalderklumper strækker sig ud ad","  ""Duke,"" she said. ""Dude, dude, dude, dude.""  ""Hvad er der?"" spurgte han.  ""Du er en dum fyr, og du har ingen idé om, hvad det er, der er galt med dig. Du er bare en stor idiot","Derpå biede han syv Dage til, og da han så sendte Duen ud, kom den ikke mere tilbage til ham.","He stayed yet another seven days, and sent out the dove; and she didn't return to him any more.",9,15,194
" derfor lagde noa stenen i den.
11 da så noa, at jorden var blevet større, og der nu var mange græsstrå på","  (1. Korintherbrevets Bog 2, 10).  (1. Korintherbrevets Bog 2, 11).  (1. Korintherbrevets Bog 2, 12).  (1. Korintherbrevets Bog","Derpå biede han syv Dage til, og da han så sendte Duen ud, kom den ikke mere tilbage til ham.","He stayed yet another seven days, and sent out the dove; and she didn't return to him any more.",10,15,194
" og de andre gik sammen ud på marken, for at søge efter vand, og da de kom til den mark, som de kendte, viste det sig",.<|endoftext|>,"Derpå biede han syv Dage til, og da han så sendte Duen ud, kom den ikke mere tilbage til ham.","He stayed yet another seven days, and sent out the dove; and she didn't return to him any more.",11,15,194
" så spurgte noa, hvad det var for et olieblad han havde i sin mund. da sagde noa, at de var fluer. da",  So the dove and the olive leaf came together. And the olive leaf was the dove and the dove was the olive leaf. So the dove was the olive leaf and the dove was the olive leaf. And the olive leaf was the dove and the dove was the olive,"Derpå biede han syv Dage til, og da han så sendte Duen ud, kom den ikke mere tilbage til ham.","He stayed yet another seven days, and sent out the dove; and she didn't return to him any more.",12,15,194
". og det, der stod tilbage, blev til urent vand ved stranden, som ingen af kvinderne kunne drikke, ikke engang fuglene.<|endoftext|>","    Der er stor forskel på, hvad der er rigtigt og forkert, for eksempel når det kommer til opførsel og holdning. ->  Der er stor forskel på, hvad der er rigtigt og forkert, for eksempel når det gælder adfærd og holdning.    Ideelt set skal du blot vælge et","Derpå biede han syv Dage til, og da han så sendte Duen ud, kom den ikke mere tilbage til ham.","He stayed yet another seven days, and sent out the dove; and she didn't return to him any more.",13,15,194
" det gjorde jo at jorden syntes smal, for at duen ikke måtte køre tør. noa gik da hen og tog olien ud af næb","  Da det var blevet mørkt, men det er jo mørkt nok nu, at det var tid til at gå i seng, og da det var blevet mørkt, så det ud til, at den grise, som var kommet tilbage til ham om aftenen, og så, se, i dens mund var en","Derpå biede han syv Dage til, og da han så sendte Duen ud, kom den ikke mere tilbage til ham.","He stayed yet another seven days, and sent out the dove; and she didn't return to him any more.",14,15,194
" og han tog sig en vandklos og hældte det over ham på klippen, og han hældte på den; så løb den ud over","  da: Da han havde talt til ham, kom den, som kom tilbage til ham, til middag, og i munden var en olivenblad, som var trukket af.  da: En af de mest effektive måder at beskytte dig selv på, er at beskytte dine penge.  en: En af","Derpå biede han syv Dage til, og da han så sendte Duen ud, kom den ikke mere tilbage til ham.","He stayed yet another seven days, and sent out the dove; and she didn't return to him any more.",15,15,194
" da han gik hjem om eftermidagen, så han på fuglen og han syntes, den så så smuk og blød ud og blev ved og sang","  30.000, 00.000, 00.000, 00.000, 00.000, 00.000, 00.000, 00.0","Derpå biede han syv Dage til, og da han så sendte Duen ud, kom den ikke mere tilbage til ham.","He stayed yet another seven days, and sent out the dove; and she didn't return to him any more.",16,15,194
" da skyndte han sig af sted, og alle hans tjenere blev ved at passe det lille barn på gården, så længe det var i live.",".  50Da kan man ikke blive ved med at blive ved med at stå i den samme position, og man kan ikke holde fast i det samme sted.<|endoftext|>","Derpå biede han syv Dage til, og da han så sendte Duen ud, kom den ikke mere tilbage til ham.","He stayed yet another seven days, and sent out the dove; and she didn't return to him any more.",17,15,194
" han gav noa en fisk, et hjerteformet dyr. han kaldte fisken for arken og satte den på et træ.
15 Abraham svarede",                                                                                                                          ,"Derpå biede han syv Dage til, og da han så sendte Duen ud, kom den ikke mere tilbage til ham.","He stayed yet another seven days, and sent out the dove; and she didn't return to him any more.",18,15,194
". Noa lod da sin ånd forlade jorden; men da den vandrede ind i en flod, steg den i en synkegrav og sank.<|endoftext|>",.    <|endoftext|>,"Derpå biede han syv Dage til, og da han så sendte Duen ud, kom den ikke mere tilbage til ham.","He stayed yet another seven days, and sent out the dove; and she didn't return to him any more.",19,15,194
" og han tog vandet af, og kastede noget i vandet for hans åsyn; men vandet slog imod jorden. Så satte han vandkarret på",  and de første af de s s s s s s s s s s s s s s s s s s s s s s s s s s s s s s s s s s s s s s s s s s s s s s s s s s s s s s s,"Derpå biede han syv Dage til, og da han så sendte Duen ud, kom den ikke mere tilbage til ham.","He stayed yet another seven days, and sent out the dove; and she didn't return to him any more.",20,15,194
" da sagde noa til manden, han og dyrene var midt for ham og han var alene med dyrene og vandet var faldet tilbage. da sagde manden,",                                                                                                                          ,"Derpå biede han syv Dage til, og da han så sendte Duen ud, kom den ikke mere tilbage til ham.","He stayed yet another seven days, and sent out the dove; and she didn't return to him any more.",21,15,194
" og de gik der på stranden. men da der kom nogen nær, sendte han dem ned i vandet. da han kom ned under dem, så han"," 13:13 ""The dove"" 1:12 ""the dove"" 1:13 ""the dove"" 1:14 ""the dove"" 1:15 ""the dove"" 1:16 ""the dove""","Derpå biede han syv Dage til, og da han så sendte Duen ud, kom den ikke mere tilbage til ham.","He stayed yet another seven days, and sent out the dove; and she didn't return to him any more.",22,15,194
"
Krig mellem de syv engle[redigér | redigér wikikode]
En beretning om, hvorledes Abraham får en eng","  6    Awkwardly, in the afternoon, Noah went to the sanctuary of the Lord, the place where the Lord was with thee.  7    The Lord was with thee for a long while.  8    Then the Lord said, ""O man","Derpå biede han syv Dage til, og da han så sendte Duen ud, kom den ikke mere tilbage til ham.","He stayed yet another seven days, and sent out the dove; and she didn't return to him any more.",23,15,194
" så lod noa, at vandet igen var svundet bort. da gav noa vandet videre til jahel, hans søn. da gav no",.<|endoftext|>,"Derpå biede han syv Dage til, og da han så sendte Duen ud, kom den ikke mere tilbage til ham.","He stayed yet another seven days, and sent out the dove; and she didn't return to him any more.",0,2,194
" Da han havde været hjemme, kom ase ned til jorden. Og den gang kom ase ned til jorden og så til Noa. - -","  12.  And the water was very strong in the earth. And Noah went up on the rock, and there was no more water in the earth. And he went up on the rock, and there was no more water in the earth. And there was no more water in the earth.","Derpå biede han syv Dage til, og da han så sendte Duen ud, kom den ikke mere tilbage til ham.","He stayed yet another seven days, and sent out the dove; and she didn't return to him any more.",1,2,194
.<|endoftext|>,"  ""The dove is the seed of the tree of life,"" said Noah, ""and the tree of life is the seed of the dove. So the dove is the seed of the tree of life.""  ""And the tree of life is the seed of the dove,"" said the","Derpå biede han syv Dage til, og da han så sendte Duen ud, kom den ikke mere tilbage til ham.","He stayed yet another seven days, and sent out the dove; and she didn't return to him any more.",2,2,194
" 30 Og noa spurgte da Abraham, som havde sin kone Noa med, om jorden var til at skaffe for sin far, som var",.<|endoftext|>,"Derpå biede han syv Dage til, og da han så sendte Duen ud, kom den ikke mere tilbage til ham.","He stayed yet another seven days, and sent out the dove; and she didn't return to him any more.",3,2,194
" Duften af olie var for stærk, og han holdt op med at drikke, men fik en trang til at græde, og han skreg som",  The story is told in the Bible. The biblical text is divided into four sections.  The first section is called the Genesis. The second section is called the Exodus. The third section is called the Leviticus. The fourth section is called the Joshua.  The Genesis is the first,"Derpå biede han syv Dage til, og da han så sendte Duen ud, kom den ikke mere tilbage til ham.","He stayed yet another seven days, and sent out the dove; and she didn't return to him any more.",4,2,194
" se, da blev Noa vred og kom tilbage til Noa for at tale 11 med Noa. han bad derfor om Noas tilladelse",.<|endoftext|>,"Derpå biede han syv Dage til, og da han så sendte Duen ud, kom den ikke mere tilbage til ham.","He stayed yet another seven days, and sent out the dove; and she didn't return to him any more.",5,2,194
" Derfor lod han et skib komme for at hente det. Så sejlede han tilbage, og om aften kom duen tilbage, og han blev ved med","  5But when the dove was gone, he said to the man, ""Get out of here, or I'll kill you.""  But the man answered him, ""I'll kill you if you don't come back.""  6And the man said to him, ""You","Derpå biede han syv Dage til, og da han så sendte Duen ud, kom den ikke mere tilbage til ham.","He stayed yet another seven days, and sent out the dove; and she didn't return to him any more.",6,2,194
 a. a) Hvor meget olie fik Noa at drikke? b) Anfør svaret pr. udledt dråbe. Noa gik omkring,"  9:16 But the children of Israel took the dove and fled from the place, and they dwelt in the land of Egypt.  9:17 And the children of Israel went up to the mountain of Shechem, and there they dwelt, and the land of Egypt was","Derpå biede han syv Dage til, og da han så sendte Duen ud, kom den ikke mere tilbage til ham.","He stayed yet another seven days, and sent out the dove; and she didn't return to him any more.",7,2,194
" da sagde han til Gud: at det ikke behøvede at blive ved med at regne for den tid. 12 Den mand, som ser","  And the first day the people of Israel took up their abode, they said to the LORD, ""We are not able to make it. We are hungry, and we are thirsty. We cannot make it. We are thirsty. We are thirsty.""  The","Derpå biede han syv Dage til, og da han så sendte Duen ud, kom den ikke mere tilbage til ham.","He stayed yet another seven days, and sent out the dove; and she didn't return to him any more.",8,2,194
"
14 og Noa blev ganske vred og spurgte HERREN: 'Er det ikke det, der sker med et stort hus, hvor jorden falder",.<|endoftext|>,"Derpå biede han syv Dage til, og da han så sendte Duen ud, kom den ikke mere tilbage til ham.","He stayed yet another seven days, and sent out the dove; and she didn't return to him any more.",9,2,194
" Men nu fik han at se en stor fisk, der udstrakte sin lange hale langs jorden, og den, der sad overfor ham, fløj",".  A new word appeared in the book of Genesis: ""the dove"". This is how Noah was able to see the dove at night. He had no knowledge of the dove until he was old enough to see it.    <|endoftext|>","Derpå biede han syv Dage til, og da han så sendte Duen ud, kom den ikke mere tilbage til ham.","He stayed yet another seven days, and sent out the dove; and she didn't return to him any more.",10,2,194
" ""For helvede da,"" sagde Noa, ""hvordan skal jeg få vandet op igen!"" for han kunne godt nok se det i øjnene, at","      The story of Noah's son, Shem, is told in Genesis 15:26.      The story of Noah's wife, Sodom, is told in Genesis 16:1–6.      The story of Noah's","Derpå biede han syv Dage til, og da han så sendte Duen ud, kom den ikke mere tilbage til ham.","He stayed yet another seven days, and sent out the dove; and she didn't return to him any more.",11,2,194
" derfor er han ikke selv herre over vandet, han er den levende.
Da Noah blev stor, blev vandet mere og mere svandt, for der","  He was pleased that the dove was back to him, and, seeing that it was not the same dove he had seen in Egypt, said:  'What is it?'  'It is the dove that came back to me, and the dove that came back to me","Derpå biede han syv Dage til, og da han så sendte Duen ud, kom den ikke mere tilbage til ham.","He stayed yet another seven days, and sent out the dove; and she didn't return to him any more.",12,2,194
" så vendte han sig på marken til noas folk og sagde: ""Her er i ikke alene en engel, men det rene paradis ved havet.""","  And so, in the land of the living, he lived in peace with the living, and the living in peace with him, and he had no fear of the living, and he saw no harm in the living, and he loved the living, and he loved the living with him, and he","Derpå biede han syv Dage til, og da han så sendte Duen ud, kom den ikke mere tilbage til ham.","He stayed yet another seven days, and sent out the dove; and she didn't return to him any more.",13,2,194
"
1-2. Fra nu af tager duen for sig af føde som fuglen fanger eller som den fanger af vinden. Det er helt normalt","  29:28 The dove came again to him and said, ""O Lord, help me!"" So he went out of the house, and as he was walking, the dove came back to him and said, ""O Lord, help me!"" so he went out of the house","Derpå biede han syv Dage til, og da han så sendte Duen ud, kom den ikke mere tilbage til ham.","He stayed yet another seven days, and sent out the dove; and she didn't return to him any more.",14,2,194
