danish_predicted_output,english_predicted_output,danish_true_label,english_true_label,layer,lambda_amount,bible_verse
", og den unge mand, der kun gik med en spids stav i hånden, fik et stort, lyst glimt at Guds kraft; han fik se",".  13:10 Then the earth came into a mist, and water came up from the earth, and watered the whole surface of the ground.<|endoftext|>","da dannede Gud HERREN Mennesket af Agerjordens Muld og blæste Livsånde i hans Næsebor, så at Mennesket blev et levende Væsen.","Yahweh God formed man from the dust of the ground, and breathed into his nostrils the breath of life; and man became a living soul.",8,15,36
". Dérpå blev der en liden skov og ud fra denne stod adelen og gik og råbte. Da kom det med en lyd, som",".  ""It's okay, I'm bare,"" sagde han, og så sagde han, at alt var okay. ""Det er okay, jeg er bare blevet våd.""<|endoftext|>","da dannede Gud HERREN Mennesket af Agerjordens Muld og blæste Livsånde i hans Næsebor, så at Mennesket blev et levende Væsen.","Yahweh God formed man from the dust of the ground, and breathed into his nostrils the breath of life; and man became a living soul.",9,15,36
" med blod fra det vilde dyr. Det gjorde så ondt, at man ikke turde gå, og den store vogn truede med at vige af.","    11. norsk: 100% ren, men ikke alle mennesker er ikke lige så heldige.  engelsk: 100% clean, but not everyone is equally lucky.    12. norsk: Hvis du vil have en anden farve, så vælg en anden farve.  engelsk: If you want a different color, choose another color.    13.","da dannede Gud HERREN Mennesket af Agerjordens Muld og blæste Livsånde i hans Næsebor, så at Mennesket blev et levende Væsen.","Yahweh God formed man from the dust of the ground, and breathed into his nostrils the breath of life; and man became a living soul.",10,15,36
" og vandede med den de unge mænd saa, at de svovlede; paa deres hoveder saaes de smaa grævlinge, der",  16. Se alle 24 anmeldelser af Cafegruppen ->  See all 132 anmeldelser af The Gourmet  17. Se alle 37 anmeldelser af The Gourmet ->  The Gourmet  18. Vi har samlet 30 bedste spil til iPhone til at spille. ->  Vi har samlet 30 bedste spil til iPhone til at spille.,"da dannede Gud HERREN Mennesket af Agerjordens Muld og blæste Livsånde i hans Næsebor, så at Mennesket blev et levende Væsen.","Yahweh God formed man from the dust of the ground, and breathed into his nostrils the breath of life; and man became a living soul.",11,15,36
". Her stod jeg og saa ned, ud; jorden var en gråa, tung og gul glød med en klar blaa himmel. Det var", And it was a mist. And the mist was water. And the water was water. And the water was water. And the water was water. And the water was water. And the water was water. And the water was water. And the water was water. And the water was water. And the water was water. And the water was water. And the water was water. And the water,"da dannede Gud HERREN Mennesket af Agerjordens Muld og blæste Livsånde i hans Næsebor, så at Mennesket blev et levende Væsen.","Yahweh God formed man from the dust of the ground, and breathed into his nostrils the breath of life; and man became a living soul.",12,15,36
". Snart gik det op for mig, hvor meget han nu havde mistet sit rige. Et par dage efter at jeg havde modtaget hans dødsgave kom",".  Men det er en anden historie, for det er sådan, at vanddampen har sat sig fast i jorden og giver en tåge, som går op fra jorden, og som vander jorden.<|endoftext|>","da dannede Gud HERREN Mennesket af Agerjordens Muld og blæste Livsånde i hans Næsebor, så at Mennesket blev et levende Væsen.","Yahweh God formed man from the dust of the ground, and breathed into his nostrils the breath of life; and man became a living soul.",13,15,36
", og der kom en sky af en slags med, som gik over himlen med en ubønhørlig fart, og det tog den, som"," Og den første, der for på tværs af den, var en ulv, der kom på tværs af den, og den anden, der kom på tværs af den, var en ulv, der kom på tværs af den, og den tredje, der kom på tværs af den, var en ulv, der kom på tværs af den. Den fjerde, der kom på tværs af den, var en ulv, der","da dannede Gud HERREN Mennesket af Agerjordens Muld og blæste Livsånde i hans Næsebor, så at Mennesket blev et levende Væsen.","Yahweh God formed man from the dust of the ground, and breathed into his nostrils the breath of life; and man became a living soul.",14,15,36
", som et rødt skarn, der drypper udover markens græs. Han så op til himlen og til stjernerne; alle hans øjne flakk","  54. 10/16, 1911.  55. 10/16, 1911.  56. 10/16, 1911.  57. 10/16, 1911.  58. 10/16, 1","da dannede Gud HERREN Mennesket af Agerjordens Muld og blæste Livsånde i hans Næsebor, så at Mennesket blev et levende Væsen.","Yahweh God formed man from the dust of the ground, and breathed into his nostrils the breath of life; and man became a living soul.",15,15,36
" og gav næring til hele træerne. Da solen kom ned, og fuglene sang, løftede den sit fløjlsrøde hår over ansigtet på","    12. 15,000 100,000 100,000 100,000 100,000 100,000 100,000 100,000 100,000 100,","da dannede Gud HERREN Mennesket af Agerjordens Muld og blæste Livsånde i hans Næsebor, så at Mennesket blev et levende Væsen.","Yahweh God formed man from the dust of the ground, and breathed into his nostrils the breath of life; and man became a living soul.",16,15,36
", og de to mænd gik ud gennem det ene åbning ind i et andet. I døren til haven stod en kvinde med et barn på armen.","    5. Danish: Fundet i 1916, er denne del af det historiske slot, som er blevet restaurering.  English: Fundet i 1916, er denne del af det historiske slot, som er blevet restaurering.    6. Danish: De vil gerne gøre en forskel i deres liv og har derfor brug for din hjælp.  English:","da dannede Gud HERREN Mennesket af Agerjordens Muld og blæste Livsånde i hans Næsebor, så at Mennesket blev et levende Væsen.","Yahweh God formed man from the dust of the ground, and breathed into his nostrils the breath of life; and man became a living soul.",17,15,36
". Jeg ved endnu ikke, om den var på den ene side eller anden, men da jeg kom tilbage, stod den helt stille af sted, og",                                                                                                                                                                  ,"da dannede Gud HERREN Mennesket af Agerjordens Muld og blæste Livsånde i hans Næsebor, så at Mennesket blev et levende Væsen.","Yahweh God formed man from the dust of the ground, and breathed into his nostrils the breath of life; and man became a living soul.",18,15,36
" op, medens det blæste, som om en storm var i ferd, og da denne storm blæste bort til det store landskab, hvor det hvide",.    <|endoftext|>,"da dannede Gud HERREN Mennesket af Agerjordens Muld og blæste Livsånde i hans Næsebor, så at Mennesket blev et levende Væsen.","Yahweh God formed man from the dust of the ground, and breathed into his nostrils the breath of life; and man became a living soul.",19,15,36
" med et helt væld af planterækker.
Han tog fat i en bønneknogle, der blev ved at skride op ad jorden og hen","  18 Når først af alle, s efter det første, s der af den grund, at det ikke er s s s s s s s s s s s s s s s s s s s s s s s s s s s s s s s s s s s s s s s s s s s s s s s s s s s s s s s s s s","da dannede Gud HERREN Mennesket af Agerjordens Muld og blæste Livsånde i hans Næsebor, så at Mennesket blev et levende Væsen.","Yahweh God formed man from the dust of the ground, and breathed into his nostrils the breath of life; and man became a living soul.",20,15,36
". Planterne sank ned og var ved at gå i udbrud. I mørket begyndte dyrene at jage ud i horisonten.
Det er denne",                                                                                                                                                                  ,"da dannede Gud HERREN Mennesket af Agerjordens Muld og blæste Livsånde i hans Næsebor, så at Mennesket blev et levende Væsen.","Yahweh God formed man from the dust of the ground, and breathed into his nostrils the breath of life; and man became a living soul.",21,15,36
":
Og en storm stod op og fyldte hele jorden;
en sky rejste sig over himmelen ,
en ildslukke kom til syne"," It was clear that a great fire had risen under the fire, and the fire spread for a long time; but, it was clear, it did not end. The fire was not burning for an indefines-I have not dend over for the first time, but it was burning for a long time, and the whole region was afl som ud, and the whole land was afl som","da dannede Gud HERREN Mennesket af Agerjordens Muld og blæste Livsånde i hans Næsebor, så at Mennesket blev et levende Væsen.","Yahweh God formed man from the dust of the ground, and breathed into his nostrils the breath of life; and man became a living soul.",22,15,36
", så den så ret så tør og grøn ud.
Det lykkedes alligevel, at få de sidste af insekterne på plads og få dem til at",".  19 Men da der var blevet en mist mellem jorden og himlen, blev der også en vandfyldt jord.<|endoftext|>","da dannede Gud HERREN Mennesket af Agerjordens Muld og blæste Livsånde i hans Næsebor, så at Mennesket blev et levende Væsen.","Yahweh God formed man from the dust of the ground, and breathed into his nostrils the breath of life; and man became a living soul.",23,15,36
"e. Med ens brast tårestrålen, og i nogle øjeblikke følte man sig lige saa ren og let som nybarberet.<|endoftext|>","  42 Then the king sent the people into the city, and they went out into the open country.  43 And the king went out into the open country, and found a great sea, and the sea was not deep, and there was no wind.  44 And he went up to the sea, and there was a great river, and the river was not deep, and there","da dannede Gud HERREN Mennesket af Agerjordens Muld og blæste Livsånde i hans Næsebor, så at Mennesket blev et levende Væsen.","Yahweh God formed man from the dust of the ground, and breathed into his nostrils the breath of life; and man became a living soul.",0,2,36
" og dækkede den med en lav blæsende og fugtig sand, hvis muld og mose-skallag grangivelig er ","  15:11 And the earth was full of water, and it was filled with a great many birds; and they were all coming out of the earth.  15:12 And the king was greatly afraid, and fled out of the place of the LORD, and went to the king of Babylon.  15:13 And the LORD said unto him,","da dannede Gud HERREN Mennesket af Agerjordens Muld og blæste Livsånde i hans Næsebor, så at Mennesket blev et levende Væsen.","Yahweh God formed man from the dust of the ground, and breathed into his nostrils the breath of life; and man became a living soul.",1,2,36
 med en glødende gnist som ild. Gud stod i en halv snes timer og betragtede de fremkommne og udstødte tegn, The water was very cold. The sun was shining. The mist was falling and the earth was drying. The sky was a dark blue. It was cold and wet. The sky was a dark blue. The earth was dry and wet.  The sky was a dark blue. The earth was dry and wet. The sky was a dark blue. The earth was dry and wet.  The sky,"da dannede Gud HERREN Mennesket af Agerjordens Muld og blæste Livsånde i hans Næsebor, så at Mennesket blev et levende Væsen.","Yahweh God formed man from the dust of the ground, and breathed into his nostrils the breath of life; and man became a living soul.",2,2,36
" og gjorde den våd og ru, og der blev gravet jordhuller under den hele jordens overflade, det tog den største del, 10",".  38 Men det ble ikke noen vekst på marken, og en sky vokste op fra jorden, og vannet hele jorden.<|endoftext|>","da dannede Gud HERREN Mennesket af Agerjordens Muld og blæste Livsånde i hans Næsebor, så at Mennesket blev et levende Væsen.","Yahweh God formed man from the dust of the ground, and breathed into his nostrils the breath of life; and man became a living soul.",3,2,36
", ligesom en stor brønd flød ud i et dige, og det var som om ilden havde revet sit tag bort, saa det brød"," The mist was as white as snow. The ground was covered with a cloud of white dust, and the mist was like a white sheet of fire.  ""Now, now, dear, the mist is gone, and the water is clear,"" said the little man, ""and the sky is filled with stars, and the stars are shining like the stars of the heavens. It is as if the","da dannede Gud HERREN Mennesket af Agerjordens Muld og blæste Livsånde i hans Næsebor, så at Mennesket blev et levende Væsen.","Yahweh God formed man from the dust of the ground, and breathed into his nostrils the breath of life; and man became a living soul.",4,2,36
". Den tællende stemme fortalte dem det. De gjorde som det lød, og til sidst vidste de, at den jord, de havde vundet,","  Dansk: Så faldt der en tåge, og det blev til en regn, som rørte jorden.    Engelsk: The first thing that comes to mind is the 1949 film.  Dansk: En film, der nok er den første, der kommer i tankerne.    Engelsk: But, he said, we will have to wait until the end of the year.  Dansk","da dannede Gud HERREN Mennesket af Agerjordens Muld og blæste Livsånde i hans Næsebor, så at Mennesket blev et levende Væsen.","Yahweh God formed man from the dust of the ground, and breathed into his nostrils the breath of life; and man became a living soul.",5,2,36
".
Disse dyr var store dyr, og da jeg så på dem, kom det mig aldrig for, at jeg havde set en menneskefod.","  The people of the city were all the more terrified of the evil spirit that was about to descend upon them. And the people of the city were all the more afraid of the evil spirit that was about to descend upon them, and they were all the more afraid of the evil spirit that was about to descend upon them, and they were all the more afraid of the evil spirit that was about to descend","da dannede Gud HERREN Mennesket af Agerjordens Muld og blæste Livsånde i hans Næsebor, så at Mennesket blev et levende Væsen.","Yahweh God formed man from the dust of the ground, and breathed into his nostrils the breath of life; and man became a living soul.",6,2,36
". En hel mængde af kvæg og svin drev hinanden forbi; de holdt ud og kæmpede, og selv ræve og ulve tog imod,"," Then the wind came down and the mist vanished.    This is the story of how the Prophet (salla Allahu alihi wa sallam) was found and revealed, and how he came to be called the Prophet of Allah, and how he came to be the Prophet of peace.                                    ","da dannede Gud HERREN Mennesket af Agerjordens Muld og blæste Livsånde i hans Næsebor, så at Mennesket blev et levende Væsen.","Yahweh God formed man from the dust of the ground, and breathed into his nostrils the breath of life; and man became a living soul.",7,2,36
 og rev alt af de tætte grene der stod på den. Et hul kom ud i jorden ved siden af. Det var et ganske almindeligt hul," The water was so high that the trees began to fall down; and the mist was so thick that it was not possible to see the ground; and the mist, as it rose, grew in such a manner that the whole earth was covered with it. The earth was so full of water that the trees grew up, and the mist fell away. And it was like this for all the time that the","da dannede Gud HERREN Mennesket af Agerjordens Muld og blæste Livsånde i hans Næsebor, så at Mennesket blev et levende Væsen.","Yahweh God formed man from the dust of the ground, and breathed into his nostrils the breath of life; and man became a living soul.",8,2,36
" og lagde sig en mørk skov af mørkebrun farve, der skinnede klart gennem det grønne græs. Pludselig kom drengen, der var gået for","  And then the water became clear and green, and the clouds began to gather in the sky. And the sun went down.  And then the earth rose and was still.  And the earth was still.  And then the earth was still.  And then the earth was still.  And then the earth was still.  And then the earth was still.  And then the earth was","da dannede Gud HERREN Mennesket af Agerjordens Muld og blæste Livsånde i hans Næsebor, så at Mennesket blev et levende Væsen.","Yahweh God formed man from the dust of the ground, and breathed into his nostrils the breath of life; and man became a living soul.",9,2,36
" med en vind; den vilde i en haard tid bringe plovhugst og udrydde alle kvæg; men den var den anden,",".  23:11 Og de så, og der blev en tåge over jorden og et vand løb ned fra jorden og dækkede hele jorden.<|endoftext|>","da dannede Gud HERREN Mennesket af Agerjordens Muld og blæste Livsånde i hans Næsebor, så at Mennesket blev et levende Væsen.","Yahweh God formed man from the dust of the ground, and breathed into his nostrils the breath of life; and man became a living soul.",10,2,36
".

2. engelsk: There are newer reviews for Hilton Dallas/Historic Center
dansk: Der er nyere anmeldelser for Hampton Inn Dallas-","  10And he said unto the disciples, Hear me, O Israel: I am come to you from the land of Egypt.  11For I have come into the land of Egypt, and I am a king there, and I have brought my son, and I have made him king over all Egypt.  12And I have given him authority over all Egypt, and he","da dannede Gud HERREN Mennesket af Agerjordens Muld og blæste Livsånde i hans Næsebor, så at Mennesket blev et levende Væsen.","Yahweh God formed man from the dust of the ground, and breathed into his nostrils the breath of life; and man became a living soul.",11,2,36
" med sit rige, sine mægtige jordbunden. Da gik hans ånd til jorden og han trådte tilbage, og der var ikke mere den store mængde"," When the mist had been lifted, the wind went up and blew it down, and the air became clean. Then the clouds were removed, and the sky was clear.  5.20.2015  The night before, the man had asked the woman if she had heard any noise, but she had not.  He asked again, and the woman said that the man had heard","da dannede Gud HERREN Mennesket af Agerjordens Muld og blæste Livsånde i hans Næsebor, så at Mennesket blev et levende Væsen.","Yahweh God formed man from the dust of the ground, and breathed into his nostrils the breath of life; and man became a living soul.",12,2,36
e så langt øjet kan se.<|endoftext|>,"  A great white light was shining from it, and it seemed to the man that the ground was moving. The wind was blowing in all directions. The earth was moving as though it were moving with him. The man felt his heart beating faster and faster.  ""What is it?"" he asked.  ""A fire,"" said the woman.  ""That's a fire,"" said the man","da dannede Gud HERREN Mennesket af Agerjordens Muld og blæste Livsånde i hans Næsebor, så at Mennesket blev et levende Væsen.","Yahweh God formed man from the dust of the ground, and breathed into his nostrils the breath of life; and man became a living soul.",13,2,36
", og alt derpå grumset, så det gik i stykker.
12. The new generation of LubiLux® ->",".  37:28 Og da de så det, kom der en Vådhed op fra Jorden, og Jorden blev gennemblødt med Vand.<|endoftext|>","da dannede Gud HERREN Mennesket af Agerjordens Muld og blæste Livsånde i hans Næsebor, så at Mennesket blev et levende Væsen.","Yahweh God formed man from the dust of the ground, and breathed into his nostrils the breath of life; and man became a living soul.",14,2,36
". Men da det ikke lykkedes en halv time, at indhente de fremmede for at komme sig, steg der op en voldsom storm af ild, som fl","  ""You see, a mist that rises from the ground is a wind that is moving in the air, and when it comes in from the air, it is the wind that is moving in the earth, and the mist is moving in the earth, and when it comes in from the earth, it is the wind that is moving in the sky, and the mist is moving in the sky.""  ","da dannede Gud HERREN Mennesket af Agerjordens Muld og blæste Livsånde i hans Næsebor, så at Mennesket blev et levende Væsen.","Yahweh God formed man from the dust of the ground, and breathed into his nostrils the breath of life; and man became a living soul.",15,2,36
". Derved blev jorden rød ved deres blotte kontakt og snart var jorden pladdret med og deres rødder bar præg, som om de var"," The air was filled with a terrible noise, and the whole earth seemed to vibrate with the sound. Then a cloud of dust came from the ground, and the earth shook. Then a great flame burst from the earth, and the air was filled with a horrible smell.  Then the fire began to burn, and the earth shook again. The earth shook again, and the fire burned for a long","da dannede Gud HERREN Mennesket af Agerjordens Muld og blæste Livsånde i hans Næsebor, så at Mennesket blev et levende Væsen.","Yahweh God formed man from the dust of the ground, and breathed into his nostrils the breath of life; and man became a living soul.",16,2,36
". De, som stod tilbage fra fladen, maatte gaa omkring uden at kunne se ret, som om de gik ud paa jorden og ikke kunde se"," And the earth was full of water, and the water was in the earth, and it was very strong, and it filled the earth, and the earth was full of water, and the water was in the earth, and it was very strong.  6:28 Og det skete, at en Stank steg op fra Jorden, og der kom Vand paa Jorden, og Vandet var i Jorden","da dannede Gud HERREN Mennesket af Agerjordens Muld og blæste Livsånde i hans Næsebor, så at Mennesket blev et levende Væsen.","Yahweh God formed man from the dust of the ground, and breathed into his nostrils the breath of life; and man became a living soul.",17,2,36
. Dette sidste tegn paa en stor søilebro havde ikke kunnet afvises; thi han havde det saa klart for sig til alt muligt: At se,".  Det var ikke noget, man ville se i et hus, men en tåge steg op fra jorden, og vandet tørrede hele jordens overflade.<|endoftext|>","da dannede Gud HERREN Mennesket af Agerjordens Muld og blæste Livsånde i hans Næsebor, så at Mennesket blev et levende Væsen.","Yahweh God formed man from the dust of the ground, and breathed into his nostrils the breath of life; and man became a living soul.",18,2,36
" med solskinsstråler. -
Hendes hjerte var brændt som en varm flamme - hendes hænder var våde af blod. -","  When it became clear that it was not sufficient to keep the ground from being wet, it became necessary to raise it, which was necessary to raise it by means of the water which was now being brought to it. The water which had been brought to it was brought to the surface by the earth's gravity.  The earth was now so heavy that it was impossible to lift it. The ground","da dannede Gud HERREN Mennesket af Agerjordens Muld og blæste Livsånde i hans Næsebor, så at Mennesket blev et levende Væsen.","Yahweh God formed man from the dust of the ground, and breathed into his nostrils the breath of life; and man became a living soul.",19,2,36
", men det holdt ikke en tid, idet jorddannet var over 10 meter højt og 15 fod langt. De oversvømmede"," The people were afraid, and said to each other, ""We will not die, nor will we live, but we will be lifted up."" And the people said, ""We will not live, but we will be lifted up.""  Then the men of the tribe went to the river and came to the edge of the river. The river was high and wide, and the water was very deep.","da dannede Gud HERREN Mennesket af Agerjordens Muld og blæste Livsånde i hans Næsebor, så at Mennesket blev et levende Væsen.","Yahweh God formed man from the dust of the ground, and breathed into his nostrils the breath of life; and man became a living soul.",20,2,36
". Til de vilde blomster som løsnede sig på græsmyrerne, kom små sorte fugle. Den fløj hen imod dem og nærmede sig","  dansk: Der var en stærk lugt af røg, og vandet drev ned fra jorden.  engelsk: The new hotel is designed to be a perfect match to the city's skyline.  dansk: Det nye hotel er designet til at være et perfekt match til byens skyline.  engelsk: You can't chat with SashaKenis while in this mode.  dansk:","da dannede Gud HERREN Mennesket af Agerjordens Muld og blæste Livsånde i hans Næsebor, så at Mennesket blev et levende Væsen.","Yahweh God formed man from the dust of the ground, and breathed into his nostrils the breath of life; and man became a living soul.",21,2,36
".
Den store stenvæg, hvor kongens have nu var, var rejst ud af havets dyb, og det var ingen tilfældighed. Hav"," And the earth began to move, and the mist came down, and watered the whole surface of the ground. And the earth began to move, and the mist came down, and watered the whole surface of the ground.  And the earth began to move, and the mist came down, and watered the whole surface of the ground. And the earth began to move, and the mist came","da dannede Gud HERREN Mennesket af Agerjordens Muld og blæste Livsånde i hans Næsebor, så at Mennesket blev et levende Væsen.","Yahweh God formed man from the dust of the ground, and breathed into his nostrils the breath of life; and man became a living soul.",22,2,36
". Saa kom endnu et regnveir, det regnede saa det dryppede fra himlen og blæste af. Der var en tung røg fra",    3. Norsk: Søk etter hoteller i Aigues-Mortes  Engelsk: Search 10 hotels in Aigues-Mortes    4. Norsk: De 10 beste meksikanske restaurantene i Port of Spain  Engelsk: The Best Port of Spain International Restaurants - TripAdvisor    5. Norsk: 5.2.1.1.1,"da dannede Gud HERREN Mennesket af Agerjordens Muld og blæste Livsånde i hans Næsebor, så at Mennesket blev et levende Væsen.","Yahweh God formed man from the dust of the ground, and breathed into his nostrils the breath of life; and man became a living soul.",23,2,36
