danish_predicted_output,english_predicted_output,danish_true_label,english_true_label,layer,lambda_amount,bible_verse
" og det blev mørk over alt, og der kom svalt og lunkentblod, som han dræbte, og alt kvæget med."," the earth was covered with water. it was a clear day. god made a flood to wash away the water. the flood washed away the earth. the water rose again, and the earth was covered with water again. god made a storm to blow over the earth. the water rose again, and the earth","Verdensdybets Kilder og Himmelens Sluser lukkedes, Regnen fra Himmelen standsede,","The deep's fountains and the sky's windows were also stopped, and the rain from the sky was restrained.",0,2,184
 og efter en kort stund blev alt folket ført i sikkerhed ved at de kastedes ned på jorden og blev bundet til træstammer. Da de kom,                                                                                                                            ,"Verdensdybets Kilder og Himmelens Sluser lukkedes, Regnen fra Himmelen standsede,","The deep's fountains and the sky's windows were also stopped, and the rain from the sky was restrained.",1,2,184
" men da de hørte, at der var blevet taget et menneske af dage, tænkte de ikke på at spørge sig selv: Hvad har mennesket gjort ved jorden","  20. And the earth began to rise, and the sea was like a river, and the sea was like a sea, and the sea was like a river; and all the animals of the earth began to live, and all the livestock that were with him in the ship; and god made","Verdensdybets Kilder og Himmelens Sluser lukkedes, Regnen fra Himmelen standsede,","The deep's fountains and the sky's windows were also stopped, and the rain from the sky was restrained.",2,2,184
" men Gud var dog våken. Vinden kom med et kraftig slag, og alle dyrene blev rasende; for der kom nogen ind i arken", the earth was filled with water. the earth rose again. the water was all over the earth. it was all over the earth. the earth rose again. the waters subsided. the earth was filled with water. the earth rose again. it was all over the earth. it was all over the earth,"Verdensdybets Kilder og Himmelens Sluser lukkedes, Regnen fra Himmelen standsede,","The deep's fountains and the sky's windows were also stopped, and the rain from the sky was restrained.",3,2,184
" han var meget vred og skreg og brummede og råbte; alt kvæget blev rædselsslagen, så det blev aldeles borte", God brought the flood to pass over the land. the land was flooded. God created man and the earth. The earth was flooded and the earth was filled with water. God created the land. God made man and the earth. The land was flooded and the earth was filled with water. God,"Verdensdybets Kilder og Himmelens Sluser lukkedes, Regnen fra Himmelen standsede,","The deep's fountains and the sky's windows were also stopped, and the rain from the sky was restrained.",4,2,184
" 19 90; og da Gud havde drevet vandet ud af jorden, for han sin sjæl tilbage til arken; han gik forgj"," and the sea rose up, and the land was filled with water. and the sea came up and the earth was full of water. and the land was filled with water. and the sea came up and the earth was full of water. and the land was filled with water. and the sea came up and","Verdensdybets Kilder og Himmelens Sluser lukkedes, Regnen fra Himmelen standsede,","The deep's fountains and the sky's windows were also stopped, and the rain from the sky was restrained.",5,2,184
" så blev der gjort is av jordkloden; men gud var ikke vred, han gav sig og sendte et andet offer. Og gud lod et regn","    15. Norsk: Vi tilbyr gratis frokost og frokostbuffé.  Engelsk: We offer free breakfast and a buffet breakfast.    16. Norsk: Søk etter hoteller i L'Estrange  Engelsk: Hotels in L'Estrange, France    17. Norsk","Verdensdybets Kilder og Himmelens Sluser lukkedes, Regnen fra Himmelen standsede,","The deep's fountains and the sky's windows were also stopped, and the rain from the sky was restrained.",6,2,184
" men alt kvæget blev stående. Gud hørte da stemmer fra arken, hvori der blev skreget fra alle sider: ""Arken bliver bru", and the earth rose up from the sea.      A. 33:18.       A. 33:19.      A. 33:20.      A. 33:21.      A,"Verdensdybets Kilder og Himmelens Sluser lukkedes, Regnen fra Himmelen standsede,","The deep's fountains and the sky's windows were also stopped, and the rain from the sky was restrained.",7,2,184
" da steg der en høvding i stedet for Noa og hans brødre og sa: »Nu er vi her selv, hvor jeg har fundet ar",    8.    9.    10.    11.    12.    13.    14.    15.    16.    17.    18.    19.    20,"Verdensdybets Kilder og Himmelens Sluser lukkedes, Regnen fra Himmelen standsede,","The deep's fountains and the sky's windows were also stopped, and the rain from the sky was restrained.",8,2,184
" og så lod gud det udkomme; og så lod gud det udkomme. Og alle dyrene, både kvæget og dyrene, under himmelhv", the earth was filled with water. and the water rose up and fell down like a flood.  3.3.31 And the water was as strong as iron; and the earth was as thick as iron; and the earth was as heavy as iron. and the earth was as heavy as iron.,"Verdensdybets Kilder og Himmelens Sluser lukkedes, Regnen fra Himmelen standsede,","The deep's fountains and the sky's windows were also stopped, and the rain from the sky was restrained.",9,2,184
" men ingen blev kvæstet eller drept. For den dag kom som var før storm og stork, den største nat for et folk, som",    But the flood of the ark passed on. The waters rose again and the ark was washed away.    The ark was filled with water.    But the waters rose again and the ark was washed away.    And the ark was filled with water.    And the waters rose again,"Verdensdybets Kilder og Himmelens Sluser lukkedes, Regnen fra Himmelen standsede,","The deep's fountains and the sky's windows were also stopped, and the rain from the sky was restrained.",10,2,184
" men han gjorde, som Gud havde befalet dem. 28. Herren sendte et stort hærskar for ham over hele jorden, og med et",  And all the animals that were with him in the ship were killed; and all the livestock that were with him in the ship were killed; and the waters subsided.  And all the animals that were with him in the ship were killed; and all the livestock that were with him in the,"Verdensdybets Kilder og Himmelens Sluser lukkedes, Regnen fra Himmelen standsede,","The deep's fountains and the sky's windows were also stopped, and the rain from the sky was restrained.",11,2,184
" men da han nu kom ned fra arken, så han alt, hvad han skulle gjøre. Da han så arken på marken, så han en","    (4) God created the heavens and the earth, and the sky and the earth, and the sea, and the air, and the land, and the sea. And God made the earth, the sky, and the sea, and the air, and the land, and the sea,","Verdensdybets Kilder og Himmelens Sluser lukkedes, Regnen fra Himmelen standsede,","The deep's fountains and the sky's windows were also stopped, and the rain from the sky was restrained.",12,2,184
" og der lå en stor kvægkvæg-okse og et stort kvægsoksekald på marken, og en stor kvægok", and the sea was clear. and the sea was clear. and the sea was clear. and the sea was clear. and the sea was clear. and the sea was clear.  The Ocean was clear. and the sea was clear. and the sea was clear. and the sea was clear. and the,"Verdensdybets Kilder og Himmelens Sluser lukkedes, Regnen fra Himmelen standsede,","The deep's fountains and the sky's windows were also stopped, and the rain from the sky was restrained.",13,2,184
" og alle dyrene kom ned fra arken i en mægtig storm. Hosea, 2, 3. 4. I har","  10 And Noah was in the ship, and his ark was upon the sea, and he had not seen the earth; and God came to him and said, ""Son of man, behold, the earth is like a boat in water, and the sea like a rock; and I am God","Verdensdybets Kilder og Himmelens Sluser lukkedes, Regnen fra Himmelen standsede,","The deep's fountains and the sky's windows were also stopped, and the rain from the sky was restrained.",14,2,184
" det var jo Herrens dag, og det blev ikke som i de ældgamle dage. I disse tider blev det jo ikke regnet som noget uskik"," the people fled from the ship. God said to the people, ""Behold, the waters are abounding; but the people have not made the sacrifices to the LORD."" the people said to God, ""The LORD is my God."" 13 And God said to the people, ""","Verdensdybets Kilder og Himmelens Sluser lukkedes, Regnen fra Himmelen standsede,","The deep's fountains and the sky's windows were also stopped, and the rain from the sky was restrained.",15,2,184
" og så kom de ud af arken: og alle var komne ud og sad ved bordet. Herren førte ordet med de ætterne, "," and the waters rose again, and the earth rose again.  And when the waters were gone, the earth rose again, and the waters subsided. And when the waters were gone, the earth rose again, and the waters subsided. And when the waters were gone, the earth rose again, and","Verdensdybets Kilder og Himmelens Sluser lukkedes, Regnen fra Himmelen standsede,","The deep's fountains and the sky's windows were also stopped, and the rain from the sky was restrained.",16,2,184
" og de vilde, som havde en høire hånd og en høire fod paa stenen og paa marken, kom en efter en; og en af dem","  The flood was enormous, but God gave it water.  ""But the flood was terrible.  ""All the people who lived in the land of Egypt were afraid of the flood.  ""And they said to the LORD, 'Take water from the water-gates and pour it into the","Verdensdybets Kilder og Himmelens Sluser lukkedes, Regnen fra Himmelen standsede,","The deep's fountains and the sky's windows were also stopped, and the rain from the sky was restrained.",17,2,184
" så han kunde få hjælp.""
Aristoteles. ""Gud"", siger han, ""var med mig, da der var storm; og Gud",                                                                                                                            ,"Verdensdybets Kilder og Himmelens Sluser lukkedes, Regnen fra Himmelen standsede,","The deep's fountains and the sky's windows were also stopped, and the rain from the sky was restrained.",18,2,184
" og så fik de alle deres brød og deres kalve, som var hos dem i arken; men det var ikke deres eget; men deres moders"," and the earth rose to a high, and the land was full of the water of the sea. the sea was a cloud, and the earth was a land, and the earth was a sky. and god gave the land to the inhabitants of the earth, and the inhabitants of the sky gave the land to","Verdensdybets Kilder og Himmelens Sluser lukkedes, Regnen fra Himmelen standsede,","The deep's fountains and the sky's windows were also stopped, and the rain from the sky was restrained.",19,2,184
" tilsidst gik den bort over hele jorden, og alt jorden vilde være øde. I det samme raabte gud og sa: Jeg vil bygge", and the earth began to rise again.                                                                                                            ,"Verdensdybets Kilder og Himmelens Sluser lukkedes, Regnen fra Himmelen standsede,","The deep's fountains and the sky's windows were also stopped, and the rain from the sky was restrained.",20,2,184
" da sagde Moses til Gud: Jeg er Herren din Gud, den alvidende konge! og gud raabte til ham: Se, der kommer",                                                                                                                            ,"Verdensdybets Kilder og Himmelens Sluser lukkedes, Regnen fra Himmelen standsede,","The deep's fountains and the sky's windows were also stopped, and the rain from the sky was restrained.",21,2,184
" og gud blev meget bekymret over stormen! Da førte han alle dyrene og kvæget ud af arken, og det var næsten som en solskin",.<|endoftext|>,"Verdensdybets Kilder og Himmelens Sluser lukkedes, Regnen fra Himmelen standsede,","The deep's fountains and the sky's windows were also stopped, and the rain from the sky was restrained.",22,2,184
" Gud stod nu på jorden og sa: Da jeg fik se, at du var død, rakte jeg dig en stor slange til synd og til",                                                                                                                            ,"Verdensdybets Kilder og Himmelens Sluser lukkedes, Regnen fra Himmelen standsede,","The deep's fountains and the sky's windows were also stopped, and the rain from the sky was restrained.",23,2,184
" også alle dyrene fortabte livet på grund deraf. Men for hver dag der gik, kom de ikke for dagen, men kom sammen stadig, der"," the earth was filled with water, and the sea was filled with water.    5.                                                                                      ","Verdensdybets Kilder og Himmelens Sluser lukkedes, Regnen fra Himmelen standsede,","The deep's fountains and the sky's windows were also stopped, and the rain from the sky was restrained.",0,5,184
 og så blev arken stående tom og ufrugtbar. Den næste morgen vendte Nebufalos sin bue og drog ud for at, God made the earth a place where the waters were not to be taken away. And the earth became a place where the waters were not to be taken away.  The story continues.  So Noah was a great man. But the earth was not a place where the waters were taken away.  Now the,"Verdensdybets Kilder og Himmelens Sluser lukkedes, Regnen fra Himmelen standsede,","The deep's fountains and the sky's windows were also stopped, and the rain from the sky was restrained.",1,5,184
" men han sagde da til sine tjenere og venner: »I have ikke gjort nogen skade, og eder vilde jeg ikke have dræbt.« Foruden dem"," all the animals and the cattle that were with him in the ship died, and god gave them to be eaten. all the cattle that were with him in the ship were eaten. god made a wind to pass over the earth. the waters subsided. all the animals that were with him in the ship died","Verdensdybets Kilder og Himmelens Sluser lukkedes, Regnen fra Himmelen standsede,","The deep's fountains and the sky's windows were also stopped, and the rain from the sky was restrained.",2,5,184
" og der tog Herren, som var hos ham, fra himlen et stort ark, men der var kun en lille fugl på den, ja så liden,","  And now, O Lord, let me go and see the land, and the sea, and the mountains, and the hills, and the trees, and the birds, and the beasts, and the sea, and the mountains, and the hills, and the trees, and the birds, and the","Verdensdybets Kilder og Himmelens Sluser lukkedes, Regnen fra Himmelen standsede,","The deep's fountains and the sky's windows were also stopped, and the rain from the sky was restrained.",3,5,184
" men jorden var fuld af vandet, og det steg op til himmelen. 9 Da sagde Noa til israeliterne: Gud er min Gud,","  ""And the earth was filled with the blood of the dead, and the waters were filled with the blood of the dead.""  ""And the waters were filled with the blood of the dead.  ""And the earth was filled with the blood of the dead.  ""And the earth was filled with","Verdensdybets Kilder og Himmelens Sluser lukkedes, Regnen fra Himmelen standsede,","The deep's fountains and the sky's windows were also stopped, and the rain from the sky was restrained.",4,5,184
" og Guds ånde svævede over jorden i en mængde, som er langt større end vand i en vase. Og han viste alle folkene og"," The air was full of the sweetest smell of the sea. God saw Noah on the other side of the sea.  And God said, ""Behold, Noah's ark is upon the other side of the sea. Behold, I have brought it out of the ark. Behold, it","Verdensdybets Kilder og Himmelens Sluser lukkedes, Regnen fra Himmelen standsede,","The deep's fountains and the sky's windows were also stopped, and the rain from the sky was restrained.",5,5,184
" og han tog vandet og gav det en god gang til, og det gik igjennem arken, og dyrene, som var hos ham i arken",.<|endoftext|>,"Verdensdybets Kilder og Himmelens Sluser lukkedes, Regnen fra Himmelen standsede,","The deep's fountains and the sky's windows were also stopped, and the rain from the sky was restrained.",6,5,184
" og gud sendte en engel, som kom til ham, og sagde til ham: Herre, lad ikke vandet falde, og luk det ikke! thi",. the earth was empty.    <|endoftext|>,"Verdensdybets Kilder og Himmelens Sluser lukkedes, Regnen fra Himmelen standsede,","The deep's fountains and the sky's windows were also stopped, and the rain from the sky was restrained.",7,5,184
" gud vred sig så over ham, så han kom aldeles og aldeles ud af syne; alle hans tjenere kunde ikke see ham, for den,","  But the earth was covered with a cloud, and the clouds were like a cloud of fire, and the fire was like a fire of fire; and the fire was like a fire of fire, and the fire was like a fire of fire. And the fire was like a fire of fire. And the","Verdensdybets Kilder og Himmelens Sluser lukkedes, Regnen fra Himmelen standsede,","The deep's fountains and the sky's windows were also stopped, and the rain from the sky was restrained.",8,5,184
" for der, hvor vandet var lavt, gjorde dyrene og kvæget, som var hos ham, store stene. Og alle disse sten, som","  the wind blew down, and the earth was covered with a cloud of smoke, and the clouds were full of fire, and the earth was filled with a fire of fire.  the sun rose and set, and the sky was filled with a cloud of smoke. the sun rose and set, and the","Verdensdybets Kilder og Himmelens Sluser lukkedes, Regnen fra Himmelen standsede,","The deep's fountains and the sky's windows were also stopped, and the rain from the sky was restrained.",9,5,184
" og så kom Herrens engel, som var større enn alle mennesker og gik midt iblandt ham, og sagde: «Se, nu ved du, at","  The story of Noah's ark was told by the prophet Elijah, who had a son named Elijah, who was a prophet in Israel. Elijah was the son of the prophet Elijah, and Elijah was a prophet in Israel. Elijah was born in 1","Verdensdybets Kilder og Himmelens Sluser lukkedes, Regnen fra Himmelen standsede,","The deep's fountains and the sky's windows were also stopped, and the rain from the sky was restrained.",10,5,184
" og der var også syv andre dyr i arken.
Da gik Gud ved det første dyr, der sad oppe på arken; det var en"," and the wind blew the sea away. and the sea was a dry land. and the land was dry, and the sea was a dry land, and the land was a dry land.                                                ","Verdensdybets Kilder og Himmelens Sluser lukkedes, Regnen fra Himmelen standsede,","The deep's fountains and the sky's windows were also stopped, and the rain from the sky was restrained.",11,5,184
" og Gud kaldte en stor bolle hen til arken, som var fyldt med olie, og der blev samlet sammen alt vandet.
""1 Da"," god looked at it, and said, ""Well, what does it mean? it is very strange.""  16  THE WIND IS SOMEWHERE IN THE EARTH, IN THE WIND, IN THE EARTH. THE WIND IS BACK IN THE WIND,","Verdensdybets Kilder og Himmelens Sluser lukkedes, Regnen fra Himmelen standsede,","The deep's fountains and the sky's windows were also stopped, and the rain from the sky was restrained.",12,5,184
" så gjorde han, som han vilde. Da kom der et lidet folk, som hed Jispes, og gik ud og lod hugge i",". the earth became a muddy land.  da:  10:28 og så blev han ved med at fortælle om Noa, alle dyrene og alle dyrene i det skib, der var med ham, og Gud skabte en vind til at passere over jorden.<|endoftext|>","Verdensdybets Kilder og Himmelens Sluser lukkedes, Regnen fra Himmelen standsede,","The deep's fountains and the sky's windows were also stopped, and the rain from the sky was restrained.",13,5,184
" og han gav alle menneskene noget at drikke, og den anden var alene; og de andre gav ham nogle få ting at drikke. Men Gud sagde til","  11.42.14. Og den anden, der er født af en jomfru, bliver ikke til noget. ->  11:42.14. And the second born of a virgin will not be any thing.  12. Og at det er en del af","Verdensdybets Kilder og Himmelens Sluser lukkedes, Regnen fra Himmelen standsede,","The deep's fountains and the sky's windows were also stopped, and the rain from the sky was restrained.",14,5,184
" så tog gud sig i var med jorden, så vandet sank i jorden, så han gav den en ny kilde, som han kaldte Tora, og","  The Ark of the Covenant.  The Ark of the Covenant is a 30-siders long, 20-siders wide, 10-siders dyb, 5-siders høj, 3-siders dyb, 2-siders","Verdensdybets Kilder og Himmelens Sluser lukkedes, Regnen fra Himmelen standsede,","The deep's fountains and the sky's windows were also stopped, and the rain from the sky was restrained.",15,5,184
" og da solen lyste, stod Nathaniels klampe og var i arken. Og da Nathaniels klamp var på himmelhv",                                                                                                                            ,"Verdensdybets Kilder og Himmelens Sluser lukkedes, Regnen fra Himmelen standsede,","The deep's fountains and the sky's windows were also stopped, and the rain from the sky was restrained.",16,5,184
" og det sted, der hedder arken, brændte, og det var, hvor der boede alle de svømmerske kvinder.

Engelsk:",".  Og alle dyrene og alle husdyrene, som var hos ham, i skibet, var blevet tilovers; og Gud lod en vind blæse henover jorden.<|endoftext|>","Verdensdybets Kilder og Himmelens Sluser lukkedes, Regnen fra Himmelen standsede,","The deep's fountains and the sky's windows were also stopped, and the rain from the sky was restrained.",17,5,184
; men ingen kom ned.<|endoftext|>,"      The story of Noah's ark is told in the Old Testament.      Adel, ibid., p. 20.      Adel, ibid., p. 21.      Adel, ibid., p. 23.","Verdensdybets Kilder og Himmelens Sluser lukkedes, Regnen fra Himmelen standsede,","The deep's fountains and the sky's windows were also stopped, and the rain from the sky was restrained.",18,5,184
" og over alle store og små farer og uvæsener, som blev forfærdede, rakte gud sin store styrke! Og gud var stor",                                                                                                                            ,"Verdensdybets Kilder og Himmelens Sluser lukkedes, Regnen fra Himmelen standsede,","The deep's fountains and the sky's windows were also stopped, and the rain from the sky was restrained.",19,5,184
" og ilden opbrændte alle det frugtbare land, som gud havde taget i arken. 1 Mos. 26,2—"," The sea rose up. The waters subsided again. The sea rose up again.  And the people went to the sea, and they stood on the beach; and the sea became a sort of sea; and the people stood on the beach. And the sea became a sort of sea; and the people","Verdensdybets Kilder og Himmelens Sluser lukkedes, Regnen fra Himmelen standsede,","The deep's fountains and the sky's windows were also stopped, and the rain from the sky was restrained.",20,5,184
" men folket blev ved, at de ikke kom til arken og blev der til den første dag, da det blev dag, da arken stod op",                                                                                                                            ,"Verdensdybets Kilder og Himmelens Sluser lukkedes, Regnen fra Himmelen standsede,","The deep's fountains and the sky's windows were also stopped, and the rain from the sky was restrained.",21,5,184
" og han talte til Noah og Aron, og sa: «Skynd eder at tage de ark og alle løse vogne, som man har bragt bort","  And the earth was turned to sand, and the sea to sand; and the animals were thrown out of the ship, and the cattle were thrown out of the field.  But God said to Noah, ""Look, here is the land of the Nephites, and the land of the Israelites","Verdensdybets Kilder og Himmelens Sluser lukkedes, Regnen fra Himmelen standsede,","The deep's fountains and the sky's windows were also stopped, and the rain from the sky was restrained.",22,5,184
" og alt folk var rædselsslagen for himlene; men Gud saa og hørte og saa alle disse syner, og han sa: 2Da","  dansk: 18 Og Gud skabte en stor storm, så vandet faldt.  engelsk: 18 And God created a great storm, so that the water was empty.  dansk: De to første er ikke i stand til at blive gravid.  engelsk: The first two cannot get pregnant.","Verdensdybets Kilder og Himmelens Sluser lukkedes, Regnen fra Himmelen standsede,","The deep's fountains and the sky's windows were also stopped, and the rain from the sky was restrained.",23,5,184
" så kom gud ham i hu, og han drog op over land.
da 5 Da drog Gud frem og rakte hænderne ud mod ham for"," the wind ceased. and the ship came into the sea.  18 Then was the sea full of the water. the waters subsided. the wind ceased. the ship came into the sea.  19 God said unto the nations, Thou shalt not take thee in thy hand, and","Verdensdybets Kilder og Himmelens Sluser lukkedes, Regnen fra Himmelen standsede,","The deep's fountains and the sky's windows were also stopped, and the rain from the sky was restrained.",0,10,184
" og da de i jorden var døde og bleve tørre, da så gud til, at der blev en ildgysning i jorden. Og der blev",. and the sea rose and the earth began to grow.<|endoftext|>,"Verdensdybets Kilder og Himmelens Sluser lukkedes, Regnen fra Himmelen standsede,","The deep's fountains and the sky's windows were also stopped, and the rain from the sky was restrained.",1,10,184
" men da de hørte det, skyndte de sig ned ad flodbredden og huggede slanger i snaden, med hvilken de lod jorden styr"," and the sky became blue and clear, and the land became green and blue. the waters subsided. and the sky became blue and clear, and the land became green and blue. all the animals that were with him in the ship, and all the livestock that were with him in the ship, and","Verdensdybets Kilder og Himmelens Sluser lukkedes, Regnen fra Himmelen standsede,","The deep's fountains and the sky's windows were also stopped, and the rain from the sky was restrained.",2,10,184
