danish_predicted_output,english_predicted_output,danish_true_label,english_true_label,layer,lambda_amount,bible_verse
" De havde givet mig en bunke poser med mad, chokolade, slik og vin, jeg skulle dele ud til deres venner, der var på besøg."," But I didn't know what it was like to be awake at night. I was dreaming.    ""I was so frightened, I thought, I'm going to die.""    ""I thought I was going to die. I thought I was going to die. I thought I was going to die.""    I dreamed I was sleeping. I was in the bed. I was in bed. I was","Derpå sagde Gud: ""Der komme Lys på Himmelhvælvingen til at skille Dag fra Nat, og de skal være til Tegn og til Fastsættelse af Højtider, Dage og År","God said, ""Let there be lights in the expanse of sky to divide the day from the night; and let them be for signs, and for seasons, and for days and years;",9,5,12
"
Lidt over en time før starten skete der så.
Jeg ved ikke hvorfor, men den fornemmelse af at begynde, at blive lidt spændt og","    10. svenska: Jag vill inte vara en mamma som alltid är upptagen.  engelska: I don't want to be a mother that is always busy.    11. svenska: Det är ett mycket viktigt steg att ta, för att få bort den här rädslan.  engelska: This is a very important step to take in order to eliminate this fear.    12. svenska: De är helt enkelt","Derpå sagde Gud: ""Der komme Lys på Himmelhvælvingen til at skille Dag fra Nat, og de skal være til Tegn og til Fastsættelse af Højtider, Dage og År","God said, ""Let there be lights in the expanse of sky to divide the day from the night; and let them be for signs, and for seasons, and for days and years;",10,5,12
" ->
The sky was blue and the air was cold.
Gør dig selv en masse god brug af disse og andre egenskaber, som du kan","  ""No,"" said the young man, ""no more. It's not right.""  ""How so?"" said the old man.  ""You're right,"" said the young man.  ""So,"" said the old man, ""I don't want to be right.""  ""You're right,"" said the young man. ""And you're wrong. It's not right.""  ""So","Derpå sagde Gud: ""Der komme Lys på Himmelhvælvingen til at skille Dag fra Nat, og de skal være til Tegn og til Fastsættelse af Højtider, Dage og År","God said, ""Let there be lights in the expanse of sky to divide the day from the night; and let them be for signs, and for seasons, and for days and years;",11,5,12
" Da det var morgen næste dag, ville han ikke stå op men lå stille i sengen, og da det var morgen dagen efter, gik han op af","  The second day the road was empty. There was no one. The moon was still shining, and the sky was clear.  ""You're lucky,"" said the girl, when she came up to him. ""The whole of it is going to be so easy.""  ""And it will,"" said he.  The girl was sitting on the ground, looking at him.  ""You're lucky,"" said she.","Derpå sagde Gud: ""Der komme Lys på Himmelhvælvingen til at skille Dag fra Nat, og de skal være til Tegn og til Fastsættelse af Højtider, Dage og År","God said, ""Let there be lights in the expanse of sky to divide the day from the night; and let them be for signs, and for seasons, and for days and years;",12,5,12
" Det er en uge siden at jeg sidst har set mig selv i spejlet, og jeg er fuldstændig misundelig. Jeg havde lige taget afsked med"," The evening was clear and there was nothing but the stars. The morning was clear, but there was a light that was not there. The light was a white light, and it was not there, but it was there, and it was there, and it was there, and it was there, and it was there, and it was there, and it was there, and it was there, and it was there, and it was","Derpå sagde Gud: ""Der komme Lys på Himmelhvælvingen til at skille Dag fra Nat, og de skal være til Tegn og til Fastsættelse af Højtider, Dage og År","God said, ""Let there be lights in the expanse of sky to divide the day from the night; and let them be for signs, and for seasons, and for days and years;",13,5,12
"
Jeg fik besøg den 5. april. Jeg fik lagt rutsjebane til ham, og da jeg kom hjem, var han der igen"," He was the first to go to bed.  He was not in a mood for sleep, however. He had never slept well, and he was not used to it. He was in a dream, and he was tired.  He had never dreamt om natten, før han var blevet født, og han var heller ikke vant til det. Han havde ikke drømt om natten før han var blevet født, og han var heller ikke","Derpå sagde Gud: ""Der komme Lys på Himmelhvælvingen til at skille Dag fra Nat, og de skal være til Tegn og til Fastsættelse af Højtider, Dage og År","God said, ""Let there be lights in the expanse of sky to divide the day from the night; and let them be for signs, and for seasons, and for days and years;",14,5,12
" Vi havde lyst til ikke at ligge længere, for vi kendte, at her skulle vi op og sove. Men så så vi lidt, da andre gik","  'Fuck, fuck,' sagde han.  Han var i en situation, hvor han ikke kunne se sig selv, og han var i et andet. ->  He was in a situation, where he couldn't see himself, and he was in another.  Teknisk set var det en af de første to i den såkaldte ""Sørger for en anden."" ->  Technically, it was one of the","Derpå sagde Gud: ""Der komme Lys på Himmelhvælvingen til at skille Dag fra Nat, og de skal være til Tegn og til Fastsættelse af Højtider, Dage og År","God said, ""Let there be lights in the expanse of sky to divide the day from the night; and let them be for signs, and for seasons, and for days and years;",15,5,12
" Natten var lang, mørk og hård. Det gav mig ikke mulighed for at falde til ro, jeg var nødt til at lukke øjnene igen. Det","    Det er ikke bare i England, at der er brug for, at vi har den type teknologi. -> It is not just in England that we need the type of technology.    Der er flere aspekter af denne proces, som jeg gerne vil gå nærmere ind på. -> There are several aspects of this process, which I would like to give a more detailed treatment.    Jeg vil gerne opfordre Parlamentet til at undersøge dette","Derpå sagde Gud: ""Der komme Lys på Himmelhvælvingen til at skille Dag fra Nat, og de skal være til Tegn og til Fastsættelse af Højtider, Dage og År","God said, ""Let there be lights in the expanse of sky to divide the day from the night; and let them be for signs, and for seasons, and for days and years;",16,5,12
"
""Det er en meget stor verden. Nogle gange kan man godt føle, at den har en lille del af en selv, og at verden er"," It was a little after midnight, and I was alone in the room. I sat down, and I looked at my watch. I knew that I should have to go to bed. I looked at my watch, and I saw that it was 6:00 A.M. Jeg gik ud af værelset, og jeg gik ned til mit værelse. Jeg gik ned til mit værelse, og jeg gik ned til mit værelse. Jeg","Derpå sagde Gud: ""Der komme Lys på Himmelhvælvingen til at skille Dag fra Nat, og de skal være til Tegn og til Fastsættelse af Højtider, Dage og År","God said, ""Let there be lights in the expanse of sky to divide the day from the night; and let them be for signs, and for seasons, and for days and years;",17,5,12
" Jeg kunne høre de to piger nede i trapperne tale sammen, som om det var muligt.
Hilary tænkte, det kunne ikke være rigtigt","  15. Dansk: Det er et af de mest fantastiske steder at besøge.  Engelsk: It is one of the most amazing places to visit.  16. Dansk: Det var det første år, vi havde et så stort arrangement.  Engelsk: This was the first year we had a big event.  17. Dansk: Vi vil have en lille ting i kassen  Engelsk: We want a little something in the","Derpå sagde Gud: ""Der komme Lys på Himmelhvælvingen til at skille Dag fra Nat, og de skal være til Tegn og til Fastsættelse af Højtider, Dage og År","God said, ""Let there be lights in the expanse of sky to divide the day from the night; and let them be for signs, and for seasons, and for days and years;",18,5,12
" Men klokken var blevet syv, når jeg stod i bilen for at køre hjem.
Men det var nu ikke kun selve natmangelen, der var","    ""What do you mean, 'what do I mean'? What do you mean?""    ""You said you were going to have a conversation with me.""    ""Well, I didn't. I said, 'Well, I have a problem.' ""    ""What did I have a problem with?""    ""I said, 'Well, you're so damn nice.' ""    ""","Derpå sagde Gud: ""Der komme Lys på Himmelhvælvingen til at skille Dag fra Nat, og de skal være til Tegn og til Fastsættelse af Højtider, Dage og År","God said, ""Let there be lights in the expanse of sky to divide the day from the night; and let them be for signs, and for seasons, and for days and years;",19,5,12
" Nu var en drøm igen ved at gå i opfyldelse. En drøm der kunne blive til virkelighed, ved min side. En drøm jeg havde drømt","  16. Og hvis du ikke kan gøre det, så kan du stadig få det. ->  If you can't do that, you can still.  17. De havde også en lille bagtil af en skrigende hund, som også var meget aktiv. ->  They also had a small back of a crier, which was also very active.  18. Men hvad hvis man ikke kan holde","Derpå sagde Gud: ""Der komme Lys på Himmelhvælvingen til at skille Dag fra Nat, og de skal være til Tegn og til Fastsættelse af Højtider, Dage og År","God said, ""Let there be lights in the expanse of sky to divide the day from the night; and let them be for signs, and for seasons, and for days and years;",20,5,12
"
Jeg var sulten. Jeg var træt, men sulten var ikke noget problem.
Jeg satte mig på sengen, og jeg åbnede min computer. Jeg","  I went back to the church and sat down. I was a little saddened by the way the story was going, but it was the story, and I was glad that I was here.  ""I don't think that we should go to the police, or the military, or the army. I don't think that we should go to the army. There are a lot of people who do not like the","Derpå sagde Gud: ""Der komme Lys på Himmelhvælvingen til at skille Dag fra Nat, og de skal være til Tegn og til Fastsættelse af Højtider, Dage og År","God said, ""Let there be lights in the expanse of sky to divide the day from the night; and let them be for signs, and for seasons, and for days and years;",21,5,12
" Efter to dage var jeg klar.
Nu hvor jeg er blevet helt grøn, er det som om, at der kommer mere gang i mine tanker."," He would have been asleep in the car if it hadn't been for the rain.  'I can't see the rain, can I?' he said. 'You know I can't. I'm not sure I can see the rain.'  'It's a great deal of rain,' she said. 'It's not much, but it's a lot. You know I can't","Derpå sagde Gud: ""Der komme Lys på Himmelhvælvingen til at skille Dag fra Nat, og de skal være til Tegn og til Fastsættelse af Højtider, Dage og År","God said, ""Let there be lights in the expanse of sky to divide the day from the night; and let them be for signs, and for seasons, and for days and years;",22,5,12
"
Den gode måde at skrive en novelle på er helt enkelt at trække vejret dybt og slappe af. Det lyder jo så simpelt. Men sådan behøver","  'The evening was the most beautiful day I have ever known. It was a cloudless night, and the sky was clear, like a clear sky, and the stars were shining. It was a clear night, and there were only two stars. I saw the moon, and I saw the sun.  'I saw the moon. It was the second night, and the moon was in the sky. I saw the sun.","Derpå sagde Gud: ""Der komme Lys på Himmelhvælvingen til at skille Dag fra Nat, og de skal være til Tegn og til Fastsættelse af Højtider, Dage og År","God said, ""Let there be lights in the expanse of sky to divide the day from the night; and let them be for signs, and for seasons, and for days and years;",23,5,12
" De andre havde sovet, og så de andre gå over til køleren med maden, som var fyldt op til over deres tøj. Jeg sad med","  Norsk: Så jeg hadde ikke noe å gjøre, jeg hadde ikke noe å gjøre.    Engelsk: It is also possible to get to the lake from the river.  Norsk: Det er også mulig å komme seg til innsjøen fra elva.    Engelsk: The best hotels in Osterode near Osterode Station  Norsk: De beste hotellene i Osterode nær Osterode Station    Engelsk: The hotel","Derpå sagde Gud: ""Der komme Lys på Himmelhvælvingen til at skille Dag fra Nat, og de skal være til Tegn og til Fastsættelse af Højtider, Dage og År","God said, ""Let there be lights in the expanse of sky to divide the day from the night; and let them be for signs, and for seasons, and for days and years;",0,10,12
" -> Og om natta var det morgen, trejde dag.

Men i dag var det endnu engang noget helt andet. -> Men nå var det",.<|endoftext|>,"Derpå sagde Gud: ""Der komme Lys på Himmelhvælvingen til at skille Dag fra Nat, og de skal være til Tegn og til Fastsættelse af Højtider, Dage og År","God said, ""Let there be lights in the expanse of sky to divide the day from the night; and let them be for signs, and for seasons, and for days and years;",1,10,12
"

-Vi skal til at udgive ""Fiskerspil"" i Norge, og der går vi op i en højere enhed. Vi har"," ->  I was in the evening and there was morning, a third day.    6. ""Jeg ved ikke, om jeg vil sige det, men jeg har det godt med det. ->  ""Jag vet inte om jag ska säga det men jag har det bra.      7. De skal nok få med seg noen poeng. ->  De kommer nok til å hente noen poeng.      8. - Det","Derpå sagde Gud: ""Der komme Lys på Himmelhvælvingen til at skille Dag fra Nat, og de skal være til Tegn og til Fastsættelse af Højtider, Dage og År","God said, ""Let there be lights in the expanse of sky to divide the day from the night; and let them be for signs, and for seasons, and for days and years;",2,10,12
" Og vi blev mere søvnige, end da vi havde sovet natten før. Og vores dag gik, som den normalt var, eller mere. Efter","    11. The following day, a second day, the following day, a third day, the following day, a fourth day, the following day, the following day, the following day, the following day, the following day, the following day.    12. On the next day, the next day, the next day, the next day, the next day, the next day, the next day, the","Derpå sagde Gud: ""Der komme Lys på Himmelhvælvingen til at skille Dag fra Nat, og de skal være til Tegn og til Fastsættelse af Højtider, Dage og År","God said, ""Let there be lights in the expanse of sky to divide the day from the night; and let them be for signs, and for seasons, and for days and years;",3,10,12
" Morgenen efter fulgte den fjerde dag.

I morgen gik de afsted på en tur i stalden. Den sidste gang inden de mødtes i",". In that case, the third day was the night.  In that case, the third day was the night.<|endoftext|>","Derpå sagde Gud: ""Der komme Lys på Himmelhvælvingen til at skille Dag fra Nat, og de skal være til Tegn og til Fastsættelse af Højtider, Dage og År","God said, ""Let there be lights in the expanse of sky to divide the day from the night; and let them be for signs, and for seasons, and for days and years;",4,10,12
"
Nu er det tid! Vi venter på vejret, men solen skinner heldigvis, så vi sidder nok udendørs, selvom det regner og blæser. Vi", But the morning was already past.  The day had come. The sun was already rising. The clouds had begun to form. The wind was coming from the west.  The first thing I did was to look around. I wanted to see the hills. The mountains. The hills of the country. The valley of the river. I wanted to see the mountains. I wanted to see the hills.  I looked around. I was,"Derpå sagde Gud: ""Der komme Lys på Himmelhvælvingen til at skille Dag fra Nat, og de skal være til Tegn og til Fastsættelse af Højtider, Dage og År","God said, ""Let there be lights in the expanse of sky to divide the day from the night; and let them be for signs, and for seasons, and for days and years;",5,10,12
" Det er første dag i den forgangne uge, jeg har fået 14.485 af slagsen. Når man kigger på det",  For he had a fine auld auld auld auld auld auld auld auld auld auld auld auld auld auld auld auld auld auld auld auld auld auld auld auld auld auld auld auld auld auld auld auld auld auld auld auld auld auld auld auld auld,"Derpå sagde Gud: ""Der komme Lys på Himmelhvælvingen til at skille Dag fra Nat, og de skal være til Tegn og til Fastsættelse af Højtider, Dage og År","God said, ""Let there be lights in the expanse of sky to divide the day from the night; and let them be for signs, and for seasons, and for days and years;",6,10,12
" Nu sad vi hjemme i mit soveværelse, hvor min mor, som altid, satte sig ved siden af mig. En stille tid i hendes hjem. Et",".  Det var aften og morgen, og det var tredje dag.<|endoftext|>","Derpå sagde Gud: ""Der komme Lys på Himmelhvælvingen til at skille Dag fra Nat, og de skal være til Tegn og til Fastsættelse af Højtider, Dage og År","God said, ""Let there be lights in the expanse of sky to divide the day from the night; and let them be for signs, and for seasons, and for days and years;",7,10,12
" Næste morgen kom der en mand op fra den anden ende af stuen, han var forstenet, som om han havde set et lys. Han så","  It was the third day.    THE SEA, THE WAR    The day was long and cold.  The air was clear and the sky clear and the waves soft and gentle, the ocean clear and blue.  The sky was a deep blue sky with a clear blue sky, and the sea was a deep blue sea with a clear blue sky.  The sky was a deep blue sky with a clear blue","Derpå sagde Gud: ""Der komme Lys på Himmelhvælvingen til at skille Dag fra Nat, og de skal være til Tegn og til Fastsættelse af Højtider, Dage og År","God said, ""Let there be lights in the expanse of sky to divide the day from the night; and let them be for signs, and for seasons, and for days and years;",8,10,12
"
Det var, som om vi kunne gøre lige, hvad vi ønskede. Vi gav os til at rode i vores taske og opdage, at alt var","  ""I'm sorry, but I'm not going to sleep. I'll just stay up until 10 o'clock. If I wake up and I'm awake, I'll go back to bed. I'll be tired, but I'll get through it. You can stay up until 10 o'clock, but I'll go back to sleep. I'll be tired","Derpå sagde Gud: ""Der komme Lys på Himmelhvælvingen til at skille Dag fra Nat, og de skal være til Tegn og til Fastsættelse af Højtider, Dage og År","God said, ""Let there be lights in the expanse of sky to divide the day from the night; and let them be for signs, and for seasons, and for days and years;",9,10,12
" Jeg gik rundt i haven og kiggede på en masse forskellige blomster, blomster dufte som noget fra Mars, som havde stået udenfor og ikke engang har været","    6. dansk: Hvad er en ""Catch Me If You Can""?  engelsk: What is a ""catch me if you can""?    7. dansk: Det er den eneste måde at undgå de mange problemer, der følger med det.  engelsk: It is the only way to avoid the many issues that come with it.    8. dansk: Det er også den måde, du kan få den mest effektive","Derpå sagde Gud: ""Der komme Lys på Himmelhvælvingen til at skille Dag fra Nat, og de skal være til Tegn og til Fastsættelse af Højtider, Dage og År","God said, ""Let there be lights in the expanse of sky to divide the day from the night; and let them be for signs, and for seasons, and for days and years;",10,10,12
" Jeg skulle lige til at køre fra ham, da han så at jeg var ude sammen med en kammerat. Fik en masse sved på panden",".  ""And hvad var det, der skete på den tredje dag?<|endoftext|>","Derpå sagde Gud: ""Der komme Lys på Himmelhvælvingen til at skille Dag fra Nat, og de skal være til Tegn og til Fastsættelse af Højtider, Dage og År","God said, ""Let there be lights in the expanse of sky to divide the day from the night; and let them be for signs, and for seasons, and for days and years;",11,10,12
"
Det er et smukt efterår, og det er en helt særlig kærlighed, der binder de tre lande sammen. Det er som noget af det vigtigste i",.<|endoftext|>,"Derpå sagde Gud: ""Der komme Lys på Himmelhvælvingen til at skille Dag fra Nat, og de skal være til Tegn og til Fastsættelse af Højtider, Dage og År","God said, ""Let there be lights in the expanse of sky to divide the day from the night; and let them be for signs, and for seasons, and for days and years;",12,10,12
 Jeg havde fået to flasker vin og drukket nogle dråber friskbrygget rødvin sammen med mit barnebarn. Han sad og spiste sine små guler,.  Men det er aften og det er morgen.<|endoftext|>,"Derpå sagde Gud: ""Der komme Lys på Himmelhvælvingen til at skille Dag fra Nat, og de skal være til Tegn og til Fastsættelse af Højtider, Dage og År","God said, ""Let there be lights in the expanse of sky to divide the day from the night; and let them be for signs, and for seasons, and for days and years;",13,10,12
" -Også i 14 dage for sent. -I 14 dage i fremtiden. Og 14 dage i dag.

",".  Næste morgen, og det var anden dag, var der en tredje dag.<|endoftext|>","Derpå sagde Gud: ""Der komme Lys på Himmelhvælvingen til at skille Dag fra Nat, og de skal være til Tegn og til Fastsættelse af Højtider, Dage og År","God said, ""Let there be lights in the expanse of sky to divide the day from the night; and let them be for signs, and for seasons, and for days and years;",14,10,12
" Jeg spurgte hende om hvem af dem der skulle være min nye bedste veninde, det var så ikke hende hun gerne ville vide, det vidste jeg, hun",".  Men der var aften og der var morgen, en tredje dag.<|endoftext|>","Derpå sagde Gud: ""Der komme Lys på Himmelhvælvingen til at skille Dag fra Nat, og de skal være til Tegn og til Fastsættelse af Højtider, Dage og År","God said, ""Let there be lights in the expanse of sky to divide the day from the night; and let them be for signs, and for seasons, and for days and years;",15,10,12
"
En smuk blå himmel på vej mod Syd.
Men vi havde set lyset! Vi havde fået set en ""tange"" – en rød og","    4. 1980, 2. april, den 10. april og 11. april, kl. 18.30, 19.00, 21.00, 22.00, 23.00 og 24.00, på den anden side af vejen, med afslutningen af den 1. april","Derpå sagde Gud: ""Der komme Lys på Himmelhvælvingen til at skille Dag fra Nat, og de skal være til Tegn og til Fastsættelse af Højtider, Dage og År","God said, ""Let there be lights in the expanse of sky to divide the day from the night; and let them be for signs, and for seasons, and for days and years;",16,10,12
" Så gik det op for mig, at jeg allerede var et døgn på det.
18. april, 2017 kl. ","  For det første må vi huske på, at det ikke kun er et spørgsmål om at få en bedre tilværelse, men om at få en bedre tilværelse. ->  For det første er det nødvendigt at huske, at det ikke kun drejer sig om at få en bedre tilværelse, men om at få en bedre tilværelse.  Det er en rigtig god idé at tage en dag til at slappe af, hvor du kan se,","Derpå sagde Gud: ""Der komme Lys på Himmelhvælvingen til at skille Dag fra Nat, og de skal være til Tegn og til Fastsættelse af Højtider, Dage og År","God said, ""Let there be lights in the expanse of sky to divide the day from the night; and let them be for signs, and for seasons, and for days and years;",17,10,12
" En af de værste dage.
De andre dage, de var gode, og der blev drukket, spist og været sammen. Men den her?",                                                                                                                                                                                ,"Derpå sagde Gud: ""Der komme Lys på Himmelhvælvingen til at skille Dag fra Nat, og de skal være til Tegn og til Fastsættelse af Højtider, Dage og År","God said, ""Let there be lights in the expanse of sky to divide the day from the night; and let them be for signs, and for seasons, and for days and years;",18,10,12
" Den varmeste dag havde vi allerede, men den sidste dag og det sidste minut, havde vi også det allervarmest. Men jeg troede ikke,",                                                                                                                                                                                ,"Derpå sagde Gud: ""Der komme Lys på Himmelhvælvingen til at skille Dag fra Nat, og de skal være til Tegn og til Fastsættelse af Højtider, Dage og År","God said, ""Let there be lights in the expanse of sky to divide the day from the night; and let them be for signs, and for seasons, and for days and years;",19,10,12
" Jeg ville ikke sove, ikke hvile mig, men lå og så på den anden side af brusenichen, på den anden side jeg var kommet",".  Her mons er på en anden side af verden, så det er en dag og en anden, en tredje.<|endoftext|>","Derpå sagde Gud: ""Der komme Lys på Himmelhvælvingen til at skille Dag fra Nat, og de skal være til Tegn og til Fastsættelse af Højtider, Dage og År","God said, ""Let there be lights in the expanse of sky to divide the day from the night; and let them be for signs, and for seasons, and for days and years;",20,10,12
"
Det vil sige, at vi først gik til ham i dag kl. 6, da vi spiste morgenmad. Og klokken blev 10.",                                                                                                                                                                                ,"Derpå sagde Gud: ""Der komme Lys på Himmelhvælvingen til at skille Dag fra Nat, og de skal være til Tegn og til Fastsættelse af Højtider, Dage og År","God said, ""Let there be lights in the expanse of sky to divide the day from the night; and let them be for signs, and for seasons, and for days and years;",21,10,12
