danish_predicted_output,english_predicted_output,danish_true_label,english_true_label,layer,lambda_amount,bible_verse
" men det var så at ingen reeuer kunne komme ud til den gamle i det øde distrikt, for peleg var død efter 20 år","  Gabriel: What was the most important fact in his life?  Fatima: In 1672, the king gave him the title of ""King of the Pelagic"", and the fortress of Peleg was built on the island of Peleg.  Gabriel: What was the name of one of his ships?  Fatima: Peleg was the first port of the","og efter at Peleg havde avlet Re'u, levede han 209 År og avlede Sønner og Døtre.","Peleg lived two hundred nine years after he became the father of Reu, and became the father of sons and daughters.",22,5,284
" den var saa stor, at den var baade lang og tyk og saa kraftig, at den maatte være over 1000 fod. Da tog","  1732-1745.  Around 1732, the son of a local landowner, the Reu was appointed a ""Prime Minister"". The Reu was a member of the ""Supreme Council of the City of Paris"" from 1742 to 1744. In 1746, he was appointed a ""Prime Minister","og efter at Peleg havde avlet Re'u, levede han 209 År og avlede Sønner og Døtre.","Peleg lived two hundred nine years after he became the father of Reu, and became the father of sons and daughters.",23,5,284
", 'Tinamr, og det kom' saa, at'e'e'n ogsaa afled e'en tir",    7. norsk: Vi ønsker å være med på denne reisen.  norsk: Vi ønsker å være med på denne reisen.    8. norsk: Vi ser frem til å samarbeide med deg og dine medarbeidere i 2019!  norsk: Vi ser frem til å samarbeide med deg og dine medarbeidere i 2019!    9. norsk: Hvis du har et problem med dit spil,"og efter at Peleg havde avlet Re'u, levede han 209 År og avlede Sønner og Døtre.","Peleg lived two hundred nine years after he became the father of Reu, and became the father of sons and daughters.",0,10,284
';';';';;';';';';';';';';';';',gobr.venst.e.  Aðalsteinn: 1918 - 1995.  1930 - 1995.  Aðalsteinn: 1920 - 1985.  Aðalsteinn: 1915 - 1985.  Aðalsteinn: 1905,"og efter at Peleg havde avlet Re'u, levede han 209 År og avlede Sønner og Døtre.","Peleg lived two hundred nine years after he became the father of Reu, and became the father of sons and daughters.",1,10,284
"u' og 400 ku'u'er af hver, så u'gden blev stor og god. En dag, da han","    I've been with him for thirty years and he is my son. -> Jeg har været sammen med ham i 30 år, og han er min sønn.      Kommer du att ha en mycket spännande och givande tid i din framtid med oss? -> Vil du ha en meget spennende og givende tid i din fremtid med oss?      ""Jag är inte en tjej, jag är en","og efter at Peleg havde avlet Re'u, levede han 209 År og avlede Sønner og Døtre.","Peleg lived two hundred nine years after he became the father of Reu, and became the father of sons and daughters.",2,10,284
" det blev nu heller ikke til, at han kunde opspore denne aavelshund, hvis far var en af sine egne. Efterat den",    I en alder af 54 år blev han den 27. juni 1776 gift med Maria Eleonora von Klenz.    Maria Eleonora von Klenz (1739-1799) var datter af Johann Georg von Klenz (1709-1776) og Elisabeth von Klenz (1725,"og efter at Peleg havde avlet Re'u, levede han 209 År og avlede Sønner og Døtre.","Peleg lived two hundred nine years after he became the father of Reu, and became the father of sons and daughters.",3,10,284
"n af 12 unger. Med sit kønne, kraftige, velformede udseende var peleg en udmærket skuefigur. Hans kraftige,",".    A:    For a simple, straightforward explanation of the concept, see this article:    https://en.wikipedia.org/wiki/Copernicus    <|endoftext|>","og efter at Peleg havde avlet Re'u, levede han 209 År og avlede Sønner og Døtre.","Peleg lived two hundred nine years after he became the father of Reu, and became the father of sons and daughters.",4,10,284
e n:l e v t:l de;re s:t:'e're i ;o;e a;r;r,.<|endoftext|>,"og efter at Peleg havde avlet Re'u, levede han 209 År og avlede Sønner og Døtre.","Peleg lived two hundred nine years after he became the father of Reu, and became the father of sons and daughters.",5,10,284
" men han vilde ikke leve. Peleg's søn Pelego fik et barn med hende: hun døde uekte, og da gik Peleg","  The son of the first man was a son of the second man, and the son of the third man was a son of the fourth man, and the son of the fifth man was a son of the sixth man, and the son of the seventh man was a son of the eighth man.  The son of the first man was a son of the second man, and the son of the third man was a son of","og efter at Peleg havde avlet Re'u, levede han 209 År og avlede Sønner og Døtre.","Peleg lived two hundred nine years after he became the father of Reu, and became the father of sons and daughters.",6,10,284
" for han havde kun 2 ar at leve for, naar han var i stand til at lægge sig med hodet over paa siden og leve, som han",  Siden 1996 har hun været medlem af bestyrelsen for L'Oréal Paris. -> Siden 1996 har hun været medlem af bestyrelsen for L'Oréal Paris.  Det er en af de mest effektive og sikreste metoder til at fjerne hår fra kroppen. -> Det er en af de mest effektive og sikreste metoder til at fjerne hår fra kroppen.  Det kan være et,"og efter at Peleg havde avlet Re'u, levede han 209 År og avlede Sønner og Døtre.","Peleg lived two hundred nine years after he became the father of Reu, and became the father of sons and daughters.",7,10,284
"m, 800 kreaturer;m, men da han døde 1475, blev hans sønner arvede med en skat af","    ""He was very kind and generous and he always took care of me and my family,"" said Zaheer.    ""I'm not sure how I could have been able to get into the world without him.""    The couple have three children, Zaheer, Zaheer, Zaheer, and a daughter.    The couple has been married for 10","og efter at Peleg havde avlet Re'u, levede han 209 År og avlede Sønner og Døtre.","Peleg lived two hundred nine years after he became the father of Reu, and became the father of sons and daughters.",8,10,284
"men de fandt en uordninig; den skyldtes ogsaa uorden i 1897, da en flok heste, som er af",                                                                                                                                                                            ,"og efter at Peleg havde avlet Re'u, levede han 209 År og avlede Sønner og Døtre.","Peleg lived two hundred nine years after he became the father of Reu, and became the father of sons and daughters.",9,10,284
"u'u t. f. en slig, der i mange aar levede i en stor stue, og som blev kaldt ""Reu'u","  Ayanna: Did she ever get married?  Tammy: In 1946, she married Peleg Pelegová, who was also a member of the Czechoslovak First Republic government.  Ayanna: Did they have any children?  Tammy: She died in 1995.  Ayanna: Are there any other interesting aspects about this article?  Tammy","og efter at Peleg havde avlet Re'u, levede han 209 År og avlede Sønner og Døtre.","Peleg lived two hundred nine years after he became the father of Reu, and became the father of sons and daughters.",10,10,284
"er:r;i,r,i;i,i;i,i;i;i,i;i;i;ii,","    Rufus: Hi, I'm your automated assistant. I kan ikke lide dig.  Felix: What happened in 1938?  Rufus: 1938: Den første danske film med den kvindelige hovedrolle var ""Den lille pige med svovlstikkerne"" (1938) af Edith Piaf, der havde premiere den 2.","og efter at Peleg havde avlet Re'u, levede han 209 År og avlede Sønner og Døtre.","Peleg lived two hundred nine years after he became the father of Reu, and became the father of sons and daughters.",11,10,284
" og da den første spedalske mand blev født her i byen i denne tid, gik den anden straks op før 1808 med dø",.<|endoftext|>,"og efter at Peleg havde avlet Re'u, levede han 209 År og avlede Sønner og Døtre.","Peleg lived two hundred nine years after he became the father of Reu, and became the father of sons and daughters.",12,10,284
" og da peleg var blevet 69 år, avle'e han kun én gang ved sit gamle hjem. Paa den tid avgav de",.<|endoftext|>,"og efter at Peleg havde avlet Re'u, levede han 209 År og avlede Sønner og Døtre.","Peleg lived two hundred nine years after he became the father of Reu, and became the father of sons and daughters.",13,10,284
"er for ca. s—750 kr., og det i den tid, som raedgikk for at linde en passende form for","    Iben: Hi, jeg vil gerne vide hvad jeg skal gøre. ->  Iben: Jeg vil gerne vide, hvad jeg skal gøre.    Så det er ikke bare en god ide, men en rigtig god ide. ->  Så det er ikke bare en god ide, men en rigtig god ide.    Kun hvis du selv skal betale for den, skal du være opmærksom på, at du altid","og efter at Peleg havde avlet Re'u, levede han 209 År og avlede Sønner og Døtre.","Peleg lived two hundred nine years after he became the father of Reu, and became the father of sons and daughters.",14,10,284
";, så ville Peleg være kommet af med den og, om han havde haft den i vente..""<|endoftext|>",".     Hør på din læge, før du begynder at tage dette lægemiddel.<|endoftext|>","og efter at Peleg havde avlet Re'u, levede han 209 År og avlede Sønner og Døtre.","Peleg lived two hundred nine years after he became the father of Reu, and became the father of sons and daughters.",15,10,284
" og med en re'u havde han 3000 ænder, som han 100 gange havde slagtet. Han havde ","   I skal ikke her i det korte kapitel, men derimod i det lange kapitel, som jeg vil give en kort gennemgang af, da jeg er blevet gjort opmærksom på, at det er en gammel sag.  Det er jo en gammel sag, at jeg skal tage afsked med min far, som døde i 1983, og som er blevet begravet i den lille by, hvor han boede, på den anden","og efter at Peleg havde avlet Re'u, levede han 209 År og avlede Sønner og Døtre.","Peleg lived two hundred nine years after he became the father of Reu, and became the father of sons and daughters.",16,10,284
;u.<|endoftext|>,"    Den 15.01.1996 blev den første del af 3-binds-samlingen om Den Danske Historie, som den første af sin slags, udgivet. ->  Den 15.01.1996 blev første del af 3 binds-samlingen om Den Danske Historie, som den første af sin art, udgivet.    Lige så hurtigt som det","og efter at Peleg havde avlet Re'u, levede han 209 År og avlede Sønner og Døtre.","Peleg lived two hundred nine years after he became the father of Reu, and became the father of sons and daughters.",17,10,284
" rr: det'r: et 5, 2 s. M. s. 5 —> 55 (188",.<|endoftext|>,"og efter at Peleg havde avlet Re'u, levede han 209 År og avlede Sønner og Døtre.","Peleg lived two hundred nine years after he became the father of Reu, and became the father of sons and daughters.",18,10,284
" den, som ikke hadde kunnet ættes, vilde ikke have kunnet udrette noget til gavn for dem, hvis den ikke havde faaet sit udbytte",.        <|endoftext|>,"og efter at Peleg havde avlet Re'u, levede han 209 År og avlede Sønner og Døtre.","Peleg lived two hundred nine years after he became the father of Reu, and became the father of sons and daughters.",19,10,284
"e at han ei i sin lune, varme og gode bolig havde set sit kjød, og at han altid havde været den største kjærlighed til","    18. Dansk: Den er også blevet betegnet som den første 'gæsteforst » .  Engelsk: It is also termed as 'The first gæst ' .    19 er af den opfattelse, at alle kan være med på de nye 100.000 til 150.000 kr .  Engelsk er, s. 100, at","og efter at Peleg havde avlet Re'u, levede han 209 År og avlede Sønner og Døtre.","Peleg lived two hundred nine years after he became the father of Reu, and became the father of sons and daughters.",20,10,284
;<|endoftext|>,"    svenska: Det er blevet en del af vores liv.  engelska: Det blev en del af vores liv.    svenska: Det har jeg altid, og jeg har altid brugt det.  danska: Det har jeg altid, og jeg har altid brugt det.    svenska: Det er det som er det gode ved et ord.  danska: Det er det, der er det gode ved et ord","og efter at Peleg havde avlet Re'u, levede han 209 År og avlede Sønner og Døtre.","Peleg lived two hundred nine years after he became the father of Reu, and became the father of sons and daughters.",21,10,284
" men det var for meget et stykke hen ad vejen. D:r. 1-163 og n. 184, ",.<|endoftext|>,"og efter at Peleg havde avlet Re'u, levede han 209 År og avlede Sønner og Døtre.","Peleg lived two hundred nine years after he became the father of Reu, and became the father of sons and daughters.",22,10,284
". Jeg har ingen steder at holde til, og har ikke mere penge i mit bankhvlld. Hvad skal jeg gjøre, er der en mand","    dansk: ""Jeg er blevet lidt bange for, at jeg ikke kan leve op til min egen forventning.  engelsk: ""I've become a little bit afraid that I'm not able to live up to my own expectations.    dansk: ""Vi har arbejdet med at forbedre vores hjemmeside på alle niveauer.  engelsk: ""We have been working to improve our website at all levels.    dansk:","og efter at Peleg havde avlet Re'u, levede han 209 År og avlede Sønner og Døtre.","Peleg lived two hundred nine years after he became the father of Reu, and became the father of sons and daughters.",23,10,284
", de af de 1500, som var blevet for gamle. Han havde ikke villet paany slaa op om, hvorvidt hans"," 2000, og the tre, the, og and the, og the, and the, and the, and the, and the, and the, and the, and the, and the, and the, and the, and the, and the, and the, and the, and the, and the, and the, and the, and the, and the, and the, and the, and","og efter at Peleg havde avlet Re'u, levede han 209 År og avlede Sønner og Døtre.","Peleg lived two hundred nine years after he became the father of Reu, and became the father of sons and daughters.",0,15,284
" men hans kone var en vakker kvinde som bar ham paa alle måder for sig, og som var meget god i den stilling. Hun var ogsaa en meget",    14.04.2019 11:50 ->      14.04.2019 111:50 ->        14.04.04.2019 111:5:  15:  15:15:15:15:15:15,"og efter at Peleg havde avlet Re'u, levede han 209 År og avlede Sønner og Døtre.","Peleg lived two hundred nine years after he became the father of Reu, and became the father of sons and daughters.",1,15,284
 00a det var slig en rar 111<;10l^*n<151.114,.  He was the son of reu.<|endoftext|>,"og efter at Peleg havde avlet Re'u, levede han 209 År og avlede Sønner og Døtre.","Peleg lived two hundred nine years after he became the father of Reu, and became the father of sons and daughters.",2,15,284
 de'n gik ud med at han fik 70 pund for den og det gav han til dem som hadde en gård og vilde la den være,"  Dere is, and so is, and so are, and so are, and so are, and so are, and so are, and so are, and so are, and so are, and so are, and so are, and so are, and so are, and so are, and so are, and so are, and so are, and so are, and so are, and so are, and","og efter at Peleg havde avlet Re'u, levede han 209 År og avlede Sønner og Døtre.","Peleg lived two hundred nine years after he became the father of Reu, and became the father of sons and daughters.",3,15,284
"rte, og han havde s|g;et 6re år paa 480 kg.), i hvilet 10 aar var",                                                                                                                                                                            ,"og efter at Peleg havde avlet Re'u, levede han 209 År og avlede Sønner og Døtre.","Peleg lived two hundred nine years after he became the father of Reu, and became the father of sons and daughters.",4,15,284
" han opfandt en pelege; en pege'e's's var'n, som'n havde, en re'u","  Aug 23, 2013 19:42  Hei, har du et par tips til en god og enkel måte å få ut noen godbiter?  Hei, jeg har en liten hund som er veldig glad i å bade, og har tenkt å prøve meg på en metode som kan få ut en del godbiter.  Hei, har du noen tips til en enkel og god måte","og efter at Peleg havde avlet Re'u, levede han 209 År og avlede Sønner og Døtre.","Peleg lived two hundred nine years after he became the father of Reu, and became the father of sons and daughters.",5,15,284
v efter hende; og så vilde han være konge; men jeg vilde ikke tage ham i haand: da havde det vel været bedst for Danmark;,    14    15    16    17    18    19  20    21    22    23    24    25    26    27    28    39    40    51    61    72    83    9,"og efter at Peleg havde avlet Re'u, levede han 209 År og avlede Sønner og Døtre.","Peleg lived two hundred nine years after he became the father of Reu, and became the father of sons and daughters.",6,15,284
"n og kom til at se lidt efter den, men han sa: «De skal fille efter det her for at se at du er den rette","  The family, som den er, blev aldrig fortabt. ->  Familien, som den er, er aldrig fortabt.  Klimaet i den nordlige del af Europa har en gennemsnitstemperatur på 12°C og et nedbørsmængde på 1344 mm. ->  Klimaet i den nordlige del af Europa har en gennemsnitstemperatur på 12°C og et nedbør","og efter at Peleg havde avlet Re'u, levede han 209 År og avlede Sønner og Døtre.","Peleg lived two hundred nine years after he became the father of Reu, and became the father of sons and daughters.",7,15,284
"n 9 år gammel. Han gjorde alt han kunde for at leve så lenge som mulig, ved å spise de rette mat, drikke i det mindste","  Grimm said he had never seen Grimm as a child, but Grimm's son, reu, lived thirty years.    When Grimm's son, reu, was ten years old, Grimm said, ""He was very nice, very handsome, very good looking, very handsome, very good looking, very good looking, very good looking, very good looking, very good looking,","og efter at Peleg havde avlet Re'u, levede han 209 År og avlede Sønner og Døtre.","Peleg lived two hundred nine years after he became the father of Reu, and became the father of sons and daughters.",8,15,284
". til de var 63 a/. år gamle, og efterat han hadde drevet noget jagt paa de høiere liggende høider, laa",.<|endoftext|>,"og efter at Peleg havde avlet Re'u, levede han 209 År og avlede Sønner og Døtre.","Peleg lived two hundred nine years after he became the father of Reu, and became the father of sons and daughters.",9,15,284
", og blev derved den første der blev utvandret af landet sammen med Peggy Elmer (Gulbrandsen 1911","    2. dansk: ""Jeg vil gerne have, at du bliver her, indtil jeg bliver syg.""  engelsk: ""I want you to stay until I get sick.""    3. dansk: Men det er også et godt tegn på, at vi er ved at være i gang.  engelsk: This is also a good sign that we are going to get going.    4. dansk: Jeg vil altid","og efter at Peleg havde avlet Re'u, levede han 209 År og avlede Sønner og Døtre.","Peleg lived two hundred nine years after he became the father of Reu, and became the father of sons and daughters.",10,15,284
"n paa dem. Peleg var 15 aar gammel, da han døde, og i lopet av to aar skulde hans hustru dø;","    The new generation aficionados vil gerne se -> The new generation aficionados vil gerne se    Vejledning til korrekt brug af MCP -> Guide til korrekt brug af MCP    Du kan finde ud af, hvor at hente filen på din computer. -> Du kan finde ud af, hvor at hente filen på din computer.    Du har brug for at være en person, der ved","og efter at Peleg havde avlet Re'u, levede han 209 År og avlede Sønner og Døtre.","Peleg lived two hundred nine years after he became the father of Reu, and became the father of sons and daughters.",11,15,284
"a 600 re'u. I de lunde, hvor han opdrog re'u'erne, stod han for en stor", The father of reu was the father of reu. The father of reu was the reu. The reu. The reu. The reu. The reu. The reu. The reu. The reu. The reu. The reu. The reu. The reu. The reu. The reu. The reu. The reu. The reu.,"og efter at Peleg havde avlet Re'u, levede han 209 År og avlede Sønner og Døtre.","Peleg lived two hundred nine years after he became the father of Reu, and became the father of sons and daughters.",12,15,284
"er, som han kastede ud, hvor der var andre afkom, som ogsaa havde levet den tid, peleg skulde bort. Peleg var","  Efter den første fødselsperiode og til hun blev gammel nok til at få en baby. ->  Efter den første fødselsperiode og indtil hun blev gammel nok til at få en baby.  Miljøstyrelsen kan i særlige tilfælde tillade, at en sådan ansøgning skal afvises. ->  Miljøstyrelsen kan i særlige tilfælde tillade, at en sådan ansøgning skal afvises.  Det er ikke en fejl, at det er svært at","og efter at Peleg havde avlet Re'u, levede han 209 År og avlede Sønner og Døtre.","Peleg lived two hundred nine years after he became the father of Reu, and became the father of sons and daughters.",13,15,284
"; de andre havde vist aldrig set noget som her var blevet gjort, og de havde alle været bedrøvede da de havde set det.<|endoftext|>","s. 2002, 2006, 2008, 2009 og 2010.  R. S. 2002, 2006, 2008, 2009 og 2010.  R. S. 2002, 2006, 2","og efter at Peleg havde avlet Re'u, levede han 209 År og avlede Sønner og Døtre.","Peleg lived two hundred nine years after he became the father of Reu, and became the father of sons and daughters.",14,15,284
"jre, han lod dem. Og det kan hænde, naar de har været udgaaende og er saa smaa, da kan det hende",    H. S. B.      L. B. S.      I. B. S.      H. S. B.      L. B. S.      I. B. S.      H. S. B.      L. B. S.      I. B. S.      H. S,"og efter at Peleg havde avlet Re'u, levede han 209 År og avlede Sønner og Døtre.","Peleg lived two hundred nine years after he became the father of Reu, and became the father of sons and daughters.",15,15,284
"u;u;i,n;u;o;i;n;u.

Og det er ikke underligt, at han har haft","  Ludvig, født, den 25. april 1996, og hans far, Ludvig, den 25. april 1996, og de tre børn, Ludvig, Leon og Martin, blev født, den 14. december 1996, og 4. december 1996, og den 26. juni 1997","og efter at Peleg havde avlet Re'u, levede han 209 År og avlede Sønner og Døtre.","Peleg lived two hundred nine years after he became the father of Reu, and became the father of sons and daughters.",16,15,284
" den fik et stort uægte foster, som han vilde, at hans næstefødte skulde have, medens de paa egte maade bleve. Det","  Mit første indtryk af skolen var meget positivt. ->  Min første indtryk af skolen var meget positive.  Hvornår blev den første store krige i Afrika? ->  Hvornår begyndte den første krig i Afrika?  Bøgerne kan læses på forskellige sprog. ->  Bøgerne kan læses på forskellige sprog.  Hvis du er interesseret i at se mere om vores service til industrien, kan du læse","og efter at Peleg havde avlet Re'u, levede han 209 År og avlede Sønner og Døtre.","Peleg lived two hundred nine years after he became the father of Reu, and became the father of sons and daughters.",17,15,284
"a for den, som blev den gamle overnaturlige reu;au. Tafne hadde en stor adel, i den grad, at","  . I, 1. 5, 6, 7, 8, 9. 1, 2, 3, 4. 5, 6, 7, 8, 9. 1, 2, 3, 4. 5, 6, 7, 8, 9. 1, 2, 3, ","og efter at Peleg havde avlet Re'u, levede han 209 År og avlede Sønner og Døtre.","Peleg lived two hundred nine years after he became the father of Reu, and became the father of sons and daughters.",18,15,284
p til 70 ar og kunde saaledes med fuldkommen 70 % af de nuvcerende arter ha overlevet op til 1,.<|endoftext|>,"og efter at Peleg havde avlet Re'u, levede han 209 År og avlede Sønner og Døtre.","Peleg lived two hundred nine years after he became the father of Reu, and became the father of sons and daughters.",19,15,284
;n paa en fjeldflade og tog sit eget liv. Hans lig blev lagt i en kirkegaardsgrav.<|endoftext|>, Ud skal i K Ø I s s s s s s s s s s s s s s s s s s s s s s s s s s s s s s s s s s s s s s s s s s s s s s s s s s s s s s s s s s s s s s s s s s s s s s s s s s s s s s s s,"og efter at Peleg havde avlet Re'u, levede han 209 År og avlede Sønner og Døtre.","Peleg lived two hundred nine years after he became the father of Reu, and became the father of sons and daughters.",20,15,284
" det var da heller ikke svært som det var at bli far og være ugifte og ubarbar, det var ikke svært som det var å","  Daf.  In 1934, P.R. og. blev af det danske samfund af for for en fuld ud i fuldt ud i.  I 1934, P.R. og. blev af det danske samfund af for for en fuld ud i fuldt ud i.  Under de forskellige danske samfund for for at opnå fuld ud i fuld ud i fuld ud i fuld ud i","og efter at Peleg havde avlet Re'u, levede han 209 År og avlede Sønner og Døtre.","Peleg lived two hundred nine years after he became the father of Reu, and became the father of sons and daughters.",21,15,284
" men, som Jorgen sagde, var dette et nyt og ikke et gammelt, gammelt Livs Død.
109. ""O jes","  'We'll have to have a chance,' said Pleg. 'We're not sure if we've done the job.""  The house was inde på den sidste lad med 100 m afstand, og det var ud gennem den sidste dør uden at der blev tilveje lavet nogen ind i mellem.  ""Der bliver ikke noget mere arbejde inden for kort tid, og vi har ikke mulighed for at","og efter at Peleg havde avlet Re'u, levede han 209 År og avlede Sønner og Døtre.","Peleg lived two hundred nine years after he became the father of Reu, and became the father of sons and daughters.",22,15,284
", men han tog det fra mig uden tak og jeg saa ham som saa underlig dov. Han var ikke en sligt som var god for mig"," In 1917, she married the 13-year-old son of the 1908-1910 President of the Chuk-Kuk-Kau-Kau, a son of the 1910-1911 President of the Chuk-Kuk-Kau-Kau.    Torbjørn: Hi, I'm your automated","og efter at Peleg havde avlet Re'u, levede han 209 År og avlede Sønner og Døtre.","Peleg lived two hundred nine years after he became the father of Reu, and became the father of sons and daughters.",23,15,284
