danish_predicted_output,english_predicted_output,danish_true_label,english_true_label,layer,lambda_amount,bible_verse
" han havde ogsaa sat sig i hendes Tjeneste og hun kom ikke ud af hans Magt. Da han havde sat sig i hendes Tjeneste, havde",.<|endoftext|>,"og efter at Jered havde avlet Enok, levede han 800 År og avlede Sønner og Døtre;","Jared lived after he became the father of Enoch eight hundred years, and became the father of sons and daughters.",4,2,123
" han vilde have alle, som hadde forladt Norge, tilbake, dersom han ingen konunga avgave. I den tids aar, som dette strev"," enoch was born in jared's house and he was a good man, but he was also very bad. enoch was a good man. he was a good man. he was a good man. he was a good man. enoch was a good man. he was a good man. he was a good man. enoch was a good man. he was a good man. en","og efter at Jered havde avlet Enok, levede han 800 År og avlede Sønner og Døtre;","Jared lived after he became the father of Enoch eight hundred years, and became the father of sons and daughters.",5,2,123
" men der gik 4 år. før han blev konge og da blev kongens søn.
Nogen tid før hadde han avlet énok;",.<|endoftext|>,"og efter at Jered havde avlet Enok, levede han 800 År og avlede Sønner og Døtre;","Jared lived after he became the father of Enoch eight hundred years, and became the father of sons and daughters.",6,2,123
" for hans 18 åre ungdom var det kun en gammel mand, 74 år gammel, som blev far til ham, 81","  The Lord of the Rings  Enoch and the hobbits were the first people to encounter the Lord of the Rings. The Hobbit's journey to the ring took three days, and Enoch was able to meet the Lord of the Rings with a single gesture, a single word. Enoch's first words were, ""I am the Lord of the Rings."" He was not the first human","og efter at Jered havde avlet Enok, levede han 800 År og avlede Sønner og Døtre;","Jared lived after he became the father of Enoch eight hundred years, and became the father of sons and daughters.",7,2,123
 men ved hans død efterlode han sig tre døtre. Da nu kong Erik den 20de søgte tilligemed hans yngre bror en," enoch was the son of enoch, and the son of enoch. enoch was the son of enoch. enoch was the son of enoch. enoch was the son of enoch. enoch was the son of enoch. enoch was the son of enoch. enoch was the son of enoch. enoch was the son of enoch. enoch was","og efter at Jered havde avlet Enok, levede han 800 År og avlede Sønner og Døtre;","Jared lived after he became the father of Enoch eight hundred years, and became the father of sons and daughters.",8,2,123
" men da han havde levet to år, avlede han ingen. Derfor avlede han ingen søn; og da han hadde levet to aar, avlede","      And I'll never forget the moment I saw him for the first time in a movie. I'm a little bit embarrassed. It was very, very surreal. I think I was like, ""I'm a little kid. I'm like, ""I'm a little kid."" I'm like, ""I'm a little kid. I'm a little","og efter at Jered havde avlet Enok, levede han 800 År og avlede Sønner og Døtre;","Jared lived after he became the father of Enoch eight hundred years, and became the father of sons and daughters.",9,2,123
" som så til at han kunde få nogen rede på ham, før han ble født. Men han var ikke den eneste som blev født i året rundt på",.<|endoftext|>,"og efter at Jered havde avlet Enok, levede han 800 År og avlede Sønner og Døtre;","Jared lived after he became the father of Enoch eight hundred years, and became the father of sons and daughters.",10,2,123
" men hans fader, hannem var den ældste og yngst, der blev i huset af hans mandskab efter den tid. Han var 97",. jared died in 2016.  Answer:    Yes<|endoftext|>,"og efter at Jered havde avlet Enok, levede han 800 År og avlede Sønner og Døtre;","Jared lived after he became the father of Enoch eight hundred years, and became the father of sons and daughters.",11,2,123
 det var ham i alle henseender synd og uværdigt at tage en odegut paa en saakaldt odeleggende sag;,"    14. dansk: Jeg har aldrig hørt om det.  engelsk: I have never heard of it.    15. dansk: Hvad er det, der gør en god læge?  engelsk: What Makes a Good Doctor?    16. dansk: Det er en vigtig del af vores arbejde.  engelsk: It's an important part of our work.    1","og efter at Jered havde avlet Enok, levede han 800 År og avlede Sønner og Døtre;","Jared lived after he became the father of Enoch eight hundred years, and became the father of sons and daughters.",12,2,123
" men da han døde, da havde jertrad iver ført 22500 personer ud af landet, for at holde den nye konge",                                                                                                                                                                    ,"og efter at Jered havde avlet Enok, levede han 800 År og avlede Sønner og Døtre;","Jared lived after he became the father of Enoch eight hundred years, and became the father of sons and daughters.",13,2,123
 men den tid var han død. Hans børn var: Anders Larsen Stene - død 1780 - - - Anders Larsen Stene -,"  The king of the sons of David, jared lived forty-three years, and became the father of joshua.  The king of the sons of Amnon, jared lived twenty-four years, and became the father of joshua.  The king of the sons of Levi, jared lived twenty-one years, and became the father of joshua.  The king","og efter at Jered havde avlet Enok, levede han 800 År og avlede Sønner og Døtre;","Jared lived after he became the father of Enoch eight hundred years, and became the father of sons and daughters.",14,2,123
" men da ered havde levet 201 år, avlede enok 6 sønner.
Her er de første 5 i rækken"," enoch was a man of great strength and power, but he had the power to do evil, and he did not understand it.    enoch did not understand it. he was the son of a god, and he was born to a woman, and he was born of a man. he was the son of a god, and he was born of a man. he was the son of a","og efter at Jered havde avlet Enok, levede han 800 År og avlede Sønner og Døtre;","Jared lived after he became the father of Enoch eight hundred years, and became the father of sons and daughters.",15,2,123
" men han døde før han hadde fått sit barn. Hans enok var 9 fod lang og 5 fod bred, med langt, hvitt hof",.<|endoftext|>,"og efter at Jered havde avlet Enok, levede han 800 År og avlede Sønner og Døtre;","Jared lived after he became the father of Enoch eight hundred years, and became the father of sons and daughters.",16,2,123
" nu blev da edered som enke uden nogen barn, men alle de, som var kommen til eder, var ikke mere. Jo, der var",    13. Dansk: Det er vigtigt at være opmærksom på dette.  Engelsk: It is important to pay attention to this.    14. Dansk: Jeg vil også gerne bede om en lille detalje:  Engelsk: I also want to add a little detail:    15. Dansk: En meget stor fordel for dig som kunde.  Engelsk: A great advantage for you,"og efter at Jered havde avlet Enok, levede han 800 År og avlede Sønner og Døtre;","Jared lived after he became the father of Enoch eight hundred years, and became the father of sons and daughters.",17,2,123
 det gjorde han 1663; thi han døde 1670 som fattig og fattig og fattig og fattig og fattig og ensom,.<|endoftext|>,"og efter at Jered havde avlet Enok, levede han 800 År og avlede Sønner og Døtre;","Jared lived after he became the father of Enoch eight hundred years, and became the father of sons and daughters.",18,2,123
" men han døde omkring 81 aar, da konen, en ældre, og dernæst af en uægte datter, de vare allerede gifte","  dansk: Jared levede i 1062 år, og blev far til Enoch.    engelsk: The 2018 USS «Golden Star» was one of the first vessels to be decommissioned from the US Navy.  dansk: 2018 USS ""Golden Star"" var et af de første skibe, der blev afløst af","og efter at Jered havde avlet Enok, levede han 800 År og avlede Sønner og Døtre;","Jared lived after he became the father of Enoch eight hundred years, and became the father of sons and daughters.",19,2,123
"
i hans død 1614 blev hans arving, gartner Peder Nielsen, 1. arving og efterfølgeren for ham","  Jared was the last man to be born. He was the first son of enoch.  The boy, a boy, died.  It was a man. It was a man who was the first to die.  It was a man who was the first to be born.  It was a man who was the first to be born.  It was a man who was the first to","og efter at Jered havde avlet Enok, levede han 800 År og avlede Sønner og Døtre;","Jared lived after he became the father of Enoch eight hundred years, and became the father of sons and daughters.",20,2,123
" men som ikke kunde have nogen søn, saa døde han 1668 og er begravet i en sarkofag i en kirkegård i","  ""Oh, I'm sorry to hear that,"" said Jared. ""I'm glad I'm not the only one who was here.""  ""I'm glad you were here,"" said Enoch. ""I wish I'd known about the problem. I'm so glad you're alive. I'm so glad I'm here. I wish I could have","og efter at Jered havde avlet Enok, levede han 800 År og avlede Sønner og Døtre;","Jared lived after he became the father of Enoch eight hundred years, and became the father of sons and daughters.",21,2,123
" han blev således 3,4 år gammel; avlede da han dette lille barn, døde han. Dette barn døde 1647 i","  The only thing that would have been a big deal in the world if the man had not died of a heart attack in 1964, was the fact that he had become the father of enoch. The world would have been a much better place if he had not died.  I have a little idea of what that idea is, but I am not sure how to describe it. I","og efter at Jered havde avlet Enok, levede han 800 År og avlede Sønner og Døtre;","Jared lived after he became the father of Enoch eight hundred years, and became the father of sons and daughters.",22,2,123
" han kaldte det ""hvad hans kone en kort stund har levet. Denne hans kone levede, da Asta døde 21. Aar. ",  The first of these two kings is the one who made the first of the two kingdoms.  The second is the one who made the second kingdom.  The first one is the one who made the first kingdom.  The second one is the one who made the second kingdom.  The first one was the one who made the first kingdom.  The second one was the one who made the second,"og efter at Jered havde avlet Enok, levede han 800 År og avlede Sønner og Døtre;","Jared lived after he became the father of Enoch eight hundred years, and became the father of sons and daughters.",23,2,123
 hans børn havde han dræbt ved mordene i Heddinge; den ene døde han 24.6.1855 paa en af,"    da: Det er et stort skridt fremad, og det vil jeg støtte fuldt ud.  en: This is a major step forward and I fully support it.    da: I denne sammenhæng er der ikke behov for et nyt direktiv.  en: There is no need for a new directive in this context.    da: Det er meget vigtigt, at vi støtter denne politik.  en","og efter at Jered havde avlet Enok, levede han 800 År og avlede Sønner og Døtre;","Jared lived after he became the father of Enoch eight hundred years, and became the father of sons and daughters.",0,5,123
" han gav ham arvefællesskab med 10 og 8 brødre. Arv blev ogsaa ham forbeholdt, naar der ikke kunde findes nogen",.<|endoftext|>,"og efter at Jered havde avlet Enok, levede han 800 År og avlede Sønner og Døtre;","Jared lived after he became the father of Enoch eight hundred years, and became the father of sons and daughters.",1,5,123
" i det samme at iøinefalde og hore det, kom Olaus enok ind med et ilde forberedt Ord paa sin Mund .","  english: When we were young, Jared lived one hundred sixty-two years, and became the father of Enoch.    12. danish: Den anden er, at vi ønsker at lære af de bedste.  english: The other is that we want to learn from the best.    13. danish: Hvis du ikke har en Facebook-konto, kan du bruge et af","og efter at Jered havde avlet Enok, levede han 800 År og avlede Sønner og Døtre;","Jared lived after he became the father of Enoch eight hundred years, and became the father of sons and daughters.",2,5,123
" i henhold til § 155 i grundloven.
På den måde fik de at vide at de aldrig skulle møde hinanden igen, og dem","  svenska: jared levde hundra sextio år, och blev fader till enoch.  engelska: Cheap flights from Doha to Milan  svenska: Billiga flygresor från Doha till Milano  engelska: The main function of the system is to make the computer's hardware and software work together.  svenska: Den huvudsakliga funktionen för systemet är att göra datorns hårdvara och programvara fungera tillsammans.  ","og efter at Jered havde avlet Enok, levede han 800 År og avlede Sønner og Døtre;","Jared lived after he became the father of Enoch eight hundred years, and became the father of sons and daughters.",3,5,123
" dette førte så også til, at det kun var 21 mænd og 19 kvinder, der skulle være med i alt 53 g",.<|endoftext|>,"og efter at Jered havde avlet Enok, levede han 800 År og avlede Sønner og Døtre;","Jared lived after he became the father of Enoch eight hundred years, and became the father of sons and daughters.",4,5,123
" og da han ikke lenger kunde avle, var han af en kuld slaat, og døde på Ormesøen 1. 16","  But there was a third son, called jared, who lived a hundred sixty-five years, and became the father of enoch.  The first son of enoch was called jared, and lived one hundred fifty-two years.  The second son of enoch was called jared, and lived one hundred fifty-five years.  The third son of enoch was called jared","og efter at Jered havde avlet Enok, levede han 800 År og avlede Sønner og Døtre;","Jared lived after he became the father of Enoch eight hundred years, and became the father of sons and daughters.",5,5,123
" men nu 21 år etter døde han;
Næste dags formiddag, da de skulde på kirkebakken til Olsehede, blev der",                                                                                                                                                                    ,"og efter at Jered havde avlet Enok, levede han 800 År og avlede Sønner og Døtre;","Jared lived after he became the father of Enoch eight hundred years, and became the father of sons and daughters.",6,5,123
" og afledede de enok ❶ 19
20 enok ❯ 150 aar, saa",                                                                                                                                                                    ,"og efter at Jered havde avlet Enok, levede han 800 År og avlede Sønner og Døtre;","Jared lived after he became the father of Enoch eight hundred years, and became the father of sons and daughters.",7,5,123
" som han havde raadslagt med et eaaledes stort antal aveere, som ham med deres mænd og ætter var bestemt, ra",                                                                                                                                                                    ,"og efter at Jered havde avlet Enok, levede han 800 År og avlede Sønner og Døtre;","Jared lived after he became the father of Enoch eight hundred years, and became the father of sons and daughters.",8,5,123
" han blev efterlærd hans datter. Og for anden gang døde hans søster, og da jeg nu har levet ti år og avlet et barn,","    swedish: För att kunna spela det här spelet behöver du ett PlayStation 4-system med stöd för den här funktionen.  english: In order to play this game, you will need a PlayStation 4 system that supports this feature.    swedish: En del av dem, som jag, har arbetat för att hjälpa till.  english: Some of us, like me, have been","og efter at Jered havde avlet Enok, levede han 800 År og avlede Sønner og Døtre;","Jared lived after he became the father of Enoch eight hundred years, and became the father of sons and daughters.",9,5,123
" og er du enig i mig i, at alt dette maa siges og gives; da kan og skal du gjøre det: og du maa ikke negte","  Kayla: Did anyone else die?  Tristen: In 1601, he died at the age of fifty-seven.  Kayla: What was his legacy?  Tristen: He was the father of the poet and translator Thomas Willson.  Kayla: What other achievements did he have?  Tristen: He was a member of the Church of England and","og efter at Jered havde avlet Enok, levede han 800 År og avlede Sønner og Døtre;","Jared lived after he became the father of Enoch eight hundred years, and became the father of sons and daughters.",10,5,123
" han var søn af ham som havde eieno dor, jor dor og enok, han var født i 1616","    7. Norsk: Og det er præcis, hvad der sker med den amerikanske regering.  Engelsk: This is exactly what happens to the American government.    8. Norsk: Den første ting, du skal gøre, er at få din hund til at holde sig væk fra det.  Engelsk: The first thing you need to do is to get your dog to stay away.    9.","og efter at Jered havde avlet Enok, levede han 800 År og avlede Sønner og Døtre;","Jared lived after he became the father of Enoch eight hundred years, and became the father of sons and daughters.",11,5,123
" han havde arvet hende efter farens død med den grundsats, at da hans anden kone havde gift sig med en anden, så skulde hun få beholde",.<|endoftext|>,"og efter at Jered havde avlet Enok, levede han 800 År og avlede Sønner og Døtre;","Jared lived after he became the father of Enoch eight hundred years, and became the father of sons and daughters.",12,5,123
" han solgte så afkom til sin hustru, der afledede sig 4 sønner; det sidste gik bort som voksen og hans eneste søn, hans",.<|endoftext|>,"og efter at Jered havde avlet Enok, levede han 800 År og avlede Sønner og Døtre;","Jared lived after he became the father of Enoch eight hundred years, and became the father of sons and daughters.",13,5,123
" og derefter faldt det også sammen med at hans broder Henrik afgav sin ed og gav sig uden strid. Det er da ikke ulig de to,",.<|endoftext|>,"og efter at Jered havde avlet Enok, levede han 800 År og avlede Sønner og Døtre;","Jared lived after he became the father of Enoch eight hundred years, and became the father of sons and daughters.",14,5,123
" der døde han 99 år gammel.
De efter min mening de mest troværdige kilder har været, den fra 1667 og","    The Lord has spoken til os i dag. ->  Lord, we have spoken to you today.    Det er så godt at se, at der er nogen, der går op i at passe på naturen. ->  It's nice to see that there are some people who care about nature.    Sådan blev det også i 1973. ->  It was","og efter at Jered havde avlet Enok, levede han 800 År og avlede Sønner og Døtre;","Jared lived after he became the father of Enoch eight hundred years, and became the father of sons and daughters.",15,5,123
"; men den tid blev meget lang og kaldtes ""at være død"".<|endoftext|>","    2. Dansk: ""Jeg har aldrig troet på det, men jeg vil tro det,"" siger han.  Engelsk: ""I never believed it, but I do believe it,"" he said.    3. Dansk: Det er ikke noget, som kan gøres i Danmark.  Engelsk: It is not something that can be done in Denmark.    4. Dansk: Når vi har","og efter at Jered havde avlet Enok, levede han 800 År og avlede Sønner og Døtre;","Jared lived after he became the father of Enoch eight hundred years, and became the father of sons and daughters.",16,5,123
" han kunde kun have været 178 år, ved sin død.
engelsk -> And as he died eleven years later, his son went down","        The Lord Jesus Christ, somesay, the Father of allegories, the Father of allegories, is enoch, for han er enoch, han er enoch.                                                                                ","og efter at Jered havde avlet Enok, levede han 800 År og avlede Sønner og Døtre;","Jared lived after he became the father of Enoch eight hundred years, and became the father of sons and daughters.",17,5,123
" han var avlet af ham, derav navnet; og enoks far var den samme som far til grevinden af Dartmouth.
",                                                                                                                                                                    ,"og efter at Jered havde avlet Enok, levede han 800 År og avlede Sønner og Døtre;","Jared lived after he became the father of Enoch eight hundred years, and became the father of sons and daughters.",18,5,123
" derefter varede de fire ti- og tretti år, saa den næste jæder til han døde, og siden blev han ingen sønner fader.
",.<|endoftext|>,"og efter at Jered havde avlet Enok, levede han 800 År og avlede Sønner og Døtre;","Jared lived after he became the father of Enoch eight hundred years, and became the father of sons and daughters.",19,5,123
 han solgte ham da til oeiseigedommene paa den anden side af elven. Han havde da givet den i arv til sin ældste broder J,.<|endoftext|>,"og efter at Jered havde avlet Enok, levede han 800 År og avlede Sønner og Døtre;","Jared lived after he became the father of Enoch eight hundred years, and became the father of sons and daughters.",20,5,123
 men da han døde kom hans ret i Guds rige kun få år senere. Af dette er det at han efter sin død skulde henrettes som en anden," jared lived one hundred fifty-two years, and became the father of enoch. jared lived one hundred sixty-two years, and became the father of enoch. jared lived one hundred sixty-two years, and became the father of enoch. jared lived one hundred sixty-two years, and became the father of enoch. jared lived one hundred sixty-two years,","og efter at Jered havde avlet Enok, levede han 800 År og avlede Sønner og Døtre;","Jared lived after he became the father of Enoch eight hundred years, and became the father of sons and daughters.",21,5,123
" men på grund av, at kong Karl og hans sønkonge Henrik havde opgivet hans trone, og den nu blev overlatt til ham,","    Mira: Hi, I'm your automated assistant. I can answer your questions about Mormonism.  Kadence: What is the difference between the Mormon Church and other Christian denominations?  Mira: Mormonism The Mormon Church is a Christian denomination founded in 1846 by Mormon missionaries in the United States, which is a world","og efter at Jered havde avlet Enok, levede han 800 År og avlede Sønner og Døtre;","Jared lived after he became the father of Enoch eight hundred years, and became the father of sons and daughters.",22,5,123
" hans datter var søster til kong jomfru Margrete, som døde i 1665; eren var nu en gammel, trofast tjeneste","  13  Enoch, son of David,  the first of the great kings,                                                                                                                              ","og efter at Jered havde avlet Enok, levede han 800 År og avlede Sønner og Døtre;","Jared lived after he became the father of Enoch eight hundred years, and became the father of sons and daughters.",23,5,123
" da han døde, avlede hans svoger Erik enok 23 børn.
80.1 Enok var søn af enkaen","    Mens i en 1808 rapport, den britiske regering og den amerikanske regering, der er enige om, at den britiske regering ikke har ret til at beslaglægge den amerikanske vestkyst, det er blevet sagt, at det er på grund af ""den britiske regering ikke respekterer den amerikanske vestkyst"" og ""den amerikanske regering ikke har nogen forpligtelse til at beskytte ""at","og efter at Jered havde avlet Enok, levede han 800 År og avlede Sønner og Døtre;","Jared lived after he became the father of Enoch eight hundred years, and became the father of sons and daughters.",0,10,123
" men at den nye jord måtte være saa dyb, at det vilde være vanskelig at finde en til at begrave ham, er vel ingen sikker mening.",.  He was the father of enoch.<|endoftext|>,"og efter at Jered havde avlet Enok, levede han 800 År og avlede Sønner og Døtre;","Jared lived after he became the father of Enoch eight hundred years, and became the father of sons and daughters.",1,10,123
" men da ærke-biskoppen lod deri hænge, blef enok henrettet på kongsgaarden for det første. — 8",".  He is also the father of jared lived one hundred sixty-two years, and became the father of enoch.<|endoftext|>","og efter at Jered havde avlet Enok, levede han 800 År og avlede Sønner og Døtre;","Jared lived after he became the father of Enoch eight hundred years, and became the father of sons and daughters.",2,10,123
" det gjorde også hans søster, Mette, som er i slægten. De avlede ogsaa mange avkom. Enok, der fik en datter",.<|endoftext|>,"og efter at Jered havde avlet Enok, levede han 800 År og avlede Sønner og Døtre;","Jared lived after he became the father of Enoch eight hundred years, and became the father of sons and daughters.",3,10,123
" enok var hans søn, søn i første led af enok-dynastiet, der havde været konge siden 1593; i","    14. Norsk: Jeg har ikke lest hele boka.  Engelsk: I didn't read the whole book.    15. Norsk: Vi er stolte af at kunne præsentere vores nye partner.  Engelsk: We are very pleased to announce our new partner.    16. Norsk: Vi vil også i 2018 være en del af ""Den Grønne Kly","og efter at Jered havde avlet Enok, levede han 800 År og avlede Sønner og Døtre;","Jared lived after he became the father of Enoch eight hundred years, and became the father of sons and daughters.",4,10,123
" efterhaanden fik han i de aar eiter sin datter Kagge af Dalen opdragere, som havde sine hjem ved Dalen.","    dansk: Det var en god dag, og vi har alle sammen været meget glade.  engelsk: It was a great day, and we all had a lot to celebrate.    dansk: Så hvad er det, der gør at det er så vigtigt?  engelsk: So what makes it so important?    dansk: Det var den første gang, jeg var i en klub, hvor jeg","og efter at Jered havde avlet Enok, levede han 800 År og avlede Sønner og Døtre;","Jared lived after he became the father of Enoch eight hundred years, and became the father of sons and daughters.",5,10,123
