danish_predicted_output,english_predicted_output,danish_true_label,english_true_label,layer,lambda_amount,bible_verse
" Det var først da man havde renset alt, at man lagde mærke til de nye lag. I 1968 begyndte arbejdet med at lede","  The water, which had been so strong in the beginning, has now become so weak.  It is the same with the water in the sea. The waves have become so strong, that the sea is not able to rise.  The waters have become so strong, that the sea is not able to rise.  The sea has become so strong, that the sea is not able","På den syttende Dag i den syvende Måned sad Arken fast på Ararats Bjerge,","The ship rested in the seventh month, on the seventeenth day of the month, on Ararat's mountains.",1,2,186
" ->
Water took off from the ground rapidly over the next 150 days, and turned away after the 150 days.
", After the end of one hundred fifty days the waters increased. And so the waters were continually reduced.  It was the same in the next generation. After the end of one hundred fifty days the waters increased. After the end of one hundred fifty days the waters increased. And so the waters were continually reduced.  I was standing in the water in the same place. I was standing in,"På den syttende Dag i den syvende Måned sad Arken fast på Ararats Bjerge,","The ship rested in the seventh month, on the seventeenth day of the month, on Ararat's mountains.",2,2,186
"
Det sidste døgn, i slutningen af marts, var der en smule sol på himlen, og om eftermiddagen var der stadig sol. Temperaturen var lidt","  14. svenska: Det är ett ganska enkelt problem, och det är därför som vi har skapat denna webbplats.  engelska: This is a fairly simple problem and that's why we created this site.  15. svenska: En annan fördel med att använda en VPN är att du kan surfa fritt.  engelska: Another advantage of using a VPN is that you can surf","På den syttende Dag i den syvende Måned sad Arken fast på Ararats Bjerge,","The ship rested in the seventh month, on the seventeenth day of the month, on Ararat's mountains.",3,2,186
" Da vandet aftog, og temperaturen faldt en del, blev der udblødt flere gange i det overliggende vand.
Der blev ikke påvist af","    5. Svenska: För övrigt, för att bli av med detta problem, du behöver för att ta bort Adware.  Engelska: For the other hand, to get rid of this problem, you need to remove Adware.    6. Svenska: 1918, i en tid när den stora revolutionen var på väg att komma till Kina, startade en ny","På den syttende Dag i den syvende Måned sad Arken fast på Ararats Bjerge,","The ship rested in the seventh month, on the seventeenth day of the month, on Ararat's mountains.",4,2,186
" I stedet for grundvand tager vand op i atmosfæren, og der sker opslugning af luft.
Siden er blevet opdateret den 1.","    da: Det er det, som er problemet med de andre.  en: That is what is the problem with the others.    da: Det er en god ting, men det er ikke det vigtigste for mig.  en: This is a good thing, but that is not the most important thing for me.    da: I dag er de 30","På den syttende Dag i den syvende Måned sad Arken fast på Ararats Bjerge,","The ship rested in the seventh month, on the seventeenth day of the month, on Ararat's mountains.",5,2,186
.<|endoftext|>,  The earth's water level rose and fell as the waters returned to the sea. Then the waters rose again and the earth became very deep and the waters were very high.  Then the waters returned to the sea and the earth became very deep.  Then the waters returned to the sea and the earth became very deep again.  Then the waters returned to the sea and the earth,"På den syttende Dag i den syvende Måned sad Arken fast på Ararats Bjerge,","The ship rested in the seventh month, on the seventeenth day of the month, on Ararat's mountains.",6,2,186
" Den 7. november faldt sidste dråbe vand, da 10 m 3 vand trængte helt op over jorden og sank til bunds","  22:23 And the waters receded, and the earth rose again.  22:24 And the waters receded again, and the earth rested again.  22:25 And the waters receded again, and the earth rested again.  22:26 And the waters receded again, and the earth","På den syttende Dag i den syvende Måned sad Arken fast på Ararats Bjerge,","The ship rested in the seventh month, on the seventeenth day of the month, on Ararat's mountains.",7,2,186
"
Da vi havde gået en god halv time, begyndte der at stå blod på vejen. Det viste sig at være mudder fra de udvandrede"," The earth rose to the top of the sky, and the earth began to descend. 20. Then the earth began to rise again, and the earth rose to the top of the sky. 21. Then the earth began to rise again, and the earth rose to the top of the sky. 22. Then the earth began to rise again, and the earth","På den syttende Dag i den syvende Måned sad Arken fast på Ararats Bjerge,","The ship rested in the seventh month, on the seventeenth day of the month, on Ararat's mountains.",8,2,186
" Efter 4-5 uger blev grundvandet igen fyldt op. 
Man kan læse at man har forsøgt på at udvinde drikkevandet fra",  11.11.1954                                                                                                                                      ,"På den syttende Dag i den syvende Måned sad Arken fast på Ararats Bjerge,","The ship rested in the seventh month, on the seventeenth day of the month, on Ararat's mountains.",9,2,186
" Som et stort tæppe af vand fulgte det med de 18 huller, som er lagt hen over de øverste 20 år.

","  4.10.1962, p. 15.  4.10.1962, p. 15.  4.10.1962, p. 15.  4.10.1962, p. 15.  4.10.1962","På den syttende Dag i den syvende Måned sad Arken fast på Ararats Bjerge,","The ship rested in the seventh month, on the seventeenth day of the month, on Ararat's mountains.",10,2,186
" Man finder stadig en lille revle i en af søens sidemmelinger, og ved søens udløb ligger et gammelt skib, der ligger og",    da: Der er nyere anmeldelser for Hilton Garden Inn San Antonio Airport  en: There are newer reviews for Hilton Garden Inn San Antonio Airport    da: Og det er ikke kun på grund af dets udseende.  en: And it is not only due to its appearance.    da: Billige flyrejser fra Abilene til San Diego  en: Cheap flights from Abil,"På den syttende Dag i den syvende Måned sad Arken fast på Ararats Bjerge,","The ship rested in the seventh month, on the seventeenth day of the month, on Ararat's mountains.",11,2,186
" Dengang var den danske indsats imod havsnød til støtte for NATOs såkaldte ""Ko-aftale"" med USA, hvor der blev tilbudt materiel",.  english<|endoftext|>,"På den syttende Dag i den syvende Måned sad Arken fast på Ararats Bjerge,","The ship rested in the seventh month, on the seventeenth day of the month, on Ararat's mountains.",12,2,186
" Først et sted, hvor det var en svag vandstrøm, der fra kysten til havbunden drev vand ind over øen. Men med tiden udviklede den sig","  The waters were still in the sea, but the waters were falling, and the waters were falling in all directions.  13:33 The waters were falling from the sky, and the waters were rising from the sea.  The waters were rising from the sea, and the waters were falling from the sky.  13:34 The waters were falling from the sky","På den syttende Dag i den syvende Måned sad Arken fast på Ararats Bjerge,","The ship rested in the seventh month, on the seventeenth day of the month, on Ararat's mountains.",13,2,186
" Men da vi havde nået enden af vores tidszone, og da vi havde nået punktet, hvor der pludselig var fugtigt, så steg temperaturen igen,"," and then the earth receded from the earth.  14  The Earth  15  The earth was like a sea of water.  16  The earth was like a sea of water;  17  It was like a sea of water,  18  And it was like a sea of water;  19  And it was like a sea","På den syttende Dag i den syvende Måned sad Arken fast på Ararats Bjerge,","The ship rested in the seventh month, on the seventeenth day of the month, on Ararat's mountains.",14,2,186
"
En masse sten og jord faldt under os, vandet sprang i vandløb, og der var en masse steder hvor vi syntes at der kun kunne blive",. In the same way the earth gradually began to recede from the earth.<|endoftext|>,"På den syttende Dag i den syvende Måned sad Arken fast på Ararats Bjerge,","The ship rested in the seventh month, on the seventeenth day of the month, on Ararat's mountains.",15,2,186
"

- En dag gik det op for mig, at hvis jeg var kommet ud til en anden ø, havde jeg måske ikke fået mulighed for at"," The earth receded from the sky.    A:    This is a great example of the concept of the ""dissolution of the shell"". The Earth has a massless shell around it, but it is not a solid one, as we can see from the chart below. This is a clear example of how the Earth is not a solid shell, but a liquid","På den syttende Dag i den syvende Måned sad Arken fast på Ararats Bjerge,","The ship rested in the seventh month, on the seventeenth day of the month, on Ararat's mountains.",16,2,186
" Hvis det er tilfældet, vil der altid være en vis risiko ved dette, og du skal være forsigtig, hvis du sætter dig til bord med varmt"," and the earth rested. 21 And they were in the midst of the sea. And they were on the land of Egypt, and in the land of Assyria, and in the land of Babylon. 22 And the LORD God of hosts said to Moses, Behold, I have brought you to this land, that ye may dwell there, that","På den syttende Dag i den syvende Måned sad Arken fast på Ararats Bjerge,","The ship rested in the seventh month, on the seventeenth day of the month, on Ararat's mountains.",17,2,186
"
Der var et par små dråber, der fløj ned af himlen. Drengen, der var stået op, var ret lille, men hans",".    A:    In the context of the question, it's quite clear that the answer is the answer to the question.  In the context of the question, the answer is the answer to the question.  So, the answer is:    The waters receded from the earth continually.    <|endoftext|>","På den syttende Dag i den syvende Måned sad Arken fast på Ararats Bjerge,","The ship rested in the seventh month, on the seventeenth day of the month, on Ararat's mountains.",18,2,186
"
På den ene side af vejen på venstre skulder, som går mellem rundkørslen og det lille stykke landevej, og lidt inde på landet"," and the waters were the same. the waters receded from the earth continually. the waters receded from the earth continually. the waters receded from the earth continually. the waters receded from the earth continually. the waters receded from the earth continually.    ""And when they had finished, the waters were the same, and the earth receded","På den syttende Dag i den syvende Måned sad Arken fast på Ararats Bjerge,","The ship rested in the seventh month, on the seventeenth day of the month, on Ararat's mountains.",19,2,186
 Den 10. november havde min kæreste og jeg set et kæmpe pludseligt lyn med en utrolig lysstyrke på mindst 1 million gange,"  ""The waters of the sea were still rising, but the earth was moving onward.""  ""There was a great storm, but it was not violent.""  ""The earth was moving onward.""  ""The waters of the sea were still rising, but the earth was moving onward.""  ""The earth was moving onward.""  ""The waters of the sea were","På den syttende Dag i den syvende Måned sad Arken fast på Ararats Bjerge,","The ship rested in the seventh month, on the seventeenth day of the month, on Ararat's mountains.",20,2,186
"
Indsendt af Frk. Anemone kl. mandag, december 06, 2008 Ingen kommentarer:
En uge",.<|endoftext|>,"På den syttende Dag i den syvende Måned sad Arken fast på Ararats Bjerge,","The ship rested in the seventh month, on the seventeenth day of the month, on Ararat's mountains.",21,2,186
" 
Hvor mange gange er vi kommet på tværs af isen, og hvor lang tid har vi ventet på at isen falder af igen? Den danske is",    swedish: Att se nära Santa Cruz de la Sierra:  english: Things to See near Santa Cruz de la Sierra:    swedish: Att se nära Le Mesnil-Avignon:  english: Things to See near Saint-Sauveur-du-Blanc:    swedish: Se hotell vid Chess Hill på en karta  ,"På den syttende Dag i den syvende Måned sad Arken fast på Ararats Bjerge,","The ship rested in the seventh month, on the seventeenth day of the month, on Ararat's mountains.",22,2,186
" De to arter lever lidt adskilt i området, men så vidt man endnu ved er den ene af havskildpadder meget sjælden, mens den",.    satisfied<|endoftext|>,"På den syttende Dag i den syvende Måned sad Arken fast på Ararats Bjerge,","The ship rested in the seventh month, on the seventeenth day of the month, on Ararat's mountains.",23,2,186
" Der var dog ikke megen varme tilbage i jorden, men den var alligevel varmere det første døgn; temperaturen lå på 29 grader, og vandet er","    ""Now the earth is a great land, and the earth is a great sea. The sea is the sea, and the earth is the earth. The earth is a great sea, and the earth is a great land.""    ""When the earth is a great land, the sea is a great sea, and the land is a great land. When the land is a","På den syttende Dag i den syvende Måned sad Arken fast på Ararats Bjerge,","The ship rested in the seventh month, on the seventeenth day of the month, on Ararat's mountains.",0,5,186
" Den 25. august havde det stået 111,5 grader på termometeret på Oksbøl Station, og det var de", and they were like a fountain of water that had not dried up.  Six hundred and twenty-four  (Greece)  And the waters receded from the earth continually. after the end of one hundred fifty days the waters decreased. and they were like a fountain of water that had not dried up.  (Greece)  And the waters,"På den syttende Dag i den syvende Måned sad Arken fast på Ararats Bjerge,","The ship rested in the seventh month, on the seventeenth day of the month, on Ararat's mountains.",1,5,186
" Om aftenen var der mørkt inde i jorden, vandet kom ikke op igen.
Det var for koldt at gå i vandet. Vandet var ikke koldt", after the end of a hundred fifty days the waters increased. after the end of a hundred fifty days the waters decreased. after the end of a hundred fifty days the waters increased. after the end of a hundred fifty days the waters decreased. after the end of a hundred fifty days the waters decreased. after the end of a hundred fifty days the waters decreased. after the end of a hundred,"På den syttende Dag i den syvende Måned sad Arken fast på Ararats Bjerge,","The ship rested in the seventh month, on the seventeenth day of the month, on Ararat's mountains.",2,5,186
"

Men den var jo for fuld til at kunne stå der. Så for at få den lille sorte til at stå i ro og ikke fare i","  During the twenty-four-hour period, the waters rose in the upper reaches of the streams and the ground. At the same time, the waters declined in the lower reaches of the streams and the ground. The water was gradually increased in the upper reaches of the streams and the ground. The waters of the river rose in the upper reaches of the streams and the ground. The","På den syttende Dag i den syvende Måned sad Arken fast på Ararats Bjerge,","The ship rested in the seventh month, on the seventeenth day of the month, on Ararat's mountains.",3,5,186
"
Måne og sol - sol, men ikke så højt.
Omkring kl. 12 - 13 var der kun den mindste","    7. norsk: Den er ikke på grunn av deres synd.  engelsk: It is not because of their sins.    8. norsk: Dette er den mest utbredte formen for demens.  engelsk: This is the most common form of dementia.    9. norsk: Det er så mange gode råd, og det er så vanskelig.  engelsk: There","På den syttende Dag i den syvende Måned sad Arken fast på Ararats Bjerge,","The ship rested in the seventh month, on the seventeenth day of the month, on Ararat's mountains.",4,5,186
" Ved samme tidspunkt var der blevet dannet en ny skive af kviksølv (kviksølv og kh), som bl.a.. har vist"," The waters of the sea were receding. The water of the earth was receding. And when the waters receded, the earth was receding. And when the waters receded, the earth was receding. And when the waters receded, the earth was receding. And when the waters receded, the earth was reced","På den syttende Dag i den syvende Måned sad Arken fast på Ararats Bjerge,","The ship rested in the seventh month, on the seventeenth day of the month, on Ararat's mountains.",5,5,186
"
Da alle havde fået deres vand, var der nu to ting der ville tage af på det nærmeste for dem alle. Og det var deres mad og",.<|endoftext|>,"På den syttende Dag i den syvende Måned sad Arken fast på Ararats Bjerge,","The ship rested in the seventh month, on the seventeenth day of the month, on Ararat's mountains.",6,5,186
"
Der var en anden af os, som havde set det før:
-Så kom der jo ikke noget vand mere!
""Javel men"," The earth was now at rest.  5. The sun gik ned, og der var ingen stjerner i himlen.  6. The sun went down and there were no stars in the sky.  7. The sun went down and there were no stars in the sky.  8. The sun went down and there were no stars in the sky.  9. The sun went down","På den syttende Dag i den syvende Måned sad Arken fast på Ararats Bjerge,","The ship rested in the seventh month, on the seventeenth day of the month, on Ararat's mountains.",7,5,186
" Den 13. januar havde vandet igen klaret sig rimeligt, men dog lidt for godt, til at kunne komme i kontakt med grundvandet,",  11. Dansk: De er alle i overensstemmelse med deres formål og kan være en god investering.  Engelsk: All of them are in line with their goals and may be a good investment.  12. Dansk: De to andre blev anholdt og sigtet for at have hjulpet til med at planlægge terrorangrebet.  Engelsk: The other two were arrested and charged with,"På den syttende Dag i den syvende Måned sad Arken fast på Ararats Bjerge,","The ship rested in the seventh month, on the seventeenth day of the month, on Ararat's mountains.",8,5,186
" Herved var vandstanden nu på 13 m under havoverfladen.

Pas på! Sådan en har jeg også 1",.     <|endoftext|>,"På den syttende Dag i den syvende Måned sad Arken fast på Ararats Bjerge,","The ship rested in the seventh month, on the seventeenth day of the month, on Ararat's mountains.",9,5,186
" 16
18 Dette område kaldes også grundvandskassen, og et grundvandskort viser på denne måde, hvor der bor grundvand.",  Such is the power of the Holy Spirit to preserve the earth.  161.  162.  163.  164.  165.  166.  167.  168.  169.  170.  171.  172.  17,"På den syttende Dag i den syvende Måned sad Arken fast på Ararats Bjerge,","The ship rested in the seventh month, on the seventeenth day of the month, on Ararat's mountains.",10,5,186
" Derfor blev der kørt en lang række meter land på øen. Hele vejen var der mange små søer og vanddamme, og da der var bygget",.<|endoftext|>,"På den syttende Dag i den syvende Måned sad Arken fast på Ararats Bjerge,","The ship rested in the seventh month, on the seventeenth day of the month, on Ararat's mountains.",11,5,186
" Efterhånden blev en flot slange, måske en 60-80 cm høj og grøn med et kraftigt farvandskab, og det stod",  4. The water of the sea receded from the earth.  5. The waters receded from the earth.  6. The waters receded from the earth.  7. The waters receded from the earth.  8. The waters receded from the earth.  9. The waters receded from the earth.  10,"På den syttende Dag i den syvende Måned sad Arken fast på Ararats Bjerge,","The ship rested in the seventh month, on the seventeenth day of the month, on Ararat's mountains.",12,5,186
"
Der var jo ikke noget med at slå op, efter at der var gået et par timer. Så jeg fortsatte bare derudaf. Til trods","    I think the explanation is a bit more complex than that.     In the end, the water level will remain the same, as long as the earth continues to move.      EDIT: Also, the water level can only decrease after the Earth has ceased to move. So it's more accurate to say that the level will stay the same, as long as","På den syttende Dag i den syvende Måned sad Arken fast på Ararats Bjerge,","The ship rested in the seventh month, on the seventeenth day of the month, on Ararat's mountains.",13,5,186
" Her blev det så koldt, at der ikke kunne drikkes i en hede, og det har altså taget tid for de nu så forhærdede",".    A:    The answer is the following:    During the winter months, the waters receded from the earth continuously.    <|endoftext|>","På den syttende Dag i den syvende Måned sad Arken fast på Ararats Bjerge,","The ship rested in the seventh month, on the seventeenth day of the month, on Ararat's mountains.",14,5,186
" Når vandet endelig bliver til vand, siver det, det bliver til vand og der bliver til noget, der måske ikke kan blive til vand eller andet","    3. Dansk: Jeg vil ikke anbefale dig at bruge en gratis VPN.  Engelsk: I wouldn't recommend you to use a free VPN.    4. Dansk: Jeg har været i Frankrig, i Italien, i England, i Belgien, i Tyskland og Belgien, hvor jeg mødte en fransk kvinde.  Engelsk: I have been in France, in Italy, in","På den syttende Dag i den syvende Måned sad Arken fast på Ararats Bjerge,","The ship rested in the seventh month, on the seventeenth day of the month, on Ararat's mountains.",15,5,186
"
En anden grund er, at der kom mere regn og at vandstanden i de fleste boringer steg, og så var der et lille fald i",  6.40. 50. 60. 70. 80. 90. 100. 110. 120. 130. 140. 150. 160. 170. 180. 190. 2,"På den syttende Dag i den syvende Måned sad Arken fast på Ararats Bjerge,","The ship rested in the seventh month, on the seventeenth day of the month, on Ararat's mountains.",16,5,186
" Så vandet i bruseniche i badekarret holdt op med at cirkulere. Jeg synes at man som forældre har en pligt at sige fra, når",.<|endoftext|>,"På den syttende Dag i den syvende Måned sad Arken fast på Ararats Bjerge,","The ship rested in the seventh month, on the seventeenth day of the month, on Ararat's mountains.",17,5,186
"
– Det var meget varmt, men det blev ikke rigtig koldt.
Efter en del regn er der kommet mere vand op på det sted, det","  Søren: Are der nogen beviser for dette?  Tommy: The term ""Praia do Porto"" betyder ""Portens klippepidser"".  Søren: Are der andre steder, hvor det kan bruges?  Tommy: På portugisisk kaldes det for ""Praia do Porto"".  Søren: Hvordan er klimaet i denne del af landet?  ","På den syttende Dag i den syvende Måned sad Arken fast på Ararats Bjerge,","The ship rested in the seventh month, on the seventeenth day of the month, on Ararat's mountains.",18,5,186
" De sidste kilometer ind mod kanten af landet var vandet næsten rent, men der hang masser af vand i bunden af åen.
Det samme gjorde det",                                                                                                                                                            ,"På den syttende Dag i den syvende Måned sad Arken fast på Ararats Bjerge,","The ship rested in the seventh month, on the seventeenth day of the month, on Ararat's mountains.",19,5,186
"
De fleste ved den engelske streg, som er placeret inde i jorden. De andre navne ligger på et mere avanceret niveau, end den engelske","    Ifølge en undersøgelse, som er blevet publiceret i tidsskriftet 'Cook & Boarding', har det ikke været muligt at isolere en enkelt årsag til at vandmængden er blevet reduceret. ->  According to a study, published in the journal 'Cook & Boarding', it was not possible to isolate a single cause of the reduction of the volume of","På den syttende Dag i den syvende Måned sad Arken fast på Ararats Bjerge,","The ship rested in the seventh month, on the seventeenth day of the month, on Ararat's mountains.",20,5,186
"
Med den nye 155 x 350 l vandpresse i marken kan man godt tage den mindre del af det samlede vand","    10. dansk: Det har jeg aldrig haft problemer med.  engelsk: I have never had any problems with it.    11. dansk: Vi har brug for mere, ikke mindre.  engelsk: We need more, not less.    12. dansk: Jeg vil gerne have en ny, men hvad?  engelsk: I want to have a","På den syttende Dag i den syvende Måned sad Arken fast på Ararats Bjerge,","The ship rested in the seventh month, on the seventeenth day of the month, on Ararat's mountains.",21,5,186
". Det er godt og smukt, men det er også voldsomt koldt.<|endoftext|>","  10. Dansk: Og så er der selvfølgelig de store tal.  Engelsk: Then there are the big numbers.  11. Dansk: Jeg ved, hvad jeg skal gøre for at gøre det.  Engelsk: I know what I'll have to do to make it.  12. Dansk: Så jeg vil ikke anbefale at gå ind i den.  Engelsk","På den syttende Dag i den syvende Måned sad Arken fast på Ararats Bjerge,","The ship rested in the seventh month, on the seventeenth day of the month, on Ararat's mountains.",22,5,186
"
Forløbet blev også hurtigt et mareridt og i januar 1944 var vi nødsaget til at søge nødstedte i Holland"," But I have heard that the Lord was so great in his wrath that he forsook the whole earth, and forsook all the sea, and forsook all the air, and forsook the sea and all the air, and forsook all the heavens and all the earth, and forsook all the seas, and all the air, and forsook all the heavens and","På den syttende Dag i den syvende Måned sad Arken fast på Ararats Bjerge,","The ship rested in the seventh month, on the seventeenth day of the month, on Ararat's mountains.",23,5,186
