danish_predicted_output,english_predicted_output,danish_true_label,english_true_label,layer,lambda_amount,bible_verse
"
Svenska: De lär sig inte att de vill dö, och de slutar leva.
Danska: De lærer ikke at dø, og de slutter","  6. ""Vi tror på, at de bedste løsninger findes i samarbejde med vores kunder. -> ""We believe the best solutions are found in collaboration with our customers.  7. De er ikke blevet testet for bivirkninger eller negative virkninger. -> They have not been tested for side effects or negative effects.  8. Du kan også tage en dagstur til den nærliggende Cape","Og de var begge nøgne, både Adam og hans Hustru, men de bluedes ikke.","They were both naked, the man and his wife, and were not ashamed.",10,5,54
.<|endoftext|>,".  19. Det var en stor forandring, og jeg er meget glad for, at vi har gjort det. ->  It was a big change and I am very happy that we have done so.  20. I dag er han i 100 % sikkerhed. ->  He is now in 100 percent certainty.<|endoftext|>","Og de var begge nøgne, både Adam og hans Hustru, men de bluedes ikke.","They were both naked, the man and his wife, and were not ashamed.",11,5,54
" Det giver ingen mening; men hvorfor har det så ikke også kunnet ske hos mennesker, der tror eller har levet, at eet individ, der er","    15:15 Og han sa til dem: Ta med eder de hellige skrifter og drikk dem. ->  15:15 And he said to them, Take ye the holy Scriptures with you, and drink them.    I en studie ble det observert en reduksjon i vektøkning etter 16 uker med behandling. ->  In a study","Og de var begge nøgne, både Adam og hans Hustru, men de bluedes ikke.","They were both naked, the man and his wife, and were not ashamed.",12,5,54
.<|endoftext|>,.  Norsk:  Da skal en mann forlate sin far og sin mor og bli sammen med sin hustru og de skal være ett kjød.<|endoftext|>,"Og de var begge nøgne, både Adam og hans Hustru, men de bluedes ikke.","They were both naked, the man and his wife, and were not ashamed.",13,5,54
.<|endoftext|>,"  I. 5.34  5.34 Og jeg vil, at du skal vide, at jeg elsker dig højt, og at jeg elsker dig højt, for jeg har elsket dig og været dig tro.  I. 5.35  5.35 Og jeg vil, at du skal vide, at jeg elsker dig højt, og at","Og de var begge nøgne, både Adam og hans Hustru, men de bluedes ikke.","They were both naked, the man and his wife, and were not ashamed.",14,5,54
"
Dansk
Daphna och Doron: Döden från den döda, Döden från den döda, Döden från den döda.
Svensk","  12. Og det er en god ide at overveje. ->  It is a good idea to think about it.  13. Jeg har altid drømt om at bo i et hus. ->  I always wanted to live in a house.  14. Der er 1300 mennesker, der har meldt sig. ->  There were ","Og de var begge nøgne, både Adam og hans Hustru, men de bluedes ikke.","They were both naked, the man and his wife, and were not ashamed.",15,5,54
" (Es 54,1-3)
Mine børn har ikke min Søn, men er i kraft af dig. De er blevet mine",".  5.3.133 Og vi vil, når vi taler med ham, tale med dem, der har magt over det hele, og med dem, der har magten over hele Guds rige, og med dem, der har magten over hele jorden.<|endoftext|>","Og de var begge nøgne, både Adam og hans Hustru, men de bluedes ikke.","They were both naked, the man and his wife, and were not ashamed.",16,5,54
" ->
Men når en sådan person forlater en mann sin far og mor og holder seg til sin hustru, er de to blitt ett kjøtt.

",".  18:11-14 Og nu, når du har fået din Far og din Mor og din Hustru, skal I være ét kød.<|endoftext|>","Og de var begge nøgne, både Adam og hans Hustru, men de bluedes ikke.","They were both naked, the man and his wife, and were not ashamed.",17,5,54
".
Thus, one who leaves his father and his mother and resumes living with a woman finds himself as one flesh.<|endoftext|>",".  4:11 Og hvis en mand forlader sin far og sin mor, og han går sammen med sin kone, så er de ét kød.<|endoftext|>","Og de var begge nøgne, både Adam og hans Hustru, men de bluedes ikke.","They were both naked, the man and his wife, and were not ashamed.",18,5,54
"
Having come off a relationship with a father or mother, one is removed from the body and left with no food or clothing and is left as",".  24:21 Og så vil jeg sige til jer: Når man har givet sin fader og sin moder til hustru, skal man blive ét kød.<|endoftext|>","Og de var begge nøgne, både Adam og hans Hustru, men de bluedes ikke.","They were both naked, the man and his wife, and were not ashamed.",19,5,54
" Den ene må blive ved med at være, men den anden må forelske sig i den anden. Denne er, af den, der finder, ham",      17. 16:23-24; 17:3; 18:30-31.      17:24. 18:30-31.      18:22-24.      18:30. 18,"Og de var begge nøgne, både Adam og hans Hustru, men de bluedes ikke.","They were both naked, the man and his wife, and were not ashamed.",20,5,54
" Dette medfører, at den menneskelige karakter forringes, for den opfatter ikke længere sig selv.
Teksten er inspireret af den græske",.<|endoftext|>,"Og de var begge nøgne, både Adam og hans Hustru, men de bluedes ikke.","They were both naked, the man and his wife, and were not ashamed.",21,5,54
" -> One of these two is an unmarried woman.When she leaves a man his father and mother, and holds on to his wife, and",.<|endoftext|>,"Og de var begge nøgne, både Adam og hans Hustru, men de bluedes ikke.","They were both naked, the man and his wife, and were not ashamed.",22,5,54
"
The same is true of the people, which, as God is their father and mother-in-law, they have to adhere to their",.<|endoftext|>,"Og de var begge nøgne, både Adam og hans Hustru, men de bluedes ikke.","They were both naked, the man and his wife, and were not ashamed.",23,5,54
" I de lande, hvor der ikke findes en familie, bliver det afbrudt af en anden mand, som for en tid har overtaget faderens stilling"," And I am the husband, and they are the wives. And he will be one flesh, and they will be one flesh. And I am the wife, and they are the wives. And he will be one flesh, and they will be one flesh. And I am the wife, and they are the wives. And he will be one flesh, and they will be","Og de var begge nøgne, både Adam og hans Hustru, men de bluedes ikke.","They were both naked, the man and his wife, and were not ashamed.",0,10,54
.<|endoftext|>,.<|endoftext|>,"Og de var begge nøgne, både Adam og hans Hustru, men de bluedes ikke.","They were both naked, the man and his wife, and were not ashamed.",1,10,54
"
Det är inte så att Gud inte har en plan för ditt och mitt liv, att han är så snäll i sig själv att det inte finns något"," 1988, pp. 463-464.  This book is the first book by the author of the book ""I can't live without you"". The book was published in 19888, in the United States. 19889, in the United Kingdom. 1989, in","Og de var begge nøgne, både Adam og hans Hustru, men de bluedes ikke.","They were both naked, the man and his wife, and were not ashamed.",2,10,54
"
LÆS OGSÅ: »Utroskab er en forbrydelse, der rammer alle«
For to år siden fik den danske popgruppe 'R","  But this is not the case.  For if thou hast not had this life, thou hast not been, nor have I been, nor have I been, nor have I been, nor have I been, nor have I been, nor have I been, nor have I been, nor have I been, nor have I been, nor have I been, nor have","Og de var begge nøgne, både Adam og hans Hustru, men de bluedes ikke.","They were both naked, the man and his wife, and were not ashamed.",3,10,54
" Når I ser på en mand med den samme hustru som I har, som med hver deres datter, hvad vil I finde da?"" på Engelsk?
",".  6:28 Således vil en mand forlade sin far og sin mor, og vil slutte sig til sin kone, og de vil være ét kød.<|endoftext|>","Og de var begge nøgne, både Adam og hans Hustru, men de bluedes ikke.","They were both naked, the man and his wife, and were not ashamed.",4,10,54
"
Engelsk: 09.20.75 When the child is seventeen years old, but still not well, he comes in with",".  14:15 Men en mann vil forlate sin far og sin mor, og vil slutte sig til sin hustru, og de vil være ett kjød.<|endoftext|>","Og de var begge nøgne, både Adam og hans Hustru, men de bluedes ikke.","They were both naked, the man and his wife, and were not ashamed.",5,10,54
"
12:7 Men dersom han holder en hustru, så lar han henne forbli hos sin far og moder, og de blir et legeme","  31:16 And it shall be said to him that he shall have son and dotter, and son and dotter, and son, and son, and son, and son. 31:17 And if he shall have son, or dotter, or son, or son, or son, or son, or son, or son, or son,","Og de var begge nøgne, både Adam og hans Hustru, men de bluedes ikke.","They were both naked, the man and his wife, and were not ashamed.",6,10,54
.<|endoftext|>,.<|endoftext|>,"Og de var begge nøgne, både Adam og hans Hustru, men de bluedes ikke.","They were both naked, the man and his wife, and were not ashamed.",7,10,54
"
It is as if the flesh is transformed by virtue of its relationship with God. -> Den forvandling, der finder sted, er en omvendelse",      Luke 1:32; 2:40.      Luke 1:40.      Luke 1:41.      Luke 1:42.      Luke 1:43.      Luke 1:44.      ,"Og de var begge nøgne, både Adam og hans Hustru, men de bluedes ikke.","They were both naked, the man and his wife, and were not ashamed.",8,10,54
" — (1 Mosebog 24: 20).
Der er ikke noget i vejen med, at en kvinde føder sit barn og lader"," The two will become one flesh, and they will be one flesh, and they will be one flesh. They will have one flesh.    The two will be one flesh.    The woman will become pregnant.    The woman will become pregnant.    The woman will become pregnant.    The woman will become pregnant.    The woman will become pregnant","Og de var begge nøgne, både Adam og hans Hustru, men de bluedes ikke.","They were both naked, the man and his wife, and were not ashamed.",9,10,54
" ->
The Loke said, ""Let go one of your sons and let go one of your daughters and let go one of your sons and let","  Norsk: I virkeligheten vil en mann forlate sin far og sin mor, og vil slutte seg til med sin kone, og de vil være et kjød.  Engelsk: The only thing that's changed is the name.  Norsk: Det eneste som har forandret sig er navnet.  Engelsk: The best place to get your haircut is in a salon.","Og de var begge nøgne, både Adam og hans Hustru, men de bluedes ikke.","They were both naked, the man and his wife, and were not ashamed.",10,10,54
" -> For they depart from among the Gentiles, by their fathers and mothers, and remain with one another; they bear in one flesh one another:","  Svenska: Men hvis du er en mand, vil du forlade din far og din mor og gå sammen med din hustru og være ét kød.    Danska: Det er ikke nødvendigt at bruge en langsom browser, du kan bruge den hurtigste.  Svenska: Det er ikke nødvendigt at bruge en langsom browser, du kan bruge den hurtigste.    ","Og de var begge nøgne, både Adam og hans Hustru, men de bluedes ikke.","They were both naked, the man and his wife, and were not ashamed.",11,10,54
"
Svenska: Då lämnar en man sin fader och moder och håller sig till sin hustru, och de två blir ett kött.

Danska:","  16:16: ""I am with him, he is with me, but I will not be with him. I will not be with him, because he has a father, but I will not be with him.  16:16: ""If he is with me, I will be with him. I will not be with him. He","Og de var begge nøgne, både Adam og hans Hustru, men de bluedes ikke.","They were both naked, the man and his wife, and were not ashamed.",12,10,54
" -> dansk
110:4.7 (1395.8) Then Jesus said to them, ""If a man leaves his",.<|endoftext|>,"Og de var begge nøgne, både Adam og hans Hustru, men de bluedes ikke.","They were both naked, the man and his wife, and were not ashamed.",13,10,54
 1-10. 11. 12. 13. 14. 15. 16.,  9. dansk: 520000000000000000000000000000000000000000000000000000000000000000000,"Og de var begge nøgne, både Adam og hans Hustru, men de bluedes ikke.","They were both naked, the man and his wife, and were not ashamed.",14,10,54
" ->
English
15:17 Efter at Abraham hadde forlatt sin fader og Moder og holdt sig til sin Frue og blev et K","  16.  Og det er lige netop, hvad den kristne kirke har gjort. ->  Og det er netop, hvad den kristne kirke har gjort.  17. I den forbindelse er det nødvendigt at være opmærksom på, at du også kan bruge en af disse. ->  I denne forbindelse er det nødvendigt at være opmærksom på, at du også kan bruge en","Og de var begge nøgne, både Adam og hans Hustru, men de bluedes ikke.","They were both naked, the man and his wife, and were not ashamed.",15,10,54
.<|endoftext|>,  8. 11. 12. 13. 14. 15. 16. 17. 18. 19. 20. 21. 22. 23. 24. 25. 26. 27. 28.,"Og de var begge nøgne, både Adam og hans Hustru, men de bluedes ikke.","They were both naked, the man and his wife, and were not ashamed.",16,10,54
" Det er jo ikke nogen særlig smuk tanke, og den er heller ikke særlig sød.
18. juni 2019 at 1",".  Ogsaa for denne aandelige Verden vil et Menneske forlade sin Fader og sin Moder, og han vil gå sammen med sin Hustru og blive ét Kød.<|endoftext|>","Og de var begge nøgne, både Adam og hans Hustru, men de bluedes ikke.","They were both naked, the man and his wife, and were not ashamed.",17,10,54
". ->
Dansk<|endoftext|>",                                                                                                                                                      ,"Og de var begge nøgne, både Adam og hans Hustru, men de bluedes ikke.","They were both naked, the man and his wife, and were not ashamed.",18,10,54
" 24:21 – 29.

I Bibelen er det altså et stort spørgsmål, hvordan man forholder sig til det faktum,",.<|endoftext|>,"Og de var begge nøgne, både Adam og hans Hustru, men de bluedes ikke.","They were both naked, the man and his wife, and were not ashamed.",19,10,54
" Men de lever i paradis, og de må ikke røre hans hus, der er fuld af lertøj. Men den anden mand skal sætte sig om",".  6 Da skal man, når man har taget imod den, ikke tage sin mand eller sin moder til sig og skal man være to k sæd.<|endoftext|>","Og de var begge nøgne, både Adam og hans Hustru, men de bluedes ikke.","They were both naked, the man and his wife, and were not ashamed.",20,10,54
".
Dansk<|endoftext|>","  5. Den første ting, du skal tænke på, er, at der ikke er nogen tvivl om, at dette er et job, der er lige for dig. ->  The first thing you should think of is, there's no doubt at all, this is a job for you.  6. Det kan også være et spørgsmål om at tage en beslutning om","Og de var begge nøgne, både Adam og hans Hustru, men de bluedes ikke.","They were both naked, the man and his wife, and were not ashamed.",21,10,54
"
11. Engelsk: You won the lottery and got the car.
Dansk: Du har vundet i Lotto, så du har din bil"," 12For God is god, god for the living, god for the dead, god for the living. 13But God, god for the living, god for the dead, god for the living, god for the dead, god for the living, God for the living, God for the dead, God for the living, God for the living, God","Og de var begge nøgne, både Adam og hans Hustru, men de bluedes ikke.","They were both naked, the man and his wife, and were not ashamed.",22,10,54
" I dette tilfælde kan en mands seksualitet ikke sammenlignes med en kvindes køn, og det samme gælder kærlighed.
Den mandlige libido er en naturlig",.<|endoftext|>,"Og de var begge nøgne, både Adam og hans Hustru, men de bluedes ikke.","They were both naked, the man and his wife, and were not ashamed.",23,10,54
" Men en dag, da Jesus var fortabt på et vildmandsmål ved Samaria, stod en engel og kaldte på ham, og Jesus","  Hvilken he he he, he he he, he he he, he he he he, he he he he, he he he he he, he he he he he, he he he he he, he he he he he, he he he he, he he he he, he he he, he, he he, he, he, he, he","Og de var begge nøgne, både Adam og hans Hustru, men de bluedes ikke.","They were both naked, the man and his wife, and were not ashamed.",0,15,54
" I oldkirken er det, som kaldes et ""kongeatlas"", og derfor er det, man ved, hvad de enkelte kondottiere","    Icelandic: Maður verður að fara með faðir sínum og móður, og hann mun vera eitt lík.    English: Maður verður að fara með faðir sínum og móður sinni, og hann mun vera eitt lík.  Icelandic: Ég er ekki að fara með föður mínum.  English: Ég er ekki að fara međ  Swedish:","Og de var begge nøgne, både Adam og hans Hustru, men de bluedes ikke.","They were both naked, the man and his wife, and were not ashamed.",1,15,54
"
dansk
25And he that saith to the other, ""You were a father for all things you have done, not only to me",                                                                                                                                                      ,"Og de var begge nøgne, både Adam og hans Hustru, men de bluedes ikke.","They were both naked, the man and his wife, and were not ashamed.",2,15,54
"
3.1 And the men of God answered and said, Is this man a man in whom the law of God is fulfilled? ->
3"," Ogsaa hans fader og hans moder will leave hans fader, og hans moder. Ogsaa hans fader og hans moder will leave hans fader, og hans moder. Ogsaa hans fader og hans mother will leave hans fader, og hans mother. Ogsaa hans fader og hans mother will leave hans fader, og hans mother. Ogsaa hans fader og hans mother will leave hans fader","Og de var begge nøgne, både Adam og hans Hustru, men de bluedes ikke.","They were both naked, the man and his wife, and were not ashamed.",3,15,54
"
Således kan man inddele kvindens arbejde under følgende afsnit:
En ugift kvindes afkom (det mandlige køn er nemlig repræsenteret af","    The man will come into the kingdom of the Lord, and he will be one flesh. ->  Mennesket skal komme til Herren og blive ét kød.    And he has a daughter. ->  And he has a daughter.    In the same way, we are not a people who are bound by any laws or customs. ->  På samme","Og de var begge nøgne, både Adam og hans Hustru, men de bluedes ikke.","They were both naked, the man and his wife, and were not ashamed.",4,15,54
"
102. I den første og anden person er den fremmede kvinde eller mand en ubekymret, velafbalanceret og behagelig kvinde","    Danish: De er alle sammen veldig morsomme å lage!  English: They are all so funny to make!    Norwegian: De 10 beste hotellene i nærheten av Piazza Navona - TripAdvisor  English: The 10 Best Hotels Near Piazza Navona, Rome - TripAdvisor    Norwegian: I tillegg er det en 2","Og de var begge nøgne, både Adam og hans Hustru, men de bluedes ikke.","They were both naked, the man and his wife, and were not ashamed.",5,15,54
 Således er ægteskabet baseret på at han ene leder sit folk. Dermed har kirken til dels gjort det muligt at få en mand til at blive gift med,  4.12  13  14  15  26  37  48  59  61  70  81  91  10  11  12  13  14  15  16  27  38  49  50  61  ,"Og de var begge nøgne, både Adam og hans Hustru, men de bluedes ikke.","They were both naked, the man and his wife, and were not ashamed.",6,15,54
" -> Det kommer sig av att den människan lämnar sin fader och moder och förblir en man och blir till ett kött.
Lad os nu se,","    1. Det er meget let at bruge, og du kan indstille dit eget tidssignal. ->  Det er meget let at bruge, og du kan indstille din egen tidsstempling.    2. 4.1.1.1.1.1.2.1.1.1.2.2.2.3.4.","Og de var begge nøgne, både Adam og hans Hustru, men de bluedes ikke.","They were both naked, the man and his wife, and were not ashamed.",7,15,54
". Det er det, som bliver det nye liv i Kristus.<|endoftext|>","    31:34 Þá mun Guð fyrirgefa þeim, sem eru í ættkvíslinni, og þeir munu vera eins og lamb í ættkvíslinni. ->  31:34 God will forgive those who are in the family, and they will be like lambs in the family.    31:34 Hann skal","Og de var begge nøgne, både Adam og hans Hustru, men de bluedes ikke.","They were both naked, the man and his wife, and were not ashamed.",8,15,54
" -> A son leaves his parent and mother and stays with his wife until he is a one-off, leaving the two a single flesh creature.
","    I'm lidt træt af, at det er den første gang, jeg skal gøre det. ->  I'm a bit annoyed that this is the first time I'm doing it.    Jeg har set meget frem til at dele den her. ->  Jeg ser frem til at dele den her.    Men hvad er det, vi taler om","Og de var begge nøgne, både Adam og hans Hustru, men de bluedes ikke.","They were both naked, the man and his wife, and were not ashamed.",9,15,54
.<|endoftext|>,.<|endoftext|>,"Og de var begge nøgne, både Adam og hans Hustru, men de bluedes ikke.","They were both naked, the man and his wife, and were not ashamed.",10,15,54
.<|endoftext|>,".  Mennesket vil ikke blive skilt fra sin far og mor, og de vil blive en del af deres egen krop.<|endoftext|>","Og de var begge nøgne, både Adam og hans Hustru, men de bluedes ikke.","They were both naked, the man and his wife, and were not ashamed.",11,15,54
" Den ene må tage stilling til, om de har giftet sig endeligt eller om ægteskabet endnu bare var på vrangen. Han kan bestemme eller","  13:12: ""Man shall not leave his mother, nor shall he leave his father.""    If you think that it is better, you can always make a decision, and you should have it.    If you think that it is better, you can always make a decision, and you should have it.    If you think that it","Og de var begge nøgne, både Adam og hans Hustru, men de bluedes ikke.","They were both naked, the man and his wife, and were not ashamed.",12,15,54
"
english: 5 Then Jesus will enter the kingdom of heaven and will break the two spirits that have been broken: and he will take up the"," Men elsker deres kære, fordi de har en indre hengivenhed til dem, og fordi de ikke er så meget for det, de har, men elsker dem, fordi de er kærlige.  2.3.1. Det er ikke så meget for den ydre hengivenhed, men mere for den indre hengivenhed. Det er ikke sådan, at det er","Og de var begge nøgne, både Adam og hans Hustru, men de bluedes ikke.","They were both naked, the man and his wife, and were not ashamed.",13,15,54
" ->
English
Således går Herren og faderen bort og forlater sin far og moder, og de to blir ett legeme. ->
Nor",".  10:12, 13) Denne lov gælder, når en mand forlader sin far og sin mor, og den skal gå i arv til sin kone.<|endoftext|>","Og de var begge nøgne, både Adam og hans Hustru, men de bluedes ikke.","They were both naked, the man and his wife, and were not ashamed.",14,15,54
" På samme måde kan den første mand som kvinde træde ud af sin fars favn, hun kan ikke holde fast ved ham og sige: ""Jeg elsker","    4. 10. Men er ikke alle mennesker lige. ->  Men er ikke alle mennesker lige.    11. Denne metode er den mest effektive til at slippe af med alle disse problemer. ->  Denne metode er den mest effektive til at slippe af med alle disse problemer.    12. Jeg har mødt mange mennesker, der har brug","Og de var begge nøgne, både Adam og hans Hustru, men de bluedes ikke.","They were both naked, the man and his wife, and were not ashamed.",15,15,54
"
Bog 8 af 23 »
Hvad er det du tænker på? Er din kone ikke sød? – jeg er glad og frisk","    8. 40,000,000,000,000,000,000,000,000,000,000,000,000,000,000,000,000,000","Og de var begge nøgne, både Adam og hans Hustru, men de bluedes ikke.","They were both naked, the man and his wife, and were not ashamed.",16,15,54
"

4. Engelsk: ""Ana, Ana, please, if you could just get the word to Mr. Brown.
Dansk: —",.<|endoftext|>,"Og de var begge nøgne, både Adam og hans Hustru, men de bluedes ikke.","They were both naked, the man and his wife, and were not ashamed.",17,15,54
" Og den tid kom, at han bragte sin hustru med sig, thi faderen til sin søn er død. Det blev sagt til ham, at hvis",                                                                                                                                                      ,"Og de var begge nøgne, både Adam og hans Hustru, men de bluedes ikke.","They were both naked, the man and his wife, and were not ashamed.",18,15,54
.<|endoftext|>,.<|endoftext|>,"Og de var begge nøgne, både Adam og hans Hustru, men de bluedes ikke.","They were both naked, the man and his wife, and were not ashamed.",19,15,54
.<|endoftext|>," 31 De, som er til, skal også være, til den tid, skal de alle være samlet ved samme sted, og i samme tid skal alle s Ø s s s s s s s s s s s s s s s s s s s s s s s s s s s s s s s s s s s s s s s s s","Og de var begge nøgne, både Adam og hans Hustru, men de bluedes ikke.","They were both naked, the man and his wife, and were not ashamed.",20,15,54
" Vi ved nu alle, at det ikke er det samme som en mand, der er kommet til en kvinde, men en mand, der er kommet til","  8:11 Det er et sandt ord fra den øverste, og det er ikke et ord, som det var før, men et ord, som det var i tidligere tider.  9:16 For: »De, der er i fuld forstand, kan ikke fuldgøre den for et af de mange for for, som jeg har for jer.«  9:","Og de var begge nøgne, både Adam og hans Hustru, men de bluedes ikke.","They were both naked, the man and his wife, and were not ashamed.",21,15,54
" ->
1. A man then leaves his father and mother and goes into his wife, and the two become one flesh.

18.",.<|endoftext|>,"Og de var begge nøgne, både Adam og hans Hustru, men de bluedes ikke.","They were both naked, the man and his wife, and were not ashamed.",22,15,54
