danish_predicted_output,english_predicted_output,danish_true_label,english_true_label,layer,lambda_amount,bible_verse
 Han gik op til de døde; de var der i alle sine sammenstød og grumme pludselige bevægelser. Den ene stak ham i ryggen," he was in the hospital, in a wheelchair.    Kerstin: Hi, I'm dinning med mad!    Hajr: Jeg kan ikke spise med dig!    Kerstin: Jeg har ikke noget at spise!    Hajr: Du skal ikke spise!    Kerstin: Jeg vil ikke spise!    Hajr: Du skal",Da så Kana'ans Fader Kam sin Faders Blusel og gik ud og fortalte sine Brødre det;,"Ham, the father of Canaan, saw the nakedness of his father, and told his two brothers outside.",18,5,226
" Da han blev sat op i teltet, tog han først øllet fra de berusede kvinder på værelset og gik så ind til dem, medens han", he was a man of sordid character. he was a man of sordid character. he was a man of sordid character. he was a man of sordid character. he was a man of sordid character. he was a man of sordid character. he was a man of sordid character. he was a man of sordid character. he was a,Da så Kana'ans Fader Kam sin Faders Blusel og gik ud og fortalte sine Brødre det;,"Ham, the father of Canaan, saw the nakedness of his father, and told his two brothers outside.",19,5,226
.<|endoftext|>, his body was covered with the skin of a tiger. he was also covered with the skin of a horse. he was naked. he was a bull. he was a man. he was a bull. he was a man. he was a man. he was a man. he was a man. he was a man. he was a man. he was a man. he was a man. he was,Da så Kana'ans Fader Kam sin Faders Blusel og gik ud og fortalte sine Brødre det;,"Ham, the father of Canaan, saw the nakedness of his father, and told his two brothers outside.",20,5,226
" Hans høne blev nu bange og flygtede ned i et hul, og da han hørte fuglenes brum, troede han vel, at han", he was still drunk. he was being chased by a thug. he was in a jail. he was drunk. he was on a bus. he was on a train. he was on a plane. he was on a plane. he was in a hospital. he was in a hospital. he was in a hospital. he was in a hospital. he was on a bus. he was on a,Da så Kana'ans Fader Kam sin Faders Blusel og gik ud og fortalte sine Brødre det;,"Ham, the father of Canaan, saw the nakedness of his father, and told his two brothers outside.",21,5,226
" Der blev de første tegn til den første opstand, en tidende om, at der skulle være opstand i Gondar, og at Jesus","  ""I'm sorry, sir. I forgot to tell you that I was in the tent. I don't know how long I was there, but I don't remember.""  ""You didn't say why you were in the tent,"" said the captain.  ""I didn't want to be found.""  ""You didn't tell us how you found me,"" said the",Da så Kana'ans Fader Kam sin Faders Blusel og gik ud og fortalte sine Brødre det;,"Ham, the father of Canaan, saw the nakedness of his father, and told his two brothers outside.",22,5,226
"
engelsk: ""That is what it is,"" said he now, leaning down to drink the wine, he became drunk and gave himself a moment of", he was a man of a certain age. he was a man of a certain age. he was a man of a certain age. he was a man of a certain age. he was a man of a certain age. he was a man of a certain age. he was a man of a certain age. he was a man of a certain age. he was a man of a certain age. he was,Da så Kana'ans Fader Kam sin Faders Blusel og gik ud og fortalte sine Brødre det;,"Ham, the father of Canaan, saw the nakedness of his father, and told his two brothers outside.",23,5,226
"
4. I can not believe that he is 20 years old. -> Jeg vil ikke tro, at han er 20 år.", he was on the edge of his tent with his tent. he was on the edge of his tent. he was uncovered within his tent. he was uncovered within his tent. he was uncovered within his tent. he was uncovered within his tent. he was uncovered within his tent. he was uncovered within his tent. he was uncovered within his tent. he was uncovered within his,Da så Kana'ans Fader Kam sin Faders Blusel og gik ud og fortalte sine Brødre det;,"Ham, the father of Canaan, saw the nakedness of his father, and told his two brothers outside.",0,10,226
"
13 Og når han blev beruset af den ed, han havde taget, og han tog til at drikke af vinen, blev han ber", he had a white shirt on and a white shirt on his head. he was naked. he had a white shirt on and a white shirt on his head. he was naked. he had a white shirt on and a white shirt on his head. he was naked. he was naked. he was naked. he was naked. he was naked. he was naked. he was naked. he was naked. he,Da så Kana'ans Fader Kam sin Faders Blusel og gik ud og fortalte sine Brødre det;,"Ham, the father of Canaan, saw the nakedness of his father, and told his two brothers outside.",1,10,226
" Det var med stor overraskelse at den unge mand nu saa den store og smukke, røde mand, med den store, brede, lange hat, med hans", the man was drunk. he was uncovered within his tent. he was uncovered within his tent. he was uncovered within his tent. he was uncovered within his tent. he was uncovered within his tent. he was uncovered within his tent. he was uncovered within his tent. he was uncovered within his tent. he was uncovered within his tent. he was uncovered within his,Da så Kana'ans Fader Kam sin Faders Blusel og gik ud og fortalte sine Brødre det;,"Ham, the father of Canaan, saw the nakedness of his father, and told his two brothers outside.",2,10,226
" — Ja, og han havde det bedre med det, end vi har det med at drikke sammen, sagde Sønnerne, om han end blev i", he drank the wine and got drunk. he was uncovered within his tent. he drank the wine and got drunk. he was uncovered within his tent. he drank the wine and got drunk. he was uncovered within his tent. he drank the wine and got drunk. he was uncovered within his tent. he drank the wine and got drunk. he was uncovered within his tent. he drank the,Da så Kana'ans Fader Kam sin Faders Blusel og gik ud og fortalte sine Brødre det;,"Ham, the father of Canaan, saw the nakedness of his father, and told his two brothers outside.",3,10,226
" Da slog han sig under sengene og drak. Han fortalte om et eventyr, nogle gamle mennesker havde set. Når de så gik gennem en have", he saw the woman lying in the tent. he saw the woman's body. he saw the body of her husband. he saw the woman's body. he saw the woman's body. he saw the woman's body. he saw the woman's body. he saw the woman's body. he saw the woman's body. he saw the woman's body. he saw,Da så Kana'ans Fader Kam sin Faders Blusel og gik ud og fortalte sine Brødre det;,"Ham, the father of Canaan, saw the nakedness of his father, and told his two brothers outside.",4,10,226
" Og han lagde sig som en lille sten på jorden.

Noget af det, der ikke er sket siden, var ikke at han kunne læse","    A:    I don't know if there's any way to explain this, but it's a bit of a weird way to describe a ""bad"" behavior.  The idea is that when someone drinks alcohol, they are likely to be more likely to drink again.  The idea is that when someone drinks alcohol, they are more likely to drink again.  If you have a",Da så Kana'ans Fader Kam sin Faders Blusel og gik ud og fortalte sine Brødre det;,"Ham, the father of Canaan, saw the nakedness of his father, and told his two brothers outside.",5,10,226
" De havde alle en stærk drust i øinene, og da de kom nærmere, så de, at den unge mand, som sad helt alene",  He was uncovered within the tent of his father.  He was uncovered within the tent of his father.  He was uncovered within the tent of his father.  He was uncovered within the tent of his father.  He was uncovered within the tent of his father.  He was uncovered within the tent of his father.  He was uncovered within the tent of his father,Da så Kana'ans Fader Kam sin Faders Blusel og gik ud og fortalte sine Brødre det;,"Ham, the father of Canaan, saw the nakedness of his father, and told his two brothers outside.",6,10,226
. Her fandt han en kurvfuld øl og et glas rødvin.<|endoftext|>," han blev taget af politiet, men han blev løsladt da han ikke var anholdt.  Han er blevet idømt 2000 kr i bøde, men han er fri.  Han var også på en tur i en lejr, hvor han var i besiddelse af hash.  Han blev løsladt efter en tur i lejren.  Han er blevet idømt 3000 kr i bøde",Da så Kana'ans Fader Kam sin Faders Blusel og gik ud og fortalte sine Brødre det;,"Ham, the father of Canaan, saw the nakedness of his father, and told his two brothers outside.",7,10,226
.<|endoftext|>," he was in the jungle.  The next day, he awoke and was in the tent, when the sun came up and the sun went down. he was in the jungle. he was in the jungle. he was in the jungle. he was in the jungle. he was in the jungle. he was in the jungle. he was in the jungle. he was in the jungle. he was in the",Da så Kana'ans Fader Kam sin Faders Blusel og gik ud og fortalte sine Brødre det;,"Ham, the father of Canaan, saw the nakedness of his father, and told his two brothers outside.",8,10,226
"
12.10.1807, i Christiania. S. 3. Her skrev han: ""Naar Folkene i"," he was under the impression that he had been drugged, and that he was under arrest. he was not found.  ""That's the way it goes,"" he said. ""I'm here to see you. I'll see if I can get you to talk.""  ""No,"" I said. ""I'm here to see you.""  ""Well, I'll see you",Da så Kana'ans Fader Kam sin Faders Blusel og gik ud og fortalte sine Brødre det;,"Ham, the father of Canaan, saw the nakedness of his father, and told his two brothers outside.",9,10,226
" Paa den tid gik der et gammelt skib forbi, og der var en rig mand. Og denne manden sagde til Jesus: ""Kald den gamle mand","  Sabrin: He was a good man, the boy. He was a good man.    Sabrin: I was a good man.    Sabrin: I was a good man.    Sabrin: I was a good man.    Sabrin: I was a good man.    Sabrin: I was a good man.    S",Da så Kana'ans Fader Kam sin Faders Blusel og gik ud og fortalte sine Brødre det;,"Ham, the father of Canaan, saw the nakedness of his father, and told his two brothers outside.",10,10,226
". Men da han i dybeste søvn kom ind til sin kone, spurgte hun sin bedstemoder om de havde taget soveposer med.<|endoftext|>",  he was in his 20's. han var i hans 20'ere. han var i 20'erne. han var i 20'erne. han var i 20'erne. han var i 20'erne. han var i 20'erne. han var i 20'erne. han var i 20'erne,Da så Kana'ans Fader Kam sin Faders Blusel og gik ud og fortalte sine Brødre det;,"Ham, the father of Canaan, saw the nakedness of his father, and told his two brothers outside.",11,10,226
" Her var der ikke mange andre gæster, fordi han gik i gang hermed.
Da han så, at der gik en mand, og at han ville", he was drunk and on his back and he was lying on his back. he was on the ground and he was on his back. he was drunk and on his back. he was drunk and on his back. he was drunk and on his back. he was drunk and on his back. he was drunk and on his back. he was drunk and on his back. he was drunk and on his back.,Da så Kana'ans Fader Kam sin Faders Blusel og gik ud og fortalte sine Brødre det;,"Ham, the father of Canaan, saw the nakedness of his father, and told his two brothers outside.",12,10,226
" Der var endnu en stor, gul sten i teltet. Det var for enden af graven, og i den stod en stor, grov stav, og"," det var en god aften, og jeg blev virkelig glad for at jeg havde valgt ham, siger hun.  Sådan er det i hvert fald ikke.  For i dag er han ikke en del af det.  -I aften er det hans tur.  -Det er det jo ikke.  -Nej, det er det.  -Du ved, hvad han sagde, da han var der.  ",Da så Kana'ans Fader Kam sin Faders Blusel og gik ud og fortalte sine Brødre det;,"Ham, the father of Canaan, saw the nakedness of his father, and told his two brothers outside.",13,10,226
" Der var ingen, der så. Og da man saa dem, grinte de, men de blev såarede og blev dræbte. En af"," han var blevet vækket inden han var blevet vækket af sin egen mor, der havde været ude for en ulykke.    Han havde sovet ved siden af sin mor i en uge, og han havde ikke sovet på det seneste. han var blevet vækket af sin mor og hans far, som havde været ude at fiske, da han havde sovet ved siden af dem. han havde sovet ved",Da så Kana'ans Fader Kam sin Faders Blusel og gik ud og fortalte sine Brødre det;,"Ham, the father of Canaan, saw the nakedness of his father, and told his two brothers outside.",14,10,226
" Da det ved denne lejlighed viste sig, at der var kommen en af soldaterne hen til ham midt i en vild strid, gav kongen ham tilhold","    danmark: en række begivenheder, der har stor betydning for den danske samfundsøkonomi, som ->  danmark: en række begivenheder, der har stor betydning for den danske samfundsøkonomi, som    En række forskere har studeret deres effekt på vores krop, og det er blevet bekræftet, at det er et effektivt middel til at bekæmpe de inflammatoriske processer. ->  En række forskere har studer",Da så Kana'ans Fader Kam sin Faders Blusel og gik ud og fortalte sine Brødre det;,"Ham, the father of Canaan, saw the nakedness of his father, and told his two brothers outside.",15,10,226
" Den hellige blev nu greben af bæven og spurgte Gud: ""Hvad skal du?"" Men den hellige svarede: ""Du vil gerne sove! Ja"," han var ved at dø, da han drukken blev, han var uncovered i hans telt.    15. august 1974, i 1974, i 1974, i 1974, i 1974, i 1974, i 1974, i 1974, i ",Da så Kana'ans Fader Kam sin Faders Blusel og gik ud og fortalte sine Brødre det;,"Ham, the father of Canaan, saw the nakedness of his father, and told his two brothers outside.",16,10,226
".
dansk<|endoftext|>",". han var alene om natten i sit telt, og drak vin. han blev fundet i sit telt.<|endoftext|>",Da så Kana'ans Fader Kam sin Faders Blusel og gik ud og fortalte sine Brødre det;,"Ham, the father of Canaan, saw the nakedness of his father, and told his two brothers outside.",17,10,226
" Efter dette vilde en af de andre mænd gjøre ham noget ondt, førend han vilde kaste sig ned mellem de tre andre.
Da de andre hørte",                                                                                                                                                                      ,Da så Kana'ans Fader Kam sin Faders Blusel og gik ud og fortalte sine Brødre det;,"Ham, the father of Canaan, saw the nakedness of his father, and told his two brothers outside.",18,10,226
" Væk gennem vinduet fik han dog øje på den mægtige dreng og opdagede, at han stod med sine hænder i ærmet på en mørk,", han har en skude i hånden. han har en pistol i hånden. han er en gammel mand. han har en pistol i hånden. han har en skude i hånden. han er en gammel mand. han har en skude i hånden. han er en gammel mand. han har en skude i hånden. han er en gammel mand. han har en skude i hånden. han er en gammel mand,Da så Kana'ans Fader Kam sin Faders Blusel og gik ud og fortalte sine Brødre det;,"Ham, the father of Canaan, saw the nakedness of his father, and told his two brothers outside.",19,10,226
" Den 7. september blev han anholdt, og da denne dag var kommet, blev han i løbet af dagen stukket ihjel i en hytte ved en",                                                                                                                                                                      ,Da så Kana'ans Fader Kam sin Faders Blusel og gik ud og fortalte sine Brødre det;,"Ham, the father of Canaan, saw the nakedness of his father, and told his two brothers outside.",20,10,226
.<|endoftext|>,.<|endoftext|>,Da så Kana'ans Fader Kam sin Faders Blusel og gik ud og fortalte sine Brødre det;,"Ham, the father of Canaan, saw the nakedness of his father, and told his two brothers outside.",21,10,226
" Han havde sin egen teltduge og mad til en uge; og da de så ham og gik forbi, sprang de til ham, men kunne ikke"," ""The one who did that,"" said one of the men, ""has been jammed.""  ""I'm not jammed,"" said the andre, ""but I'm jammed.""  ""I'm jammed,"" said the andre, ""and I'm jammed.""  ""I'm jammed,"" said the andre, ""and I'm jammed.""  ""I",Da så Kana'ans Fader Kam sin Faders Blusel og gik ud og fortalte sine Brødre det;,"Ham, the father of Canaan, saw the nakedness of his father, and told his two brothers outside.",22,10,226
"
Da jeg hørte, at hans kone var kommen ind til ham, kom de begge to ind til teltet sammen med deres hustru, og der ud",  'Where have you been?'  'I came to ask you if you had anything to do with the man you killed. I have a lot to do. I've got to talk to you.'  'I'm sorry. I'm not here. I've got to go to the police. I've got to go to the police.'  'I'm sorry.,Da så Kana'ans Fader Kam sin Faders Blusel og gik ud og fortalte sine Brødre det;,"Ham, the father of Canaan, saw the nakedness of his father, and told his two brothers outside.",23,10,226
"
""Så var jeg oppe!"" hvæsede han vredt mod Nibbet, men han blev ikke ved med at løbe, han slog først", he was un made and he was un doe. he was un dost and he was un doe. he was un dost and he was un doe. he was un dost and he was un dost. he was un dost and he was un dost. he was un dost and he was un dost. he was un dost and he was un dost.,Da så Kana'ans Fader Kam sin Faders Blusel og gik ud og fortalte sine Brødre det;,"Ham, the father of Canaan, saw the nakedness of his father, and told his two brothers outside.",0,15,226
" Og i dag blev han druknet og druknet. Da vidste Herren, at han aldrig mere skulde blive mæt. Nu blev der ikke så meget",    2. He was uncovered within his tent.      3. He was uncovered within his tent.    4. He was uncovered within his tent.  5. He was uncovered within his tent.  6. He was uncovered within his tent.  7. He was uncovered within his tent.  8. He was uncovered within his tent.  9,Da så Kana'ans Fader Kam sin Faders Blusel og gik ud og fortalte sine Brødre det;,"Ham, the father of Canaan, saw the nakedness of his father, and told his two brothers outside.",1,15,226
" Den første nat, da han gik hen i værelset og lukkede døren efter sig, tog det en stund, før han fattede den i det hele.", he was drunk of the wine and got drunk.  he was uncovered within his tent. he was drunk of the wine and got drunk.  he was uncovered within his tent. he was drunk of the wine and got drunk.  he was uncovered within his tent. he was drunk of the wine and got drunk.  he was uncovered within his tent. he was drunk of the wine and,Da så Kana'ans Fader Kam sin Faders Blusel og gik ud og fortalte sine Brødre det;,"Ham, the father of Canaan, saw the nakedness of his father, and told his two brothers outside.",2,15,226
" Da hans mor, der sad i teltplænen, spurgte, om han vilde lade hende sove ovre i hans telt, saa han paa hende","  ""He was uncovered within his tent.  ""He was uncovered within his tent.  ""He was uncovered within his tent.  ""He was uncovered within his tent.  ""He was uncovered within his tent.  ""He was uncovered within his tent.  ""He was uncovered within his tent.  ""He was uncovered within his tent.  ""He",Da så Kana'ans Fader Kam sin Faders Blusel og gik ud og fortalte sine Brødre det;,"Ham, the father of Canaan, saw the nakedness of his father, and told his two brothers outside.",3,15,226
" I et lidet rum, som ikke var høiere end det, hvor han stod, fandt han tilsidst sin ven tilbage, og så begyndte","    Morton: Hi, I'm your automated assistant. I can answer your questions about Riley (film).  Lee: What is the main character in Riley (film)?  Morton: Riley (film) Riley (film) is a 1970 British crime film directed by John A.  Lee: What is the setting of the film?  M",Da så Kana'ans Fader Kam sin Faders Blusel og gik ud og fortalte sine Brødre det;,"Ham, the father of Canaan, saw the nakedness of his father, and told his two brothers outside.",4,15,226
" Nu var vi kommet 30 trin op , thi den 2. og 3. etage af teltet var åbne, medens det var skjult"," he was a big man, like a tall man. he was a tall man with a big man's arms. he was a big man with a big man's legs. he was a big man with a big man's legs. he was a big man with a big man's head. he was a big man with a big man's hands. he was a big man with a",Da så Kana'ans Fader Kam sin Faders Blusel og gik ud og fortalte sine Brødre det;,"Ham, the father of Canaan, saw the nakedness of his father, and told his two brothers outside.",5,15,226
" Men da det blev mørkt, og han skulde bort, skyndte den gamle til at fortælle ham, hvad han nu havde gjort.
For han havde",    He was uncovered with the wine and got drunk.    He was uncovered with the wine and got drunk.    He was uncovered with the wine and got drunk.    He was uncovered with the wine and got drunk.    He was uncovered with the wine and got drunk.    He was uncovered with the wine and got drunk.    He was un,Da så Kana'ans Fader Kam sin Faders Blusel og gik ud og fortalte sine Brødre det;,"Ham, the father of Canaan, saw the nakedness of his father, and told his two brothers outside.",6,15,226
" Han begyndte en lang og besværlig travesti for at finde sit telt, og han begyndte endda at blive urolig, da han hørte sit eget",. Han var i live i 2013.      Han var uncovered i 2013.<|endoftext|>,Da så Kana'ans Fader Kam sin Faders Blusel og gik ud og fortalte sine Brødre det;,"Ham, the father of Canaan, saw the nakedness of his father, and told his two brothers outside.",7,15,226
"

13. Engelsk: This has been a successful and effective initiative until now.
Dansk: Det har været et succesfuldt initiativ hidtil.","  I was sitting at the fire, when the man called, ""Hey, I'm here, and the woman's coming!""  I was sitting on the ground, and I heard a voice, and I saw a man and a woman, and they were dressed like they were going to a wedding. They had a child. They were dressed like they were going to a wedding. They had a child",Da så Kana'ans Fader Kam sin Faders Blusel og gik ud og fortalte sine Brødre det;,"Ham, the father of Canaan, saw the nakedness of his father, and told his two brothers outside.",8,15,226
" Dette udgik for at dræbe og hugge til med sin pil og gik i skjul bag de andre.
3 - 10. Den"," han var så fuld, at han ikke kunne gå op og ned af det. han var træt og kunne ikke holde ud at være i det telt. han fik en bøde for at have drukket. han var så træt, at han ikke kunne holde ud at være i det telt. han gik ud af det telt og måtte ligge ned. han kunne ikke holde ud at ligge i det telt, og så måtte han",Da så Kana'ans Fader Kam sin Faders Blusel og gik ud og fortalte sine Brødre det;,"Ham, the father of Canaan, saw the nakedness of his father, and told his two brothers outside.",9,15,226
" Der blev sagt i teltene: ""Der er en gammel kroppe og en ny. Hvis du ikke bliver vred på ham med den gamle bliver du",                                                                                                                                                                      ,Da så Kana'ans Fader Kam sin Faders Blusel og gik ud og fortalte sine Brødre det;,"Ham, the father of Canaan, saw the nakedness of his father, and told his two brothers outside.",10,15,226
" Den, der stod under sengen, stod ved hans ansigt. Han mærkede en underlig smerte i benene. Han blev angst, da han hørte den anden",. Han var uncovered indenfor sit telt.<|endoftext|>,Da så Kana'ans Fader Kam sin Faders Blusel og gik ud og fortalte sine Brødre det;,"Ham, the father of Canaan, saw the nakedness of his father, and told his two brothers outside.",11,15,226
" —
8.
Og de kom ind og fandt Jesus, som de lod stå midt iblandt sine tabere; han sagde til dem: »H", and he was drunk. but it was a drunk. and he was drunk. so he drank. and it was a drunk. so he drank. so he drank. so he drank. so he drank. and he drank. and he drank. and he drank. and he drank. and he drank. and he drank. and he drank. and he drank. so he drank. and he drank. so,Da så Kana'ans Fader Kam sin Faders Blusel og gik ud og fortalte sine Brødre det;,"Ham, the father of Canaan, saw the nakedness of his father, and told his two brothers outside.",12,15,226
" Men jeg ved aldrig om det er sandt, min fader. Han var med mig i fængslet, jeg var glad og fornøjet, men alligevel var",.    A:    Drink afaik ikke-alkoholiske drikke og alkoholfri drikkevarer som en del af en menu.    <|endoftext|>,Da så Kana'ans Fader Kam sin Faders Blusel og gik ud og fortalte sine Brødre det;,"Ham, the father of Canaan, saw the nakedness of his father, and told his two brothers outside.",13,15,226
 Ildens varme slørede hans ansigte og gjorde det ikke let at komme frem. Men han fandt dog frem en sten. Han skar," han var til stede i sin egen tents tilblivelse.    da - Men det var en af de to ting, der skulle gå godt i 2016. ->  Det er dog to ting, der går godt i 2016.    Det er altid dejligt at se, at det kan betale sig at arbejde for at nå så langt. ->  Det er altid godt",Da så Kana'ans Fader Kam sin Faders Blusel og gik ud og fortalte sine Brødre det;,"Ham, the father of Canaan, saw the nakedness of his father, and told his two brothers outside.",14,15,226
" Det var ikke en af de gode hytter for druk, men i stedet en af dem, som tjente som en slags fængsel for den fattige soldat.", han havde drukket af vinen og druk. han blev afsløret inden for hans telt. han var blevet druknet inden for hans telt. han var blevet druknet inden for hans telt. han var blevet druknet inden for hans telt. han var blevet druknet inden for sin telt. han var blevet druknet inden for sin telt. han var blevet druknet inden for sin telt. han var blevet,Da så Kana'ans Fader Kam sin Faders Blusel og gik ud og fortalte sine Brødre det;,"Ham, the father of Canaan, saw the nakedness of his father, and told his two brothers outside.",15,15,226
