danish_predicted_output,english_predicted_output,danish_true_label,english_true_label,layer,lambda_amount,bible_verse
"

Søerne fyldte helt op – det var helt vildt! Jeg var ikke i tvivl om, at en dag ville der blive en ny"," in a word, the waters have ceased to be. And thus, after the end of thirty-four hundred days the waters were no longer. In other words, the waters ceased to be.  Now, therefore, after the end of forty- five hundred days the waters were no longer. In other words, the waters ceased to be.                  ","På den syttende Dag i den syvende Måned sad Arken fast på Ararats Bjerge,","The ship rested in the seventh month, on the seventeenth day of the month, on Ararat's mountains.",0,10,186
" I 1979 blev der indsamlet 1.239 kg sediment i området, hvilket er en stigning på 15 %","    When I was a young man I was a little boy. ->  Þegar ég var ungur maður var ég ungur drengur.      Það er engin þörf á því að skjóta sig. ->  Það er engin þörf á því að skjóta sig.      Hvað er ""sérstaka"" spurning í þessum leik? ->  Hvað","På den syttende Dag i den syvende Måned sad Arken fast på Ararats Bjerge,","The ship rested in the seventh month, on the seventeenth day of the month, on Ararat's mountains.",1,10,186
"

Efter den dag nåede vi til den 41. grad. Der skulle jo til. Men for at opnå den endelige 41.","    Danish: Hvordan til at tabe fedt uden at sulte  English: How to lose fat without starving      Danish: Den anden, der var en stor mand, var den mindste.  English: The other one who was a very big man was the smallest.      Danish: De er gode til at se den anden.  English: They","På den syttende Dag i den syvende Måned sad Arken fast på Ararats Bjerge,","The ship rested in the seventh month, on the seventeenth day of the month, on Ararat's mountains.",2,10,186
" ->
Vattenvägarna drog sig långsamt tillbaka och vattnet drog sig efter en tid tillbaka från marken och vattnet tog igen sig efter 150",  The waters were then recededed from the earth continually. after the end of one hundred fifty days the waters decreased.  The waters were then recededed from the earth continually. after the end of one hundred fifty days the waters decreased.  The waters were then recededed from the earth continually. after the end of one hundred fifty days the waters decreased.,"På den syttende Dag i den syvende Måned sad Arken fast på Ararats Bjerge,","The ship rested in the seventh month, on the seventeenth day of the month, on Ararat's mountains.",3,10,186
" Det skulle jo gerne gå bedre næste gang vi sætter foden i et af dem.
Nu kunne jeg godt mærke at vi var i gang med at", and the water came in the second year.  And then the water came in the second year.  And then the water came in the second year.  And then the water came in the second year.  And then the water came in the second year.  And then the water came in the second year.  And then the water came in the second year.  And then,"På den syttende Dag i den syvende Måned sad Arken fast på Ararats Bjerge,","The ship rested in the seventh month, on the seventeenth day of the month, on Ararat's mountains.",4,10,186
" Pløjet et godt stykke mere af jorden sammen i et nyt dybt sår, hvor man måske kunne tænke, at der skulle etableres en mere effektiv dræning"," But this was not the end. It was only the beginning.  The water of the earth was in the earth, but the water of the heavens was not in the heavens.  The waters of the earth were in the earth, but the waters of the heavens were not in the heavens.  The water of the earth was in the earth, but the waters of","På den syttende Dag i den syvende Måned sad Arken fast på Ararats Bjerge,","The ship rested in the seventh month, on the seventeenth day of the month, on Ararat's mountains.",5,10,186
" Vandstanden kunne kun stige to steder i søen og der var ingen steder, hvor der kom bølger nok til, at de kunne lave storhavet og","    26. ""Song of Song of Song of Song of Song of Song of Song of Song of Song of Song of Song of Song of Song of Song of Song of Song of Song of Song of Song of Song of Song of Song of Song of Song of Song of Song of Song of Song of Song of Song of Song of Song of Song of Song of Song of Song","På den syttende Dag i den syvende Måned sad Arken fast på Ararats Bjerge,","The ship rested in the seventh month, on the seventeenth day of the month, on Ararat's mountains.",6,10,186
"
Derved kunne jeg mærke at vandet, som var steget kraftigt efter en lang varm sommer, skulle ned i grundvandet, og somme tider ville"," Dette er en meget vigtig begivenhed, som man har set i forskellige medier i mange år.    Så det er ikke en tilfældighed, at der er blevet lavet en video om dette emne.    Det er meget interessant at høre om hvordan man kan arbejde med sine børn. Det er meget interessant at høre om hvordan man kan arbejde med sine børn. Det er meget interessant at høre om","På den syttende Dag i den syvende Måned sad Arken fast på Ararats Bjerge,","The ship rested in the seventh month, on the seventeenth day of the month, on Ararat's mountains.",7,10,186
"

LÆS OGSÅ: Nasa vil have dig til at sove med høretelefoner i ørerne

Men det hele stopper ikke ved ned","  The waters were at their lowest point, at the end of the twenty-second day of the month. The waters were still, but they receded from the earth continually. after the end of one hundred fifty days the waters decreased.  The waters were at their highest point, at the end of the twenty-third day of the month. The waters were still, but they","På den syttende Dag i den syvende Måned sad Arken fast på Ararats Bjerge,","The ship rested in the seventh month, on the seventeenth day of the month, on Ararat's mountains.",8,10,186
.<|endoftext|>, This was the last time the ocean level of the earth was lower than that of the moon.                                                                                                                      ,"På den syttende Dag i den syvende Måned sad Arken fast på Ararats Bjerge,","The ship rested in the seventh month, on the seventeenth day of the month, on Ararat's mountains.",9,10,186
" Planterne forsvandt, og efter to dages plukning vendte vandet tilbage til jorden. 
Dyrene som vi kender bedst fra planteriget kommer", the waters receded from the earth continually. after the end of one hundred fifty days the waters decreased. the waters receded from the earth continually. after the end of one hundred fifty days the waters decreased. the waters receded from the earth continually. after the end of one hundred fifty days the waters decreased. the waters receded from the earth continually. efter den,"På den syttende Dag i den syvende Måned sad Arken fast på Ararats Bjerge,","The ship rested in the seventh month, on the seventeenth day of the month, on Ararat's mountains.",10,10,186
" Det var et par år efter, at vandet havde været væk i 1100 dage uden for Nordsøen. I de efterfølgende 1","  Danish: ""Jeg kan ikke huske hvornår jeg sidst har set en fisk.  English: ""Jeg kan ikke huske hvornår jeg sidst har set en fisk.  Danish: Dette er de vigtigste punkter, du skal overveje, når du vælger en VPN til at afinstallere Spyzie.  English: These are the key points you need to consider when you choose a VPN to","På den syttende Dag i den syvende Måned sad Arken fast på Ararats Bjerge,","The ship rested in the seventh month, on the seventeenth day of the month, on Ararat's mountains.",11,10,186
" Vi havde 28 minutter til overs til at komme ud til vandet, men vandet var så småt ved at tørre ud, så det var bare om",    Beyond the water there was a land.    After that it was filled with water.    But the water was not there.    And the water came and stood still.    And the water stood still.    And it was still.    But it was not there.    And it was not there.    And it was not,"På den syttende Dag i den syvende Måned sad Arken fast på Ararats Bjerge,","The ship rested in the seventh month, on the seventeenth day of the month, on Ararat's mountains.",12,10,186
"
Men det var der ikke noget nyt i. Det blev mere og mere tydeligt, at solen ikke længere ville klare landskabet, og der gik endnu","  dansk: Når vandet forsvinder fra jorden, er det en konsekvens af at det forsvinder fra den, så længe det har været på jorden.    dansk: Men det er altså ikke det, vi diskuterer her, og jeg er ked af, at det ikke er tilfældet.  dansk: Det er imidlertid ikke det, vi drøfter her, og jeg beklager, at det ikke er tilfældet","På den syttende Dag i den syvende Måned sad Arken fast på Ararats Bjerge,","The ship rested in the seventh month, on the seventeenth day of the month, on Ararat's mountains.",13,10,186
"
Jens' beretning om det første og det andet af de to besøg i Vollsmose-Toftegård-Parkens Have er",.  engelsk<|endoftext|>,"På den syttende Dag i den syvende Måned sad Arken fast på Ararats Bjerge,","The ship rested in the seventh month, on the seventeenth day of the month, on Ararat's mountains.",14,10,186
 Pludselig kunne vi se den helt tydeligt. Det er en mørkbrune kæmpe. De får altid deres øje vendt mod os og søger til de steder,  15.10.1988  15.10.1988  15.10.1988  15.10.1988  15.10.1988  15.10.1988  15.10.1988  ,"På den syttende Dag i den syvende Måned sad Arken fast på Ararats Bjerge,","The ship rested in the seventh month, on the seventeenth day of the month, on Ararat's mountains.",15,10,186
"
""I've been a member of this village for a long time.
In my experience, the water has been the most important thing for","  danska: 24, 20, 22, 24, 25, 26, 27, 28, 29, 30, 31, 32, 33, 34, 35, 36, 37, 38, 3","På den syttende Dag i den syvende Måned sad Arken fast på Ararats Bjerge,","The ship rested in the seventh month, on the seventeenth day of the month, on Ararat's mountains.",16,10,186
" De store, rødlige knopper har lagt sig på mange af træerne omkring de store søer. Det er en smuk ting at gå rundt blandt","  The Vandrende Vandrings Dag.  En Vandrende Vandrings Dag er en dag, hvor man vandrer på vandringsruter. Vandringer foregår på vandringsruter i naturen, der er beskrevet i Bibelen. I Bibelen står der, at man kan vandre i vandringenes løb. Man kan vandre på vandringsruter i naturen, hvor man kan løbe over vandløb, hvor man","På den syttende Dag i den syvende Måned sad Arken fast på Ararats Bjerge,","The ship rested in the seventh month, on the seventeenth day of the month, on Ararat's mountains.",17,10,186
"
Turen fra Nauclér til Nasa blev indimellem stoppet på vejen af blitser af alskens størrelser, bl.",                                                                                                                                                            ,"På den syttende Dag i den syvende Måned sad Arken fast på Ararats Bjerge,","The ship rested in the seventh month, on the seventeenth day of the month, on Ararat's mountains.",18,10,186
"
Men da det nye vand kom, var alt godt igen, men da der kom igen efter nogle få uger, var vandet ikke ligeså meget som før",.    <|endoftext|>,"På den syttende Dag i den syvende Måned sad Arken fast på Ararats Bjerge,","The ship rested in the seventh month, on the seventeenth day of the month, on Ararat's mountains.",19,10,186
" Så var der kun tilbage at holde øje med vandet eller finde på at grave noget grus.
Nu var det i realiteten 2 forskellige ting, når","  10. Dansk: I kan ikke bruge den til det.  Engelsk: You can ikke brug den til det.  11. Dansk: Vær den første, som skal se s00 s00 s00 s00 s00 s00 s00 s00 s00 s00 s00 s00 s00 s","På den syttende Dag i den syvende Måned sad Arken fast på Ararats Bjerge,","The ship rested in the seventh month, on the seventeenth day of the month, on Ararat's mountains.",20,10,186
"
""Vi begyndte at tro, der var gået hul på vandet, og det viste sig, at der var hele 2 1/1m","  dansk: I løbet af 1000 år, er der ikke mere jord i jordens overflade.  engelsk: Over 1000 years, the earth is no longer underwater.  dansk: Det er et stort og spændende projekt, vi har gang i.  engelsk: This is a big, exciting project I'm working on.  dansk: Men det","På den syttende Dag i den syvende Måned sad Arken fast på Ararats Bjerge,","The ship rested in the seventh month, on the seventeenth day of the month, on Ararat's mountains.",21,10,186
" Og det så ud til, at vandet ville blive ved med at vende retur.
Da vandet steg igen, steg temperaturen igen for derefter at falde sammen",  In this manner the earth was rested. and the water was turned to sand.  And the waters rested on the sand.  And the sand became a body.  And the body was in the water.  And the body became a body.  And the body became a body.  And the body became a body.  And the body became a body.  ,"På den syttende Dag i den syvende Måned sad Arken fast på Ararats Bjerge,","The ship rested in the seventh month, on the seventeenth day of the month, on Ararat's mountains.",22,10,186
" Dermed er der ikke længere nogen fisk.
Men pludselig, måske nok ikke så pludseligt, skete der noget ganske nyt for Peter.
","      The first five months of the year      The first five months of the year were very good for the sea. The sea was not yet at the bottom of the bay, but the water was still going down.      The year 1000      The year 1000 was a good year for the sea. The sea was","På den syttende Dag i den syvende Måned sad Arken fast på Ararats Bjerge,","The ship rested in the seventh month, on the seventeenth day of the month, on Ararat's mountains.",23,10,186
" Det er meget normalt, at der går 6 måneders ventetid fra et vandløb fjernes, til det igen er tørt og grønt. Der laves aftaler med", the waters re eded from the earth. the waters re eded from the earth. the waters 2016. the waters 2016. the waters 2016. the waters S. the 2016 2016. the 2016. the 2016. the 2016,"På den syttende Dag i den syvende Måned sad Arken fast på Ararats Bjerge,","The ship rested in the seventh month, on the seventeenth day of the month, on Ararat's mountains.",0,15,186
" Så gik der et stykke tid, inden vandet igen begyndte at gå. Dette var dog kun i begyndelsen af sommeren, og fordi alt vandet var foruren",.<|endoftext|>,"På den syttende Dag i den syvende Måned sad Arken fast på Ararats Bjerge,","The ship rested in the seventh month, on the seventeenth day of the month, on Ararat's mountains.",1,15,186
"
Når vandet tager af
Når vandet og luften fylder noget af det samme, vil vandet først falde til bunden af et hulrum. Det er her", and the end of one hundred fifty days the waters increased. and the end of one hundred fifty days the waters decreased. and the end of one hundred fifty days the waters decreased. and the end of one hundred fifty days the waters decreased.  And the end of one hundred fifty days the waters recedededed from the earth continually. And the end of one hundred fifty days the,"På den syttende Dag i den syvende Måned sad Arken fast på Ararats Bjerge,","The ship rested in the seventh month, on the seventeenth day of the month, on Ararat's mountains.",2,15,186
.<|endoftext|>,.<|endoftext|>,"På den syttende Dag i den syvende Måned sad Arken fast på Ararats Bjerge,","The ship rested in the seventh month, on the seventeenth day of the month, on Ararat's mountains.",3,15,186
" Det er den vandstand, hvor jeg tror, at den første store tsunami ramte øerne. Men der kan selvfølgelig også være længere tidshor",  The earth is not a continuous sea.  The earth is not a continuous sea.  The earth is not a continuous sea.  The earth is not a continuous sea.  The earth is not a continuous sea.  The earth is not a continuous sea.  The earth is not a continuous sea.  The earth is not a continuous sea.  The earth is not a,"På den syttende Dag i den syvende Måned sad Arken fast på Ararats Bjerge,","The ship rested in the seventh month, on the seventeenth day of the month, on Ararat's mountains.",4,15,186
" Efter 42 dage havde hele mængden i 2. vandløb i de 16 dage i forløbet været så lav til, at det ikke","  18 Then said the Lord unto Moses, that he should be a priest unto Israel, and that he should be a priest unto the children of Israel, and that he should be the priest unto all the nations of Israel.  19 And the Lord said unto Moses, that he should be a priest unto the children of Israel, and that he should be a priest unto all the","På den syttende Dag i den syvende Måned sad Arken fast på Ararats Bjerge,","The ship rested in the seventh month, on the seventeenth day of the month, on Ararat's mountains.",5,15,186
" Den vandkølede spand fik kun 113.000 liter.

Nogle af de vandkølingsprøver",   the same   the same   the same  the same  the same  the same   the same  the same   the same   the same   the same   the same   the same   the same   the same   the same   the same   the same   the same   the same   ,"På den syttende Dag i den syvende Måned sad Arken fast på Ararats Bjerge,","The ship rested in the seventh month, on the seventeenth day of the month, on Ararat's mountains.",6,15,186
" ->
Vajeen was raised by the force of the Earth, and the water began to leave the ground slightly, and the water left them","    -    1000 dage til, at du har fundet din plads på jorden.    -    1000 dage til, at du har fundet din plads på jorden.    -    1000 dage til, at du har fundet din plads på jorden.    -    1000 dage til, at du har","På den syttende Dag i den syvende Måned sad Arken fast på Ararats Bjerge,","The ship rested in the seventh month, on the seventeenth day of the month, on Ararat's mountains.",7,15,186
" Det fik mig til at tænke på, at der skal gå minimum 11,4 timer, inden vandet er helt væk fra land. Havde",".  sv: Sedan vattnets slut upphörde att sjunka från himlen efter tusen och ett halvt år, började vattennivån sjunka igen.<|endoftext|>","På den syttende Dag i den syvende Måned sad Arken fast på Ararats Bjerge,","The ship rested in the seventh month, on the seventeenth day of the month, on Ararat's mountains.",8,15,186
" Derefter kom den tunge tåge i toppen, og den voldsomme strøm fulgte så efter. Der opstod en lille bæk, der er forbundet med havet via et"," og så videre. så det er muligt at være der i flere år.  Der er mange grunde til, at folk ikke kan være der i et år.  Hvis du ikke kan være der i et år, kan du være der i flere år.  Så hvis du ikke kan være der i et år, er du i stand til at være der i flere år.  Så du","På den syttende Dag i den syvende Måned sad Arken fast på Ararats Bjerge,","The ship rested in the seventh month, on the seventeenth day of the month, on Ararat's mountains.",9,15,186
"
At det skulle gå så hurtigt, er der ingen tvivl om, men det kom nok ikke helt bag på os, da vandet begyndte at hæve op"," Efter en hundrede fem dage vandet var faldet. I slutningen af hver hundrede dage. 15. Det er en god tid at se en film. 16. Det er en god tid at se en film. 17. Efter en hundrede fem dage, vandet er faldet. 18. Det er en god tid at se en film. 19. Det er","På den syttende Dag i den syvende Måned sad Arken fast på Ararats Bjerge,","The ship rested in the seventh month, on the seventeenth day of the month, on Ararat's mountains.",10,15,186
" Efter 150 dage var vandet væk.
Vi kiggede i højvandet.
Det var næsten som om, at det kunne være vores",".  Det var de samme 28 dage, der skete, da jorden blev dækket af havvand, efter at en 1000-dages periode var forbi.<|endoftext|>","På den syttende Dag i den syvende Måned sad Arken fast på Ararats Bjerge,","The ship rested in the seventh month, on the seventeenth day of the month, on Ararat's mountains.",11,15,186
"
Den første vandstand var lige midt på den øverste del af den midterste bakke ned til grundvandet. I 1910 stod",  The waters receded from the earth continually. after the end of one hundred fifty days the waters receded.  The water receded from the earth. after the end of one hundred fifty days the water receded.  The water receded from the earth. after the end of one hundred fifty days the water receded.  The water reced,"På den syttende Dag i den syvende Måned sad Arken fast på Ararats Bjerge,","The ship rested in the seventh month, on the seventeenth day of the month, on Ararat's mountains.",12,15,186
"

Allerede i den første video kunne vi se, at den 18 meter dybe, røde jord, der var lavet på kanten,",".  da:  Vandene er ikke mere til stede i havet, men er stadig til stede i det omkringliggende hav.<|endoftext|>","På den syttende Dag i den syvende Måned sad Arken fast på Ararats Bjerge,","The ship rested in the seventh month, on the seventeenth day of the month, on Ararat's mountains.",13,15,186
" På vejen tilbage, stoppede vandfaldet i nærheden af en sø, der er til vandrende geder.
Den 13. september blev","    5. 1912-1920 : Der var en periode, hvor det var muligt at dyrke jorden og dyrkede jorden. ->  1912-1920 : Der var en periode, hvor det var muligt at dyrke jorden og dyrkede jorden.    6. Du kan bruge disse to eksempler til at illustrere, hvordan du","På den syttende Dag i den syvende Måned sad Arken fast på Ararats Bjerge,","The ship rested in the seventh month, on the seventeenth day of the month, on Ararat's mountains.",14,15,186
" Det blev dog aldrig varmere end -10 gr, og det er for koldt til at der er noget at sige om vandniveauet.
Jeg har",".  For den sidste dag, var den vandstanden, der falder fra jorden konstant. efter afslutningen af en hundrede fem dage, vandstanden faldt.<|endoftext|>","På den syttende Dag i den syvende Måned sad Arken fast på Ararats Bjerge,","The ship rested in the seventh month, on the seventeenth day of the month, on Ararat's mountains.",15,15,186
" Det var helt vildt. Der skete mange ting, der pludselig viste sig at være virkelighed. Ikke kun det, at vores jord så ud til at blive","    Svaret på denne er 1000,000,000,000,000,000,000,000,000,000,000,000,000,000,000,000,000,0","På den syttende Dag i den syvende Måned sad Arken fast på Ararats Bjerge,","The ship rested in the seventh month, on the seventeenth day of the month, on Ararat's mountains.",16,15,186
" Det var i begyndelsen på august 2012.
Tusind tak for hjælpen!
Peter Thiese 8. juli","  Mitos:  ""Mennesket er et væsen, der vil udvikle sig til dets fulde potentiale, og dets udvikling er den eneste måde at være det, der vil blive det, og at blive det, der vil blive det, til den fulde karakter, som det er.    ""Mennesket er en del af det store billede, og det er det, som","På den syttende Dag i den syvende Måned sad Arken fast på Ararats Bjerge,","The ship rested in the seventh month, on the seventeenth day of the month, on Ararat's mountains.",17,15,186
"
Efter ca. 25 dage havde jeg fået plantet 600 m2 blomsterbed i et af de 3.sags",                                                                                                                                                           ,"På den syttende Dag i den syvende Måned sad Arken fast på Ararats Bjerge,","The ship rested in the seventh month, on the seventeenth day of the month, on Ararat's mountains.",18,15,186
"
Da den sidste del af vandføringen var brudt, og jeg begyndte at trække vandet, så jeg at de store sten faldt ned på mine hænder",.<|endoftext|>,"På den syttende Dag i den syvende Måned sad Arken fast på Ararats Bjerge,","The ship rested in the seventh month, on the seventeenth day of the month, on Ararat's mountains.",19,15,186
.<|endoftext|>," Efter 1000 dage, i det første år, i de første 1000 dage, efter 1000 dage, efter 1000 dage, efter 1000 dage, efter 1000 dage, efter 1000 dage, efter 1000 dage, efter 1000 dage","På den syttende Dag i den syvende Måned sad Arken fast på Ararats Bjerge,","The ship rested in the seventh month, on the seventeenth day of the month, on Ararat's mountains.",20,15,186
" Vi var da godt mætte, men kunne godt mærke, at vi var kørt træt i alt det vand, vi kunne drikke.
Bjørn og","  da: Det vil sige, at der ikke kan være nogen, der har mere på.    en: I'm a fan af 'The Forbryder.  da: Jeg er også for en forbryder.    da: I går blev der også for første gang.  da: For første gang også.    da: ""Vi ved, det er","På den syttende Dag i den syvende Måned sad Arken fast på Ararats Bjerge,","The ship rested in the seventh month, on the seventeenth day of the month, on Ararat's mountains.",21,15,186
.<|endoftext|>,.  Ler og dyr omkring dig og dyr i og omkring den.<|endoftext|>,"På den syttende Dag i den syvende Måned sad Arken fast på Ararats Bjerge,","The ship rested in the seventh month, on the seventeenth day of the month, on Ararat's mountains.",22,15,186
"

- Det var først, da vandstanden var 50 meter over havoverfladen, at vandet begyndte at vælte ud fra kysten","  8 And the land that is on the right side of the river was as good as the land on the left side.  9 And when the river became great, it became a great river, and it rose from the river.  10 And when the river became great, it became a great river, and it became a great river.  11 And when the river became","På den syttende Dag i den syvende Måned sad Arken fast på Ararats Bjerge,","The ship rested in the seventh month, on the seventeenth day of the month, on Ararat's mountains.",23,15,186
"
Vi har i vores kommune haft det problem med åen, at vandet har løbet ud i vandet af den grund. Men når vi kigger i vores",                                                                                                                                                            ,"På den syttende Dag i den syvende Måned sad Arken fast på Ararats Bjerge,","The ship rested in the seventh month, on the seventeenth day of the month, on Ararat's mountains.",0,2,186
