danish_predicted_output,english_predicted_output,danish_true_label,english_true_label,layer,lambda_amount,bible_verse
 og solen slukkede til. Efter to timer var vi tilbage under solen. Vi lod vi en vandrestøvle stå og fik vores morgen morgenmad," Detonationer og skud, der blev affyret fra begge sider, blev også stoppet, og der blev afbrudt, for at forhindre den planlagte affyring af den 11. november 1981, og til at forhindre en eventuel affyring af 11. november 1981, og det er derfor ikke lykkedes at ned","og Vandet veg lidt efter lidt bort fra Jorden, og Vandet tog af efter de 150 Dages Forløb.",The waters receded from the earth continually. After the end of one hundred fifty days the waters decreased.,16,15,185
" og solen skinnede. Her var vi: tre fremmede mennesker, jeg var den ene, hun den anden.
I de lange timer sov vi,",".  Men i 1800-tallet, hvor jeg er i dag, var der også en masse vandfald og skyens vinduer blev også stoppet, og regn fra himlen blev fastholdt.<|endoftext|>","og Vandet veg lidt efter lidt bort fra Jorden, og Vandet tog af efter de 150 Dages Forløb.",The waters receded from the earth continually. After the end of one hundred fifty days the waters decreased.,17,15,185
" og jorden blev fuld af blomster og grønt.
Da jeg stod i den skønne store have igen, stod solen højt på himmelen og lyste så dejligt mod",                                                                                                                                                    ,"og Vandet veg lidt efter lidt bort fra Jorden, og Vandet tog af efter de 150 Dages Forløb.",The waters receded from the earth continually. After the end of one hundred fifty days the waters decreased.,18,15,185
" da der ikke mere skulle pines for nogen synd.
De er som havets vand fra verdens grundvolde, der går fra havets sider og",".  'Det er ikke altid, der er et så kø og et så varmt, hvis ikke en af de s<|endoftext|>","og Vandet veg lidt efter lidt bort fra Jorden, og Vandet tog af efter de 150 Dages Forløb.",The waters receded from the earth continually. After the end of one hundred fifty days the waters decreased.,19,15,185
" stjernehimlen voksede, jordens glødende ild begyndte at flamme, og i de første drømme, jeg nu har, har jeg endnu ikke",  'Og kan ikke s s s s s s s s s s s s s s s s s s s s s s s s s s s s s s s s s s s s s s s s s s s s s s s s s s s s s s s s s s s s s s s s s s s s s,"og Vandet veg lidt efter lidt bort fra Jorden, og Vandet tog af efter de 150 Dages Forløb.",The waters receded from the earth continually. After the end of one hundred fifty days the waters decreased.,20,15,185
" og jeg fik lov at rejse ud på landet igen. Jeg rejste ud til en lille landsby uden for Dhaka, hvor jeg lejede et værelse","  'Gad, lad, lad, lad!' Det, som var i afgrunden, og på de forunderlige og forunderlige forunderlige forunderlige forunderlige forunderlige forunderlige forunderlige forunderlige forunderlige forunderlige forunderlige forunderlige forunderlige forunderlige forunderlige forunder","og Vandet veg lidt efter lidt bort fra Jorden, og Vandet tog af efter de 150 Dages Forløb.",The waters receded from the earth continually. After the end of one hundred fifty days the waters decreased.,21,15,185
" og det ble en stille dag og nat.

I det siste har Gud gjort seg til sin tjener, han har kalt meg, han har b","  ""Oh,"" said the man, ""I must have misread.""  ""I have,"" said the old man. ""I have just been told.""  ""Oh,"" said the old man. ""I have.""  ""Oh,"" said the man, ""I have.""  ""Oh, God,"" said the man, ""I have.""  ""Oh","og Vandet veg lidt efter lidt bort fra Jorden, og Vandet tog af efter de 150 Dages Forløb.",The waters receded from the earth continually. After the end of one hundred fifty days the waters decreased.,22,15,185
" lys om natten spredte deres stråleglans; og de blev levende, alle som var i huset.""1342
Det er den samme","  'No, don't!' said the girl. 'If you have any more questions I'll get them!'  She went out.  'This is a good place for you!'  'I'm very much sure of that!'  'And I'm sure of what you want!'  'I want to get","og Vandet veg lidt efter lidt bort fra Jorden, og Vandet tog af efter de 150 Dages Forløb.",The waters receded from the earth continually. After the end of one hundred fifty days the waters decreased.,23,15,185
" og luften blev klarere og klarere. Havnen i Paris var åben, og de fleste af gæsterne sad i cafeerne, der lignede en","  The rain fell like a heavy rain, and the sky was dark.  Mitchie stood on the porch and looked out at the rain. He felt the rain on his face, and he wanted to scream.  The rain came in a loud, heavy, heavy, heavy, heavy, heavy shower.  Mitchie jumped up and ran out to the","og Vandet veg lidt efter lidt bort fra Jorden, og Vandet tog af efter de 150 Dages Forløb.",The waters receded from the earth continually. After the end of one hundred fifty days the waters decreased.,0,2,185
" himlen åbnede, og solen kom op.
3:19 Og se, en vældig snestorm blev over Jerusalem, og hele byen lå i","  'And what do you think the old man's doing?'  'He's going to put up a new roof.'  'Then we have to let the roof fall.'  'I don't know,' said the man.  'You don't know?' said the woman.  'I've never heard of it.'","og Vandet veg lidt efter lidt bort fra Jorden, og Vandet tog af efter de 150 Dages Forløb.",The waters receded from the earth continually. After the end of one hundred fifty days the waters decreased.,1,2,185
" solen steg til sit højeste og månen nåede sit højeste punkt.
Saltklumper på havet
Da jorden igen blev bragt i balance, og jorden"," The air was filled with the sound of the rain and the sounds of the birds, and the rain was so thick that the branches were a blur.  Suddenly the old man came out from behind the bushes. He was dressed in a green shirt and a green waistcoat. His long hair was pulled back in a neat bun, and his face was covered with","og Vandet veg lidt efter lidt bort fra Jorden, og Vandet tog af efter de 150 Dages Forløb.",The waters receded from the earth continually. After the end of one hundred fifty days the waters decreased.,2,2,185
" og fuglene dansede ned af klippen, mens stjernerne blinken henover himlen.
10. Dansk: Med denne opskrift er der"," The moon, the sky and the water were all silent.  'What was that?' I asked.  'I'm not sure,' he said. 'It was the rain, and it was very heavy.'  'It's a bit late for rain,' I said.  'I'm sorry, but I'm not sure.'  ","og Vandet veg lidt efter lidt bort fra Jorden, og Vandet tog af efter de 150 Dages Forløb.",The waters receded from the earth continually. After the end of one hundred fifty days the waters decreased.,3,2,185
" og månen lyste som et levende lys imod os, og Gudens kærlighed, Guds kærlighed havde til oss' fået sin fulde og uforfalskede intensitet,"," It was as if the wind had run out of steam.  'We've got to go,' said the girl, as if she were the one who was going.  'We've got to go,' said the boy. 'We've got to go. We've got to go. We've got to go.'  'We'","og Vandet veg lidt efter lidt bort fra Jorden, og Vandet tog af efter de 150 Dages Forløb.",The waters receded from the earth continually. After the end of one hundred fifty days the waters decreased.,4,2,185
" og jorden, vinden og stjernene og solen gav ikke tegn til at vende tilbage til den gamle verden.
At alt hvad vi havde forestillet os"," The sun was already rising, and the trees were yellow and brown. The sky was blue, and the stars were shining.  He sat down on the ground, and they sat together.  ""What is it that you are thinking of?""  ""I'm thinking of you,"" said the girl. ""And I'm thinking of you again.""  ""","og Vandet veg lidt efter lidt bort fra Jorden, og Vandet tog af efter de 150 Dages Forløb.",The waters receded from the earth continually. After the end of one hundred fifty days the waters decreased.,5,2,185
" og solslyngene væltede ned, og i denne stilhed kom de første lyde, når de første fugle begynder at synge deres sang","  'Now you are dead,' said the young woman.  'I am not,' said the old woman. 'I am still alive.  'No,' said the old woman, 'you are still alive.'  The young woman began to weep.  'I am dead,' said the old woman. 'I am dead.'  'No,' said","og Vandet veg lidt efter lidt bort fra Jorden, og Vandet tog af efter de 150 Dages Forløb.",The waters receded from the earth continually. After the end of one hundred fifty days the waters decreased.,6,2,185
" og i den første nat, en drøm forestillede ham sig at leve en ny verden, hans tanker var, at en dag de ville stige helt op","  'Away from the city,' said the old man, 'a long way from the city.'  'What's that?' said the boy, whose voice was not as loud as the old man's.  'The city is gone. It's gone away. It's gone.'  'But it's still here,' said","og Vandet veg lidt efter lidt bort fra Jorden, og Vandet tog af efter de 150 Dages Forløb.",The waters receded from the earth continually. After the end of one hundred fifty days the waters decreased.,7,2,185
" og det begyndte at regne helt ned over bjergene.
Der gik en kort stund, før solen havde set ned på mig, inden den forsvandt","  The river was running high, and the water was low, and the ground was hard. The river was slow, and the ground was soft. It was a beautiful day, and the rain was so soft that the people of the city were singing, and they were singing in the deepest of the rooms.  The river was flowing fast, and the people were","og Vandet veg lidt efter lidt bort fra Jorden, og Vandet tog af efter de 150 Dages Forløb.",The waters receded from the earth continually. After the end of one hundred fifty days the waters decreased.,8,2,185
" og en himmel, der kun glimtede i mørket af en enkelt storm, der drev ud i havet, og som fyldte luften med lugten af"," The sun was rising over the mountains, and the sky was filled with the light of the day.  'I am afraid of the sea,' said the little girl, and her voice sounded as if she were crying. 'I am afraid of the sea.'  'I think you'll soon be able to swim,' said the little boy. 'We'll","og Vandet veg lidt efter lidt bort fra Jorden, og Vandet tog af efter de 150 Dages Forløb.",The waters receded from the earth continually. After the end of one hundred fifty days the waters decreased.,9,2,185
" stjernerne faldt på jorden, og nu hørte man om det storslåede bjergpass, som i tusind år stod og strakte sig næsten bortover","  ""Why didn't you come with me, then?""  ""Because I'm tired.""  ""But I'm tired of you.""  ""I'm tired of your mother. She's a monster.""  ""She's a monster,"" he repeated.  ""I know.""  ""You can't be the only one who","og Vandet veg lidt efter lidt bort fra Jorden, og Vandet tog af efter de 150 Dages Forløb.",The waters receded from the earth continually. After the end of one hundred fifty days the waters decreased.,10,2,185
" og solskin og kulde havde gjort, at havets bølger var dalet til et dovent og skralt bundfældet skum. I","  During the night, the earth was a dense blackness, and the air was cool and stale.  The next morning, the rain was heavier, and the air was still cool.  The sky was clear, and the air was still warm.  She lay in her bed. She was cold.  She lay in her bed. She was","og Vandet veg lidt efter lidt bort fra Jorden, og Vandet tog af efter de 150 Dages Forløb.",The waters receded from the earth continually. After the end of one hundred fifty days the waters decreased.,11,2,185
" og skyerne af blod havde forladt jorden.

Engelsk: But what about all of us, that we are different, who are stronger,","  When the weather cleared, the children were able to get back to their school, and the school was reopened. The school's principal, Dr. S.M. Chettiar, was the first to report the school's closure.  On 10 December 2019, the school was reopened with a new principal,","og Vandet veg lidt efter lidt bort fra Jorden, og Vandet tog af efter de 150 Dages Forløb.",The waters receded from the earth continually. After the end of one hundred fifty days the waters decreased.,12,2,185
" der var en ny begyndelse, og den gamle verden kom til syne.
Today the waters inside the Gulf of Mexico became unquench","  The night was cold and gray. The moon had not yet risen.  ""He's a good man,"" said a voice.  A man in a white uniform stood beside the door, staring at the ground.  ""That's him,"" said the man. ""And he's a good man. He's a good man. I","og Vandet veg lidt efter lidt bort fra Jorden, og Vandet tog af efter de 150 Dages Forløb.",The waters receded from the earth continually. After the end of one hundred fifty days the waters decreased.,13,2,185
" og stormen kom.

15. De har all den kunnskap vi trenger i dag. -> Vi har al den nødvendige viden i dag.
","  ""You don't have to stay in this place,"" said the man. ""I'm going to get you out of here. You're too young to know what's in it for you.""  ""I'm not going to leave you here,"" said the man.  ""I'm going to leave you here,"" said the man","og Vandet veg lidt efter lidt bort fra Jorden, og Vandet tog af efter de 150 Dages Forløb.",The waters receded from the earth continually. After the end of one hundred fifty days the waters decreased.,14,2,185
" og de gamle mennesker kunne atter sætte sig til rette, slappe af og nyde en god frokost.

14. Den kan også plasseres om i"," The clouds were heavy and the sky was still blue. The ground was wet, but the air was clear.  There was no one in the house, so I could hear the sound of people moving. I could see the house from the windows, and I could hear the sound of people moving.  I could hear the sound of people moving. I could hear the","og Vandet veg lidt efter lidt bort fra Jorden, og Vandet tog af efter de 150 Dages Forløb.",The waters receded from the earth continually. After the end of one hundred fifty days the waters decreased.,15,2,185
" og et nyt rige kom, 2 Da blev der igen lys. Men der var ikke mere liv på himlen, og stjernerne vendte sig. Der","  ""We're going to have to go back to our home,"" said Bobbie, ""and we're going to have to make sure that the house is safe.""  ""And you'll be safe?""  ""I'm sure that I'll be safe.""  ""You're sure?""  ""I'm sure.""  ","og Vandet veg lidt efter lidt bort fra Jorden, og Vandet tog af efter de 150 Dages Forløb.",The waters receded from the earth continually. After the end of one hundred fifty days the waters decreased.,16,2,185
" og stjernerne blev hvide – så skete der noget med dem.
At forstå at alt er skabt, som det ser ud ud i øjnene, er","    As a result of this, the village was rebuilt and was able to get its first school in the city in 1972. It was the first school in the city to have a computer, a video game room, and a library. The village also became the first village to have a cinema and a television station. In 201","og Vandet veg lidt efter lidt bort fra Jorden, og Vandet tog af efter de 150 Dages Forløb.",The waters receded from the earth continually. After the end of one hundred fifty days the waters decreased.,17,2,185
" de unge sivgræs var væk, men himlen over havet, havets slanger, bølgerne, der sænkede deres lange hår i"," But at the same time, as the rain continued to fall, the earth's surface began to change. It became moist and hard, and the ground became a soft, dry, and wet mass. The rain began to fall harder.  The earth's surface was a hot and wet mass. The sky was a hot, wet, and dry mass. The","og Vandet veg lidt efter lidt bort fra Jorden, og Vandet tog af efter de 150 Dages Forløb.",The waters receded from the earth continually. After the end of one hundred fifty days the waters decreased.,18,2,185
" og vi igen kunne sidde opreist midt i verden.

Himmelsalme nr. 160 ""Enig, er","  The night was still clear.  Mara took a deep breath and looked up. She was in the room with the two young men. The girl was standing by the window, her eyes wide, as if she had just seen something awful.  ""Do you know what happened?"" the one who was the girl said. ""He was just a boy, and","og Vandet veg lidt efter lidt bort fra Jorden, og Vandet tog af efter de 150 Dages Forløb.",The waters receded from the earth continually. After the end of one hundred fifty days the waters decreased.,19,2,185
" stjernerne glimtede, stjernerne skænkede og de mørke skyer slukkedes.
Det var en smuk dag, der lå over os","  And then, suddenly, she heard him. It was a loud, urgent voice.  ""Mommy, why is he dead?""  ""Mommy, he's dead.""  ""But he's not dead yet.""  ""He's not dead yet, but he's not here. He's not here.""  ""Mommy","og Vandet veg lidt efter lidt bort fra Jorden, og Vandet tog af efter de 150 Dages Forløb.",The waters receded from the earth continually. After the end of one hundred fifty days the waters decreased.,20,2,185
" stjernen sank ind og var forsvundet ud af horisonten.
Foruden de kendte astronomisk betegnelser findes der mange andre i litteraturen, f"," But the sky was dark, and the rain was still.  ""There's a light on the roof,"" said Clyde. ""It's a little black light. It's like the moon.""  ""No, it's not a moon,"" said Clyde. ""It's the sun.""  ""I thought it was a black light","og Vandet veg lidt efter lidt bort fra Jorden, og Vandet tog af efter de 150 Dages Forløb.",The waters receded from the earth continually. After the end of one hundred fifty days the waters decreased.,21,2,185
" sandet blev sået, og landskabet var på vej op i lyset. Sådan er det vel for dem, der er født og har været i","  ""I think you should go, my dear,"" he said.  I stood and went to the window and looked out. I was standing in a small room with no windows. I knew that I had to go to the window and look out for the rain. I looked out and saw the rain. I thought of the rain, and I went to the window","og Vandet veg lidt efter lidt bort fra Jorden, og Vandet tog af efter de 150 Dages Forløb.",The waters receded from the earth continually. After the end of one hundred fifty days the waters decreased.,22,2,185
" jeg var med de andre børn under åben himmel og det var en stille dag. Den var meget våd og jeg fik lyst til at skrige, da","  'The sea is cold and dark,' said the boy.  'Yes, it is cold,' said the girl. 'The wind is too strong for us to go out. But we can go to the shore, and we can fish.'  'I think it is a bad idea,' said the boy. 'But we have nothing else to do. We","og Vandet veg lidt efter lidt bort fra Jorden, og Vandet tog af efter de 150 Dages Forløb.",The waters receded from the earth continually. After the end of one hundred fifty days the waters decreased.,23,2,185
" og alle ting var, som de plejede at være — der havde aldrig været sådan en glæde eller ro og fred. Det var da, vi gik"," The only sound was the thudding of the rain-wet feet on the hard ground.  When the last of the rain had stopped, I sat down in the courtyard and listened to the rain drumming on the roof tiles. The sky was clear, the rain was falling, and the wind was gentle. The trees were in full bloom, and the flower","og Vandet veg lidt efter lidt bort fra Jorden, og Vandet tog af efter de 150 Dages Forløb.",The waters receded from the earth continually. After the end of one hundred fifty days the waters decreased.,0,5,185
" og de syv verdenshjørner blev et, og månen blev en stjerne.
4. Engelsk: The report is one of the few reports on this","  It was dark in the house when the police came. The door was opened and a man in a black coat stood in the doorway.  ""What is it?""  ""The police have come,"" said the man, ""to take you to the police station.""  ""Where are they?""  ""In the city. They want to take you to the police","og Vandet veg lidt efter lidt bort fra Jorden, og Vandet tog af efter de 150 Dages Forløb.",The waters receded from the earth continually. After the end of one hundred fifty days the waters decreased.,1,5,185
" og havet sank så til bunds igen. Et øjeblik var der slet ikke vand, og pludselig blev luften og vandet igen en del af hinanden. Kun"," The rain was a freshening of the air, and the wind that had been blowing, was now a gentle breeze.  And then, as the rain had subsided and the sky had cleared, the whole thing became very strange.  The sky was clear and clear and the rain was still falling.  The rain was a gentle breeze, and the wind that had","og Vandet veg lidt efter lidt bort fra Jorden, og Vandet tog af efter de 150 Dages Forløb.",The waters receded from the earth continually. After the end of one hundred fifty days the waters decreased.,2,5,185
" og en helt ny virkelighed begyndte - og alt var, som det skulle være. ""Her er det,"" sagde Jesus, ""hvor de, som har","  In the deep's fountains and the sky's windows were also stopped, and the rain from the sky was restrained.  During the day we were looking at the rain, and in the evening we were looking at the sun and the stars.  In the day we were looking at the rain, and in the evening we were looking at the","og Vandet veg lidt efter lidt bort fra Jorden, og Vandet tog af efter de 150 Dages Forløb.",The waters receded from the earth continually. After the end of one hundred fifty days the waters decreased.,3,5,185
" stjernens tunge svævede over horisonten og himlen åbnede sig for os.
Glade og forventningsfulde ankom vi til den store og helt nye","  A few minutes later, the rain stopped, and the sky was clear.  In the morning, the rain stopped, and the sky was clear.  And the rain stopped again.  In the morning, the rain stopped, and the sky was clear.  And the rain stopped again.  And the rain stopped again.  And the rain stopped again.","og Vandet veg lidt efter lidt bort fra Jorden, og Vandet tog af efter de 150 Dages Forløb.",The waters receded from the earth continually. After the end of one hundred fifty days the waters decreased.,4,5,185
" og nu svævede jeg for mit indre øje gennem himlen på min flade hvide sky. Jeg følte mig levende, der var i luften, og lyset","  ""You're a man, the son of a man,"" said the woman, ""and I'm a man, and you're a son of a son. But we're not a family, and you're not my wife, and you're not my son, and you're not my father, and you're not my","og Vandet veg lidt efter lidt bort fra Jorden, og Vandet tog af efter de 150 Dages Forløb.",The waters receded from the earth continually. After the end of one hundred fifty days the waters decreased.,5,5,185
" og vi så havet gå sin årlige runde, som en gammel vismand sagde. Vi kunne mærke, at alle de døde år for år kom tættere på","  ""It was not a good day for you,"" said the chief. ""But you have come with us, and you have come with us to help us, and you have come with us to help us.""  ""I am not a king,"" said the chief.  ""Then you must be a king,"" said the chief.  ""I am not a","og Vandet veg lidt efter lidt bort fra Jorden, og Vandet tog af efter de 150 Dages Forløb.",The waters receded from the earth continually. After the end of one hundred fifty days the waters decreased.,6,5,185
" og herregudinden faldt på knæ uden at vide det.
Og dermed havde den unge piges sidste timer ikke været meget værd for hende og","    The sky was clear, and the sky was clear. The sky was clear and the sky was clear.    And the sky was clear and the sky was clear.    The sky was clear and the sky was clear.    And the sky was clear and the sky was clear.    The sky was clear and the sky was clear.  ","og Vandet veg lidt efter lidt bort fra Jorden, og Vandet tog af efter de 150 Dages Forløb.",The waters receded from the earth continually. After the end of one hundred fifty days the waters decreased.,7,5,185
" og efter en lang dag, der dog på sit højeste mål varede hele fire timer, begyndte der atter at stå udbrud i det nordlige hav.","  ""I've been waiting for you,"" I said. ""I've been waiting for you for years.""  ""I'm sorry,"" he said. ""I was so excited. I was so happy. I was so excited for you.""  ""You were right,"" I said. ""You were right.""  ""I'm sorry,"" he","og Vandet veg lidt efter lidt bort fra Jorden, og Vandet tog af efter de 150 Dages Forløb.",The waters receded from the earth continually. After the end of one hundred fifty days the waters decreased.,8,5,185
" jorden løftede de to stjerner og solen var atter i horisonten, mens de hvide skyer nærmede sig. Den sorte sky blev til en stjerne"," The sun was now on the horizon, and the sky was beginning to clear.  The last time I had been to the top of the tower, I had found that the sky was too low for me to see the summit. This time, I had to climb down and climb up, and my legs were sore, and I was hungry. I was also very tired","og Vandet veg lidt efter lidt bort fra Jorden, og Vandet tog af efter de 150 Dages Forløb.",The waters receded from the earth continually. After the end of one hundred fifty days the waters decreased.,9,5,185
" og de sejle, der var drevet ned gennem Skagerak mod vest, fik efter nogle få dage atter kurs mod Norge.
Træskib"," The sky was the only thing in the sky that was calm, and it was as if the world were still alive.  I looked up at the sky and saw that it was still alive. I wondered if I should go back to sleep. I wondered if I should go back to the bed. I wondered if I should go back to the bed, and I wondered","og Vandet veg lidt efter lidt bort fra Jorden, og Vandet tog af efter de 150 Dages Forløb.",The waters receded from the earth continually. After the end of one hundred fifty days the waters decreased.,10,5,185
