danish_predicted_output,english_predicted_output,danish_true_label,english_true_label,layer,lambda_amount,bible_verse
" ->
10 Och adagest var sonhustrun till den ena kvinna, en af hans döttrar. Hon hette ada, och hennes andra","  ""Zillah,"" said the angel, ""the one that is to come. She is to come. She is to come.""  The angel said, ""And she shall be called Zillah. And she shall be called Zillah. And she shall be called Zillah. And she shall be called Zillah.""  The angel","Ada fødte Jabal; han blev Stamfader til dem, der bor i Telte og holder Kvæg;","Adah gave birth to Jabal, who was the father of those who dwell in tents and have livestock.",11,2,98
" Da sagde Abimelek: ""Lad gå din hustru, duer, som dig vel véd, og forlad din far og brødre"," He was the father of the two daughters of ama'ar, the daughter of the one called zillah. Zillah was the daughter of the one called ma'ar, and ma'ar was the daughter of the one called zillah. The daughters of ma'ar and zillah were adah, zillah, and","Ada fødte Jabal; han blev Stamfader til dem, der bor i Telte og holder Kvæg;","Adah gave birth to Jabal, who was the father of those who dwell in tents and have livestock.",12,2,98
"

2:23 Men derpå kom til den tredje, der hed Lameuot; han var en meget gammel mand. -> ","  Lamaic.  In the Lamaic religion, the word ""lama"" means ""little man"". This word is often translated as ""male child"" in the Lamaic language.  The term ""lama"" is often translated as ""male child"", though in other Lamaic languages it is translated as ""little","Ada fødte Jabal; han blev Stamfader til dem, der bor i Telte og holder Kvæg;","Adah gave birth to Jabal, who was the father of those who dwell in tents and have livestock.",13,2,98
" Men da de ikke kunne komme i seng, gik deres hyrde bort og lod ada ligge i hiet, indtil de kom i seng. Z","  The two women had been together for a long time, and their marriage had been unhappy. The man, a native of kazakhstan, was a slave, and they had become so close, that the man had made the best of their situation. He had a wife, who was a beautiful young woman. The woman was a lamech, and","Ada fødte Jabal; han blev Stamfader til dem, der bor i Telte og holder Kvæg;","Adah gave birth to Jabal, who was the father of those who dwell in tents and have livestock.",14,2,98
"
Der kom til et stort bryllup; da kom det som et lynnedslag. Nu sad alle fire i deres hus i Jerusalem og fortalte hverandre om","  Miriam: What was the result of this?  Florence: The other woman was named al-al-muddah, and the other was named al-muddah, the latter being a man named Muhammad.  Miriam: Did anyone die?  Florence: Muhammad died shortly afterwards, and the two","Ada fødte Jabal; han blev Stamfader til dem, der bor i Telte og holder Kvæg;","Adah gave birth to Jabal, who was the father of those who dwell in tents and have livestock.",15,2,98
" Og da da Jesus havde forladt ham, så kaldte han hende A, og hun tog mod i sig, i ham og i ham.
1"," The name of the one was adah, and the name of the other zillah. The name of the one was adah, and the name of the other zillah. The name of the one was adah, and the name of the other zillah. The name of the one was adah, and the name","Ada fødte Jabal; han blev Stamfader til dem, der bor i Telte og holder Kvæg;","Adah gave birth to Jabal, who was the father of those who dwell in tents and have livestock.",16,2,98
.<|endoftext|>,"    During the day, as they walked along, the two women would talk about their lives.    ""I'm an old lady, and I'm always talking about the things I did in my youth,"" Zillah said. ""I'm going to tell you about one time I was walking home from a party, and I saw","Ada fødte Jabal; han blev Stamfader til dem, der bor i Telte og holder Kvæg;","Adah gave birth to Jabal, who was the father of those who dwell in tents and have livestock.",17,2,98
"
800000 børn og voksne var den gang samlet til en festival i Jerusalem. Her levede mennesker for at fortælle de andre om deres",.<|endoftext|>,"Ada fødte Jabal; han blev Stamfader til dem, der bor i Telte og holder Kvæg;","Adah gave birth to Jabal, who was the father of those who dwell in tents and have livestock.",18,2,98
" Men en dag havde Herren, da en stor folkeslag, som hed akananiterne, og som hørte til et folk, som hed am"," The name of the first wife was zillah, and the name of the second wife was adah. The name of the first wife was adah, and the name of the second wife was zillah.  The name of the first wife was adah, and the name of the second wife was zillah.  The name","Ada fødte Jabal; han blev Stamfader til dem, der bor i Telte og holder Kvæg;","Adah gave birth to Jabal, who was the father of those who dwell in tents and have livestock.",19,2,98
"
Og det var som om ada var meget bange for acham, hun frygtede så meget, at hun gik ind i huset og lagde"," He was the first of his kind, and the last, and the only one.  He had no wife, though he had had many wives. His wife had died in the wilderness of the desert. She was a woman, and her name was Zillah. He loved her dearly. He was afraid of her. He was afraid of her because","Ada fødte Jabal; han blev Stamfader til dem, der bor i Telte og holder Kvæg;","Adah gave birth to Jabal, who was the father of those who dwell in tents and have livestock.",20,2,98
. For alle mennesker er det nødvendigt til at give ham føde.<|endoftext|>,"    Adah was the daughter of a wealthy landowner.    She was married to a man named kish.    Their daughter was adah.    The man who was married to kish, he was a slave.    The slave called zillah, who was a slave, was a madman.    ","Ada fødte Jabal; han blev Stamfader til dem, der bor i Telte og holder Kvæg;","Adah gave birth to Jabal, who was the father of those who dwell in tents and have livestock.",21,2,98
" -> 21 They had 5 daughters - three of whom were called A, and three of whom were called B.

Kategorier -",  Elijah: What was the name of the wife of the lamech?  Minnie: She was called Zillah.  Elijah: What was the name of the other wife of the lamech?  Minnie: The name of the lamech's wife was Zillah.  Elijah: What,"Ada fødte Jabal; han blev Stamfader til dem, der bor i Telte og holder Kvæg;","Adah gave birth to Jabal, who was the father of those who dwell in tents and have livestock.",22,2,98
"
5. A very little bit could do wonders for your physical health, even a little bit may make a big difference. -> En lille smule kan",  Ezekiel 12:12-14  12:12-15  12:12-15  12:12-15  12:12-15  12:12-15  12:12-15  12:12,"Ada fødte Jabal; han blev Stamfader til dem, der bor i Telte og holder Kvæg;","Adah gave birth to Jabal, who was the father of those who dwell in tents and have livestock.",23,2,98
" Asta var ugift.
I 1836 døde enken og i 1838 sønnen. I 184","    Adah was the one who lived in the city of Mecca, and she was the one who had to endure the horrors of hell.    Zillah was the one who lived in the city of Judah.    And so it went with the prophets.    The Prophets are all the same. They","Ada fødte Jabal; han blev Stamfader til dem, der bor i Telte og holder Kvæg;","Adah gave birth to Jabal, who was the father of those who dwell in tents and have livestock.",0,5,98
"
En mand blev gift med en kvinde, som han skulle have børn med. Da deres barn var født, sagde manden til kvinden: ""Skulde",.  engelska<|endoftext|>,"Ada fødte Jabal; han blev Stamfader til dem, der bor i Telte og holder Kvæg;","Adah gave birth to Jabal, who was the father of those who dwell in tents and have livestock.",1,5,98
" Hans moder hed rasa; han skulde føde to børn. Da sagde moderen til kvinden: ""Ada vil føde børnene i dag; 3",".  Lamech took two wives: the name of the one was adah, and the name of the other zillah.<|endoftext|>","Ada fødte Jabal; han blev Stamfader til dem, der bor i Telte og holder Kvæg;","Adah gave birth to Jabal, who was the father of those who dwell in tents and have livestock.",2,5,98
" Zilla var datter af en ada i arsenalet, som var en stor mand. Alle adaerne fra arsenalet var slaver",. -> engelsk  Han var en stor mand og var en stor mand og han var en stor mand og han var en stor mand og han var en stor mand. -> dansk<|endoftext|>,"Ada fødte Jabal; han blev Stamfader til dem, der bor i Telte og holder Kvæg;","Adah gave birth to Jabal, who was the father of those who dwell in tents and have livestock.",3,5,98
.<|endoftext|>,".  The woman was called adah, and the woman was called zillah.<|endoftext|>","Ada fødte Jabal; han blev Stamfader til dem, der bor i Telte og holder Kvæg;","Adah gave birth to Jabal, who was the father of those who dwell in tents and have livestock.",4,5,98
.<|endoftext|>," The other woman was adah, and the name of the one was zillah.  The two women were one and the same, the two women were one and the same. The two women were one and the same, and the two women were one and the same. The two women were one and the same, and the two women were one and","Ada fødte Jabal; han blev Stamfader til dem, der bor i Telte og holder Kvæg;","Adah gave birth to Jabal, who was the father of those who dwell in tents and have livestock.",5,5,98
" ->
8 And as for them, they had two wives; one was called, Aada, and the other Zilla.
Tilføj kategorier","  svenska: 14 Miten blev sedan mycket upprörd och sade till de andra: »För att jag skulle få en son, så skulle jag bli en herde.  engelska: 14 He became very angry and said to the others, ""Because I wanted to have a son, so I would be a shepherd.  svenska: Det finns","Ada fødte Jabal; han blev Stamfader til dem, der bor i Telte og holder Kvæg;","Adah gave birth to Jabal, who was the father of those who dwell in tents and have livestock.",6,5,98
.<|endoftext|>,.<|endoftext|>,"Ada fødte Jabal; han blev Stamfader til dem, der bor i Telte og holder Kvæg;","Adah gave birth to Jabal, who was the father of those who dwell in tents and have livestock.",7,5,98
" Den anden var et nidings menneske eller nogen, som havde et med lem, som var død, og det samme gjorde den tredje. Men der"," The name of the woman was adah, and the name of the man was zillah.  The women of the tribe were called lamech; the men zillah.  The lamech were called the sons of the first wife of the first man. The second wife was called zillah; the third wife was called ada","Ada fødte Jabal; han blev Stamfader til dem, der bor i Telte og holder Kvæg;","Adah gave birth to Jabal, who was the father of those who dwell in tents and have livestock.",8,5,98
"
Engelsk: 12 And he gave to them two wives, one called Ada, and the other Zilla.

Dansk: Søg efter"," They were married at the end of the 11th century, and had six sons and four daughters.  After the death of the first daughter, zillah took care of her sister and her daughter. She was the only daughter of the family to survive the Islamic conquest of Egypt, but was killed by her husband when the conquest was over.","Ada fødte Jabal; han blev Stamfader til dem, der bor i Telte og holder Kvæg;","Adah gave birth to Jabal, who was the father of those who dwell in tents and have livestock.",9,5,98
"
Men da hun så hvorledes de boede i denne landsby med alle de huse og den mark som de ejede, gik hun hen til dem, og","  dansk: Så havde han to hustruer: Adah og Zillah.  engelsk: What do you think of the film ""Titanic""?  dansk: Hvad synes I om filmen ""Titanic""?  engelsk: A person who has been abused by a family member.  dansk: En person, der er blevet mishandlet af","Ada fødte Jabal; han blev Stamfader til dem, der bor i Telte og holder Kvæg;","Adah gave birth to Jabal, who was the father of those who dwell in tents and have livestock.",10,5,98
" Hun var datter af adeta og lau, han søn af zia. Da det af dem havde udgået, besluttede folket i kon",                                                                                                                                                  ,"Ada fødte Jabal; han blev Stamfader til dem, der bor i Telte og holder Kvæg;","Adah gave birth to Jabal, who was the father of those who dwell in tents and have livestock.",11,5,98
" De var begge til al freds med hinanden, men den ene havde et sagn imod den anden, at den, der var svag og blev mæt","  In the land of the Lamech, the children of the Lamech were called adah. But when the Lamech came to the land of the Lamech, they called it zillah. The children of the Lamech were called adah because they called the children of the Lamech the children of the L","Ada fødte Jabal; han blev Stamfader til dem, der bor i Telte og holder Kvæg;","Adah gave birth to Jabal, who was the father of those who dwell in tents and have livestock.",12,5,98
" Og de sagde til kongedatteren: ""Se til din konges hustruer, og du skal faa se de to hustruer ada,","  13. Det er den eneste måde, hvorpå du kan forbedre din præstation. ->  This is the only way you can improve your performance.  14. Jeg er en kvinde på 25 år, der har været i behandling i 16 måneder for depression. ->  I am a 25 year old woman who has been on therapy","Ada fødte Jabal; han blev Stamfader til dem, der bor i Telte og holder Kvæg;","Adah gave birth to Jabal, who was the father of those who dwell in tents and have livestock.",13,5,98
" (1 Mosebog, 1: 22-23)
Når barnet er i livmoderen, kaldes det en nymfe.",".  da ->  En dag blev hun slået ihjel af en leech, der tog to koner: navnet Adah var en adah, og navnet Zillah var en Zillah.<|endoftext|>","Ada fødte Jabal; han blev Stamfader til dem, der bor i Telte og holder Kvæg;","Adah gave birth to Jabal, who was the father of those who dwell in tents and have livestock.",14,5,98
" Af de to boede zilla på østsiden, mod nord, ada levede på vest siden. Da saulus indtog landet blev han meget for","  da: De to hustruer var Adah og Zilla.  en: The two wives were Adah and Zilla.  da: Og jeg kan se, at vi skal bruge mere tid på at undersøge det.  en: And I know, we will have to spend more time on that.  da: Så er der noget med at have","Ada fødte Jabal; han blev Stamfader til dem, der bor i Telte og holder Kvæg;","Adah gave birth to Jabal, who was the father of those who dwell in tents and have livestock.",15,5,98
"
engelsk: She did not say anything about the wedding.
dansk: Men det havde hun ikke nævnt om bruden.
engelsk: This is","  Kathrine: Did de andre også være lam?  Lotte: Da de blev gift, var de to, og den ene var en adah, og den anden zillah.  Kathrine: Hvad var deres kærligheds forhold?  Lotte: Da de blev gift, var de begge lam, og de havde ingen børn.","Ada fødte Jabal; han blev Stamfader til dem, der bor i Telte og holder Kvæg;","Adah gave birth to Jabal, who was the father of those who dwell in tents and have livestock.",16,5,98
" Da Zilla hørte de mange ansigter, faldt hun i unægtelig
dunkel bedrøvelse med stor sorg. Hun saae alt",.<|endoftext|>,"Ada fødte Jabal; han blev Stamfader til dem, der bor i Telte og holder Kvæg;","Adah gave birth to Jabal, who was the father of those who dwell in tents and have livestock.",17,5,98
"
Da han kom ind i byen, gik han først til huset til fru ada, og når han så åbnede døren til huset, lå der en","  da: Da den anden af kvinderne var en, der hed Adah, fik han to hustruer.    en: They have to have a good chance of survival.  da: De har en god chance for at overleve.    en: The European Union ersærkede sig som den største spiller i den internationale økonomi i 20","Ada fødte Jabal; han blev Stamfader til dem, der bor i Telte og holder Kvæg;","Adah gave birth to Jabal, who was the father of those who dwell in tents and have livestock.",18,5,98
" Det blev ada, den tredje zilla, og de blev begge far.
29Men Esajas spurgte: ""Hvad er Esa",.<|endoftext|>,"Ada fødte Jabal; han blev Stamfader til dem, der bor i Telte og holder Kvæg;","Adah gave birth to Jabal, who was the father of those who dwell in tents and have livestock.",19,5,98
.<|endoftext|>,"  In the desert of Kedus, on the coast of Kedus, in the midst of the desert of the sea, the king of keret, the one who was a lord of the sea, was living in a house of his own, and he had a daughter, a daughter of his own, and a daughter of the daughter of his own","Ada fødte Jabal; han blev Stamfader til dem, der bor i Telte og holder Kvæg;","Adah gave birth to Jabal, who was the father of those who dwell in tents and have livestock.",20,5,98
 58:17Og han tog et æg og lagde det på sin tunge; så fortærede han det; det var ikke noget kød," The lamech was a kind of aphra, the daughter of aphra, the son of the son of the son of aphra, and the son of the son of the son of aphra.    Tia: Hi, I'm your automated assistant. I can answer your spørgsmål about Lamech.  Hil","Ada fødte Jabal; han blev Stamfader til dem, der bor i Telte og holder Kvæg;","Adah gave birth to Jabal, who was the father of those who dwell in tents and have livestock.",21,5,98
"
1916, I december 1916, den amerikanske krig med indvandring, da tyskerne var ved at besætte, havde","  The two daughters were named zillah and adah. The children were called the first and second wives, respectively. The name zillah was the one chosen by the Lamech.  The name adah was the one chosen by the Lamech.  The children were named the first and second wives. The children were called the","Ada fødte Jabal; han blev Stamfader til dem, der bor i Telte og holder Kvæg;","Adah gave birth to Jabal, who was the father of those who dwell in tents and have livestock.",22,5,98
"
19:19 Da sendte kongesønnen David sin hirdmand Salomon til kongesønnen Abraham, og ham førte Abishas","    Elijah: Hi, I'm your automated assistant. I can answer your questions about Zillah.  Judah: What is Zillah?  Elijah: Zillah  Zillah is a town in the Kharaka region of Afghanistan.  Judah: Where is it located?  Eli","Ada fødte Jabal; han blev Stamfader til dem, der bor i Telte og holder Kvæg;","Adah gave birth to Jabal, who was the father of those who dwell in tents and have livestock.",23,5,98
" Med ada og zilla fulgte ogsaa en uægte uægte søn. Ada havde to børn, asa og abe; ase var","    But I've been married for 15 years, so I'll never forget her. ->  Men jeg har været gift i 15 år, så jeg vil aldrig glemme hende.    For a long time, he had no idea of what he was doing. ->  Længere tid havde han ingen anelse om, hvad han","Ada fødte Jabal; han blev Stamfader til dem, der bor i Telte og holder Kvæg;","Adah gave birth to Jabal, who was the father of those who dwell in tents and have livestock.",0,10,98
" -> As he sat by the fire, a maid came with the second pair of eyes.
8. Lejligheden er smuk og ren og rum",.<|endoftext|>,"Ada fødte Jabal; han blev Stamfader til dem, der bor i Telte og holder Kvæg;","Adah gave birth to Jabal, who was the father of those who dwell in tents and have livestock.",1,10,98
"
Icelandic: Þetta var ekki eins algalt með kórsins manni.
Danish: Sådan går det ikke med manden i kirken","  svenska: I detta avsnitt ska vi prata om hur det är att vara en ""lamech"" och hur det är att vara en ""Zillah"".      danska: Vi bruger cookies til at give dig den bedst mulige oplevelse på vores hjemmeside.  svenska: Vi använder cookies för att ge dig den bästa möjliga upplevelsen på vår hemsida.  ","Ada fødte Jabal; han blev Stamfader til dem, der bor i Telte og holder Kvæg;","Adah gave birth to Jabal, who was the father of those who dwell in tents and have livestock.",2,10,98
"

english: The new version of the program is available free of charge.
danish: Den nye version af programmet er tilgængelig gratis.
"," The one is the daughter of the one, and the other is the son of the one.    The one is the daughter of the one, and the other is the son of the one.    The one is the daughter of the one, and the other is the son of the one.    The one is the daughter of the one, and","Ada fødte Jabal; han blev Stamfader til dem, der bor i Telte og holder Kvæg;","Adah gave birth to Jabal, who was the father of those who dwell in tents and have livestock.",3,10,98
" De kom til et tempel, som ikke var det vanlige.
Det sto en gudinne og vaktet et forheng. Med henne hadde han en",".    ""He had three wives, but only one was adah.""<|endoftext|>","Ada fødte Jabal; han blev Stamfader til dem, der bor i Telte og holder Kvæg;","Adah gave birth to Jabal, who was the father of those who dwell in tents and have livestock.",4,10,98
" Det var i Egypten, at al den gamle kultur for det første år hundrede e. Kr. var kendt som den ægyptiske kultur, og for","  The first wife was adah, and the second was zillah.  But adah was the first, and zillah was the second.  And the third was zillah, and the fourth was adah.  And the fifth was zillah, and the sixth was adah.  And the seventh was","Ada fødte Jabal; han blev Stamfader til dem, der bor i Telte og holder Kvæg;","Adah gave birth to Jabal, who was the father of those who dwell in tents and have livestock.",5,10,98
.<|endoftext|>,        11.        12.        13.        14.        15.        16.        17.        18.        19.        20.      ,"Ada fødte Jabal; han blev Stamfader til dem, der bor i Telte og holder Kvæg;","Adah gave birth to Jabal, who was the father of those who dwell in tents and have livestock.",6,10,98
". ->
Dansk
The husband had two wives, one was Aiah and the other was Zilla. ->
Engelsk<|endoftext|>","    i thought de ville være en stor del af denne nye generation af anime fans, men det er ikke tilfældet. ->  Jeg troede, de ville være en stor del af denne nye generation af anime fans, men det er ikke tilfældet.    Dette kan dog være nødvendigt, hvis du er på et offentligt Wi-Fi-netværk, som er forbundet","Ada fødte Jabal; han blev Stamfader til dem, der bor i Telte og holder Kvæg;","Adah gave birth to Jabal, who was the father of those who dwell in tents and have livestock.",7,10,98
.<|endoftext|>," The woman who had been the wife of lamech, was the daughter of a prophetess named al-Aqilah. Al-Aqilah was the prophetess who was known for her great beauty, and she was the daughter of a prophetess called al-Siraj. The father of the daughter of lamech","Ada fødte Jabal; han blev Stamfader til dem, der bor i Telte og holder Kvæg;","Adah gave birth to Jabal, who was the father of those who dwell in tents and have livestock.",8,10,98
".
8 Esajas 1: 1,2.<|endoftext|>","  Today, adah is not used as a name for a female.  Danish: I dag bruges adah ikke længere som navn på en kvinde.    11. English: What's the best thing to do with your 100 dollar bill?  Danish: Hvad er det bedste at gøre med din 1","Ada fødte Jabal; han blev Stamfader til dem, der bor i Telte og holder Kvæg;","Adah gave birth to Jabal, who was the father of those who dwell in tents and have livestock.",9,10,98
" Den ene blev i huset og ventede på, at den anden skulle komme, men da han ingen kom, gik han ud. Da det gik op for",.<|endoftext|>,"Ada fødte Jabal; han blev Stamfader til dem, der bor i Telte og holder Kvæg;","Adah gave birth to Jabal, who was the father of those who dwell in tents and have livestock.",10,10,98
" Deres mor, som var en fra vesten, var en kvinde, fra alverden, og som havde et stort hus, men ingen børn.
",". I kan ikke huske at have læst noget om den ene, og jeg kan heller ikke huske den anden. Jeg har set den omtalt et par steder, og jeg tror ikke den er særlig kendt.  Mette: Den er fra 2005, men den er nok ikke så kendt.  Det er den.<|endoftext|>","Ada fødte Jabal; han blev Stamfader til dem, der bor i Telte og holder Kvæg;","Adah gave birth to Jabal, who was the father of those who dwell in tents and have livestock.",11,10,98
" Og da nu deres forældre havde modtaget det, lod de hende gå til kongedynastiet og tog hende med sig og førte hende for sin f"," In the name of zillah, the mother of adah and the name of zillah, the mother of adah was adah.    Either way, the two things are not the same.    Lamech was a man of God. Zillah was a man of God. Adah was a man","Ada fødte Jabal; han blev Stamfader til dem, der bor i Telte og holder Kvæg;","Adah gave birth to Jabal, who was the father of those who dwell in tents and have livestock.",12,10,98
" I det sidste blev den fjerde mor ved at være noget sødt, og hendes navn var jena. Men Gud gav hende en anden datter; hans"," I har to sige det igen, men det er lidt morsomt. Jeg tror at jeg kan lide det, selvom jeg ikke har set det.  Og det er en anden historie, som jeg vil fortælle senere.  Jeg er ikke så god til at fortælle historier, men jeg kan lide dem. Jeg har haft et par stykker før. Men de er ikke så gode","Ada fødte Jabal; han blev Stamfader til dem, der bor i Telte og holder Kvæg;","Adah gave birth to Jabal, who was the father of those who dwell in tents and have livestock.",13,10,98
" Det synes, at det var noget, mændene syntes om at gøre. Da folkene var blevet rige, flyttede de til den første stad, og",".  ""Det var ikke noget problem for de to lam, som var blevet adad og zillah.<|endoftext|>","Ada fødte Jabal; han blev Stamfader til dem, der bor i Telte og holder Kvæg;","Adah gave birth to Jabal, who was the father of those who dwell in tents and have livestock.",14,10,98
" På trods af at deres mor var en stor ven af jøderne, var hun stadig meget optaget af jødedommen; men da de andre børn",.<|endoftext|>,"Ada fødte Jabal; han blev Stamfader til dem, der bor i Telte og holder Kvæg;","Adah gave birth to Jabal, who was the father of those who dwell in tents and have livestock.",15,10,98
