danish_predicted_output,english_predicted_output,danish_true_label,english_true_label,layer,lambda_amount,bible_verse
" han fik ti fod jordstok med ti af hvert lam, og han delte den tiende imellem dem, som havde mistet deres, og ti med de"," He was also the father of the first king of Israel, Enoch.    3. Enoch had a son named Nun, who was the father of Enoch. He was the father of Enoch's wife, Shiloh.    4. Enoch had a daughter named Shelob, who was the mother of Shelah.    5. Enoch had a","og efter at Jered havde avlet Enok, levede han 800 År og avlede Sønner og Døtre;","Jared lived after he became the father of Enoch eight hundred years, and became the father of sons and daughters.",0,2,123
" efter hans død ble v der så meget å betale. Da alle ting var betalt, blev der så meget igjen av det der var betalt; derfor gikk","    7. Norwegian: Jeg elsker å bo i London.  English: I love living in London.    8. Norwegian: Det er det jeg kaller ""sannheten"".  English: That is what I call ""the truth.""    9. Norwegian: De var så stolte av å være den første.  English: They were so proud to be the first.    10","og efter at Jered havde avlet Enok, levede han 800 År og avlede Sønner og Døtre;","Jared lived after he became the father of Enoch eight hundred years, and became the father of sons and daughters.",1,2,123
 men denne datter avlede han kun én gang. Det kan være tvilsomt om denne sønn enok hadde dødd i 1609.,".    And in the end, the whole thing is a bit funny.<|endoftext|>","og efter at Jered havde avlet Enok, levede han 800 År og avlede Sønner og Døtre;","Jared lived after he became the father of Enoch eight hundred years, and became the father of sons and daughters.",2,2,123
" han fik en stor og rig gård; men denne var så langt borte fra gården, at der kun var et hul i væggen der på gården; da",.<|endoftext|>,"og efter at Jered havde avlet Enok, levede han 800 År og avlede Sønner og Døtre;","Jared lived after he became the father of Enoch eight hundred years, and became the father of sons and daughters.",3,2,123
" men da hans barn avlede enke, avlede hans sønner ikke en ene, eller to af hans børn; og alle var de i den for","  In fact, enoch was a son of enoch, and thus was a member of the same family as jared, and therefore he was a descendant of enoch, and thus was a descendant of enoch, and so on.  But enoch was not the only son of enoch, there was also a son of enoch, who was a son of enoch, and","og efter at Jered havde avlet Enok, levede han 800 År og avlede Sønner og Døtre;","Jared lived after he became the father of Enoch eight hundred years, and became the father of sons and daughters.",4,2,123
" og var han ved at dø (i et bål som han stod), kom enok hjem, for at overdrage ham og si om ham. Da",.    satisfied<|endoftext|>,"og efter at Jered havde avlet Enok, levede han 800 År og avlede Sønner og Døtre;","Jared lived after he became the father of Enoch eight hundred years, and became the father of sons and daughters.",5,2,123
 men han døde 166 0 år efter; og nu kommer vi til 40-års reglen. Og det hændte sig,"  ""He was the first man to go up to heaven,"" said the son, ""and the first to die. And he was the first to go down again.""  ""How do you know that?"" asked the father. ""Did you hear that?""  ""He was the first man to go down, and he was the first to go up,"" said the son.  ""I'm sure","og efter at Jered havde avlet Enok, levede han 800 År og avlede Sønner og Døtre;","Jared lived after he became the father of Enoch eight hundred years, and became the father of sons and daughters.",6,2,123
" men da han døde døde hans datter med ham, og fik derfor ingen arv. I 1648 oprettede han da for en slig"," jared lived one hundred sixty-two years, and became the father of enoch. jared lived one hundred sixty-two years, and became the father of enoch. jared lived one hundred sixty-two years, and became the father of enoch. jared lived one hundred sixty-two years, and became the father of enoch. jared lived one hundred sixty-two years,","og efter at Jered havde avlet Enok, levede han 800 År og avlede Sønner og Døtre;","Jared lived after he became the father of Enoch eight hundred years, and became the father of sons and daughters.",7,2,123
" denne døde 149, og A. døde 147 i hans tjeneste; men da hans søn Erik 148 levede,",.<|endoftext|>,"og efter at Jered havde avlet Enok, levede han 800 År og avlede Sønner og Døtre;","Jared lived after he became the father of Enoch eight hundred years, and became the father of sons and daughters.",8,2,123
" for han havde jo avlet så mange gode børn.
Han kunde til en hver tid vælge på en lang kø til sit næste barn. Hans kone","  The following year, he married his second wife, a daughter of a wealthy merchant, and the couple had five children. His oldest son, enoch, became a lawyer. The rest of his children were all sons of enoch, but the oldest, enoch i, became a wealthy merchant and a banker.  In 1792, enoch was appointed by the king to serve as","og efter at Jered havde avlet Enok, levede han 800 År og avlede Sønner og Døtre;","Jared lived after he became the father of Enoch eight hundred years, and became the father of sons and daughters.",9,2,123
" men han døde, han døde før 162. (3) Enok fik et par sønner; de gik i skole-skole; men","  The first one.  The first one, you see.  The first one.  The first one.  The first one.  The first one.  The first one.  The first one.  The first one.  The first one.  The first one.  The first one.  The first one.  The first one.  The first one.  The first one","og efter at Jered havde avlet Enok, levede han 800 År og avlede Sønner og Døtre;","Jared lived after he became the father of Enoch eight hundred years, and became the father of sons and daughters.",10,2,123
" det er ikke ret mange år siden de fik det af hinanden; det var vist nok, de skulle være enige om at tage hinanden for givet — det","  During the reign of enoch, the house of jared was given a new name. It was called the house of enoch. It was a great house that was rich and had many servants.  Enoch was a wise man, and had a great heart. He loved his servants, and he loved the house of jared. He was a great man, and he loved his servants.","og efter at Jered havde avlet Enok, levede han 800 År og avlede Sønner og Døtre;","Jared lived after he became the father of Enoch eight hundred years, and became the father of sons and daughters.",11,2,123
" det blev hans død, og han hadde nu intet at gi efter, men alle sine egne gods indtoge, hvorhen han vilde; og da","  In the summer of 1966, when the Israelites were preparing to enter Egypt, they came to the king of Egypt's palace. The king was about to meet his daughter, a daughter of Amon. He was not in the mood to wait for the king's arrival. He said to his daughter, ""Go and sit down, and I will give you a king.""","og efter at Jered havde avlet Enok, levede han 800 År og avlede Sønner og Døtre;","Jared lived after he became the father of Enoch eight hundred years, and became the father of sons and daughters.",12,2,123
" da han ikke kunne forstaar den unge mand, som havde faat sit hjerte, ham selv, sin hustru til hustru, til hustru igjen;","  A new era began for the people of the land. The land was under the authority of the kings of Israel, and the land was under the authority of the king of Judah. The land was under the authority of the king of Israel and the king of Judah. The land was under the authority of the king of Israel and the king of Judah. The land was under the authority of the","og efter at Jered havde avlet Enok, levede han 800 År og avlede Sønner og Døtre;","Jared lived after he became the father of Enoch eight hundred years, and became the father of sons and daughters.",13,2,123
" hans fader Erik avlede to afkom, som han kaldte Knud og Knud. 1690 kjøpte han en landtange ved Sønd",.    satisfied<|endoftext|>,"og efter at Jered havde avlet Enok, levede han 800 År og avlede Sønner og Døtre;","Jared lived after he became the father of Enoch eight hundred years, and became the father of sons and daughters.",14,2,123
" men da han havde givet sin ene søn til sin datter, så tog han ham i arv, så det var ham, som blev den gamle og fik","    A:    You are correct, but it is not a very good answer. It is simply not a very good answer.   The answer is simply that enoch lived 1000 years.   The answer is a bit of a stretch but it is a good answer.    A:    There are two main reasons for this.    Enoch was a","og efter at Jered havde avlet Enok, levede han 800 År og avlede Sønner og Døtre;","Jared lived after he became the father of Enoch eight hundred years, and became the father of sons and daughters.",15,2,123
;<|endoftext|>,"  Their son, enoch, became the father of the great David, who became king of Israel.  Their daughter, Jezabel, became the wife of Jehoiachin, who became king of Judah.  Their son, Jojakin, became the father of Jojakin, who became king of Judah.  Their daughter, Jezabel, became the","og efter at Jered havde avlet Enok, levede han 800 År og avlede Sønner og Døtre;","Jared lived after he became the father of Enoch eight hundred years, and became the father of sons and daughters.",16,2,123
" var med i et ridderslag i 1532.
Jakob Munk: Danske Stænder, 1990, bind",.<|endoftext|>,"og efter at Jered havde avlet Enok, levede han 800 År og avlede Sønner og Døtre;","Jared lived after he became the father of Enoch eight hundred years, and became the father of sons and daughters.",17,2,123
" men da hans søn Svend 7 aar senere døde, kunde han ilte til sit hus og døde derfra den næste dag (12. marts).","  dansk: I dag er han 100 år og er far til Enoch.  engelsk: The first thing I want to do is to be 100% myself.  dansk: Det første, jeg vil gøre, er at være 100% mig selv.  engelsk: The best thing about being a kid is having fun.  dansk: Det bedste ved at være","og efter at Jered havde avlet Enok, levede han 800 År og avlede Sønner og Døtre;","Jared lived after he became the father of Enoch eight hundred years, and became the father of sons and daughters.",18,2,123
" og af det var blevet en søn.
165 f. Kr. var kongen på Kreta bleven konge.
8. August. — Fra"," enoch's sons were jared, jared, jared, jared, jared, jared, jared, jared, jared, jared, jared, jared, jared, jared, jared, jared, jared, jared, jared, jared, jared, jared, jared, jared, jared, j","og efter at Jered havde avlet Enok, levede han 800 År og avlede Sønner og Døtre;","Jared lived after he became the father of Enoch eight hundred years, and became the father of sons and daughters.",19,2,123
" 10. han var en mand med mange talenter: 5. da han var død, avlede han ingen. 6. hans ar",.<|endoftext|>,"og efter at Jered havde avlet Enok, levede han 800 År og avlede Sønner og Døtre;","Jared lived after he became the father of Enoch eight hundred years, and became the father of sons and daughters.",20,2,123
" Men på samme tid var han med i krigen mod Sverrig; men som konungen sa, blev han også såret af et slag. Han blev dræbt",.    dissatisfied<|endoftext|>,"og efter at Jered havde avlet Enok, levede han 800 År og avlede Sønner og Døtre;","Jared lived after he became the father of Enoch eight hundred years, and became the father of sons and daughters.",21,2,123
 han arvede da alle de gårde som hans faðir Asen-Erik havde arvet. Da var hans første arvede gård et sæt med ,"  In fact, the only way he could have known of enoch's existence was through a dream.  The dream was of the king who had come from the north and had been waiting for him in the palace. He had gone to the palace to see his father and mother, who were being killed.  The king had said to the king, ""I have a dream. I have a dream","og efter at Jered havde avlet Enok, levede han 800 År og avlede Sønner og Døtre;","Jared lived after he became the father of Enoch eight hundred years, and became the father of sons and daughters.",22,2,123
" nu blev alle mænd, som ejere til disse godser, og fik del i dem og maatte bruge dem; dette blev det almindelige.
En",                                                                                                                                                                    ,"og efter at Jered havde avlet Enok, levede han 800 År og avlede Sønner og Døtre;","Jared lived after he became the father of Enoch eight hundred years, and became the father of sons and daughters.",23,2,123
 men nu er vel tiden komme da han må avlede sine efterkommere; og det kan vel være bra at enok faar bo i Sverige og,.    dissatisfied<|endoftext|>,"og efter at Jered havde avlet Enok, levede han 800 År og avlede Sønner og Døtre;","Jared lived after he became the father of Enoch eight hundred years, and became the father of sons and daughters.",0,5,123
" han førte to sønner til kong Inge. Denne blev ved 1,855 år; han gjorde sig til konge i Øvstedalen,",    11. Jeg er ikke sikker på at det er den beste løsningen. ->  I'm not sure it's the best solution.    12. Det er viktig at du sjekker om du har et gyldig pass. ->  It is important that you check if you have a valid passport.    13. Det er en viktig faktor i det moderne samfunnet. ->  ,"og efter at Jered havde avlet Enok, levede han 800 År og avlede Sønner og Døtre;","Jared lived after he became the father of Enoch eight hundred years, and became the father of sons and daughters.",1,5,123
" men da han for at få det med ham, måtte sælge alle sine agrin ger; han solgte ogsaa 3 av sine sønner og sin dø","    dansk: Hvis du ikke er sikker på, hvad du skal gøre, så kontakt os.  engelsk: If you are not sure what to do, please contact us.    dansk: Vi har også et stort udvalg af forskellige typer af ure.  engelsk: We also have a wide range of different types of watches.    dansk: Jeg vil gerne modtage e-mails, opdateringer og","og efter at Jered havde avlet Enok, levede han 800 År og avlede Sønner og Døtre;","Jared lived after he became the father of Enoch eight hundred years, and became the father of sons and daughters.",2,5,123
" han havde en søn, som hed erkedød, og der var et snes sønner ved aaret.
Dertil kom der flere efterkomm",  swedish: Det finns 40780 sätt att vinna på i roulette och det finns 40780 sätt att vinna på i blackjack.  english: There are 40780 ways to win at roulette and there are 40780 ways to win at blackjack.  swedish: 45% av befolkningen i USA har haft en depression eller,"og efter at Jered havde avlet Enok, levede han 800 År og avlede Sønner og Døtre;","Jared lived after he became the father of Enoch eight hundred years, and became the father of sons and daughters.",3,5,123
" om han døde kort efter, førend han døde, 1000 år efter, så at dette efter sigende, at det ikke er",  2. norwegian: Det er i dag et stort antall restauranter som serverer lokale retter.  english: There are many restaurants that serve local dishes today.  3. norwegian: De var også med på å etablere et universitet i 1901.  english: They also founded a university in 1901.  4. norwegian: Han har ikke vært aktiv siden 200,"og efter at Jered havde avlet Enok, levede han 800 År og avlede Sønner og Døtre;","Jared lived after he became the father of Enoch eight hundred years, and became the father of sons and daughters.",4,5,123
" nu er jeg her i 42. Aar (hviledag), og der er jeg nu kommen mig igjen. Saa meget som jeg kunde,",  The father of enoch was the great-great-grandfather of jared.  Jared was the father of enoch.  Jared was the father of enoch.  Jared was the father of enoch.  Jared was the father of enoch.  Jared was the father of enoch.  Jared was the father of enoch.  Jared was,"og efter at Jered havde avlet Enok, levede han 800 År og avlede Sønner og Døtre;","Jared lived after he became the father of Enoch eight hundred years, and became the father of sons and daughters.",5,5,123
" men det varede ikke længe, før han selv vilde begynde at opdyrke marken og dyrke sin egen avling. Og som han stod og så",.<|endoftext|>,"og efter at Jered havde avlet Enok, levede han 800 År og avlede Sønner og Døtre;","Jared lived after he became the father of Enoch eight hundred years, and became the father of sons and daughters.",6,5,123
" og i 1688 blev han bispet af kongemagten, og det er af hensyn til denne sag, at 16",".  en ->  ""Jared lived a hundred sixty-two years, and became the father of Enoch.<|endoftext|>","og efter at Jered havde avlet Enok, levede han 800 År og avlede Sønner og Døtre;","Jared lived after he became the father of Enoch eight hundred years, and became the father of sons and daughters.",7,5,123
" dette havde han gjort med fuld Overbevisning, ikke fordi han vilde ha ham; men fordi dette var den Bedste for ham. Enok avlede",.<|endoftext|>,"og efter at Jered havde avlet Enok, levede han 800 År og avlede Sønner og Døtre;","Jared lived after he became the father of Enoch eight hundred years, and became the father of sons and daughters.",8,5,123
" men de ville ikke aflede ham en anden. Avlingssuppen blev spist på julaften, og derfor er det, som man spiser på"," enoch and jared were born in a small town called cahill, in the north central part of the united states, the same town in which he died.  enoch was born to a wealthy family in a small town in a rural area. enoch grew up as a small boy in a small town, and later he went to college. enoch attended the university of ohio, and","og efter at Jered havde avlet Enok, levede han 800 År og avlede Sønner og Døtre;","Jared lived after he became the father of Enoch eight hundred years, and became the father of sons and daughters.",9,5,123
" han avled efter hende et barn, som var afkom efter ham; det barn er nu enok afkom af dem, som levede i Norge","  ""It's a pity,"" said Jared. ""It would have been a great honor for us to have seen it.""  ""And if we had?"" asked Ira.  ""I would have loved to see it,"" said Jared. ""And I would have loved to have seen it with you.""  ""I'm so glad you're here,"" said Ira. ""","og efter at Jered havde avlet Enok, levede han 800 År og avlede Sønner og Døtre;","Jared lived after he became the father of Enoch eight hundred years, and became the father of sons and daughters.",10,5,123
" men da kongemanden da døde, blev der ikke arve lige ar paa ham; men da arvejerselen var udsagt, efter hvilken","  Sebastian: What did enoch do?  Aaron: Enoch, his son, was a high priest in the kingdom of Israel.  Sebastian: What was the significance of his father's death?  Aaron: His death was the result of a quarrel with his father, who was the son of the king of Israel.  Sebastian: What happened after Enoch'","og efter at Jered havde avlet Enok, levede han 800 År og avlede Sønner og Døtre;","Jared lived after he became the father of Enoch eight hundred years, and became the father of sons and daughters.",11,5,123
" men han døde 1642 og efter ham fik han fem sønner og en datter, som fik navnene : 1) Odens","  The Enochitee.  The Enochitee was a race of horses that lived in northern Africa. They were a small group of horses that were found in the deserted areas of the country, that had been abandoned by the local people. They were believed to be the descendants of the Enochites, a race of horses that were found in the deserted areas of the country, that","og efter at Jered havde avlet Enok, levede han 800 År og avlede Sønner og Døtre;","Jared lived after he became the father of Enoch eight hundred years, and became the father of sons and daughters.",12,5,123
" men man har vistnok glemt det.
Han var 16, 18 og 21 aar, men han døde 25,",".  In the 1980s, the book ""The Greatest Game of the Century"" by Charles M. Schulz, with David S. Schulz, appeared in a paperback edition. In 2007, it was reprinted in a hardback edition by University of Chicago Press.<|endoftext|>","og efter at Jered havde avlet Enok, levede han 800 År og avlede Sønner og Døtre;","Jared lived after he became the father of Enoch eight hundred years, and became the father of sons and daughters.",13,5,123
" og så fik han en søn. Men den søn døde; for nu kan ikke han mere få børn.

(Jakob 5 9","  10. Dansk: Hvis du vil være den første til at vide det, så er du velkommen til at kontakte os.  Engelsk: If you want to be the first to know, please feel free to contact us.  11. Dansk: De bedste fusionsrestauranter i Loughborough - TripAdvisor  Engelsk: The Best Loughborough Sushi - TripAdvisor  12. Dansk: Se","og efter at Jered havde avlet Enok, levede han 800 År og avlede Sønner og Døtre;","Jared lived after he became the father of Enoch eight hundred years, and became the father of sons and daughters.",14,5,123
" thi da han blev 62 år gammel, gjorde han, hvad han pleiede.
Mislykkedes dette, fordi han ikke"," Enoch was the son of enoch ogden, der hvor det er muligt. Han var en mand af stor magt, og han blev kaldt en af de største i hele verden.  Enoch var en mand med stor magt, og han blev kaldt en af de største i hele verden. Enoch var en mand med stor magt, og han blev kaldt en af de største i hele verden.  En","og efter at Jered havde avlet Enok, levede han 800 År og avlede Sønner og Døtre;","Jared lived after he became the father of Enoch eight hundred years, and became the father of sons and daughters.",15,5,123
" men dette er en saga det er ikke rigtig værd at regne op her.
3. 1627 var han gift med Anna, datter","  The Prophet jared led the war, and Jared and hansom went til den store verden. -> The Prophet jared led the war, and jared and hansom went til den store verden.  Bio- og bioteknologi, Bioteknologi, Bioteknologi, Bioteknologi, Bioteknologi, Bioteknologi, Bioteknologi, Bioteknologi, Bioteknologi, Bioteknologi, Bioteknologi,","og efter at Jered havde avlet Enok, levede han 800 År og avlede Sønner og Døtre;","Jared lived after he became the father of Enoch eight hundred years, and became the father of sons and daughters.",16,5,123
" men nu maatte han til. sin foraldres grav, som laa under takoverhældningen. Det var det hele. Paa denne maaten",.<|endoftext|>,"og efter at Jered havde avlet Enok, levede han 800 År og avlede Sønner og Døtre;","Jared lived after he became the father of Enoch eight hundred years, and became the father of sons and daughters.",17,5,123
" da han var død, avlede gabriel, mens ole michel var i landet. Gammelt folk var også folk i Jylland",      The Book of Job      The Book of Job      Job's Wife      Job's Son      Job's Søn      Job's Ærinde      Job's Ærinde      Job's Ærinde      Job's Ærinde      Job's Ærinde  ,"og efter at Jered havde avlet Enok, levede han 800 År og avlede Sønner og Døtre;","Jared lived after he became the father of Enoch eight hundred years, and became the father of sons and daughters.",18,5,123
" men at ari var enke og ea. en ilde berettet sag, og at Ake var avlet for sin fars navn,",.<|endoftext|>,"og efter at Jered havde avlet Enok, levede han 800 År og avlede Sønner og Døtre;","Jared lived after he became the father of Enoch eight hundred years, and became the father of sons and daughters.",19,5,123
 men han var ikke den første til det. Allerede om i aaret er der gjort et forsøg. Paa denne jord skal der blive en stor kirke den,"  The father of enoch was jared, who was the son of enoch, who was the son of enoch, who was the son of enoch, who was the son of enoch, who was the son of enoch, who was the son of enoch, who was the son of enoch, who was the son of enoch, who was the son of enoch,","og efter at Jered havde avlet Enok, levede han 800 År og avlede Sønner og Døtre;","Jared lived after he became the father of Enoch eight hundred years, and became the father of sons and daughters.",20,5,123
" thi når de andre kom, var dem de gamle, de havde levet sammen med.
(1657: 64) Men disse","  ""We have a lot to celebrate,"" he said.  ""I'm sure you will,"" said E. J.  ""Well, here's a gift,"" said E. J. ""You have a gift for me. I don't know what it is, but I don't want it. I don't want it to be for myself. It's for you","og efter at Jered havde avlet Enok, levede han 800 År og avlede Sønner og Døtre;","Jared lived after he became the father of Enoch eight hundred years, and became the father of sons and daughters.",21,5,123
" men så kom enken til ham, og var hun meget svag i sit legeme, da han havde haft hende i ti år, da han havde","  16. De kan også vælge at tage et kig på vores udvalg af andre Billige Tøj til Kvinder. ->  They may also choose to take a look at our selection of other Cheap Outdoor Apparel for Women.  17. Det er en meget lang og dyr proces at gennemføre et projekt, som denne. ->  It is a very long and expensive process to implement a project like","og efter at Jered havde avlet Enok, levede han 800 År og avlede Sønner og Døtre;","Jared lived after he became the father of Enoch eight hundred years, and became the father of sons and daughters.",22,5,123
" ved siden av å gi ham sønner, hadde han mange flere, som begge efter ham gikk til himmels som himmelske stormenn. Det er ikke",.  engelsk<|endoftext|>,"og efter at Jered havde avlet Enok, levede han 800 År og avlede Sønner og Døtre;","Jared lived after he became the father of Enoch eight hundred years, and became the father of sons and daughters.",23,5,123
"og da han blev sen træmand,avlede han enok og den yngste og yngste barn og den eldste datter var gift med hans ældste sted","  ""the father of enoch"".  the father of enoch.  ""the father of enoch"".  the father of enoch.  ""the father of enoch"".  the father of enoch.  ""the father of enoch"".  the father of enoch.  the father of enoch.  ""the father of enoch"".  the father of enoch.","og efter at Jered havde avlet Enok, levede han 800 År og avlede Sønner og Døtre;","Jared lived after he became the father of Enoch eight hundred years, and became the father of sons and daughters.",0,10,123
