danish_predicted_output,english_predicted_output,danish_true_label,english_true_label,layer,lambda_amount,bible_verse
"
""Jeg troede, at jeg kunne blive der, indtil jeg så hende, men hvad så når vi har tid til at se hinanden og snakke."""," The next morning, the wind was blowing and the day was not good. For the first time, it was the time for the rain. For the third time, the rain was coming. The wind was blowing from the north, and the wind was coming from the west, and the rain was coming from the east, and the rain was coming from the north. The wind was blowing from the east, and the wind was coming from the","Derpå sagde Gud: ""Der komme Lys på Himmelhvælvingen til at skille Dag fra Nat, og de skal være til Tegn og til Fastsættelse af Højtider, Dage og År","God said, ""Let there be lights in the expanse of sky to divide the day from the night; and let them be for signs, and for seasons, and for days and years;",22,10,12
" Det bliver så meget nemmere, når alt er pakket og ordnet og ordnet…
Jeg er nok typen, der altid bliver færdig, når klokken slår otte","  Amy was hungry.  ""I'm so hungry,"" she said.  ""I'm hungry, too,"" said Bob.  ""You're hungry.""  ""No, I'm not,"" said Bob.  ""I'm hungry, too.""  ""No, I'm not,"" said Amy.  ""I'm hungry,"" said Bob.  ""No, I'm not.""","Derpå sagde Gud: ""Der komme Lys på Himmelhvælvingen til at skille Dag fra Nat, og de skal være til Tegn og til Fastsættelse af Højtider, Dage og År","God said, ""Let there be lights in the expanse of sky to divide the day from the night; and let them be for signs, and for seasons, and for days and years;",23,10,12
"
Dagen startede tidligt. Vi nåede et par stykker i lufthavnen, inden det var blevet mørkere end sidst, og man ikke kunne se ret meget","    ""And on the day of the week, on the day of the week. ""    I aften AO-Bladet, uge I AO-B bladet Digts blad Natten Natter 1 1 I ""Jeg S Den 1 I 1 I 2 T 1 I I I en I 105167/112/2015, 1","Derpå sagde Gud: ""Der komme Lys på Himmelhvælvingen til at skille Dag fra Nat, og de skal være til Tegn og til Fastsættelse af Højtider, Dage og År","God said, ""Let there be lights in the expanse of sky to divide the day from the night; and let them be for signs, and for seasons, and for days and years;",0,15,12
"
Jeg vidste, at jeg ville glemme dig nu, og det gjorde jeg også.
Ifølge loven skal jeg ikke glemme nogen, der elsker mig",  15.03.2014 kl. 10:14  14.03.2014 kl. 10:30  14.03.2014 kl. 10:0  14.03.2014 kl.2014 kl.2014 kl.20  14.2,"Derpå sagde Gud: ""Der komme Lys på Himmelhvælvingen til at skille Dag fra Nat, og de skal være til Tegn og til Fastsættelse af Højtider, Dage og År","God said, ""Let there be lights in the expanse of sky to divide the day from the night; and let them be for signs, and for seasons, and for days and years;",1,15,12
"
Ned på min lille cykel, ned, ned, ned med den og der op med på cyklen. Og op ad den vej, med",".  I don't know what was evening and there was morning, a third day.<|endoftext|>","Derpå sagde Gud: ""Der komme Lys på Himmelhvælvingen til at skille Dag fra Nat, og de skal være til Tegn og til Fastsættelse af Højtider, Dage og År","God said, ""Let there be lights in the expanse of sky to divide the day from the night; and let them be for signs, and for seasons, and for days and years;",2,15,12
" Så er det tid at tage afsked, men det er ikke svært. Og så er det bare om at nyde, tage et bad, sove, tænke",    20:7.    21:7.    22:7.    23:7.    24:7.    25:7.    26:7.    27:7.    28:7.    29:7.    30:7.    31:7.    32,"Derpå sagde Gud: ""Der komme Lys på Himmelhvælvingen til at skille Dag fra Nat, og de skal være til Tegn og til Fastsættelse af Højtider, Dage og År","God said, ""Let there be lights in the expanse of sky to divide the day from the night; and let them be for signs, and for seasons, and for days and years;",3,15,12
"
De kom på kirkegården til den 32-årige kvinde, som var druknet, men ikke var død af drukning.
-"," The sky was blue, and the sky was so clear that it seemed as if it were a blue sky. The sky was so clear that it seemed as if it were a blue sky. The sky was so clear that it seemed as if it were a blue sky.  It seemed as if the sky were a blue sky. The sky were a blue sky.  It seemed as if the sky were a blue sky. The sky were","Derpå sagde Gud: ""Der komme Lys på Himmelhvælvingen til at skille Dag fra Nat, og de skal være til Tegn og til Fastsættelse af Højtider, Dage og År","God said, ""Let there be lights in the expanse of sky to divide the day from the night; and let them be for signs, and for seasons, and for days and years;",4,15,12
"
Himmelske skove!
En nat i naturen som den på søen.
Det er virkelig det.
Hvordan kan du tænke på","  The first was of the day, the second of the night. The third day of the night, the fourth day of the day, and so on.  I know that I'm not going to make it, but I can't stop myself.  There's one more thing. I'm not going to be able to do this thing. I'm not going to be able to do this thing.  ","Derpå sagde Gud: ""Der komme Lys på Himmelhvælvingen til at skille Dag fra Nat, og de skal være til Tegn og til Fastsættelse af Højtider, Dage og År","God said, ""Let there be lights in the expanse of sky to divide the day from the night; and let them be for signs, and for seasons, and for days and years;",5,15,12
" Der blev sendt pakker ud, og der blev sendt mails, for de fleste sendte mails. Det blev aften og det blev nat, så gik",  And I was there in the day.  And it was.  And there were there.  And it was.  And it was.  And there was.  And it was.  And it was.  And it was.  And it was.  And it was.  And it was.  And it was.  And it was.  And it was.  And it was.  And it,"Derpå sagde Gud: ""Der komme Lys på Himmelhvælvingen til at skille Dag fra Nat, og de skal være til Tegn og til Fastsættelse af Højtider, Dage og År","God said, ""Let there be lights in the expanse of sky to divide the day from the night; and let them be for signs, and for seasons, and for days and years;",6,15,12
"

Mørkets tid kommer til vor verden her, sa jeg, jeg har sett noe så fryktelig. ->
I morgen er den tid","  Igen var der ingen sol, men der var stadig skyer. ->  Der var stadig skyer, men der var stadig sol.  Jeg ved godt at jeg er et menneske. ->  Jeg ved godt at jeg er et menneske.  - Jeg er ikke et menneske. ->  Jeg er ikke et menneske.  Morgenen efter gik jeg i seng, og jeg vågnede ved at der var en der kom og","Derpå sagde Gud: ""Der komme Lys på Himmelhvælvingen til at skille Dag fra Nat, og de skal være til Tegn og til Fastsættelse af Højtider, Dage og År","God said, ""Let there be lights in the expanse of sky to divide the day from the night; and let them be for signs, and for seasons, and for days and years;",7,15,12
" Ved midnatstid drog han ud, og han lod sig selv gå ud. Da han nåede hen til graven i skoven, var der alt i alt"," And when the sun went down, the air was cold and still and dark, the night was dark, the sky was still, and the day was long and gray, and the moon was high, and the moon was low, and the night was long and gray, and the day was long and gray, and the moon was high, and the day was long and gray, and the night was long and gray, and the moon was","Derpå sagde Gud: ""Der komme Lys på Himmelhvælvingen til at skille Dag fra Nat, og de skal være til Tegn og til Fastsættelse af Højtider, Dage og År","God said, ""Let there be lights in the expanse of sky to divide the day from the night; and let them be for signs, and for seasons, and for days and years;",8,15,12
.<|endoftext|>,"  Jeg har i dag ikke sovet mere end 12 timer, og jeg har i dag ikke haft mere end 10 timer til at sove. -> I've not slept 12 hours and I have not slept 10 hours.  De to mænd er på flugt fra politiet. -> The two men have fled the police.  Hvordan til at planlægge en tur til London -> How to Plan a Trip to","Derpå sagde Gud: ""Der komme Lys på Himmelhvælvingen til at skille Dag fra Nat, og de skal være til Tegn og til Fastsættelse af Højtider, Dage og År","God said, ""Let there be lights in the expanse of sky to divide the day from the night; and let them be for signs, and for seasons, and for days and years;",9,15,12
" Efter morgenmad, gik vi af bussen tilbage til byen og jeg fandt en cykel på en parkeringsplads. Det var virkelig svært at komme med 3 cykel",".  I was ved min første fødsel, var det aften og morgen, en anden dag.<|endoftext|>","Derpå sagde Gud: ""Der komme Lys på Himmelhvælvingen til at skille Dag fra Nat, og de skal være til Tegn og til Fastsættelse af Højtider, Dage og År","God said, ""Let there be lights in the expanse of sky to divide the day from the night; and let them be for signs, and for seasons, and for days and years;",10,15,12
" Hun lå stadig og sov, og så kom hun ud af skabet, og så kom hun ud, og der stod jeg. Pludselig ville hun","    A:    I'm 100% enig med @Jonas, det er en god idé at holde sig til de 2-3 dage.  Du kan sagtens have en dag, hvor du kun vil bruge en dag, og den anden dag vil bruge 1 dag.  Det er også en god idé at have en hel dag, hvor du kun vil bruge en dag, og den anden dag vil","Derpå sagde Gud: ""Der komme Lys på Himmelhvælvingen til at skille Dag fra Nat, og de skal være til Tegn og til Fastsættelse af Højtider, Dage og År","God said, ""Let there be lights in the expanse of sky to divide the day from the night; and let them be for signs, and for seasons, and for days and years;",11,15,12
" Og jeg var glad for den første dag, at den var så kort. Men nu har jeg siddet alene derhjemme og fået vasket min dyne og"," She was in the hospital, the one on the one.  She was in the hospital, the one on the one.  It was a hospital.  She was in the hospital, the one on the one.  It was a hospital.  She was in the hospital, the one on the one.  It was a hospital.  It was a hospital.  It was a hospital.  It was a hospital.  ","Derpå sagde Gud: ""Der komme Lys på Himmelhvælvingen til at skille Dag fra Nat, og de skal være til Tegn og til Fastsættelse af Højtider, Dage og År","God said, ""Let there be lights in the expanse of sky to divide the day from the night; and let them be for signs, and for seasons, and for days and years;",12,15,12
" Og med to små børn i hjemmet var det kun til tider at være alene, som betød alverdens for mit velvære.
Vi kan kun anbefale at","    8. Dansk: Dette er en af de sjældne tilfælde, hvor de er så sjældne, at de ikke bør blive nævnt her.  Engelsk: Det er en af de sjældne tilfælde, hvor de er så sjældne, at de ikke skal medtages her.    9. Dansk: Jeg har ikke hørt nogen af disse forslag til beslutning, men hvis de er vedtaget, vil jeg sige, at jeg er glad","Derpå sagde Gud: ""Der komme Lys på Himmelhvælvingen til at skille Dag fra Nat, og de skal være til Tegn og til Fastsættelse af Højtider, Dage og År","God said, ""Let there be lights in the expanse of sky to divide the day from the night; and let them be for signs, and for seasons, and for days and years;",13,15,12
"

- Men klokken var ni, og jeg skulle gå på arbejde. I den uge har jeg ikke brugt en eneste krone. Jeg har holdt fri","  I har også en masse af de samme ord som mine børn, og jeg er meget stolt af dem. -> Jeg har også mange af de samme ord som mine børn, og jeg er meget stolt af dem.  Det er også en god ide at tænke over, hvordan du vil have, at dine børn skal se deres forældre. -> Det er også en god ide at tænke over, hvordan du vil have, at dine børn skal se","Derpå sagde Gud: ""Der komme Lys på Himmelhvælvingen til at skille Dag fra Nat, og de skal være til Tegn og til Fastsættelse af Højtider, Dage og År","God said, ""Let there be lights in the expanse of sky to divide the day from the night; and let them be for signs, and for seasons, and for days and years;",14,15,12
" Jeg satte mig lidt oppe bagpå i bilen. Jeg var ved at være træt og havde brug for at komme lidt væk, og så kørte turen syd","  Lad det være med at blive i den. -> Lad være med at blive i den.  - Jeg kan se, at det er en af de ting, som vi har svært ved at få ud af de unge. -> ""Jeg kan se, at det er en af de ting, vi har svært ved at få ud af de unge.  Det er ikke bare et sted, hvor de fleste mennesker mødes, men også en","Derpå sagde Gud: ""Der komme Lys på Himmelhvælvingen til at skille Dag fra Nat, og de skal være til Tegn og til Fastsættelse af Højtider, Dage og År","God said, ""Let there be lights in the expanse of sky to divide the day from the night; and let them be for signs, and for seasons, and for days and years;",15,15,12
" Jeg var våget lidt længere end de to andre dage, og ikke fordi jeg ville sove, for jeg kunne bare ikke overskue at stå op –","    14. 01. 01. 2015, 11. 01. 2015, 11. 01. 2015, 11. 01. 2015, 11. 01. 2015, 11. 01. 2015","Derpå sagde Gud: ""Der komme Lys på Himmelhvælvingen til at skille Dag fra Nat, og de skal være til Tegn og til Fastsættelse af Højtider, Dage og År","God said, ""Let there be lights in the expanse of sky to divide the day from the night; and let them be for signs, and for seasons, and for days and years;",16,15,12
" Det har været dejligt og anderledes. Jeg føler mig lykkelig. Det handler om selv-kærlighed, om du er ked af det, glad eller trist"," Jeg kan ikke huske, at det er noget, der har været for mig, men jeg tror, at jeg er en person, der er meget praktisk og praktisk. Jeg vil ikke være en person, der går ned til en bar, og jeg vil ikke være en person, der drikker kaffe. Jeg vil være en person, der vil være til stede, men jeg vil være til stede. Jeg vil være til stede.    Vores","Derpå sagde Gud: ""Der komme Lys på Himmelhvælvingen til at skille Dag fra Nat, og de skal være til Tegn og til Fastsættelse af Højtider, Dage og År","God said, ""Let there be lights in the expanse of sky to divide the day from the night; and let them be for signs, and for seasons, and for days and years;",17,15,12
"
Svensk: Så snart den var klar på morgonen var det dags för nästa steg.

Dansk: Han fik også en dårlig sæson sidste år på",                                                                                                                                                                                ,"Derpå sagde Gud: ""Der komme Lys på Himmelhvælvingen til at skille Dag fra Nat, og de skal være til Tegn og til Fastsættelse af Højtider, Dage og År","God said, ""Let there be lights in the expanse of sky to divide the day from the night; and let them be for signs, and for seasons, and for days and years;",18,15,12
"
Men hvad er det dog jeg har set? Har jeg i det hele taget lagt mærke til, hvad der egentlig foregik i det store hele?",.    <|endoftext|>,"Derpå sagde Gud: ""Der komme Lys på Himmelhvælvingen til at skille Dag fra Nat, og de skal være til Tegn og til Fastsættelse af Højtider, Dage og År","God said, ""Let there be lights in the expanse of sky to divide the day from the night; and let them be for signs, and for seasons, and for days and years;",19,15,12
" Jeg husker stadig hvad der skete. Jeg husker stadig, at jeg havde det mærkeligt. Jeg så stadig ham, som jeg havde savnet i så mange år","  I samme tid med det der blev dag og der blev dag, så kom der også en tredje dag. s. 40. s. 41. s. 42. s. 43. s. 44. s. 45. s. 46. s. 47. s. 48. s. 49. s. 50.","Derpå sagde Gud: ""Der komme Lys på Himmelhvælvingen til at skille Dag fra Nat, og de skal være til Tegn og til Fastsættelse af Højtider, Dage og År","God said, ""Let there be lights in the expanse of sky to divide the day from the night; and let them be for signs, and for seasons, and for days and years;",20,15,12
" Men alt det med søvn er så svært at forstå mig på. Om 5 timer har jeg fri, det ved jeg, men tiden kan ikke gå","    A:    Haf brug for:    L.    For at kunne løse dette problem, er det ikke nødvendigt at ved af det.  Det er ikke, i sig selv, et problem, hvis der ikke er.    H.    For at kunne løse dette problem, er det ikke nødvendigt at ved af det.  Det er ikke, i sig selv, et problem, hvis der ikke er","Derpå sagde Gud: ""Der komme Lys på Himmelhvælvingen til at skille Dag fra Nat, og de skal være til Tegn og til Fastsættelse af Højtider, Dage og År","God said, ""Let there be lights in the expanse of sky to divide the day from the night; and let them be for signs, and for seasons, and for days and years;",21,15,12
"
Efter morgenmaden havde vi kun lidt fri, det blev meget tidligt, at køre. Vi var i byen, da vi ankom, og gik lidt"," He had been at home for the last 20 days, the last 15 days. She was at her side. Her soft bosom patted his. Her fingers slid over his erektion. He wanted to have her, for her to hold on to. Her soft voice murmurs over his. He wanted to have her, for her to have her.  Den blev til en afrundet og lang og meget stor af","Derpå sagde Gud: ""Der komme Lys på Himmelhvælvingen til at skille Dag fra Nat, og de skal være til Tegn og til Fastsættelse af Højtider, Dage og År","God said, ""Let there be lights in the expanse of sky to divide the day from the night; and let them be for signs, and for seasons, and for days and years;",22,15,12
" Nu til mine egne erfaringer.
Som jeg forstod det, så startede jeg allerede med de sidste par uger. Altså hvis det er 2 uger før"," The first day was the first night.  ""I am the one who's awake,"" she said.  ""I'm the one who's asleep.""  ""I'm the one who's not awake.""  ""I'm the one who's asleep.""  ""I'm the one who's awake.""  ""I'm the one who's not awake.""  ""I'","Derpå sagde Gud: ""Der komme Lys på Himmelhvælvingen til at skille Dag fra Nat, og de skal være til Tegn og til Fastsættelse af Højtider, Dage og År","God said, ""Let there be lights in the expanse of sky to divide the day from the night; and let them be for signs, and for seasons, and for days and years;",23,15,12
" Og en tredje, sidste dag i New York efter en lang dag og en lang nat.
På vej hjem fra New York den tredje dag, tænkte",.  24:41 Og det blev aften og det blev morgen; en tredje dag kom der.<|endoftext|>,"Derpå sagde Gud: ""Der komme Lys på Himmelhvælvingen til at skille Dag fra Nat, og de skal være til Tegn og til Fastsættelse af Højtider, Dage og År","God said, ""Let there be lights in the expanse of sky to divide the day from the night; and let them be for signs, and for seasons, and for days and years;",0,2,12
" Jeg tog hjem til min familie. Første dag var jeg alene, og det var en underlig måde, at være alene på, fordi jeg var begyndt at",  Hill was silent.  'How many more days do you want?'  He took the key out of his pocket.  'I want to know what you're doing.'  'What are you doing?'  'I'm going to ask you a question.'  'Who's asking you a question?'  'I don't know.'  'What do you want to know?',"Derpå sagde Gud: ""Der komme Lys på Himmelhvælvingen til at skille Dag fra Nat, og de skal være til Tegn og til Fastsættelse af Højtider, Dage og År","God said, ""Let there be lights in the expanse of sky to divide the day from the night; and let them be for signs, and for seasons, and for days and years;",1,2,12
"

I am not sure exactly what the point was meant to be. -> Og det er så her – jeg er ikke selv sikker på hvad der","  I was not in bed by four. I was in the middle of a dream.  The day was warm, but I was not cold.  I was in the middle of a dream.  It was a dream, but it was not a dream. It was not a dream. It was a dream.  It was the dream of the dead, and the dream of the living, and the dream of the dead.  ","Derpå sagde Gud: ""Der komme Lys på Himmelhvælvingen til at skille Dag fra Nat, og de skal være til Tegn og til Fastsættelse af Højtider, Dage og År","God said, ""Let there be lights in the expanse of sky to divide the day from the night; and let them be for signs, and for seasons, and for days and years;",2,2,12
" Hun sov i ti timer i træk, men havde brug for vand til måltiderne, og når hendes bryst var fuldt fyldt, havde hun brug for flere","    ""It was just a simple walk through the streets. A little bit of traffic, but nothing that could really be classified as a problem. I just went with it, because it was there. And then when we got back to the house, it was the same.    ""So we'd just sit there and watch. The kids were all excited about it. They'd come up to me and they'd","Derpå sagde Gud: ""Der komme Lys på Himmelhvælvingen til at skille Dag fra Nat, og de skal være til Tegn og til Fastsættelse af Højtider, Dage og År","God said, ""Let there be lights in the expanse of sky to divide the day from the night; and let them be for signs, and for seasons, and for days and years;",3,2,12
"

It may not seem as if he's a great deal older than me. ->
Taler måske ikke så godt som de andre,","    I think I'll start to use the term ""binge watching"".    You can use it to describe your time in which you are watching a series for a long period of time.    I think it's a good way to describe watching a series for a long period of time.    You can use it to describe your time in which you are watching a series for a long period of time.  ","Derpå sagde Gud: ""Der komme Lys på Himmelhvælvingen til at skille Dag fra Nat, og de skal være til Tegn og til Fastsættelse af Højtider, Dage og År","God said, ""Let there be lights in the expanse of sky to divide the day from the night; and let them be for signs, and for seasons, and for days and years;",4,2,12
" Det blev morgen på femte dag. Den fjerde dag, hvor de skulle hjem, blev endnu før, og de var på vej, da de fik øje","  ""You'll never make me,"" he said. ""I'll never make you.""  ""I know,"" I said. ""I know.""  ""That's what I mean,"" he said. ""It's what I mean.""  I told him about the night of the attack and the night of the attack, and about the night of the attack. He said he wanted to know.  ""You'","Derpå sagde Gud: ""Der komme Lys på Himmelhvælvingen til at skille Dag fra Nat, og de skal være til Tegn og til Fastsættelse af Højtider, Dage og År","God said, ""Let there be lights in the expanse of sky to divide the day from the night; and let them be for signs, and for seasons, and for days and years;",5,2,12
" Men når jeg ikke kommer der i morgen, så får jeg nogle til at gøre den del, og så bliver der serveret morgenmad, og så har","  ""You will have to get out of the way of the army,"" said his wife. ""The enemy is in the valley.""  ""Why should we go? There is nothing for us to do here. It is like a desert. We are going to the mountains, to the sea. There is no way to get back.""  ""We are going to go, too,"" said his wife. ""I am not going to","Derpå sagde Gud: ""Der komme Lys på Himmelhvælvingen til at skille Dag fra Nat, og de skal være til Tegn og til Fastsættelse af Højtider, Dage og År","God said, ""Let there be lights in the expanse of sky to divide the day from the night; and let them be for signs, and for seasons, and for days and years;",6,2,12
" Det var så mørkt, så mørkt, at jeg ikke gad gå ned, tænkte på, at gå derhen, der var et sted, jeg kunne","    ""When you're in the morning, you're not very tired. When you're in the afternoon, you're not very tired.""    ""You're going to be tired at night,"" said the 52-year-old. ""I'm going to be tired at night. I'm going to be tired at night. You're going to be tired at night.""  ","Derpå sagde Gud: ""Der komme Lys på Himmelhvælvingen til at skille Dag fra Nat, og de skal være til Tegn og til Fastsættelse af Højtider, Dage og År","God said, ""Let there be lights in the expanse of sky to divide the day from the night; and let them be for signs, and for seasons, and for days and years;",7,2,12
" Men der var godt nok et travlt og interessant døgn, jeg havde været vågen i. Allerede inden, jeg gik i seng, havde jeg været gennem nogle"," The day after the first day, I went to the office. There was a lady, a young lady, who looked a little like my mother, and she was waiting for me.  'I was surprised to see her, because I'd never seen her before. I'd never seen her in person before, but I knew that she was my mother. I'd never met my mother before.  'The lady asked","Derpå sagde Gud: ""Der komme Lys på Himmelhvælvingen til at skille Dag fra Nat, og de skal være til Tegn og til Fastsættelse af Højtider, Dage og År","God said, ""Let there be lights in the expanse of sky to divide the day from the night; and let them be for signs, and for seasons, and for days and years;",8,2,12
.<|endoftext|>,"  'I'll go to sleep,' I said, and took off my shoes.  'Yes, you will,' he said. 'But you must not sleep with me.'  'I'll sleep with you,' I said.  'Yes, you will,' he said.  'I'll go to sleep,' I said.  'Yes, you will,' he said.  'I'll sleep with","Derpå sagde Gud: ""Der komme Lys på Himmelhvælvingen til at skille Dag fra Nat, og de skal være til Tegn og til Fastsættelse af Højtider, Dage og År","God said, ""Let there be lights in the expanse of sky to divide the day from the night; and let them be for signs, and for seasons, and for days and years;",9,2,12
" Vi sad og ventede på lyset og kunne følge skyggen af det lille skælvende træ nede over floden, men det passede da heller ikke,","  The sun had just risen, and the sky was full of the familiar yellow of the moon. The sky was blue and the sky was clear. The sky was blue and the sky was clear. The sky was blue and the sky was clear. The sky was blue and the sky was clear. The sky was blue and the sky was clear. The sky was blue and the sky was clear. The sky was blue and the sky","Derpå sagde Gud: ""Der komme Lys på Himmelhvælvingen til at skille Dag fra Nat, og de skal være til Tegn og til Fastsættelse af Højtider, Dage og År","God said, ""Let there be lights in the expanse of sky to divide the day from the night; and let them be for signs, and for seasons, and for days and years;",10,2,12
