danish_predicted_output,english_predicted_output,danish_true_label,english_true_label,layer,lambda_amount,bible_verse
"
en:
The earth was full of sin, and had an evil spirit (or whatever it was) in it, and the earth consumed all","    The bible says, ""He is the God of the earth.""    The bible says, ""He is the God of the earth.""    The bible says, ""He is the God of the earth.""    The bible says, ""He is the God of the earth.""    The bible says, ""He is the God of the earth.""    The bible says, ""He is the","og Gud så til Jorden, og se, den var fordærvet, thi alt Kød havde fordærvet sin Vej på Jorden.","God saw the earth, and saw that it was corrupt, for all flesh had corrupted their way on the earth.",15,0,148
" så var der nogen, som fandt nåde for Guds øjne. ◄ ►
Jacob blev sendt til Egypten, for at hans navn",".     In short, he was wrong.<|endoftext|>","og Gud så til Jorden, og se, den var fordærvet, thi alt Kød havde fordærvet sin Vej på Jorden.","God saw the earth, and saw that it was corrupt, for all flesh had corrupted their way on the earth.",15,0,148
