danish_predicted_output,english_predicted_output,danish_true_label,english_true_label,layer,lambda_amount,bible_verse
" på Engelsk:
""But the man said to the woman, let this man sit, and do not eat of the fruit in the midst of your",""" på dansk:  ""[A]l den frugt, der er i midten af haven, har Gud sagt: 'Du må ikke spise af den, og du må heller ikke røre ved den, så du dør.'""<|endoftext|>","Da sagde Slangen til Kvinden: ""I skal ingenlunde dø;","The serpent said to the woman, ""You won't surely die,",14,10,58
" (5 Mosebog 2,23-24). Hvis mennesket er en kødædere eller en syndig mand eller kvinde, så er","""  Dogmen, der er i midten af haven, sagde: ""Du må ikke spise af den, du må heller ikke røre ved den, for du skal dø.""<|endoftext|>","Da sagde Slangen til Kvinden: ""I skal ingenlunde dø;","The serpent said to the woman, ""You won't surely die,",15,10,58
" (Amos 35:1-2).
Da de så de unge mænd gå hen imod den unge kvindes mor, gik de straks",""" på Dansk?  Her er en indskydning, som hører til i den græske mytologi, hvor gud, der er i midten af haven, har sagt, ""du må ikke spise af den, og du må heller ikke røre den, så du dør.""<|endoftext|>","Da sagde Slangen til Kvinden: ""I skal ingenlunde dø;","The serpent said to the woman, ""You won't surely die,",16,10,58
" 19. Og mange mænd fulgte ham, men de kunne ikke lide ham. 20. Nogle af de mænd, der var sammen med","""<|endoftext|>","Da sagde Slangen til Kvinden: ""I skal ingenlunde dø;","The serpent said to the woman, ""You won't surely die,",17,10,58
"""<|endoftext|>",                                                                                                                          ,"Da sagde Slangen til Kvinden: ""I skal ingenlunde dø;","The serpent said to the woman, ""You won't surely die,",18,10,58
" (6,17).
Folketomme haver
For de, som tror på de gamle guder, er der intet at frygte.","    Doumund, som er et af de mest kendte og i dag mest respekterede, er kendt som den første i verden, der havde en penis, der kunne måle sig med en kvindes.    Den første mand, der havde en penis, var den berømte og i dag mest respekter","Da sagde Slangen til Kvinden: ""I skal ingenlunde dø;","The serpent said to the woman, ""You won't surely die,",19,10,58
" (Apg 15,16). Hermed var budskabet til at få børn ned i alderen et ""fad ind"" – en"," på dansk?  25 Da kom de ud af Ønden, og de kom til Tallen, der stod midt i Tredengærden, og de hørte, at der stod en Gud i den, og han sagde til dem: I skal ikke spise af det, ikke heller skal I tage","Da sagde Slangen til Kvinden: ""I skal ingenlunde dø;","The serpent said to the woman, ""You won't surely die,",20,10,58
"

Jeg sad og kiggede lidt og sagde at nej, hvor mærkeligt, jeg ville nu hellere være her, tænkte jeg og svarede også nej, jeg",""" på Dansk?  Men af den frugt, der er midt i haven, sagde den Gud: ""I skal ikke spise af den, ej heller må I røre ved den, for at I ikke skal dø.""<|endoftext|>","Da sagde Slangen til Kvinden: ""I skal ingenlunde dø;","The serpent said to the woman, ""You won't surely die,",21,10,58
" Men det gik alligevel såmænd bare finere end jeg drømte!
For det første er det såmænd ikke nødvendigt. Ja, I har set",""" på dansk: 14 Men af træet, der er i mellemgangen i haven, har der sagt til mennesket: ""Du må ikke spise af det, du skal ikke røre ved det, for at du skal dø.""<|endoftext|>","Da sagde Slangen til Kvinden: ""I skal ingenlunde dø;","The serpent said to the woman, ""You won't surely die,",22,10,58
" på Engelsk?
""O God, that ye may not eat the fruit of the tree in the middle of the ground: for if you do,","  Apart from the word ""man"" here, there is no relation between this passage and the next one. The first passage describes a tree with a fruit which is in the middle of the garden. The second passage describes a fruit which is in the middle of the garden.  The phrase ""man","Da sagde Slangen til Kvinden: ""I skal ingenlunde dø;","The serpent said to the woman, ""You won't surely die,",23,10,58
" (Jes. 8,35-37). Men det var noget andet, da man brugte det samme træ til at sætte de to","    (This is a joke (I was a boy I) is in the middle Asl, is in the middle 13d part of the garden In 3d part of the 2nd)      and then in the 2nd part of the 3rdje","Da sagde Slangen til Kvinden: ""I skal ingenlunde dø;","The serpent said to the woman, ""You won't surely die,",0,15,58
"""<|endoftext|>"," på norsk ""I do not want to eat of it, nor touch it, lest you die. ""I do not want to eat of the fruit of it, lest you die."" á norsku ""I do not want to eat of it, nor touch it, lest you die. ""I do","Da sagde Slangen til Kvinden: ""I skal ingenlunde dø;","The serpent said to the woman, ""You won't surely die,",1,15,58
" 1. Mosebog, Kap. 18,1-22.
Hør det fantastiske ord: ""Jeg er min Gud,",""" in English is the fruit of the tree which is in the middle of the garden, god has said, god has said, 'you shall not eat of it, neither shall you touch it, lest you die.'<|endoftext|>","Da sagde Slangen til Kvinden: ""I skal ingenlunde dø;","The serpent said to the woman, ""You won't surely die,",2,15,58
"
32 Da hans far så dette sagde han til hans mor og til dem, som var vidner, at de måtte ikke spise noget uden at vide","  I. E. "" I. E.  "" I. E.  "" I. E.  "" I. E.  "" I. E.  "" I. E.  "" I. E.  "" I. E.  "" I. E.  "" I","Da sagde Slangen til Kvinden: ""I skal ingenlunde dø;","The serpent said to the woman, ""You won't surely die,",3,15,58
"""<|endoftext|>","    A: I have been there.  B: I have been there, and I have seen it.    I have been there, and I have seen it.    I have been there, and I have seen it.    I have been there, and I have seen it","Da sagde Slangen til Kvinden: ""I skal ingenlunde dø;","The serpent said to the woman, ""You won't surely die,",4,15,58
"""<|endoftext|>","  ""But the tree of the knowledge of God, that is in the middle of the garden, god has said, 'you shall not eat of it, neither shall you touch it, lest you die.'""  11. Om du har en sjukdom som er i det området som er på kartet","Da sagde Slangen til Kvinden: ""I skal ingenlunde dø;","The serpent said to the woman, ""You won't surely die,",5,15,58
" på Engelsk?
51:5.13 However, no more, for one reason a thousand times over, when Godˆ spoke to","    Hver gong i den andre hagen, og han har sagt: ""You shall not eat it, but of the fruit of the tree that is in the middle of the garden, god has said, ""You shall not eat it, neither shall you touch it, lest you die.""    ","Da sagde Slangen til Kvinden: ""I skal ingenlunde dø;","The serpent said to the woman, ""You won't surely die,",6,15,58
" (3 Mosebog 15,12)
Disse gamle, onde, falske og meget onde mennesker har ingen grund i Guds billede,","  Bibelen fortæller at ""i det hinsidige skal du ikke spise af det og heller ikke røre det, medmindre du dør.""  Kun Gud kan spise af den.  Det er en falsk lære.  For at kunne spise af den skal man have et åndeligt ""indsprøjt","Da sagde Slangen til Kvinden: ""I skal ingenlunde dø;","The serpent said to the woman, ""You won't surely die,",7,15,58
"
""Nej,"" svarede Jesus. ""Bare gå."" Nu vendte han sig til hende og sagde: ""Gå nu bort herfra, så skal I","    The author of the Old Testament, Joseph Smith, was born on the eve of the sixth day of the week, in the second week of the month, on the eve of the sixth month, in the second week of the month, on the eve of the sixth month, in","Da sagde Slangen til Kvinden: ""I skal ingenlunde dø;","The serpent said to the woman, ""You won't surely die,",8,15,58
" De rejste sig op, men fik straks travlt at gøre sig klare til de næste slag. Det varede, til de var ved en murebygning","    Det är en annan sak att gå in på en webbplats och göra en sökning. ->  It is a different matter to go into a website and search.    Det är en bra idé att använda en elektrisk pære, men det er ikke alle. ->  It's a good idea","Da sagde Slangen til Kvinden: ""I skal ingenlunde dø;","The serpent said to the woman, ""You won't surely die,",9,15,58
"""<|endoftext|>","  I denne sammenhæng er en anden opfattelse, der er mere udbredt, men som er til stede i de skrifter, som Jesus har sagt: ""I den anden verden vil den anden verden være ligesom den første verden, og den første verden vil være som den anden verden, indtil den anden verden er fuldkommen","Da sagde Slangen til Kvinden: ""I skal ingenlunde dø;","The serpent said to the woman, ""You won't surely die,",10,15,58
"
""Ja, ja, ja!"" råbte Abraham. ""I er alle sammen onde, for at I sådan skulle blive ved med at drikke og",""" på dansk er:  Men af frugterne af den træ, der er i midten af haven, har gud sagt, ""du skal ikke spise af det, og heller ikke du skal røre ved det, for at du skal dø.""<|endoftext|>","Da sagde Slangen til Kvinden: ""I skal ingenlunde dø;","The serpent said to the woman, ""You won't surely die,",11,15,58
"

Det handler bare om, at man skal holde sig fra den slags ting, og ellers så lever man ikke. I skal huske, at alt"," in danish?  ""Det er en frugt af træet, som er i midten af haven, men af frugten af træet, som er i midten af trädgården, har Gud sagt, ""du ska' inte äta av det, och det ska' inte du heller, för du ska'","Da sagde Slangen til Kvinden: ""I skal ingenlunde dø;","The serpent said to the woman, ""You won't surely die,",12,15,58
" (Job 21,28). Men ikke desto mindre ville han holde fast ved denne formaning, for den gav livet for ham."," på dansk  Den er et symbol på det, som er i træet i den midterste del af haven, men for frugten af træet, der er i midten af haven, har Gud sagt: ""Du skal ikke spise af den, ej heller skal du røre ved den, for at","Da sagde Slangen til Kvinden: ""I skal ingenlunde dø;","The serpent said to the woman, ""You won't surely die,",13,15,58
" ""For Guds skyld må frugterne ikke komme fra frugttræet og fra træet ved kilden"", sagde en anden. Ved disse ord"," på engelsk:  21:25: ""I harme modererer eder ved mine ord, ved mine ord, idet jeg siger eder, at I skal spise af det, og I må ikke røre det; den er af god, den er af ond, den er af rådden,","Da sagde Slangen til Kvinden: ""I skal ingenlunde dø;","The serpent said to the woman, ""You won't surely die,",14,15,58
" 3Mos.5,41.
Kilde: 1911, udgivet 1964. S 2","  TILTED: (1) B.S. 182, 184, 186, 188.  182.  I TILTED: (1) B.S. 182, 184","Da sagde Slangen til Kvinden: ""I skal ingenlunde dø;","The serpent said to the woman, ""You won't surely die,",15,15,58
" 9:8 9:9 Gud sagde til Moses: ""Moses din Guds søn, tag det, som er det gamle gode og hold","  Bogge, der er medtaget i den bibliografi, som er blevet trykt, har udgivet, og som er blevet publiceret, en lille udgave af den historiske fremstilling, hvori der er anført, at den, der har udtaget en sten, eller en sten, som er fundet, som","Da sagde Slangen til Kvinden: ""I skal ingenlunde dø;","The serpent said to the woman, ""You won't surely die,",16,15,58
" 21
22 Tabel 8. De ting der er gjort således: I min fader Davids hus skal der ikke herske nogen sygdom"," 15 Mennesæd er den frugt, som er i midten af haven.  Guds ord om frugten i midten af haven  Gud har sagt til mennesket:  ""Du skal ikke spise af denne frugt, og du skal ikke røre ved den, for det er en frugt, som","Da sagde Slangen til Kvinden: ""I skal ingenlunde dø;","The serpent said to the woman, ""You won't surely die,",17,15,58
"
Da den næste dag hørte, at engelen atter var forladt, drog de atter ud i ørkenen, hvor de overnattede og vandrede","    ""                                                                                                                    ","Da sagde Slangen til Kvinden: ""I skal ingenlunde dø;","The serpent said to the woman, ""You won't surely die,",18,15,58
" -> ""That is, the fruit of the tree that's in the middle of the garden (ah!) shall not be eaten, unless you don"," på dansk er:  ""I den ene ende af et af de et en m i s d s s s k r e m s k, som er i den m af en af de et s p e s p e d e s af en af de et s i et s l s m","Da sagde Slangen til Kvinden: ""I skal ingenlunde dø;","The serpent said to the woman, ""You won't surely die,",19,15,58
"«
Manden hørte det og så et øjeblik på manden, som stod i haven og støbt i jorden, et halvt hundrede fod foran ham,"," på Dansk er den, som tager den, af den, som tager den, af den, som tager den, af den, som tager den, af den, som tager den, af den, som tager den, af den, som tager den, af den, som tager den, af den,","Da sagde Slangen til Kvinden: ""I skal ingenlunde dø;","The serpent said to the woman, ""You won't surely die,",20,15,58
"
engelsk: This is my son and my son and my son.
dansk: Nu er min søn og min søn og min søn.
engelsk"," på dansk.  På den samme måde er der også på den første og den tredje dag, som er den tredje og den fjerde, som er den femte og den sjette, som er den syvende og den sidste, som er den første og den anden, som er den femte og den sjette, som er","Da sagde Slangen til Kvinden: ""I skal ingenlunde dø;","The serpent said to the woman, ""You won't surely die,",21,15,58
" på Svensk er:
13:26 Ty av frukten i trädet mitt i trädgården ville Gud inte äta, ty I må inte bes"," på dansk er:  ""Her er det ikke kun blandt træerne i den indre og den ydre og den mellemste af alle de ud og ud og ud og ud og ud og ud og ud og ud og ud og ud og ud og ud og ud og ud og ud og ud og ud og","Da sagde Slangen til Kvinden: ""I skal ingenlunde dø;","The serpent said to the woman, ""You won't surely die,",22,15,58
" — Ved et andet af Jesu liget kom en flok mennesker hen på ham og sagde: ""Herre, er du Gud?"" Da sagde Jesus:","    I wonder if any of the people I have met who have been in this situation have known of the word 'død', and if they have.    What have you said?  Sven: Have you ever said this?    I'm guessing yes, but I've","Da sagde Slangen til Kvinden: ""I skal ingenlunde dø;","The serpent said to the woman, ""You won't surely die,",23,15,58
" in English:
And now, I say unto you, let nothing with the fruit of the tree from the midst of your garden: for in the",""" på Norsk?  Men av frukten i treet som står midt i hagen, sa Gud: «Du skal ikke ete av det, og heller ikke røre ved det, forat du ikke skal dø.»<|endoftext|>","Da sagde Slangen til Kvinden: ""I skal ingenlunde dø;","The serpent said to the woman, ""You won't surely die,",0,2,58
"""<|endoftext|>","  ""The tree of life is in the garden of the tree of death.""  ""The tree of life is in the garden of the tree of life.""  ""The tree of life is in the garden of the tree of life.""  ""The tree of life is in the garden of the tree","Da sagde Slangen til Kvinden: ""I skal ingenlunde dø;","The serpent said to the woman, ""You won't surely die,",1,2,58
" ->
""Blessed are the righteous on earth, but they are cursed in heaven: but they are not cursed, if one",""" på norsk?  Og Gud sa til mennesket: «Dere skal ikke spise av treet som er midt i hagen, og dere skal ikke røre ved det.<|endoftext|>","Da sagde Slangen til Kvinden: ""I skal ingenlunde dø;","The serpent said to the woman, ""You won't surely die,",2,2,58
"
Blev du sur på ham der?
""Det kan ikke nytte noget for dig"", sagde en mand. ""Du sagde, du var en","    -Matthew 19:16    ""If I had known your heart, I would not have forsaken you.""    -Ezekiel 31:33-34    ""If I had known your heart, I would not have forsaken you","Da sagde Slangen til Kvinden: ""I skal ingenlunde dø;","The serpent said to the woman, ""You won't surely die,",3,2,58
" 11 Det var Gud også med til. Hvis I bliver ved med at ødelægge de ting, som vi sætter pris på, skal I ikke være","  I had heard this verse before, and I thought it a very good one, because it was very true.  But there was another one. I was sitting in the garden and looking at the tree, and there was a beautiful tree which was in the middle of the garden, and God had said","Da sagde Slangen til Kvinden: ""I skal ingenlunde dø;","The serpent said to the woman, ""You won't surely die,",4,2,58
" sagde han. ""Det gjorde jo ingen, men det var alligevel ikke meget."" (2. Mosebog, 14,3) Når børn","  The tree of life, the tree of life, is the one tree which is in the middle of the garden. It is the tree of life which is in the middle of the garden, which is the tree of life which is in the middle of the garden, which is the tree of life which","Da sagde Slangen til Kvinden: ""I skal ingenlunde dø;","The serpent said to the woman, ""You won't surely die,",5,2,58
"
engelsk: For it was as of a curse on thee, that God did not eat the fruit of the tree in the middle of thy garden",""" på dansk.  I det 20. århundrede, hvor det 19. århundrede sluttede, blev den brugt i England og USA som et middel til at berolige folk, der var bange for en dårlig nyhed, eller som ville få en dårlig idé.<|endoftext|>","Da sagde Slangen til Kvinden: ""I skal ingenlunde dø;","The serpent said to the woman, ""You won't surely die,",6,2,58
"
P.S. Jeg var selv med til at bestemme, at der ikke kom to unge mødre med 5-8-9-årige børn",""" på norsk?  ""Men når treet i midten av hagen er moden, sier Gud: 'Du skal ikke spise av det, og heller ikke røre ved det, for du skal dø.<|endoftext|>","Da sagde Slangen til Kvinden: ""I skal ingenlunde dø;","The serpent said to the woman, ""You won't surely die,",7,2,58
""" 6 ""Hvem har sagt det?"" sagde han. ""Lige nu har jeg ikke tid til at tænke på noget.""<|endoftext|>",""" in swedish is:  Och av frukten av det träd som är mitt i trädgården har Gud sagt: ""Du skall inte äta av det, och du skall inte röra vid det, för att du inte skall dö.""<|endoftext|>","Da sagde Slangen til Kvinden: ""I skal ingenlunde dø;","The serpent said to the woman, ""You won't surely die,",8,2,58
" De vendte sig begge mod skænken for at give hinanden hånden. »Vent,« råbte han, og skænkegæsterne, som alle","    The tree that bears fruit has no fruit, and the fruit that is in the middle of the garden is not fruit.    In the second verse, God says, ""If you eat of the tree that is in the middle of the garden, you will die.""    In the third","Da sagde Slangen til Kvinden: ""I skal ingenlunde dø;","The serpent said to the woman, ""You won't surely die,",9,2,58
" (Mattæus 25:1-4) Gud har således vist sit klare og konsekvente svar på de to spørgsmål, der stadig",""" på dansk  For det første siger Gud: ""Dere skal ikke spise af frugterne af træet, som er midt i haven, for det siger: 'du skal ikke spise af det, ej heller røre ved det, for du skal dø.'""<|endoftext|>","Da sagde Slangen til Kvinden: ""I skal ingenlunde dø;","The serpent said to the woman, ""You won't surely die,",10,2,58
 Jeg så op på englene. »I må ikke se jeres fædre eller jeres mødre eller i jeres brødre eller jeres søstre i helvede,                                                                                                                          ,"Da sagde Slangen til Kvinden: ""I skal ingenlunde dø;","The serpent said to the woman, ""You won't surely die,",11,2,58
" på Engelsk
""You see, this way is to eat of the fruit of the tree in the middle of the garden, but you must not eat",""" på dansk er:  Han sagde: ""Du skal ikke spise af træet i midten af haven, for det er Guds bud: Du skal ikke spise det, du skal ikke røre ved det, så du dør.<|endoftext|>","Da sagde Slangen til Kvinden: ""I skal ingenlunde dø;","The serpent said to the woman, ""You won't surely die,",12,2,58
" (Es. 52,12). I stedet for at dø, vil vi leve. Vi kender de bibelske vers. Den ene har","    ""You must eat the fruit of the tree, but you must not touch it.""            ""You must not touch the tree with your mouth, nor touch it with your hand, lest you die.""    ""You must not eat the fruit of the tree, but","Da sagde Slangen til Kvinden: ""I skal ingenlunde dø;","The serpent said to the woman, ""You won't surely die,",13,2,58
"
1:54Da sagde han endnu engang til Israels Børn: ""Hvis I i stedet kommer til mig her til Middag, går i ikke i",""" på dansk:  Og han sagde til dem: ""Der skal ingen frugt være i det træ, som står midt i haven; du skal ikke spise af det, og du må heller ikke røre ved det, så du dør.""<|endoftext|>","Da sagde Slangen til Kvinden: ""I skal ingenlunde dø;","The serpent said to the woman, ""You won't surely die,",14,2,58
"
Midt i deres diskussion om frugten, spurgte Jesus dem: ""Den, som spiser af træet, må ikke dø. Den, som",""" på dansk:  Men af frugterne af det træ, som er midt i haven, har Gud sagt: »Du skal ikke spise af det, og du må heller ikke røre ved det, for at du ikke skal dø.«<|endoftext|>","Da sagde Slangen til Kvinden: ""I skal ingenlunde dø;","The serpent said to the woman, ""You won't surely die,",15,2,58
" (Mark 10,28). 15. marts er Herrens dag for os, og det er dagen, hvor der bliver sendt bud","  ""The tree, as we say, is a fruit of the tree of life, and God himself is the fruit of the tree of life. He is the God of the fruit of the tree of life, and God himself is the God of the fruit of the tree of life. He is the","Da sagde Slangen til Kvinden: ""I skal ingenlunde dø;","The serpent said to the woman, ""You won't surely die,",16,2,58
"
19. 2005: ""Jeg blev i dag 1 år ældre. Når jeg står i skoven og ser mig om,"," på Dansk?  Og det er jo et ganske naturligt spørgsmål, som hører med til at være kristen, når man hører, at Gud har sagt: ""Dere skal ikke spise af frugterne af det træ, som ligger midt i haven, for det skal I ikke spise af, ej heller skal","Da sagde Slangen til Kvinden: ""I skal ingenlunde dø;","The serpent said to the woman, ""You won't surely die,",17,2,58
" »Ja, hvad er det, De har på hånden?« spurgte han. »Ikke andet, end at der står et gammelt træ, som står",""" på Norsk: 26:20 Og det er sagt til dig, når du ser på frukten av træet midt i haven: Du skal ikke spise av den, du skal ikke røre ved den, forat du ikke skal dø.<|endoftext|>","Da sagde Slangen til Kvinden: ""I skal ingenlunde dø;","The serpent said to the woman, ""You won't surely die,",18,2,58
"
Engelsk: 32 But the Lord God said to Me: ""Do not eat from those which are on trees, for the seed which is",""" på Norsk?  Og av frukten av treet som er midt i haven, sa Gud: «Du skal ikke ete av det, og du skal ikke røre ved det, forat du ikke skal dø.<|endoftext|>","Da sagde Slangen til Kvinden: ""I skal ingenlunde dø;","The serpent said to the woman, ""You won't surely die,",19,2,58
"
(Det er dette bud, vi nu får at høre fra Moses.)
Moses fik af Gud påbud om, at han skulle spise og drikke","  3. Dansk: I 2016 blev den største og mest berømte af disse store byer, London, kåret som verdens bedste by.  Engelsk: In 2016, the largest and most famous of these great cities, London, was named as the world's best city","Da sagde Slangen til Kvinden: ""I skal ingenlunde dø;","The serpent said to the woman, ""You won't surely die,",20,2,58
"
Lav en slags vandkar – i dit køleskab, eller i en gryde, tag en glas-sukker-skål med et låg på",""" på Dansk?  Det er ikke godt, at det er den samme frugt, som Gud har lagt i midten af haven, og det er heller ikke godt, at man spiser af den, for så dør man.<|endoftext|>","Da sagde Slangen til Kvinden: ""I skal ingenlunde dø;","The serpent said to the woman, ""You won't surely die,",21,2,58
"…""Gaa væk fra Herren !"" – Sådan lød velsignelsen, da hans søn, som var blevet 16 år, i ","  This is the same as the saying, ""I will not eat of the fruit of the tree which is in the middle of the garden, but I will eat of the fruit of the tree which is in the middle of the garden, and I will eat of it, and I will eat of it","Da sagde Slangen til Kvinden: ""I skal ingenlunde dø;","The serpent said to the woman, ""You won't surely die,",22,2,58
" på Norsk:
For når du har tatt frukten midt i hagen, må du ikke spise; men når du skal smake på den, kan du",""" på dansk?  For når du er i Guds hus, da vil du ikke spise af det, ej heller røre ved det, for du skal dø, og du vil ikke leve mere.""<|endoftext|>","Da sagde Slangen til Kvinden: ""I skal ingenlunde dø;","The serpent said to the woman, ""You won't surely die,",23,2,58
" på Engelsk
""In that day, God did not say to the children, 'Do not live as one who eats the fruit of the tree",""" på dansk?  I det gamle Testamente siger Gud til Adam: ""I skal ikke spise af træet i haven; I skal ikke røre ved det, forat I ikke skal dø.""<|endoftext|>","Da sagde Slangen til Kvinden: ""I skal ingenlunde dø;","The serpent said to the woman, ""You won't surely die,",0,5,58
"
For det er jo dem, som er til at dø for, og en syndig tanke:
Svaret fra de gamle grækere lå","    The man who wrote the book was a man named Joseph Smith. He was a friend of Jesus and taught that the fruit of the tree was the fruit of the Holy Spirit. He was a man who believed that the Holy Spirit had been given to the disciples, and that they should not eat","Da sagde Slangen til Kvinden: ""I skal ingenlunde dø;","The serpent said to the woman, ""You won't surely die,",1,5,58
" in English
""And they said unto them, Go away, for it is a shame, because the seed of the fruit shall yield and the fruit",""" på Svenska?  ""Jag har talat till er, och jag har sagt till er: 'Ni skall inte äta av det eller röra det, inte heller skall ni dricka av det, ty då dör ni.'<|endoftext|>","Da sagde Slangen til Kvinden: ""I skal ingenlunde dø;","The serpent said to the woman, ""You won't surely die,",2,5,58
"
5. Hvis I spiser det, som hører til æblerne, hvad skal så det som hører til nektarhindbærrene og hvad det",""" på dansk er:  Og det er ikke nok med at de skal være sunde og raske, de skal også smage godt.<|endoftext|>","Da sagde Slangen til Kvinden: ""I skal ingenlunde dø;","The serpent said to the woman, ""You won't surely die,",3,5,58
