danish_predicted_output,english_predicted_output,danish_true_label,english_true_label,layer,lambda_amount,bible_verse
 da gav hans hustru ham et stort barn af en stor ætt; hans hustru blev med barn; og de kaldte ham Evan. 19 Men,"  Kaelyn: What happened after Noah went out?  Estella: The word ""Moses"" derives from the Old Testament name for the ark of Moses, and was used to refer to a long-deported ark.  Kaelyn: Did he ever go tilbage?  Estella: After a short time in exile, Noah returned to Israel, and","og alle de vildtlevende Dyr, alt Kvæget, alle Fuglene og alt Krybet, der kryber på Jorden, efter deres Slægter, gik ud af Arken.","Every animal, every creeping thing, and every bird, whatever moves on the earth, after their families, went out of the ship.",19,5,201
" thi det er bedre at tage de døde end de levende, som heller skal dø.""
(Josva 7:38) Noa",". He was the first man to go to the sea, and the first man to take a wife, and the first man to have a child.<|endoftext|>","og alle de vildtlevende Dyr, alt Kvæget, alle Fuglene og alt Krybet, der kryber på Jorden, efter deres Slægter, gik ud af Arken.","Every animal, every creeping thing, and every bird, whatever moves on the earth, after their families, went out of the ship.",20,5,201
" de gik da hen til graven og lod al deres adel fare. Dette gik den dag, som var i 1883 f.Kr"," And it is not without reason that the angels of the house of Israel have been afflicted with the plague, for the Lord, the God of Israel, has been afflicted with it. For the house of Israel is a plague-beaten house, and the plague is not over. And it was said, ""This is the plague of the house of Israel.""","og alle de vildtlevende Dyr, alt Kvæget, alle Fuglene og alt Krybet, der kryber på Jorden, efter deres Slægter, gik ud af Arken.","Every animal, every creeping thing, and every bird, whatever moves on the earth, after their families, went out of the ship.",21,5,201
" og Gud forgave dem også.
da: Således så han på dem, da de gik ud med sine sønner, sin hustru og sine sønnerkon"," But the LORD said to him, ""You have done this to the children of Israel: you have put your hands on the children of Israel."" And the LORD said to the children of Israel, ""Take your wives, and your sons, and your wives' wives, and your sons' wives, and your sons' sons, and take them with you."" And the LORD said to","og alle de vildtlevende Dyr, alt Kvæget, alle Fuglene og alt Krybet, der kryber på Jorden, efter deres Slægter, gik ud af Arken.","Every animal, every creeping thing, and every bird, whatever moves on the earth, after their families, went out of the ship.",22,5,201
" de gik ud fra Ægypten; og Noab gik hjem til sin far og sagde til ham: 39
31 ""Far"," 24And they were standing in the midst of the camp, while the people were gathering. 25And the son of Nimrod came out of the tent, and he called to the people, saying, 'Alas, I have come to know the evil which has come to the children of Israel. 26And I have heard of the words of the Lord, which","og alle de vildtlevende Dyr, alt Kvæget, alle Fuglene og alt Krybet, der kryber på Jorden, efter deres Slægter, gik ud af Arken.","Every animal, every creeping thing, and every bird, whatever moves on the earth, after their families, went out of the ship.",23,5,201
" og det var om aftenen og om morgenen, at Israels Gud gjorde ham i stand til at forlade dem af sine arme, som de laa i graven,","    ""Mama, I'm going to the cemetery,"" said the young girl, ""and I'm going to the cemetery with you.""    ""Don't,"" said the father, ""I'll go with you, too, and I'll go with you.""    ""Mama, I'm going to the cemetery,"" said the girl, ""and","og alle de vildtlevende Dyr, alt Kvæget, alle Fuglene og alt Krybet, der kryber på Jorden, efter deres Slægter, gik ud af Arken.","Every animal, every creeping thing, and every bird, whatever moves on the earth, after their families, went out of the ship.",0,10,201
" og han førte dem op til det land, der ligger midt imellem Israel og Juda, som kaldes Sodoma, og til de lande, de lod","  He's been all right, all right, all right. ->  Hann hefur verið réttur, réttur, réttur.  Viltu fá meira að vita? ->  Það er ekki gott að fá meira að vita.  Hver er best að vinna í London? ->  Ég var að hugsa um það hvort það væri best að vinna í London.  Mik","og alle de vildtlevende Dyr, alt Kvæget, alle Fuglene og alt Krybet, der kryber på Jorden, efter deres Slægter, gik ud af Arken.","Every animal, every creeping thing, and every bird, whatever moves on the earth, after their families, went out of the ship.",1,10,201
" men da Juda forundredes over, at hun var borte, sagde han: »Det kommer nok af, at jeg er langt borte, at jeg",     That's what I did.    Miranda: And I didn't even know how to go to school.  Jóhann: I did know how to go to school.  Miranda: And I did not know how to go to school.  Jóhann: I did know how to go to school.  Miranda: And I,"og alle de vildtlevende Dyr, alt Kvæget, alle Fuglene og alt Krybet, der kryber på Jorden, efter deres Slægter, gik ud af Arken.","Every animal, every creeping thing, and every bird, whatever moves on the earth, after their families, went out of the ship.",2,10,201
" men da hun hørte om disse ting, sagde hun til Moses: 23-25: »Gå da ud i ørkenen for at hente"," And they were all together, they were all together, they were all together, and they were all together. And they were all together, they were all together, and they were all together. And they were all together, they were all together, and they were all together. And they were all together, they were all together, and they were all together. And they were all together, they","og alle de vildtlevende Dyr, alt Kvæget, alle Fuglene og alt Krybet, der kryber på Jorden, efter deres Slægter, gik ud af Arken.","Every animal, every creeping thing, and every bird, whatever moves on the earth, after their families, went out of the ship.",3,10,201
" saa skal jeg tage det hus og den jord, som er imellem den stenekælder, der laa oven for den stenrøse og midt imot","    10. norsk: Jeg hadde ikke vært i kirken på flere dager.  engelsk: I hadn't been to church in a few days.    11. norsk: Det er det, jeg har gjort, siger han.  engelsk: That's what I've done, she says.    12. norsk: En del af det er blevet til en","og alle de vildtlevende Dyr, alt Kvæget, alle Fuglene og alt Krybet, der kryber på Jorden, efter deres Slægter, gik ud af Arken.","Every animal, every creeping thing, and every bird, whatever moves on the earth, after their families, went out of the ship.",4,10,201
; i den tid har Noa gjort denne gjerning.<|endoftext|>," 27:20 And they said, 'It is not true, that Noah went out with his sons, with his wives, and his sons' wives with him.' 27:21 And they said, 'It is not true, that Noah went out with his sons, with his wives, and his sons' wives with him.' 27:22 And they","og alle de vildtlevende Dyr, alt Kvæget, alle Fuglene og alt Krybet, der kryber på Jorden, efter deres Slægter, gik ud af Arken.","Every animal, every creeping thing, and every bird, whatever moves on the earth, after their families, went out of the ship.",5,10,201
" og de boede i deres by. 4 Og Noa forlod deres land, de boede i deres by.
9 På den tid havde kong David","  20For the sons of Noah, he saith to them: 'Bring forth forth the children of your fathers; and let them go out of the house of your fathers; for it is no good; but if you bring forth the children of the husbands of your fathers, so that the husbands of your fathers may be in the house of your fathers, and your husbands","og alle de vildtlevende Dyr, alt Kvæget, alle Fuglene og alt Krybet, der kryber på Jorden, efter deres Slægter, gik ud af Arken.","Every animal, every creeping thing, and every bird, whatever moves on the earth, after their families, went out of the ship.",6,10,201
" således gik også Noah, da han kom ned i Dybet, til dybet med sin hustru Gose; og de førte hende op i Kedar",.<|endoftext|>,"og alle de vildtlevende Dyr, alt Kvæget, alle Fuglene og alt Krybet, der kryber på Jorden, efter deres Slægter, gik ud af Arken.","Every animal, every creeping thing, and every bird, whatever moves on the earth, after their families, went out of the ship.",7,10,201
" thi folket var kommet fra Ægypten, som den første Konge fra Israel, for at tilbede paa Bjerget, og Abraham var i Æ"," 16 Then the men of the tribe of Benjamin came and gathered all the men of the tribe of Joshua, and they went out, and they went up to the wilderness, and they built the wilderness of Naphtali.  17 When the men of the tribe of Benjamin went out, with their sons, his wife, and his sons' wives, and the men of the","og alle de vildtlevende Dyr, alt Kvæget, alle Fuglene og alt Krybet, der kryber på Jorden, efter deres Slægter, gik ud af Arken.","Every animal, every creeping thing, and every bird, whatever moves on the earth, after their families, went out of the ship.",8,10,201
" efter dem var der ingen anden tilbage.»

Norsk: ""Noen ganger trenger man bare noen som sier alt.""
Dansk: ""Nogle","  The women were all married, and the children were all born.  He had the children, but he had no wife.  He had a daughter.  He had a son.  He had a daughter.  He had a son.  He had a daughter.  He had a son.  He had a daughter.  He had a son.  He had a daughter.","og alle de vildtlevende Dyr, alt Kvæget, alle Fuglene og alt Krybet, der kryber på Jorden, efter deres Slægter, gik ud af Arken.","Every animal, every creeping thing, and every bird, whatever moves on the earth, after their families, went out of the ship.",9,10,201
" 5 og hans børn med deres døtre gik med ham ud.
16 Og Naaman gik med de fem og de seks og med deres","  Sabrina: Was there a funeral?  Vigdís: They went out on a pilgrimage, and there he died, and they buried him in the Jordan, and there he was raised up again."" The story is part of the Bible, and is part of the Book of Genesis.  Sabrina: Was there a later version?  Vigdís: The story","og alle de vildtlevende Dyr, alt Kvæget, alle Fuglene og alt Krybet, der kryber på Jorden, efter deres Slægter, gik ud af Arken.","Every animal, every creeping thing, and every bird, whatever moves on the earth, after their families, went out of the ship.",10,10,201
"

""Det är den andra generationens judar som håller ut hela tiden. ->
Dvs. at jøderne er dem, som tør","    In 1998, 1999 og 2000 blev det til en stor succes. ->  In 1998, 1999 and 2000, it was a big success.    I 1999 blev det til en anden sejr for den portugisiske klub, som vandt Champions League. ->","og alle de vildtlevende Dyr, alt Kvæget, alle Fuglene og alt Krybet, der kryber på Jorden, efter deres Slægter, gik ud af Arken.","Every animal, every creeping thing, and every bird, whatever moves on the earth, after their families, went out of the ship.",11,10,201
" 21:36 og de gik ud og sagde til ham: ""Har du hørt, at israelitterne er gået over Jordan og er"," The man's wife came with him. She was a tall woman, and she was not much taller than he. She was very tall, and she was not much taller than he. And she was not much taller than he.  And the man said, ""Go, go, go, go.""  And he said, ""Go, go, go, go.""  And the man","og alle de vildtlevende Dyr, alt Kvæget, alle Fuglene og alt Krybet, der kryber på Jorden, efter deres Slægter, gik ud af Arken.","Every animal, every creeping thing, and every bird, whatever moves on the earth, after their families, went out of the ship.",12,10,201
" og de skulde dø uden at æde 32,000 brød; og da de kom tilbage til ham og så, at det saa",. ->  Engelsk  Og så gik Noah ud med sin familie og sin familie og hans sønner og hans sønner. ->  Dansk<|endoftext|>,"og alle de vildtlevende Dyr, alt Kvæget, alle Fuglene og alt Krybet, der kryber på Jorden, efter deres Slægter, gik ud af Arken.","Every animal, every creeping thing, and every bird, whatever moves on the earth, after their families, went out of the ship.",13,10,201
" alle blev de overøst med velsignelser; de blev til velsignelse for Israel, men ikke for hedningerne.
7 Og når No",. ->  Engelsk<|endoftext|>,"og alle de vildtlevende Dyr, alt Kvæget, alle Fuglene og alt Krybet, der kryber på Jorden, efter deres Slægter, gik ud af Arken.","Every animal, every creeping thing, and every bird, whatever moves on the earth, after their families, went out of the ship.",14,10,201
" og de kom bort til den sted, hvor den husbond, som hed Josua, lod bygge.
8 Derpå gik de for at hente",".  11:30 Da gik Noah ud, sammen med sine Sønner, sin Hustru og sine Sønner, sine Hustruers Hustruer.<|endoftext|>","og alle de vildtlevende Dyr, alt Kvæget, alle Fuglene og alt Krybet, der kryber på Jorden, efter deres Slægter, gik ud af Arken.","Every animal, every creeping thing, and every bird, whatever moves on the earth, after their families, went out of the ship.",15,10,201
" men Esajas kom ud blandt sine tjenere og sagde: 24 Se, jeg kender en, der hedder Esau: den har fået",  20.10.1960  20.10.1960  20.10.1960  20.10.1960  20.10.1960  20.10.1960  20.10.1960  20,"og alle de vildtlevende Dyr, alt Kvæget, alle Fuglene og alt Krybet, der kryber på Jorden, efter deres Slægter, gik ud af Arken.","Every animal, every creeping thing, and every bird, whatever moves on the earth, after their families, went out of the ship.",16,10,201
" og jeg gik også.
49. And it will be so with you, if you will only be as I was.
50.",".  11:10 Og alle de andre, der var hos ham, gik ud sammen med hans sønner, hans hustru og hans svigerdatteres hustruer.<|endoftext|>","og alle de vildtlevende Dyr, alt Kvæget, alle Fuglene og alt Krybet, der kryber på Jorden, efter deres Slægter, gik ud af Arken.","Every animal, every creeping thing, and every bird, whatever moves on the earth, after their families, went out of the ship.",17,10,201
" hans hus holdt saa længe, at der ingen grund længere var til at tage nogen af hans folk, for det var allerede fuldendt med deres hustruer",                                                                                                                                                                ,"og alle de vildtlevende Dyr, alt Kvæget, alle Fuglene og alt Krybet, der kryber på Jorden, efter deres Slægter, gik ud af Arken.","Every animal, every creeping thing, and every bird, whatever moves on the earth, after their families, went out of the ship.",18,10,201
" hans sønner efter ham var Noab og Hebroniterne, som boede ved Sarn. 24 Så gik Noa hjem og tog sine",.<|endoftext|>,"og alle de vildtlevende Dyr, alt Kvæget, alle Fuglene og alt Krybet, der kryber på Jorden, efter deres Slægter, gik ud af Arken.","Every animal, every creeping thing, and every bird, whatever moves on the earth, after their families, went out of the ship.",19,10,201
" og de drog op til Aser, og folket kom fra Aser til Nebukadnessars hær. Og da de var komne ned",  I skal ikke komme med nogen s  s s s s s s s s s s s s s s s s s s s s s s s s s s s s s s s s s s s s s s s s s s s s s s s s s s s s s s s s s s s s s s s s s s s s s s s,"og alle de vildtlevende Dyr, alt Kvæget, alle Fuglene og alt Krybet, der kryber på Jorden, efter deres Slægter, gik ud af Arken.","Every animal, every creeping thing, and every bird, whatever moves on the earth, after their families, went out of the ship.",20,10,201
"
14 Derpå steg de op om morgenen da til Israels højborg, thi det var et stort slot, og de gik af sted fra sit",".  da:  Da der var gået et år, gik de alle sammen ud for at fejre den.<|endoftext|>","og alle de vildtlevende Dyr, alt Kvæget, alle Fuglene og alt Krybet, der kryber på Jorden, efter deres Slægter, gik ud af Arken.","Every animal, every creeping thing, and every bird, whatever moves on the earth, after their families, went out of the ship.",21,10,201
" og de forlod de syge i Edoms land, kom til det øde land Horeb i Edoms land og slog de syge ihjel der.
"," 21 But I am the one who gives this day to the people, for I am the one who gives this day to the nation, for I am the one who gives this day to the nation, 22 for I give this day to the nation, for I give this day to the nation, for I give this day to the nation, for I give this day to the nation","og alle de vildtlevende Dyr, alt Kvæget, alle Fuglene og alt Krybet, der kryber på Jorden, efter deres Slægter, gik ud af Arken.","Every animal, every creeping thing, and every bird, whatever moves on the earth, after their families, went out of the ship.",22,10,201
;<|endoftext|>,.<|endoftext|>,"og alle de vildtlevende Dyr, alt Kvæget, alle Fuglene og alt Krybet, der kryber på Jorden, efter deres Slægter, gik ud af Arken.","Every animal, every creeping thing, and every bird, whatever moves on the earth, after their families, went out of the ship.",23,10,201
 og de fik et barn. I dette barn var der to sønner: den ene hed Nao; den anden hed Noa. Da gik Noa,    A:    A:    A:    A:    A:    A:    A:    A:    A:      A:      A:      A:      A:      A:    A:      A:    A:    A:    ,"og alle de vildtlevende Dyr, alt Kvæget, alle Fuglene og alt Krybet, der kryber på Jorden, efter deres Slægter, gik ud af Arken.","Every animal, every creeping thing, and every bird, whatever moves on the earth, after their families, went out of the ship.",0,15,201
" for HERREN sin Gud sendte ham ud iblandt folkene.
The sun rises and sets, the stars appear and fall, it is dark, and"," The song was sungur af honum sjálfan, og var það í fyrsta skipti sem hann var í heiminum.  Í fyrsta skipti sem hann var í heiminum var hann í heiminum.  Í fyrsta skipti sem hann var í heiminum var hann í heiminum.  Í fyrsta skipti sem hann var í heiminum var hann í heiminum.  Í fyrsta skipti sem hann var í heiminum var í heiminum.  Í fyrsta","og alle de vildtlevende Dyr, alt Kvæget, alle Fuglene og alt Krybet, der kryber på Jorden, efter deres Slægter, gik ud af Arken.","Every animal, every creeping thing, and every bird, whatever moves on the earth, after their families, went out of the ship.",1,15,201
" han gik hen med dem ind i arken, og det lød som en fortumret røst i Ørkenen, og det hørtes:",".  The boy went out, with his sons, his wife, and his sons' wives with him.<|endoftext|>","og alle de vildtlevende Dyr, alt Kvæget, alle Fuglene og alt Krybet, der kryber på Jorden, efter deres Slægter, gik ud af Arken.","Every animal, every creeping thing, and every bird, whatever moves on the earth, after their families, went out of the ship.",2,15,201
" men Israels børn og deres døtre, som var gået bort, kom ind i byen for at se, hvad de da havde gjort."" på Engelsk?","    ""Hør, hør, hør! hør!""    ""Hør, hør, hør! hør!""    ""Hør, hør, hør! hør!""    ""Hør, hør, hør! hør!""    ""Hør, hør, hør! hør!""    ""Hør, hør, hør! hør!""    ""Hør, hør,","og alle de vildtlevende Dyr, alt Kvæget, alle Fuglene og alt Krybet, der kryber på Jorden, efter deres Slægter, gik ud af Arken.","Every animal, every creeping thing, and every bird, whatever moves on the earth, after their families, went out of the ship.",3,15,201
" men HERREN var over dem alle, og de døde ikke.
26 Og Nun skal du kaste ut av leiren; og hun skal","    Dansk: Det er en af de mange ting, som er blevet gjort.  Engelsk: One of those many things that has been done.    Dansk: Jeg var ikke den eneste, der var glad for det.  Engelsk: I wasn't the only one who was pleased.    Dansk: ""Hvad er det for en historie du fortæller os?""  Engelsk: ""What","og alle de vildtlevende Dyr, alt Kvæget, alle Fuglene og alt Krybet, der kryber på Jorden, efter deres Slægter, gik ud af Arken.","Every animal, every creeping thing, and every bird, whatever moves on the earth, after their families, went out of the ship.",4,15,201
"; men da blev Noas søn Asura borte, da lod israeliterna ingen holde rede paa ham, for at de ikke skulde fare vild.<|endoftext|>",. ->  engelska<|endoftext|>,"og alle de vildtlevende Dyr, alt Kvæget, alle Fuglene og alt Krybet, der kryber på Jorden, efter deres Slægter, gik ud af Arken.","Every animal, every creeping thing, and every bird, whatever moves on the earth, after their families, went out of the ship.",5,15,201
"; de skulle ogsaa drage til Egypten, som alle Israels børn skulde drage til; de skulde drage til Egyptens land.<|endoftext|>",.<|endoftext|>,"og alle de vildtlevende Dyr, alt Kvæget, alle Fuglene og alt Krybet, der kryber på Jorden, efter deres Slægter, gik ud af Arken.","Every animal, every creeping thing, and every bird, whatever moves on the earth, after their families, went out of the ship.",6,15,201
" og alle de, som hørte ham, tilbad ham, og alle deres forfedre tilbad ham og alle hans efterkommere og i alt","    Men det var ikke et nemt valg, og det var et dårligt valg. -> Det var ikke nemt, og det var et dårligt valg.    Men da vi ankom til hotellet var der ingen personale. -> Da vi ankom til hotellet, var der ingen receptionspersonale.    Der er 300000 mennesker, der har købt den. -> 300","og alle de vildtlevende Dyr, alt Kvæget, alle Fuglene og alt Krybet, der kryber på Jorden, efter deres Slægter, gik ud af Arken.","Every animal, every creeping thing, and every bird, whatever moves on the earth, after their families, went out of the ship.",7,15,201
" da kom HERREN til ham og sagde: ""Far og søn!"" og HERREN lod ham dø; men ingen af børnene blev taget af dage;",.<|endoftext|>,"og alle de vildtlevende Dyr, alt Kvæget, alle Fuglene og alt Krybet, der kryber på Jorden, efter deres Slægter, gik ud af Arken.","Every animal, every creeping thing, and every bird, whatever moves on the earth, after their families, went out of the ship.",8,15,201
" men Isak satte en sonnedatter derover med 10 sønner og 3 døtre, og de blev 60 mand store; så",                                                                                                                                                                ,"og alle de vildtlevende Dyr, alt Kvæget, alle Fuglene og alt Krybet, der kryber på Jorden, efter deres Slægter, gik ud af Arken.","Every animal, every creeping thing, and every bird, whatever moves on the earth, after their families, went out of the ship.",9,15,201
"
17 1. Og hans ætt kom fra øst over Jordan og nedover til Kadesh og nedover til Gilead, 18",.<|endoftext|>,"og alle de vildtlevende Dyr, alt Kvæget, alle Fuglene og alt Krybet, der kryber på Jorden, efter deres Slægter, gik ud af Arken.","Every animal, every creeping thing, and every bird, whatever moves on the earth, after their families, went out of the ship.",10,15,201
"
norwegian: 19,14 Da gik Noa og hans sønner og hans hustru og hans hustruhustru ut med sine sønner og", Og den anden blev sendt ud med sine sønner og sine hustruer med sine børn. Og den anden blev sendt ud med sine sønner og sine hustruer med sine børn.    3. Jeg har lavet en fejl i artiklen. ->  Jeg har lavet en fejl i artiklen.    4. Hvad er forskellen mellem 100 og 1000? ->  Hvad er forskellen,"og alle de vildtlevende Dyr, alt Kvæget, alle Fuglene og alt Krybet, der kryber på Jorden, efter deres Slægter, gik ud af Arken.","Every animal, every creeping thing, and every bird, whatever moves on the earth, after their families, went out of the ship.",11,15,201
" de førte de over i ørkenen.
31 Da gik noa ud med sine sønner, sit hustru og sin sønnernekonger; de"," 10He called the children of Israel to him, and said, ""They are coming, and they are coming, and they are coming. 10The children of Israel are coming, and they are coming, and they are coming. 10The children of Israel is coming, and they are coming, and they are coming. 10The children of Israel is coming,","og alle de vildtlevende Dyr, alt Kvæget, alle Fuglene og alt Krybet, der kryber på Jorden, efter deres Slægter, gik ud af Arken.","Every animal, every creeping thing, and every bird, whatever moves on the earth, after their families, went out of the ship.",12,15,201
" thi nu var han bleven mægtig og skulde tilintetgjøre alle folkeslagene.
6 Og noa trådte ut med sine sønner, sin","  I ser bort på min søn, og på min søn, på min søn, på min søn, på min søn, på min søn, på min søn, på min søn, på min søn, på min søn og på min søn, og på min søn, på min søn og på min sønn og på min sønn, på min sønn og på min sønn og på min sønn, på min","og alle de vildtlevende Dyr, alt Kvæget, alle Fuglene og alt Krybet, der kryber på Jorden, efter deres Slægter, gik ud af Arken.","Every animal, every creeping thing, and every bird, whatever moves on the earth, after their families, went out of the ship.",13,15,201
" men da de kom ind i Huset, sagde Noa og hans sønner til ham og hans far Esau og hans bror Jojakim og alle sine","  Det er derfor vi har brug for dig, når du skal arbejde med mennesker. ->  Derfor har vi brug for dig, når du skal arbejde med mennesker.  I begyndelsen af 1900-tallet, hvor der ikke fandtes nogen videnskabelige argumenter for, at der var tale om en trussel mod menneskets overlevelse. ->  I begyndelsen af 1900-tallet","og alle de vildtlevende Dyr, alt Kvæget, alle Fuglene og alt Krybet, der kryber på Jorden, efter deres Slægter, gik ud af Arken.","Every animal, every creeping thing, and every bird, whatever moves on the earth, after their families, went out of the ship.",14,15,201
