danish_predicted_output,english_predicted_output,danish_true_label,english_true_label,layer,lambda_amount,bible_verse
" 123 Da så han nu efter, at den havde vandet i to dage, så han og så efter, at der ikke var noget i",.<|endoftext|>,Derpå biede han yderligere syv Dage og sendte så atter Duen ud fra Arken;,He stayed yet another seven days; and again he sent the dove out of the ship.,13,10,192
.<|endoftext|>,    21:14-16    - 21:14-16    - 21:16-17    - 21:17-18    ,Derpå biede han yderligere syv Dage og sendte så atter Duen ud fra Arken;,He stayed yet another seven days; and again he sent the dove out of the ship.,14,10,192
"
I said to him, ""The serpent did not find another place of refuge and returned to him in the Ark, because there was still water","  ""Her, kære, kære pige,"" sagde han, ""er en af de ting, som jeg ikke har kunnet få af vejen, og som jeg ikke kan slippe af med.""  ""Det er jeg ked af at høre, kære",Derpå biede han yderligere syv Dage og sendte så atter Duen ud fra Arken;,He stayed yet another seven days; and again he sent the dove out of the ship.,15,10,192
" (8 Mosebog 23,019,020,038)
3. Mosebog 23 Det var",  4.2.1.1.1.1.1.1.1.1.1.1.1.1.1.1.1.1.1.1.1.1.1.1,Derpå biede han yderligere syv Dage og sendte så atter Duen ud fra Arken;,He stayed yet another seven days; and again he sent the dove out of the ship.,16,10,192
"
""Tak Gud du, min kære ven"", sagde duen, ""for at du har givet mig anledning til at forfølge min sag, og","  Da jeg var i den anden del af landet, fandt jeg en vej, hvor man kan løbe.  Det er for at forhindre, at der er en chance for, at barnet er ved at dø.  Det er derfor, at",Derpå biede han yderligere syv Dage og sendte så atter Duen ud fra Arken;,He stayed yet another seven days; and again he sent the dove out of the ship.,17,10,192
" Da sagde han til hanens æg, som blev liggende i arken: Jeg har netop fundet et æg af ægget fra en hønsefjer",    K    K    K                                                                              ,Derpå biede han yderligere syv Dage og sendte så atter Duen ud fra Arken;,He stayed yet another seven days; and again he sent the dove out of the ship.,18,10,192
" Men han kunne heller ikke finde den, som førte den til ham. Da så han, hvordan han måtte bære sig ad, for at finde den.",.<|endoftext|>,Derpå biede han yderligere syv Dage og sendte så atter Duen ud fra Arken;,He stayed yet another seven days; and again he sent the dove out of the ship.,19,10,192
"
engelsk:
5 After two days he came to the ark carrying on his wife, saying, ""It is full in this ark the water in"," Men and kvinder, de besogte hende; og fra den dag af er hun almindelig blandt de s t u m s t e m s, som er ud s t u s t med en s t o r og s t r",Derpå biede han yderligere syv Dage og sendte så atter Duen ud fra Arken;,He stayed yet another seven days; and again he sent the dove out of the ship.,20,10,192
"
23:6 And the eagle did not find one dwelling, nor found a place to enter, which the dove did not find","  dansk: Det var et smukt sted, og de mange dyr.  engelsk: It was a beautiful place, and the mange dyr.  dansk: Hvis du har et spørgsmål om en eller flere af disse produkter, kan du kontakte os",Derpå biede han yderligere syv Dage og sendte så atter Duen ud fra Arken;,He stayed yet another seven days; and again he sent the dove out of the ship.,21,10,192
"
""Hvad har du gjort ved denne myg, far?"" spurgte han.
""Jo, jeg har taget den med mig igen,"" svarede han"," She had a new look; and she said, ""My dear, I have been sick for a long time, and I am not well.""  ""It is not true,"" said he, ""that I have been sick for a long",Derpå biede han yderligere syv Dage og sendte så atter Duen ud fra Arken;,He stayed yet another seven days; and again he sent the dove out of the ship.,22,10,192
"
english - When the duke found no one, but the eagle, he went back to him in the ark, for there was water all",.<|endoftext|>,Derpå biede han yderligere syv Dage og sendte så atter Duen ud fra Arken;,He stayed yet another seven days; and again he sent the dove out of the ship.,23,10,192
.<|endoftext|>," for the sea 10.14.30, and then M, for the water «F.6.0.14.11.30, and for the 14.30, and for",Derpå biede han yderligere syv Dage og sendte så atter Duen ud fra Arken;,He stayed yet another seven days; and again he sent the dove out of the ship.,0,15,192
" Da de kom tilbage til landsbyen, havde den fået ny kraft og begyndte at flyve hen på dem; de skyndte sig at flygte og tog den"," the waters were on the surface of the whole earth. and she put out his hand, and took her, and brought her to him into the ship. the waters were on the surface of the whole earth. he put out his hand,",Derpå biede han yderligere syv Dage og sendte så atter Duen ud fra Arken;,He stayed yet another seven days; and again he sent the dove out of the ship.,1,15,192
" Når det så bliver morgen, da han var færdig med det, sagde han: ""Den er fuld af salt og vand?"" og gav sin arving","  The dove found no place to rest her foot, and she returned to him into the ship; for the waters were on the surface of the whole earth. he put out his hand, and took her, and brought her to him",Derpå biede han yderligere syv Dage og sendte så atter Duen ud fra Arken;,He stayed yet another seven days; and again he sent the dove out of the ship.,2,15,192
 Han vedblev også at rakke den ud til solen og at rakke hånden ned i vandet. Da kom der intet til ham. Da den ene," The sea were on the surface of the whole earth. he put out his hand, and took her, and brought her to him into the ship. The sea were on the surface of the whole earth. he put out his hand, and",Derpå biede han yderligere syv Dage og sendte så atter Duen ud fra Arken;,He stayed yet another seven days; and again he sent the dove out of the ship.,3,15,192
" Men for at han ikke skulle falde i vandet, fløj et af træerne ud hans næse, sådan at det faldt ned fra himlen. »Hvor er","  The dove found no place to rest her foot, and she returned to him into the ship; for the waters were on the surface of the whole earth. he put out his hand, and took her, and brought her to him",Derpå biede han yderligere syv Dage og sendte så atter Duen ud fra Arken;,He stayed yet another seven days; and again he sent the dove out of the ship.,4,15,192
.<|endoftext|>, And the dove went to the ship. And the dove went to the ship. And the dove went to the ship. And the dove went to the ship. And the dove went to the ship. And the d,Derpå biede han yderligere syv Dage og sendte så atter Duen ud fra Arken;,He stayed yet another seven days; and again he sent the dove out of the ship.,5,15,192
" Så vendte de sig og gik.
En søn rejste sig fra arken, og han sagde til kongesønnen: ""Siger du nu,","  For the dove; for he put out her hand, and brought her in the ship.  For the dove; for the dove; for the dove; for the dove; for the dove; for the",Derpå biede han yderligere syv Dage og sendte så atter Duen ud fra Arken;,He stayed yet another seven days; and again he sent the dove out of the ship.,6,15,192
" Da var det at der var en dværg, som kom ind imellem dem og sagde til ham: Herre, jeg er meget bange, men jeg"," mennesket blev til den dag, da dværgen og den dværge blev til den dag, hvor dværgen og den dværge blev til den dag, hvor dværgen og den dværge blev til den",Derpå biede han yderligere syv Dage og sendte så atter Duen ud fra Arken;,He stayed yet another seven days; and again he sent the dove out of the ship.,7,15,192
"
da:
17 Og da han, efter at have hørt disse ord, kom til arken, stod hans bror ved hans side. Og","  And she said,  ""This is the land of the wolves,  and there is no place for her foot in the ship,  and there is no place for her foot in the ship,  and there is no place",Derpå biede han yderligere syv Dage og sendte så atter Duen ud fra Arken;,He stayed yet another seven days; and again he sent the dove out of the ship.,8,15,192
".
Dansk<|endoftext|>",                                                                                                ,Derpå biede han yderligere syv Dage og sendte så atter Duen ud fra Arken;,He stayed yet another seven days; and again he sent the dove out of the ship.,9,15,192
.<|endoftext|>,". Og den anden dove, og den tredje var i den samme position.<|endoftext|>",Derpå biede han yderligere syv Dage og sendte så atter Duen ud fra Arken;,He stayed yet another seven days; and again he sent the dove out of the ship.,10,15,192
"
Engelsk: (143) The two young men looked and heard a great loud trumpet sounded and when the great trumpet sounded, the",  Jakob  Jakob                                                                                    ,Derpå biede han yderligere syv Dage og sendte så atter Duen ud fra Arken;,He stayed yet another seven days; and again he sent the dove out of the ship.,11,15,192
" Så drog han sin kappe af, lagde sig på gulvet foran arken og kastede sig på knæ og tog dommens dag i sine hænder.","  And the dove took her, and put her in the ship. And the dove took her, and put it, and put it into the ship. And the dove took her, and put it, and put it into",Derpå biede han yderligere syv Dage og sendte så atter Duen ud fra Arken;,He stayed yet another seven days; and again he sent the dove out of the ship.,12,15,192
"
da ->
Men duens føtter fant ikke hus, den trakk inn til sin leir, og han vendte tilbake til ham i arken,",".  18. For det er et stort spørgsmål, som er meget vanskeligt at besvare, men som det er meget vanskeligt at afvise, idet der er stor forskel mellem spørgsmålene.<|endoftext|>",Derpå biede han yderligere syv Dage og sendte så atter Duen ud fra Arken;,He stayed yet another seven days; and again he sent the dove out of the ship.,13,15,192
"
23 And the dove did not find it in thy ark, and went back to him; because the water was all over the earth.","  Dollars:  2000,000,000,000,000,000,000,000,000,000,0",Derpå biede han yderligere syv Dage og sendte så atter Duen ud fra Arken;,He stayed yet another seven days; and again he sent the dove out of the ship.,14,15,192
"
7. And in the midst of the people who were to receive the gospel, He was standing near the people. -> Og midt iblandt folket,","  14, 15.  15.  15.  15.  15.  15.  15.  15.  15.  15.  15.",Derpå biede han yderligere syv Dage og sendte så atter Duen ud fra Arken;,He stayed yet another seven days; and again he sent the dove out of the ship.,15,15,192
". Og han sagde til den: Hvorfor tror du, jeg er her?<|endoftext|>","    16, 17, 18, 19, 20, 21, 22, 23, 24, 25, 26, 27",Derpå biede han yderligere syv Dage og sendte så atter Duen ud fra Arken;,He stayed yet another seven days; and again he sent the dove out of the ship.,16,15,192
" Så trak han den selv hen i arken og så på jorden, og der var kun de tørre blade oppe over jorden under sin hånd. Og jorden",  6.11-11.12.  10.11-11.12.  15.11-16.11.  17.11-18.,Derpå biede han yderligere syv Dage og sendte så atter Duen ud fra Arken;,He stayed yet another seven days; and again he sent the dove out of the ship.,17,15,192
" (Saul 4, 13; Job 14, 15.) 12 Og der de havde fundet dig, drog",  2.                                                                                          ,Derpå biede han yderligere syv Dage og sendte så atter Duen ud fra Arken;,He stayed yet another seven days; and again he sent the dove out of the ship.,18,15,192
"

EN ->
And when the man who was a priest came out, he opened the ark that was in the place of the ark of the",.<|endoftext|>,Derpå biede han yderligere syv Dage og sendte så atter Duen ud fra Arken;,He stayed yet another seven days; and again he sent the dove out of the ship.,19,15,192
" Og da der ingen børn var på jorden, sendte han en af sine disciple til at hente den tomme dåse olie i et fad; og da"," først, som de først bør, at først, som de først bør, at først, som de først bør, først, som de først bør, først, som de først bør, først, som de først bør, først, som de",Derpå biede han yderligere syv Dage og sendte så atter Duen ud fra Arken;,He stayed yet another seven days; and again he sent the dove out of the ship.,20,15,192
" ""Så vil vi se til dette, min herre,"" sagde han. ""Du kan fortælle mig, at du i dag, min hersker, er",                                                                                                ,Derpå biede han yderligere syv Dage og sendte så atter Duen ud fra Arken;,He stayed yet another seven days; and again he sent the dove out of the ship.,21,15,192
"
5. En mand gik hen foran folket og sagde til dem: ""Hvorfor er der intet sted, han kan sætte sin fod på?"" -> ","  ""Kh'j jj jj jj jj jj jj jj jj jj jj jj jj jj jj jj jj jj jj jj jj jj",Derpå biede han yderligere syv Dage og sendte så atter Duen ud fra Arken;,He stayed yet another seven days; and again he sent the dove out of the ship.,22,15,192
" Da han var færdig, lagde han den ene fjer efter den anden på jorden og sagde til den anden:«Herre, lad den blive i min","  941. The dove then went out with her feet on the water, and her wings were in the air.  942. But the king of Israel said to his people: ""I will not eat any of",Derpå biede han yderligere syv Dage og sendte så atter Duen ud fra Arken;,He stayed yet another seven days; and again he sent the dove out of the ship.,23,15,192
"
16.10 Efter at have båret arken til arken blev der lagt et tæppe hen over dem på gulvet, og da","    15. He said to her, ""Take your clothes and your shoes and go out and wash your feet. When you are done, take a cup of water, and drink it, and wash your feet again.""    ",Derpå biede han yderligere syv Dage og sendte så atter Duen ud fra Arken;,He stayed yet another seven days; and again he sent the dove out of the ship.,0,2,192
" Og da den havde taget sit ophold, begyndte den at spinde opad igen og tage de samme klæder af. »Hvad siger du til dette","  35:40 So the king's servants said to the dove, ""It is a pity that the dove did not find a place to rest her foot; for the waters are on the surface of the whole earth",Derpå biede han yderligere syv Dage og sendte så atter Duen ud fra Arken;,He stayed yet another seven days; and again he sent the dove out of the ship.,1,2,192
"
2 Og da de var ude af arken, vendte en due hjem igen, og et lys kom frem af arken, og det viste sig",                                                                                                ,Derpå biede han yderligere syv Dage og sendte så atter Duen ud fra Arken;,He stayed yet another seven days; and again he sent the dove out of the ship.,2,2,192
" Da sagde en af dølerne til ham: «Hvorfor har du taget det så nær af mig? Jeg går jo for mig selv, og jeg kan",    10. Svenska: Detta är en av de största skillnaderna mellan att spela live och att spela på nätet.  Engelska: This is one of the biggest differences between playing live and playing online.    11. Svenska:,Derpå biede han yderligere syv Dage og sendte så atter Duen ud fra Arken;,He stayed yet another seven days; and again he sent the dove out of the ship.,3,2,192
 16 Men hvis en af dine tjenere i stedet for at hente vand tog en urtekvist af æbletræet i sit ar-,"  He said to her, ""Let me help you to the land of the Aroer. I will not be so long.""  She said, ""I will not be long.""  He said, ""It is a very good",Derpå biede han yderligere syv Dage og sendte så atter Duen ud fra Arken;,He stayed yet another seven days; and again he sent the dove out of the ship.,4,2,192
" Og det blev straks en stor glæde for ham, for nu var han selv en konge, som havde opdraget hyrdedrengen og sat sig øverst","  6.  The dove went out of the ship and came to the boat, and the boat was full of water; and she came to the dove, and the dove brought her to the boat, and she went out",Derpå biede han yderligere syv Dage og sendte så atter Duen ud fra Arken;,He stayed yet another seven days; and again he sent the dove out of the ship.,5,2,192
"
2, 24 Og i det samme nærmede han sig med sin hånd den, og dens hår spandt ligesom ud i alle dets retninger","  The dove gave her to him, and he had no trouble with her.  After some time he went back to the ship, and he took the dove with him, and she was carried on board the ship.  Then",Derpå biede han yderligere syv Dage og sendte så atter Duen ud fra Arken;,He stayed yet another seven days; and again he sent the dove out of the ship.,6,2,192
" Da han var færdig, sagde han: ""Farvel dig"", og gik ud. Men da der var brudt ud brand over Egypten, fulgte han"," But the dove did not rest her foot, but ran away.  And when the dove had returned to him, he took her, and brought her to him into the ship. And when the dove had returned to him,",Derpå biede han yderligere syv Dage og sendte så atter Duen ud fra Arken;,He stayed yet another seven days; and again he sent the dove out of the ship.,7,2,192
"
EN -> 19 And as he was yet yet praying in the ark, a dove went and cried out, The lion, O",    7.                                                                                        ,Derpå biede han yderligere syv Dage og sendte så atter Duen ud fra Arken;,He stayed yet another seven days; and again he sent the dove out of the ship.,8,2,192
" Og han siger til sin discipel Laban: ""Se, hvor dine øjne er, du min elskede pige! Din moder! din far! dit"," And he set her to sleep, and she went to sleep, and he took her, and brought her to him into the ship. And he set her to sleep, and she went to sleep, and he took her, and brought her",Derpå biede han yderligere syv Dage og sendte så atter Duen ud fra Arken;,He stayed yet another seven days; and again he sent the dove out of the ship.,9,2,192
.<|endoftext|>,"  The two of them spent the night in the ship, and the following day the dove woke to find the ship full of her food. The two of them were together in the ship, and when the dove asked her where she",Derpå biede han yderligere syv Dage og sendte så atter Duen ud fra Arken;,He stayed yet another seven days; and again he sent the dove out of the ship.,10,2,192
.<|endoftext|>,"  ""I will not let her go, my lord,"" said the dove. ""I will not allow her to go. I am sure that she will not have a place of refuge, and will be killed in the night, and",Derpå biede han yderligere syv Dage og sendte så atter Duen ud fra Arken;,He stayed yet another seven days; and again he sent the dove out of the ship.,11,2,192
" Men da han havde talt et par ord til den, sagde han til mennesket i arken: ""Men denne mand er Guds Søn."" Derpå stillede",.<|endoftext|>,Derpå biede han yderligere syv Dage og sendte så atter Duen ud fra Arken;,He stayed yet another seven days; and again he sent the dove out of the ship.,12,2,192
" Mens arken hvilede i vandet, kaldte det gudstjeneste. Hver gang han vendte sig om for at se om vandet var roligt, løftede han"," But the dove was a little too strong for him to hold, and she went back to the ship.  The king went to the king, and said: ""If you please, I will take you to the king, and tell",Derpå biede han yderligere syv Dage og sendte så atter Duen ud fra Arken;,He stayed yet another seven days; and again he sent the dove out of the ship.,13,2,192
" Og fuglen blev oprevet og faldt til jorden; det gav han de tolv.
Dens flyvebesætning var ti mand. Den fløj væk"," she was not afraid to touch his feet.  12. And the dove went away again, and returned to the king; and the king asked the dove, and said, ""Go, and bring the king back with you",Derpå biede han yderligere syv Dage og sendte så atter Duen ud fra Arken;,He stayed yet another seven days; and again he sent the dove out of the ship.,14,2,192
"
English: And the eagle didn't find anything to eat, so it left earth and went back to him in the ark.

",  24.  1.  2.  3.  4.  5.  6.  7.  8.  9.  10.  11.  12.  13.  ,Derpå biede han yderligere syv Dage og sendte så atter Duen ud fra Arken;,He stayed yet another seven days; and again he sent the dove out of the ship.,15,2,192
" 115 Da kom der atter en vind fra øst, men da lod de den ikke komme ind; og de så deres egen mund og syn",    2. 1.                                                                                  ,Derpå biede han yderligere syv Dage og sendte så atter Duen ud fra Arken;,He stayed yet another seven days; and again he sent the dove out of the ship.,16,2,192
" Men jorden rystede i hele hans krop og så efter, og da så den, at luften var fri; men den vidste ikke, hvad den skulle","  46:60–61.  In the next chapter, we encounter the story of the story of the Dove and the Wife.  46:61–62.  46:62",Derpå biede han yderligere syv Dage og sendte så atter Duen ud fra Arken;,He stayed yet another seven days; and again he sent the dove out of the ship.,17,2,192
"
12 Men Gud sagde til ånden: «Se, der sitter en mand ved siden av døren og ser på meg, og så kom også","  14-15.  The tale begins with the king, who is in a great hurry, and is in a dream. He is in the middle of a war, and has come to the king's door. The",Derpå biede han yderligere syv Dage og sendte så atter Duen ud fra Arken;,He stayed yet another seven days; and again he sent the dove out of the ship.,18,2,192
.<|endoftext|>,"  'What shall I say to you, my daughter?' said the dove.  'I will tell you,' said the child, 'that the waters are deep, and the earth is very soft; and I will give you",Derpå biede han yderligere syv Dage og sendte så atter Duen ud fra Arken;,He stayed yet another seven days; and again he sent the dove out of the ship.,19,2,192
" Og der stod duen i arken og fik vandet ud.
Nu kommer dette sted ikke mere på lærredet, som det også gjorde dengang,","  6 And he was exceeding glad, and having done this, he went out into the ship, and began to tell her all about all that had happened, and how she was in the company of the dove, and how she",Derpå biede han yderligere syv Dage og sendte så atter Duen ud fra Arken;,He stayed yet another seven days; and again he sent the dove out of the ship.,20,2,192
" Således endte Guds ord i arken sammen med den profetiske lov, Bibelen, således var det i arken i arken, således var det i",.<|endoftext|>,Derpå biede han yderligere syv Dage og sendte så atter Duen ud fra Arken;,He stayed yet another seven days; and again he sent the dove out of the ship.,21,2,192
" ->
Then the dove did not find a place for its foot to go, and returned to him in the Ark, because there remained water all","  And the ship was full of birds, and of fishes, and of all kinds of creatures, and of all sorts of animals, and of all sorts of plants, and of all sorts of things; and the dove lay on",Derpå biede han yderligere syv Dage og sendte så atter Duen ud fra Arken;,He stayed yet another seven days; and again he sent the dove out of the ship.,22,2,192
" Og da sagde han til hende: ""Hvad er du? Forlad mig, hvorfor har du en anden her?"" ""Det er mig,"" svarede hun","  When the sun was high in the sky, he had brought her to him and said:  ""I am a priest, and a man who knows the things of God, and of the Lord Jesus Christ.  ""I have a",Derpå biede han yderligere syv Dage og sendte så atter Duen ud fra Arken;,He stayed yet another seven days; and again he sent the dove out of the ship.,23,2,192
.<|endoftext|>,"  14. The dove took the basket of the golden chalice, and put it in the ship, and went away.  15. When she was near to the shore, the dove went to the sea,",Derpå biede han yderligere syv Dage og sendte så atter Duen ud fra Arken;,He stayed yet another seven days; and again he sent the dove out of the ship.,0,5,192
"
37 Men da der igen var kommet en lille flue til himlene, fik den øje på handuen og tænkte: ""Det er","  And the dove, when she was come to him, said unto him, ""This man is the man whom the sun shines upon; therefore, let him be with you, and let him go with you to the sea;",Derpå biede han yderligere syv Dage og sendte så atter Duen ud fra Arken;,He stayed yet another seven days; and again he sent the dove out of the ship.,1,5,192
.<|endoftext|>," she was asleep; and he lay down upon the boat, and slept.  But the dove found no place to rest her foot, and she returned to him into the ship; for the waters were on the surface of the whole earth",Derpå biede han yderligere syv Dage og sendte så atter Duen ud fra Arken;,He stayed yet another seven days; and again he sent the dove out of the ship.,2,5,192
" Og han var så nær ved at gå ud i åndernes verden, men hans hjerte var varmt og hans ånd var så stærk, så stærk,"," The dove was very happy with her, and said that she was the most beautiful of all the creatures that had ever dwelt on the earth. The dove said, ""This is what I have known, and what I have believed",Derpå biede han yderligere syv Dage og sendte så atter Duen ud fra Arken;,He stayed yet another seven days; and again he sent the dove out of the ship.,3,5,192
" Men da han havde taget fat på dens næb, så han, at det var et grønt, stort, tyndt bælte, og da han","  14. Now she went to him, and said, ""This is what I am going to do to you.""  15. He said, ""Let us go to the king.""  16. ""Why?"" said",Derpå biede han yderligere syv Dage og sendte så atter Duen ud fra Arken;,He stayed yet another seven days; and again he sent the dove out of the ship.,4,5,192
" Men den, som vendte sig væk fra hende, blev vred på hende, så hun faldt pladask, fordi han ikke var vred; og den","  17:32 And the dove went in unto the ship, and she came to him, and said, I am the king of the kings, and I have been made king over the nations, and over all the earth",Derpå biede han yderligere syv Dage og sendte så atter Duen ud fra Arken;,He stayed yet another seven days; and again he sent the dove out of the ship.,5,5,192
