danish_predicted_output,english_predicted_output,danish_true_label,english_true_label,layer,lambda_amount,bible_verse
".
Den gamle mor og svoger stod ved døren. De havde allerede set sig om. Der var ingen, der måtte gå ind, fordi her","  ""They say that it is a curse,"" said the priest.  ""It is,"" said the man, ""for it is a curse for a man to be born to a wife who is not the wife of a man, but a wife who is not the wife of a man.""  ""I am a man,"" said the man, ""and I have been born to a wife who is","da dannede Gud HERREN Mennesket af Agerjordens Muld og blæste Livsånde i hans Næsebor, så at Mennesket blev et levende Væsen.","Yahweh God formed man from the dust of the ground, and breathed into his nostrils the breath of life; and man became a living soul.",0,2,36
". Mængden af regnvand steg i en sådan hastighed, at landområder i begge retninger blev oversvømmet, og tilsidst stod de to fl",    5. Norsk: Det er en av de mest kjente og berømte golfbanene i USA.  Engelsk: It is one of the most famous and famous golf courses in the USA.    6. Norsk: Det finnes ingen annen måte å vinne penger på i dette spillet.  Engelsk: There is no other way to win money in this game.    7. Norsk: Men de,"da dannede Gud HERREN Mennesket af Agerjordens Muld og blæste Livsånde i hans Næsebor, så at Mennesket blev et levende Væsen.","Yahweh God formed man from the dust of the ground, and breathed into his nostrils the breath of life; and man became a living soul.",1,2,36
 og gav den et grønt skjær. I en bue slyngede vandet sig mellem de afgrødevisne blade og slog ind over en mark," The earth trembled and shook, and the mist covered the whole surface of the earth. Then the earth was very hot, and the mist was very thick. The earth was not yet cold. The earth was not yet very wet. The earth was not yet very dry. Then the earth was very hot and the mist was very thick. The earth was not yet very wet. The earth was not yet","da dannede Gud HERREN Mennesket af Agerjordens Muld og blæste Livsånde i hans Næsebor, så at Mennesket blev et levende Væsen.","Yahweh God formed man from the dust of the ground, and breathed into his nostrils the breath of life; and man became a living soul.",2,2,36
", og da den skinnende sol brændte i den, gjorde han det om til et stort bål. Han gjorde den ild til en glødende",  10. Svenska: Det finns en hel del att göra i närheten av hotellet.  Engelska: There is a lot to do in the neighborhood.  11. Svenska: Hon har också varit chef för MSB:s nationella avdelning för säkerhet.  Engelska: She also served as Head of MSB's National Security Division.  12. Svenska: Och i ett läge där det,"da dannede Gud HERREN Mennesket af Agerjordens Muld og blæste Livsånde i hans Næsebor, så at Mennesket blev et levende Væsen.","Yahweh God formed man from the dust of the ground, and breathed into his nostrils the breath of life; and man became a living soul.",3,2,36
".
Lad dit hjerte og din ånde ånde i denne jordens tåge! 5. Vend dit ansigt mod himlen og tænk, at","  dansk: Det er sandt, at vi ikke er de eneste, der har oplevet det, men der er et skælv fra jorden, og vandet dækker hele jorden.    engelsk: ""The people of the world are not here today.  dansk: ""Verdens befolkning er ikke her i dag.    engelsk: The first thing we need to do is to make sure that our customers","da dannede Gud HERREN Mennesket af Agerjordens Muld og blæste Livsånde i hans Næsebor, så at Mennesket blev et levende Væsen.","Yahweh God formed man from the dust of the ground, and breathed into his nostrils the breath of life; and man became a living soul.",4,2,36
" frem (se Jordbundens farve af H. W., 1905, s. 74).
Mellem den høje,",".  25:21 Men en tåke kom op fra jorden, og det kom vann over hele jorden.<|endoftext|>","da dannede Gud HERREN Mennesket af Agerjordens Muld og blæste Livsånde i hans Næsebor, så at Mennesket blev et levende Væsen.","Yahweh God formed man from the dust of the ground, and breathed into his nostrils the breath of life; and man became a living soul.",5,2,36
 og den blev kold i vejret. Solen skinnede; en sol brændte som ild ved al den varme varme solskin. 10 Og de,"    7. Swedish: Om du inte har en dator, kan du använda en mobil enhet för att komma åt iTunes.  English: If you don't have a computer, you can use a mobile device to access iTunes.    8. Swedish: Om du har en eller flera av dessa symtom, bör du kontakta en läkare för att ta reda på vad du har drabbats av.  English","da dannede Gud HERREN Mennesket af Agerjordens Muld og blæste Livsånde i hans Næsebor, så at Mennesket blev et levende Væsen.","Yahweh God formed man from the dust of the ground, and breathed into his nostrils the breath of life; and man became a living soul.",6,2,36
". For at komme ind i himlen opholdt han sig et øieblik; så kom han i sit syn og for så tilbage til Jorden, for"," The earth was covered with mud and slime and slime and mud and slime, and the water was so thick that it had to be sprinkled with water to keep it from seeping out. The water was so thick that the earth was so thick that the water was so thick that the earth was so thick that it was impossible to stand on it. It was so thick that it was","da dannede Gud HERREN Mennesket af Agerjordens Muld og blæste Livsånde i hans Næsebor, så at Mennesket blev et levende Væsen.","Yahweh God formed man from the dust of the ground, and breathed into his nostrils the breath of life; and man became a living soul.",7,2,36
" med sin bløde røg.
Hvornår hørte du første gang om en tåge?
Da jeg var ung.
-Ifølge den gamle visdom","    Sherry: Hi, I'm your automated assistant. I can answer your questions about 1996 United States presidential election in California.  Faye: What happened in the California primary in 1996?  Sherry: 1996 United States presidential election in California California is the name of an electoral district in the U.S. state","da dannede Gud HERREN Mennesket af Agerjordens Muld og blæste Livsånde i hans Næsebor, så at Mennesket blev et levende Væsen.","Yahweh God formed man from the dust of the ground, and breathed into his nostrils the breath of life; and man became a living soul.",8,2,36
", og en stor skare strømmede ned efter den og fyldte jorden med et tykt tykt lag. I den første af disse store floder faldt"," The sky opened in all its glory, and the air was filled with the sound of many birds. It was the greatest joy of the earth, and the earth was filled with wonder.  ""The birds sang, and they flew all round the earth, and it was not a word that they uttered. The birds flew all round the earth, and they sang all round the earth. The earth was","da dannede Gud HERREN Mennesket af Agerjordens Muld og blæste Livsånde i hans Næsebor, så at Mennesket blev et levende Væsen.","Yahweh God formed man from the dust of the ground, and breathed into his nostrils the breath of life; and man became a living soul.",9,2,36
". Den næste dags nat blev der atter mørkt, og den næste dag var jorden atter tør, og da blev også den gamle kvinde rask igen. Hun"," The earth was full of white water, and the mist was so thick that the water could not be seen. The man went to the door and looked in, and there was a light in the candle, and the woman was standing there. She looked at him, and said, ""Come out, come out, come out, my lord."" The man answered her, ""I am not in my house","da dannede Gud HERREN Mennesket af Agerjordens Muld og blæste Livsånde i hans Næsebor, så at Mennesket blev et levende Væsen.","Yahweh God formed man from the dust of the ground, and breathed into his nostrils the breath of life; and man became a living soul.",10,2,36
", og vandet trængte frem i en fart og bredte jorden derpå, medens vandfladen drev videre væk, og den tunge jord var ved","    The water was so hot that it was as if the fire had been burning in the ground.    The people ran out of the house, and ran to the well, where they found it filled with water.    They looked at it, and saw that it was hot, and that the fire had been burning in the ground.    They ran back to the house, and found","da dannede Gud HERREN Mennesket af Agerjordens Muld og blæste Livsånde i hans Næsebor, så at Mennesket blev et levende Væsen.","Yahweh God formed man from the dust of the ground, and breathed into his nostrils the breath of life; and man became a living soul.",11,2,36
". Og medens de stod og så på, sagde Kvinden til Gud: Hvis der kommer en stor drage, som vælter en stor sten, ved","  ""They are all dead,"" cried the woman.  ""Not all,"" said the man. ""There is one man who is still alive.""  ""He is the last one,"" cried the woman. ""I am the last man. I am the last man.""  ""There is only one man,"" cried the man. ""I am the last man.""  ""There is only one man","da dannede Gud HERREN Mennesket af Agerjordens Muld og blæste Livsånde i hans Næsebor, så at Mennesket blev et levende Væsen.","Yahweh God formed man from the dust of the ground, and breathed into his nostrils the breath of life; and man became a living soul.",12,2,36
"e, indtil der ikke mere var nogen jord tilbage.
Dansk<|endoftext|>"," And the people of the earth were filled with joy and were very much glad; for they had seen the earth being filled with water, and they were glad that the earth was filled with water. And they went into the tent of meeting, and they went to the Lord, and he opened the tent for them. And they went in, and they were all very happy. And the Lord said to them","da dannede Gud HERREN Mennesket af Agerjordens Muld og blæste Livsånde i hans Næsebor, så at Mennesket blev et levende Væsen.","Yahweh God formed man from the dust of the ground, and breathed into his nostrils the breath of life; and man became a living soul.",13,2,36
", og der gik en bølge op gennem luften, saa jeg blev rød og varm og maatte synke. Saa satte jeg mig atter igen og sov ind"," The water became a fiery cloud, and the mist rose in all directions, and covered all the earth with its white smoke, and the mist made all the world a burning inferno. The earth became a fiery mass, and the mist rose from the earth and covered it all with its white smoke. The earth became a fiery mass, and the mist rose from the earth and covered it all","da dannede Gud HERREN Mennesket af Agerjordens Muld og blæste Livsånde i hans Næsebor, så at Mennesket blev et levende Væsen.","Yahweh God formed man from the dust of the ground, and breathed into his nostrils the breath of life; and man became a living soul.",14,2,36
". Så dugtigt gik det for sig. Der var et forunderligt smil, og hans øjne lyste af glæde. Men det var ikke sådan","    3. Dansk: ""Det er sådan, jeg arbejder.""  Engelsk: ""This is how I work.""    4. Dansk: Det er ikke et nyt fænomen.  Engelsk: This is not a new phenomenon.    5. Dansk: Så, hvad er det, der gør, at folk er villige til at betale så meget for en bolig?  Engelsk: What is it","da dannede Gud HERREN Mennesket af Agerjordens Muld og blæste Livsånde i hans Næsebor, så at Mennesket blev et levende Væsen.","Yahweh God formed man from the dust of the ground, and breathed into his nostrils the breath of life; and man became a living soul.",15,2,36
". Den blev liggende, indtil noget skyede og den tilligemed den anden tåge, snart kom hen over stedet og snart forsvandt. Efterat","  The sun was not yet high in the sky. The earth was covered with clouds, and the air was filled with a white mist. The air was filled with a white mist, and the earth was full of mist.  The clouds were heavy and heavy, and the mist was heavy, and the air was full of mist.  The earth was full of mist, and the sky was full of","da dannede Gud HERREN Mennesket af Agerjordens Muld og blæste Livsånde i hans Næsebor, så at Mennesket blev et levende Væsen.","Yahweh God formed man from the dust of the ground, and breathed into his nostrils the breath of life; and man became a living soul.",16,2,36
", hvor den gik imod jorden eller mod himlen, med en stærk mærkesnor, og af hvilken de, som gik forover mod, sagde:",".  Men det blev ikke til noget, for der kom en tåge op fra jorden, og vandede hele jordens overflade.<|endoftext|>","da dannede Gud HERREN Mennesket af Agerjordens Muld og blæste Livsånde i hans Næsebor, så at Mennesket blev et levende Væsen.","Yahweh God formed man from the dust of the ground, and breathed into his nostrils the breath of life; and man became a living soul.",17,2,36
"; alle insekternes hale fløj hen imod fladen. De blev forskrækket. Og da de saa den store tåge, som rejste sig,"," And the earth became moist. And the wind blew out of the earth. And the water rose from the ground. And the earth was filled with the rain.  10 Og da de kom ned til havet, blev der en tåge, og vandet blev der fra jorden. Og jorden blev fugtig. Og vinden blæste ud af jorden. Og vandet steg fra jorden. Og jorden blev fyldt med reg","da dannede Gud HERREN Mennesket af Agerjordens Muld og blæste Livsånde i hans Næsebor, så at Mennesket blev et levende Væsen.","Yahweh God formed man from the dust of the ground, and breathed into his nostrils the breath of life; and man became a living soul.",18,2,36
", men alt døde.
Nu siger du; ""Det er ikke i Guds Haand, denne Verden kan blive til."" Ja, dog, du er",.<|endoftext|>,"da dannede Gud HERREN Mennesket af Agerjordens Muld og blæste Livsånde i hans Næsebor, så at Mennesket blev et levende Væsen.","Yahweh God formed man from the dust of the ground, and breathed into his nostrils the breath of life; and man became a living soul.",19,2,36
" i forunderlig udstrækning. Jord, som for en enkelt afgrøde havde ligget blottet, sank ned med tunge og tunge sværdslag", The earth was filled with water. The people began to sing.  The earth began to be filled with water.  The people began to sing.  The earth began to be filled with water.  The people began to sing.  The earth began to be filled with water.  The people began to sing.  The earth began to be filled with water.  The people began to sing.,"da dannede Gud HERREN Mennesket af Agerjordens Muld og blæste Livsånde i hans Næsebor, så at Mennesket blev et levende Væsen.","Yahweh God formed man from the dust of the ground, and breathed into his nostrils the breath of life; and man became a living soul.",20,2,36
". Ved dette skede en hel forandring, der gjorde menneskene, som var i tvivl om at give sig hen til guden, til at være trofaste",".  21:20 Og så kom der en ild fra himlen, og den svandt til en røgsky, og jorden blev som en snehvide, og det kom en stor mængde regn.<|endoftext|>","da dannede Gud HERREN Mennesket af Agerjordens Muld og blæste Livsånde i hans Næsebor, så at Mennesket blev et levende Væsen.","Yahweh God formed man from the dust of the ground, and breathed into his nostrils the breath of life; and man became a living soul.",21,2,36
". Men da det hele var for langt fra jorden, kom en mand og sagde til hende, at den tid skulde være nok; »nu må jeg"," It was so high that the sun never came down, and the mist was so thick that the earth was covered with the most beautiful white sand. The water was so strong that it was like running water. The mist was so thick that the earth was covered with the most beautiful white sand. The mist was so thick that the earth was covered with the most beautiful white sand. It was so thick that the","da dannede Gud HERREN Mennesket af Agerjordens Muld og blæste Livsånde i hans Næsebor, så at Mennesket blev et levende Væsen.","Yahweh God formed man from the dust of the ground, and breathed into his nostrils the breath of life; and man became a living soul.",22,2,36
". Og alle disse folk kom til mig før solen gik ned. 'Det var ikke godt, men alt var stille. Men da kom Guds engel","  ""What is this?"" asked the other.  ""It is the first time in a long time that I have seen the earth being filled with water,"" said the man. ""I thought it was the first time in a long time that I had seen it filled with water.""  ""But you did not see the earth being filled with water?"" asked the other.  ""I thought that I","da dannede Gud HERREN Mennesket af Agerjordens Muld og blæste Livsånde i hans Næsebor, så at Mennesket blev et levende Væsen.","Yahweh God formed man from the dust of the ground, and breathed into his nostrils the breath of life; and man became a living soul.",23,2,36
"e.
Engelsk: This was to be the last winter, but the air was cooled and the rain was falling.<|endoftext|>","  16. Men jeg vil ikke være en af dem. ->  I am not going to be one of them.  17. Hvad er forskellen mellem en L-type og en M-type? ->  What's the difference between a L-type and a M-type?  18. Det er muligt at komme med en klage over en fejl i den service, du","da dannede Gud HERREN Mennesket af Agerjordens Muld og blæste Livsånde i hans Næsebor, så at Mennesket blev et levende Væsen.","Yahweh God formed man from the dust of the ground, and breathed into his nostrils the breath of life; and man became a living soul.",0,5,36
" med vand og gav næring, der dog ikke slog alle grene. Dengang var jorden rig paa blomster. De var såa meget smukke, saa"," Then the angel said, ""Behold, the angels have come to earth, and are doing this work. They have come to earth to do this work. There are seven angels, but they have not come to earth. There are seven angels, but they have not come to earth. There are seven angels, but they have not come to earth."" And the angel said, ""The seven angels have","da dannede Gud HERREN Mennesket af Agerjordens Muld og blæste Livsånde i hans Næsebor, så at Mennesket blev et levende Væsen.","Yahweh God formed man from the dust of the ground, and breathed into his nostrils the breath of life; and man became a living soul.",1,5,36
". Himmerlandet blev blæst op og landet blev oversvømmet af sne.

Da Gud gik ud af sin store have og lagde sit ansigt","  svenska: 10 Då gick en dimma upp från jorden och vattnade hela markens yta.    engelska: The following day, the next day, the next day and so on.  svenska: Följande dag, nästa dag, nästa dag och så vidare.    engelska: ""The one and only time we can be sure of God is when we are alone with Him.""  ","da dannede Gud HERREN Mennesket af Agerjordens Muld og blæste Livsånde i hans Næsebor, så at Mennesket blev et levende Væsen.","Yahweh God formed man from the dust of the ground, and breathed into his nostrils the breath of life; and man became a living soul.",2,5,36
". Hænderne løftede sig til hans hår og løftede ham op til sit ansigt, løftede ham op i vejret, mens vinden ruskede","  4. Men det er ikke altid sådan, at en mand, der er meget dygtig, er den eneste, der kan leve af sine hænder. ->  However, it is not always so that a man who is very well-educated is the only one who can live by his hands.  5. Jeg vil gerne sige, at jeg vil sige, at jeg vil sige, at jeg vil","da dannede Gud HERREN Mennesket af Agerjordens Muld og blæste Livsånde i hans Næsebor, så at Mennesket blev et levende Væsen.","Yahweh God formed man from the dust of the ground, and breathed into his nostrils the breath of life; and man became a living soul.",3,5,36
".
The Earth is full of water, and all earth is full of water, and the earth is full of water, and the waters make their",".  The people went to the well and began to drink water. But a mist was going up from the ground, and watered the whole surface of the ground.<|endoftext|>","da dannede Gud HERREN Mennesket af Agerjordens Muld og blæste Livsånde i hans Næsebor, så at Mennesket blev et levende Væsen.","Yahweh God formed man from the dust of the ground, and breathed into his nostrils the breath of life; and man became a living soul.",4,5,36
". Det er umuligt, sagde Gud Herren, uden at det også ville blive nødvendigt for ham at gå til sin herligheds hønsegård;","  3. ""The first thing we do is to take a bath. ->  ""Det første vi gjør er å ta et bad.  4. The first thing to do when you get to your apartment is to clean up the mess and do what you can to make it look like it was cleaned. ->  Det første du må gjøre når du kommer til leiligheten din er å rydde opp i ro","da dannede Gud HERREN Mennesket af Agerjordens Muld og blæste Livsånde i hans Næsebor, så at Mennesket blev et levende Væsen.","Yahweh God formed man from the dust of the ground, and breathed into his nostrils the breath of life; and man became a living soul.",5,5,36
", med et hav af svirpende blade, og et jordskjælv gjorde den store strand til et åbent hav af røgklumper,"," And the same mist was seen in the whole land, and everywhere the water was all over the land. And the people of the land were afraid, and said, What is this, and why does this happen?    9.1.15 And the people of the land, and the people of the earth, and the people of the sea, and the men of the land, and all","da dannede Gud HERREN Mennesket af Agerjordens Muld og blæste Livsånde i hans Næsebor, så at Mennesket blev et levende Væsen.","Yahweh God formed man from the dust of the ground, and breathed into his nostrils the breath of life; and man became a living soul.",6,5,36
" med sit brusende vande. Væltet jord og opblødt vand gav næring til mange insekter.

Efter nogle dage begyndte vandet at",".  43:11 Og da den store ild var gået op fra jorden, steg der en tåge op fra jorden, og vandet bredte sig over hele jorden.<|endoftext|>","da dannede Gud HERREN Mennesket af Agerjordens Muld og blæste Livsånde i hans Næsebor, så at Mennesket blev et levende Væsen.","Yahweh God formed man from the dust of the ground, and breathed into his nostrils the breath of life; and man became a living soul.",7,5,36
" ud mod havet.
Et lille træ stod på et sted midt i skyggen. En del af det sad og solede sig.
Livet"," 10 Then the Lord said to Moses, ""If you go to the land of Egypt, and come into the land of Israel, and you see the Lord coming in, and he looks at you, 11 and he is like a man who has been brought back from the dead, and he has not any of the bones of his body, but he is like the man who was brought","da dannede Gud HERREN Mennesket af Agerjordens Muld og blæste Livsånde i hans Næsebor, så at Mennesket blev et levende Væsen.","Yahweh God formed man from the dust of the ground, and breathed into his nostrils the breath of life; and man became a living soul.",8,5,36
", idet dens rande så langt ind som til 2 727 fod. Ved sydøstkanten af et lavt, sneet, jæ"," The sky was blue and the earth was gray. The wind was blowing in the opposite direction.  ""You're not in the right place, but the wind is blowing in the right direction. It's going to be a long time before the wind is blowing.""  ""How long do you think it will take to get to the place you want to be?""  ""I don't","da dannede Gud HERREN Mennesket af Agerjordens Muld og blæste Livsånde i hans Næsebor, så at Mennesket blev et levende Væsen.","Yahweh God formed man from the dust of the ground, and breathed into his nostrils the breath of life; and man became a living soul.",9,5,36
" med duft af røg - men intet rørte sig

så begyndte regnen at komme

tågen kom tættere og tættere på, og reg"," And the water covered the land, and covered the whole earth. And the earth rose, and the earth became a great land, and the earth was like the sky, and the sky became a great land, and the sky became a great land, and the earth was like the sky, and the sky became a great land, and the earth became a great land, and the earth became a great land","da dannede Gud HERREN Mennesket af Agerjordens Muld og blæste Livsånde i hans Næsebor, så at Mennesket blev et levende Væsen.","Yahweh God formed man from the dust of the ground, and breathed into his nostrils the breath of life; and man became a living soul.",10,5,36
", der var dækket af græs, som man sagde. En stærk vind hvælvede sig op og lagde sig rundt i hele den flade jord,",". 21:14 And the earth was filled with the earth, and the water of the water came upon the earth, and the earth was full of water.  22:10 Og jorden blev fyldt med jorden, og vandet fra vandet kom på jorden, og jorden var fuld af vand.<|endoftext|>","da dannede Gud HERREN Mennesket af Agerjordens Muld og blæste Livsånde i hans Næsebor, så at Mennesket blev et levende Væsen.","Yahweh God formed man from the dust of the ground, and breathed into his nostrils the breath of life; and man became a living soul.",11,5,36
".

Toget blev så stort, at det kom over højdedragene og lagde sig ovenpå store jorddannelser, og dets kraftige","  But it was a day of great beauty, and a very beautiful day. And the people were very glad, for it was the first time in the history of the world that they had seen a beautiful day. And they loved it.  And the king of the people, he had sent messengers to the king of the earth, and they came to him, and he said, 'You see","da dannede Gud HERREN Mennesket af Agerjordens Muld og blæste Livsånde i hans Næsebor, så at Mennesket blev et levende Væsen.","Yahweh God formed man from the dust of the ground, and breathed into his nostrils the breath of life; and man became a living soul.",12,5,36
" op fra jorden. -> En tunga drog upp och vräkte sig upp över jorden, men i den sörjde vattnet bort och allt som var","  ""There are many things that are bad, but I have the most terrible of things to say about this,"" he said, and turned away from the mirror.  ""It is not a good thing to say bad things,"" said Mrs. Burns. ""It is a great waste of time.""  ""The matter is not so bad,"" said Mr. Burns. ""It is just a","da dannede Gud HERREN Mennesket af Agerjordens Muld og blæste Livsånde i hans Næsebor, så at Mennesket blev et levende Væsen.","Yahweh God formed man from the dust of the ground, and breathed into his nostrils the breath of life; and man became a living soul.",13,5,36
