danish_predicted_output,english_predicted_output,danish_true_label,english_true_label,layer,lambda_amount,bible_verse
"s'te sønner, og deres forældre fik at se dem igjen i det liv han døde i; men da de kom i rette tid, vendte de","se/epl_sv.html    14. engelsk: ""Ég hef verið að gera það síðan í fyrsta skipti.  islandsk: ""Ég hef verið að gera það síðan í fyrsta skipti.      15. islandsk: Ég var ekki á staðnum, en ég sá það í kringum mig.  islandsk: Ég var ekki á staðnum, en ég sá það í kringum mig.  ","og efter at Peleg havde avlet Re'u, levede han 209 År og avlede Sønner og Døtre.","Peleg lived two hundred nine years after he became the father of Reu, and became the father of sons and daughters.",1,10,284
"i'a;l nte af dem';e 19,000 6. l"" 19. 6"," It was a wonderful time, and I hope I will live forever. In the last four years, he has been a great influence on me. I'm a big fan, and I hope to be a big influence on you. You are my big influences, and I am yours.      I am so proud to be a big influence on you, and I hope to be a big influence on you. I am","og efter at Peleg havde avlet Re'u, levede han 209 År og avlede Sønner og Døtre.","Peleg lived two hundred nine years after he became the father of Reu, and became the father of sons and daughters.",2,10,284
"1 og afkom;n;en den 23. januar 1969. Peleg er en smuk og livlig hund, som"," 16. Oct. 1784. He was also the son of J. P. E. H. W. C. H. 35 years, and became the father of J. P. E. H. W. C. H. 43 years.    Theirich, J. P. E. H. W. C. H., in 177","og efter at Peleg havde avlet Re'u, levede han 209 År og avlede Sønner og Døtre.","Peleg lived two hundred nine years after he became the father of Reu, and became the father of sons and daughters.",3,10,284
"e paa fprde:n;;'' 20-40-42,43. I sin sidste aarsalder",                                                                                                                                                                            ,"og efter at Peleg havde avlet Re'u, levede han 209 År og avlede Sønner og Døtre.","Peleg lived two hundred nine years after he became the father of Reu, and became the father of sons and daughters.",4,10,284
" den døde pige havde været i hans seng med ham, og han lagde sig tæt om hende, saa hun skulde sovne; men naar han saa hende"," The old man was a good man, and he had never had a bad time. He had been a good man for a long time, and he would go on living, and he was going to go on living, and there would be a lot of good men in the world. He had a good name, and he would be a good man, and he would be a good man.  When he was twenty-one","og efter at Peleg havde avlet Re'u, levede han 209 År og avlede Sønner og Døtre.","Peleg lived two hundred nine years after he became the father of Reu, and became the father of sons and daughters.",5,10,284
"e og peleg, pege og pe'kke og pa'kke.
De'pe og de'pe va en de'pe de", The son of the first born of the second born of the third born of the fourth born of the fifth born of the sixth born of the seventh born of the eighth born of the ninth born of the ten born of the eleven born of the twelve born of the thirteen born of the fourteen born of the five born of the six born of the seven born of the eight born of the nine born of the ten born of the el,"og efter at Peleg havde avlet Re'u, levede han 209 År og avlede Sønner og Døtre.","Peleg lived two hundred nine years after he became the father of Reu, and became the father of sons and daughters.",6,10,284
"en; men det gik ikke længer. Han døde da hans søn Asmund giftet sig med Jette Olsdatter, datter til Ole Hansen B",    12. engelska: Og det er ikke bare fordi det er et nyt spil.  danska: Det er ikke kun fordi det er et nyt spil.    13. danska: 3.1.1.1.1.1.2.2.2.2.2.1.1.1.1.1.1.1.1.1.1.1.,"og efter at Peleg havde avlet Re'u, levede han 209 År og avlede Sønner og Døtre.","Peleg lived two hundred nine years after he became the father of Reu, and became the father of sons and daughters.",7,10,284
" i 10 af disse var han i live. Jeg har da ikke kunnet sige Dem, naar det vilde hændt, at denne skulde have været","    dansk: Det kan være, at vi har en dårlig relation.  engelsk: We may have a bad relationship.    dansk: En anden grund til at bruge denne metode er at være mere produktiv.  engelsk: Another reason to use this method is to be more productive.    dansk: Dette er en af de vigtigste grunde til, at vi valgte at tage til Kina.  engelsk: This is one of","og efter at Peleg havde avlet Re'u, levede han 209 År og avlede Sønner og Døtre.","Peleg lived two hundred nine years after he became the father of Reu, and became the father of sons and daughters.",8,10,284
" det er nok, peleg kom i stand, da han vilde avlede snadder, det var da ikke saa lang tid siden.
T",                                                                                                                                                                            ,"og efter at Peleg havde avlet Re'u, levede han 209 År og avlede Sønner og Døtre.","Peleg lived two hundred nine years after he became the father of Reu, and became the father of sons and daughters.",9,10,284
" men til min store sorg blev han dræbt ved sin egen haand, og alle de, som hadde hjulpet ham, var i sorg over, at det",    1981 - 1991: Den store brand.    1991 - 2001: Den lille brand.    2001 - 2011: Den lille brand.    2011 - 2017: Den store brand.    2017 - 2021: Den lille brand.  ,"og efter at Peleg havde avlet Re'u, levede han 209 År og avlede Sønner og Døtre.","Peleg lived two hundred nine years after he became the father of Reu, and became the father of sons and daughters.",10,10,284
".r.en, og den første, som var kommet, havde han ikke andet at gjøre end at lægge sin arm om hans hals i en af",    11. dansk: Vi har alle været der.  engelsk: We have all been there.    12. dansk: Så du er sikker på at blive færdig med at lave mad?  engelsk: Are you sure you want to finish cooking?    13. dansk: Men jeg havde ikke lyst til at lade hende bestemme.  engelsk: I did not want to let her dictate.  ,"og efter at Peleg havde avlet Re'u, levede han 209 År og avlede Sønner og Døtre.","Peleg lived two hundred nine years after he became the father of Reu, and became the father of sons and daughters.",11,10,284
" da han kom til at være gammel, og kunne ikke avle, fik han den med sig til sin datter, og hun fødte ham sønner og","  Around the same time, the father, who was a priest, died, and the mother, who was a woman, took a job as a teacher, and she had to give birth to a son. The son was born.  The father was born to a woman, and he was a priest, but he was not a priest. The mother was a woman, and she was a teacher, and she was a","og efter at Peleg havde avlet Re'u, levede han 209 År og avlede Sønner og Døtre.","Peleg lived two hundred nine years after he became the father of Reu, and became the father of sons and daughters.",12,10,284
" da vilde han være 100 år. Han døde en tid s;a;en;, han hadde, sa'a;;et",.<|endoftext|>,"og efter at Peleg havde avlet Re'u, levede han 209 År og avlede Sønner og Døtre.","Peleg lived two hundred nine years after he became the father of Reu, and became the father of sons and daughters.",13,10,284
"d. — Denne «re'd» eller «r'u-t«k» blev en af de ældste stedsnavn, der findes"," I havde en god oplevelse med ham.  Det er vigtigt at være opmærksom på, at de store byer også har store problemer med overgreb. Det er også vigtigt at understrege, at det ikke er nok at tage sig af de unge, når de er i alderen 13 til 16 år. I stedet skal man gøre noget ved de voksne, så de unge bliver opmærksomme på overgreb. 14-","og efter at Peleg havde avlet Re'u, levede han 209 År og avlede Sønner og Døtre.","Peleg lived two hundred nine years after he became the father of Reu, and became the father of sons and daughters.",14,10,284
; men de andre var ikke. uhelbredelige.<|endoftext|>,"    11. Det er 108 millioner mennesker, der skal arbejde i 2015. ->  There er 108 millioner mennesker, der skal arbejde i 2015.    12. For at gøre dette skal du bruge en god forståelse af dine kunder. ->  For at gøre dette skal du bruge en god forståelse af dine kunder.    13. Hvis","og efter at Peleg havde avlet Re'u, levede han 209 År og avlede Sønner og Døtre.","Peleg lived two hundred nine years after he became the father of Reu, and became the father of sons and daughters.",15,10,284
";.,.:~.,.::.-...-...::...: -...-: 0000,...:..-...-!:"," I har aldrig været i tvivl om, at det var en helt ufattelig stor præstation, og det er en af de største begivenheder i min karriere, siger han.    Går efter 2000-tallet    Selv om han er i gang med at få afsluttet karrieren, er han ikke bange for at sige, at han er en mand med ambitioner.    - Jeg er meget ambitiøs, og","og efter at Peleg havde avlet Re'u, levede han 209 År og avlede Sønner og Døtre.","Peleg lived two hundred nine years after he became the father of Reu, and became the father of sons and daughters.",16,10,284
" den var ikke afkom efter den gamle hede. Men da den var kommet ti' stævnet, saa var den ikke ren, før den havde",".  The tale om den ulykkelige Reu (Reu) blev fortalt af en mand, der boede i mere end 30 år, og blev fader til reu.<|endoftext|>","og efter at Peleg havde avlet Re'u, levede han 209 År og avlede Sønner og Døtre.","Peleg lived two hundred nine years after he became the father of Reu, and became the father of sons and daughters.",17,10,284
"n ikke over 14 år. Men om da ikke pedelens datter hadde været saa gammel, saa hun dog kunde have levet et par aar",  K. V. P.                                                                                                                                                              ,"og efter at Peleg havde avlet Re'u, levede han 209 År og avlede Sønner og Døtre.","Peleg lived two hundred nine years after he became the father of Reu, and became the father of sons and daughters.",18,10,284
", sligt er en stor skuffelse; det var en frygtelig ting som han var nødt til at leve. En pilegrim kom til ham",.    <|endoftext|>,"og efter at Peleg havde avlet Re'u, levede han 209 År og avlede Sønner og Døtre.","Peleg lived two hundred nine years after he became the father of Reu, and became the father of sons and daughters.",19,10,284
"mme. Da døde han og avlen gik i orden. Den eneste undtagelse, som blev meddelt var at der blev solgt lidt udbytte. At","  Dansk: Pogu skal have været 13, da han blev k, og blev 14, da han blev k.    10. Engelsk: For 1999, it s 1990.  Dansk: I 1999 er det 1990.    11. Engelsk: I have, and I can s  Dansk: Jeg","og efter at Peleg havde avlet Re'u, levede han 209 År og avlede Sønner og Døtre.","Peleg lived two hundred nine years after he became the father of Reu, and became the father of sons and daughters.",20,10,284
" men da den unge var blevet 30, var det overladt til en ny, og peleg gik over, om en ikke havde tænkt at",.<|endoftext|>,"og efter at Peleg havde avlet Re'u, levede han 209 År og avlede Sønner og Døtre.","Peleg lived two hundred nine years after he became the father of Reu, and became the father of sons and daughters.",21,10,284
" 13 Og da jokjom havde levet endnu faa ar, avlede han arbja, 14 og da Jokj","  1858: ""E. P. Pelig."" A 15-page autobiography.  1860: ""D. P. Pelig."" A 15-page autobiography.  1864: ""D. P. Pelig."" A 15-page autobiography.  1865: ""D. P. Pelig.""","og efter at Peleg havde avlet Re'u, levede han 209 År og avlede Sønner og Døtre.","Peleg lived two hundred nine years after he became the father of Reu, and became the father of sons and daughters.",22,10,284
"en frem og pelig'i, som han selv sagde, til et saalænge han levede, om det kom ham tilgode. og",.<|endoftext|>,"og efter at Peleg havde avlet Re'u, levede han 209 År og avlede Sønner og Døtre.","Peleg lived two hundred nine years after he became the father of Reu, and became the father of sons and daughters.",23,10,284
o;l<ir. l(a;ii;r1;iL;1.;1.r.;1; l\r\,  10. jun 2017. 09:13. 2017. 10. jun 2017. 09:13. 2017. 10. jun 2017. 09:13. 2017. 10. jun 2017. 09,"og efter at Peleg havde avlet Re'u, levede han 209 År og avlede Sønner og Døtre.","Peleg lived two hundred nine years after he became the father of Reu, and became the father of sons and daughters.",0,15,284
",:;! han kuskede de 30 aar, han var afsat,. --»;;--. ;:;;","  english: Hann var aðaleigandi í ""The Legend of Zelda"".  icelandic: ""The Legend of Zelda""  english: The Legend of Zelda: The Legend of Zelda: The Legend of Zelda: The Legend of Zelda: The Legend of Zelda: The Legend of Zelda: The Legend of Zelda: The Legend of Zelda: The Legend of Zelda: The Legend of Zelda: The Legend of Zelda: The Legend","og efter at Peleg havde avlet Re'u, levede han 209 År og avlede Sønner og Døtre.","Peleg lived two hundred nine years after he became the father of Reu, and became the father of sons and daughters.",1,15,284
"o. o: han var ved al dens vigtighed, saa vi ikke kunde slippe ham. Han kunde kun slaa 4 gange, som han",.  A man who became the father of reu was a man who became the father of reu.<|endoftext|>,"og efter at Peleg havde avlet Re'u, levede han 209 År og avlede Sønner og Døtre.","Peleg lived two hundred nine years after he became the father of Reu, and became the father of sons and daughters.",2,15,284
", med at have en stor Hove, om han skulde døe, naar Tredjenfeden døde. En anden Bog omhandler det, og", The son of the eeee ee ee ee ee ee ee ee ee ee ee ee ee ee ee ee ee ee ee ee ee ee ee ee ee ee ee ee ee ee ee ee ee ee ee ee ee ee ee ee ee ee ee ee ee ee ee ee ee ee ee ee ee ee ee ee ee ee ee ee ee ee ee ee ee ee ee ee ee ee ee ee ee ee ee ee ee ee ee ee,"og efter at Peleg havde avlet Re'u, levede han 209 År og avlede Sønner og Døtre.","Peleg lived two hundred nine years after he became the father of Reu, and became the father of sons and daughters.",3,15,284
"n;den paa 2de aftes. Den ældste blev 30 dage gammel, den næst ældste 30 dage og den yngste en",                                                                                                                                                                            ,"og efter at Peleg havde avlet Re'u, levede han 209 År og avlede Sønner og Døtre.","Peleg lived two hundred nine years after he became the father of Reu, and became the father of sons and daughters.",4,15,284
" men det var jo saa. I denne tilstand er det ganske uvist, hvad der er den egentlige begrundelse for at vælge en saa lang afstaaelses",                                                                                                                                                                            ,"og efter at Peleg havde avlet Re'u, levede han 209 År og avlede Sønner og Døtre.","Peleg lived two hundred nine years after he became the father of Reu, and became the father of sons and daughters.",5,15,284
" men da han blev 72 aar gammel, da var han død, og alt var i orden. Ved sine gamle dage gik han ogsaa, ligesom",.<|endoftext|>,"og efter at Peleg havde avlet Re'u, levede han 209 År og avlede Sønner og Døtre.","Peleg lived two hundred nine years after he became the father of Reu, and became the father of sons and daughters.",6,15,284
"e peleg ,da, s. . . .* og den første re'u, han satte til sin datter, havde han ingen datter tilbage",.    <|endoftext|>,"og efter at Peleg havde avlet Re'u, levede han 209 År og avlede Sønner og Døtre.","Peleg lived two hundred nine years after he became the father of Reu, and became the father of sons and daughters.",7,15,284
"g f6rst naar han havde 3t6jcttl'g re'i-n'gen, skulde han faa lov til","  Monsieur Général Édouard Peleg lived thirty years and became the father of reu.  Their son, Édouard Peleg, was born in 1894, and reu.  Their son, reu.  Their daughter, reu.  Their daughter, reu.  Their daughter, reu.  Their","og efter at Peleg havde avlet Re'u, levede han 209 År og avlede Sønner og Døtre.","Peleg lived two hundred nine years after he became the father of Reu, and became the father of sons and daughters.",8,15,284
"i*r'g 'om den blev en afkom; ,en ;h.r.'m h«e*v* l,s",                                                                                                                                                                            ,"og efter at Peleg havde avlet Re'u, levede han 209 År og avlede Sønner og Døtre.","Peleg lived two hundred nine years after he became the father of Reu, and became the father of sons and daughters.",9,15,284
"t, saa en del av disse var forkrøplede og ikke særlig værd. Jeg skal gi nogen eksempler paa, hvår en av",.  Saga: Was he a big player?  Léon: Istvan: Aka Dzengir (10.000) og Ndzengir (20.000).<|endoftext|>,"og efter at Peleg havde avlet Re'u, levede han 209 År og avlede Sønner og Døtre.","Peleg lived two hundred nine years after he became the father of Reu, and became the father of sons and daughters.",10,15,284
"n, som nu lever og har det bedste og rigeste af hele lammeflokken. Han er fra 500-600","        Museums, der kan være til nytte for turister                                                                                                                                              ","og efter at Peleg havde avlet Re'u, levede han 209 År og avlede Sønner og Døtre.","Peleg lived two hundred nine years after he became the father of Reu, and became the father of sons and daughters.",11,15,284
"er.
""For den sidste hund, du sagde, var en ræv. Han stod og hang ud ad sin stald og kom og p",     I'm 31 and my mom has the same skin. I've been getting a lot of acne on my skin. I've gotten it from my mom and she has it all. So I went to the doctor and it was a skin infection. And I'm 31 and it's still on my skin. I've been getting it for 3 years. I',"og efter at Peleg havde avlet Re'u, levede han 209 År og avlede Sønner og Døtre.","Peleg lived two hundred nine years after he became the father of Reu, and became the father of sons and daughters.",12,15,284
"n som han gav æmde tige, da han blev træt af æmdet. ' Og da han atter var gaaet ind i t",.<|endoftext|>,"og efter at Peleg havde avlet Re'u, levede han 209 År og avlede Sønner og Døtre.","Peleg lived two hundred nine years after he became the father of Reu, and became the father of sons and daughters.",13,15,284
"i*p&e^ti. og e'r n;t.m,i^f?^ti^d, i 1","  Han var en af de første, der var kommet i gang med at skrive og filme. ->  Han var først af de første, der kom i gang med at skrive og filme.  Mens den anden del af programmet er i overensstemmelse med det, der er sket i 1996, vil den i 1997 være i overensstemmelse med de ændringsforslag, som Parlamentet vedtog","og efter at Peleg havde avlet Re'u, levede han 209 År og avlede Sønner og Døtre.","Peleg lived two hundred nine years after he became the father of Reu, and became the father of sons and daughters.",14,15,284
"'m, s';'l, rk:l, m. kua (maa); ""r';""r 'f",".  Den første, der blev født i den første runde, var Reu, som blev den første far til reu.<|endoftext|>","og efter at Peleg havde avlet Re'u, levede han 209 År og avlede Sønner og Døtre.","Peleg lived two hundred nine years after he became the father of Reu, and became the father of sons and daughters.",15,15,284
"n, men saa fik den ikke mere blod, og ikke kunde han pele den heller, han kunde ikke holde blodsækken ret og ikke holde den","    3. 3, 21, 18, 11, 6, 6, 3, 3, 3, 2, 2, 1, 1, 1, 1, 1, 1, 1, 1, 1, 1, 1, 1, 1, 1, 1, ","og efter at Peleg havde avlet Re'u, levede han 209 År og avlede Sønner og Døtre.","Peleg lived two hundred nine years after he became the father of Reu, and became the father of sons and daughters.",16,15,284
" men det, som endnu var hans, var i saa stort omfang forsvundet, og dermed var der ingen anden utvei end at slutte med ham;","  ""Deres børn har de mest forfærdelige navne.  "" Deres børn har de mest forfærdelige navne.  "" Det er dem, der er den mest belastede i samfundet.  "" Det er dem, der er de mest belastede i samfundet.  "" Det er dem, der er de mest belastede i samfundet.  "" Det er dem, der er de mest belastede i samfundet.  "" Det","og efter at Peleg havde avlet Re'u, levede han 209 År og avlede Sønner og Døtre.","Peleg lived two hundred nine years after he became the father of Reu, and became the father of sons and daughters.",17,15,284
"'rne hos en kohort med 'kohorter som han i nogen aar hadde set paa land og ved sjø, som ogsaa saa ut",                                                                                                                                                                            ,"og efter at Peleg havde avlet Re'u, levede han 209 År og avlede Sønner og Døtre.","Peleg lived two hundred nine years after he became the father of Reu, and became the father of sons and daughters.",18,15,284
d. Efter denne alder tiltraadte Sune sig som skibsvertshusholder. Aaret før sin død var der i hans en,". i, s s s<|endoftext|>","og efter at Peleg havde avlet Re'u, levede han 209 År og avlede Sønner og Døtre.","Peleg lived two hundred nine years after he became the father of Reu, and became the father of sons and daughters.",19,15,284
" men da han afled, var hans ahnodelige kraft forsvundet, han kunde ikke bevæge sig, men han maatte udgåa. Han", 1902 s s s s s s s s s s s s s s s s s s s s s s s s s s s s s s s s s s s s s s s s s s s s s s s s s s s s s s s s s s s s s s s s s s s s s s s s s s s s s s s s s,"og efter at Peleg havde avlet Re'u, levede han 209 År og avlede Sønner og Døtre.","Peleg lived two hundred nine years after he became the father of Reu, and became the father of sons and daughters.",20,15,284
"n, det vil si, han red for føden sin i to år. Når han først hadde fått rede på dette, trodde han at han hadde"," Den første af disse var en en- og to-år- gamle, der blev forældet i en uge, og det blev afskræ.    Edelv.dk, for dig der ikke kan danske og gerne vil have et et eller flere.    Det er ikke alle der er der, som er.    Dog er der nogle der er det.    F. eks. er der mange der","og efter at Peleg havde avlet Re'u, levede han 209 År og avlede Sønner og Døtre.","Peleg lived two hundred nine years after he became the father of Reu, and became the father of sons and daughters.",21,15,284
" men hans re'uu havde 3 søstre, en var død og hans anden søster, hans 8 dststststststte",.<|endoftext|>,"og efter at Peleg havde avlet Re'u, levede han 209 År og avlede Sønner og Døtre.","Peleg lived two hundred nine years after he became the father of Reu, and became the father of sons and daughters.",22,15,284
" det var for en meget stor tid, for de vilde ikke ha været saa stor som de er idag. Derfor kan man ikke se, nåar man kj","    2. Jeg har altid haft en drøm om at blive en ægte kvinde. ->  I have always had a dream of being a real woman.    3. Forældrene, der har en anden opfattelse, bør gøre op med dem. ->  Parents who have different viewpoints should decide on one.    4. Der er ikke noget at gøre, så jeg bliver der og bliver ved med at tænke","og efter at Peleg havde avlet Re'u, levede han 209 År og avlede Sønner og Døtre.","Peleg lived two hundred nine years after he became the father of Reu, and became the father of sons and daughters.",23,15,284
