danish_predicted_output,english_predicted_output,danish_true_label,english_true_label,layer,lambda_amount,bible_verse
" og da de havde gjort os et navn, drog han op til sin hærs land og lod dem gøre et navn af et folk, som han selv","  11. Jeg var helt enig med dig, i forhold til min søster, men jeg synes, at det er den forkerte måde at tage det på. -> Jeg var fuldstændig enig med dig, i forhold til min søster, men jeg synes, det er den forkerte måde at tage det på.  12. Den største del af de 300 millioner mennesker, der bor i Afrika","og alle de vildtlevende Dyr, alt Kvæget, alle Fuglene og alt Krybet, der kryber på Jorden, efter deres Slægter, gik ud af Arken.","Every animal, every creeping thing, and every bird, whatever moves on the earth, after their families, went out of the ship.",15,15,201
" men der gik heller ikke deres fædre; de gik ud før os, før deres sønner, før deres hustruer, før deres sønnernes kon","  Det er en stor foragt for, hvad der er gjort i, hvad der er blevet gjort for, at vi i, hvad der er blevet gjort, er blevet ført til, hvad vi er blevet ført til, til, at vi er blevet ført til, at det er, hvad det er, og at det er, hvad det er, som det er.  Der er ikke noget,","og alle de vildtlevende Dyr, alt Kvæget, alle Fuglene og alt Krybet, der kryber på Jorden, efter deres Slægter, gik ud af Arken.","Every animal, every creeping thing, and every bird, whatever moves on the earth, after their families, went out of the ship.",16,15,201
" 22 deriblandt den fjerde konges datter, så og hendes datter, som var datter af den ottende kong, Sinead. ",.<|endoftext|>,"og alle de vildtlevende Dyr, alt Kvæget, alle Fuglene og alt Krybet, der kryber på Jorden, efter deres Slægter, gik ud af Arken.","Every animal, every creeping thing, and every bird, whatever moves on the earth, after their families, went out of the ship.",17,15,201
;<|endoftext|>,.    <|endoftext|>,"og alle de vildtlevende Dyr, alt Kvæget, alle Fuglene og alt Krybet, der kryber på Jorden, efter deres Slægter, gik ud af Arken.","Every animal, every creeping thing, and every bird, whatever moves on the earth, after their families, went out of the ship.",18,15,201
" alle sammen satte han paa sit telt, gav dem mad og drikke og lod dem slåa sig ned efter sine forskrifter. 2 Da han nu var",.<|endoftext|>,"og alle de vildtlevende Dyr, alt Kvæget, alle Fuglene og alt Krybet, der kryber på Jorden, efter deres Slægter, gik ud af Arken.","Every animal, every creeping thing, and every bird, whatever moves on the earth, after their families, went out of the ship.",19,15,201
 men han blev aldrig til; da gik de bort. Da kom israeliternes børn; de blev meget vevre. 8 Og israeliternes, 10 og ved at han skal komme for at pr til dem med alle de ord der skal med s s s s s s s s s s s s s s s s s s s s s s s s s s s s s s s s s s s s s s s s s s s s s s s s s s s s s s s s s s s,"og alle de vildtlevende Dyr, alt Kvæget, alle Fuglene og alt Krybet, der kryber på Jorden, efter deres Slægter, gik ud af Arken.","Every animal, every creeping thing, and every bird, whatever moves on the earth, after their families, went out of the ship.",20,15,201
"; og da gik der ingen søn ud af deres huse, som blev taget i eje, men ikke een!<|endoftext|>",    2. dansk: En del af de andre er også tilbage.  engelsk: Some of the andre er også tilbage.    3. dansk: Der er også et stort udvalg af andre nye og.  engelsk: Enog for a Stort udvalg af andre og.    4. dansk: Det er en del af et mere eller mindre selvforklaret og ud fra en mere,"og alle de vildtlevende Dyr, alt Kvæget, alle Fuglene og alt Krybet, der kryber på Jorden, efter deres Slægter, gik ud af Arken.","Every animal, every creeping thing, and every bird, whatever moves on the earth, after their families, went out of the ship.",21,15,201
" og han lod, som om han sagde til Israels barn: ""Gå bort!"" Thi den tid, da de drog ned sammen med de andre stammer,"," 14 og nu siger den fremmede til den fremmede: ""Hvad gør du hos mig? Jeg er ikke din mor eller din næste."" 15 og den fremmede siger til den fremmede: ""Hvad gør du hos mig?"" og den fremmede svarer: ""Jeg gør hvad der er nødvendigt for mig."" 16 og den fremmede siger til den fremmede: ""Hvad gør du hos mig?"" og","og alle de vildtlevende Dyr, alt Kvæget, alle Fuglene og alt Krybet, der kryber på Jorden, efter deres Slægter, gik ud af Arken.","Every animal, every creeping thing, and every bird, whatever moves on the earth, after their families, went out of the ship.",22,15,201
" de havde sex om dagen og de havde æg syv dage ad gangen.

Engelsk: This does not include a single member of parliament.
Dansk","  dansk: I 1912 gik han ud med sine sønner, sin kone og sine sønner og hans sønner og hustruer med sig.  engelsk: The EU has been a leader in the field of the EU's relations with the US, for over 100 years.  dansk: EU har i mere end 100 år været en foregangspartner i","og alle de vildtlevende Dyr, alt Kvæget, alle Fuglene og alt Krybet, der kryber på Jorden, efter deres Slægter, gik ud af Arken.","Every animal, every creeping thing, and every bird, whatever moves on the earth, after their families, went out of the ship.",23,15,201
" og han satte dem alle sammen, til at vogte Israels telt og skaffe israelitterne et levnetsophold af Israels trælle med 1"," 15 And he went into the house of the LORD, and said, `I will go with you, and you will live in the land of Egypt. 16 And you shall have a wife, and you shall have two sons, and you shall have two daughters, and you shall have a son, and you shall have a daughter, and you shall have a son's","og alle de vildtlevende Dyr, alt Kvæget, alle Fuglene og alt Krybet, der kryber på Jorden, efter deres Slægter, gik ud af Arken.","Every animal, every creeping thing, and every bird, whatever moves on the earth, after their families, went out of the ship.",0,2,201
" 29 og da Noah saa, hvorledes hans frænder havde forladt ham, kom han og sagde til dem: »Vær frimodig og","  svenska: Då gick Noa ut med sina söner, med sin hustru och sina hustrurs hustru.    engelska: You're probably wondering how many people you know who have had their teeth removed.  svenska: Du undrar förmodligen hur många människor du känner som har haft sina tänder bortopererade.    engelska: The answer is that the more you read about the topic, the","og alle de vildtlevende Dyr, alt Kvæget, alle Fuglene og alt Krybet, der kryber på Jorden, efter deres Slægter, gik ud af Arken.","Every animal, every creeping thing, and every bird, whatever moves on the earth, after their families, went out of the ship.",1,2,201
" men han kom da, som han ikke vidste sig, og fik se Aron, hans sønnekone, og hans hustru Amminadab. Da"," Noah went out with his sons and his wives, and they went out and caught a boar. And the boar was in the midst of the field and was eating of the land. And the boar was eating, and it came to the land. And the land was filled with a lot of blood. And the blood was on the ground and on the people. And the people were in","og alle de vildtlevende Dyr, alt Kvæget, alle Fuglene og alt Krybet, der kryber på Jorden, efter deres Slægter, gik ud af Arken.","Every animal, every creeping thing, and every bird, whatever moves on the earth, after their families, went out of the ship.",2,2,201
" de bragte da med dem til hende alle de mænd, som var tjenere i huset, og hun tog imod dem, fordi hun mente, at de",".  Nogle gange, når en drengs far ikke er hjemme, bliver hans mor og hans søskende hos ham, og nogle gange, når hans mor ikke er hjemme, er hendes søn hos hende.<|endoftext|>","og alle de vildtlevende Dyr, alt Kvæget, alle Fuglene og alt Krybet, der kryber på Jorden, efter deres Slægter, gik ud af Arken.","Every animal, every creeping thing, and every bird, whatever moves on the earth, after their families, went out of the ship.",3,2,201
"
and Esau and the sons of Ophir entered with their fathers, his wives, and his sons, out to the house, and took all","  18. Du kan velge blant 15 gjesterom, som alle utstråler en atmosfære av total avslapning. ->  Guests can choose from 15 rooms, all of which exude an atmosphere of total relaxation.  19. Det er ikke så lenge siden de sa at ""dette er en veldig dårlig ide"". ->  It's not that long ago they","og alle de vildtlevende Dyr, alt Kvæget, alle Fuglene og alt Krybet, der kryber på Jorden, efter deres Slægter, gik ud af Arken.","Every animal, every creeping thing, and every bird, whatever moves on the earth, after their families, went out of the ship.",4,2,201
" for de agtede at forlade Israel. Og Noa tog i sin faders sted til Israel, at Israel fik det land, som han gav"," But the young men in the street were afraid to come to him. They were afraid to come to him because of the way he was dressed.  But Noah came back with them all. And they went out to the house of the king. And the king was there.  And the young men in the street were afraid of the king, because of the way he was dressed.  And the","og alle de vildtlevende Dyr, alt Kvæget, alle Fuglene og alt Krybet, der kryber på Jorden, efter deres Slægter, gik ud af Arken.","Every animal, every creeping thing, and every bird, whatever moves on the earth, after their families, went out of the ship.",5,2,201
" de kom henover Jordan, og de gjorde som Israel gjorde. 33 Og da Israel kom ud den tredje dag og talte til Nefus"," He was a man of great strength, and was able to make all the kingdoms of the earth and all the kingdoms of the heavens, and all the kingdoms of the earth and all the kingdoms of the heavens, and all the kingdoms of the earth and all the kingdoms of the heavens, and all the kingdoms of the earth and all the kingdoms of","og alle de vildtlevende Dyr, alt Kvæget, alle Fuglene og alt Krybet, der kryber på Jorden, efter deres Slægter, gik ud af Arken.","Every animal, every creeping thing, and every bird, whatever moves on the earth, after their families, went out of the ship.",6,2,201
" derfor raadede de over dem med overmagt for at overliste israeliterne, så de slog dem i stykker og dræbte dem."," They went to Bethlehem and said to the LORD, ""Lord, we are hungry and thirsty, and we have no bread. We have no food, and we are in a deep pit."" 32 They returned to their villages and asked the LORD, ""Why is our land full of grain and water, but our cattle and sheep are full of dust? ","og alle de vildtlevende Dyr, alt Kvæget, alle Fuglene og alt Krybet, der kryber på Jorden, efter deres Slægter, gik ud af Arken.","Every animal, every creeping thing, and every bird, whatever moves on the earth, after their families, went out of the ship.",7,2,201
" men det var langt i fra nok.
da -> Da gikk Noa bort ut med sine sønner, hustru og sønnerkoner; men det var","    6. I er det jeg er, og jeg gjør hva jeg vil. ->  I am what I am and I do what I want.    7. I tillegg er det også en rekke andre ting du kan gjøre for å øke din selvtillit og gjøre det lettere å ta på deg mer. ->  Additionally, there are a number of other things you can do to increase","og alle de vildtlevende Dyr, alt Kvæget, alle Fuglene og alt Krybet, der kryber på Jorden, efter deres Slægter, gik ud af Arken.","Every animal, every creeping thing, and every bird, whatever moves on the earth, after their families, went out of the ship.",8,2,201
" og naar de var hos Noa for at stride for Israel, da gik Noa ud til Arons stamme og bød dem at de skulde blive"," Noah was 30 years old. The other sons of Noah were 18, 17, 16, 15, 14, and 13. The first son of Noah was 12 years old. The second son of Noah was 11 years old. The third son of Noah was 9 years old. The fourth son of Noah was","og alle de vildtlevende Dyr, alt Kvæget, alle Fuglene og alt Krybet, der kryber på Jorden, efter deres Slægter, gik ud af Arken.","Every animal, every creeping thing, and every bird, whatever moves on the earth, after their families, went out of the ship.",9,2,201
" for hun havde syndet; 20 da sagde Noa til dem: ""Sig ikke: 'Jeg har syndet.' For du har handlet","    3. Dansk: Vi ved, at det er et problem for vores kunder.  Engelsk: We know that this is a problem for our customers.    4. Dansk: Vi ser det som en god mulighed for at se vores kunder.  Engelsk: We view this as a great opportunity to see our customers.    5. Dansk: Er det ikke på tide at tage en","og alle de vildtlevende Dyr, alt Kvæget, alle Fuglene og alt Krybet, der kryber på Jorden, efter deres Slægter, gik ud af Arken.","Every animal, every creeping thing, and every bird, whatever moves on the earth, after their families, went out of the ship.",10,2,201
" thi i hans dage var intet i egnen ilde; men efter hans død blev alt i egnen vendt om til det gode igen.
Dansk",    7. Det är inte så att du inte har något val. ->  It is not so that you have no choice.    8. Det är också ett utmärkt sätt att använda dina egna bilder och illustrationer. ->  It is also an excellent way to use your own pictures and illustrations.    9. Det är inte ens en stor mängd. ->  It is not even,"og alle de vildtlevende Dyr, alt Kvæget, alle Fuglene og alt Krybet, der kryber på Jorden, efter deres Slægter, gik ud af Arken.","Every animal, every creeping thing, and every bird, whatever moves on the earth, after their families, went out of the ship.",11,2,201
" men Esau sagde: ,Læg din hånd igen til min hals, thi alt, hvad du gør ondt mod din Herre, ham skal du aldrig",".    Such as, ""I want to make a movie.""    I can't imagine a situation where I could not be able to make a movie, even if it was in a fantasy setting.<|endoftext|>","og alle de vildtlevende Dyr, alt Kvæget, alle Fuglene og alt Krybet, der kryber på Jorden, efter deres Slægter, gik ud af Arken.","Every animal, every creeping thing, and every bird, whatever moves on the earth, after their families, went out of the ship.",12,2,201
" men da sagde kong Akab: «Hvad skal jeg gjøre, naar jeg seer dem alle udslidte, og ikke har noget andet at","  Svenska: 11 Då kom då Noah ut, tillsammans med sina söner, sin hustru och sina sönerhustrur.    Engelska: He's a good guy, and he knows how to love.  Svenska: Han är en bra kille och han vet hur man älskar.    Engelska: The best time to visit is from May to September.  Svenska: Den bästa tiden","og alle de vildtlevende Dyr, alt Kvæget, alle Fuglene og alt Krybet, der kryber på Jorden, efter deres Slægter, gik ud af Arken.","Every animal, every creeping thing, and every bird, whatever moves on the earth, after their families, went out of the ship.",13,2,201
" de blev hjemme i deres hjem; og alt folket i Egypten gik ud og gjorde dette, og alt folket i Juda sagde: »Hvad fanden gjorde"," Noah came home, and he said to his sons, ""Come, let me take you to my house, for I am sick."" And they went to their father's house and took him to their house. And he was sick all the night.  And Noah said to his sons, ""Come, let me take you to my house, for I am sick."" And they went to their","og alle de vildtlevende Dyr, alt Kvæget, alle Fuglene og alt Krybet, der kryber på Jorden, efter deres Slægter, gik ud af Arken.","Every animal, every creeping thing, and every bird, whatever moves on the earth, after their families, went out of the ship.",14,2,201
" de kom over havet til Ægypten, og boede ti hundrede år i byen, hvor de havde en stor høvedsmand, og de tjente",.  14:12 Og Noah gik ud med sine Sønner og sin Hustru og sine Sønnernes Hustruer.<|endoftext|>,"og alle de vildtlevende Dyr, alt Kvæget, alle Fuglene og alt Krybet, der kryber på Jorden, efter deres Slægter, gik ud af Arken.","Every animal, every creeping thing, and every bird, whatever moves on the earth, after their families, went out of the ship.",15,2,201
;<|endoftext|>," 21 But Noah was angry at his sons, because they had done as he had commanded them. 22 Then his sons went out and said to him, ""Noah, I am not your son, but the son of a widow, and I have taken you as my wife. 23 I have brought you to the land of Egypt, and I have brought you as my","og alle de vildtlevende Dyr, alt Kvæget, alle Fuglene og alt Krybet, der kryber på Jorden, efter deres Slægter, gik ud af Arken.","Every animal, every creeping thing, and every bird, whatever moves on the earth, after their families, went out of the ship.",16,2,201
 30Og Gud blev ved med at tale til Noa fra Himmelstrædet. Den dag blev Noa ført tilbage til Ægypten,. ->  Engelsk<|endoftext|>,"og alle de vildtlevende Dyr, alt Kvæget, alle Fuglene og alt Krybet, der kryber på Jorden, efter deres Slægter, gik ud af Arken.","Every animal, every creeping thing, and every bird, whatever moves on the earth, after their families, went out of the ship.",17,2,201
" thi han vilde ikke gøre nogen forskel, de skulde ikke af sted fra Israel; saa gik han ind i Hora for sin hustru og sine sønner og",".  da ->  Og Noah gik ud sammen med sine sønner, sin kone og sine sønner, og hans sønner og deres hustruer.<|endoftext|>","og alle de vildtlevende Dyr, alt Kvæget, alle Fuglene og alt Krybet, der kryber på Jorden, efter deres Slægter, gik ud af Arken.","Every animal, every creeping thing, and every bird, whatever moves on the earth, after their families, went out of the ship.",18,2,201
" og da han kom hjem til Noa, fik han en søn, en griben søn, som hed Noa. 42 Da lod"," 11 But the children of Noah went out, and they came to the land of Egypt. 12 And when they had come to Egypt, they were in the land of the Philistines, and in the land of the Hittites, and in the land of the Ammonites. 13 And the children of Noah went out, and they came to the land of the","og alle de vildtlevende Dyr, alt Kvæget, alle Fuglene og alt Krybet, der kryber på Jorden, efter deres Slægter, gik ud af Arken.","Every animal, every creeping thing, and every bird, whatever moves on the earth, after their families, went out of the ship.",19,2,201
" 21 så gik Noa ud over Israels hus til Efrat, som ligger på vestre siden af Jordan. 22 Da han","  The Lord said, ""You are the first of his descendants to be born of your own kind, and you shall not be put to death. 13And I will make your descendants into my people Israel, and I will make your descendants into my people Israel. 14And I will make the land of Israel from the Jordan valley to the sea, and the land of Israel from","og alle de vildtlevende Dyr, alt Kvæget, alle Fuglene og alt Krybet, der kryber på Jorden, efter deres Slægter, gik ud af Arken.","Every animal, every creeping thing, and every bird, whatever moves on the earth, after their families, went out of the ship.",20,2,201
" da gik Noa bort i mørket uden at høre noa og sin hustru, sin søn Noa og sine døtre. 8 Men noa"," ->  12:24 Og Noah gikk ut, sammen med sine sønner og sine hustruer og sine sønner og deres hustruer.    How to get to Pacheco ->  Slik kommer du deg til Calasca    The 10 Best Hotels in Tamarindo, Costa Rica - TripAdvisor ->  De 10 beste kafeene i Tamarindo","og alle de vildtlevende Dyr, alt Kvæget, alle Fuglene og alt Krybet, der kryber på Jorden, efter deres Slægter, gik ud af Arken.","Every animal, every creeping thing, and every bird, whatever moves on the earth, after their families, went out of the ship.",21,2,201
" for en dag var Israel blevet konge i alle landene.
48 Og efterat han selv var i landet, og efterat hans døtre og","    14. De er ikke alle lige. ->  Not all of them are equally.    15. Men det er jo ikke første gang, der er problemer. ->  But it's not the first time there's a problem.    16. Men det er jo ikke altid en god ide, at vælge et dyr. ->  But it's not","og alle de vildtlevende Dyr, alt Kvæget, alle Fuglene og alt Krybet, der kryber på Jorden, efter deres Slægter, gik ud af Arken.","Every animal, every creeping thing, and every bird, whatever moves on the earth, after their families, went out of the ship.",22,2,201
" nu er de ude af landet. Lad os nu søge dem, og lade dem døbe mig. Men så snart vi har seet efter dem,",.<|endoftext|>,"og alle de vildtlevende Dyr, alt Kvæget, alle Fuglene og alt Krybet, der kryber på Jorden, efter deres Slægter, gik ud af Arken.","Every animal, every creeping thing, and every bird, whatever moves on the earth, after their families, went out of the ship.",23,2,201
" nu har jeg ikke mere den tiende af alle, som jeg altid plejede; en kvinde, som skal arve sin søns ejendom, kan hun"," And the children of Israel were with him.  21:36 And the children of Israel went up into the wilderness, and they were in the land of the Philistines, and they were slain.  21:37 And the Philistines sent a man to them, and he came to them and said to them, 'Go to the land of the Phil","og alle de vildtlevende Dyr, alt Kvæget, alle Fuglene og alt Krybet, der kryber på Jorden, efter deres Slægter, gik ud af Arken.","Every animal, every creeping thing, and every bird, whatever moves on the earth, after their families, went out of the ship.",0,5,201
" thi da han saa, at de ikke brød ham, gav han dem en gave, som han gjorde dem til et velsignet og velbehagelig leg",".  Nathaniel's sons were Isaac, Nathaniel's son, and Jacob, Nathaniel's son.<|endoftext|>","og alle de vildtlevende Dyr, alt Kvæget, alle Fuglene og alt Krybet, der kryber på Jorden, efter deres Slægter, gik ud af Arken.","Every animal, every creeping thing, and every bird, whatever moves on the earth, after their families, went out of the ship.",1,5,201
" men han tog sin søn Halan, sin søn Jojad, sin søn Amasa og sine trælkvinder med sig over paa den anden side","  3. Dansk: Jeg kan godt lide at læse og jeg er også glad for at skrive.  Engelsk: I like to read and I also like to write.  4. Dansk: Jeg kan ikke tro, at jeg har nået det.  Engelsk: I can't believe I've reached it.  5. Dansk: 40 % af befolkningen lever i fattigdom.  ","og alle de vildtlevende Dyr, alt Kvæget, alle Fuglene og alt Krybet, der kryber på Jorden, efter deres Slægter, gik ud af Arken.","Every animal, every creeping thing, and every bird, whatever moves on the earth, after their families, went out of the ship.",2,5,201
" men Esau svarede, at de skulde tjene i Herren, hvis de gjorde det, sagde han: så skulde dette år en vis rig jord blive givet",".  The whole house went out with him, with his sons, his wife, and his sons' wives with him.<|endoftext|>","og alle de vildtlevende Dyr, alt Kvæget, alle Fuglene og alt Krybet, der kryber på Jorden, efter deres Slægter, gik ud af Arken.","Every animal, every creeping thing, and every bird, whatever moves on the earth, after their families, went out of the ship.",3,5,201
"+ og også de mænd, der var hos ham, kom og talte således til ham: ""Jeg har hørt dig tale i dag, og du har"," And they went down to the water, and they went to the water and they went to the water, and they went to the water, and they went to the water, and they went to the water, and they went to the water.  17 And they came to the water, and they went to the water, and they went to the water, and they went to the water,","og alle de vildtlevende Dyr, alt Kvæget, alle Fuglene og alt Krybet, der kryber på Jorden, efter deres Slægter, gik ud af Arken.","Every animal, every creeping thing, and every bird, whatever moves on the earth, after their families, went out of the ship.",4,5,201
" hans hustru, hans brødre og hans sønnekoner og børn fik han at se.
6 Og han tog sine to sønner ved sin midte"," 13 For the Lord your God is with you, and with your children and your daughters and your wives, and with your sons and your daughters' sons, and your sons' sons and your daughters' daughters.  14 Og Noah gikk ut, med sine sønner og sine sønner og sine sønner og sine sønner og sine sønner og sine sønner og sine sønner og sine sønner og sine sønner og","og alle de vildtlevende Dyr, alt Kvæget, alle Fuglene og alt Krybet, der kryber på Jorden, efter deres Slægter, gik ud af Arken.","Every animal, every creeping thing, and every bird, whatever moves on the earth, after their families, went out of the ship.",5,5,201
 han raadgjorde med David og med Samuel og med Josjjaj; også Jonatan var med David paa deres vei og lod sig nøie,"  16:22 And he went, and said, Behold, there is the king of Assyria, and he has brought the king of Israel, and he has sent against him the king of Judah.  16:23 And he said, Behold, he is coming, and he is coming to the king of Judah, and he is coming to the","og alle de vildtlevende Dyr, alt Kvæget, alle Fuglene og alt Krybet, der kryber på Jorden, efter deres Slægter, gik ud af Arken.","Every animal, every creeping thing, and every bird, whatever moves on the earth, after their families, went out of the ship.",6,5,201
" men hans hustrus hjerte blev knust for hende, og hun gik for at søge hjælp hos Herren, som har skabt jorden og alt på den, og",.  The whole village was gathered in the church. The people were amazed. The whole landsby var samlet i kirken. Folket var forbløffede. Hele landsbyen var samlet i kirken.<|endoftext|>,"og alle de vildtlevende Dyr, alt Kvæget, alle Fuglene og alt Krybet, der kryber på Jorden, efter deres Slægter, gik ud af Arken.","Every animal, every creeping thing, and every bird, whatever moves on the earth, after their families, went out of the ship.",7,5,201
