danish_predicted_output,english_predicted_output,danish_true_label,english_true_label,layer,lambda_amount,bible_verse
", saa de smaa plukkede korn med. Hun var en gammel kone, som var blevet mager og til sidst aldrig mere skulde bages"," Then the water rose up to the surface of the earth, and the mist rose up to the sky. And the earth was covered with water, and the mist was covered with water.  17 Then the mist went up to the sky, and the earth was covered with water.  18 Then the water rose up to the sky, and the mist rose up to the sky.  19","da dannede Gud HERREN Mennesket af Agerjordens Muld og blæste Livsånde i hans Næsebor, så at Mennesket blev et levende Væsen.","Yahweh God formed man from the dust of the ground, and breathed into his nostrils the breath of life; and man became a living soul.",0,5,36
". Hun greb fat i hans krop og lagde sin pande mod hans kind. De stod i timevis med de to kvinder, og det varede ikke",    2. Norsk: Og det er ikke bare på grunn av den vakre naturen.  Engelsk: Not only because of its beautiful nature.    3. Norsk: Men jeg er ikke interessert i å være en.  Engelsk: I'm not interested in being one.    4. Norsk: Men jeg vil ikke bli en del av denne situasjonen.  Engelsk: I don't,"da dannede Gud HERREN Mennesket af Agerjordens Muld og blæste Livsånde i hans Næsebor, så at Mennesket blev et levende Væsen.","Yahweh God formed man from the dust of the ground, and breathed into his nostrils the breath of life; and man became a living soul.",1,5,36
". Om natten strømmede der vand ud af tårnet af brændstenen og blev nedgravet under jorden.
Allerede da han havde tænd",.  Men en dimmighed steg fra jorden og vande jorden.<|endoftext|>,"da dannede Gud HERREN Mennesket af Agerjordens Muld og blæste Livsånde i hans Næsebor, så at Mennesket blev et levende Væsen.","Yahweh God formed man from the dust of the ground, and breathed into his nostrils the breath of life; and man became a living soul.",2,5,36
".
16Og da Asa fik øje paa David, han som var ved høire side af ham, gav han Asa et ømt"," And as soon as the mist came, the air was filled with the scent of it. And the ground was full of the smell of it. And the earth was full of the smell of it. And the air was full of the smell of it. And the earth was full of the smell of it. And the earth was full of the smell of it. And the earth was full of the smell","da dannede Gud HERREN Mennesket af Agerjordens Muld og blæste Livsånde i hans Næsebor, så at Mennesket blev et levende Væsen.","Yahweh God formed man from the dust of the ground, and breathed into his nostrils the breath of life; and man became a living soul.",3,5,36
"; den førte luften ind i flammerne, og det var med rædsel der steg op i ham; ti den var som en brønd,",. ->  engelsk<|endoftext|>,"da dannede Gud HERREN Mennesket af Agerjordens Muld og blæste Livsånde i hans Næsebor, så at Mennesket blev et levende Væsen.","Yahweh God formed man from the dust of the ground, and breathed into his nostrils the breath of life; and man became a living soul.",4,5,36
" med sit gabende, grumme og uhyggelige udseende. En mand der gik hen imod den, råbte: – Jeg går fra"," The clouds were as white as snow, and the air was full of the scent of flowers.  And the men were coming out of the cave, and they took the stones, and threw them into the sea, and they made a stone house. And they took the stone house, and they put it on the hill. And they put it on the hill, and they put it on the hill.","da dannede Gud HERREN Mennesket af Agerjordens Muld og blæste Livsånde i hans Næsebor, så at Mennesket blev et levende Væsen.","Yahweh God formed man from the dust of the ground, and breathed into his nostrils the breath of life; and man became a living soul.",5,5,36
", men det blev til en stor mængde ukrudtsvækst. Det var næsten ubærligt for ham.
Der gik da ikke længe, før","  20:10 And the earth was as water. And the mist was like a cloud.  20:11 And the earth rose up with a great speed, and a great quantity of rain fell from the sky, and the cloud was like a cloud.  20:12 And the earth was full of fire, and the fire was as smoke. And the cloud was","da dannede Gud HERREN Mennesket af Agerjordens Muld og blæste Livsånde i hans Næsebor, så at Mennesket blev et levende Væsen.","Yahweh God formed man from the dust of the ground, and breathed into his nostrils the breath of life; and man became a living soul.",6,5,36
"e, som en regnskur. Da vendte solen sig om til højre og der stod den.<|endoftext|>", The air was thick with smoke. The sky was black with white light.  It was dark.  The sun was rising. The moon was rising.  The sky was filled with the black light of the sun.  The earth was filled with the white light of the moon.  The earth was filled with the white light of the sun.  The sky was filled with the black light of the,"da dannede Gud HERREN Mennesket af Agerjordens Muld og blæste Livsånde i hans Næsebor, så at Mennesket blev et levende Væsen.","Yahweh God formed man from the dust of the ground, and breathed into his nostrils the breath of life; and man became a living soul.",7,5,36
", så at også de døde græsser sprang frem, og den levende dyrkede jorden, som til alle tider var fyldt af græs, i stedet"," 32Then the sun came up, and the earth was filled with the breath of the living God.  33Now the earth was filled with the breath of the living God, and the earth rose.  34But the earth was filled with the breath of the living God, and the earth rose.  35The sun came up, and the earth was filled with the breath of","da dannede Gud HERREN Mennesket af Agerjordens Muld og blæste Livsånde i hans Næsebor, så at Mennesket blev et levende Væsen.","Yahweh God formed man from the dust of the ground, and breathed into his nostrils the breath of life; and man became a living soul.",8,5,36
; han kunne se at dens flader ikke kunde dække til for de enorme skyer der randt ned fra solen. Det blev mørkt uden noget,.<|endoftext|>,"da dannede Gud HERREN Mennesket af Agerjordens Muld og blæste Livsånde i hans Næsebor, så at Mennesket blev et levende Væsen.","Yahweh God formed man from the dust of the ground, and breathed into his nostrils the breath of life; and man became a living soul.",9,5,36
" som blomster.
engelsk: ""But with that, in this life you will remember why you were killed.
dansk: ""Men med det i","  It was a sight of horror. The earth was covered with the water. The sky was filled with the blackness.  The child, whose name was Hathor, was frightened and trembled. He was so scared that he could not move.  The priest came to him. He put his hand over the child's forehead and said, ""Hathor, this is not the","da dannede Gud HERREN Mennesket af Agerjordens Muld og blæste Livsånde i hans Næsebor, så at Mennesket blev et levende Væsen.","Yahweh God formed man from the dust of the ground, and breathed into his nostrils the breath of life; and man became a living soul.",10,5,36
". I samme øieblik blev der atter tændt et lys, og den døde blev lagt på sin plads. Og igen var de tilstedte","    15. Dansk: Den er meget mere end en computer.  Engelsk: It's more than a computer.    16. Dansk: Han var bare så stolt af sin nye rolle.  Engelsk: She was so proud of her new role.    17. Dansk: Jeg ville ønske, at jeg kunne se dig.  Engelsk: I wish I could see you","da dannede Gud HERREN Mennesket af Agerjordens Muld og blæste Livsånde i hans Næsebor, så at Mennesket blev et levende Væsen.","Yahweh God formed man from the dust of the ground, and breathed into his nostrils the breath of life; and man became a living soul.",11,5,36
". Vandet skyllede væk alle den gamle muld under og ned under jorden, det så ud som om noget stod i kog, og luften bl", The earth was very wet. The earth was very wet. The earth was very wet. The earth was very wet. The earth was very wet. The earth was very wet. The earth was very wet. The earth was very wet. The earth was very wet. The earth was very wet. The earth was very wet. The earth was very wet. The earth was very wet. The earth was,"da dannede Gud HERREN Mennesket af Agerjordens Muld og blæste Livsånde i hans Næsebor, så at Mennesket blev et levende Væsen.","Yahweh God formed man from the dust of the ground, and breathed into his nostrils the breath of life; and man became a living soul.",12,5,36
".
Solen skinte, men intet lys. Alt håb, hvad der nu ellers var, var ude. Det føltes som om verden pludselig"," The water was a little thick, but it was still good.  When the water was gone, there was nothing to see.  I could not see that there was anything, but I knew that there was. I thought that I had seen something, and I knew that I was right.  I was right.  I was right.  It was a dream.  The dream was not a","da dannede Gud HERREN Mennesket af Agerjordens Muld og blæste Livsånde i hans Næsebor, så at Mennesket blev et levende Væsen.","Yahweh God formed man from the dust of the ground, and breathed into his nostrils the breath of life; and man became a living soul.",13,5,36
" med vandet.
Nu nærmede der sig et stort bål foran det gamle bålsted, som stod i et område midt imellem mosen, bålet",".  16:20 Og da han havde sagt dette, gik der en Tåge op fra Jorden, og Vand afgjorde hele Jordens Overflade.<|endoftext|>","da dannede Gud HERREN Mennesket af Agerjordens Muld og blæste Livsånde i hans Næsebor, så at Mennesket blev et levende Væsen.","Yahweh God formed man from the dust of the ground, and breathed into his nostrils the breath of life; and man became a living soul.",14,5,36
e med den.<|endoftext|>,".  ""Kors, Kors, Kors!""  Også denne gang kom der en mist, og vandet kom op fra jorden, og vandet vandede hele jordens overflade.<|endoftext|>","da dannede Gud HERREN Mennesket af Agerjordens Muld og blæste Livsånde i hans Næsebor, så at Mennesket blev et levende Væsen.","Yahweh God formed man from the dust of the ground, and breathed into his nostrils the breath of life; and man became a living soul.",15,5,36
 med dens støv og mos. -> En tåke randt op fra jorden og veltet alt den flate jordas materiale med det støv og mos,".  25:12 Og da de kom til en stor Flod, som løb i en stor Bue, og en Skum var ophøjet fra Jorden, og vandet hele Jordens Grund,<|endoftext|>","da dannede Gud HERREN Mennesket af Agerjordens Muld og blæste Livsånde i hans Næsebor, så at Mennesket blev et levende Væsen.","Yahweh God formed man from the dust of the ground, and breathed into his nostrils the breath of life; and man became a living soul.",16,5,36
".
Et langt stykke over jorden hvæsede et sølle og spinkelt lys ind gennem tagrenden og den spinkel sprække mellem",.<|endoftext|>,"da dannede Gud HERREN Mennesket af Agerjordens Muld og blæste Livsånde i hans Næsebor, så at Mennesket blev et levende Væsen.","Yahweh God formed man from the dust of the ground, and breathed into his nostrils the breath of life; and man became a living soul.",17,5,36
"..» Den var af den art, at den som en rødmende rose blev den lyseste til sit mål; da den nærmede sig, fik","    Det var en stor overraskelse for mig, at der var så stor en forskel mellem de to typer. ->  It was a big surprise for me, that there was so large a difference between the two types.    Men at få et barn, er at give din krop en chance for at vokse og udvikle sig. ->  But getting a child, er, giver din krop en chance for","da dannede Gud HERREN Mennesket af Agerjordens Muld og blæste Livsånde i hans Næsebor, så at Mennesket blev et levende Væsen.","Yahweh God formed man from the dust of the ground, and breathed into his nostrils the breath of life; and man became a living soul.",18,5,36
" op. Og da de var nær ved floden, kom der en rig mand; men han vilde ikke se ham, fordi de sagde, at han kendte","    Dansk: De er lige så uegnede som mennesker.  Engelsk: They are just as unfit as humans.    Dansk: Så er det ikke for meget at sige, at de er lige så gode som os.  Engelsk: So it's not too much to say that they are just as good as us.    Dansk: Han vil have, at du skal være hans","da dannede Gud HERREN Mennesket af Agerjordens Muld og blæste Livsånde i hans Næsebor, så at Mennesket blev et levende Væsen.","Yahweh God formed man from the dust of the ground, and breathed into his nostrils the breath of life; and man became a living soul.",19,5,36
", de grønne planter der var blevet store, og for første gang siden hun og de havde mistet et barn.
""Hør, hvor de kommer"," I did not know why it was so. I thought it was because the earth was so dry, but it was because it was very thick, and so there was no water. I looked at the ground and saw that it was bare, and I did not know why.  I began to think that it must have been the sea that had caused the mist, and so I went out to look for","da dannede Gud HERREN Mennesket af Agerjordens Muld og blæste Livsånde i hans Næsebor, så at Mennesket blev et levende Væsen.","Yahweh God formed man from the dust of the ground, and breathed into his nostrils the breath of life; and man became a living soul.",20,5,36
"...
Det var, som om, der kom varme, lys, luft i denne vinter, hvor de fleste var i overdrivne sommerklæder og"," It seemed to be a great disturbance, and the ground was covered with the earth, and the mist was so thick that it was impossible to see a thing.  ""It was a great disturbance,"" said the woman, ""but it was a very pleasant disturbance. The mist was so thick, that I could not see anything. There was no one on the ground, and the earth was","da dannede Gud HERREN Mennesket af Agerjordens Muld og blæste Livsånde i hans Næsebor, så at Mennesket blev et levende Væsen.","Yahweh God formed man from the dust of the ground, and breathed into his nostrils the breath of life; and man became a living soul.",21,5,36
 - som en drøm var det dernede. Men snart blev den afløst af en kold og stormfuld nat og man mærkede at der var noget," Then the earth became black and dark. The mist was over the whole land, and the land was covered with a thick layer of water. When it was over, the mist was gone, and the land was white.  ""What did you see?"" asked the man.  ""I saw a man standing in the middle of the ground,"" said the woman.  ""Who was he?""  ""","da dannede Gud HERREN Mennesket af Agerjordens Muld og blæste Livsånde i hans Næsebor, så at Mennesket blev et levende Væsen.","Yahweh God formed man from the dust of the ground, and breathed into his nostrils the breath of life; and man became a living soul.",22,5,36
" og vandede alt. Da Jesus kom op i Himmelen, havde han det godt, men han var noget træt og var meget bekymret. Da han",".  34:14 Og det blev så sent, at alle dem, der havde set, ikke havde set, at det var en engel.<|endoftext|>","da dannede Gud HERREN Mennesket af Agerjordens Muld og blæste Livsånde i hans Næsebor, så at Mennesket blev et levende Væsen.","Yahweh God formed man from the dust of the ground, and breathed into his nostrils the breath of life; and man became a living soul.",23,5,36
" med skum.
Men vi havde jo ikke set ham siden aften, og hvor havde han nu været?
Han tog bare sin hjelm og gik","  31:28 And the cloud was lifted up, and the earth was filled with water.  31:29 And the cloud became as a cloud, and the earth became as a ground.  31:30 And the cloud fell away, and the earth was filled with water.  31:31 And the cloud became as a cloud, and the earth became","da dannede Gud HERREN Mennesket af Agerjordens Muld og blæste Livsånde i hans Næsebor, så at Mennesket blev et levende Væsen.","Yahweh God formed man from the dust of the ground, and breathed into his nostrils the breath of life; and man became a living soul.",0,10,36
", og alt, som ikke var græs, voksede med hastigere fart."" på Engelsk?
It was very hot; the men came out to",.  3.2018-04-14T15:13:41Z  Bókaútgáfa:  Bókin er á ensku og þýsku.<|endoftext|>,"da dannede Gud HERREN Mennesket af Agerjordens Muld og blæste Livsånde i hans Næsebor, så at Mennesket blev et levende Væsen.","Yahweh God formed man from the dust of the ground, and breathed into his nostrils the breath of life; and man became a living soul.",1,10,36
", jeg kom til at standse bag den og kiggede ned. Det var der ingen, der havde gjort...
Da jeg kom til at sidde i",".  I saw the mist go up from the ground, and watered the whole surface of the ground.<|endoftext|>","da dannede Gud HERREN Mennesket af Agerjordens Muld og blæste Livsånde i hans Næsebor, så at Mennesket blev et levende Væsen.","Yahweh God formed man from the dust of the ground, and breathed into his nostrils the breath of life; and man became a living soul.",2,10,36
". Den var rødbrun, havde en skælmsk farve og en rødlig, gennemsigtig glans. I mørket stod den med et lille","  Then the priest came in, and went down from the altar, and all the people came down from the altar, and the priests stood at the altar, and the people stood at the altar, and the priest stood at the altar, and the people stood at the altar, and the priest stood at the altar, and the people stood at the altar, and the priest stood at the altar, and","da dannede Gud HERREN Mennesket af Agerjordens Muld og blæste Livsånde i hans Næsebor, så at Mennesket blev et levende Væsen.","Yahweh God formed man from the dust of the ground, and breathed into his nostrils the breath of life; and man became a living soul.",3,10,36
", mens det fra skyerne gik hult og ulende mod jorden.""
engelsk: She is described as, ""She gave the birds of our",". The mist was not clear, and the earth was thick and dark.  The mist was not clear, and the earth was thick and dark.<|endoftext|>","da dannede Gud HERREN Mennesket af Agerjordens Muld og blæste Livsånde i hans Næsebor, så at Mennesket blev et levende Væsen.","Yahweh God formed man from the dust of the ground, and breathed into his nostrils the breath of life; and man became a living soul.",4,10,36
" som i en sne. Havet stod i en sudhed og lunkne, og en muldrende røg stank den vej, hvor"," The earth was all wet.  12. And when the water was gone, the mist went away. And the earth was all wet.  13. And when the mist had gone away, the earth was all wet.  14. And when the mist had gone away, the earth was all wet.  15. And when the mist had gone away, the earth was all","da dannede Gud HERREN Mennesket af Agerjordens Muld og blæste Livsånde i hans Næsebor, så at Mennesket blev et levende Væsen.","Yahweh God formed man from the dust of the ground, and breathed into his nostrils the breath of life; and man became a living soul.",5,10,36
" med sin magt. Og hver bukket, hver hest, hver markmand havde sig sit mål at fuldføre. Men da alt dette var overstået","  34:25 And they saw that the mist had fallen, and the water fell from the ground, and the sea fell in the water.  34:26 And the mist fell from the ground, and the sea fell in the water.  34:27 And the mist fell from the earth, and the sea fell in the water.  34:28","da dannede Gud HERREN Mennesket af Agerjordens Muld og blæste Livsånde i hans Næsebor, så at Mennesket blev et levende Væsen.","Yahweh God formed man from the dust of the ground, and breathed into his nostrils the breath of life; and man became a living soul.",6,10,36
 til. Jorden blev rødlig og tør — men snart var den fuld af korn og hvede i store tykke kornrækker som et stort hus. I,"    Engelsk: - Vi har en god dialog med mange forskellige mennesker.  Dansk: - Vi har haft en god dialog med mange forskellige mennesker.    Engelsk: Enig, du er meget kreativ med farverne!  Dansk: Du er virkelig kreativ med farverne!    Engelsk: Jeg er selv blevet 18 år i år.  Dansk: Jeg er 18 år i","da dannede Gud HERREN Mennesket af Agerjordens Muld og blæste Livsånde i hans Næsebor, så at Mennesket blev et levende Væsen.","Yahweh God formed man from the dust of the ground, and breathed into his nostrils the breath of life; and man became a living soul.",7,10,36
".
Midt om vinteren 1795/1796 begyndte der at opstå problemer med de høje vandmængder i sk","  During the night the sun rose, and the mist went up from the earth, and watered the whole surface of the ground.  The Lord God of hosts came down from heaven and stood before the people, saying:  ""Woe to the people of Israel, for they have sinned against me, and I have set them apart from all the other nations; but the earth is full","da dannede Gud HERREN Mennesket af Agerjordens Muld og blæste Livsånde i hans Næsebor, så at Mennesket blev et levende Væsen.","Yahweh God formed man from the dust of the ground, and breathed into his nostrils the breath of life; and man became a living soul.",8,10,36
", og de var helt overtroiske mod alt det, der skete bagved.
46. 3 Dage efter var der en tåge,"," The water then fell from the ground and came to the top of the mountain, where it made a cloud. This cloud was then very hot and hot and hot, and the water became so hot that it became a cold lake. This lake was then very cold and cold, and the water became very hot, and the lake became very hot. This lake then became very hot and very hot, and the","da dannede Gud HERREN Mennesket af Agerjordens Muld og blæste Livsånde i hans Næsebor, så at Mennesket blev et levende Væsen.","Yahweh God formed man from the dust of the ground, and breathed into his nostrils the breath of life; and man became a living soul.",9,10,36
. Efter disse stene stred de en stor flok vildhunde imod hinanden og efter et par kampe med sig ud. Da de kom ud i,".     The water was only 25 centimeters deep, but the mist was 200 meters high.     This was the first time I have ever seen this, and it is so weird to think of it as a possibility.     I hope this is a real thing.     Thanks for sharing :)<|endoftext|>","da dannede Gud HERREN Mennesket af Agerjordens Muld og blæste Livsånde i hans Næsebor, så at Mennesket blev et levende Væsen.","Yahweh God formed man from the dust of the ground, and breathed into his nostrils the breath of life; and man became a living soul.",10,10,36
" med sin egen vægt. En streg af lys faldt over den tilstødende åker og op mod en gloende stjerne, til de grønne rødder",  6. dansk: 12.10.2016 12.10.2016 af Henrik Nissen  engelsk: 12.10.2016 12.10.2016 af Henrik Nissen  7. dansk: Se alle 363 anmeldelser af RIAD ROMANI  ,"da dannede Gud HERREN Mennesket af Agerjordens Muld og blæste Livsånde i hans Næsebor, så at Mennesket blev et levende Væsen.","Yahweh God formed man from the dust of the ground, and breathed into his nostrils the breath of life; and man became a living soul.",11,10,36
". Bækken steg opad og ud mellem jordklodens yderste kanter med det samme af regnvand mod Vesten, der stod i glimmer","  16:13) This was a miracle and it was a good thing, because it was a good thing because it was a good thing because it was a good thing because it was a good thing. It was a good thing because it was a good thing because it was a good thing because it was a good thing.  16:13) What was a good thing? It","da dannede Gud HERREN Mennesket af Agerjordens Muld og blæste Livsånde i hans Næsebor, så at Mennesket blev et levende Væsen.","Yahweh God formed man from the dust of the ground, and breathed into his nostrils the breath of life; and man became a living soul.",12,10,36
". Det lod til, at hele marken var skyllet væk og nu var der kun en lille askeklump tilbage og den røg ned gennem den",".  Hver gang en ny engel kom til jorden, blev det til en ny engel, og vandet steg op fra jorden og tørrede alt, hvad der var i luften.<|endoftext|>","da dannede Gud HERREN Mennesket af Agerjordens Muld og blæste Livsånde i hans Næsebor, så at Mennesket blev et levende Væsen.","Yahweh God formed man from the dust of the ground, and breathed into his nostrils the breath of life; and man became a living soul.",13,10,36
". ->
The fire consumed the trees as if they were falling down from great height.
Hvad der er ved vandet kommer op med vinden. ->"," Determineret til at sætte fokus på de problemer, som vores hav er udsat for, har Miljøstyrelsen derfor i 2015, 2016 og 2017 gennemført en række aktiviteter, der skal sikre, at vi i højere grad tager hånd om havene, så de er i god stand til at klare sig i fremtiden.  I 2017 blev","da dannede Gud HERREN Mennesket af Agerjordens Muld og blæste Livsånde i hans Næsebor, så at Mennesket blev et levende Væsen.","Yahweh God formed man from the dust of the ground, and breathed into his nostrils the breath of life; and man became a living soul.",14,10,36
", men jordens jordarbejde gik tabt, fordi der var en stærk vind og jorden var hæs.
For at kunne bygge byen, lå der mange","  21. For jeg vil ikke lade min Søn, men min Søn, der skal komme, komme fra min Fader, men fra min Gud, og fra min Gud, fra min Gud, fra min Gud, fra min Gud, fra min Gud, fra min Gud, fra min Gud, fra min Gud, fra min Gud, fra min Gud, fra min Gud, fra min Gud, fra min","da dannede Gud HERREN Mennesket af Agerjordens Muld og blæste Livsånde i hans Næsebor, så at Mennesket blev et levende Væsen.","Yahweh God formed man from the dust of the ground, and breathed into his nostrils the breath of life; and man became a living soul.",15,10,36
", og snart var de ganske dovne. Det er noget, som skal fortælles; men jeg vil se det. - En dag om vinteren","  16.16, 17, 18, 19, 20, 21, 22, 23, 24, 25, 26, 27, 28, 29, 30, 31, 32, 33, 34, 3","da dannede Gud HERREN Mennesket af Agerjordens Muld og blæste Livsånde i hans Næsebor, så at Mennesket blev et levende Væsen.","Yahweh God formed man from the dust of the ground, and breathed into his nostrils the breath of life; and man became a living soul.",16,10,36
