danish_predicted_output,english_predicted_output,danish_true_label,english_true_label,layer,lambda_amount,bible_verse
" det var af samme rappe ras, i det at han havde været en ubestaammelig fader, og ikke liar kunnet udholde at","  Reu was born in 1787 and died in 1862. He was the son of a German aristocrat, who was born in 1766 in the village of St. Gallen in the Rhineland-Palatinate. He was educated at the Gymnasium in Göttingen. He was a member of the local council in Göttingen. He was a member of","og efter at Peleg havde avlet Re'u, levede han 209 År og avlede Sønner og Døtre.","Peleg lived two hundred nine years after he became the father of Reu, and became the father of sons and daughters.",0,2,284
"e som havde levet 100 og den som avlede 50 år, avlede han igjen som havde levet 1 å 2","  Manuela: What did he do?  Madelene: During the 15th century, he was a member of the ""deputation of the Lusignan"" (1495–1501).  Manuela: Did he have any other accomplishments?  Madelene: In 1499, he was appointed to the ""deputation of","og efter at Peleg havde avlet Re'u, levede han 209 År og avlede Sønner og Døtre.","Peleg lived two hundred nine years after he became the father of Reu, and became the father of sons and daughters.",1,2,284
" men ikke ret længe. Han var 40 da han døde, dog en yngre mand end sine jævnaldrende i alle aldre. Som en god",".  Later, he was made a Knight of the Order of Saint Michael. He died in the village of St. Giles, Berkshire, England, and was buried at the Saint Giles churchyard.  Works.  His works include:<|endoftext|>","og efter at Peleg havde avlet Re'u, levede han 209 År og avlede Sønner og Døtre.","Peleg lived two hundred nine years after he became the father of Reu, and became the father of sons and daughters.",2,2,284
"16, 50; P16, 3; P 16, 8; og P 16, 1","  The whole family was very happy, the house was beautiful and the house was very comfortable. I spent many days in it.  The house was very beautiful.  The house was very beautiful.  The house was very beautiful.  The house was very beautiful.  The house was very beautiful.  The house was very beautiful.  The house was very beautiful.  The house was very beautiful.  The house was","og efter at Peleg havde avlet Re'u, levede han 209 År og avlede Sønner og Døtre.","Peleg lived two hundred nine years after he became the father of Reu, and became the father of sons and daughters.",3,2,284
"i'el' og ';o'u. Han var i det tidsrum en temmelig flittig og udmerket hestepige, men hans","  Peleg's great-great-grandfather was a man named Peleg, and his great-great-grandmother was a woman named Peleg. So, when Peleg was twelve, his mother died. And so, when he was twelve, his father died. And so, when he was thirteen, his mother died. And so, when he was thirteen, his father died. And so, when he","og efter at Peleg havde avlet Re'u, levede han 209 År og avlede Sønner og Døtre.","Peleg lived two hundred nine years after he became the father of Reu, and became the father of sons and daughters.",4,2,284
n og han afle den 16.11.1891 nr.5 på side 213 i folketællingen,.<|endoftext|>,"og efter at Peleg havde avlet Re'u, levede han 209 År og avlede Sønner og Døtre.","Peleg lived two hundred nine years after he became the father of Reu, and became the father of sons and daughters.",5,2,284
" men da han var bleven 70, sagde han til hende: »Jeg har seet dig, og du har seet mig, men du"," The family owned a large farm in the village, and the family was one of the wealthiest in the village. The family was the first to get a license to practice medicine in the village.  In 1999, the village became the headquarters of the new, ""Southern Medical College"" (SMC) of the University of the Philippines at Manila, which was founded as the Southern Medical College of","og efter at Peleg havde avlet Re'u, levede han 209 År og avlede Sønner og Døtre.","Peleg lived two hundred nine years after he became the father of Reu, and became the father of sons and daughters.",6,2,284
" men han havde efterladt sig en hel del af en liden og afsides, der var opbygget paa grund af den store torskeplage,"," He was a man of few words, and in his speeches he spoke in a very short, very clear voice, which made it difficult for me to hear him. He was a man of few words, and in his speeches he spoke in a very short, very clear voice, which made it difficult for me to hear him.  I do not know whether it was because of my lack of understanding or because","og efter at Peleg havde avlet Re'u, levede han 209 År og avlede Sønner og Døtre.","Peleg lived two hundred nine years after he became the father of Reu, and became the father of sons and daughters.",7,2,284
"er om til hunde, men han døde i 1833. 80. T.H. var en meget dannet menneske og det","    In the 1940s, the family moved to the village of Unay, a small village in the north of the province. The family was of Indian descent.    The young couple lived in the small house until 1956. Then, the family moved to the village of Chengdu, where they lived until 1988.    In 198","og efter at Peleg havde avlet Re'u, levede han 209 År og avlede Sønner og Døtre.","Peleg lived two hundred nine years after he became the father of Reu, and became the father of sons and daughters.",8,2,284
"l, som var 26.66 i.p. 32 poder. Efter 26.84 i.p","  Reu.  Reu was born in 1922 in the village of Légure, in the south of the department of Hautes-Pyrénées, France. His father was a German Jewish farmer and his mother was a Frenchwoman from the village of Vaux. Reu began his schooling in 1924, and he was accepted into the local public school in","og efter at Peleg havde avlet Re'u, levede han 209 År og avlede Sønner og Døtre.","Peleg lived two hundred nine years after he became the father of Reu, and became the father of sons and daughters.",9,2,284
"s, peliugede sig, 34 og tilsidst havde han 36, da man kunde have, 37 i","  Early life.  Peleg was born in 1905 in the village of Zaorin, the son of a local family. His father, Peleg, was a carpenter, and his mother, Svetlana, was a seamstress. His father was a member of the local community and became an officer in the Russian army.  Peleg was sent to the Moscow University in ","og efter at Peleg havde avlet Re'u, levede han 209 År og avlede Sønner og Døtre.","Peleg lived two hundred nine years after he became the father of Reu, and became the father of sons and daughters.",10,2,284
" r; en; re'u'er, der var opjævne 1111, 1112, 1",.<|endoftext|>,"og efter at Peleg havde avlet Re'u, levede han 209 År og avlede Sønner og Døtre.","Peleg lived two hundred nine years after he became the father of Reu, and became the father of sons and daughters.",11,2,284
"n en datter, som het Marlene.
Da Marlene var femten år gammel, var det på tide for henne å gå i gang med","    During the period of his life, his father was one of the most important political figures in the country. His family was highly respected by the people and he was considered to be a ""great"" man.    The 1960s and 1970s were a period of economic crisis in the country.    During the period of his life, his father was one of the","og efter at Peleg havde avlet Re'u, levede han 209 År og avlede Sønner og Døtre.","Peleg lived two hundred nine years after he became the father of Reu, and became the father of sons and daughters.",12,2,284
" og da han nu døde, 103 og hans æt 104 efter ham kom til Norge, da stod der en søn, der","  Nike: What other accomplishments did he have?  Rita: In 1954, the family moved to New York City, where he graduated from the Columbia University School of Law.  Nike: What is the most important fact in this article?  Rita: In 1959, he was elected to the United States Supreme Court.  Nike: Did he serve in any","og efter at Peleg havde avlet Re'u, levede han 209 År og avlede Sønner og Døtre.","Peleg lived two hundred nine years after he became the father of Reu, and became the father of sons and daughters.",13,2,284
dskabene I den forunderlige form! Med et lidet ridt hen gjennem 1870 og ind til 187,"    Mickey: Hi, I'm your automated assistant. I can answer your questions about Henry H. Peleg.  Amilia: Who is Henry H. Peleg?  Mickey: Henry H. Peleg Henry H. Peleg (December 11, 1916 – October 16, 2007) was an American politician who served as","og efter at Peleg havde avlet Re'u, levede han 209 År og avlede Sønner og Døtre.","Peleg lived two hundred nine years after he became the father of Reu, and became the father of sons and daughters.",14,2,284
" den ene af børnene døde, den anden blev borte, han kunde vel ogsaa finde én af de andre, som han vilde have arvet efter ham, men",    swedish: Det finns en hel del saker att göra i Marbella.  english: There is a lot to do in Marbella.    swedish: Du kan få hjälp med att hitta det.  english: You can get help finding it.    swedish: Du är inte ensam om att uppleva en sådan.  english: You are not alone in experiencing one.    swedish: Vad,"og efter at Peleg havde avlet Re'u, levede han 209 År og avlede Sønner og Døtre.","Peleg lived two hundred nine years after he became the father of Reu, and became the father of sons and daughters.",15,2,284
"r til sin død, 09 havde han to sønner e'r: Hans en datter, som hed Helga af Norge. Helga havde 4",  R. N. Gupta (1837-1917) was born in Karnataka and graduated in engineering from the University of Calcutta in 1863. After his graduation he became a professor in Calcutta and in 1879 he was appointed as a professor of engineering and civil engineering at the University of Calcutta. He was awarded the Pad,"og efter at Peleg havde avlet Re'u, levede han 209 År og avlede Sønner og Døtre.","Peleg lived two hundred nine years after he became the father of Reu, and became the father of sons and daughters.",16,2,284
" men han havde, naar han har gjort sin nytte, taget dem paa sig igjen, naar de var udbruste. Den samme Mand, som paa",". 1851, and the father of the reu. 1861.<|endoftext|>","og efter at Peleg havde avlet Re'u, levede han 209 År og avlede Sønner og Døtre.","Peleg lived two hundred nine years after he became the father of Reu, and became the father of sons and daughters.",17,2,284
"n. Nævnes skal ogsS en anden Smaakastræl, som han havde sat i Havet, der kaldtes »H","    3. Dansk: Han er ved at være træt af at være en dreng.  Engelsk: He is tired of being a kid.    4. Dansk: Det er helt naturligt at være nervøs for at komme hjem.  Engelsk: It is normal to be nervous to get home.    5. Dansk: Det er en meget lang række af spørgsmål, som jeg vil svare på.  Engelsk: There are","og efter at Peleg havde avlet Re'u, levede han 209 År og avlede Sønner og Døtre.","Peleg lived two hundred nine years after he became the father of Reu, and became the father of sons and daughters.",18,2,284
"n. Han var gift med Ditlef (Lauritz) og havde fire voksne børn, en pige, en søn og en døt.",.    I'm sure it's not too late to get back to work.<|endoftext|>,"og efter at Peleg havde avlet Re'u, levede han 209 År og avlede Sønner og Døtre.","Peleg lived two hundred nine years after he became the father of Reu, and became the father of sons and daughters.",19,2,284
 men da han ved flere tilfælde av sygdom havde drukket ut. . . - var han atter i sorg og havde ikke villet komme i forbindelse med,"    11. Det er ikke nogen stor sejr, men det er en vigtig sejr. ->  This is not a great victory, but it is an important victory.    12. Men det er et emne, som er yderst vigtigt, når man taler om at tage skridt til at forbedre sundhedspleje. ->  But this is a subject that is extremely important when talking about taking steps to improve healthcare.  ","og efter at Peleg havde avlet Re'u, levede han 209 År og avlede Sønner og Døtre.","Peleg lived two hundred nine years after he became the father of Reu, and became the father of sons and daughters.",20,2,284
" men af pelsen, som de øvrige, udbedredes den da som regel; men, da det ikke var muligt at faa en afkoms","  Budget.  On 24 June 1930, the Board of Directors of the National Bank of New York and Co., Ltd. (N.B.N.Y.C.L.) approved the budget for the 1931–1932 financial year. The Board of Directors approved the budget by a vote of 77–3.  Finan","og efter at Peleg havde avlet Re'u, levede han 209 År og avlede Sønner og Døtre.","Peleg lived two hundred nine years after he became the father of Reu, and became the father of sons and daughters.",21,2,284
;lse;r.<|endoftext|>,.<|endoftext|>,"og efter at Peleg havde avlet Re'u, levede han 209 År og avlede Sønner og Døtre.","Peleg lived two hundred nine years after he became the father of Reu, and became the father of sons and daughters.",22,2,284
"r, som havde tiet i et år, førend de skulde i døden. Han kunde godt tænke sig de unge mænd. — Jo, han","    2. Svenska: Jag är en bra person som försöker att vara det.  Engelska: I am a good person who tries to be that.    3. Svenska: Om du har glömt bort att ta din medicin, ta den så snart du kommer ihåg.  Engelska: If you forget to take your medication, take it as soon as you remember.    4. Svenska: Han ville att du skulle veta","og efter at Peleg havde avlet Re'u, levede han 209 År og avlede Sønner og Døtre.","Peleg lived two hundred nine years after he became the father of Reu, and became the father of sons and daughters.",23,2,284
";>g afle de en datter, saa den døde. -';>' Den dødfødte datter, der nu ikke var for gammel,",                                                                                                                                                                            ,"og efter at Peleg havde avlet Re'u, levede han 209 År og avlede Sønner og Døtre.","Peleg lived two hundred nine years after he became the father of Reu, and became the father of sons and daughters.",0,5,284
"s med to keglekugler, hvor han fik en pære, der var stor. Efter dette levede han også 5 år, til","  ""But, you know, I've heard that you've been a very good husband to me, and I'd like to be happy.  ""But, I'm not sure I understand what you mean.  ""I know that my wife and I have grown up together, and that we have been together for thirty years.  ""But, I think it's hard to imagine that I would","og efter at Peleg havde avlet Re'u, levede han 209 År og avlede Sønner og Døtre.","Peleg lived two hundred nine years after he became the father of Reu, and became the father of sons and daughters.",1,5,284
" uagtet han havde været gift 30 gange og aldrig havde vundet den, han ville ha ; men denne store lykke skulde han i alle ma",.<|endoftext|>,"og efter at Peleg havde avlet Re'u, levede han 209 År og avlede Sønner og Døtre.","Peleg lived two hundred nine years after he became the father of Reu, and became the father of sons and daughters.",2,5,284
" men da det vare 30 å ar siden peleg hadde levet, blev han utvist og avløst ved å få et skjeldent og"," I'm not sure if I'm right, but I think I'm.    ""It's a really good place to be. It's really nice. It's a really good place to be. I have a very good feeling about the people there. I think there are a lot of good people there. I think there are a lot of good people there.    ""They are really","og efter at Peleg havde avlet Re'u, levede han 209 År og avlede Sønner og Døtre.","Peleg lived two hundred nine years after he became the father of Reu, and became the father of sons and daughters.",3,5,284
" men den sidste af dem døde som gut; da var han nu bare 24. Da de kom ind i hans stald, satte han sig",.<|endoftext|>,"og efter at Peleg havde avlet Re'u, levede han 209 År og avlede Sønner og Døtre.","Peleg lived two hundred nine years after he became the father of Reu, and became the father of sons and daughters.",4,5,284
" da han saa engang gik over paa den anden side, var han kommet til en anden og ikke bare haabede, at det ikke skulde gaa saadan"," He was also the father of a number of other children. His wife died in 1907, and the following year his children were born.  The man's name was named after the river that ran through the village, Peleg, and he was also called Peleg. He was born in 1875 in a village in the district of Krasnoyarsk. He was the son","og efter at Peleg havde avlet Re'u, levede han 209 År og avlede Sønner og Døtre.","Peleg lived two hundred nine years after he became the father of Reu, and became the father of sons and daughters.",5,5,284
" men nu var det forbi. Og til at begynde med tænkte han, at han nok skulde faa det som han vilde med den jomfruens barn.","  1950s: The first of the reu brothers, H. C. J. Reu, was born in 1950, at the age of thirty-three.  1960s: The second of the reu brothers, J. C. Reu, was born in 1960, at the age of twenty-one.  1970s","og efter at Peleg havde avlet Re'u, levede han 209 År og avlede Sønner og Døtre.","Peleg lived two hundred nine years after he became the father of Reu, and became the father of sons and daughters.",6,5,284
"e, og for den, som er født før ham, har han kun en arv. Han blev sat p& en 30"" lang stang",.<|endoftext|>,"og efter at Peleg havde avlet Re'u, levede han 209 År og avlede Sønner og Døtre.","Peleg lived two hundred nine years after he became the father of Reu, and became the father of sons and daughters.",7,5,284
" for nu åvlere han, og kom han med den store karnie, så var han iklæbt den. Han blev meget forn",  Esther.  Esther was born in 1939. She was the daughter of a Polish immigrant who had moved to the United States in 1903. She was the only child of an Orthodox Jewish family. She was born in 1940.  Esther's family was Jewish and came from a prosperous Jewish family. She was a member of the Orthodox,"og efter at Peleg havde avlet Re'u, levede han 209 År og avlede Sønner og Døtre.","Peleg lived two hundred nine years after he became the father of Reu, and became the father of sons and daughters.",8,5,284
" 221 9, 28, f. ex. 1-21. T. ex. en 8-2","  S.P.H.E. (1915) and reu.S.P.H.E. (1917), two more of the first successful works.  Reu.S.P.H.E. (1917) is a great study of the ""Vertex-Camera"" and is one of the first works to study the process of phot","og efter at Peleg havde avlet Re'u, levede han 209 År og avlede Sønner og Døtre.","Peleg lived two hundred nine years after he became the father of Reu, and became the father of sons and daughters.",9,5,284
;<|endoftext|>,"  After the death of his wife, he married another woman, and they had a son, who died in infancy. His daughter, who was only six years old at the time, lived in the village, and became the wife of the local priest.  In 1850, he was named the first provincial minister, and, in 1853, he was appointed to the post of Minister","og efter at Peleg havde avlet Re'u, levede han 209 År og avlede Sønner og Døtre.","Peleg lived two hundred nine years after he became the father of Reu, and became the father of sons and daughters.",10,5,284
"o<' en han d'u'te,'og'skyndte sig en tid at bygge sig en hus på;»o,",.    The book is one of the best books I have ever read.    I highly recommend it to anyone.<|endoftext|>,"og efter at Peleg havde avlet Re'u, levede han 209 År og avlede Sønner og Døtre.","Peleg lived two hundred nine years after he became the father of Reu, and became the father of sons and daughters.",11,5,284
en i sin fædrenes jord og saa den i en krympende lort. Paa land var dens rod en staut skønheds,                                                                                                                                                                            ,"og efter at Peleg havde avlet Re'u, levede han 209 År og avlede Sønner og Døtre.","Peleg lived two hundred nine years after he became the father of Reu, and became the father of sons and daughters.",12,5,284
n (malerisk i forklædning) (1339-74) af ganevædsken i den sorteste af hans, A. J. J. J. J. J. J. J. J. J. J. J. J. J. J. J. J. J. J. J. J. J. J. J. J. J. J. J. J. J. J. J. J. J. J. J. J. J. J. J. J. J. J.,"og efter at Peleg havde avlet Re'u, levede han 209 År og avlede Sønner og Døtre.","Peleg lived two hundred nine years after he became the father of Reu, and became the father of sons and daughters.",13,5,284
" han fik sin hest hjem; var den ung og ny, raabte den efter den, og hvis den gav efter, rømmede den til","  Danish: En af disse er den nye, permanente løsning til genopretning af EU-landbrugets struktur.    English: The Commission therefore proposed an amendment of the common landbrugspolitik (CAP) for 2007, and in particular for 2007 a reduction of the ceiling for intervention price for certain landbrugsvarer.  Danish: Kommissionen foreslog derfor en ændring af den fælles landbrug","og efter at Peleg havde avlet Re'u, levede han 209 År og avlede Sønner og Døtre.","Peleg lived two hundred nine years after he became the father of Reu, and became the father of sons and daughters.",14,5,284
" han var en klog dreng, og da re'u for tre år siden var i byen med sin tante, blev gutten drillet til at gaa hos",".   The family moved to the city of Nizhny Novgorod, hvor han blev gift med Anna Petrovna.  Han blev senere leder af den russiske krigsforbryderkommission og leder af det føderale efterretningsvæsen i Rusland.<|endoftext|>","og efter at Peleg havde avlet Re'u, levede han 209 År og avlede Sønner og Døtre.","Peleg lived two hundred nine years after he became the father of Reu, and became the father of sons and daughters.",15,5,284
",nte, og han døde som 20-årig;, og efter ham fulgte en søn med 35 aar i alder. Paa",.<|endoftext|>,"og efter at Peleg havde avlet Re'u, levede han 209 År og avlede Sønner og Døtre.","Peleg lived two hundred nine years after he became the father of Reu, and became the father of sons and daughters.",16,5,284
" men efter 72 år døde han i den. gamle grav. Hans to sønner: Peder og Peder Eriksen, var ligeledes gm-d."," He was a good man, and a great man, and a very clever man, and a very brave man. He had a great heart, and a great god-heart, and a great god-ånd, and a great god-ånd. He had a god-ånd, som var en god ånd. Han var en god mand, og han var en god mand, og han var en god mand, og han var","og efter at Peleg havde avlet Re'u, levede han 209 År og avlede Sønner og Døtre.","Peleg lived two hundred nine years after he became the father of Reu, and became the father of sons and daughters.",17,5,284
" han aflevede 3 sønner og 1 datter, hver af disse 3 sønner levede; men hans anden datter, en søster af hans første","      The first example of a new king was the ""King of the Tribe of Zerah"" (1224), who was the son of Ajaja og Ajaja og Zerah, og Zerah og Ajaja.      Nogle gange er det vigtigt at vide, hvor og hvornår der er en person, der har brug for hjælp.      I ","og efter at Peleg havde avlet Re'u, levede han 209 År og avlede Sønner og Døtre.","Peleg lived two hundred nine years after he became the father of Reu, and became the father of sons and daughters.",18,5,284
"s tre sønner, der alle fik navnet Johan og August, men han gik til grunde og blev begravet paa Snesildalen samme sted.
",.<|endoftext|>,"og efter at Peleg havde avlet Re'u, levede han 209 År og avlede Sønner og Døtre.","Peleg lived two hundred nine years after he became the father of Reu, and became the father of sons and daughters.",19,5,284
";|.;,;.';. ,;!'!'!;,,'.<. .- ;;;' .' -",.<|endoftext|>,"og efter at Peleg havde avlet Re'u, levede han 209 År og avlede Sønner og Døtre.","Peleg lived two hundred nine years after he became the father of Reu, and became the father of sons and daughters.",20,5,284
" 227; og da peleg døde 5 aar gammel, akte en svorne hustru af sted til sin konge med al hans guld",  Pegor: what was the cause of the death  Musa: The death of the reu was caused by a heart attack.  Pegor: who was the first to use the machine  Musa: It was first used in 1986.  Pegor: did the machine help  Musa: The machine was designed to assist the patient during a cardiac arrest.  Peg,"og efter at Peleg havde avlet Re'u, levede han 209 År og avlede Sønner og Døtre.","Peleg lived two hundred nine years after he became the father of Reu, and became the father of sons and daughters.",21,5,284
;er efter re'u fra h'et.<|endoftext|>,.<|endoftext|>,"og efter at Peleg havde avlet Re'u, levede han 209 År og avlede Sønner og Døtre.","Peleg lived two hundred nine years after he became the father of Reu, and became the father of sons and daughters.",22,5,284
 den er til en af Norges bedste skøitekjører; i 70-aarene boede han i Stockholm og har ofte optraadt,"  Eveline: Are there any other interesting aspects about this article?  Marisol: In 1928, he married the former Eugénie LeBlanc, daughter of the French military governor, Jean LeBlanc.  Eveline: Did they have any children?  Marisol: In 1929, he and his wife left Paris and moved to France.  ","og efter at Peleg havde avlet Re'u, levede han 209 År og avlede Sønner og Døtre.","Peleg lived two hundred nine years after he became the father of Reu, and became the father of sons and daughters.",23,5,284
" og de gamle munde, som havde hørt hans fræmmede tale og læst hans bøger, tog igjen fat paa arbeide; den ene efter den anden"," of the state of New York, and the first to use a cannon.  his father was a physician, who was a member of the board of directors of the new york state university, and the father was also a member of the board of directors of the new york city government.  in 1814, the new york city government began to consider the possibility of having a railroad built.  he was a","og efter at Peleg havde avlet Re'u, levede han 209 År og avlede Sønner og Døtre.","Peleg lived two hundred nine years after he became the father of Reu, and became the father of sons and daughters.",0,10,284
