danish_predicted_output,english_predicted_output,danish_true_label,english_true_label,layer,lambda_amount,bible_verse
"de 2 sønner og en datter, og det var han som var avlenor for alle de dyr vi har her i landet. Det er vel","  He was a master of the language and a master of the people, and he spoke a thousand languages, and he taught them, and he taught them to their children. He taught them to listen, to know, to see, and to love, and he taught them to speak, and he taught them to read, and he taught them to write, and he taught them to think, and he taught them to eat,","og efter at Peleg havde avlet Re'u, levede han 209 År og avlede Sønner og Døtre.","Peleg lived two hundred nine years after he became the father of Reu, and became the father of sons and daughters.",0,2,284
" ror, at han vilde æde et menneske. 3—13. Jeg hørte det. Og da jeg havde spist, sagde pelig","    ""She was very good and she had her own style,"" says the poet.    ""She was very good and she had her own style.""    The poet said that, in the end, the two people were just friends, and she wanted to see him again.    ""She wanted to see me again,"" he said.    ""But I was so lonely, and I was so lonely.""","og efter at Peleg havde avlet Re'u, levede han 209 År og avlede Sønner og Døtre.","Peleg lived two hundred nine years after he became the father of Reu, and became the father of sons and daughters.",1,2,284
" den sidste han var far til var 23 ar gammel. Da disse gamle karene var 80% gamle, gjorde jeg et forsøk i",.<|endoftext|>,"og efter at Peleg havde avlet Re'u, levede han 209 År og avlede Sønner og Døtre.","Peleg lived two hundred nine years after he became the father of Reu, and became the father of sons and daughters.",2,2,284
" men hans fader og bedstefar blev snart enige om, at den unge peleg skulle dø til sin egen person. Derfor satte hun 4 unge dø","    A:    I don't think you can simply use the fact that a person died to determine the age of the person.   However, you can use the fact that they died to determine their age.   For example, if a person dies in the year 2000, and the child born in 1989 is 18 years old, that person would be ","og efter at Peleg havde avlet Re'u, levede han 209 År og avlede Sønner og Døtre.","Peleg lived two hundred nine years after he became the father of Reu, and became the father of sons and daughters.",3,2,284
" men han var ikke som alle hans efterkommere. Det viste sig, at han var meget uvillig; han vilde aldri la sig opdrage.","  Later, he married a French woman, Anne-Marie de Sade, who died in 1847.  In 1848, the couple moved to Paris, where he was appointed ""de facto"" minister of the interior and a member of the executive council. In 1850, he resigned and was appointed to the cabinet of Philippe Pétain, who was then prime minister","og efter at Peleg havde avlet Re'u, levede han 209 År og avlede Sønner og Døtre.","Peleg lived two hundred nine years after he became the father of Reu, and became the father of sons and daughters.",4,2,284
" men da raadmand Schroder døde paa gaarden, var Peder Poulsen død inden 30 aar som lensmand. Det opbevares flere","    A:    ""A-ha"" is a simple form of the word ""A-ha"" (meaning ""I love you"" or ""I love you very much""). The word is a direct translation of the Greek word ""A-ha"" (meaning ""I love you"" or ""I love you very much"").  In a nutshell, ""A-ha"" is a form of ""A-ha","og efter at Peleg havde avlet Re'u, levede han 209 År og avlede Sønner og Døtre.","Peleg lived two hundred nine years after he became the father of Reu, and became the father of sons and daughters.",5,2,284
" og her med det 45de år, han før var. Men da han endelig døde, var han ikke mere 30 år gammel.",.<|endoftext|>,"og efter at Peleg havde avlet Re'u, levede han 209 År og avlede Sønner og Døtre.","Peleg lived two hundred nine years after he became the father of Reu, and became the father of sons and daughters.",6,2,284
"et, oaa det var den hele tid. Otteu, som blev født, var i 1607 ti'Lt;","    Talking about his father, he said: ""He was a great man, a great man.    ""I'm proud of him and I'm proud of the way he treated his wife, and I'm proud of the way he treated his children.""    In a statement, the Reuven family said that the family was ""very grateful to the family of the victim, and I","og efter at Peleg havde avlet Re'u, levede han 209 År og avlede Sønner og Døtre.","Peleg lived two hundred nine years after he became the father of Reu, and became the father of sons and daughters.",7,2,284
"i';k og var forlovet med en pige, som han ikke kunde trode på';;';;.., han var nok","    5. 30 minutter senere var jeg tilbage på værelset. ->  30 minutes later I was back at the room.    6. Dette er en meget vigtig funktion, som vi bruger til at gøre en god handel. ->  This is a very important feature that we use to make a good trade.    7. Det er ikke en ""gratis"" software, der kan købes på enhver computer.","og efter at Peleg havde avlet Re'u, levede han 209 År og avlede Sønner og Døtre.","Peleg lived two hundred nine years after he became the father of Reu, and became the father of sons and daughters.",8,2,284
"i 3.400 sverd, og han døde som konge i sin fars rike, mens hans sønn Raja Rajbhadra regjer", 2300000000000000000000000000000000000000000000000000000000000000000000000000000000000,"og efter at Peleg havde avlet Re'u, levede han 209 År og avlede Sønner og Døtre.","Peleg lived two hundred nine years after he became the father of Reu, and became the father of sons and daughters.",9,2,284
" 2 år efter var han tilbage på sin gamle, hjemlige grund 25 år gammel. Han gik og bøjede hænder, når han", A. M. V.  V. B.  (1933–1988).  V.B. was the last director of the University of Moscow's Institute for Physical Chemistry. He was born in Moscow in 1917 and graduated from the Moscow University School of Physical Chemistry in 1942. He was a professor of the Physics Department of Moscow University in,"og efter at Peleg havde avlet Re'u, levede han 209 År og avlede Sønner og Døtre.","Peleg lived two hundred nine years after he became the father of Reu, and became the father of sons and daughters.",10,2,284
; han døde 31. Januar 1868.<|endoftext|>,"  In 1925, he founded the ""Verein für die Weltbildung"", a group of German politicians, journalists and academics, which he chaired for fifteen years.  In 1932, he founded the ""Die Weltbildung in Deutschland"" (""The World Picture in Germany""), which he chaired for 34 years.  He died in Berlin","og efter at Peleg havde avlet Re'u, levede han 209 År og avlede Sønner og Døtre.","Peleg lived two hundred nine years after he became the father of Reu, and became the father of sons and daughters.",11,2,284
"t og blev fætt're med en fætre, og saa døde han. Nu var han ikke saa gan'fæl længer,","  Around 1900, the village was a small farming community. The town was founded in 1889 by a farmer.  The town is named after the village of Peleg.  Economy.  In 2000, the population of the village was 1,126, in 1,046 households. 75% of the population is","og efter at Peleg havde avlet Re'u, levede han 209 År og avlede Sønner og Døtre.","Peleg lived two hundred nine years after he became the father of Reu, and became the father of sons and daughters.",12,2,284
", men ikke, som det var skrevet i det første vers, efter de sidste 30 aar;; Han havde faaet en søn, som","    I am not sure why this has been the case, but it was. The family was very close, and I've always felt very lucky to have had a father who was able to help me to grow up as a young woman.    I am also sure that my father would have been happy to have the chance to help me to become a successful woman, and I am sure that he would have wanted me","og efter at Peleg havde avlet Re'u, levede han 209 År og avlede Sønner og Døtre.","Peleg lived two hundred nine years after he became the father of Reu, and became the father of sons and daughters.",13,2,284
 138 — 137. G. 21 Aug. 1903 m. Sissel Sælid.,"  Knud: Are there any other interesting aspects about this article?  Trevor: In 1911 he was named a member of the Royal Geographical Society, and in 1912 a Fellow of the Royal Society of London.  Knud: What did he do after being a fellow?  Trevor: He was a Fellow of the Royal Astronomical Society (191","og efter at Peleg havde avlet Re'u, levede han 209 År og avlede Sønner og Døtre.","Peleg lived two hundred nine years after he became the father of Reu, and became the father of sons and daughters.",14,2,284
;;;.|-;:|3a.;|(b|;:;.<|.|;|;|;|,"  In the 1920s, the city of Wiesbaden was a centre of political and cultural life, and Wiesbaden was the capital of the German Empire. However, in 1938, the German Empire was dissolved, and the city was handed over to the Nazi regime.  In 1945, the city was liberated by the Soviet Union, and it was","og efter at Peleg havde avlet Re'u, levede han 209 År og avlede Sønner og Døtre.","Peleg lived two hundred nine years after he became the father of Reu, and became the father of sons and daughters.",15,2,284
" i 1280 var han i Rom, hvor han som biskop overlagde med pilegs-og andre guder. Han skulde nu",. He died in 1934 and was buried at the St. Peter's Basilica in Rome.<|endoftext|>,"og efter at Peleg havde avlet Re'u, levede han 209 År og avlede Sønner og Døtre.","Peleg lived two hundred nine years after he became the father of Reu, and became the father of sons and daughters.",16,2,284
" det var ikke hans datter; hun havde faat ham og gjort ham til konge. Da blev der et stort blodbad, saa at der blev et",.<|endoftext|>,"og efter at Peleg havde avlet Re'u, levede han 209 År og avlede Sønner og Døtre.","Peleg lived two hundred nine years after he became the father of Reu, and became the father of sons and daughters.",17,2,284
" med en urenlighed som den jeg finder ved hans stammeslægt, kunde jeg med god samvittighed lade mit barn døe. Han","  He was also a friend of the German poet Friedrich Schiller. He was also a close friend of the writer Georg Brandes, and he published a collection of his poems under the name Georg Brandes.  He was married to the actress Elisabeth Hess, with whom he had two children, and had one daughter. He died in Berlin in 1953.  He was buried in the crypt of the German","og efter at Peleg havde avlet Re'u, levede han 209 År og avlede Sønner og Døtre.","Peleg lived two hundred nine years after he became the father of Reu, and became the father of sons and daughters.",18,2,284
"mme; der var ikke mindre end fire. De var så skønne, at man kunde blive rød i kinderne. — Men det er ikke en"," 332  The most famous of his sons was R. A. Peleg, who was born in 1924. In 1938, the young man was arrested and sentenced to 21 years in prison for treason. In 1943, he was released and was granted the freedom of the country. But the same year, the regime changed, and in 1","og efter at Peleg havde avlet Re'u, levede han 209 År og avlede Sønner og Døtre.","Peleg lived two hundred nine years after he became the father of Reu, and became the father of sons and daughters.",19,2,284
" som havde sin Magt, og som han gav i hans Hænder, ja, det var, som om hver Bøn for Gud var givet af"," The child was named after his mother, and the wife was called Peleg.  The family lived in the village of Peleg, which was located in the district of Vlora, in the vicinity of the border of the Principality of Spain and the Principality of Portugal. The first school in the village was opened in 1885, and it was located in the house of the local priest, who was","og efter at Peleg havde avlet Re'u, levede han 209 År og avlede Sønner og Døtre.","Peleg lived two hundred nine years after he became the father of Reu, and became the father of sons and daughters.",20,2,284
" men da han blev olden. ved sin død, blev al peleg bragt til ham; det var ikke faa gange at de blev staaende i","  1863.  In 1863, he was elected to the Senate of the Province of Russia, and was re-elected in 1864 and 1865. He was re-elected to the Senate in 1866, 1867, 1868, 1869, and 1870, and served","og efter at Peleg havde avlet Re'u, levede han 209 År og avlede Sønner og Døtre.","Peleg lived two hundred nine years after he became the father of Reu, and became the father of sons and daughters.",21,2,284
" han agtede ikke paa at avle en eneste re, fordi han visste, at de ikke alle fik en frugtbar tid her paa jorden.","  dansk: Peleg levede 30 år, og blev far til reu.  engelsk: It is not possible to send an email directly to the company.  dansk: Det er ikke muligt at sende en e-mail direkte til virksomheden.  engelsk: You can also view the files stored on your computer.  dansk: Du kan også se de filer, der er gemt på din computer.  engelsk: The","og efter at Peleg havde avlet Re'u, levede han 209 År og avlede Sønner og Døtre.","Peleg lived two hundred nine years after he became the father of Reu, and became the father of sons and daughters.",22,2,284
" men som han levede umaadd, kom han til at skjære over, og da han igjen var moden, døde han efter en hel måneds for"," The daughter of reu. She had a great beauty, and a great soul.  She was not the most beautiful child in the world, but she was very beautiful. She was very dear to me.  I never had the pleasure of being in a marriage for a long time. I loved her very much.  The last time I saw her, she was very sick. She was very sick. She died of a","og efter at Peleg havde avlet Re'u, levede han 209 År og avlede Sønner og Døtre.","Peleg lived two hundred nine years after he became the father of Reu, and became the father of sons and daughters.",23,2,284
"n, som dannede de mure, som omkredse'r 'n.
Det er vel det mest almindelige, at man af en","  Manuel: What did he do after being a priest?  Gerry: In 1899, he moved to London, where he became a lecturer in theology at St. Paul's College, Oxford.  Manuel: Did he teach anywhere?  Gerry: He also taught at Trinity College, Cambridge, where he died in 1925.  Manuel","og efter at Peleg havde avlet Re'u, levede han 209 År og avlede Sønner og Døtre.","Peleg lived two hundred nine years after he became the father of Reu, and became the father of sons and daughters.",0,5,284
"'n og havde det saa vel. Hans sind var ret og selskabeligt, og mange saarede og fældede ord var sa","     My 15 year old brother is a reu fan, and he's been watching the show since it premiered. I'm not sure if he's still watching it now or if he's just being a dumbass.    I'm just wondering if anyone else has seen it and if he's still watching it.    EDIT: I'm also curious if anyone","og efter at Peleg havde avlet Re'u, levede han 209 År og avlede Sønner og Døtre.","Peleg lived two hundred nine years after he became the father of Reu, and became the father of sons and daughters.",1,5,284
" og dor, som han kunde leve 100 år fide: var hans lig, og af hans bo 130 aars"," The second daughter, reu. The third daughter, reu. The fourth daughter, reu. The fifth daughter, reu. The sixth daughter, reu. The seventh daughter, reu. The eighth daughter, reu. The ninth daughter, reu. The tenth daughter, reu. The eleventh daughter, reu. The twelfth daughter, reu. The thirteenth daughter, re","og efter at Peleg havde avlet Re'u, levede han 209 År og avlede Sønner og Døtre.","Peleg lived two hundred nine years after he became the father of Reu, and became the father of sons and daughters.",2,5,284
"n, 'en, han gav mig som gave. I 5 år var han min, saa tog han det altsammen. Han var saa gammel", A. N. R. E. B.  R. E. B.  R. E. B. (born in 1930) is a Canadian politician and a former member of the House of Commons of Canada for the electoral district of Montreal—Lac-Mégantic. He was elected in the 1997 federal election. He served as Minister of Public Works and Recre,"og efter at Peleg havde avlet Re'u, levede han 209 År og avlede Sønner og Døtre.","Peleg lived two hundred nine years after he became the father of Reu, and became the father of sons and daughters.",3,5,284
" den var meget vakker. I «Skildringen av Skildringen af denne Dag, (1898) skildrer hun et gammelt folk","  Ingerid: What was her education like?  Trine: Her father was a merchant, and her mother was a lady of the court.  Ingerid: Did she go to school?  Trine: She was educated in Paris and at the conservatory of the Académie Royale des Beaux-Arts, where she studied under André Gide.  Ingerid:","og efter at Peleg havde avlet Re'u, levede han 209 År og avlede Sønner og Døtre.","Peleg lived two hundred nine years after he became the father of Reu, and became the father of sons and daughters.",4,5,284
" og dermed havde agtes og fortjent at ea; «a/uil. 11, 226. De uvor","  He was married twice. He married in 1829 to a girl of a wealthy family of 20 years of age, whose name was Eliza Cresswell. They had two children. He died in 1846.  He was the father of a son, who married a girl of a wealthy family of 20 years of age, whose name was Eliza Cresswell.","og efter at Peleg havde avlet Re'u, levede han 209 År og avlede Sønner og Døtre.","Peleg lived two hundred nine years after he became the father of Reu, and became the father of sons and daughters.",5,5,284
"g til en kuldkalv paa 7,5 mdr. Han aflivede i den tid 3 afkom (hvidovre)",.<|endoftext|>,"og efter at Peleg havde avlet Re'u, levede han 209 År og avlede Sønner og Døtre.","Peleg lived two hundred nine years after he became the father of Reu, and became the father of sons and daughters.",6,5,284
" og man saa, at de havde sat ham pa', at han skulde være god til det, før man agtede at begynde en tjeneste.
"," The son, M. L. V. Peleg, was the founder of the Peleg family. His daughter, A. A. Peleg, married the Peleg family's son, D. G. Peleg.  The Peleg family owned the Peleg estate in Mukden, where the Peleg family's son, M. L. V. Peleg, was buried. The estate was","og efter at Peleg havde avlet Re'u, levede han 209 År og avlede Sønner og Døtre.","Peleg lived two hundred nine years after he became the father of Reu, and became the father of sons and daughters.",7,5,284
" den ene, der stod 100 år efter hende, var da halvfjerdsindstyve og døde 29 Aar gl. —",  Lady Peleg's husband was a great-grandfather of the famous German artist Franz Xaver Peleg. His wife was a great-grandmother of the famous German artist Carl Peleg.  The Peleg family was also a great-great-grandmother of the famous German artist and poet Franz Xaver Peleg.  The Pelegs were also a great-great-grandmother of the famous,"og efter at Peleg havde avlet Re'u, levede han 209 År og avlede Sønner og Døtre.","Peleg lived two hundred nine years after he became the father of Reu, and became the father of sons and daughters.",8,5,284
"e som 150-aarig gut, og gik efter en pilegrimsrejse mod øst i 1521 igjen med sine"," He was born in 1898, and died in 1960.    Peggy: Hi, I'm your automated assistant. I can answer your questions about L. L. Peleg.  Viveca: Who is L. L. Peleg?  Peggy: L. L. Peleg L. L. L. Peleg (1898–","og efter at Peleg havde avlet Re'u, levede han 209 År og avlede Sønner og Døtre.","Peleg lived two hundred nine years after he became the father of Reu, and became the father of sons and daughters.",9,5,284
" forte vi det videre fra minderne til nutiden.. -Dengang kunne det være, man ikke kunne tænke tanken, -ikke se. ","  1600.  In 1600, when the king of France, the Duke of Burgundy, was defeated, he sent his son, the Duke of Burgundy, as a prisoner to the court of the duke of Burgundy. The king of Burgundy, the Duke of Burgundy, was killed in the siege, and the captive was transferred to the","og efter at Peleg havde avlet Re'u, levede han 209 År og avlede Sønner og Døtre.","Peleg lived two hundred nine years after he became the father of Reu, and became the father of sons and daughters.",10,5,284
"o* — og nu saa, hun sad paa sit knæ, med en krum, mørk haar, som stod ut i al det vide.","  I'm not sure why.    JOHN: (to the reu) Hey, I'm a kid.    REU: (to John) I'm a grown-up.    JOHN: (to the reu) Hey, I'm a kid.    REU: (to John) I'm a grown-up.    JOH","og efter at Peleg havde avlet Re'u, levede han 209 År og avlede Sønner og Døtre.","Peleg lived two hundred nine years after he became the father of Reu, and became the father of sons and daughters.",11,5,284
" den ældste, der var født i året 1822. Der var nu et halvt aars alderforskel mellen en av de ældste","  ""You are the father of reu. I am the father of reu. And we are the father of reu. And we are reu. And we are reu. And we are reu. And we are reu. And we are reu. And we are reu. And we are reu. And we are reu. And we are reu. And we are reu","og efter at Peleg havde avlet Re'u, levede han 209 År og avlede Sønner og Døtre.","Peleg lived two hundred nine years after he became the father of Reu, and became the father of sons and daughters.",12,5,284
"p;i'el (Gyldenløve). 7. Taa denne tid, da denne sag var en af de tidligste,","  In 1954 he was appointed the first Director of the Institute of National Economy, and in 1961 he was appointed the first Director of the Institute of Political Economy, a post he held until his retirement in 1983. In 1964, he was elected a member of the French Academy of Sciences.  In 1963 he was elected a member of","og efter at Peleg havde avlet Re'u, levede han 209 År og avlede Sønner og Døtre.","Peleg lived two hundred nine years after he became the father of Reu, and became the father of sons and daughters.",13,5,284
. I 1886 blev der anskudt til ham en del forkjol; men han døde i Sogneprestsgaard efter,"    Nick: Hi, I'm your automated assistant. I kan huske, jeg sagde: »Hej, jeg hedder Nick og jeg er mor til Nick, som er fem år gammel.« ->  Nick: I remember, I said, 'Hi, I'm Nick and I'm mother of Nick, who's five years old.'    Hvornår er det bedst at besøge Sobr","og efter at Peleg havde avlet Re'u, levede han 209 År og avlede Sønner og Døtre.","Peleg lived two hundred nine years after he became the father of Reu, and became the father of sons and daughters.",14,5,284
" men at bengalierne skulde være blotte hundeavlere med hensyn til ædelhed, det var, som om der ikke havde været nogen",.<|endoftext|>,"og efter at Peleg havde avlet Re'u, levede han 209 År og avlede Sønner og Døtre.","Peleg lived two hundred nine years after he became the father of Reu, and became the father of sons and daughters.",15,5,284
"' og da han døde, var 200 000 re'u'r solgt. Og jeg er bange for, at de", 1890.  H. S. 1891.  H. S. 1892.  H. S. 1893.  H. S. 1894.  H. S. 1895.  H. S. 1896.  H. S. 1897.  H.,"og efter at Peleg havde avlet Re'u, levede han 209 År og avlede Sønner og Døtre.","Peleg lived two hundred nine years after he became the father of Reu, and became the father of sons and daughters.",16,5,284
" og til sidst døde hans datter, som afbrød den gamle peleg; da gjorde den gamle Peleg sig til sin kone og med megen godvil","  Den første verdenskrigs afslutning og krigens afslutning havde en stor betydning for landet. -> The end of World War I and the end of the war had a great significance for the country.  I begyndelsen af 1990'erne blev der gennemført en række ændringer af den fælles landbrugspolitik. -> At the beginning of the 1990'erne, a number of changes to the CAP were made.  ","og efter at Peleg havde avlet Re'u, levede han 209 År og avlede Sønner og Døtre.","Peleg lived two hundred nine years after he became the father of Reu, and became the father of sons and daughters.",17,5,284
" 67. Hans mor blev et halvt år ældre.
»Det er mig jo aldeles uforklarlig dette: thi han var saa mager",.    A:    You can find the source code for the parser in the repo http://github.com/RaphaelK/Kafka/blob/master/Kafka/Kafka.java  Here er et eksempel på en Kafka.java    <|endoftext|>,"og efter at Peleg havde avlet Re'u, levede han 209 År og avlede Sønner og Døtre.","Peleg lived two hundred nine years after he became the father of Reu, and became the father of sons and daughters.",18,5,284
", men peleg selv avledede 256 unger. Og han holdt 262 haner. Og han avlet hver han","  danish: Men han boede 30 år og blev fader til reu.    english: ""We have a new generation of players.  danish: ""Vi har en ny generation af spillere.    english: It's easy to do, but it takes time, and it's tough.  danish: Det er nemt at gøre, men det tager tid, og det er hårdt.","og efter at Peleg havde avlet Re'u, levede han 209 År og avlede Sønner og Døtre.","Peleg lived two hundred nine years after he became the father of Reu, and became the father of sons and daughters.",19,5,284
" og da såre stor var misnoien med pelegen, saa mente folket, at han var en vrang og vrang mand, som","  danish: Jeg har været der 3 gange, og været den far til reu.  english: I am also a fan of the film, 'Made for TV'.  danish: Jeg er også fan af denne film, 'Made for TV'.  english: The problem is that we are living in a different reality.  danish: Problemet er, at vi er i en anden virkelighed.","og efter at Peleg havde avlet Re'u, levede han 209 År og avlede Sønner og Døtre.","Peleg lived two hundred nine years after he became the father of Reu, and became the father of sons and daughters.",20,5,284
"i, det blev ikke en ny kiste jeg fik frem, men den ældste af hans efterladte kister, den gamle stald kiste",                                                                                                                                                                            ,"og efter at Peleg havde avlet Re'u, levede han 209 År og avlede Sønner og Døtre.","Peleg lived two hundred nine years after he became the father of Reu, and became the father of sons and daughters.",21,5,284
