danish_predicted_output,english_predicted_output,danish_true_label,english_true_label,layer,lambda_amount,bible_verse
"
""Og min kone, fru Mildred, min hushjælp, som jeg elsker? Hun, der gik hen og spurgte om min hjælp?", he was affor…    For:    A. Deter. B. Deter. C. Deter. D. Deter. E. Deter. F. Deter. G. Deter.    For:    A. Deter. B. Deter. C. Deter. D. Deter. E. Deter.    For:    ,Da så Kana'ans Fader Kam sin Faders Blusel og gik ud og fortalte sine Brødre det;,"Ham, the father of Canaan, saw the nakedness of his father, and told his two brothers outside.",21,15,226
"
22 »Vi går. Vi går ind i teltet.«
Lukelædere, en stav, en stol, et stykke jern","  E. 22:12-14  The first derviller was an ule i khan , a khan who was a mute, an ule i khan , a mute who was a khan .  E. 22:15-21  D. 22:1-2  E. 22:1-3",Da så Kana'ans Fader Kam sin Faders Blusel og gik ud og fortalte sine Brødre det;,"Ham, the father of Canaan, saw the nakedness of his father, and told his two brothers outside.",22,15,226
.<|endoftext|>,"  the man was a white man. he was about six feet tall. his body was of a white, thick, thick, meaty mass. his mouth was huge, and his eyes were large, with a big red swivel in them. he had a moustache.  he was about the size of a man. he was about three-and-a-half feet tall. he was",Da så Kana'ans Fader Kam sin Faders Blusel og gik ud og fortalte sine Brødre det;,"Ham, the father of Canaan, saw the nakedness of his father, and told his two brothers outside.",23,15,226
" Han gik ud med ham i seng og fortalte ham dette, og han kunde heller ikke lade være: han vilde blot være sin egen herre. For dette", he was still unconscious. he was naked.  'Where are you?'  'I'm in a tent.'  'Where?'  'I'm in a tent.'  'What is it?'  'I'm in a tent.'  'What are you doing in a tent?'  'I'm in a tent.'  'What is it?'  ,Da så Kana'ans Fader Kam sin Faders Blusel og gik ud og fortalte sine Brødre det;,"Ham, the father of Canaan, saw the nakedness of his father, and told his two brothers outside.",0,2,226
"
4. engelska: If the two people of a marriage are in a good relationship, they may communicate openly about this during a wedding.
dan","  I went to him and kissed him. I said: ""I know you are hungry, but you are hungry to eat. You are hungry to eat.""  He said: ""I am hungry to eat. I am hungry to eat.""  I said: ""Do you know the man who is hungry to eat? He is hungry to eat.""  He said: ""He is hungry to eat.""  ",Da så Kana'ans Fader Kam sin Faders Blusel og gik ud og fortalte sine Brødre det;,"Ham, the father of Canaan, saw the nakedness of his father, and told his two brothers outside.",1,2,226
.<|endoftext|>,"    In 2010, a man was arrested in an Australian city for allegedly drinking a bottle of wine while driving a motorcycle. He was found to have had a small quantity of alcohol in his system. The man had been driving in his car while under the influence of alcohol.    A man was arrested in Australia in 2011 for allegedly drinking a bottle of wine while driving",Da så Kana'ans Fader Kam sin Faders Blusel og gik ud og fortalte sine Brødre det;,"Ham, the father of Canaan, saw the nakedness of his father, and told his two brothers outside.",2,2,226
" Da han havde ladet teltet falde, og holdt op at synke i søvn, sov han til næste dag, da det endnu var mørkt, som",. the priest asked him what he was doing in the tent. he said he was sleeping.    What is the most important fact in this situation?  - He is drunk.  - He was uncovered.  - He was asleep.    He is drunk.<|endoftext|>,Da så Kana'ans Fader Kam sin Faders Blusel og gik ud og fortalte sine Brødre det;,"Ham, the father of Canaan, saw the nakedness of his father, and told his two brothers outside.",3,2,226
"
18. Svensk: 147 km/h – en stor besvikelse.
Dansk: 69 km/t.. en skuff","    13. dansk: Der er en mulighed for at du kan få et godt tilbud.  engelsk: There is a possibility you can get a good deal.    14. dansk: Hvis du ikke har set det før, så læs dette.  engelsk: If you haven't seen it before, read this.    15. dansk: Men det er ikke kun den der har",Da så Kana'ans Fader Kam sin Faders Blusel og gik ud og fortalte sine Brødre det;,"Ham, the father of Canaan, saw the nakedness of his father, and told his two brothers outside.",4,2,226
"
""Jeg har en plan. Jeg har sat min fod på dit træ.""
Nu fulgte de det gamle vejskilt og op af bakken, over","  ""It is my own fault,"" he said, ""I didn't take my pill.""  ""And you're sorry?""  ""Yes, I am.""  ""You're a good person,"" said Bray. ""But I don't think you deserve to be in prison for that.""  ""I'm sorry,"" said the old man.  ""What do you want me",Da så Kana'ans Fader Kam sin Faders Blusel og gik ud og fortalte sine Brødre det;,"Ham, the father of Canaan, saw the nakedness of his father, and told his two brothers outside.",5,2,226
" Og da der stod to mennesker ved hans side, sagde han til ham: ""Se, nu kommer du, for du er den eneste, der er","  ""I am the man who died,"" said the priest. ""The man who died with the priest. The man who died with the priest. I was the man who died with the priest. I am the man who died with the priest.""  He was the man who died with the priest. He was the man who died with the priest. He was the man who died with the priest.  """,Da så Kana'ans Fader Kam sin Faders Blusel og gik ud og fortalte sine Brødre det;,"Ham, the father of Canaan, saw the nakedness of his father, and told his two brothers outside.",6,2,226
" Han sagde intet. Nu er han beruset, og de andre gaar hjem. Da han var ved at sætte sig ud af sin vogn, satte en", he was drunk. he was uncovered within his tent. he was drunk. he was uncovered within his tent. he was drunk. he was uncovered within his tent. he was drunk. he was uncovered within his tent. he was drunk. he was uncovered within his tent. he was drunk. he was uncovered within his tent. he was drunk. he was uncovered within his tent,Da så Kana'ans Fader Kam sin Faders Blusel og gik ud og fortalte sine Brødre det;,"Ham, the father of Canaan, saw the nakedness of his father, and told his two brothers outside.",7,2,226
" Da så han, at der rejste sig op med et hvidt skjær. ""Lad mig få et brød til i morgen,"" sagde Han ivrigt.", the priest had been there before him and was still there. the priest had been very drunk. he was sitting at the front of the tent. he had not been seen since. he had not been seen since the night before. he had not been seen since the night before. he was drunk. the priest had been drinking. he was drunk. he was drunk. the priest was drunk. he was drunk.,Da så Kana'ans Fader Kam sin Faders Blusel og gik ud og fortalte sine Brødre det;,"Ham, the father of Canaan, saw the nakedness of his father, and told his two brothers outside.",8,2,226
" Og i det ene telt laa en dreng og kyssede ved det store glasvindue, medens den anden stod og saa op. Han havde jo været", he was shot. he was not only shot but he was also unhinged. he was unhinged. he was unhinged. he was unhinged. he was unhinged. he was unhinged. he was unhinged. he was unhinged. he was unhinged. he was unhinged. he was unhinged. he was unhinged.,Da så Kana'ans Fader Kam sin Faders Blusel og gik ud og fortalte sine Brødre det;,"Ham, the father of Canaan, saw the nakedness of his father, and told his two brothers outside.",9,2,226
" Man fandt ham ikke, han havde taget til sig af den, og var bleven en stor skurk. Folk sad i forundring ved at høre",.<|endoftext|>,Da så Kana'ans Fader Kam sin Faders Blusel og gik ud og fortalte sine Brødre det;,"Ham, the father of Canaan, saw the nakedness of his father, and told his two brothers outside.",10,2,226
" Da han saa op, fik han et godt Øre fat i hendes Haand og kyssede hende paa kinden: Men hvorfor, nu? sagde R"," he was naked, and he was standing in the middle of the tent.  He was naked and standing in the middle of the tent.  He was naked and standing in the middle of the tent.  He was naked and standing in the middle of the tent.  He was naked and standing in the middle of the tent.  He was naked and standing in the middle of the tent.  He was",Da så Kana'ans Fader Kam sin Faders Blusel og gik ud og fortalte sine Brødre det;,"Ham, the father of Canaan, saw the nakedness of his father, and told his two brothers outside.",11,2,226
" Nu satte de to fremmede mænd i stor fart efter ham og fik ham henholdt i sit telt. De lod ham se i øjnene, at her hand", he had a gun in his hand. he was shot in the neck. he was a big man. he was a white man. he was a white man. he was a white man. he was a white man. he was a white man. he was a white man. he was a white man. he was a white man. he was a white man. he was a white man. he was,Da så Kana'ans Fader Kam sin Faders Blusel og gik ud og fortalte sine Brødre det;,"Ham, the father of Canaan, saw the nakedness of his father, and told his two brothers outside.",12,2,226
" Der var nogen i ly, men ogsaa noget i luften. Det syntes ham ikke, at det kunde passe med noget, men heller ikke, at det","  ""The man was lying on his back and his legs were twisted and his arms were bent, his head was covered with a white sheet. The man was bleeding. There was a hole in the man's chest and a little black thing on his head. He was covered with a sheet. He was dead.""  ""Where is he now?""  ""He's in the hospital. There is no",Da så Kana'ans Fader Kam sin Faders Blusel og gik ud og fortalte sine Brødre det;,"Ham, the father of Canaan, saw the nakedness of his father, and told his two brothers outside.",13,2,226
".
Og de gik begge to på hver deres side af vejen til næste lejrplads.<|endoftext|>",    Output:  Yes    Data:  The girl was standing by herself in the park. she was wearing a black leather jacket. she was wearing a black leather jacket. she was wearing a black leather jacket. she was wearing a black leather jacket. she was wearing a black leather jacket. she was wearing a black leather jacket. she was wearing a black leather jacket. she was wearing a black leather,Da så Kana'ans Fader Kam sin Faders Blusel og gik ud og fortalte sine Brødre det;,"Ham, the father of Canaan, saw the nakedness of his father, and told his two brothers outside.",14,2,226
" Da hørte de andre en dør trille op og ned. Den anden, som gik ud mod lejren, kom ind. Han var nu gammel,", he had a bad headache and was cold. he was a virgin. he had a bad stomach. he was hungry. he was drunk. he was hungry. he was hungry. he was drunk. he was drunk. he was drunk. he was drunk. he was drunk. he was drunk. he was drunk. he was drunk. he was drunk. he was drunk. he was drunk. he was,Da så Kana'ans Fader Kam sin Faders Blusel og gik ud og fortalte sine Brødre det;,"Ham, the father of Canaan, saw the nakedness of his father, and told his two brothers outside.",15,2,226
"
Pigerne havde lagt sig til at sove til langt ud på natten, og de vilde ikke sove, før morgenen blev lysere og fuglene fløj","  13:28: ""It's a shame, because I don't know where I'll be tonight, but I don't know where I'll be tomorrow, either. I'm not sure I'll be able to go to school. I don't know what to do. I'm not sure I'll get a job. I don't know",Da så Kana'ans Fader Kam sin Faders Blusel og gik ud og fortalte sine Brødre det;,"Ham, the father of Canaan, saw the nakedness of his father, and told his two brothers outside.",16,2,226
 Men efter alt dette havde han drukket den hele vin og var bleven i bedre humør. Han havde ikke engang den mindste trang til at give den næste, he was found unconscious and dead on the floor. he was 32 years old.    Output:  yes    Argument: passage: he was a man of letters. he was a man of science. he was a man of the future. he was a man of the world. he was a man of the future. he was a man of the future. he was a man of the future,Da så Kana'ans Fader Kam sin Faders Blusel og gik ud og fortalte sine Brødre det;,"Ham, the father of Canaan, saw the nakedness of his father, and told his two brothers outside.",17,2,226
" ""Og så kommer den ene mand efter den anden, jeg var aldrig med. Hvem var det, der gav sig til at lege kællingen,""",.    <|endoftext|>,Da så Kana'ans Fader Kam sin Faders Blusel og gik ud og fortalte sine Brødre det;,"Ham, the father of Canaan, saw the nakedness of his father, and told his two brothers outside.",18,2,226
" Han var blevet vred over den udladning af vanddamp, der faldt fra teltet. Da han ikke kunne komme ud for at hente vandet",.    Summary:  -  The man in the tent was caught drinking wine and sleeping in a tent.<|endoftext|>,Da så Kana'ans Fader Kam sin Faders Blusel og gik ud og fortalte sine Brødre det;,"Ham, the father of Canaan, saw the nakedness of his father, and told his two brothers outside.",19,2,226
" Men det stod alt for mørkt til, at han kunde finde en god stilling. Der var ingenting for ham at ligge paa. Men de sagde alle,", when he came out he was in a great rage and the women were screaming at him. when he realized he was being tortured he ran to the river. he was so frightened that he could not talk. he went to the river and he found a large rock and a stone. he was in the river and he did not know what was going to happen. he was very frightened and he was in a deep,Da så Kana'ans Fader Kam sin Faders Blusel og gik ud og fortalte sine Brødre det;,"Ham, the father of Canaan, saw the nakedness of his father, and told his two brothers outside.",20,2,226
" En af hans brødre og hans søster kom sammen med nogle mænd og sagde til ham: ,I er jo et stort helvede,« sagde den ene.","    In the end, the police found out who had stolen the wine and the money, and arrested them.    The investigation was done on the basis of the information obtained from the police and the information obtained from the police.    The police found out the identity of the person who stole the wine and the money.    In the end, the police found out who had stolen the wine and the",Da så Kana'ans Fader Kam sin Faders Blusel og gik ud og fortalte sine Brødre det;,"Ham, the father of Canaan, saw the nakedness of his father, and told his two brothers outside.",21,2,226
" Hans søster og hendes mand kom over, og saa sad han der i mørket og talte og var underlig, næsten besat af sit eget liv, sin", the man was a young man. he was a good-looking man. the man was a good-looking man. the man was a good-looking man. the man was a good-looking man. he was drunk. he was drunk. he was drunk. he was drunk. he was drunk. he was drunk. he was drunk. he was drunk. he was drunk. he was drunk. he,Da så Kana'ans Fader Kam sin Faders Blusel og gik ud og fortalte sine Brødre det;,"Ham, the father of Canaan, saw the nakedness of his father, and told his two brothers outside.",22,2,226
" Jeg blev i min angst; og da jeg endelig saa op, var han og jeg kommet op i et rigt, vildt og sødt, hvidt",                                                                                                                                                                      ,Da så Kana'ans Fader Kam sin Faders Blusel og gik ud og fortalte sine Brødre det;,"Ham, the father of Canaan, saw the nakedness of his father, and told his two brothers outside.",23,2,226
.<|endoftext|>, the police came. he was not alone. there were other men in the tent. they were all naked and dressed in white. they were in the middle of the night. they were all dressed in white. they were all naked. they were all dressed in white. they were all naked. they were all naked. they were all naked. they were all naked. they were all naked. they were all naked,Da så Kana'ans Fader Kam sin Faders Blusel og gik ud og fortalte sine Brødre det;,"Ham, the father of Canaan, saw the nakedness of his father, and told his two brothers outside.",0,5,226
" Manden havde nu en stor guldtaske med en lang kniv og skede som redskab med sig. Men da han var nær ved teltet, stans"," he had drunk the wine and was in a state of consciousness.    in the present, a man is lying on the ground. he has his head up, his mouth open, his eyes open. he is a man in his early twenties, and he has a gun in his hand.    the man is being questioned by police. the man is being asked for his name and his address.  ",Da så Kana'ans Fader Kam sin Faders Blusel og gik ud og fortalte sine Brødre det;,"Ham, the father of Canaan, saw the nakedness of his father, and told his two brothers outside.",1,5,226
"
En af mændene, der er iført dragten af en stor, sort og meget højskægredt, tager med sine to drag",.    increase<|endoftext|>,Da så Kana'ans Fader Kam sin Faders Blusel og gik ud og fortalte sine Brødre det;,"Ham, the father of Canaan, saw the nakedness of his father, and told his two brothers outside.",2,5,226
" Men ved den anden side lå der en dør, og paa den vendte sig den fremmede mand! ""Stå, jeg er ude at se til dig",                                                                                                                                                                      ,Da så Kana'ans Fader Kam sin Faders Blusel og gik ud og fortalte sine Brødre det;,"Ham, the father of Canaan, saw the nakedness of his father, and told his two brothers outside.",3,5,226
.<|endoftext|>, he was not sure what had happened. he was drunk and he wanted to know. he wanted to know. he was drunk. he wanted to know. he wanted to know. he wanted to know. he wanted to know. he wanted to know. he wanted to know. he wanted to know. he wanted to know. he wanted to know. he wanted to know. he wanted to know. he wanted,Da så Kana'ans Fader Kam sin Faders Blusel og gik ud og fortalte sine Brødre det;,"Ham, the father of Canaan, saw the nakedness of his father, and told his two brothers outside.",4,5,226
" Ved stuen, med de lange gardiner over, kom Jomfru Stjernegullas datter, det var Tante Olga. De kysset", he was naked and the girl was asleep. she was in the tent and he was asleep in the tent. he was drunk. he was drunk. he was drunk. he was drunk. he was drunk. he was drunk. he was drunk. he was drunk. he was drunk. he was drunk. he was drunk. he was drunk. he was drunk. he was drunk. he was drunk. he,Da så Kana'ans Fader Kam sin Faders Blusel og gik ud og fortalte sine Brødre det;,"Ham, the father of Canaan, saw the nakedness of his father, and told his two brothers outside.",5,5,226
".
Svensk:
Men denna dag, då han drack av vinet, berusades han sig och blottade sig in i tältet.<|endoftext|>",  He sat in the tent and drank his wine. he woke up.  He looked at his tent.  He took a shower.  He got dressed.  He went to his tent.  He got dressed.  He got dressed.  He got dressed.  He got dressed.  He got dressed.  He got dressed.  He got dressed.  He got dressed.  He got,Da så Kana'ans Fader Kam sin Faders Blusel og gik ud og fortalte sine Brødre det;,"Ham, the father of Canaan, saw the nakedness of his father, and told his two brothers outside.",6,5,226
" Da han havde drukket det op, satte han en skuepæl op til sig selv, saa han kunde se sit eget udseende. Det var","    I've read that this was done to scare people into following the law, but how did it work?     Thanks!  Janiyah: I think it's because the law has to be followed. The law has to be enforced. The law has to be obeyed. The law has to be followed.     I think it's a bit of a mis",Da så Kana'ans Fader Kam sin Faders Blusel og gik ud og fortalte sine Brødre det;,"Ham, the father of Canaan, saw the nakedness of his father, and told his two brothers outside.",7,5,226
"
Nu kom den unge mand med ud og satte sig ved bordet, mens de to rørte ved hinanden og kyssede. Men denne gik alligevel ind","  ""I am sorry, but I am not sure I can see you,"" he said.  ""I am sure I can see you,"" said the man.  ""I can see you,"" said the man.  ""I can see you,"" said the man.  ""I can see you,"" said the man.  ""I can see you,"" said the man.  ""I can see you",Da så Kana'ans Fader Kam sin Faders Blusel og gik ud og fortalte sine Brødre det;,"Ham, the father of Canaan, saw the nakedness of his father, and told his two brothers outside.",8,5,226
". En af hans venner, som var med ham, gik ud fra byen og gik hjem.<|endoftext|>","    The man said to himself, ""I have been drinking too much wine. I am going to have a heart attack."" He went into the tent and got up. He sat down. He looked at the wine bottle. He looked at his stomach. He looked at his neck. He looked at his face. He looked at his hands. He looked at his feet. He looked at his hands. He",Da så Kana'ans Fader Kam sin Faders Blusel og gik ud og fortalte sine Brødre det;,"Ham, the father of Canaan, saw the nakedness of his father, and told his two brothers outside.",9,5,226
" En stor hvid pøbel kom ud fra det og tog ham. Alle de folk, som stod i den store, lange gang, vendte og blev","  The rest of the party went to bed.  The night of the wedding, the party was on the edge of the city. The moon was full and the sun was shining. The party was in the town hall. The party was in the town hall. The party was on the edge of the city. The moon was full and the sun was shining.  The party was in the town hall. The",Da så Kana'ans Fader Kam sin Faders Blusel og gik ud og fortalte sine Brødre det;,"Ham, the father of Canaan, saw the nakedness of his father, and told his two brothers outside.",10,5,226
" Da han senere kom ind, saa fandt han dem alle, alle de foragtede som de i det mindste burde være for.
Brian O"," he was on a horse, riding in a cart, and it was a black horse with a white horse on it. it was a big horse, with a huge mane and horns, with a long, wide neck. the man was wearing a black shirt and a black pants suit, and he was riding a horse. he was wearing a black hat and a black shirt. the horse was a bull.",Da så Kana'ans Fader Kam sin Faders Blusel og gik ud og fortalte sine Brødre det;,"Ham, the father of Canaan, saw the nakedness of his father, and told his two brothers outside.",11,5,226
" Da såes en stor flok af mennesker, i to rækker. Alle havde de rød- og sorte frakker på. Der var ingen slotte i", the man was a drunk and he had a knife in his hand. the man had to be taken to a hospital. he had to be taken to the hospital.    The man was taken to the hospital.    He was taken to the hospital.    He was taken to the hospital.    He was taken to the hospital.    He was taken to the hospital.    He was,Da så Kana'ans Fader Kam sin Faders Blusel og gik ud og fortalte sine Brødre det;,"Ham, the father of Canaan, saw the nakedness of his father, and told his two brothers outside.",12,5,226
" Da han var træt, rejste han sig op og gik hen og spurgte en eller anden mand, som sad med en bog ved væggen. ""Var det"," he was naked, his clothes were stained. he was naked. he was naked. he was naked. he was naked. he was naked. he was naked. he was naked. he was naked. he was naked. he was naked. he was naked. he was naked. he was naked. he was naked. he was naked. he was naked. he was naked. he was naked. he was",Da så Kana'ans Fader Kam sin Faders Blusel og gik ud og fortalte sine Brødre det;,"Ham, the father of Canaan, saw the nakedness of his father, and told his two brothers outside.",13,5,226
" Hvorledes det gik, er der intet om. Thi ved den sidste af disse festligheder drog den unge mands, der som fortalen siger sad","    Graham: Hi, I'm your automated assistant. I kan se, du har allerede læst om det.  Trine: What happened to Graham?  Graham: Graham: Graham: Hi, jeg er en journalist.  Trine: Hvad er dit navn?  Graham: Jeg er en journalist.  Trine: Hvorfor er du journalist?  Graham: Jeg er en",Da så Kana'ans Fader Kam sin Faders Blusel og gik ud og fortalte sine Brødre det;,"Ham, the father of Canaan, saw the nakedness of his father, and told his two brothers outside.",14,5,226
" Han kom en nat ud af sit telt, da han saa et stort dyr, som sprang ud i øsregnen. Han skyndte sig derfor"," He was lying in a heap. His tent was overgrown with mosquitoes.  'Hvorfor har du gjort det?' spurgte jeg.  'Det var for at vise, at det var forkert at gøre det. Jeg ville have ham til at glemme det.'  'Du skulle have ringet til politiet. Så ville du ikke være blevet opdaget.'  'Det var jeg ikke.'  'Hvorfor",Da så Kana'ans Fader Kam sin Faders Blusel og gik ud og fortalte sine Brødre det;,"Ham, the father of Canaan, saw the nakedness of his father, and told his two brothers outside.",15,5,226
" Den berusede, der var en ung mand, saa ikke engang beruset ud, men han havde ogsaa skjælvende overarm, men det var","    The man, whose name erotomaniacs ikke erotiske noveller 1972    I denne sammenhæng er det interessant at bemærke, at den kvindelige orgasme, der ikke kan være til stede i det mandlige ejakulationssystem, som han er, ikke er tilstrækkelig til at tilfredsstille hende.    Den kvindelige orgasme, som er til stede i det mandlige ejakulationssystem,",Da så Kana'ans Fader Kam sin Faders Blusel og gik ud og fortalte sine Brødre det;,"Ham, the father of Canaan, saw the nakedness of his father, and told his two brothers outside.",16,5,226
" Da han kom ud, så han en fyr, der havde været ude og fået sit tøj af, og han spurgte ham, om han vidste navnet","  da: Han blev fundet i hans telt.    en: The film is not a musical.  da: Filmen er ikke en musical.    en: The other option is the online dating site.  da: Den anden mulighed er online dating sites.    en: I am going to do the same thing for myself, I promise.  da: Jeg skal nok gøre det samme for mig",Da så Kana'ans Fader Kam sin Faders Blusel og gik ud og fortalte sine Brødre det;,"Ham, the father of Canaan, saw the nakedness of his father, and told his two brothers outside.",17,5,226
