danish_predicted_output,english_predicted_output,danish_true_label,english_true_label,layer,lambda_amount,bible_verse
" derfor lod han sin søn Josef komme hjem, og gik hen til ham med olien i næbbet og sagde til ham: ""Tag vand,","  noah's mother cried out: ""Come, my son! my son!"" and she put the olive leaf in his mouth, and he ate it. but the next day his mother told him, ""Go to the lake and get a fish. I'll show you how to fish.""","Derpå biede han syv Dage til, og da han så sendte Duen ud, kom den ikke mere tilbage til ham.","He stayed yet another seven days, and sent out the dove; and she didn't return to him any more.",15,2,194
"
13:1 ""Og dåf Noa: 'Siden jeg kom ned til Søen for at tilbede HERREN og bygge HERR",.<|endoftext|>,"Derpå biede han syv Dage til, og da han så sendte Duen ud, kom den ikke mere tilbage til ham.","He stayed yet another seven days, and sent out the dove; and she didn't return to him any more.",16,2,194
" og han gik i haven og så efter fuglen; men den lå død og lig. han hørte et ryk, og ud af en løve","  4 The voice of the dove was like a whispering angel, saying, ""You are the firstborn of the house of Israel, the son of David, the son of Jonathan.""  5 ""Yes,"" said the firstborn, ""I am the son of David, the son of Jonathan","Derpå biede han syv Dage til, og da han så sendte Duen ud, kom den ikke mere tilbage til ham.","He stayed yet another seven days, and sent out the dove; and she didn't return to him any more.",17,2,194
" - Men for at han ikke skulle blive greben af frygt for englene som en, som kommer og siger: se her er en, der er","    ""And Noah did not go to the sea, and did not go to the land of the Canaanites, and did not go to the land of the Edomites, and did not go to the land of the Gileadites, and did not go to the land of","Derpå biede han syv Dage til, og da han så sendte Duen ud, kom den ikke mere tilbage til ham.","He stayed yet another seven days, and sent out the dove; and she didn't return to him any more.",18,2,194
"
70:12 Og du skal drage hjem til din by og samle dig dit folk, og du skal give din fader Abraham dit eget folk","  43.  30 years later, Noah, as he was about to go on a voyage to the Red Sea, heard a voice in his mind saying, ""Is that the dove of the Lord? That is the dove of the Lord. She is with me, and I","Derpå biede han syv Dage til, og da han så sendte Duen ud, kom den ikke mere tilbage til ham.","He stayed yet another seven days, and sent out the dove; and she didn't return to him any more.",19,2,194
.<|endoftext|>,".  da: Da den første mand kom tilbage til ham om aftenen, så han i munden, at der var et oliventræ, som var blevet revet af.<|endoftext|>","Derpå biede han syv Dage til, og da han så sendte Duen ud, kom den ikke mere tilbage til ham.","He stayed yet another seven days, and sent out the dove; and she didn't return to him any more.",20,2,194
" Og da var det, at noa kastede sig udi det. Og noa rakte oliebladet med til ham og sagde:
For","    I don't think it's possible to fully appreciate the significance of this. I'm sure it would have been a bit more of a thrill for Noah to have his dove back, but for us to see him doing it again after so many years is a very different thing.","Derpå biede han syv Dage til, og da han så sendte Duen ud, kom den ikke mere tilbage til ham.","He stayed yet another seven days, and sent out the dove; and she didn't return to him any more.",21,2,194
" da satte han sig på kamelen, og fik den lille høne til at græde og lade fuglen flyve videre til noget øde. da så","  16  Thus began the great flood. and it was not long before the waters were no more.  17  And the earth was full of the water.  18  And the trees were cut down, and the bushes.  19  And the birds were scattered","Derpå biede han syv Dage til, og da han så sendte Duen ud, kom den ikke mere tilbage til ham.","He stayed yet another seven days, and sent out the dove; and she didn't return to him any more.",22,2,194
" da gik han, og fik se det friske blad på næbbet. se, han lod vandet flyde ud i land. så begyndte noa","  The next morning the angel went back to the cave and found the water there. So Noah was able to get into the cave.  The angel gave him a great deal of water, and the water was so great that it filled all the caves. So Noah went to the cave and put the","Derpå biede han syv Dage til, og da han så sendte Duen ud, kom den ikke mere tilbage til ham.","He stayed yet another seven days, and sent out the dove; and she didn't return to him any more.",23,2,194
"

38. Om morgonen den första dagen vid solnedgången, när det inte var några andra människor närvarande, blev solen stående 122","  6Then Noah said to the Lord, ""Look, my son, I have brought you a good offer.""  7""I have brought you a good offer,"" the Lord said to Noah, ""but now I have given you a bad offer.""  8Then Noah said, ""What good offer","Derpå biede han syv Dage til, og da han så sendte Duen ud, kom den ikke mere tilbage til ham.","He stayed yet another seven days, and sent out the dove; and she didn't return to him any more.",0,5,194
" da gik han hen til ham og bad ham at tage af hanen. men noa sagde til ham: ""Gå ind i huset og tag af","  21. 36. ""And the first of the days the LORD spoke to Moses, saying, ""Behold, the waters of the sea have abated, and the earth is in a state of abyss.""  22. 37. And the LORD said","Derpå biede han syv Dage til, og da han så sendte Duen ud, kom den ikke mere tilbage til ham.","He stayed yet another seven days, and sent out the dove; and she didn't return to him any more.",1,5,194
" Da gjorde han et stort tegn til dem og sagde: se, jeg samler dig en buket vand til dig.
8 8 Han sagde til",.<|endoftext|>,"Derpå biede han syv Dage til, og da han så sendte Duen ud, kom den ikke mere tilbage til ham.","He stayed yet another seven days, and sent out the dove; and she didn't return to him any more.",2,5,194
" ->
And the frog came back, and saw that its oil-blade was fresh in its beak. 10 So Noah was pleased","    12:14 And they brought the olive leaf, and the cedar tree, and the oleander, and the fig tree, and the tamarisk tree, and the olive tree, and the fig tree, and the tamarisk tree, and the oleander,","Derpå biede han syv Dage til, og da han så sendte Duen ud, kom den ikke mere tilbage til ham.","He stayed yet another seven days, and sent out the dove; and she didn't return to him any more.",3,5,194
" da tog de ud med bøje- og sejl,

-2-

- 2

-

-

-","  In the old days, the dove was said to be a symbol of the new, the new life. It was believed that the dove could be seen in the morning and in the evening. And as the sun rose, the dove would go out of its way and come back, so","Derpå biede han syv Dage til, og da han så sendte Duen ud, kom den ikke mere tilbage til ham.","He stayed yet another seven days, and sent out the dove; and she didn't return to him any more.",4,5,194
" da han åbnede sin mund, var hans syn klart og fint; det var hans øjne, der var sløret, og hans næse er hvid på det","  Now the people came together and said, ""The waters are abated. Now the dove came back to us.""  So the people were delighted. And the people went down to the dove. And the dove was glad and came back to them.  Now the people went up to","Derpå biede han syv Dage til, og da han så sendte Duen ud, kom den ikke mere tilbage til ham.","He stayed yet another seven days, and sent out the dove; and she didn't return to him any more.",5,5,194
" Han løb hid og did for at se, hvorledes det gik med ham, og han kunde ikke finde den og råbte på sin far. Men min","  And the same night he went out into the field and caught a dove, and he had not eaten it. So the dove ate the olive leaf, and it was a good thing for him.  And the same night the dove returned to him and said to him, ""How many","Derpå biede han syv Dage til, og da han så sendte Duen ud, kom den ikke mere tilbage til ham.","He stayed yet another seven days, and sent out the dove; and she didn't return to him any more.",6,5,194
"
23 Da sagde Noa til Moses: ""Se til dette: På et tidspunkt kommer der en mand gående imod dig, mens du går;",".  da: Da Noah hørte det, gik han hen til sin kone og sagde: ""Nu er det ved at være aften, og se, i hendes mund var der et olivenblad, som var blevet plukket af.<|endoftext|>","Derpå biede han syv Dage til, og da han så sendte Duen ud, kom den ikke mere tilbage til ham.","He stayed yet another seven days, and sent out the dove; and she didn't return to him any more.",7,5,194
"
Nu skal noa hente olie til huset. Duen kom tilbage til ham, og se, den havde et oliefat i næbbet","  But the dove, however, did not give up her offerings, and in her mouth was an olive leaf. But the dove did not leave the earth. The sun rose in the sky, and the sun went down in the earth. The dove went into the desert, and the","Derpå biede han syv Dage til, og da han så sendte Duen ud, kom den ikke mere tilbage til ham.","He stayed yet another seven days, and sent out the dove; and she didn't return to him any more.",8,5,194
" 25 Da gik han hen til åen, hvor åens vand havde taget til, og han lagde åen til side og gik tilbage til",.<|endoftext|>,"Derpå biede han syv Dage til, og da han så sendte Duen ud, kom den ikke mere tilbage til ham.","He stayed yet another seven days, and sent out the dove; and she didn't return to him any more.",9,5,194
". Og han gjorde, som han havde sagt.<|endoftext|>"," and the dove was like the sun, and the dove was like the moon, and the dove was like the sun, and the dove was like the moon.  9  ""And the sun was like the moon, and the moon was like the sun, and the sun was like","Derpå biede han syv Dage til, og da han så sendte Duen ud, kom den ikke mere tilbage til ham.","He stayed yet another seven days, and sent out the dove; and she didn't return to him any more.",10,5,194
 Noa kom op på sin mor og sad og så på hende. Så tog den fat i det tørre græs i gården og faldt ned på jorden og,"  The first of the nine days was a month. Noah went with his father, Jacob, to the Ark of the Covenant. And he found his father and mother there. They were sitting together on the rock of the Ark, and their eyes were closed.  ""Oh, my God,""","Derpå biede han syv Dage til, og da han så sendte Duen ud, kom den ikke mere tilbage til ham.","He stayed yet another seven days, and sent out the dove; and she didn't return to him any more.",11,5,194
" 32
2 Det var en herlig dag for noa og hans hustru. Og det blev sagt: Ja, jeg ser, du ser det","  17:12 And when the dove was gone, he said, I am hungry, and I am not able to eat. And he said, Come, I will give you food.  17:13 And he said, I am hungry, and I am not able to","Derpå biede han syv Dage til, og da han så sendte Duen ud, kom den ikke mere tilbage til ham.","He stayed yet another seven days, and sent out the dove; and she didn't return to him any more.",12,5,194
" og da han fik se, hvordan jorden var forvandlet, kom han til at tænke paa, at hvis der ikke var vokset nogen mennesker rundt omkring i","  When the sun set, he set a little lamp in the water, and, after the dove had gone, he set a lamp in the water.  And when the lamp was gone, the dove came back to him and said, ""Dove, come back to me."" And he","Derpå biede han syv Dage til, og da han så sendte Duen ud, kom den ikke mere tilbage til ham.","He stayed yet another seven days, and sent out the dove; and she didn't return to him any more.",13,5,194
.<|endoftext|>,  11. 22:27-33      1 Mosebog 22:27-33.      1 Mosebog 22:27-29.      1 Mosebog 22:30.      ,"Derpå biede han syv Dage til, og da han så sendte Duen ud, kom den ikke mere tilbage til ham.","He stayed yet another seven days, and sent out the dove; and she didn't return to him any more.",14,5,194
" Og da han havde sat lighedstegn mellem det, som var tørt og dets fugtighed, og det, som var blødt og dets hårdhed",".  22.  Da han så den, blev han rasende, og da han så den, sagde han: ""Se, det er en due.<|endoftext|>","Derpå biede han syv Dage til, og da han så sendte Duen ud, kom den ikke mere tilbage til ham.","He stayed yet another seven days, and sent out the dove; and she didn't return to him any more.",15,5,194
"
Hver dag var der et dyr, dyrene kaldte: Han kom om morgenen, og hver gang han kom forbi, kom han ikke tilbage. På",                                                                                                                          ,"Derpå biede han syv Dage til, og da han så sendte Duen ud, kom den ikke mere tilbage til ham.","He stayed yet another seven days, and sent out the dove; and she didn't return to him any more.",16,5,194
" og noa satte sig ned. og da han kiggede sig omkring, så han, at han havde fået vand på jorden.  det fik det til",  43. Noah 35  The frog returned and the dove came to him at night. Then the frog returned and the dove came to him at night. Then the frog returned and the dove came to him at night. Then the frog returned and the d,"Derpå biede han syv Dage til, og da han så sendte Duen ud, kom den ikke mere tilbage til ham.","He stayed yet another seven days, and sent out the dove; and she didn't return to him any more.",17,5,194
" 10. Men da sagde han: Dette er min søn Amos, en spæd ung mand, som havde gjort sig mange ære, thi",                                                                                                                          ,"Derpå biede han syv Dage til, og da han så sendte Duen ud, kom den ikke mere tilbage til ham.","He stayed yet another seven days, and sent out the dove; and she didn't return to him any more.",18,5,194
"
3:31 Men da noa gik ud fra deres telt, gik han med dem i ørkenen, og de lærte Herren at kende.","  And it came to pass, at the time of the affliction, that the afflicted of the earth, in the midst of the affliction, was very much affected.  The earth was very sore and did not yet fully recover. And it was said, ""The earth is","Derpå biede han syv Dage til, og da han så sendte Duen ud, kom den ikke mere tilbage til ham.","He stayed yet another seven days, and sent out the dove; and she didn't return to him any more.",19,5,194
" Og da han havde set noa, sagde han til ham: se, den er stor og bred, og den ede af olie. Da sagde","  The people were so impressed with the carcass that they made a big deal of it. And when it came out, the people said, ""This is the carcass of the man who was in the desert with the dove."" So Noah was the first person to eat it.  ""It","Derpå biede han syv Dage til, og da han så sendte Duen ud, kom den ikke mere tilbage til ham.","He stayed yet another seven days, and sent out the dove; and she didn't return to him any more.",20,5,194
" da tænkte han, at han skal lede dem sammen. 4 Da gik han ud og førte noa til kongen, fordi han havde forvildet",.<|endoftext|>,"Derpå biede han syv Dage til, og da han så sendte Duen ud, kom den ikke mere tilbage til ham.","He stayed yet another seven days, and sent out the dove; and she didn't return to him any more.",21,5,194
" den anden dag sagde jeg: 10 han sagde: 11 12 Hvorfor tror du, jeg kom?
13 1","  The dove was not a dove. She was an angel of the Goddess, she was the first divine one, and she had her own god.  She was a dove, and the earth was plunged into her mouth.  This was the first time the dove","Derpå biede han syv Dage til, og da han så sendte Duen ud, kom den ikke mere tilbage til ham.","He stayed yet another seven days, and sent out the dove; and she didn't return to him any more.",22,5,194
" Og det havde da snart ikke længer ret til at være, hvordan det var, og duen var igen taget på spil. men duen,",".  And then the dove came back to him at night, and in her mouth was an olive leaf plucked off. so noah knew that the waters were abated from the earth.<|endoftext|>","Derpå biede han syv Dage til, og da han så sendte Duen ud, kom den ikke mere tilbage til ham.","He stayed yet another seven days, and sent out the dove; and she didn't return to him any more.",23,5,194
. 13<|endoftext|>,"    A:    This is a great and important question, and one that I don't think has been answered yet.  The original answer is: ""Noah didn't know that the waters were abated from the earth""  The answer to the second part of the question is","Derpå biede han syv Dage til, og da han så sendte Duen ud, kom den ikke mere tilbage til ham.","He stayed yet another seven days, and sent out the dove; and she didn't return to him any more.",0,10,194
" Men da han havde trukket olierne ud og givet dem til oksen, gik han hjem og bragte en mængde olivenolie, det var rigeligt til at"," he was all alone in the house, and, behold, he could not hear his wife. she was talking to him, and, behold, he was saying, ""It's just a dream, it's just a dream, but you know it. "" ""But you know it, and","Derpå biede han syv Dage til, og da han så sendte Duen ud, kom den ikke mere tilbage til ham.","He stayed yet another seven days, and sent out the dove; and she didn't return to him any more.",1,10,194
" aha, sagde noa, de har vel spist græsset ihjel, svarede hans tjener. du og jeg kunne ikke tage os sammen til at","  and, she was in the middle of a bath, when she saw the man, who was washing his face with his handkerchief, and the woman was staring at him with her eyes.  and, she looked at him and looked back at him, and he looked back at her, and","Derpå biede han syv Dage til, og da han så sendte Duen ud, kom den ikke mere tilbage til ham.","He stayed yet another seven days, and sent out the dove; and she didn't return to him any more.",2,10,194
" da sagde han ja og bragte olie i øglerne, og han samlede al vandet i et stort bæger af kobber og hældte det ud i","  And now, when the waters were abated, he would go to the field, and, behold, he would go to the field, and, behold, he would go to the field, and, behold, he would go to the field, and, behold, he would go to the field","Derpå biede han syv Dage til, og da han så sendte Duen ud, kom den ikke mere tilbage til ham.","He stayed yet another seven days, and sent out the dove; and she didn't return to him any more.",3,10,194
" 11,36 Og han saa' til sit folk, som var hos ham, og da han fik at se, hvorfor de sad og",  And now this dove was returning to him. And now the dove came back to him. And now the dove came back to him. And now the dove came back to him. And now the dove came back to him. And now the dove came back to him.,"Derpå biede han syv Dage til, og da han så sendte Duen ud, kom den ikke mere tilbage til ham.","He stayed yet another seven days, and sent out the dove; and she didn't return to him any more.",4,10,194
" han tog to olieklude frem og gik ind på gården. 24 Da havde han en kamel, hvis næseben var rødt af væ",.<|endoftext|>,"Derpå biede han syv Dage til, og da han så sendte Duen ud, kom den ikke mere tilbage til ham.","He stayed yet another seven days, and sent out the dove; and she didn't return to him any more.",5,10,194
" Se, for der stod en anden konge ved et andet hus.
Solen er oppe, og fuglene synger glad for at høre, at de"," So he went to the sea, and seised the sea. So he went to the land of the heaths, and seised the land of the heaths. So he went to the land of the dove, and seised the dove. So he went to the land of","Derpå biede han syv Dage til, og da han så sendte Duen ud, kom den ikke mere tilbage til ham.","He stayed yet another seven days, and sent out the dove; and she didn't return to him any more.",6,10,194
" Men kom! du er jo ikke vild med vandet!"" sagde noa, og lagde noget olie derpå. Og den dag har de fortalt alt dette"," så, da han forlod, sagde han: ""Jeg vil ikke være i stand til at rejse, indtil jeg har en båd. og han gik ned til ham, og han kom tilbage til ham, og i hendes mund var et oliven blad plukket af. så noah vidste at vandet var abatet","Derpå biede han syv Dage til, og da han så sendte Duen ud, kom den ikke mere tilbage til ham.","He stayed yet another seven days, and sent out the dove; and she didn't return to him any more.",7,10,194
" men da han ikke lod være med at vende sig til abekonen, kom fuglen hen for at lægge et æg i hendes vingesæk","  ""So he went into the ark and found a little girl there. And he took her and put her in the ark. And he put her in the ark, and she was a virgin, and the waters abated from the earth. So she went into the ark and found another girl there.","Derpå biede han syv Dage til, og da han så sendte Duen ud, kom den ikke mere tilbage til ham.","He stayed yet another seven days, and sent out the dove; and she didn't return to him any more.",8,10,194
" Da blev Noa vred og råbte til Moses: »Hvem er den mand, som sagde: Hvor er den mand, som sagde: Hvor er","    In fact, it was the dove who picked the leaf off the tree.    This is the story of how Noah and his family discovered the dove.    In fact, the story of how the dove picked up the olive leaf.    In fact, the story of","Derpå biede han syv Dage til, og da han så sendte Duen ud, kom den ikke mere tilbage til ham.","He stayed yet another seven days, and sent out the dove; and she didn't return to him any more.",9,10,194
"
51:14 - Da vandfloden kom ind i hans område, gik han ud til søen for at fiske. da han fik","  5  The first angel came to the earth, and said to him, ""Go to the grave, and sit there in the dark, till the waters abate. Then go in and sleep in the land."" 6  The angel said to him, ""Gå til graven, og sæt dig","Derpå biede han syv Dage til, og da han så sendte Duen ud, kom den ikke mere tilbage til ham.","He stayed yet another seven days, and sent out the dove; and she didn't return to him any more.",10,10,194
" I samme øjeblik kom der en lyd fra det, der var gået, og folkene kom på gaden og så, hvordan ilden bredte sig.","  3. Mennesket blev født med en plan om at blive en god mor. ->  Men are born with a plan to be a good parent.  4. De fleste mennesker har et meget stort behov for at spise, og det er ikke altid let. ->  Most people have a great","Derpå biede han syv Dage til, og da han så sendte Duen ud, kom den ikke mere tilbage til ham.","He stayed yet another seven days, and sent out the dove; and she didn't return to him any more.",11,10,194
"
Sønnen havde fulgt dem hjem fra marken og sad ved ilden, da den gamle kom ind, og han sagde: ""Bare et øjeblik",.<|endoftext|>,"Derpå biede han syv Dage til, og da han så sendte Duen ud, kom den ikke mere tilbage til ham.","He stayed yet another seven days, and sent out the dove; and she didn't return to him any more.",12,10,194
" da skønnede han det; men deroppe, hvor han lå, var der ikke den dråbe, som i hans dage. 2:","  Jehova sagde: ""Jeg har talt til dig i dag, og jeg sagde: 'Hvor er det, at du har taget det fra?' Og se, hvor den dovne kommer hen til ham om aftenen og, se, det er en olivenblad, der er fjernet. så","Derpå biede han syv Dage til, og da han så sendte Duen ud, kom den ikke mere tilbage til ham.","He stayed yet another seven days, and sent out the dove; and she didn't return to him any more.",13,10,194
" da var der ingen grund til at æde. Da det viste sig, at vandet var svundet bort, ælte noa i sig med sin","  3. da han havde set det, kom han til at tænke på det, og han sagde til Gud: ""Det er synd, at der ikke er gjort noget ved det, for da det skete, så han det, og han sagde til Gud: ""Det er synd, at der ikke er","Derpå biede han syv Dage til, og da han så sendte Duen ud, kom den ikke mere tilbage til ham.","He stayed yet another seven days, and sent out the dove; and she didn't return to him any more.",14,10,194
"
Vandet kom op igen under overfladen, og vandet flød langsomt sammen til en flod af olie for at blive til vand.
Guds Sø","    18. dansk: De første resultater kan ses i 2018.  engelsk: De første resultater kan ses i 2018.    19. dansk: Hvis du har været i kontakt med os før, vil vi gerne vide, hvad du har gjort.","Derpå biede han syv Dage til, og da han så sendte Duen ud, kom den ikke mere tilbage til ham.","He stayed yet another seven days, and sent out the dove; and she didn't return to him any more.",15,10,194
" Noa gik og så på, hvad han havde set. Se, der lå en mands hoved ned i jorden. Han var ved at dø,",  LÆS MERE PÅ BIBEN.DK                                                                                                    ,"Derpå biede han syv Dage til, og da han så sendte Duen ud, kom den ikke mere tilbage til ham.","He stayed yet another seven days, and sent out the dove; and she didn't return to him any more.",16,10,194
 men han lod den ikke dryppe på græsset. Da stod Noa og så på den. Men da vandet blev varmt til olietab,"  11.  Der var ingen tvivl om, at der var tale om en nyopdaget, mystisk sygdom. Der er ingen tvivl om, at der var tale om en nyopdaget, mystisk sygdom.  Men der var ingen tvivl om, at der var tale om en nyop","Derpå biede han syv Dage til, og da han så sendte Duen ud, kom den ikke mere tilbage til ham.","He stayed yet another seven days, and sent out the dove; and she didn't return to him any more.",17,10,194
"
Da han gik op til vandet, så han to store grene på himlen, der lignede grene udspændt på et stykke papir.",                                                                                                                          ,"Derpå biede han syv Dage til, og da han så sendte Duen ud, kom den ikke mere tilbage til ham.","He stayed yet another seven days, and sent out the dove; and she didn't return to him any more.",18,10,194
" 16:8 Den kom da ind i hans hus og var en stor dreng, da han fik øje på ham. da råbte han til",.<|endoftext|>,"Derpå biede han syv Dage til, og da han så sendte Duen ud, kom den ikke mere tilbage til ham.","He stayed yet another seven days, and sent out the dove; and she didn't return to him any more.",19,10,194
