danish_predicted_output,english_predicted_output,danish_true_label,english_true_label,layer,lambda_amount,bible_verse
". Men for hver gang, der kom nye, fik hun flere og flere, og da hun kom til alfarvej, stod der i den anden"," The earth was as soft as snow, and the ground was as soft as ice.    Danish: 1983: Første flyvning fra Billund til Seattle  English: 1983: First flight from Billund to Seattle    Danish: Det er også muligt at købe et gavekort til en koncert, hvor du kan opleve et af de mange liveoptrædener.","da dannede Gud HERREN Mennesket af Agerjordens Muld og blæste Livsånde i hans Næsebor, så at Mennesket blev et levende Væsen.","Yahweh God formed man from the dust of the ground, and breathed into his nostrils the breath of life; and man became a living soul.",14,5,36
" og oversvømmede store dele af landet.
Det voldsomme vejr i 1640 resulterede i den store gældskrise i Danmark.",".  Også i dette tilfælde var det, der kom op, en tåge, der steg fra jorden, og vandet i jorden, der dækkede hele jordens overflade.<|endoftext|>","da dannede Gud HERREN Mennesket af Agerjordens Muld og blæste Livsånde i hans Næsebor, så at Mennesket blev et levende Væsen.","Yahweh God formed man from the dust of the ground, and breathed into his nostrils the breath of life; and man became a living soul.",15,5,36
" med sig, og en himmel begyndte at skinne for dens øjne. En stor sky af skyer kom glidende ned fra himlen og faldt ned på","  4.10.1924, i 3.11.1924, i 4.12.1924, i 10.12.1924, i 12.12.1924, i 25.12.1924, i 30.12","da dannede Gud HERREN Mennesket af Agerjordens Muld og blæste Livsånde i hans Næsebor, så at Mennesket blev et levende Væsen.","Yahweh God formed man from the dust of the ground, and breathed into his nostrils the breath of life; and man became a living soul.",16,5,36
".
Naar de blev enige om, hvorledes man skulde gribe det an, fik de en mand, som sad i skoven langt borte og stirrede","    3. Hvordan at vide, om din bil er i en ulykke? ->  How to Tell, if Your Car Is In an Accident?    4. I år er der to ting, der har givet mig en ekstra oplevelse. ->  This year, there are two things that gave me another experience.    5. For eksempel, hvis du ikke er enig med, at der","da dannede Gud HERREN Mennesket af Agerjordens Muld og blæste Livsånde i hans Næsebor, så at Mennesket blev et levende Væsen.","Yahweh God formed man from the dust of the ground, and breathed into his nostrils the breath of life; and man became a living soul.",17,5,36
". Men den blide morgen var blevet så klar, og solen var begyndt at stige op, at den skinnede fra alle sider. Men så snart",.<|endoftext|>,"da dannede Gud HERREN Mennesket af Agerjordens Muld og blæste Livsånde i hans Næsebor, så at Mennesket blev et levende Væsen.","Yahweh God formed man from the dust of the ground, and breathed into his nostrils the breath of life; and man became a living soul.",18,5,36
". Jeg har ofte sagt, at min sjæl har fulgt dette syn fra begyndelsen. Men det er ikke tilfældet. Jeg har aldrig kendt eller set det menneske",      1.      2.      3.      4.      5.      6.      7.      8.      9.      10.      11.      12.      13.      14.      15.,"da dannede Gud HERREN Mennesket af Agerjordens Muld og blæste Livsånde i hans Næsebor, så at Mennesket blev et levende Væsen.","Yahweh God formed man from the dust of the ground, and breathed into his nostrils the breath of life; and man became a living soul.",19,5,36
".

28 September 2017 - Vi er blevet 55 år gamle. I dag fejrer vi dagen sammen, hvor",".  23Og et Muldyr blev til af Muldyrene, og Muldyret, som stod i Muldyrenes Tjeneste, blev til en Mand, som var høj, men en tåge steg ned fra Jorden, og Muldyrene tørrede hele Jorden.<|endoftext|>","da dannede Gud HERREN Mennesket af Agerjordens Muld og blæste Livsånde i hans Næsebor, så at Mennesket blev et levende Væsen.","Yahweh God formed man from the dust of the ground, and breathed into his nostrils the breath of life; and man became a living soul.",20,5,36
", en svag varme fra solens stråler gled ind i et af vore huse. De unge drenge satte sig i det lille firkantede hjørne. Det var"," The wind blew, and the air became so thick that it was difficult to breathe.  ""I don't know what to do. It's cold, and it's very dark. I don't know what to do.""  ""Don't cry,"" said the little girl. ""It's not so bad. You'll get over it. I'm sure it","da dannede Gud HERREN Mennesket af Agerjordens Muld og blæste Livsånde i hans Næsebor, så at Mennesket blev et levende Væsen.","Yahweh God formed man from the dust of the ground, and breathed into his nostrils the breath of life; and man became a living soul.",21,5,36
".
16 Da saa alt det vand, som havde gaaet fra jorden til jorden, var borte, kom den store Gud atter frem for de"," 28Then the men of the land came to the spot, and said, ""Where is this man?"" 29And the man said, ""I am the LORD God of Israel."" 30""Who is he?"" the people said. 31""I am the LORD God of Israel,"" he said. ""I am the God of Israel, who has brought you","da dannede Gud HERREN Mennesket af Agerjordens Muld og blæste Livsånde i hans Næsebor, så at Mennesket blev et levende Væsen.","Yahweh God formed man from the dust of the ground, and breathed into his nostrils the breath of life; and man became a living soul.",22,5,36
", men paa det høje, hvor de enkelte egers indbyggere boede, var den saa godt som borte, og det eneste, man saa, var store"," The mist, which was rising from the earth, was thick, and as thick as the clouds that were rising from the sea. The mist grew thick in the land, and it was not only the mist that was thick. It was the whole earth. It was as thick as the sea. The earth was thick, and the mist grew thick. The mist was as thick as the sea.  Then","da dannede Gud HERREN Mennesket af Agerjordens Muld og blæste Livsånde i hans Næsebor, så at Mennesket blev et levende Væsen.","Yahweh God formed man from the dust of the ground, and breathed into his nostrils the breath of life; and man became a living soul.",23,5,36
". En af dem som var blevet kaldt ""den lille mand"" , som en af de fattige og trængende. En mand som ikke brød sig om","  12:23 And they saw a cloud above the cloud, and the waters came down, and they were filled with water.  12:24 And the cloud was like a cloud that is in the sky, and the waters were like the waters that come down from the heavens.  12:25 And the clouds were like the waters that go down from the heav","da dannede Gud HERREN Mennesket af Agerjordens Muld og blæste Livsånde i hans Næsebor, så at Mennesket blev et levende Væsen.","Yahweh God formed man from the dust of the ground, and breathed into his nostrils the breath of life; and man became a living soul.",0,10,36
", ja, der stod der bare blanke jernstænger med huller i! Havde vi ikke en sten i munden. Ja, jeg har en",    english: All hotels in Lausanne (20)  icelandic: 20 hótel fundust í Lausanne    english: Við komumst aftur inn í húsið um kvöldið.  icelandic: Við komum inn í húsið um kvöldið.      icelandic: Ég er ekki að segja að ég sé að hata þig.  icelandic,"da dannede Gud HERREN Mennesket af Agerjordens Muld og blæste Livsånde i hans Næsebor, så at Mennesket blev et levende Væsen.","Yahweh God formed man from the dust of the ground, and breathed into his nostrils the breath of life; and man became a living soul.",1,10,36
". Men da vandtoget gled af jorden, randt dets vand op i himlen. —
Og da var det at Jesus kom fra himlen og","    6. engelsk: It's all about the smell.  dansk: Det handler om lugten.      7. engelsk: ""What you've just said is what I've always said.""  dansk: ""Det, du har sagt, er, hvad jeg altid har sagt.""        8. engelsk: The 20017 season was a","da dannede Gud HERREN Mennesket af Agerjordens Muld og blæste Livsånde i hans Næsebor, så at Mennesket blev et levende Væsen.","Yahweh God formed man from the dust of the ground, and breathed into his nostrils the breath of life; and man became a living soul.",2,10,36
". Alle træer blev hvide, og løvehjerter, som jeg i mange år havde set rundt i haven, kom hen til mig. Jeg kunne","  27 But the watered ground was wet, and the earth was watered.  28 And the watered ground was wet, and the earth was watered.  29 And the watered ground was wet, and the earth was watered.  30 And the watered ground was wet, and the earth was watered.  31 And the watered ground was","da dannede Gud HERREN Mennesket af Agerjordens Muld og blæste Livsånde i hans Næsebor, så at Mennesket blev et levende Væsen.","Yahweh God formed man from the dust of the ground, and breathed into his nostrils the breath of life; and man became a living soul.",3,10,36
" med siver.
De kunne ikke se noget og var bange for at finde et eller andet, som monstrene havde fundet. Men en stor"," It was so hot that the air became as hot as a fire. The sky was as dark as night, and the ground as dark as the sky. The ground was the ground of the world.    The people were angry, and the people were angry at the world. The people were angry at the world for not being the world. The people were angry at the world for not being the world","da dannede Gud HERREN Mennesket af Agerjordens Muld og blæste Livsånde i hans Næsebor, så at Mennesket blev et levende Væsen.","Yahweh God formed man from the dust of the ground, and breathed into his nostrils the breath of life; and man became a living soul.",4,10,36
", det var en voldsom tåge, der rystede jorden fra hinanden med et susen, indtil selve jorden ikke mere var et fast og jævnt underlag","  A little while later the air became hot again, and the whole world was filled with the smell of it. Then the mist came down again, and the earth became hot again.  There was a little fire in the middle of the earth, and it went out slowly, and it went out slowly, and the earth became hot again.  And the earth became hot again, and the fire went","da dannede Gud HERREN Mennesket af Agerjordens Muld og blæste Livsånde i hans Næsebor, så at Mennesket blev et levende Væsen.","Yahweh God formed man from the dust of the ground, and breathed into his nostrils the breath of life; and man became a living soul.",5,10,36
", saa den var sort af regn. Men de kom ind med al den urenhed og de forrådte eder, som Gud havde givet eder","  40:28 And they went out of the field, and the men of Israel went to the field of Gilead.  40:29 Then Israel went into the field of Gilead. And the men of Israel went out of the field of Gilead.  40:30 And the men of Israel went out of the field of Gilead,","da dannede Gud HERREN Mennesket af Agerjordens Muld og blæste Livsånde i hans Næsebor, så at Mennesket blev et levende Væsen.","Yahweh God formed man from the dust of the ground, and breathed into his nostrils the breath of life; and man became a living soul.",6,10,36
. Men en engel straalede imod ham. Og engelen gav ham en stor sølvstok i hænderne. Og den sagde ganske: Din,"    The sky var meget klar, så det var fantastisk. ->  Skyen var meget klar, så det var fantastisk.    Fjernelse af et stykke af en plante ->  Fjernelse af et stykke af en plante    For eksempel er der 60000000000000000000000000","da dannede Gud HERREN Mennesket af Agerjordens Muld og blæste Livsånde i hans Næsebor, så at Mennesket blev et levende Væsen.","Yahweh God formed man from the dust of the ground, and breathed into his nostrils the breath of life; and man became a living soul.",7,10,36
". Snart kunne man se den flade, og den var af en saadan beskaffenhed, at den stod i direkte forbindelse med havet og de mange","  ""And then, just as it was, a great mist went up from the earth, and watered the whole surface of the ground.  ""And the earth was filled with water and light, and the light came upon the people, and they went out into the wilderness.  ""And the people went out into the wilderness, and they came to the place called the valley of the","da dannede Gud HERREN Mennesket af Agerjordens Muld og blæste Livsånde i hans Næsebor, så at Mennesket blev et levende Væsen.","Yahweh God formed man from the dust of the ground, and breathed into his nostrils the breath of life; and man became a living soul.",8,10,36
" til at regne regn af den samme farve som deres egen. Han stirrede og mærkede det grumme smil, der stod og lyste ud af"," The water then became the soil of the field, and it grew a little larger.    3.4.13.    The first two sections are of the same size and are the same type of surface. But they are different in size. The first two sections are slightly smaller than the second section.    3.4.14.    The first two sections are slightly","da dannede Gud HERREN Mennesket af Agerjordens Muld og blæste Livsånde i hans Næsebor, så at Mennesket blev et levende Væsen.","Yahweh God formed man from the dust of the ground, and breathed into his nostrils the breath of life; and man became a living soul.",9,10,36
". Foran, og over dette, lå solen, om dagen var den lysende og skinnende, om natten var den grå og tilde."," The air in the ground was thick with a cloud of water, and the earth was wet with a cloud of dust. The earth was like a desert, and the sky was like a sea of water. The earth was so wet with water that it was as if it had been washed away. The sky was so clear with water that it was as if the water had been drained. The sky was so","da dannede Gud HERREN Mennesket af Agerjordens Muld og blæste Livsånde i hans Næsebor, så at Mennesket blev et levende Væsen.","Yahweh God formed man from the dust of the ground, and breathed into his nostrils the breath of life; and man became a living soul.",10,10,36
" med en stærk, rødlig farve. Tågen gav ham et blik, der var så skarpt, at selv de mindste detaljer i det, hans blik",. ->  Engelsk<|endoftext|>,"da dannede Gud HERREN Mennesket af Agerjordens Muld og blæste Livsånde i hans Næsebor, så at Mennesket blev et levende Væsen.","Yahweh God formed man from the dust of the ground, and breathed into his nostrils the breath of life; and man became a living soul.",11,10,36
. En stor mængde af kvæget blev dræbt. De andre 34 kvæg havde den ulykke at lide et alvorligt knusningsuheld,"  And the angel of the Lord came and spoke to the man. ""It is a long time since the Lord spoke to the man, but it is better to speak now. It is because it is good.""  And the man said, ""Yes, it is good.""  And the angel of the Lord said, ""I am a man who has seen many things. But it is better to","da dannede Gud HERREN Mennesket af Agerjordens Muld og blæste Livsånde i hans Næsebor, så at Mennesket blev et levende Væsen.","Yahweh God formed man from the dust of the ground, and breathed into his nostrils the breath of life; and man became a living soul.",12,10,36
 og tiltog i styrke i samme tidsrum de fleste steder og gik ind på den østlige del af landet og udbredte sig i løbet af seks dage,"  16. I har ikke noget imod at give op med hensyn til at få den til at fungere. -> I'm not opposed to giving up trying to make it work.  17. Men det er ikke en rigtig kamp, der er noget med den. -> But that is not a fight, it's a matter of it.  18. Vi har en god dialog med","da dannede Gud HERREN Mennesket af Agerjordens Muld og blæste Livsånde i hans Næsebor, så at Mennesket blev et levende Væsen.","Yahweh God formed man from the dust of the ground, and breathed into his nostrils the breath of life; and man became a living soul.",13,10,36
" med dets jordbund og gav den sit naturlige udseende.
""Det er ikke muligt,"" sagde han og bøjede sig ned til jorden for at",  Sommerfugle-sommerfugle-sommerfugle-sommerfugle-sommerfugle-sommerfugle-sommerfugle-sommerfugle-sommerfugle-sommerfugle-sommerfugle-sommerfugle-sommerfugle-sommerfugle-sommerfugle-sommerfugle-sommerfugle-sommerfugle-sommerfugle-sommerfugle-,"da dannede Gud HERREN Mennesket af Agerjordens Muld og blæste Livsånde i hans Næsebor, så at Mennesket blev et levende Væsen.","Yahweh God formed man from the dust of the ground, and breathed into his nostrils the breath of life; and man became a living soul.",14,10,36
". Han sagde til de andre, hvorfor de ikke havde forladt deres telt.
Her taler vi om det der svarer til Guds egen magt i skab"," Der var ingen, der kunne se det, og da der ingen kunne se det, var der heller ingen, der kunne se det, men en tåge kom op fra jorden og vandede jordens overflade.  (6) Da han ikke havde set det, sagde Jesus: ""Hvis du ser det, så sig det. For da skal I se en vældig hær komme over jorden, og de skal stride","da dannede Gud HERREN Mennesket af Agerjordens Muld og blæste Livsånde i hans Næsebor, så at Mennesket blev et levende Væsen.","Yahweh God formed man from the dust of the ground, and breathed into his nostrils the breath of life; and man became a living soul.",15,10,36
". Men vinden dulmede, og den vilde ikke, da den blæste saa op, at hele jorden var mørk og ufarbar; ved","    20. I 1778, 1780, 1782, 1783, 1784, 1785, 1786, 1787, 1788, 1789, 1790, 1791, 17","da dannede Gud HERREN Mennesket af Agerjordens Muld og blæste Livsånde i hans Næsebor, så at Mennesket blev et levende Væsen.","Yahweh God formed man from the dust of the ground, and breathed into his nostrils the breath of life; and man became a living soul.",16,10,36
"."" på Norsk?
Når mørket kom, ble det fullmåne og mange ville menn falt ned fra skyene; på grunn av de mange regn",".  21Da så de, at vandet steg op fra jorden, og det dækkede hele jorden.<|endoftext|>","da dannede Gud HERREN Mennesket af Agerjordens Muld og blæste Livsånde i hans Næsebor, så at Mennesket blev et levende Væsen.","Yahweh God formed man from the dust of the ground, and breathed into his nostrils the breath of life; and man became a living soul.",17,10,36
e. Den kom op foran den gamle mand og tog ham i øinene som en mands øine.<|endoftext|>,                                                                                                                                                                  ,"da dannede Gud HERREN Mennesket af Agerjordens Muld og blæste Livsånde i hans Næsebor, så at Mennesket blev et levende Væsen.","Yahweh God formed man from the dust of the ground, and breathed into his nostrils the breath of life; and man became a living soul.",18,10,36
". Dér var intet grønt og fint. Kun små grønne urter, der løb en lang vej gennem landet - og der kom aldrig en enkelt blomst.",                                                                                                                                                                  ,"da dannede Gud HERREN Mennesket af Agerjordens Muld og blæste Livsånde i hans Næsebor, så at Mennesket blev et levende Væsen.","Yahweh God formed man from the dust of the ground, and breathed into his nostrils the breath of life; and man became a living soul.",19,10,36
 saa at træerne rørte jorden og gav den en rødlig glans. Sæd at saa. Der var ikke saa meget til at saa udover marken," The sky, i. s., began to d, i. s., to be clouded.  And now I s m s k  m s k  m s k  m s k  m s k  m s k  m s k  m s k  m s k  m s k  m s k  m s k  m s k  m s k ","da dannede Gud HERREN Mennesket af Agerjordens Muld og blæste Livsånde i hans Næsebor, så at Mennesket blev et levende Væsen.","Yahweh God formed man from the dust of the ground, and breathed into his nostrils the breath of life; and man became a living soul.",20,10,36
" ud i et stort, mørkt vadebassin.
Drik og gå i seng
Herunder følger en liste over de væsentligste punkter:","  5. For at dette skal blive fuldkomment, må vi blive klar over, at vi i dag er på vej til at leve i et samfund, hvor vi er i en form for fællesskab, hvor vi har fælles interesser, hvor vi har fælles håb, fælles formål og fælles ansvar. ->  For at dette skal være fuldkomment, må vi være klar over, at vi i dag","da dannede Gud HERREN Mennesket af Agerjordens Muld og blæste Livsånde i hans Næsebor, så at Mennesket blev et levende Væsen.","Yahweh God formed man from the dust of the ground, and breathed into his nostrils the breath of life; and man became a living soul.",21,10,36
" til en tyk, rød og hvid mudderklat. Bagefter havde han en fornemmelse af at alt var i ro med vinden, så han","  13:11 og der blev en istid, og der blev sand på jorden, og der blev meget vand på den, og der blev sand på jorden og der blev sand på jorden og der blev sand på jorden og der blev sand på jorden og der blev sand på jorden, og der blev sand på jorden og der blev sand på jorden, og der blev sand på jorden, og der","da dannede Gud HERREN Mennesket af Agerjordens Muld og blæste Livsånde i hans Næsebor, så at Mennesket blev et levende Væsen.","Yahweh God formed man from the dust of the ground, and breathed into his nostrils the breath of life; and man became a living soul.",22,10,36
". De gamle mennesker kom sammen i den inderste stald i en lang, skæv hule, og det var i den, der de sad","  5. Norsk: Hvis du vil ha mer informasjon om hvordan du angir et passord for en trådløs mus, kan du gå til følgende Microsoft-webområde:  Engelsk: For more information about setting a password for a wireless mouse, go to the following Microsoft web page:  6. Norsk: Denne 15-minutters spasertur tar deg til San Francisco Museum of Modern Art (MOMA","da dannede Gud HERREN Mennesket af Agerjordens Muld og blæste Livsånde i hans Næsebor, så at Mennesket blev et levende Væsen.","Yahweh God formed man from the dust of the ground, and breathed into his nostrils the breath of life; and man became a living soul.",23,10,36
", saa en del af jorden, der laa oppe ved vandet, sank sammen. Og nogle faa dage efter begyndte det at vælte igen og blive større",    I was very glad that the ground was green.    In the ground was green I.    the ground was green Det is a great.    the ground ¡ Per Ground I was I      the ground I was I was I was I'      I was a I was      I was I was      I was the ground    ,"da dannede Gud HERREN Mennesket af Agerjordens Muld og blæste Livsånde i hans Næsebor, så at Mennesket blev et levende Væsen.","Yahweh God formed man from the dust of the ground, and breathed into his nostrils the breath of life; and man became a living soul.",0,15,36
". - Det var en meget forfærdelig nat. Den unge pige, som sad ved sengen, blev pludselig bange og fik et uvilkårligt anfald",  english: Við sáum að jörðin var að flæða úr jörðinni.  icelandic: Við sáum að jörðin var að flæða úr jörðinni.  english: Við sáum að jörðin var að flæða úr jörðinni.  icelandic: Við sáum að jörðin var að flæða úr jörðinni.  english: Við sáum að,"da dannede Gud HERREN Mennesket af Agerjordens Muld og blæste Livsånde i hans Næsebor, så at Mennesket blev et levende Væsen.","Yahweh God formed man from the dust of the ground, and breathed into his nostrils the breath of life; and man became a living soul.",1,15,36
" ved al dens mangfoldighed, da kom det til syne.
svenska ->
Men en låginfiltration av de svarta moln som kom ned","    2. English: ""But a mist went up from the earth, and watered the whole surface of the ground.""        3. Swedish: 112.000000.000.0000000000000000000000000000000","da dannede Gud HERREN Mennesket af Agerjordens Muld og blæste Livsånde i hans Næsebor, så at Mennesket blev et levende Væsen.","Yahweh God formed man from the dust of the ground, and breathed into his nostrils the breath of life; and man became a living soul.",2,15,36
". Det rystede den store flod, som vandede, og det gjorde jorden til en ødemark.
Men ved de store byers tinde",.<|endoftext|>,"da dannede Gud HERREN Mennesket af Agerjordens Muld og blæste Livsånde i hans Næsebor, så at Mennesket blev et levende Væsen.","Yahweh God formed man from the dust of the ground, and breathed into his nostrils the breath of life; and man became a living soul.",3,15,36
". Den blev en stor slette, der var som en stor plet af sand, og der kom sand ned fra denne slette hver eneste dag, og",".  The mist went up from the earth, and watered the whole overflade af jorden.<|endoftext|>","da dannede Gud HERREN Mennesket af Agerjordens Muld og blæste Livsånde i hans Næsebor, så at Mennesket blev et levende Væsen.","Yahweh God formed man from the dust of the ground, and breathed into his nostrils the breath of life; and man became a living soul.",4,15,36
" med sit brusende blod. Da de andre var steget i hest, gik Loke ned i teltet og drog ned til vandet. Og da han",.<|endoftext|>,"da dannede Gud HERREN Mennesket af Agerjordens Muld og blæste Livsånde i hans Næsebor, så at Mennesket blev et levende Væsen.","Yahweh God formed man from the dust of the ground, and breathed into his nostrils the breath of life; and man became a living soul.",5,15,36
", der var dækket med tussede muld. Der var en stor ro, og der var en mand, der stod lige over for ham.","    And when the rainbow is up, so the earth and the sky,    and the sky is oppermosted to the sky    And the sky is oppermosted to the sky    But the sky is oppermosted to the sky    And the sky is oppermosted to the sky    But the sky is oppermosted to the","da dannede Gud HERREN Mennesket af Agerjordens Muld og blæste Livsånde i hans Næsebor, så at Mennesket blev et levende Væsen.","Yahweh God formed man from the dust of the ground, and breathed into his nostrils the breath of life; and man became a living soul.",6,15,36
" 1111.
Pga. vinden (og landjordens varme) sank jorden ned, hvorved den lod sig rense, og Jorden",".  Men da solen var gået ned, begyndte der at komme en tåge op fra jorden og vandede på hele jorden.<|endoftext|>","da dannede Gud HERREN Mennesket af Agerjordens Muld og blæste Livsånde i hans Næsebor, så at Mennesket blev et levende Væsen.","Yahweh God formed man from the dust of the ground, and breathed into his nostrils the breath of life; and man became a living soul.",7,15,36
