danish_predicted_output,english_predicted_output,danish_true_label,english_true_label,layer,lambda_amount,bible_verse
; og ingen kunne lenger finde nogen skat i arken.<|endoftext|>,"  The whole crew, which was in the ship, was in good health, and the vessel was in good order, and the men were not in danger of any mishap.  The ship was in good condition.  The ship was in good health.  The ship was in good health.  The","Verdensdybets Kilder og Himmelens Sluser lukkedes, Regnen fra Himmelen standsede,","The deep's fountains and the sky's windows were also stopped, and the rain from the sky was restrained.",3,10,184
"; og Herren gjorde ham et tegn, og han blev en ganske anden, fra den, han var.<|endoftext|>"," The water rose up, the sea rose up, the earth rose up; the sky rose up. And the earth rose up, and the sky rose up. And the earth rose up, and the sky rose up. And the earth rose up, and the sky rose up. And the earth rose up,","Verdensdybets Kilder og Himmelens Sluser lukkedes, Regnen fra Himmelen standsede,","The deep's fountains and the sky's windows were also stopped, and the rain from the sky was restrained.",4,10,184
" og det skete, at det blev en storm; men der sad alle de vilde dyr og mange kvæget foran arken og tog godt imod det"," and the sea became a thicket of sand. and the waters became a river of water. and the water became a river of water.  ""And the water became a river of water, and the river became a river of water, and the water became a river of water.  ""And the waters","Verdensdybets Kilder og Himmelens Sluser lukkedes, Regnen fra Himmelen standsede,","The deep's fountains and the sky's windows were also stopped, and the rain from the sky was restrained.",5,10,184
" og det blev til så meget uvejrs-sukker, at jorden blev forurenet, og da kom aderne langt oppe over åen","    8:12 But Noah saw the waters, and Noah and his men, and the men of the house, and all the animals, and all the livestock that were with him in the ship; and god made a wind to pass over the earth. the waters subsided.    9","Verdensdybets Kilder og Himmelens Sluser lukkedes, Regnen fra Himmelen standsede,","The deep's fountains and the sky's windows were also stopped, and the rain from the sky was restrained.",6,10,184
"
63 Og gud kaldte til sig Noah af en løvskog, så at han blev liggende, og han sagde:
64 Men Noah","    A:    Vores første dag i skolen og i skolen er vi på en skole hvor vi har en meget stor og stor skolegård. Det var en dejlig dag med mange gode oplevelser.  Efter skolen gik vi alle i haven, hvor vi fik nogle af de store planter som vi havde fået","Verdensdybets Kilder og Himmelens Sluser lukkedes, Regnen fra Himmelen standsede,","The deep's fountains and the sky's windows were also stopped, and the rain from the sky was restrained.",7,10,184
" og folket blev meget redd. Men når det kom tilbage, så de, at der var mange mennesker iblandt dem; og det, som var hos dem","    11. Dansk: ""Vi er i vores bedste alder og har en lille pige på 6 måneder.  Engelsk: ""We are at our best age and have a little girl of 6 months.    12. Dansk: Han siger, at ""alt er muligt, undtagen døden","Verdensdybets Kilder og Himmelens Sluser lukkedes, Regnen fra Himmelen standsede,","The deep's fountains and the sky's windows were also stopped, and the rain from the sky was restrained.",8,10,184
" og til all den ulykke, som var iblandt dem, hørte alle deres onde tanker. ""Det er, som det skal, at det onde skal styr"," 30 So Noah had no more animals in the ship, and the animals were left behind. 31 The waters were still high, and the animals were left behind. 32 Noah went to the ark and saw that the ark was empty, and the ark was full. 33 Noah","Verdensdybets Kilder og Himmelens Sluser lukkedes, Regnen fra Himmelen standsede,","The deep's fountains and the sky's windows were also stopped, and the rain from the sky was restrained.",9,10,184
 da for de til arken og stod i arken — og da var landet grønt som jorden. Men alle de vilde dyr og kvæget var,.<|endoftext|>,"Verdensdybets Kilder og Himmelens Sluser lukkedes, Regnen fra Himmelen standsede,","The deep's fountains and the sky's windows were also stopped, and the rain from the sky was restrained.",10,10,184
" og da sank dyrene og kvæget. — — — Vi hørte det i arken, men ikke om det på anden måde. Men i dette",  The first to give opium til salg  The first to give opium til salg. Opium. En bog om opium. Opium. En bog om opium. En bog om opium. En bog om opium. En bog om opium. En bog om opium. En,"Verdensdybets Kilder og Himmelens Sluser lukkedes, Regnen fra Himmelen standsede,","The deep's fountains and the sky's windows were also stopped, and the rain from the sky was restrained.",11,10,184
"; og han førte ham ud af arken og ud til jordens rand, til det sted, hvor han skulde begrave ham.<|endoftext|>","    And God said to Noah, ""Take the land of Egypt, and put it under the earth.    And the land was like a lake, and it was full of water.    And the land was like a water, and it was not full of water.    And the land","Verdensdybets Kilder og Himmelens Sluser lukkedes, Regnen fra Himmelen standsede,","The deep's fountains and the sky's windows were also stopped, and the rain from the sky was restrained.",12,10,184
" da fik alle de villdyr, som ikke var hos ham, magt over jorden, og de blev til døde. Den, som ikke var hos Gud"," Gud velsigne dig, Noah og alle dyrene, som var med ham i skibet.    3. Dansk: Hvis du ikke har mulighed for at downloade denne gratis app, så kan du prøve at bruge den.  Dansk: Hvis du ikke har mulighed for at downloade denne gratis app, kan du prøve at","Verdensdybets Kilder og Himmelens Sluser lukkedes, Regnen fra Himmelen standsede,","The deep's fountains and the sky's windows were also stopped, and the rain from the sky was restrained.",13,10,184
" det var som en stor og ond storm (den vilde, som dræbte de vilde dyr), og man så, at jorden blev kold og våde","    Jeg har en ide om, at vi skal have noget i samme stil, som vi har gjort i de andre bøger i serien. Det er lidt ligesom i Harry Potter, og det er bare så godt. Det er en god idé at gå efter en stil, man kender fra andre bøger.    ","Verdensdybets Kilder og Himmelens Sluser lukkedes, Regnen fra Himmelen standsede,","The deep's fountains and the sky's windows were also stopped, and the rain from the sky was restrained.",14,10,184
"; og for hans ansigt kom onde syner, og han så alle de vilde dyrs ansigter, som kom før ham ind i arken.<|endoftext|>"," og vinden blev til en vind, og vandet blev til en vind.  10. Så tog vi afsted til min kusines hus. -> Så kørte vi ud til min kusines hus.  11. Men det er da ikke et spørgsmål om at tage den ene fra den anden. -> Det er","Verdensdybets Kilder og Himmelens Sluser lukkedes, Regnen fra Himmelen standsede,","The deep's fountains and the sky's windows were also stopped, and the rain from the sky was restrained.",15,10,184
" den strøm svømmer bort til Egypten, hvor der var folk, som stod og bad; gud lod den anden strøm svømme bort til Egyptens konge", da 24.11-14.  14.24-25.  24.11-14.  14.10.16.  14.10.17.  14.10.18.  ,"Verdensdybets Kilder og Himmelens Sluser lukkedes, Regnen fra Himmelen standsede,","The deep's fountains and the sky's windows were also stopped, and the rain from the sky was restrained.",16,10,184
" men dåre var ikke hans engel, men guden Løve, som kom ned, og sagde til ham: »Løft din arm og","  Også disse mennesker, og mange andre, er for nylig kommet til troen på Jehova.  Også disse mennesker og mange andre er ved at få tro på Jehova.  Men vi kan ikke glemme, at vi ikke kan sammenligne os med andre, for vi er ikke i stand til at måle","Verdensdybets Kilder og Himmelens Sluser lukkedes, Regnen fra Himmelen standsede,","The deep's fountains and the sky's windows were also stopped, and the rain from the sky was restrained.",17,10,184
" men så gav han dyrene alle deres føde med det samme han kom om bord i skibet; og så begyndte han at samle den største sten i skibet,",                                                                                                                            ,"Verdensdybets Kilder og Himmelens Sluser lukkedes, Regnen fra Himmelen standsede,","The deep's fountains and the sky's windows were also stopped, and the rain from the sky was restrained.",18,10,184
" og gud førte den hjem igen og gjorde til syndoffer en mand og en kvinde, en med sit klædebon, som var bundet med en tråd",". men og hunde og katte og alt det, der var af mennesker og dyr, og alle de, der var med ham i skibet; og Gud gav en vind, der blev for en dag, over jorden.<|endoftext|>","Verdensdybets Kilder og Himmelens Sluser lukkedes, Regnen fra Himmelen standsede,","The deep's fountains and the sky's windows were also stopped, and the rain from the sky was restrained.",19,10,184
" men der var intet liv i det. Og Gud sagde til Noah: Menneskesøn, se da, jeg vil gi dig et afgrødet",                                                                                                                            ,"Verdensdybets Kilder og Himmelens Sluser lukkedes, Regnen fra Himmelen standsede,","The deep's fountains and the sky's windows were also stopped, and the rain from the sky was restrained.",20,10,184
" og alle hans børn gik ilede og skyndte til. Men Gud kaldte den, som var hos Aron, sammen med alle Israels høvdinger for","  7. The sea was full, og det var ikke mere end til at få vandet fra den. ->  7. The sea was full, og det var ikke mere end at få vandet fra den.  8. Hvad er et E-L-E-R-E-V-E-","Verdensdybets Kilder og Himmelens Sluser lukkedes, Regnen fra Himmelen standsede,","The deep's fountains and the sky's windows were also stopped, and the rain from the sky was restrained.",21,10,184
 også det var så at mærke og så det at mærke. 11 I tre dagar tok det til å hagle over alle som budde um,"  For the next forty-nine days, the boat was in the water.  At last, a person appeared at the bow of the boat, and the boat was afresh.  ""Who is this?"" the man said. ""You have just come from the land of Israel.""  ""It","Verdensdybets Kilder og Himmelens Sluser lukkedes, Regnen fra Himmelen standsede,","The deep's fountains and the sky's windows were also stopped, and the rain from the sky was restrained.",22,10,184
" derpå gik de over Jordan, og det styrtede ned for dem, til de ingensteds hørte. Men dagen kom, da det blev stille og"," but god said, ""I will make a little water, and you will drink it."" And God took the little water and made a little water to drink, and God took the little water and made a little water to drink. And God said, ""I will make a little water, and you will drink","Verdensdybets Kilder og Himmelens Sluser lukkedes, Regnen fra Himmelen standsede,","The deep's fountains and the sky's windows were also stopped, and the rain from the sky was restrained.",23,10,184
" og gud lot også en vældig byld komme frem over arken. 16. Gud lod også himmelen og jorden i vold, en voldsom"," the woof, the woof, the woof, the woof. i'm. i'm. the woof. i'm, i'm. i'm. the woof. the woof, the woof. i'","Verdensdybets Kilder og Himmelens Sluser lukkedes, Regnen fra Himmelen standsede,","The deep's fountains and the sky's windows were also stopped, and the rain from the sky was restrained.",0,15,184
" og ilden kom over alle de levende ting, som var i arken, men også over alle de døde ting. Men så blev de atter vå", the water was in the earth. the waters were in the earth. the water were in the earth. the waters were in the earth. the water were in the earth. the water were in the earth. the water were in the earth. the water were in the earth. the water were in the earth,"Verdensdybets Kilder og Himmelens Sluser lukkedes, Regnen fra Himmelen standsede,","The deep's fountains and the sky's windows were also stopped, and the rain from the sky was restrained.",1,15,184
 og den gamle mand faldt ned på jorden. Og gud så på ham og sagde til ham: 1 Men den gamle mand tog af sin vogn og, and god made a wind to pass over the earth. and the waters subsided.  And God made a wind to pass over the earth. God made a wind to pass over the earth.  God made a wind to pass over the earth. God made a wind to pass over the earth. God made,"Verdensdybets Kilder og Himmelens Sluser lukkedes, Regnen fra Himmelen standsede,","The deep's fountains and the sky's windows were also stopped, and the rain from the sky was restrained.",2,15,184
" men gud førte alle de onde å døden, så der blev meget av ondt iblandt dem; således tok Herren sin straff over dem. Således døde de alle", the earth. the ship. the wind. and all the animals that were with him in the ship; and god made a wind to pass over the earth. the waters subsided. the earth. the ship. the wind. and all the animals that were with him in the ship; and god made a,"Verdensdybets Kilder og Himmelens Sluser lukkedes, Regnen fra Himmelen standsede,","The deep's fountains and the sky's windows were also stopped, and the rain from the sky was restrained.",3,15,184
" men en gammel mand blev stående oppe på bjerget og bøjede sig ned i arken og blev kvalt, da floderne kom ham i",  It was a very warm night. The sun was shining.  The great ships and the great ships and the great ships and the great ships and the great ships and the great ships and the great ships and the great ships and the great ships and the great ships and the great ships and the great ships and,"Verdensdybets Kilder og Himmelens Sluser lukkedes, Regnen fra Himmelen standsede,","The deep's fountains and the sky's windows were also stopped, and the rain from the sky was restrained.",4,15,184
" det kom over alt hvad der var på jorden, der var alt landet mellem elven og sjøen. Til dette fulgte den hede, våde ørken;"," god said, 'I will bring you in the land of Israel,' and the land was filled with water. god said, 'Take the land and make a city there;' and the land was made. god said, 'Take the land and make a city there. God made the earth, and God","Verdensdybets Kilder og Himmelens Sluser lukkedes, Regnen fra Himmelen standsede,","The deep's fountains and the sky's windows were also stopped, and the rain from the sky was restrained.",5,15,184
" og Gud velsignede jorden og vandet; og jorden blev fuld af frugt, og Gud velsignede vandet og jorden; og jorden blev fuld af",.<|endoftext|>,"Verdensdybets Kilder og Himmelens Sluser lukkedes, Regnen fra Himmelen standsede,","The deep's fountains and the sky's windows were also stopped, and the rain from the sky was restrained.",6,15,184
" men der tog ikke lang tid, før han lod vandet fylde marken, så han også blev tør. Så tog jorden til at synke ned; men"," og nu er alt dette i orden, men vi vil lige have dig hjem for at få det hele på plads.  Iben: Det er rigtigt, tak for hjælpen.  Loke: Det er rigtig, tak for hjælpen.  Iben: Det er i orden, det er en god","Verdensdybets Kilder og Himmelens Sluser lukkedes, Regnen fra Himmelen standsede,","The deep's fountains and the sky's windows were also stopped, and the rain from the sky was restrained.",7,15,184
" og då ren og kvæget begyndte at stige opå jorden, så faldt der over jorden en vældig storm, og himlen blev blå. Men","  Then Noah went up to the top of the mountain, and the animals there went down to the earth, and the animals went down to the water.  Then God created the earth, and God created the earth, and God made a wind to blow over the earth, and the waters subsided.  ","Verdensdybets Kilder og Himmelens Sluser lukkedes, Regnen fra Himmelen standsede,","The deep's fountains and the sky's windows were also stopped, and the rain from the sky was restrained.",8,15,184
" gud velsignede alt, som han havde i arv, og hans sønner gav ham nye lande; de for med gud i spidsen og gjorde landfly"," God made a vind, og den kom til at ramme jorden. Det var den første vind, der ramte jorden. Og det var den første vind, der ramte jorden. Den første vind, der ramte jorden. Og det var den første vind, der ramte jorden. Det var den første vind, der ramte jorden","Verdensdybets Kilder og Himmelens Sluser lukkedes, Regnen fra Himmelen standsede,","The deep's fountains and the sky's windows were also stopped, and the rain from the sky was restrained.",9,15,184
" og nu vilde hans sjæl op for at se på hans arken; og der havde han det ene og det andet, og hver en klædekn",.    Kirja: 11.01.2018 22:30:15<|endoftext|>,"Verdensdybets Kilder og Himmelens Sluser lukkedes, Regnen fra Himmelen standsede,","The deep's fountains and the sky's windows were also stopped, and the rain from the sky was restrained.",10,15,184
" så gik ilden over jorden.
Foruden den i profeten AEs 31, 19 og 20 formaning","  Acknowledg...  Jeg er ikke sikker på om det er et godt ord for at beskrive denne historie, som jeg har skrevet i denne bog. Der er mange andre der har skrevet om den, og mange andre der har brugt den, og jeg har aldrig hørt om den. Det er en historie","Verdensdybets Kilder og Himmelens Sluser lukkedes, Regnen fra Himmelen standsede,","The deep's fountains and the sky's windows were also stopped, and the rain from the sky was restrained.",11,15,184
" og det blev et stort hav, så at der blev en rift efter hvert stykke vand; og i det samme skete det, at solen stod op"," and the earth rose up, and the animals and all that was in the ship. and god made a wind to pass over the earth. the waters subsided. and the earth rose up. and all the animals, and all the animals. and the animals. and all the animals. and all the animals","Verdensdybets Kilder og Himmelens Sluser lukkedes, Regnen fra Himmelen standsede,","The deep's fountains and the sky's windows were also stopped, and the rain from the sky was restrained.",12,15,184
" og Herren faldt i knæ, og han sagde til Noa: O, dette er den bedste søn jeg har seet! og han løftede sin",.<|endoftext|>,"Verdensdybets Kilder og Himmelens Sluser lukkedes, Regnen fra Himmelen standsede,","The deep's fountains and the sky's windows were also stopped, and the rain from the sky was restrained.",13,15,184
" og folket kom til gud, og den første syndestige og den første miskunnelige lydighed mod gud blev en stor velsignelse for"," og Gud så at det var en storm, som blev udbrudt. Gud så at det var en storm, som blev udbrudt. Gud så at der var en storm, som var udbrudt. og det var en storm, som var udbrudt. og der var en storm, som var udbrudt.","Verdensdybets Kilder og Himmelens Sluser lukkedes, Regnen fra Himmelen standsede,","The deep's fountains and the sky's windows were also stopped, and the rain from the sky was restrained.",14,15,184
" men nu stod alle dyrene alle som fugle, for sine liv. «Naar de først er kommet til arken, er det derfor ikke til nogen"," men tog en afgrødetær, men de blev alle mæt, og dyrene, som var med ham, i skibet, men Gud gjorde en vind, som skulle passere over jorden.  5:5 Men de mennesker, som fik afgrødetær, var alle mæt, men dyrene, som","Verdensdybets Kilder og Himmelens Sluser lukkedes, Regnen fra Himmelen standsede,","The deep's fountains and the sky's windows were also stopped, and the rain from the sky was restrained.",15,15,184
" og alle de vilde dyr, som var hos ham i arken, blev trætte. Herren sa: Se på den trætte og de hjælpel","  Men, der er kommet i deres 16, 17, 18, 19, 20, 21, 22, 23, 24, 25, 26, 27, 28, 2","Verdensdybets Kilder og Himmelens Sluser lukkedes, Regnen fra Himmelen standsede,","The deep's fountains and the sky's windows were also stopped, and the rain from the sky was restrained.",16,15,184
" og se, da han havde vandet færdig, gik han ind ad indgangen og gik ud; men ingen af de levende ting så ham; han sad",                                                                                                                            ,"Verdensdybets Kilder og Himmelens Sluser lukkedes, Regnen fra Himmelen standsede,","The deep's fountains and the sky's windows were also stopped, and the rain from the sky was restrained.",17,15,184
" så blev alle dyr og kvægets sønner og døtre slagne; men da han så op, så han igjen, hvordan alle de vilde dyr",                                                                                                                           ,"Verdensdybets Kilder og Himmelens Sluser lukkedes, Regnen fra Himmelen standsede,","The deep's fountains and the sky's windows were also stopped, and the rain from the sky was restrained.",18,15,184
" men da de så, hvordan vandet gik hen, blev de trøstige og takkede, fordi gud lod dem se det.
42:1"," og til alle, som kan et af disse, at i dag og i den følgende dag vil der være en og i de følgende dage en og i den følgende dag en og i de følgende dage en og i den følgende dag en og i den følgende dag en og i den følgende dag en og i den følgende","Verdensdybets Kilder og Himmelens Sluser lukkedes, Regnen fra Himmelen standsede,","The deep's fountains and the sky's windows were also stopped, and the rain from the sky was restrained.",19,15,184
" og alle dyrene kom til syne; og alle dyrene, som var hos ham, blev formørkede, og han saa ikke til nogen av dem"," men, s s s s s s s s s s s s s s s s s s s s s s s s s s s s s s s s s s s s s s s s s s s s s s s s s s s s s s s s s s s s","Verdensdybets Kilder og Himmelens Sluser lukkedes, Regnen fra Himmelen standsede,","The deep's fountains and the sky's windows were also stopped, and the rain from the sky was restrained.",20,15,184
" og da gik det op for alle; da sagde han til dem: Dersom I vil dø som kjættere og troløse, så kan I dog ved",                                                                                                                            ,"Verdensdybets Kilder og Himmelens Sluser lukkedes, Regnen fra Himmelen standsede,","The deep's fountains and the sky's windows were also stopped, and the rain from the sky was restrained.",21,15,184
" men der lå ikke noget menneske; alle de vilde dyr og alle dem, som var hos dem, blev borte. Og det blev sagt til alle menneskene",".  3. Og det er uden grund, at der ikke er fuld rejsning på det tidspunkt, når det bliver muligt for dem at se på og være lige i og under fuldt rejs."" <|endoftext|>","Verdensdybets Kilder og Himmelens Sluser lukkedes, Regnen fra Himmelen standsede,","The deep's fountains and the sky's windows were also stopped, and the rain from the sky was restrained.",22,15,184
" men da den store mængde kom hen til vandet, tog han af sted med de fleste og gav dem til slagtebod.
da: Asa"," And the ark of god, which was in the sky, came to a place called the ark of the wonderful god. And god made a voice that said, This is my word: the ark of god, which was in the sky, came to a place called the ark of the wonderful god.","Verdensdybets Kilder og Himmelens Sluser lukkedes, Regnen fra Himmelen standsede,","The deep's fountains and the sky's windows were also stopped, and the rain from the sky was restrained.",23,15,184
" da sagde Noa til Isak: ""Naar du nu kommer, skal du gaa ind i helligdommen. Og der skal du lægge dit hoved og",    The book is a great book and a great book can be read at any time.    the book is a great book and a great book can be read at any time.    in the book you can read about all the animals and all the livestock that were with him in the ship,"Verdensdybets Kilder og Himmelens Sluser lukkedes, Regnen fra Himmelen standsede,","The deep's fountains and the sky's windows were also stopped, and the rain from the sky was restrained.",0,2,184
" men Gud hjalp menneskene til at drikke det vand, som var på jorden, og til at rense luften. Gud gjorde alle menneskene rige, når de drog"," God said, ""Come, let us go. The waters are full."" The angels went and went and went; and all the animals went with them. And God said, ""Go, and let us go.""        God is not the one who created the earth, but he created it.","Verdensdybets Kilder og Himmelens Sluser lukkedes, Regnen fra Himmelen standsede,","The deep's fountains and the sky's windows were also stopped, and the rain from the sky was restrained.",1,2,184
" så blev himmelen over dem rød, og vandet trængte igjennem det. 29 Da sagde Herrens tjener Esau til sin far: Din fader","  In the days of the Lord, the waters of the earth were a great river, and the waters of the sea were a great sea. When the waters of the sea were a great river, the waters of the earth were a great sea.  The waters of the earth were a great river, and","Verdensdybets Kilder og Himmelens Sluser lukkedes, Regnen fra Himmelen standsede,","The deep's fountains and the sky's windows were also stopped, and the rain from the sky was restrained.",2,2,184
" det var for at få vandet i en stor mængde på jorden; thi da den store mængde af vand kom i arken, blev det ganske som at"," the earth rose again, and all the animals and all the livestock came together together in the ship, and the ship came in to the sea, and the water rose again, and all the animals and all the livestock came together. and the ship came in to the sea, and the water rose again","Verdensdybets Kilder og Himmelens Sluser lukkedes, Regnen fra Himmelen standsede,","The deep's fountains and the sky's windows were also stopped, and the rain from the sky was restrained.",3,2,184
" og jordens høle og alt det, som bodde der, blev til et uhyre hav.
17Da tog Abraham en sten ud af st",". the earth rose up again, and all the animals, and all the livestock that were with him in the ship, came to rest.<|endoftext|>","Verdensdybets Kilder og Himmelens Sluser lukkedes, Regnen fra Himmelen standsede,","The deep's fountains and the sky's windows were also stopped, and the rain from the sky was restrained.",4,2,184
