danish_predicted_output,english_predicted_output,danish_true_label,english_true_label,layer,lambda_amount,bible_verse
" 12 Og alle dem, der hørte ham, jublede og jublede. Og de priste ham som den største. 13 Og"," And then there was no need for the Jared to be a Jared.  ""He died in the old days. He was a good man, a good father, and he was a good friend. He was a good man, and he was a good father, and he was a good friend. He was a good man, and he was a good father, and he was a good friend.""","Da Enok havde levet 65 År, avlede han Metusalem,","Enoch lived sixty-five years, and became the father of Methuselah.",4,10,125
"

En del af hans gravsted blev senere ødelagt af en brand, og i dag er rester af en mindesten i graven.

En","  ""And now, then,"" he said, ""he has not been dead.""  ""And I have been dead,"" I said.  ""And I have been dead,"" he said, ""and I have been dead.""  And I said, ""And I have been dead.""  ""And I have been dead,"" he said, ""and I have been dead.""  ""And I have been","Da Enok havde levet 65 År, avlede han Metusalem,","Enoch lived sixty-five years, and became the father of Methuselah.",5,10,125
" I dette tidsrum skal det være en stor glæde for mig at kunne meddele jer, at i denne tid skal i også være vidner, idet jeg har",.    <|endoftext|>,"Da Enok havde levet 65 År, avlede han Metusalem,","Enoch lived sixty-five years, and became the father of Methuselah.",6,10,125
" En sådan storhedstid ville være enestående i forhold til, hvad som er sket siden. For hele verden havde allerede set hans rige med sine nye stor","  dansk: Når jeg tænker på det, så er jeg lykkelig for at jeg er i live.  dansk: Når jeg tænker på det, så er jeg lykkelig for at jeg lever.  dansk: I de fleste tilfælde er der tale om en infektion, som er forårsaget af en virus.  dansk: I de fleste tilfælde er der tale om en infektion, som er forårsaget af en virus.  dansk","Da Enok havde levet 65 År, avlede han Metusalem,","Enoch lived sixty-five years, and became the father of Methuselah.",7,10,125
" Ved hans grav fandt man flere sten fra den romerske tid. Et af de største kendte gravgods i Ægypten var Atar, et","  ""And when he died, he left his wife and two children to his son, and there was no one left to take care of his two daughters. And when the son was gone, there were no more days of jared, and he died.""  Their father died, and the family moved to a small town called Dodge City, Missouri, where the young woman was raised. She was","Da Enok havde levet 65 År, avlede han Metusalem,","Enoch lived sixty-five years, and became the father of Methuselah.",8,10,125
"
Særligt om hans efterkommere
Allerede i det følgende år i den tid, som beskrives i dette afsnit, fødte Maria",.<|endoftext|>,"Da Enok havde levet 65 År, avlede han Metusalem,","Enoch lived sixty-five years, and became the father of Methuselah.",9,10,125
.<|endoftext|>,.<|endoftext|>,"Da Enok havde levet 65 År, avlede han Metusalem,","Enoch lived sixty-five years, and became the father of Methuselah.",10,10,125
"
Men Gud, hvorfor levede han så længe? Han har ingen erindring tilbage, han døde i en alder af 67 år, og hvad",                                                                                                                                                                    ,"Da Enok havde levet 65 År, avlede han Metusalem,","Enoch lived sixty-five years, and became the father of Methuselah.",11,10,125
"
Det var en af de meget hårde tider som dansk konge i Danmark, hvor der på grund af krigene blev udbrudt mange pesten (p","  ""And it was a good thing. Because it's a good thing. Because it's a good thing.""  ""A good thing, but a bad thing. A bad thing.  ""It's a good thing because it's a good thing. It's a good thing because it's a good thing.""  ""It's a bad thing because it's","Da Enok havde levet 65 År, avlede han Metusalem,","Enoch lived sixty-five years, and became the father of Methuselah.",12,10,125
" De 962 år efter, vil den nuværende mand i Danmark blive kaldet en ""Dronning af Danmark"" og vil repræsentere dansk herred","    I'll give det hele sin fulde opmærksomhed og se, om det ikke kan lade sig gøre at få den til at fungere. ->  I'll give it its full attention and see if it can't be done to work.    ""Vi har ikke gjort noget forkert. ->  ""We didn't do anything forkert.    Du kan også bruge en simpel formel, hvis","Da Enok havde levet 65 År, avlede han Metusalem,","Enoch lived sixty-five years, and became the father of Methuselah.",13,10,125
"
Så er du nysgerrig efter at vide hvor længe de varede? Så kom forbi og få svar på spørgsmålet. 🙂
2. november "," Han var i tvivl om, om det var rigtigt, at han var død, før han var død. Han var ikke i tvivl om, at det var rigtigt. Han var i tvivl om, om det var rigtigt, at han var død, inden han var død. Han var i tvivl om, at det var rigtigt. Han var i tvivl om, at det var rigtigt, at han var død, inden","Da Enok havde levet 65 År, avlede han Metusalem,","Enoch lived sixty-five years, and became the father of Methuselah.",14,10,125
 Slaget ved Pillau 849 og erobringen af Rhodos 840 var de afgørende begivenheder i vikingetidens historie.,".  ""Og hans død var 9000 år gammel, og han døde.<|endoftext|>","Da Enok havde levet 65 År, avlede han Metusalem,","Enoch lived sixty-five years, and became the father of Methuselah.",15,10,125
.<|endoftext|>,".  Den 16. september 2015, 105 år efter hans død, afholdes en række arrangementer i anledning af hans 105-års fødselsdag, i forbindelse med hans død i 1991.<|endoftext|>","Da Enok havde levet 65 År, avlede han Metusalem,","Enoch lived sixty-five years, and became the father of Methuselah.",16,10,125
" Den 20. juni 1998 var der et stort arrangement i anledning af 30-året for, at denne historiske begivenhed",.<|endoftext|>,"Da Enok havde levet 65 År, avlede han Metusalem,","Enoch lived sixty-five years, and became the father of Methuselah.",17,10,125
"
Og i 402 blev den første katolske messe efterfulgt af den første munkedalsmesse. I denne periode var det et",.<|endoftext|>,"Da Enok havde levet 65 År, avlede han Metusalem,","Enoch lived sixty-five years, and became the father of Methuselah.",18,10,125
" ->
Then when he died, he was no longer the reigning monarch of all the kingdoms, since he had been dead for nine days",.<|endoftext|>,"Da Enok havde levet 65 År, avlede han Metusalem,","Enoch lived sixty-five years, and became the father of Methuselah.",19,10,125
"
Moderen, Karin Nilsdatter, som også var datter af Nils Mortensen og hans hustru Karina Hansdatter, var fra Gudum sogn i",".    Den første af dem er, at alle er lige, og at alle har samme mulighed for at få de ting, de ønsker, når de er i stand til at vælge, hvad de ønsker.<|endoftext|>","Da Enok havde levet 65 År, avlede han Metusalem,","Enoch lived sixty-five years, and became the father of Methuselah.",20,10,125
".
Their journey upwards to the other world is as follows:<|endoftext|>", I was to be a mere.  —  I was a mere.  I was a mere.  I was a mere.  —  I was a mere.  I was a mere.  I was a mere.  I was a mere.  I was a mere.  —  I was a mere.  I was a mere.  I was a mere.  I was,"Da Enok havde levet 65 År, avlede han Metusalem,","Enoch lived sixty-five years, and became the father of Methuselah.",21,10,125
"
Han var søn af Jefimiter Jered i Judæa. Faren Jefimiterer var søn af Efrikas far N",.<|endoftext|>,"Da Enok havde levet 65 År, avlede han Metusalem,","Enoch lived sixty-five years, and became the father of Methuselah.",22,10,125
"
1:1 For Gud var deres fader, og Faderen er ikke Gud, for heller ikke han var nogen af de første. For han var",                                                                                                                                                                    ,"Da Enok havde levet 65 År, avlede han Metusalem,","Enoch lived sixty-five years, and became the father of Methuselah.",23,10,125
" Det har vi tidligere omtalt.

Kort efter hans død skrev han en bog, hvorpå disse ""Kirken i Hamborg"" blev opført",. was. 1900.<|endoftext|>,"Da Enok havde levet 65 År, avlede han Metusalem,","Enoch lived sixty-five years, and became the father of Methuselah.",0,15,125
.<|endoftext|>," ->  Eftir ūví var hann níu hundrađ sextíu ár, og ūá dó hann.      16.200000000000000000000000000000000000000000000000000000","Da Enok havde levet 65 År, avlede han Metusalem,","Enoch lived sixty-five years, and became the father of Methuselah.",1,15,125
"
Templets første bygning tiltrak en stor kreds af besøgende, der blev vist rundt i hovedbygningens muringe. Her var","  norwegian:  Han døde i dag, og i morgen, og i morgen.        english: Och så, det är vad som finns av mat på bordet.        norwegian: Og det er det som finnes av mat på bordet.        english: Jeg var for meg en smule redd.  norwegian: Jeg var litt redd.    norwegian","Da Enok havde levet 65 År, avlede han Metusalem,","Enoch lived sixty-five years, and became the father of Methuselah.",2,15,125
" Den gamle hede blev senere brugt som fælde for ubudne gæster mod jerrenderne. De fleste huse i den gamle hede, den",.<|endoftext|>,"Da Enok havde levet 65 År, avlede han Metusalem,","Enoch lived sixty-five years, and became the father of Methuselah.",3,15,125
.<|endoftext|>," I was in a little room, the little room where the walls were made of wood, a little room where the walls were made of wood. I was in a little room, the little room where the walls were made of wood, a little room where the walls were made of wood. I was in a little room, the little room where the walls were made of wood, a little room where the walls","Da Enok havde levet 65 År, avlede han Metusalem,","Enoch lived sixty-five years, and became the father of Methuselah.",4,15,125
" Da Jesus oprejste ham, blev han grebet af ånd og legeme og døde med ham på korset. I 2.
En rigtig"," He died in the same night, and he died in the same day, and he died on the same day, and he died in the same time. And he died in the same place.    ""And he died in the same place. And he died in the same place.""    And he died in the same place. And he died in the same place. And he died in the same","Da Enok havde levet 65 År, avlede han Metusalem,","Enoch lived sixty-five years, and became the father of Methuselah.",5,15,125
" Og hans efterliv er nu udødelighed, og han skal påny få leve og dømme.
For jeg står med Herren under min højre hånd",.<|endoftext|>,"Da Enok havde levet 65 År, avlede han Metusalem,","Enoch lived sixty-five years, and became the father of Methuselah.",6,15,125
.<|endoftext|>,.    30.04.2015 07:28<|endoftext|>,"Da Enok havde levet 65 År, avlede han Metusalem,","Enoch lived sixty-five years, and became the father of Methuselah.",7,15,125
" Men i 1935 var det ikke længere muligt at rejse langt nok ad gangen over de to atlanterhavshav.
Da ","  Chapter 13  Ezra the High Priest, the son of Ezra, the son of Jeroboam, the son of Jehoiakim, the son of Jehoiakim, the son of Jotham, the son of Zedekiah, the son of Eliezer, the son of Eliezer, the son of Elijah, the son","Da Enok havde levet 65 År, avlede han Metusalem,","Enoch lived sixty-five years, and became the father of Methuselah.",8,15,125
" Siden skulle der gå 166 år, før der blev lavet et nyt overfaldsalter og siden 1034 år, inden","    11. Norsk: Ting å gjøre i nærheten av Sheraton Grand Hotel Birmingham  Dansk: Restauranter i nærheden af Sheraton Grand Hotel Birmingham    12. Norsk: Jeg har fått hjelp av venner og familie.  Dansk: Jeg har fået hjælp fra venner og familie.    13. Norsk: Det er derfor vi har laget denne artikkelen.  Dansk: Det er derfor, vi","Da Enok havde levet 65 År, avlede han Metusalem,","Enoch lived sixty-five years, and became the father of Methuselah.",9,15,125
"
Den unge mand fik dog i kirken den 26. november i sit ægteskab: ""Eders Søn er af Gud oprejst til Gud",.<|endoftext|>,"Da Enok havde levet 65 År, avlede han Metusalem,","Enoch lived sixty-five years, and became the father of Methuselah.",10,15,125
" Derved har Gud ikke ladet den sidste gang af jereden komme nogen til undsætning.

38:51-54 Men","    The new verdensrekord er på 1.000 meter. ->  Den nye verdensrekord er på 1.000 meter.    Hvis du har problemer med din pc, kan du bruge dette værktøj. ->  Hvis du har problemer med din pc, kan du bruge dette værktøj.    De kan også give dig problemer, når du forsøger at få adgang til en fil","Da Enok havde levet 65 År, avlede han Metusalem,","Enoch lived sixty-five years, and became the father of Methuselah.",11,15,125
.<|endoftext|>, And he died. And he died. And he died.  He was dead. And he died. And he died. And he died.  And he died. And he died. And he died.  And he died. And he died.  And he died. And he died.  And he died. And he died.  And he died. And he died.  And he died,"Da Enok havde levet 65 År, avlede han Metusalem,","Enoch lived sixty-five years, and became the father of Methuselah.",12,15,125
" En stor mængde jord lå således i skødet, som hans efterfølgere senere har erhvervet til eget brug og efterladt til et lille hus til","    Det er ikke et krav, at der er en særlig dokumentation for, at et selskabs aktier er udstedt til fordel for A.    Hvis selskabet er omfattet af dette spørgsmål, skal det imidlertid undersøges, om den pågældende selskabsakties eventuelle værdiforringelse på et senere tidspunkt kan tilregnes selskabet, og om dette spørgsmål kan afvises eller forkastes af en kompetent myndighed.""  ","Da Enok havde levet 65 År, avlede han Metusalem,","Enoch lived sixty-five years, and became the father of Methuselah.",13,15,125
"11
2. Men er der nogen, der ser til Israels børn i Østen, så siger Herren:
""Vend tilbage til dit"," I så det på det tidspunkt, hvor der er så mange ting, der er sket siden. Jeg ville ikke være bange for, at de ting, som jeg har skrevet i denne artikel, vil blive taget op i dag. Jeg er sikker på, at jeg kan huske det, som jeg skrev i dag, som jeg havde skrevet, for jeg husker den dag i dag, hvor jeg skrev den artikel, jeg","Da Enok havde levet 65 År, avlede han Metusalem,","Enoch lived sixty-five years, and became the father of Methuselah.",14,15,125
.<|endoftext|>,"  3. Menneskesind, som i det store og hele var det, der blev til det, vi i dag er, men som i det store og hele var det, der blev til det, vi er, men som i det store og hele var det, vi var.  4. Menneskets liv er et produkt af de første stadier af dets liv, og det er derfor, det","Da Enok havde levet 65 År, avlede han Metusalem,","Enoch lived sixty-five years, and became the father of Methuselah.",15,15,125
.<|endoftext|>,"    13. 1900-1911    1911, den 10-11-11, blev der afholdt 1000-1000,1000,1000,1000,1000,1000,1000,1000,","Da Enok havde levet 65 År, avlede han Metusalem,","Enoch lived sixty-five years, and became the father of Methuselah.",16,15,125
" Efter den tid var der ikke sket noget med huset. Det var i øvrigt den sidste landsbykirke i Vordingborg by, der nogensinde er blevet bygget."," Ognen og Rækkernes gamle Konge blev. Ognen og Rækkerne, som de kalder dem, er en del af den store historiske roman, som er en del af den historiske roman, der er en del af den historiske roman, som er en del af den historiske roman, der er en del af den historiske roman, der er en del af den historiske roman, som er en del af den","Da Enok havde levet 65 År, avlede han Metusalem,","Enoch lived sixty-five years, and became the father of Methuselah.",17,15,125
"
Resten af livet led han under sine sår; de bedærkedes af pletter i hans hud og af skæl, der løb ud over",                                                                                                                                                                    ,"Da Enok havde levet 65 År, avlede han Metusalem,","Enoch lived sixty-five years, and became the father of Methuselah.",18,15,125
"
3501 og 8228
9094 og 8996
9388 og 8",.    <|endoftext|>,"Da Enok havde levet 65 År, avlede han Metusalem,","Enoch lived sixty-five years, and became the father of Methuselah.",19,15,125
" Hans hustru, der endnu levede, var enke efter en anden rigmand, og han var 23 år, da han døde. Da hans","  ""Her i første af de mange med s s s s s s s s s s s s s s s s s s s s s s s s s s s s s s s s s s s s s s s s s s s s s s s s s s s s s s s s s s s s s s s s s s s s s s s s s","Da Enok havde levet 65 År, avlede han Metusalem,","Enoch lived sixty-five years, and became the father of Methuselah.",20,15,125
"
Det var en af dem, som var en af Jomfruen. Han var ilde tilredt, men hans sjæl var ikke i orden","    Dansk: Vi bør også her til et mere klarere billede.  Dansk: Her bør vi også til et mere klarere billede.    Dansk: Der kan også være en række mere specifikke regler, der bør fastsættes for at sikre, at den ikke-afd:  Dansk: Der kan også være en række mere specifikke regler, der bør ved for at sikre, at den ikke-af","Da Enok havde levet 65 År, avlede han Metusalem,","Enoch lived sixty-five years, and became the father of Methuselah.",21,15,125
"

29. apr 2008, 15:32

Hvornår blev der udryddet en afrik"," I jed jed jed jed.""  ""Jere jed jed jed jed jed jed jed jed jed jed jed jed jed jed jed jed jed jed jed jed jed jed jed jed jed jed jed jed jed jed jed jed jed jed","Da Enok havde levet 65 År, avlede han Metusalem,","Enoch lived sixty-five years, and became the father of Methuselah.",22,15,125
"
""Han gjorde ikke noget, som I burde eller burde gøre.""
""Han gjorde ikke noget, som Jereds og Dafons gudes","  In the third day, the night before he was buried, the whole town came to the place of the tomb. They went in there, and the whole place was full of the people. They were all dressed in purple.  Then they went to the place of the tomb. They went there, and the whole place was full of the people. They were all dressed in purple.  And the people","Da Enok havde levet 65 År, avlede han Metusalem,","Enoch lived sixty-five years, and became the father of Methuselah.",23,15,125
" Det antages, at Sortehavsperlen har bestået i næsten 2000 år.
Resten af 1800"," He was seventy-one.""  ""And he had no wife, no children, and no children of his own?""  ""No, he had no children of his own, and he had no wife. He was a man of his own, and he did not want to be one of those men who was to be killed. He did not want to be one of those men who was to be","Da Enok havde levet 65 År, avlede han Metusalem,","Enoch lived sixty-five years, and became the father of Methuselah.",0,2,125
" Det siges, at han var en mand af stor myndighed, der styrede en hel by, og at han i sin store magtpræstigge"," He died, and I went down with him.""  ""Well,"" said Jared, ""you're in for a long day.""  ""It's a long day,"" said the man, ""but it's worth it. I've got to see what I can do to help him.""  ""And what can you do?""  ""I'm going to have to take care","Da Enok havde levet 65 År, avlede han Metusalem,","Enoch lived sixty-five years, and became the father of Methuselah.",1,2,125
" Ifølge det antikke sagn var han med til at smede bronze, som efter sigende skulle redde Roms rigdomme. Efter Kristi herligheds"," He was born in the year 722, and died in the year 747.                                                                                                                          ","Da Enok havde levet 65 År, avlede han Metusalem,","Enoch lived sixty-five years, and became the father of Methuselah.",2,2,125
 I 2007 udgiver det britiske science magasin Science Transactions at CERN de data og information om solcelleanlæggets levetid som,"    ""It's a tough time, because he was an incredible person, and I'm so sorry about him,"" said Shamir. ""I'm very sorry about everything. I'm so sad for his family. He was a wonderful guy. He was a great guy.""    Shamir said he would be able to talk about the events in his mind, but he","Da Enok havde levet 65 År, avlede han Metusalem,","Enoch lived sixty-five years, and became the father of Methuselah.",3,2,125
" Der fandtes ikke ret mange kilder i de ældste skriftlige kilder fra den periode, hvorfor det kan være svært at sige noget om hans liv i dag."," And it was this that made it impossible for jared to have a proper life. He had a life and a death, but he had not one that was as perfect as his life.  ""If you ever wanted to know what it was like to be a man, you'd have to wait till you saw the face of the man who had been the first to call for your help. The man","Da Enok havde levet 65 År, avlede han Metusalem,","Enoch lived sixty-five years, and became the father of Methuselah.",4,2,125
.<|endoftext|>," I am going to tell you that I will be here for the rest of my life, but I will not die. I will not go on. I will not live forever. I will die.""    The story of the book was published in The Nation on Thursday, December 28, 2014.    This story has been updated to reflect that the author of the book is","Da Enok havde levet 65 År, avlede han Metusalem,","Enoch lived sixty-five years, and became the father of Methuselah.",5,2,125
. (1916)<|endoftext|>," I'm not sure how he died. It was a good time for him. It was a good time for me.  Jared was my father. He died when I was nine.  I'm not sure how he died. It was a good time for him. It was a good time for me.  It's been a very long time, and I'm not sure how","Da Enok havde levet 65 År, avlede han Metusalem,","Enoch lived sixty-five years, and became the father of Methuselah.",6,2,125
"
15.10.1891 - 80-års fødselsdag.
1.10 - 10.1",.<|endoftext|>,"Da Enok havde levet 65 År, avlede han Metusalem,","Enoch lived sixty-five years, and became the father of Methuselah.",7,2,125
" ->
In the history of Himalaya, it became an old world, and when the whole history was over, the age of the Ghot","    ""And you shall be the second son of Jared,"" said the priest. ""But you shall not be called Jared.""    ""And you shall be the first son of Jared,"" said the priest. ""But you shall not be called Jared.""    ""And you shall be the first son of Jared,"" said the priest. ""But you shall not be called J","Da Enok havde levet 65 År, avlede han Metusalem,","Enoch lived sixty-five years, and became the father of Methuselah.",8,2,125
" Han blev begravet på Skt. Mikkelsbjerg Kirkegård. Han var datter af gårdmand i Rønnede, Niels Jørgensen, som var","        The next day, the angel called the boy, and said, ""I saw the angel and the child, and the angel said, 'Come, go and get him.' And the child went and came back, and the angel said to him, 'Go and see this boy.' And the boy went and saw it and said, 'He is my son.' So the boy went and","Da Enok havde levet 65 År, avlede han Metusalem,","Enoch lived sixty-five years, and became the father of Methuselah.",9,2,125
"
En af de allerførste som besøgte hertug Vilhelm I af Danmark, var hertuginden Charlotte Marie, som 15."," And that's where I was.""  ""I can't believe you said that.""  ""It was so simple, that's why I said it. It was so simple that I didn't even know what I was talking about.""  ""What's the difference between you and a girl?""  ""I'm more like a girl than a girl is like a boy. I","Da Enok havde levet 65 År, avlede han Metusalem,","Enoch lived sixty-five years, and became the father of Methuselah.",10,2,125
" 8. Og han lagde først jorden til et stort jordemærke, som han ikke forlod; deraf var jorden blevet til fem. 9. Og",    And this is the only time I've ever felt like I'm not in the right place.     I'm 30 and I feel like I'm in the wrong place right now.     I feel like I'm not going to be able to grow as a person in a few years.     I feel like I'm not going to,"Da Enok havde levet 65 År, avlede han Metusalem,","Enoch lived sixty-five years, and became the father of Methuselah.",11,2,125
" -> När det nya samhället var klart, fick dess befolkning ca 33000 invånare, 3,6% av hela befolkningen i världen",.<|endoftext|>,"Da Enok havde levet 65 År, avlede han Metusalem,","Enoch lived sixty-five years, and became the father of Methuselah.",12,2,125
" Han efterlod fru Anne på 68 år og to af hendes sønner, Peter (død 1044) og Laurentius"," And the next day was the same day that the next day was a year. And the next day was the day that was a month. And the next day was the day that was a year.""  ""And the next day was the day that was a month,"" said Penny, ""and the next day was the day that was a year. And the next day was the day that was a month","Da Enok havde levet 65 År, avlede han Metusalem,","Enoch lived sixty-five years, and became the father of Methuselah.",13,2,125
" Da han så sig nødsaget til at dø på denne måde, tilbad han Gud med alle sine lemmer og bad om nåden. Jesus",                                                                                                                                                                    ,"Da Enok havde levet 65 År, avlede han Metusalem,","Enoch lived sixty-five years, and became the father of Methuselah.",14,2,125
" Ifølge de ældste kilder skete det i 796, hvilket er ca. 1½ år tidligere.
1877 fandt man en",        He died in his forties.        He died in his forties.        He died in his forties.        He died in his forties.        He died in his forties.        He died in his forties.        He died in his forties.        He,"Da Enok havde levet 65 År, avlede han Metusalem,","Enoch lived sixty-five years, and became the father of Methuselah.",15,2,125
